Speaker,Brazilian Portuguese (PT)
Nanjo Terumasa,"""Correto. ......É claro, a criança estava gravemente ferida. Foi um milagre ter sobrevivido com aqueles ferimentos. Se tivesse batido em um ângulo levemente diferente, ou se o Genji‐san tivesse demorado para levar o bebê até mim... ......Aquele bebê só sobreviveu graças a uma série de milagres."""
Ronoue Genji,""".........Eu teria desistido. Não acreditava que pudesse sobreviver."""
Furfur,"""Mas sobreviveu."""
Zepar,"""O quão forte e resiliente é a vida!"""
Furfur,"""Não, isto é o destino."""
Zepar,"""Destino! Então, a viver o bebê estava destinado para eventualmente algo grande realizar?!"""
Ronoue Genji,""".................. ......Sim, eu pensei que era o destino. Eu pensei que o sangue da Beatrice‐sama da Kuwadorian, quem a vida chegou ao fim em Rokkenjima, pudesse ter transmitido algo àquela criança para fazê‐la sobreviver."""
Clair,"""Mas Genji ao seu mestre não contou, sobre aquela criança sobrevivido ter. Simplesmente comunicou que havia caído e a morte encontrado em um infortúnio acidente. Kinzo lamentou, mas tal lamento estava mais para loucura do que tristeza......"""
Zepar,"""Ooh, {f:5:Beatrice}, por que fugiu de mim mais uma vez?!"""
Furfur,"""Por quê?! Mesmo eu tendo jurado que jamais repetiria o mesmo erro, por quê?!"""
Clair,"""Havia uma questão pela qual Genji não confiava no mestre que tanto respeitava. A questão era se Kinzo seria capaz de aceitar a criança de Beatrice na família."""
Clair,"""Genji havia servido à Beatrice de Kuwadorian por muitos anos. Ele tinha total conhecimento do que ela sentia. Sabia que ela aceitava a afeição de Kinzo e como pai o respeitava."""
Clair,"""Porém, seu amor não era como o amor dele. Kinzo pensou nela como a reencarnação da Beatrice, e tentou usá‐la para satisfazer os inúmero sentimentos que sentia pela Beatrice anterior. Obviamente, a Beatrice de Kuwadorian não podia aceitar esses sentimentos. No fim, o próprio Kinzo, aquele quem ela respeitava e via como um pai...roubou sua castidade......"""
Zepar,"""Ela pensava que era seu pai, e ele pensava que era sua esposa!"""
Furfur,"""Oh, mas que ingovernável é este amor proibido!"""
Ronoue Genji,""".........Eu entendo os sentimentos do Kinzo‐sama em certo grau. Não era como se o Kinzo‐sama visse a Beatrice‐sama anterior naquela garota no momento em que nasceu, tampouco decidiu naquele momento que a transformaria em seu lazer."""
Nanjo Terumasa,"""Ele......falou comigo sobre isso algumas vezes enquanto bebíamos. Eu sempre pensei que ele estava apenas brincando."""
Zepar,"""Conforme ela cresceu, começou a ficar cada vez mais e mais parecida com a mãe?"""
Furfur,"""Quando ficou mais velha, ele sofreu de uma emoção proibida que não poderia ser suprimida?"""
Ronoue Genji,"""......Eu pensei que a tragédia......poderia se repetir mais uma vez. ......Foi assim que eu vi as coisas."""
Nanjo Terumasa,"""................................."""
Ronoue Genji,"""A Beatrice‐sama sofreu muito. E no fim, ela nunca entendeu a diferença entre os sentimentos dela e os sentimentos do Kinzo‐sama. .........Eu falei com a Beatrice‐sama muitas vezes, escutei muitas vezes sobre os seus mais profundos sentimentos. Mas não fui capaz de contar a verdade a ela."""
Zepar,"""Contá‐la seria mesmo difícil!"""
Furfur,"""Imagine contar que aquele que ela respeitava como pai, queria usá‐la como substituta de sua falecida mãe!"""
Nanjo Terumasa,"""......Permitam‐me dizer isto pelo bem da honra do Kinzo‐san. Ele também sofreu imensamente. Ele sentiu muito quando descobriu que não conseguia mais pensar em sua filha como sendo sua filha. ......Eu disse a ele para amá‐la como pai. Eu acredito que o Kinzo‐san ouviu a razão e sua consciência, resistindo por determinado tempo..."""
Clair,"""Kinzo a amava. Ele colocava toda sua afeição na filha que Beatrice havia deixado para trás. Ele o fez como pai. Mesmo assim, se o fez, por que ele nomeou a filha com o mesmo nome da mãe?"""
Clair,"""Sim, o pecado do Kinzo começou quando ela nasceu. Beatrice deu à luz a filha e morreu, como se fosse uma troca. ......Ela passou o nome adiante, de mãe para filha. Do momento do seu nascimento, o Kinzo já havia decidido que era a reencarnação da Beatrice..."""
Willard H. Wright,"""Em outras palavras, Lion, foi o que aconteceu quando o Kinzo, tentando expiar seu pecado, conseguiu trazer a criança para a família Ushiromiya oficialmente."""
{f:5:Bernkastel},"""......Exatamente. Sinto que terei minha bunda beliscada se eu falar sobre outros Fragmentos, ......mas será que é possível que exista um onde......a existência de Lion seja reconhecida e o Kinzo cometa o mesmo pecado...? ......Quer ver se eu encontro? *risos*risos*........."""
Ushiromiya Lion,"""Quem iria querer ver algo assim? .........Faz parte do seu trabalho misturar as piores possibilidades imagináveis possíveis para cada parte da vida de uma pessoa e rir de seus horríveis destinos?!"""
Willard H. Wright,"""Infelizmente, esse é o tipo de demônio que ela é."""
{f:5:Bernkastel},"""Sou uma {i:Bruxa}, seu mal‐educado. *riso*......"""
Willard H. Wright,"""......Genji pressupôs o pior futuro possível de todos e, tentando assegurar um futuro melhor, ele mentiu intencionalmente sobre o bebê ter morrido."""
{f:5:Bernkastel},"""Sim. O Kinzo era um homem tão impulsivo que acabou usando a sua própria filha. Genji, quem sabia sobre os sentimentos de Beatrice e sentia simpatia por ela, não podia confiar em Kinzo facilmente."""
Willard H. Wright,"""Até o Genji, o mais devotado serviçal do Kinzo?"""
{f:5:Bernkastel},"""O Genji é um homem capaz de traçar uma clara linha entre o profissional e o pessoal. Ao mesmo tempo que servia Kinzo fielmente, ele também sentia que o erro que Kinzo cometeu com sua própria filha não poderia ser perdoado facilmente."""
Willard H. Wright,"""......Provavelmente. E, para ter certeza que Kinzo não descobriria a existência de Lion facilmente, Genji mentiu sobre a idade da criança, diminuindo‐a em três anos."""
Ushiromiya Lion,"""Você está certo. Neste mundo, eu só entrei no primário em 1976. Na verdade eu supostamente deveria estar no quarto ano."""
Willard H. Wright,"""Sua fraqueza não foi o real motivo, .........então Genji deve ter disfarçado cuidadosamente o ano de seu nascimento. O ""bebê de 19 anos atrás"" foi esquecido, não apenas por Kinzo, mas também por Natsuhi. Se um serviçal suspeito da mesma idade fosse para a ilha, a intuição feminina de Natsuhi definitivamente teria percebido."""
,"A criança ficou muito doente para não ir a escola por três anos? Ou a idade foi falsificada, para que assim Natsuhi não descobrisse tudo?"
Willard H. Wright,"""Seja como for, sabemos que sua idade foi diminuída em três anos neste mundo."""
{f:5:Bernkastel},""".........Correto. A idade de Lion deste mundo foi alterada em três anos. ......Estamos falando de uma pequena e débil criança. Uma criança subdesenvolvida. Parece ser surpreendentemente fácil de se enganar."""
Clair,"""Genji pensou que deveria esperar e ver o que aconteceria. No fim, seria Kinzo capaz de aceitar a criança de Beatrice como sua prole ou não? Ele manteve a criança vivendo na Casa Fukuin até atingir uma idade apropriada, então a invocou na ilha no papel de serviçal. Nem pai nem cria sabiam um sobre o outro. Genji pensou o seguinte: se Kinzo realmente possuísse a afeição de um pai, ele notaria traços da falecida mãe naquela criança."""
Clair,"""Eles certamente seriam capazes de recuperar a relação de pai e criança sem precisarem revelar nada um para o outro. Foi o que ele acreditou. ......Ou, talvez, a hora viria naturalmente. Quando acontecesse, ele poderia falar a verdade ao pai e a cria. Acreditando que eventualmente tal dia chegaria, Genji não contou nada sobre isso a ninguém. ......Ele cuidou da criança da Beatrice, esperando pelo dia destinado..."""
,E o tempo continuou a passar.
,Os dias seguiram enquanto ele assistia silenciosamente a vida da criança de Beatrice......
