{f:5:Beatrice},""".........I thought so............I thought it might have been a little too early, but.........was it really too early after all......?"""
{f:5:Virgilia},"""If you had led him further astray beforehand, things might have been different, but it really was a futile trump card. You stirred him up instead."""
,"In addition to his victory condition of denying the witch, Battler had held onto a different victory condition, since he had wanted to explain things without suspecting someone of the 18."
, Hadn't he been weakest when he had been tossed about by two opposing goals? 
,"However, Beatrice had used the red carelessly, and had proclaimed that there were no more than 18 people."
,"...Because of that, Battler had been forced to suspect one of the 18, .........and he had finally begun to build up the readiness that he needed to accept that."
," Battler was stubborn, but because of that, when he was struck where he was fragile, fissures would crack all over him, like breaking china."
," That itself should have been his greatest weak point, but..."
{f:5:Beatrice},""".........Kuuuuuu. ......Did I get a little too careless after my complete victory last time......?"""
{f:5:Virgilia},"""Yes, you were too careless. ...The last game was a difficult one for Battler-kun, but it seems that this game will become a difficult one for you."""
{f:5:Beatrice},"""......A broken vase will definitely never return to its original form. ...So it would be more constructive to think of the next move, rather than regretfully picking up the pieces."
{f:5:Beatrice},".........However, now that Battler has been instigated this much, how should I plot against him...?"""
{f:5:Virgilia},"""Hoh-hoh-ho. Your troubled face is an even better snack than Ronove's cookies."""
{f:5:Beatrice},"""......Uu-. You and Battler and even Ronove are making fun of me. ...Even though I'm not naive at a-ll."""
,"With a shameful, childlike face that she would never have shown in front of Battler, Beatrice rolled her head around on top of the table."
{f:5:Beatrice},"""............Teacheeer. .........At least a hi-nt."""
{f:5:Virgilia},"""Oh. What kind of hint?"""
{f:5:Beatrice},"""If you know a skillful move that will make Battler speechless, and make him accept me, I won't ask you to say it outright, so, umm, ...even if it's just a hint."""
{f:5:Virgilia},"""Hoh-hoh-ho, I can't. I am acting as Battler-kun's ally, so I cannot teach you something that would give you an advantage."""
{f:5:Beatrice},"""...You don't have to say it so stiffly... Even though your disciple's in trouble..."""
{f:5:Virgilia},"""I believe you harshly boasted that you had surpassed your teacher, correct?"""
{f:5:Beatrice},""".........Uu-... Please act like an old person and give me just a bit of your cunning wisdom... Pleease... It's mean if you only help Battleeer..."""
{f:5:Virgilia},"""My, my. You're still a spoiled child."
{f:5:Virgilia},"......But, it's true that I may have given Battler-kun a few too many hints. It did serve as a scolding to you, but perhaps it was a little too much support for a fair game."""
{f:5:Beatrice},"""Isn't that right, isn't that right...? Please, Teacheeer, at least just a hint now..."""
{f:5:Virgilia},"""...............This is just a hint. Think about what it means by yourself, alright?"""
{f:5:Beatrice},"""Yeah, yeah! I'll think about it myself, so please! Please, give me one that'll leave Battler down in the dumps."""
,"It was truly shameful how she behaved when Battler wasn't around, even though she acted utterly like a Great Witch in front of him."
, Virgilia took a deep breath at how Beato was still a child no matter how much time passed.
{f:5:Virgilia},"""Then just a hint. ......Do you know of Aesop's fable, The North Wind and the Sun?"""
{f:5:Beatrice},"""Of course. It's a story about how the north wind and the sun challenge each other to steal the cloak of a traveler, right?"""
{f:5:Virgilia},"""That's right. Violent or impatient methods aren't always necessarily the best decisions."""
{f:5:Beatrice},"""......You don't have to tell me that. I have already reflected on the fact that I rushed too fast towards victory."""
{f:5:Virgilia},"""............ Think well about what this means. And furthermore, ......it seems Battler-kun had a slight misunderstanding, but it also seems that you are misunderstanding something. Do you understand the victory conditions of this game?"""
{f:5:Beatrice},"""...What else is there, other than making Battler surrender?"""
{f:5:Virgilia},""".........See? At that point, you are already mistaken."""
{f:5:Beatrice},"""How am I mistaken?"""
{f:5:Virgilia},"""Your victory isn't making Battler-kun surrender. ......Isn't it making Battler-kun accept your existence?"""
{f:5:Beatrice},"""......What's this? You want me to butter up Battler, asking 'Accept me as a witch, pleease?'! How foolish! I will not sink so low!"""
,"Grrrrrrrrrrr..., Beato growled like a dog in a bad mood."
," Virgilia shrugged her shoulders, snickering at her disciple, who was as short-tempered as always..."
{f:5:Virgilia},"""That is my hint. Now you should think deeply. .........In any event, your moves up until now will not work on Battler-kun. A significant tactical conversion will probably be required."""
{f:5:Beatrice},"""...I'd understand even without you telling me. ......I don't have a clue what you mean by the North Wind and the Sun, but anyway, I understand that I will have to change my objective. ......I'll introduce a clever scheme that will surprise even you, Teacher...!"""
{f:5:Virgilia},"""Hoh-ho-ho... I look forward to it. I wonder how Battler-kun will tackle that. ......I am wishing you good luck as well."""
{f:5:Beatrice},"""And Battler too, right? Hmm..."""
,""".........Are you going to give up and resign already? If you're that tired, why not just go into a futon and sleep...?"""
,"...As my consciousness grew vague and I pretended to fight my drowsiness, sinking deeper and deeper into the sofa, 'I' scolded myself."
,"""......You also dreamed about stealing the position of family head from Krauss, right...? "
,"Even though I gave you that chance with my magic, you're already throwing it away...?"""
Ushiromiya Eva,"You could say that, but...{n}............This riddle is really difficult.{n} Even a wire puzzle would be better.{n}...At least in that case, you are assured that it definitely is solvable."
Ushiromiya Eva, But I don't know if there's any assurance whether this riddle of the epitaph is solvable.
Ushiromiya Eva,......I might just be fighting a useless battle.
,"...Still hazy, I looked at the notebook which I had been holding the whole time."
," It was opened to the page with the epitaph, which I had looked at so many nights that I might have burned a hole through it."
,"......That, is truly a door."
," On the other side, there is the 'Golden Land', which I had wished I could drag myself to since I was a child no matter what the effort, ...and which I hadn't been able to drag myself to."
," Am I touching the door with both hands, ...and even though the book, no, the door is open, can I still not reach the other side?"
,"""...That's right. You have already touched the door with your hands. Come, open it with all of your strength. And read the characters written on the door."""
Ushiromiya Eva,""".........Open it, with all my strength. ...Read, the characters written on the door..."""
,Strain your eyes.......See through to the thing beyond the epitaph written in the notebook...
,"""...The 'beloved hometown' definitely won't betray our expectations. ......The only past that Father held dear was his years as a boy."""
Ushiromiya Eva,"That's right...... Then what about the 'sweetfish river'? {n}There are several rivers where they swim, but it is suspicious whether there was one very near the place that Father lived."
Ushiromiya Eva,"...If we start wondering whether there was a nearby river on a map where sweetfish lived..., things will quickly get vague and we won't be able to get specific..."
,"""Didn't you say it yourself? You said it didn't have to be a river with water flowing down it. ......If the word sweetfish is too complicated, why not forget it...? "
,"Think of a river. A river. Linking it with a 'family tree' wasn't a bad idea. Try thinking about how to link a river with something else along those lines......"""
Ushiromiya Eva,......Not a river? Even though the sweetfish can't swim in it if it isn't a river? 
Ushiromiya Eva,"Oh, but maybe if sweetfish could swim, that means it's tied to the ocean......"
Ushiromiya Eva," Didn't my husband even say that, while they are river fish, they can go out into the ocean..."
Ushiromiya Eva,".........{n}....................................{n}............To the ocean......................No, ...but, {n}...............Huh...?"
,"""......Did you notice? But that's just a faint memory. There should be a book archive somewhere around here. If you investigate, you can make sure."""
Ushiromiya Eva,"......If that was the 'sweetfish river', .........{n}.........And if the key might be a six character word..."
Ushiromiya Eva,..................Was the key really resting in that river? 
,"I, I don't know, I don't know....Anyway, I have to search in an atlas..."
," But, even if I know that, I don't know 'from what' I should take the six characters..."
,"""......You really don't know? Think deeply. .........We're pretty smart, so our ideas are solid."
," Don't think of it like it's something as massive as the riddle of the epitaph, but like it's a child's riddle. ......Men are always children, no matter how old they get. Even if Father has advanced into old age, that doesn't change the fact that he is essentially a child inside his heart."
,".........Throw away your awe of Father. ...Think of this like it's a worthless, infantile game with riddles, like the one Maria suddenly brought up on the boat."""
Ushiromiya Eva,"......Riddles. ......Worthless, infantile."
Ushiromiya Eva,"........................{n}..................Huh, .........ah."
Ushiromiya Eva,".......I'm sure that was, ...what was it, ......umm, umm......"
,"...I'm sure, if my memory isn't wrong, ......that's probably, umm..."
," No, I don't have to rely on my vague memory. I should be able to figure that out immediately by searching in an archive."
,""".........We've probably already noticed the answer. ...All that's left is to research whether that's correct or not."
," Come, Eva. Let's go to the archive and make sure no one notices. ......There, we should find a mountain of thick books that didn't fit in Father's study. ...I'm sure that we'll find a book that answers our question. .........Quickly. This is our first and last chance in our life to have our dreams made true."""
,"When Natsuhi tried to lay a blanket over her, Eva suddenly jumped up."
Ushiromiya Natsuhi,"""...I'm sorry. It looks like I woke you."""
Ushiromiya Krauss,"""......Eva. If you're sleepy, don't overdo it. You rest first."""
Ushiromiya Eva,"""Th, ......thank you. I'm just going to the lavatory for a bit to wash my face."""
Ushiromiya Hideyoshi,"""You should take it easy and rest. ...Is your body troubling you again?"""
Ushiromiya Eva,"""I said I'm really fine! I'll be right back."""
,"After leaving only those words behind, I rapidly left the lobby."
," The lobby was partitioned off by a door, so as soon as I went into the corridor, they could no longer see me."
,......The archive was next to the servant room.
," Father always owned a vast book collection, but ever since he started to become engrossed with his occult hobby, that collection grew even larger, so that the normal books suitable for a normal study had been forced out as his study overflowed."
, This archive was where those normal books were stored.
," They were all thick, like complete encyclopedias for intellectuals, but that was very convenient for me now that I was investigating something."
," I entered softly, ......and just in case, I checked the room with my gun readied, making sure that there were no suspicious people there."
, Then I locked it from the inside.
, I actually wasn't thinking that the murderer might be hiding somewhere.
,...What scared me was my fear that one of the siblings might hear what I was investigating.
," My heart had started jumping.........I had been half-asleep until a short time ago, so I hadn't been able to realize how significant this thing I had noticed was."
," But as I had become aware, ......my heart had started to feel like it was about to explode."
Ushiromiya Eva,""".........I, ...wonder if any of the other siblings have noticed this......"""
,I don't think Krauss and Rudolf will notice.{n}......But I don't know about Kyrie.{n} She has extraordinarily good intuition.
,.........And I don't know about Rosa either.
Ushiromiya Eva,"""Rosa is also stupid. She always has been, and surprisingly so."""
,"Really...? I think she was wise enough to make you think she was stupid, so that she didn't earn herself unnecessary malice."
Ushiromiya Eva,""".........Here it is. ...I wonder if we'll find it in this one."""
,"I pulled the book out, and flipped through the pages......"
Ushiromiya Eva,"""............Uu. .........This is, ......... a 'sweetfish river'...?"""
,"I see... This is what the sweetfish river means.{n}......Don't dawdle around, research further."
Ushiromiya Eva,"""Y, yes, I understand... If you follow the river downstream, you will find a village... By village, does it mean a town or something? That's an area of dense population, so there could be many of those..."""
,"Why have you stopped thinking?! {n}If you don't like it, why not quit...? {n}Why not just hand over the Ushiromiya headship to Kyrie?!"
Ushiromiya Eva,"""I, ...I don't want to... I will become the head. ...This is, umm, my first and last chance.........What is '{p:0:里}' (village)? What does it mean?! If you go down the 'river', there's a {p:0:里}......?! ............ah, ......... aaaaaaaahhh......!!"""
,"......In the village, look for the shore the two will tell you of.{n}......It's 'shore' ({p:0:岸}). Understand?"
Ushiromiya Eva,"""Uu, ...*gulp*... I, I, I understand...! 'Shore', ......'shore'.........!"""
,"Right before my eyes, ......the pieces that I hadn't been able to understand at all, ......began to *snap*, ......*snap*, into place, all by themselves......"
, I couldn't even remember to close my open mouth....My throat grew completely dry...
," Is it, ......really alright for this to be the answer? R, really? Really...?!"
Ushiromiya Eva,"""...But this isn't six characters at all. ...I'm absolutely sure that this is the answer, but this doesn't reach six characters at all...!"""
,"Did you stop thinking again? In that case, think of a way you could read it with six characters."
," If you can't think of one, then research it.{n}......There has to be an answer. You must not doubt that."
," If you can't believe that, why don't you cry yourself to sleep, and then just give up and die...?"
Ushiromiya Eva,"""............1, 2, 3, 4, 5, 6.........Oooh, ...s, ...... six characters..."""
Ushiromiya Eva,"......I, ......I found it. ...This, .........is, th, ......the key to the Golden Land.........!!"""
,"Yes. This is, the key to the Golden Land.{n} ......The key, to our childhood dreams."
,"......The only keyhole to stick that key in, is that place.{n} That, is definitely what offers the sacrifices.{n} Now, do you understand............?"
Ushiromiya Eva,"""Whaa, ..........whaaaaaaaaaaaaaa...!!!"""
