{f:5:Eva Beatrice},"""......You worthless former sister. You should consider it an honor to have been selected as the first sacrifice I offer as a witch. At the second twilight, I'll tear the two who are close apart with my own hands...!!"""
,"The first thing the new Beatrice wished, ......no, the first magic she tried to use, was to surpass the limitations given to humans."
,"...In particular, gravity."
, She wanted to become fully aware of her transformation into a witch by being released from those shackles.
, As the witch and Rosa stayed as they were...
,"......The ground retreated all by itself, into the distance below them. By now, their feet were no longer attached to the ground."
," Rosa finally realized that the ground wasn't retreating into the distance below them, but that she and the witch were being sucked up into the rainy sky."
Ushiromiya Rosa,"""............huh...? ...............Eeeek...?!"""
{f:5:Eva Beatrice},"""Wh, .........whoooooooooaaaa...... Awesome......!"""
,"For a human shackled to the ground by gravity, there is nothing more unnerving that having their feet stop sticking to the ground."
,"......However, to Beatrice, who knew the joy of being released from gravity as the new witch, it was enough to cause her whole body to shake with delight."
{f:5:Eva Beatrice},"""......Hey, Rosa. Do you remember, long ago, when we were small, when we used to talk about what it'd be like to become witches and fly around the sky? ......That dream has been granted, right? I became a real witch and granted it for you."""
Ushiromiya Rosa,"""S, ............stop it, .........wake me from this dream......"""
{f:5:Eva Beatrice},"""You said it. You said that you flew through the sky in your dream. And you also said that you hadn't wanted to wake up. You were even mad at me since I had woken you up, right? "
{f:5:Eva Beatrice},"......Don't worry. This time, you won't wake up, alright? Heheheheheheheheheheheheh!!"""
,"Come, dance with me in the vast, rainy sky."
," Didn't we both wish we could fly like seagulls in the sky, and escape the narrow and boring island of Rokkenjima...? "
,"Now, I'll make that dream a reality for you."
," Because I only want to share this joy with you, and no one else...!"
{f:5:Eva Beatrice},"""Ahhahaha ahhahahahaha!! It's so fun, Rosa, it's so fun!! "" "
{f:5:Eva Beatrice},"Take a look, below you! Look at how small our mansion is. I wonder how much time we spent in a place that small. ...Now I'm especially shocked at how narrow and tiny it is."
{f:5:Eva Beatrice}," So feel. Enjoy. Rejoice...! That power we yearned for, the power to move through the sky at will! Come on, let's dance, Rosa! Through the rain, through the wind! Let's fly around like we're dancing! The lightning will shine on us and bless us!! Ahhahahahahahahahahahahahahahahahahahaha!!"""
,"The witch and Rosa were like leaves fluttering around in a whirlwind. As the rain pounded upon every part of their bodies, as the lightning occasionally shone upon them, they shook with the joy of being released from the ground."
,"...However, it was only that way for the witch. Rosa was holding onto her head, voicelessly screaming over and over."
Ushiromiya Rosa,"""Stop iiiiiiiiiiiiiitt!! Forgive meeeeee, let me doooooooown!!"""
{f:5:Eva Beatrice},"""......You're right, it's more fitting for humans to crawl on the ground. Then why not go back there?"""
,"A slightly displeased expression rose to the witch's face when she realized that her own joy was not being shared. Then, she decided to listen to her former sister's request."
Ushiromiya Rosa,"""............?! .........Aaaaaaaaaaaaaaaaaaaaaahhhhh!!"""
,"The whirlwind that had been making Rosa dance around grew weaker, then stopped."
," In other words, Rosa was once again bound by the restrictions of gravity, as a human."
,"......Following the laws that were originally correct, Rosa began to descend towards the ground upside-down. No, she began to fall."
{f:5:Eva Beatrice},"""Oops... That's right, if I don't take her down the right way, this is what happens!"""
,The witch hadn't intended to send Rosa plummeting. But she still wasn't used to using magic.
," After plummeting about 100 meters into a rose bush, as a very, very natural result, Rosa died instantly."
, But the witch hadn't intended to kill her. So she wished that Rosa didn't die.
," When she did, gold butterflies coiled about Rosa's body, reviving that life just as the witch had wished."
," Rosa's body, which should have been spread out like a carpet of fresh blood, rapidly returned to normal."
, The broken and crushed bones returned to normal.
, The torn and smashed flesh returned to normal.
,"......How easy it is to break things in this world, and how difficult it is to fix them..."
, Anyone can take a life.
," But no human can revive a lost life! By surpassing the irreversable, one proves that they have surpassed humans."
,"......This surely gave her a much, much greater realization that she was a witch than flying through the sky had."
{f:5:Eva Beatrice},""".........Awesome... I can even revive, ......an ended life......!"""
Ronove,"""Of course. Beatrice-sama is the Endless Witch. "
Ronove,"......To live and to die. To bring to life and to kill, all of it repeated endlessly. Beatrice-sama, the Endless Witch, is the queen who controls the cycle of life and death."""
{f:5:Eva Beatrice},"""Ahaha, aha. One time, I dropped a fishbowl. The fragile and beautiful bowl broke, and I couldn't put it back together again. I would never see that cute pop-eyed goldfish swim again after it landed on the floor."
{f:5:Eva Beatrice},".........No matter how much I cried, the servants shook their heads, saying that broken things and dead things could never be revived."
{f:5:Eva Beatrice},"...At that time, I learned something. You must not break things, you must not kill people. After all, you can't fix them!!"""
{f:5:Eva Beatrice},"""So, if you can fix them, ......then you won't get in trouble for breaking them, right...? Haha, ahahahaha, .........awesome... Awesome, awesome, awesome...!! Ahhahahahahahahaahahahahahahaahhahahhahhahhahhaha!!"""
,"For a while, the witch became intoxicated with how terrible and wonderful the power she had succeeded was."
," Her laugh was pure, innocent, and also cruel."
Ushiromiya Rosa,""".........Uuuuuu, ......au......"""
,"Even though Rosa had been revived, she let out a cry of anguish at the pain from her fall. At that point, the witch landed and held out her hand."
{f:5:Eva Beatrice},"""Hahahahahahaha, sorry about that, Rosa. I didn't think flying in the sky would be so much fun. Sorry, I'm really sorry."
{f:5:Eva Beatrice}," And I didn't know that humans could die so easily. But I've brought you back to life, so we're even. So get up, okay? Play with me some more, okay? *giggle*giggle*, ehehehaahahahahahahahahahahahahahahahaha!!"""
,What were those dreams you told me about when you were a kid...? Go ahead and tell me about all of them without holding back.
," As I am now, I can make anything come true, no matter how absurd...! "
,"Even making you fall into a sea of jelly! Even having you get sucked into a mountain of cake! I can even even make you sprout butterfly wings and let you walk around the garden, okay?! "
,"I'll do them one after another. Let's start with the ocean of jelly, okay...?!"
Ushiromiya Rosa,"""S, stop it, ............urgg!!"""
,"Rosa was once again thrown high into the rainy sky. However, the sky wasn't filled with raindrops, but with drops of orange juice."
," When she looked down, Rosa had to doubt her eyes. The rose garden had disappeared, and the ground spread out beneath her was like a pastel-colored jigsaw puzzle."
,"......It was from the dream she had talked about when she was young, an ocean of jelly."
," The black part was coffee jelly. The red was strawberry, the yellow was pineapple, the green was melon."
," What was the white part, apple...?"
,.........Did Rosa even have the time to think something like that? 
,Rosa fell towards that multi-colored ocean.
,......And sunk deep into the purple grape-flavored ocean.
, It really was an ocean of jelly. It had no bottom.
," As Rosa sank, she was shocked to see a school of transparent fish swimming through the grape jelly ocean."
, They were probably made of grape skin.
," Then she sunk on and on, deeper and deeper, as deep as the Marianas Trench, ......crushed by the water pressure of the jelly ocean, as her ribs snapped, as her spine snapped."
,"...In the end, she had become a small, frail meatball."
{f:5:Eva Beatrice},"""Ahhahahahahahahahaha! What a truly wonderful experience, to drown to death in an ocean of jelly...!! It's a dream no one else can imitate!! I have made it come true for you, ahhyahyahyahya!!"""
,"The instant I snapped my fingers, the meatball that had been Rosa was launched up into the sky."
," And after being wrapped up in a golden sparkle, she returned to her original form."
," It was as simple and easy as returning dried seaweed to its original form, and anyone could do it. If they were a witch! "
,That absent-minded look on Rosa's face has to be because of the joy from having that dream she had given up on as a child made into reality. Definitely. Probably.
," Next is the mountain of cake. In an instant, the sky was covered, and became black and white in the shape of a chessboard."
, That almost transparent white part was her favorite rare cheesecake. The elegant black part was a slightly bitter Gateau au chocolat.
," That became the ceiling, became a mountain, ......several billion cakes were thrown down towards Rosa."
," If you piled those cakes up, they would surely be taller than Mount Everest."
," So they probably weighed, .........I'm not too sure, but it was probably heavier than all the cakes across Japan put together."
," It fell down like a ceiling and swallowed Rosa up, ......so as a very, very natural result, Rosa was crushed to death."
," In less than a second, her bones broke throughout her body and her insides were all smashed and forced out, *squish*pop*slop*."
," Even so, an even greater number of cakes piled up on top, ...and Rosa ended up as a layer of jam wedged between the cakes."
," She became as thick as a single hair, and was probably smashed out into the area of a tennis court."
, That world swallowed up by cake was once again absorbed by a gold flash.
," Then, as though it had all been a dream, Rosa was revived once again."
,"......Of course, it definitely wasn't a dream. She had been revived after dying."
," By that point, death, which most humans only have to experience once after they are born, had already been experienced repeatedly by Rosa."
," In other words, she gone through that which humans cannot, the precious experience of dying more than once."
{f:5:Eva Beatrice},"""Ahhahahahahahahaha, kyahhahhahahahahahahahahahahahahahaha!! Isn't this fun, Rosa, isn't this fun?! Next is the butterflies, look...!!"""
Ushiromiya Rosa,"""P, please, have mercy......, .........aaaaaaaaaaaaaaaaahhh!!"""
{f:5:Eva Beatrice},"""No wa-y! Let's play more, let's play more...!! Kyahihihihahahahahahahahahaha!!"""
,"Laughing innocently, she pointed her gold staff at Rosa as she begged for mercy."
," When she did, Rosa glittered gold and rapidly began to shrink."
," She shrank down to the size of a real butterfly. Then, gold wings sprouted from her back..., and she joined her fellow gold butterflies."
," However, while a human body could withstand that wind, it was a different matter for a butterfly's body."
," The gold butterfly Rosa was invited to dance by each gale of wind, and she spun in circles around the rose garden."
Ushiromiya Rosa,"""No, ...nooooooooooooooooooooooooooo!! .........ah..."""
,"As her dance wore her out, she was caught by a gentle bed."
," It was the soft, knit hammock in the shadows beneath the roof of the arbor."
,"...The owner of that hammock lumbered into view, welcoming its rare guest who had wandered in on the night of the storm..."
," That owner, which should have been small enough to crush in the palm of your hand, now looked as big as the top of a canopy bed to Rosa."
Ushiromiya Rosa,"""Gyaaaaaaaaaaaaaaaaaaaaaaaaaaaaaaaaaaaaaaaaaaaaaaaaaaaaaaaaaaaaaaaaaaaaaaaaaaaa!!!"""
{f:5:Eva Beatrice},"""Kyahhahahakyahhahahahahaha! What a klutz, you got caught in a spider's web! Ahhahaha, ahhahahahahaha!! "
{f:5:Eva Beatrice},"This time, it's a dance with a spider. That takes me back. Remember the times we'd find a spider's web and play around by throwing pebbles at it? I've heard that spiders don't chew their prey, but insert their venom, and when the insides melt into a sticky soup, they suck it out."
{f:5:Eva Beatrice},"......Hey, Rosa, remember? Remember how we'd throw butterflies into the spider's web on purpose, and play around by seeing how the spider would attack? "
{f:5:Eva Beatrice},"Kyahhahahahahahaha, you don't remember, do you? This happened before you got into grade school...!! Make sure you watch closely this time, okay? Very closely. Kyahihihahahahahahakya-hahahahahahahahahahahahahaha!!"""
Ushiromiya Rosa,"""Noooooooooooooooooooooooooooooooooooooooo, have mercy, Nee-san, help me, Nee-san!! "" "
Ushiromiya Rosa,"Eeeeeeeeeeeeeeeekkgaaaaaaaaaaaaaahhherrrrrrrrrkkkbwaaghahgggggergorblahgehmolgeeaaarg ga, ga..., ga......, gyuuboh!!"""
{f:5:Beatrice},"""This girl's not bad. She truly can use magic at will! Hiihyahhahahahahakkuhihiehiehyahyahya!! "
{f:5:Beatrice},"Interesting interesting, interesting interesting! You feel like laughing too, right, Battleeeeeeer?!"""
Ushiromiya Battler,"""Don't fuck with me!!! Stop it alreadyyyyyyyyyy!! What's so fun, you're insane, you're insane!!! What's so fun about doing something like this?!?!"""
{f:5:Beatrice},"""Doesn't that just look so fun? What do you expect, magic is fun!! I remember, when I first became able to use magic, I played around a lot! ...Aaah, I understand, I understand, I understand that play from the bottom of my heart!"
{f:5:Beatrice},"......Looks like I won't be able to share this joy and passion with you, Battler. Aah, what a shame, what a shame!! If you accept me, I'll teach you magic anytime you want, see?! It's hard to describe the joy you receive in the instant you are freed from the shackles of humanity! "
{f:5:Beatrice},"I want to teach you about it, that joy, that passion! I de-finitely would like to see the world of magic you would give birth to, just once! Kihhihihihhihhi, hyahhyahhahahahahahahahahaha!! "
{f:5:Beatrice},"Isn't this starting to get fun? You've started wanting to use magic, haven't you?! It's pretty fun to be a witch, isn't it?! Just for you, I'll teach everything! About the joy of flying together in the sky, about the joy of diving together through the sea! "
{f:5:Beatrice},"I want to teach you of the passion that starts the instant you surpass the bounds of humans and see how wide your world stretches! Wouldn't that be fun, wahhyahhyahahhahahahahahahahahahaha!!"""
,There was no malice in Beato's expression.
,"...It was hard to believe, but she was genuinely enjoying this cruel show."
, And she wanted to share that appreciation with Battler.......Battler was shocked by that hopelessly different measure of value.
Ushiromiya Battler,"""You're insane!! Stop it already, damn iiiiiiiiit!! Virgilia, let me stop this insane farce!! What should I do!!"""
{f:5:Virgilia},""".........We exist outside the board. We cannot touch the board itself."""
,Virgilia shook her head apologetically....Her body had already been 'killed'. Did that mean she couldn't interfere in any way...? 
,"As Beatrice continued to look interested in an insane sort of way, Battler lifted her up by the collar and yelled at her."
Ushiromiya Battler,"""Stop it stop it stop iiiiiiiiiiiiiiiiit!!! Quit messing around, you witch!! Are you trying to tell me that's Eva oba-san?! "
Ushiromiya Battler,"That's impossible!! While the Eva oba-san I know may be a bit mean at times, it's completely impossible that she's the kind of person that would do something this cruel!! "
Ushiromiya Battler,"This is all part of your deception!! Don't toy with Rosa oba-san!! Don't toy with Eva oba-san!! Stop this farce right nooooooooooooooooow!!"""
{f:5:Beatrice},"""I told you, I'm not the one playing with Rosa anymore. I told you, that's the new Beatrice."
{f:5:Beatrice}," Is it really so cruel that you have to squeal like that? You're also pretty fond of stuff like this, aren't you?! You actually have just a bit of interest in magic and, .........ouch! Wh, what are you doing..."""
,"For the first time, Battler slapped Beato's cheek."
,"...Beatrice didn't know why he had done something like that to her, and a surprised expression rose to her face."
," Battler especially couldn't forgive that expression, and he roared."
Ushiromiya Battler,"""Aaaaaaaaaaaaaahh?! This is interesting?! What's wrong with your head?!! Die! Try and slice your head up into pieces and look inside, you'll definitely find that the insides have been completely removed!!!"
Ushiromiya Battler," Stop it right now, stop this disgusting farce!! I won't forgive you!! How could you do something so cruel!! I've sometimes thought that you were a bit of a funny person, but I'll never make that mistake again!"
Ushiromiya Battler," You're just a monster who's always cruel!!! Don't show yourself in front of me!! Never again!! I won't accept you, I won't talk with you, I don't even want to look at your face!!"
Ushiromiya Battler," Did you hear me?!! Don't show yourself in front of me. DISAPPEEEEEEEEEEEEEEEAAARRR!!!"""
,"The instant Battler screamed, the power that resisted the witch became a red wall and knocked Beato back onto her butt."
{f:5:Beatrice},"""......Owowowow......What are you talking about, isn't it an interesting show...?"""
,"She spoke as though making an excuse, but the person those words were directed at, Battler, was no longer there. His figure had suddenly disappeared into the darkness..."
,"...But Beatrice looked displeased, and continued trying to explain herself."
{f:5:Beatrice},"""......I, it's not like I completely don't see where you're coming from, ...but this is nothing more than an innocent prank, right...? No matter how she kills, that person will be brought back to life in the end, right? ...Aren't humans creatures that are fine with anything as long as it ends well......?! "
{f:5:Beatrice},"H, hey, Teacher. It's nothing to get so angry about, is it...?!"""
,"She was hoping for approval, but Virgilia simply faced her with an indifferent expression....To Beato, at that moment, even a surprised face would probably have seemed better."
{f:5:Virgilia},"""............I have nothing in particular to say. If you think it is fun, you can keep watching as long as you want. ...Call me when it's finished. I will erase my form until then."""
,"Following Battler's lead, Virgilia hid herself in the darkness..."
," Beato, who was now completely isolated, didn't have a clue what was going on, feeling that they were making her out to be the bad guy."
{f:5:Beatrice},"""...........................What's wro-ng? Isn't it an interesting show...?! I, it might be a little vulgar, ......but it's fairly interesting, isn't it...?!! He-y, Ronove...?! It's nothing to get so mad about, right...?!"
Ronove,"""Pu ku ku ku. ......Something interesting for you, Milady, is not necessarily interesting for Battler-sama."""
{f:5:Beatrice},"""Does he really, ...hate me that much? "
{f:5:Beatrice},"......Well, certainly, we are enemies and opponents in this competition, ...but is our relationship really so bad that we can't laugh together at this entertainment...?! .........Since I applauded together with Battler, I thought I could at least laugh together with him.........Does he really reject me so much that we can't even do that...?"
{f:5:Beatrice},"...He doesn't have to accept that I'm a witch. Because we're challenging each other in this game. But still, saying he won't look at my face, that he won't talk to me, ......he'll probably do all he can to ignore me... Am I really hated that muuuuuch......!"""
Ronove,"""Up until this point, you have advanced several moves that would make you hated, Milady. Even a demon such as myself can slightly understand Battler-sama's feelings.......I wonder if you cannot understand that because you are especially thickheaded, Milady? Pu kukukukuku."""
{f:5:Beatrice},"""Sh, shut up shut up shut up shut up!! Why don't you disappear too?!!"""
Ronove,"""Yes, certainly. ......Then, if you would excuse me."""
,"Even Ronove hid himself in the darkness, and Beatrice was left alone."
, The only one in the rainy rose garden.
, A lonely witch who no one would play with.
," Because no one would play with her, she was a lonely witch."
{f:5:Beatrice},"""..................What's going on? ...Why won't anyone play with me...? .........Am I really that weird, that cruel...? ............Someone, answer meeeeeeeeee!!"""
{f:5:Eva Beatrice},"""Kyahhahahahahahaha, isn't this fun, Rosa, isn't this fun! Hey, how should we play next? Of course, we should play with Maria too, right? "
{f:5:Eva Beatrice},"Let's all have a friendly walk together, okay? Let's swim in a pot of boiling chocolate, let's have a picnic in a cake-rising oven! Ahahaha, akyakyakyakyakyakya!!"""
{f:5:Beatrice},""".........H, hey, new Beatrice."""
,"Behind the witch that was continuing her mad banquet, Beato showed herself."
,"...That expression was very rare for her. It was kind of restrained, unreliable, miserable."
{f:5:Eva Beatrice},"""Oh, it's the predecessor Beatrice-sama. Were you watching? "
{f:5:Eva Beatrice},"The power of magic is truly wonderful! Until now, I had never thought it would be so fun to be reborn as a witch. It's like playtime that never ends...! Come on, let's play together, Predecessor-sama...!! "
{f:5:Eva Beatrice},"But first, wait for a second, okay?! The two of them were cooked to death in the oven, so I have to revive them again! "
{f:5:Eva Beatrice},"They're like bread rising because of yeast! Like cookies expanding in an oven! Kyakkyakkyakkya!!"""
{f:5:Beatrice},"""L, listen to what I'm saying..."
{f:5:Beatrice},"......Umm, well, isn't that enough for the sacrifice of the second twilight? ...Of course, it isn't specified how you kill them, but, umm, ......maybe you shouldn't toy with them any more than that..."""
{f:5:Eva Beatrice},"""What are you saying, Predecessor-sama? I heard from Ronove a short while ago. Wasn't your magic much, much more wonderful, cruel, and insane! "
{f:5:Eva Beatrice},"That Halloween party where candies poured out of six people's stomachs was truly wonderful! So maybe I'll act out Alice's tea party...! I'll invite everyone to a tea party in celebration of a completely pointless day, and entertain them one by one with my magic! "
{f:5:Eva Beatrice},"I wonder if I can do it as wonderfully as you? I wonder if I can be cruel in my own pop, cute style?! "
{f:5:Eva Beatrice},"Now that I think about it, all fairy tales are cruel, aren't they? Now that I'm a witch inside one of those fairy tales, I finally understand. Kyahhahahahakukyahyafuhyahahahahaha!!"""
{f:5:Beatrice},"""............I have also, umm, ...sometimes thought that, in the past, ...I might have gone a little too far. ......Well, I think that as the Golden Witch, it's a good idea to have a little elegance..."""
{f:5:Eva Beatrice},"""............??? I don't get what you're saying, Predecessor-sama. "
{f:5:Eva Beatrice},"But there's one thing I do understand. No matter how hard I try now, I'm no match for how cruel you are. I've gotta try much, much harder. I've gotta become more cruel, and become an excellent Golden Witch...!"""
{f:5:Beatrice},"""L, like I said, you've already done enough here...! A, anyway, this is my, your predecessor's order. That's enough for the second twilight. I'll show you how it's done. Stand back and watch..."""
{f:5:Eva Beatrice},"""Yes, Predecessor-sama. I can't wait to see what brutal, cruel, and disgusting method of killing you use."""
,"The new witch grasped the sides of her skirt and gave a graceful bow, stepping back as an expectant gaze rose to her face."
,......She was expecting an even more cruel magic that surpassed even herself.
{f:5:Beatrice},"""............Well, speaking of that... You're only half a witch if you can only kill with methods like that. ...I shall show you an elegant way to kill, worthy of the Golden Witch..."""
,"When Beato waved her pipe, seven colors of smoke poured out, reviving Rosa and Maria."
,"......Compared to how the new Beatrice had done it a short while ago, it was slightly gentler....It was probably gentler that how Beato had done it herself up until now."
, Rosa's consciousness had already grown dim from the pain of so many repeated deaths.
,"...But even so, she pleaded that her daughter be spared..."
Ushiromiya Rosa,"""......Please......have mercy.........Even, ......if it's just Maria......have mercy......"""
Ushiromiya Maria,"""Waaaaaaaaaaaaaaahhh, Mama, Mamaaaaaa!!"""
{f:5:Beatrice},""".........Sorry. My disciple just, umm, ...acted without restraint for a bit. ...Umm, .........forgive me."""
Ushiromiya Maria,"""B, Beatriiiiiiiiiiiiiiiiice!! Waaaaaaaaaahh, waaaaaaaaaaaaaaaaaaaaaaaaahh!!"""
,"When Maria realized it was the real Beatrice, she jumped onto her."
Ushiromiya Maria,"""...You promised, right, Beato?! You promised that you would take Maria to the Golden Land, right?! There, would be friendly with Mama, and everyone would laugh together...! You promised that you would take us there, right?!"""
{f:5:Beatrice},""".........A, ...about that. ...I can no longer, ...keep that promise. .........Because someone appeared who could solve the riddle, ......I am no longer the Golden Witch, Beatrice. "
{f:5:Beatrice},"......So, sorry. ...I can no longer keep my promise with you......"""
Ushiromiya Maria,"""Why...? Why...? Beato promised..."""
