Furudo Erika,"""See? It's magic, isn't it? What I did there."""
Ushiromiya Maria,"""Y, ............yeah!!"""
Furudo Erika,"""So, in other words-"""
,Erika smiled pleasantly. ......She and Maria had finally reached a deep understanding...
Furudo Erika,"""You're a morooooooooooooon!!! "" "
Furudo Erika,"{p:2:While you had your eyes closed, I just lifted the cup up and tossed a candy in!! Call that magic? It's just a third-rate triiiiiick, hyahhaaaaaaah!!! "
Furudo Erika,"There's my blue truth as the detective. Now, as the Witch of Truth, here's my red truuuuuuuuuuth!!!"""
Furudo Erika,{p:1:Your so-called candy magic is nothing more than a sleight of hand!!{p:1:Just a sleight of hand that the fake witch calling herself Beatrice or whatever claimed was magic!! 
Furudo Erika,"I mean, seriously, did you really get tricked by such a stupid sleight of hand? The magic that your perspective speaks of is completely untrustworthy!!!"
Furudo Erika,"""{p:2:Everything that you ever thought was magic was just a trick that you didn't get!! There's no way it was magic! There's no way magic exiiiiiiiiiiiiiists!!}"""
Furudo Erika,"""......Huuuh?!"""
Sakutarou,"""{p:2:P, putting the candy in this cup might have been your sleight of hand, but that doesn't prove that Beato's magic was also a sleight of hand.} Uryuuu--!!!"""
Furudo Erika,"""{p:2:However, you also can't prove that it could only have been done with magic!! You rotten stuffed animaaaal!!}"""
Gertrude,"""......Please, allow me to speak."""
Cornelia,"""Know that this is a meaningless battle."""
Furudo Erika,"""You damn scraps of paper!! Why'd you have to butt in at the good part...?!!"""
Dlanor,"""That is ENOUGH. Lady MARIA has been shown that the magic which makes candy appear in a cup could possibly be a trick that she misunderstood to be MAGIC. Therefore, her claim that it was magic is DISMISSED."""
Sakutarou,"""{p:2:However, it might really have been magic when Maria saw it...! Just because it can be done by a sleight of hand doesn't disprove magic.}"""
Dlanor,"""......Well done, Lady Erika. Congratulations on crushing Lady MARIA's Illusion of the WITCH."""
,The Illusion of the Witch is created by making the existence of magic be acknowledged by claiming that it would be impossible without magic. That is the attack used by witches.
," If someone can argue back and say that it would be possible without magic, the Illusion of the Witch is defeated, and the witch must retreat."
," The magic that Maria claimed to have seen had the possibility of being a trick, so it was unqualified to be acknowledged as magic."
," That was only the result of this battle. It was still too early to bring the fight into the domain of denying Beatrice, the witch and the magic that Maria believed in......"
," However, battles will always end instantly when your opponent surrenders."
," Erika had wanted to hit Maria with everything at once, defiling the witch and magic she believed in and crushing it without a fragment of compassion..."
Furudo Erika,"""..................Sheesh!! Just one more step and I'd have been able to take a heart as innocent as the smooth sand just after a wave has pulled back...and tear it to bits. .........What a shame. This isn't any fun anymore. ............Are you satisfied now?! Ouch, ...owowowow......"""
,"Erika grumpily punched Dlanor's arm that had been restraining her. However, that cold, hard, marble-like arm just made Erika's hand hurt."
Sakutarou,""".........D, diplomatic immunity...! This battle is over...!"""
Gertrude,"""Allow me to speak. Diplomatic immunity accepted."""
Cornelia,"""......Know that this fight is childish."""
Furudo Erika,"""Did you say something?!"""
Dlanor,"""She did NOT. ......Let us WITHDRAW. Lady MARIA is no enemy of yours, Lady Erika. There is no need to pay any attention to small fry such as THIS."""
Furudo Erika,"""............Hmph. ......You're right. How childish of me, tearing a kid's dreams apart. I'm really sorry, okay? I apologize for my momentary lack of elegance. *giggle*giggle*. Let's go."""
,"Erika's group turned their backs on Maria, who was still crouching down limply."
," However, ......as detectives in famous mysteries have always done in the past, Erika clapped her hands, stopped, and turned around."
Furudo Erika,"""Oh, that's right. ......What do you think...?"""
Ushiromiya Maria,"""............?"""
Furudo Erika,"""Simply by the existence of the overturned cup, this level of reasoning was possible for Furudo Erika. .........What do you think, everyone?"""
Ushiromiya Maria,""".........!"""
,Erika's merciless words gouged themselves into Maria's heart once more......
Furudo Erika,"*cackle*cackle*cackle*cackle*cackle*, ahhahahahaahahahahhaahaha!!! "
,"Erika left, leaving an evil laugh behind her."
," After bowing to Maria and Sakutarou, Dlanor left too."
,......Gertrude and Cornelia followed suit...
," After that, only Maria and Sakutarou were left in the lonely Golden Land......"
Sakutarou,"""............Uryuu-......"""
Ushiromiya Maria,"""......Beato......is a witch......"""
Sakutarou,"""Uryu... Beato is a witch..."""
Ushiromiya Maria,"""It was magic............*hic*......it was magic......"""
Sakutarou,"""It was magic... Beato used magic to give you candy... You don't need to doubt that... ......Uryuu-...! Please believe in Beato... You know that magic can't bear fruit unless you believe..."""
Ushiromiya Maria,"""Uuuuu......uuuuuuuuuuwaaaaaaaaahhhh......"""
,"In the middle of an ice-cold drizzle, which had started falling at some point, ......Maria sobbed..."
," Trying to at least protect her from the rain, Sakutarou used his large sleeves to cover Maria's head......and stayed there by her side......"
Ushiromiya Jessica,"""Okay, let's go, Maria...! Let's play cards together in the room upstairs..."""
Ushiromiya George,"""......Erika-san. As an adult, I cannot condone that conversation just now."""
Furudo Erika,"""My apologies. I'm still just a kid, after all."""
Ushiromiya Maria,"""......*hic*, .........*hic*......"""
,"After seeing that wonderful candy magic brutally insulted by Erika, ......Maria had been crying this whole time..."
Ushiromiya Battler,"""Haah... ......I started noticing it at the quiz party after dinner, but your personality is screwed up. ......Do you think this is fun?! Do you like tearing a little kid's dreams apart?"""
Shannon,"""P, please stop, Battler-sama...! Please, for my sake, don't push any further here...! Please...!"""
,"Shannon, who had been looking flustered, bowed her head deeply and implored Battler to stop. George, who didn't want Shannon pressured, fell in line."
Ushiromiya George,"""Let's go. Let's spend this year in the cousins' room too. We can watch TV and play cards."""
Ushiromiya Jessica,"""......I've heard that Erika-san has her own room. Shannon, please guide her."""
Furudo Erika,"""Oh, no need to bother yet. I'll relax down here for a little while longer. I want to savor it a bit."""
Ushiromiya Battler,"""......What the hell are you trying to savor......pft."""
,Battler and the others could no longer hide their irritation.
, They had no obligation to entertain their uninvited guest any further than this.
, Erika herself understood perfectly well that no place would welcome a detective.
," Battler and the others wanted to leave, and Erika wanted to stay. Neither had any desire to stop the other."
," Jessica urged Maria, who was still crying, to come along..."
," Then, Maria stopped and spun around."
Furudo Erika,""".........Got a problem?"""
Ushiromiya Maria,"""Kihihihihihihihihihihihihihihihihihi!! They do exist here and there...humans that are practically lumps of the toxin that doesn't believe in magic! There were many boys like you in my class!"""
Ushiromiya Maria,"""They don't believe in witches, or magic, or miracles, or happiness! You can't become a witch if you let the toxin of people like that burn you to ashes! I may not look it, but I'm Beatrice's disciple! I'm the Apprentice Witch of Origins! Kihihihihihihihihihihihihihi!!!"""
,"Maria, who had been sobbing until a second ago, seemed to have been transformed into an entirely different person. ......She laughed...no, cackled eerily."
," Battler's group stiffened up at this sudden change, but Erika was watching calmly."
," Then, she smiled and gave a small nod in response."
Furudo Erika,"""<Good>. ......You've got some guts. Goodnight, <Miss> MARIA. Let's fight in a more satisfying game next time."""
Ushiromiya Maria,"""Sure, let's. It's a promise. ......Kihihihihihihihihihihihi."""
Ushiromiya Jessica,"""Y, you stop that too, Maria...! Come on, let's go."""
Ushiromiya George,"""What about you, Shannon-chan? You can play cards with us, if you want."""
Ushiromiya Battler,"""Come on, join us for at least one round. It'll cheer you up."""
Shannon,"""Uh, ......ah...th, then, just for a bit......"""
,Shannon couldn't remain in this suffocating lounge any longer either.
," In part apologetic and in part trying to escape, she followed after Battler's group..."
," After that, Erika was the only one left in the lounge..."
," Still wearing a thin smile, she tapped a glass with her finger."
, There was a light *chink*.......A surprisingly boring sound.
," Even so, Erika wore a thin smile, as though pleased..."
Kumasawa Chiyo,"""Hohoho, sorry to keep you waiting. I was just in the bath... ......Oh, where is everyone?"""
Furudo Erika,"""......You just missed them. They went up to the second floor. I'm the one who called you here. ......I've heard that you know a lot about the story of Akujikishima and the story of the witch of the forest."""
Kumasawa Chiyo,"""Yes, well. Hohoho. It is a trivial story, but..."""
Furudo Erika,"""I don't mind in the slightest if it's trivial. Would you like a drink to follow your bath? "
Furudo Erika,"......Even I like to be helpful every now and then."""
,"Erika stood up, opened the refrigerator behind the counter, and put ice into the ice pail......"
