Ushiromiya Eva,"""Ahahahahahaha, of course. By the way, we shouldn't be worried, should we? What about tonight's dessert?"""
Kumasawa Chiyo,"""Ohohohohoho...... I can hardly wait to surprise everyone with the mackerel fruit parfait waiting there in the kitchen!"""
Ushiromiya Ange,"""Nooooooo!!"""
,Everyone burst out laughing.
," For some time after that, I was tormented by the terrifying image of a parfait neatly topped with mackerel bits..."
Kumasawa Chiyo,"""What a shame...... I tried so hard to stop Ange-sama from getting that prize, but she solved my best riddle like it was nothing."""
,"Though she said that, Kumasawa smiled. A gold-colored medal glittered in her wrinkly hand."
, Ange took it.
Kumasawa Chiyo,"""Well then, that's all for our puzzles."""
Gohda Toshiro,"""Please keep up the pace, get more and more medals, and win that splendid prize from the Master!"""
Ushiromiya Ange,"""Okay! Thank you. I'll keep it up...! We did it, Eva oba-san!"""
Ushiromiya Eva,"""Eheheh! Let's keep it up!"""
,"We rushed away. Okay, who should we take on next...?!"
Kumasawa Chiyo,"""It seems that all of a sudden, the tiny girl who used to hide and tremble in Kyrie-sama's shadow... has grown to be so bright and cheery..."""
Gohda Toshiro,"""......With each passing family conference, one can feel the growth of those youngsters. After just a few years more, Ange-sama will surely learn of love, of makeup, and will eventually grow to become a true lady."""
Kumasawa Chiyo,"""Very true...... If she grows normally with the passing time, that is..."""
,A cruel fate......forces the chick called Ange into a lonely future.
," If an egg isn't warmed, it won't hatch. The egg she is now will not be warmed by anyone, and it will not hatch..."
Gohda Toshiro,"""Inside that frozen egg, will Ange-sama have no choice but to face that isolated future...?"""
Kumasawa Chiyo,"""......An egg's shell can always be broken from the inside. ......Even if a cold shell is very, very hard, that doesn't mean it cannot be broken."""
Gohda Toshiro,"""Does Ange-sama have the strength to do that?"""
Kumasawa Chiyo,"""Is she capable of achieving that or not...? I hear that question is what this final game is all about."""
Gohda Toshiro,"""Perhaps we should have sent her a clearer message. ......If the egg cannot be warmed, could we not at least strike it from the outside to make it easier to crack?"""
Kumasawa Chiyo,"""If a chick without the power to break its own shell is forced outside of the egg, it won't be able to withstand the cold winds. Ange-sama will have to find that power and resilience herself."""
Gohda Toshiro,"""......But, can we not somehow explain that power and resilience to her?"""
Kumasawa Chiyo,"""Words cannot be given. They can only be accepted. ......No matter what we try to give Ange-sama, it will be meaningless unless she accepts it."""
Gohda Toshiro,""".........You are right. No matter what we try to tell Ange-sama, it won't matter unless she listens."""
Kumasawa Chiyo,"""Hohohoho...... We can do nothing but watch over her. You can lead a horse to water, but you can't make it drink."""
Gohda Toshiro,"""We can do nothing......but pray that Ange-sama chooses a better future for herself."""
Kumasawa Chiyo,"""If Ange-sama does not abandon herself to anger for the sole purpose of distracting herself from her resignation and sadness... If she can just be honest about that one, single wish that she truly desires more than anything else... Then you can be certain that she will make her greatest wish come true."""
Gohda Toshiro,"""It is ironic. ......Since the very beginning, she has been denying that greatest wish of hers herself."""
Kumasawa Chiyo,"""Laughter brings happiness. Tears bring misfortune. Those who believe will be saved. ......People have the power to create their own futures by the strength of their emotions."""
Gohda Toshiro,"""I wish we could just let her hear those words......"""
Kumasawa Chiyo,"""Battler-sama is very strict. ......He's hoping that Ange will realize it by her own power alone...and is not permitting even words of this nature to be told to her."""
Gohda Toshiro,"""......It seems we can do nothing but watch over her."""
Kumasawa Chiyo,"""And so, let us pray, at least. Pray that she grasps the world she desires most with her own hands."""
Nanjo Terumasa,"""Oh, have you selected me?"""
Ushiromiya Ange,"""Yeah. I'll have to face everyone sooner or later. Right, Eva oba-san?!"""
Ushiromiya Eva,"""Right! Come on, let's have a puzzle. We'll solve it in a flash!"""
Nanjo Terumasa,"""Hahahaha. I see, I see. Then it seems I must make it a good one."""
Ushiromiya Kinzo,"""Genji. You should give her one as well. A tough one."""
Ronoue Genji,"""As you wish. ......In that case, a tough one it shall be..."""
,Whoa.
," I'd hoped that Genji-san would give me a simple puzzle, but now he's saying it'll be tough. Scary."
, But I'll beat both of them. I can't let myself get scared.
Nanjo Terumasa,"""Then let us start with mine. I am a doctor, so how about an ambulance puzzle?"""
Ushiromiya Ange,"""The ??? is a number? But emergency is a word. You can't add a number to a word, right?"""
Ushiromiya Eva,"""That part sounds like some kind of word game. After all, 'kyu-kyu-' means emergency, and 'kyu-' means nine. If you write two nines together, it looks like 99, doesn't it?"""
Ushiromiya Ange,"""So, if you add something to 99, you get an ambulance?"""
Ushiromiya Eva,"""Hmm. Why does some number added to 99 get you an ambulance? .........Ah, I've got it!"""
Ushiromiya Ange,"""Huh, really?! Hey, what is it?!"""
Ushiromiya Eva,"""I'll give you a hint. You've got a big advantage here that most people around the world don't have. *giggle* Then again, even people from other countries could narrow it down to two answers with a little math."""
Ushiromiya Ange,"""Huh? ......Nnnnn......I don't get it..."""
Nanjo Terumasa,"""Oh, are you having trouble? I thought it was an easy puzzle."""
,It's a bit annoying to hear that about a puzzle I don't get.
," Still, no matter how annoyed I get, I still don't have a clue what the answer is."
Ushiromiya Eva,"""Aw, so close. I thought you'd made it pretty far too..."""
,"Apparently, Eva oba-san knows the answer. She looked disappointed that I hadn't figured it out too."
Ushiromiya Kinzo,"""......Mumumumu...? Ah, yes, I have it! If you subtract two from an ambulance, then add on 60, you can even learn the weather."""
Nanjo Terumasa,"""Well done, Kinzo-san. It seems I must hand this medal over to you."""
Ushiromiya Kinzo,"""Wahahahahahaha. Sorry, Ange. This medal's all mine."""
Ushiromiya Ange,"""......F, fine, see if I care."""
,The gold medal passed from Nanjo to Kinzo.
, That medal was supposed to be mine...... It's no use regretting it now.
, If you subtract two from and add 60 to an ambulance...? How would that tell you the weather...??
Ushiromiya Eva,"""Hmm, what was the number for the weather forecasting service, I wonder?"""
Ushiromiya Ange,""".........???"""
,"Yeah, I don't have a clue. I'll just have to pick myself up and have a go at Genji's puzzle."
Ushiromiya Ange,"""20! Emergency sounds like 99, and if you add 20 to that, you get 119. That's the emergency number for ambulances!"""
Ushiromiya Eva,"""And if you subtract 20 from 130, you get 110. That's the emergency number for calling the police."""
Nanjo Terumasa,"""Splendid! That is correct. I knew you were a quick thinker, Ange-san."""
Ushiromiya Kinzo,"""Oooooooh, well done, Angeeeeeeee! What a wise granddaughter I have!"""
Nanjo Terumasa,"""Congratulations. This medal belongs to you."" ""But...what was that about the difference between the two being half an emergency?"" ""Heheh, yeah, we didn't really need that part. If you use that hint, you could make a pretty good guess at the answer even if you forgot what the emergency numbers were."" ""Huh??"""
,"At any rate, the gold medal glittering in Nanjo's hand is now mine."
," Okay, now I'll defeat Genji too and get another one."
Ushiromiya Eva,"""Yes, that's the spirit. Let's solve more and more!"""
Nanjo Terumasa,"""Your turn, Genji-san."""
Ushiromiya Kinzo,"""My friend here doesn't speak much, but his knowledge is quite extensive. Even I cannot wait to see what sort of puzzle he whips up."""
Ronoue Genji,"""Now then, Ange-sama. Prepare yourself. The puzzle starts now."""
,......I've never heard anyone say 'prepare yourself' like that when giving a quiz.
, I started to get so tense that my stomach began to hurt...
Ushiromiya Eva,"""It'll be okay. Hang in there!"""
,"Eva oba-san gripped my hand firmly, and my stomachache got a little better."
Ronoue Genji,"""......Ange-sama, have you learned division?"""
Ushiromiya Ange,"""Y, yeah. I learned it in cram school."""
Ushiromiya Eva,"""Incredible, a six-year-old who knows division?"""
Ronoue Genji,"""Then there should be no problems. Here it comes."""
,"This is bad... I did learn division, but I'm not very good at it......"
Ushiromiya Eva,"""Half of its remaining length burns away each hour, right...? After the first hour, it's burned down by half of 5 centimeters. During the next hour, it burns down half of that remaining length. And during the third hour, it burns down half of that remaining length......"""
Ushiromiya Ange,"""......I can't really do it without a calculator. Do you know the answer, Eva oba-san?"""
Ushiromiya Eva,"""Ah, ......I've got it. *giggle*, this is a pretty mean puzzle."""
Ushiromiya Ange,"""Why is it mean?"""
Ushiromiya Eva,"""This has nothing to do with division. Read through the puzzle again carefully."""
,"......Umm, ......what was it, again......?"
Ronoue Genji,"""My sincere apologies, but that is incorrect."""
Ushiromiya Ange,"""Huh?! Why?! I know I did the math right...!"""
Ushiromiya Eva,"""You see, ...there's no need for math in this puzzle. Yep, he tricked us good this time..."""
Ushiromiya Kinzo,"""Wahhahahahahahaha. Too bad, Ange. Did you get it, Nanjo?"""
Nanjo Terumasa,"""Yes, of course. Division is unnecessary. This was an easy puzzle, one that even Ange-san could have solved."""
,"Not only Eva oba-san, but everyone else said that math wasn't needed."
, And I worked so hard on that division......
Ronoue Genji,"""That is all for my puzzle. I believe several others are waiting for you to challenge them, Ange-sama. Perhaps you ought to search for the next challenge."""
Nanjo Terumasa,"""Good luck, Ange-san. I am rooting for you."""
Ushiromiya Eva,"""That's right. This is no time to get down! Now's our chance to turn things around."""
Ushiromiya Ange,"""Yeah! I'll try even harder and get lots of medals!"""
,We dashed away.
, There are still many people waiting to give me puzzles. I have tons of chances to get medals.
," Okay, who should I challenge next...?!"
Ushiromiya Ange,"""......After one hour, the 5 centimeters becomes 2.5 centimeters, ...and in the next hour, that becomes 1.25 centimeters, ...and in the next hour, that becomes 0.625 centimeters......"""
Ronoue Genji,"""............"""
Ushiromiya Eva,"""Ange-chan. You don't need to use math. Make sure you remember the problem clearly... How long...is the candle when it burns out...?"""
Ushiromiya Ange,"""Ah! That was a close one...! The candle goes out when it's 1 centimeter long, so the rest doesn't matter!"""
,"The flame on this candle dies when the candle is 1 centimeter in length. In other words, it can never get shorter than 1 centimeter."
," So the right answer is the fifth choice, ""About 10mm""...!"
Ushiromiya Eva,"""That's right...!"""
Ronoue Genji,"""You are correct."""
Ushiromiya Kinzo,"""Oooh, splendidly done, Ange! How clever of you, not to be misled!"""
Ushiromiya Ange,"""I didn't even need division. I almost got tricked...!"""
Ushiromiya Eva,"""You were pretty mean there, Genji-san. You even asked her if she could do division. That was a trap, right?"""
Ronoue Genji,"""Correct. My humble apologies."""
Nanjo Terumasa,"""Hahhahahahaha. After all, Genji-san is the sort who can trick you without changing his expression in the slightest."""
Ronoue Genji,"""Congratulations, Ange-sama. This medal is proof that you have correctly solved my puzzle."""
Ushiromiya Ange,"""Thanks! Eheheh, I got another medal, Eva oba-san...!"""
Ushiromiya Eva,"""Heheh, nice going!"""
Ushiromiya Ange,"""I'll get lots more. I'll get a ton, and then Grandfather will give me a great prize!"""
Ushiromiya Kinzo,"""Yes. Give it all you've got, my granddaughter...!"""
Nanjo Terumasa,"""Good luck, Ange-san. I am rooting for you."""
Ronoue Genji,"""There must be others waiting for you. Perhaps you ought to search for the next challenge."""
Ushiromiya Ange,"""Okay! Thank you. I'll try even harder now...!"""
,We dashed away.
, There are still many people waiting to give me puzzles. I have tons of chances to get medals.
," Okay, who should I challenge next...?! "
,"After Ange and Eva left, ......Battler, who had been watching their progress, came over."
Ushiromiya Battler,"""How is Ange doing?"""
Ushiromiya Kinzo,"""Oh, Battler. I am not certain, but she does seem to be enjoying herself."""
Ushiromiya Battler,"""I heard your puzzle, Genji-san. Even I was almost taken in back there."""
Ronoue Genji,"""You honor me."""
Ushiromiya Battler,"""Still, it's not quite what I'd have expected. Who'd have thought that you'd give a trick question like that? I figured you'd make a straightforward, simple puzzle."""
Ushiromiya Kinzo,"""Hahahahahahaha. You might expect such a thing from him, silent as he is, ......but he is much more of a schemer than he appears."""
Nanjo Terumasa,"""Very true. If you play a chess match against him, you'll see that right away."""
Ushiromiya Kinzo,"""He even fools me, from time to time. He'll trick me right to my face, with that stern, serious expression of his. He has always been like that. And yet, despite the numerous occasions on which he has fooled me in the past, I keep on getting tricked. Wahhahhahahahahahaha."""
Ushiromiya Battler,"""Come to think of it, ......what sort of relationship do you and Genji-san have?"""
,"For just an instant, Kinzo glanced at Genji's face."
," Apparently, he didn't plan on touching on this subject if Genji had any objections."
," However, Genji spoke as though the matter was no longer a secret."
Ronoue Genji,"""......I knew the Master once...in Taiwan."""
Ushiromiya Kinzo,"""Wahaha, 'knew me', he says...! We were partners in crime, you might say! The two of us were both prodigal sons of rich families. A pair of ruffians who caused their parents nothing but trouble."""
Ushiromiya Battler,"""Genji-san, a prodigal son...? That's a surprise...... So, Genji-san also moved to Taiwan, where he met Grandfather?"""
Ronoue Genji,""".........No. I am a native of Taiwan."""
Nanjo Terumasa,"""Genji-san was born in Taiwan. ......Well, since Taiwan was under Japanese rule before the war, he is still Japanese, of course."""
Ushiromiya Kinzo,"""He was a man who hated losing. When we first met, we fought all the time. Once we hit it off, we became the best of friends."""
Ronoue Genji,"""......There was a lot of disorder and conflict after the war. The Master is the one who saved me during that chaotic period. ......If I spent the rest of my life trying to repay that debt, it would not be enough to pay it back in full."""
Ushiromiya Kinzo,""".........Don't say that, my friend. ......If only I had been a little more persuasive, I might have saved your family as well... I was too cowardly to save anyone but you..."""
,"I don't know much about the details of Taiwan's history, but apparently, there was still a lot of chaos there even after the war ended and Japan pulled out."
," Kinzo, predicting this chaos before it happened, worked out a way for Genji and his family to escape."
," However, Genji's family possessed great wealth in Taiwan. They were unable to abandon it, and they decided to remain there."
, This wealth had been built up thanks to their close relationship with the Japanese-run government of Taiwan.
, The new regime after the war wasn't likely to welcome them with open arms.
, Much mayhem and confusion followed. And Genji was the only one who escaped harm.
,"......I don't know what happened to make this man, who Kinzo has called a troublesome prodigal son, change so drastically to become the person he is today."
," It was a story of friendship between the two of them, ......and there could be hardly any point in an unrelated person sifting through history books to interpret it however they pleased."
," They had been good friends since long ago, and they owed each other their lives. Though the troubled times had tossed them about, their friendship held firm for decades..."
," Genji's role was now that of the butler, ......but when they are alone in the study, they sometimes share a drink and reminisce about the days of their youth."
,......And they're still that way today.
," Leaving Kinzo and Genji to reminisce, Battler walked off on his own."
," It would be rude to ask for any more detail, and he didn't need to know."
," Kinzo and Genji had been friends since long, long ago. That was something he already knew."
Ushiromiya Eva,"""What do you think? Do you want to challenge Natsuhi oba-san and Krauss oji-san next?"""
Ushiromiya Ange,"""Yeah. Let's beat them!"""
Ushiromiya Krauss,"""Hahahaha. Very well, we'll play along."""
Ushiromiya Natsuhi,"""The two of us have prepared some formidable puzzles for you."""
Ushiromiya Krauss,"""Should I go first? Or you?"""
Ushiromiya Natsuhi,"""I will start."""
Ushiromiya Krauss,"""Very well."""
Ushiromiya Natsuhi,"""Listen closely to what I'm about to say. White black white black white ???? black white black white black white."""
Ushiromiya Ange,"""Huh? White black white black......huh??"""
Ushiromiya Natsuhi,"""I'll say it once more. White black white black white ???? black white black white black white. ......What does the '????' stand for?"""
,This is......a really hard one.
, White black white black white ? black white black white black white.
," It looks like the white and black are alternating, but the '????' is between a white and a black."
, Is it......gray?? Is it that easy...?
Ushiromiya Eva,"""Th, ...this is a surprisingly hard one, coming from you, Natsuhi nee-san......"""
,"Eva oba-san was groaning. Apparently, this one's really hard."
Ushiromiya Natsuhi,"""I, is it really so hard...?"""
Ushiromiya Krauss,"""......There's a chance that some people won't understand, if they haven't had the right experiences."""
Ushiromiya Natsuhi,"""Eva-san aside, I think Ange-chan would have seen it a lot at school and kindergarten......"""
Ushiromiya Eva,"""Wh, what the heck? I don't have a clue!!"""
,Is it a problem that I could get easier than Eva oba-san......?
,......It's hard.
Ushiromiya Eva,"""The hint for this one is probably what Natsuhi nee-san said, about something you might see in a school or kindergarten. ......Do you know what it is, Ange-chan?"""
Ushiromiya Ange,"""No, I'm stuck."""
Ushiromiya Eva,"""See, even Ange-chan says she's stuck! Give her at least a little hint."""
Ushiromiya Natsuhi,"""I, I see. Then, a hint...... They may be different colors, but you get a beautiful sound no matter which you push."""
Ushiromiya Eva,"""A beautiful sound......? Are these black and white things something that make sounds?"""
Ushiromiya Ange,"""Black and white things that make a sound when you push them......?"""
Ushiromiya Ange,""".........I don't get it."""
Ushiromiya Eva,"""I give up too. ......It seems even you know some pretty hard puzzles, Natsuhi nee-san."""
Ushiromiya Krauss,"""Hahahaha. It's the sort of puzzle that brings out one's upbringing. Perhaps it was a bit too hard for you."""
Ushiromiya Eva,"""Wh, what did you saaaaaaay...?!"""
Ushiromiya Ange,"""......Natsuhi oba-san. Could you tell me the answer?"""
Ushiromiya Natsuhi,"""The answer is...a keyboard."""
Ushiromiya Ange,"""A keyboard? Like on a piano?"""
Ushiromiya Natsuhi,"""That's right. The blacks and whites are the pattern of colors on a keyboard. In which case, you must already know the right answer."""
,"Natsuhi oba-san smiled at me, but I don't really remember what a keyboard looks like."
,"......Nnn, too bad."
, I'd better have a go at Krauss oji-san's puzzle and redeem myself.
Ushiromiya Eva,"""Ready? It's Nii-san's turn now. We'll solve it in a flash and teach him a lesson, okay?"""
Ushiromiya Ange,"""That black and white thing......it's a keyboard! Like a piano!"""
Ushiromiya Eva,"""Ah, ......is that it?! It's a keyboard?!"""
,"Something that can be found in kindergartens and schools, which is covered with a line of white and black things."
, It's an instrument. Like a keyboard on a piano or a melodica.
Ushiromiya Eva,"""The first two black keys are between 'do', 're', and 'mi'. The set of three black keys are between 'fa', 'so', 'la', and 'ti'......"""
Ushiromiya Ange,"""It started 'white black white black white ? black', so......the three white ones are 'do', 're', and 'mi'......"""
Ushiromiya Eva,"""There is no black key between 'mi' and 'fa'. So, 'fa' comes right after 'mi'!"""
Ushiromiya Ange,"""And since the question mark comes after 'mi', the right answer is 'fa'. ......In other words-"""
,"""""The right answer is white!"""""
Ushiromiya Natsuhi,"""Correct. I thought it might have been a bit too hard, but you did well."""
Ushiromiya Krauss,"""Splendidly done, you two. Go ahead, Natsuhi."""
Ushiromiya Natsuhi,"""Congratulations, Ange-chan. Here's my medal for you."""
Ushiromiya Ange,"""Alright! Eva oba-san, I got another one!"""
Ushiromiya Eva,"""Things are moving along nicely. Next up is Nii-san's puzzle. Let's solve it in a flash and teach him a lesson, okay?"""
Ushiromiya Krauss,"""How interesting. Looks like it's time you were taught a lesson."""
Ushiromiya Ange,"""Stop it, Eva oba-san! Don't provoke him! You'll make the puzzle harder!"""
Ushiromiya Krauss,"""Heheheheheheh. If there's anyone you have to blame, it's Eva! Now take this brain-twister! Here's a puzzle about the tenants of a skyscraper I've invested in."""
Ushiromiya Ange,"""I don't know anything about this skyscraper, so there's no way I could know......"""
,"I know what's in floors five and above, so the answer must be somewhere between floor one and floor four. There's no doubt about that."
Ushiromiya Krauss,"""Heheheheh. Do you give up?"""
Ushiromiya Eva,"""I, I won't give up, kiii!! So, you're saying that Murakoshi Publishing Co., Ltd. is on this floor X?!"""
Ushiromiya Krauss,"""Not floor X. The _th floor."""
Ushiromiya Ange,"""It's the same either way, isn't it...?"""
Ushiromiya Eva,"""......Ah. ............"""
,"Eva oba-san suddenly stumbled on something. Then, she started counting on her fingers, starting from the first floor......"
Ushiromiya Eva,"""I've got it, Ange-chan...! Try saying them aloud, starting from the first floor...! There's only one that fits!"""
Ushiromiya Ange,"""Huh? Wh, what do you mean......?"""
Ushiromiya Ange,"""......I don't get it."""
Ushiromiya Eva,"""It's 'the _th floor', not 'floor X'. That's the trick."""
Ushiromiya Krauss,"""That's right. Though, in a way, the answer is right there in the question."""
Ushiromiya Ange,"""What do you mean...?"""
Ushiromiya Eva,"""For example, let's take floor 7. You'd call that 'the seventh floor', right? But you wouldn't call floor 3 'the threeth floor', would you?"""
Ushiromiya Krauss,"""Precisely. From floor 1 to floor 4, there's only one floor that ends in 'th'."""
Ushiromiya Ange,"""A, ......ah........."""
,"By this point, even I had figured out the answer."
, If only I'd paid a bit more attention to the way Krauss oji-san said the question......
Ushiromiya Krauss,"""Hahahahahahaha. Too bad. Looks like I'll be keeping this medal."""
Ushiromiya Ange,"""The 4th floor!"""
Ushiromiya Krauss,"""Mu..."""
Ushiromiya Eva,"""Well done, you got it...! From floor one to floor four, there's only one floor that ends in 'th'...the 4th floor."""
Ushiromiya Ange,"""Yeah! The 4th floor fits, but the other ones are the 1st, 2nd, and 3rd floors."""
Ushiromiya Krauss,"""N, ......nicely done... And even I didn't figure it out until I had the answer given to me......"""
,"Apparently, Krauss oji-san once had this puzzle shown to him, and he wasn't able to answer it right."
, He looked a bit downcast to see a kid like me solve it.
,"......For some reason, he looked even more mortified to see that Eva had solved it. How strange."
Ushiromiya Eva,"""Come on, now. Let's see that medal."""
Ushiromiya Krauss,"""This medal is a mark of Ange-chan's intelligence. I mustn't let you have it, Eva."""
Ushiromiya Eva,"""Heh, sore loser...!"""
Ushiromiya Ange,"""Thank you, Krauss oji-san. Am I incredible?!"""
Ushiromiya Krauss,"""Very much so. You're a more flexible thinker than your uncle. I am proud to have you as a niece."""
Ushiromiya Natsuhi,"""That's all for our puzzles."""
Ushiromiya Krauss,"""I do hope you enjoyed them."""
Ushiromiya Ange,"""I did! Thank you, Natsuhi oba-san and Krauss oji-san!"""
Ushiromiya Krauss,"""I hope you can enjoy all the tricky questions, without worrying about your medal count too much."""
Ushiromiya Natsuhi,"""We all hope that this becomes a wonderful night, just for you."""
Ushiromiya Eva,"""We really are enjoying ourselves."""
Ushiromiya Ange,"""Yeah! We're having a lot of fun!"""
,Krauss and Natsuhi smiled at them as they dashed away.
{f:5:Beatrice},"""Oh, it's you, Natsuhi. How did your puzzles go?"""
Ushiromiya Natsuhi,"""We did the best we could, ......but I'm not sure how much they enjoyed them."""
,"On the other side of the room, Ange and Eva were counting the medals they had gathered so far."
," Ange and Eva. ......Such an unexpected pairing, but they looked like they were having a great time."
{f:5:Beatrice},"""......A future parent and child, unrelated by blood. Watching them like this, they look just like a normal parent and child."""
