Speaker,Original Witch Hunt (OG)
Ushiromiya Ange,"""The day after Christmas isn't Christmas. It couldn't happen."""
Ushiromiya Kinzo,"""Heheheh. Too bad. Wrong."""
Ushiromiya Ange,"""Huh? Why...?!"""
Ushiromiya Eva,"""Ange-chan, what time of day does a new day start?"""
Ushiromiya Ange,"""Midnight, at 12:00 AM."""
Ushiromiya Eva,"""There you go. Isn't it nighttime at midnight?"""
Ushiromiya Ange,"""......Ah."""
,I see. The first night was just after midnight on December 25th.
," In other words, the time right after the previous day ended and Christmas began."
," That would indeed be Christmas Day, and it would be at night."
Ushiromiya Ange,"""And then, the morning of the 25th would come, and when the sun sank again, that would be nighttime on the 25th again......"""
Ushiromiya Eva,"""Exactly! You figured it out."""
Ushiromiya Kinzo,"""Hohoho! If only you had figured it out a little faster."""
,Grandfather laughed like Santa Claus.
," Eva oba-san asked him to count it as a right answer, since I figured it out in the end, but Grandfather shook his head."
Ushiromiya Eva,"""Come on...! Don't be such a stingy Grandpa."""
Ushiromiya Ange,"""Still, now I've figured out how to do it. I'll get the next one right."""
Ushiromiya Kinzo,"""Yes, yes. That's the spirit. That's my granddaughter for you."""
Ushiromiya Ange,"""Thank you, Grandpa! I'm really ready now. I'll start getting a lot of them right!"""
Ushiromiya Kinzo,"""Yes. Give it your all. I have a truly splendid present waiting for you."""
,"After bowing to Grandfather, I hurried off with Eva oba-san to where everyone else was gathered."
Ushiromiya Ange,"""Oh, I see. It is possible...!"""
Ushiromiya Eva,"""Yep, that's right. After all, there are two nights in every day."""
Ushiromiya Ange,"""Right! December 25th starts at 12:00 midnight. Midnight is during the night, so that's the first night. Then, morning comes, and when night falls again, it's still the same day until midnight!"""
Ushiromiya Eva,"""Exactly. And both of those nights are nights on Christmas Day."""
Ushiromiya Ange,"""Eheheheheh. Am I awesome? Am I awesome...?!"""
,"With a delighted smile, Eva oba-san patted my head vigorously."
Ushiromiya Kinzo,"""Wahahaha! Well done, Ange. I tried to make it a hard question, but you solved it like it was nothing."""
Ronoue Genji,"""Congratulations, Ange-sama. ......Here is a medal for getting the first question right."""
,"Genji-san held out a gold-colored medal. Grandfather smiled at me, urging me to take it."
Ushiromiya Ange,"""Th, thank you!"""
Ushiromiya Kinzo,"""Keep up the pace. Well now, that is all for my puzzle. Head over there and ask whomever you choose for a quiz."""
,"It was a heavy, gold-colored medal."
," If I get a lot of these right, my pocket might burst."
, I'm gonna get so many that I can brag about it to everyone! 
,"After bowing to Grandfather, I hurried off with Eva oba-san to where everyone else was gathered."
, Kinzo watched Ange go  a warm gaze.
Ushiromiya Kinzo,"""Did I make it a bit too easy...?"""
Ronoue Genji,"""No. I think it was just right."""
Ushiromiya Kinzo,""".........Genji. Have I...managed to act the part of a good grandpa...?"""
Ronoue Genji,"""Of course."""
Ushiromiya Kinzo,"""Ange is young. And, she frequently grows sick and is unable to come to Rokkenjima. ......She probably won't...remember me well."""
,Young children have their own kind of cruelty.
, They think of kindness as something they will naturally receive.
," And because they think of kindness as only natural, ......they forget about it quickly."
Ronoue Genji,"""......It is no different from gratitude to one's parents. It will probably take Ange-sama many years before she understands."""
Ushiromiya Kinzo,"""Do you think......that she will eventually remember that I was a fun grandpa?"""
Ronoue Genji,"""......Yes. I am certain of it."""
Ushiromiya Kinzo,""".................."""
,Kinzo's expression grew slightly darker.
,"......Eventually, even Ange will get older, and she will probably hear how the public at large regards Ushiromiya Kinzo."
, The Ushiromiya Kinzo known by the public is completely different from the Kinzo who plays with his grandchildren.
," When she learns, ......will Ange remember the face of Kinzo the tyrant, known of by the world, ...or that gently smiling face?"
Ushiromiya Kinzo,"""......If possible, I would hope for her to remember my smile, ......but such a thing is probably too much to ask for."""
Ronoue Genji,"""............"""
{f:5:Beatrice},"""There's no way around it. That's what children are."""
Ushiromiya Kinzo,"""Oh, it's you."""
{f:5:Beatrice},"""Children just eat up kindness, and it never remains in their memories. By the time 12 years have passed, she will surely learn what a bizarre eccentric Ushiromiya Kinzo was. Your smile is fated to be painted over by that and forgotten."""
Ushiromiya Kinzo,"""......Most probably. No matter how much I spoil her, my love will not be rewarded."""
{f:5:Beatrice},"""However, just as it takes a long time to remember what you owe your parents, ......Ange will surely remember someday. ......She will remember the smiles you showed her."""
Ushiromiya Kinzo,"""Hmph...... Let her forget. One smile from her is the greatest parting gift I could ever take with me, when my time comes. This is...the essence of unrewarded love."""
{f:5:Beatrice},"""I guess grandfathers are always unrewarded."""
Ushiromiya Kinzo,"""Oh, but I have been rewarded. With Ange's smile just now to look back upon, I could happily pass on in my sleep tonight. Wahhahahahahahahaha......"""
,"With a lonely laugh, Kinzo spun around, setting his cape fluttering."
, This was all the love he could offer Ange as a grandfather.
," Part of him wanted to be remembered, but he knew he mustn't wish for that."
, That was...how unrewarded love worked.
," After looking at Kinzo's back, Beato stared at Ange's back again."
{f:5:Beatrice},""".........Ange. ......Even so, please remember it someday. ......Remember the smile...that Kinzo once showed you."""
,"Okay, whose quiz should I take next? "
,"I'm gonna challenge more and more people, get more and more medals for getting them right, and get a wonderful present to show everyone."
, Krauss oji-san and Natsuhi oba-san are over there.
, They're looking this way and smiling. I'm sure they've thought up some interesting puzzles.
," There's Hideyoshi oji-san, beckoning for me to come over."
," He's a fun uncle, so I'm sure he's thought up a fun question."
," Mom and Dad are across from him. They're waving at me, telling me to have lots of fun."
,......Dad probably knows a lot of really hard questions. He might be tough.
," Over there is Rosa oba-san and Maria onee-chan. It looks like they're reading a quiz book together, searching for a problem."
," Every now and then, Maria onee-chan glances over at me, saying 'kihihihihi'."
," She can be mean sometimes, so I'm sure her puzzle won't be a nice one."
," Beyond them are Battler onii-chan, George onii-chan, and Jessica onee-chan."
,"......Battler onii-chan is usually nice, but he sometimes says really mean things, and I think he likes seeing me get confused."
,......I get the feeling... that he'll give me a really tough problem.
, Is there anyone who looks like they won't be mean? 
,"If I can, I'd like to start with some easy puzzles to warm me up."
, All the way over there are Genji-san and Doctor Nanjo. I don't think those two will be mean to me.
, And then there's Shannon and Kanon.
, Shannon knows about a lot of quizzes and fairy tales. I'm sure she'll give me something unique.
," Then, we have Gohda-san and Kumasawa-san, who are serving tea."
, Kumasawa-san might be tough. ......I kinda think she'll give me a really confusing problem.
,......It looks like everyone might be pretty tough. Hmmmmm......
Ushiromiya Hideyoshi,"""Ange-chan. I've got a good one for ya...! Over here!"""
,Hideyoshi oji-san is calling for me.......What should I do? Should I go?
Ushiromiya Eva,"""Do you want to try Hideyoshi oji-san?"""
Ushiromiya Ange,"""Yeah. The order doesn't matter. After all, I'm gonna challenge everyone."""
,I rolled up my sleeves and headed towards Hideyoshi oji-san.
Ushiromiya Hideyoshi,"""Wahahahahahaha, here you are. Mine's a tricky one, okay?"""
Ushiromiya Eva,"""I wonder what sort of question you'll give her. Don't make it too hard, okay?"""
Ushiromiya Ange,"""It's okay if it's hard. I'll solve it."""
Ushiromiya Hideyoshi,"""Oooh, looking pretty confident there...! Okay, here it comes!"""
,"After clearing his throat, Hideyoshi oji-san started telling his question..."
Ushiromiya Hideyoshi,"""Mine's a riddle. Listen closely, now. You know the story of Momotarou, right?"""
Ushiromiya Ange,"""The boy who floated down a river in a peach?"""
Ushiromiya Hideyoshi,"""That's right. But you know, one day, an apple floated down that river."""
Ushiromiya Ange,"""An apple??"""
Ushiromiya Hideyoshi,"""Yep! And the next day, a butternut squash floated down it!"""
Ushiromiya Ange,"""I hate butternut squash."""
Ushiromiya Hideyoshi,"""And then, the next day, some cabbage floated down it! And the next day, a dill pickle did. And the next day, an eggplant floated by. And the day after that, a fig did!"""
Ushiromiya Eva,"""*giggle*. What a strange tale. Did a greengrocer live upstream, or something?"""
Ushiromiya Hideyoshi,"""Okay, here's the question. What floated down the river the next day?!"""
Ushiromiya Ange,"""Huh...?!"""
Ushiromiya Eva,"""I've got it. Do you get it, Ange-chan?"""
Ushiromiya Ange,"""I don't get it."""
Ushiromiya Eva,"""Then I'll give you a hint. There's a pattern to the things that float down the river. Can you guess what the pattern is?"""
Ushiromiya Hideyoshi,"""Wahahahaha! What a huge hint...!"""
Ushiromiya Ange,""".........I don't...have a clue!"""
Ushiromiya Hideyoshi,"""Wahhahahahahahahaha. Guess that was a bit too hard...!"""
Ushiromiya Eva,"""I know what floated down the river the day after that. A hassaku orange, right?"""
Ushiromiya Hideyoshi,"""Yep. And the day after that, it was probably an i.........i...hmmm... ......I can't think of a veggie that starts with 'i'!"""
,"I'm not sure I understand. No, I don't even have a clue."
Ushiromiya Ange,"""I know! It's a grapefruit!"""
Ushiromiya Eva,"""That's right. It wasn't one of the choices, but green beans would have worked too."""
,The names all followed the alphabet. Apple was 'a'. Butternut squash was 'b'. Cabbage was 'c'.
," It kept going with 'd', 'e', and 'f'."
," So, after 'f' comes 'g'. That's why the answer had to be something that started with 'g'."
Ushiromiya Ange,"""Thanks, Eva oba-san. I got it right thanks to your hint!"""
Ushiromiya Eva,"""*giggle*. You solved it by yourself, Ange-chan. Incredible."""
Ushiromiya Hideyoshi,"""Yep, nice work! Now, here's your medal for gettin' it right...!"""
,Hideyoshi took out a gold-colored medal and placed it on my palm.
," It felt heavy in my hand. Yeah, this is what victory feels like."
, I'd better keep it up!
Ushiromiya Hideyoshi,"""I've got another medal for Eva's puzzle. But I can't think of any more."""
Ushiromiya Eva,"""Then maybe I should give Ange-chan a puzzle."""
Ushiromiya Ange,"""Huh? You will?"""
Ushiromiya Eva,"""Sure. A quiz for the princess from her attendant♪ I've thought of a fun one, so please, have a go at it!"""
,Eva oba-san smiled brightly.
," I want to get as many medals as possible, so of course, I want as many chances as I can get."
Ushiromiya Ange,"""Okay, I'll have a go at it."""
Ushiromiya Eva,"""*giggle*. That's the spirit. Okay, here it comes."""
Ushiromiya Eva,"""We've talked about how I love to travel, haven't we?"""
Ushiromiya Ange,"""Yeah. You said you like traveling overseas a lot."""
Ushiromiya Eva,"""That's right. So this will be a puzzle about traveling. There was a traveler in a certain place."""
Ushiromiya Ange,"""A traveler?"""
Ushiromiya Eva,"""First, the traveler walked five kilometers north."""
Ushiromiya Ange,"""......Should I write this down on a piece of paper?"""
Ushiromiya Eva,"""Don't worry. The puzzle isn't that hard, so listening to it will be enough."""
Ushiromiya Eva,"""The traveler first walked five kilometers north. Then, he walked five kilometers to the east. Then, he walked five kilometers to the south."""
Ushiromiya Ange,""".........Five kilometers north. Five kilometers east. Five kilometers south. ......You mean, like a blocky 'n'?"""
Ushiromiya Hideyoshi,"""That's right! You work it out, and he's in a spot five kilometers to the east of where he started."""
Ushiromiya Eva,"""That should be the case, right? But, incredibly, this traveler ended up in the exact same spot he started. ......Is something so mysterious possible?"""
Ushiromiya Hideyoshi,"""Wahaha, there's no way! His compass must've gone crazy."""
Ushiromiya Eva,"""Of course it didn't! Eheheheheh, do you know, Ange-chan?"""
Ushiromiya Ange,"""It wasn't because of his compass? ......Is this a play on words?"""
Ushiromiya Eva,"""No, this is a real quiz. For a hint, why don't you try thinking about a globe?"""
Ushiromiya Ange,"""............I don't get it."""
,I've never traveled overseas at all.
, There might be some strange place in the world where you could walk in a blocky 'n' and get back to where you started.
,"......Like the Bermuda Triangle, or something..."
Ushiromiya Eva,"""Hmmm...... I guess that was a bit too hard for you, Ange-chan."""
Ushiromiya Ange,"""If you went north, then east, then south, there's no way you'd get back to where you started."""
Ushiromiya Eva,"""But there is a place. A place somewhere on the Earth's surface. If you have a globe in your house, take a good look at it and think carefully. If you just can't figure it out, try asking your dad, okay?"""
Ushiromiya Ange,"""Okay, I'll ask him. So tell me the right answer...!"""
Ushiromiya Eva,"""*giggle*. The right answer is a ve~ry cold place. Where can you find cold places on a globe? Think about it carefully. Once you figure it out, you can try giving this quiz to the other kids in your class. I'm sure they'll all be surprised."""
,Where can you find a cold place? ......Hokkaido? 
,"I don't think you end up at the start if you go north, east, then south in Hokkaido."
,......Nnnn. I don't get it. I give up.
Ushiromiya Hideyoshi,"""Okay, that's all for our puzzles! Go ask one of the others to give you one!"""
Ushiromiya Eva,"""Let's go! Who should we challenge next?!"""
,"If Eva oba-san knows puzzles this hard, I'm sure she must be good at quizzes."
," If she's with me, I know we'll get lots and lots of medals."
, Who will I ask next...?!
Ushiromiya Ange,"""I got it...! It's a really cold place! Yeah, it must be incredibly cold there!"""
Ushiromiya Eva,"""Perfect! Ange-chan, you must really be a genius, to get something like that at your age."""
Ushiromiya Hideyoshi,"""If you start at the south pole, then after you go north, going east just draws a circle around the south pole. So, anytime you go south again, that just takes you right back to the south pole."""
Ushiromiya Eva,"""I tried to make it an extra hard puzzle, but Ange-chan was just too good."""
Ushiromiya Hideyoshi,"""Congrats! Here's another medal for ya."""
,"I got a heavy, gold-colored medal."
," All right, I did it...! Eva oba-san and I held up our fists in celebration."
Ushiromiya Hideyoshi,"""Okay, that's all for our puzzles! Go ask one of the others to give you one!"""
Ushiromiya Ange,"""Okay! Thank you, Hideyoshi oji-san...!"""
Ushiromiya Hideyoshi,"""Your aunt's really clever...! ......With the two of you together, you'll be gettin' medals right and left!"""
Ushiromiya Eva,"""Yep, that's right!"""
Ushiromiya Ange,"""Yeah. Let's do our best together, Eva oba-san."""
,I dashed away. Who will I ask next...?! 
,"Hideyoshi oji-san waved goodbye, smiling......"
," Hideyoshi and Eva watched as Ange ran off happily, looking for the next quiz."
Ushiromiya Eva,""".........Even though that kid can wear such a cute smile... ...I will......be the one who takes that away from her..."""
Ushiromiya Hideyoshi,"""Eva........."""
,Eva hung her head. A single tear sparkled in her eye...
Ushiromiya Eva,"""Her reaction was only natural, considering how she felt. ......But I...wasn't able to see past it and accept her feelings......"""
Ushiromiya Hideyoshi,"""It can't be helped. You're as human as anyone else. Humans tend to be more fragile than you'd think."""
Ushiromiya Eva,"""Even so, it was my fault...! After all, I already had the experience of bringing up a child, right?! ......I should have become her mother. ......And yet, I let sadness overwhelm me, ......and I didn't do it at all..."""
Ushiromiya Hideyoshi,"""It can't be helped, I tell you...! Don't think you were the only one at fault...! You shouldn't blame yourself so much!"""
,"By now, Eva was unable to hold back her sobs... Large tears dripped down her cheeks as she stared at the ground and shook..."
Ushiromiya Eva,"""What a sin I've committed...... ......My sadness was no greater than hers...! And yet, I decided that I was suffering the most, ......so I didn't accept her feelings...... ......I'm a failure of a mother... I wasn't able......to become a mother for her......"""
Ushiromiya Kyrie,"""That's wrong. ......You did your best for her, Eva nee-san."""
Ushiromiya Eva,"""Kyrie-san..."""
,Kyrie and Rudolf were standing behind Eva now.
Ushiromiya Kyrie,"""I know the lengths you went to...to keep the truth from Ange."""
Ushiromiya Rudolf,"""......You held out well, Aneki. Guess that daughter of ours really has been a pain, clueless about how much you suffered."""
,After the accident on Rokkenjima...
," Eva, the only one who left Rokkenjima alive, adopted Ange, the girl who had been absent and survived."
,"......While they would eventually develop a sad and mutually painful relationship, it wasn't like that at first."
," Eva tried to show affection for Ange, her last remaining blood relative. She tried to become Ange's new mother. Even as she fought back the sadness she herself felt."
," However, Ange wasn't able to accept that kindness. She lashed out at Eva, the only one who had returned alive, for stealing her parents away from her."
,"......Eva, understanding the wounds that this little six-year-old girl bore, withstood these attacks. She grit her teeth and poured all of her affection onto Ange...affection that went ignored."
," However, ......the wounds Eva herself bore were also extremely deep."
," She was never rewarded for her sad efforts, ......and the future in front of her grew dark."
Ushiromiya Kyrie,"""You tried to show Ange the same affection you once showed George-kun."""
Ushiromiya Eva,"""But still, ......that was just for my own satisfaction. ......Ange-chan never felt any of it..."""
Ushiromiya Rudolf,"""Ange was the one who couldn't accept it. It isn't your fault."""
Ushiromiya Eva,"""But who could possibly ask that of Ange-chan when she was just six years old...?! I should've held out much, much longer, until she could understand my feelings...!"""
Ushiromiya Kyrie,"""Eva nee-san. I want you to believe one thing."""
Ushiromiya Eva,"""............"""
Ushiromiya Kyrie,"""We...don't blame you in the slightest."""
Ushiromiya Eva,"""......Kyrie-san............"""
Ushiromiya Kyrie,"""Thank you so much...for suffering so long for Ange's sake...... ......If that kid has a human heart, then I'm sure she'll recognize the affection you showed her someday."""
Ushiromiya Rudolf,"""Thank you, Aneki. We'll always be grateful......"""
Ushiromiya Hideyoshi,""".........Isn't that wonderful, Eva...... ......All of your efforts......have been witnessed......"""
Ushiromiya Eva,"""Uuuuu......uwaaaaaaaahhhh........."""
Gohda Toshiro,"""How are you doing, Ange-sama? If you wish, I, Gohda, would be pleased to challenge you."""
Kumasawa Chiyo,"""Hohohoho. And I, Kumasawa, have a ve~ry tricky puzzle for you."""
Ushiromiya Ange,"""It doesn't matter how hard it is. I'm not alone. I'll solve it with Eva oba-san!"""
,"Gohda and Kumasawa offered to challenge me. I'll have to go up against everyone in the end, so it doesn't matter who comes next."
," I waved at Eva oba-san to hurry up, and she ran toward me."
Ushiromiya Eva,"""So, we're challenging this pair next? Who will we start with?"""
Ushiromiya Ange,"""Okay...Gohda-san."""
Gohda Toshiro,"""Very well, as you wish. Here is my puzzle."""
Kumasawa Chiyo,"""Hohohohoho. I'll warn you, it's a toughie."""
Ushiromiya Ange,"""I'll still solve it. I've gotten the knack of it."""
Ushiromiya Eva,"""You'd better not underestimate Ange-chan. Right?!"""
Ushiromiya Ange,"""Right!"""
Gohda Toshiro,"""My, my. ...Well then, being the humble chef that I am, here is a puzzle about food and the kitchen."""
Ushiromiya Eva,"""We'll fight together this time. If you don't get it, just ask me to lend a hand. I'll give you a hint."""
Ushiromiya Ange,"""......If I get a hint, does that mean I don't get a medal?"""
Ushiromiya Eva,"""It won't affect your medals at all, so feel free to ask away!"""
Ushiromiya Eva,"""I've got it. The hint here...is that the witch got home much later than usual."""
Ushiromiya Ange,"""......What happens when she gets home later than usual?"""
Ushiromiya Eva,"""Think carefully. The food is always freshly-made and served at the usual time, right? So, ......what happens when she gets home long after that?"""
Ushiromiya Ange,"""......I don't get it. Food isn't supposed to talk."""
Gohda Toshiro,"""Well, uh, that's because this is a fairy tale puzzle......"""
Kumasawa Chiyo,"""Hohhohohohohoho... It looks as though she didn't figure it out."""
,"The answer I'd chosen at random was wrong, apparently. ......Too bad."
Ushiromiya Ange,"""Then tell me the right answer, Eva oba-san. You figured it out, right? Tell me!"""
Ushiromiya Eva,"""Alright. The answer is-"""
Gohda Toshiro,"""Eva-sama, if you wouldn't mind...! They say recipes and riddle answers are best while they remain secret."""
Ushiromiya Eva,"""You think so...? Eheheh, I'll have to tell her sometime later when you aren't around, then."""
Ushiromiya Ange,"""Yeah, it's a promise!"""
,"But even if I hear the answer later on, I still got it wrong."
, Oh well. I'd better pull myself together and take a shot at Kumasawa-san's puzzle.
Ushiromiya Ange,"""The ice cream! The witch got back really late, so the ice cream would've melted. So she couldn't eat it!"""
Ushiromiya Eva,"""Nicely done! See? Ange-chan is a clever girl, isn't she?"""
Gohda Toshiro,"""Congratulations, Ange-sama! Very impressive. How quickly you saw through the puzzle that I, Gohda, put all my efforts into...!"""
Ushiromiya Ange,"""It was totally easy. Eva oba-san's puzzle was harder."""
Ushiromiya Eva,"""*giggle*, thanks."""
Gohda Toshiro,"""Congratulations. This medal is your prize for answering my question correctly."""
Ushiromiya Ange,"""Thank you!"""
,"Alright, that was easy. Now let's take a shot at Kumasawa-san's puzzle."
Kumasawa Chiyo,"""Looks like I'm up next. Now, let's test Ange-sama with my specially-made, super-hard puzzle. Are you ready?"""
Ushiromiya Ange,"""How... hard is it?"""
Kumasawa Chiyo,"""Hohohohohohoho. You'll have to wait and see. And now, let the mackerel dessert puzzle begin."""
Ushiromiya Ange,"""Mackerel dessert...?"""
Ushiromiya Eva,"""This is Kumasawa-san we're talking about, so you can bet it'll be a strange one. Be careful."""
Ushiromiya Ange,"""Okay!"""
Ushiromiya Ange,"""Eva oba-san, do you get it?"""
Ushiromiya Eva,"""She says you have to change one letter, so the answer's probably some sort of word game. Her choice of words is suspicious to say the least. Try and think of some kind of dessert that you can make by changing a letter in...... Ah, I've got it!"""
Ushiromiya Ange,"""Huh?! What is it? What is it?!"""
Ushiromiya Eva,"""Forget changing a whole letter... You only need to change one line. In fact, that pretty much gives you the answer."""
Kumasawa Chiyo,"""*bzzzz*. Wro-ng."""
Ushiromiya Ange,"""Huh?! I don't get it! I don't get it at all...!"""
Kumasawa Chiyo,"""Hohohohoho, sorry, but wrong is wrong. Perhaps it was a bit too hard for you, Ange-sama."""
Ushiromiya Eva,"""Come on, Kumasawa-san. That was a nasty puzzle..."""
Ushiromiya Ange,"""It doesn't make sense! There's no way you could make a dessert out of mackerel! What's the answer? Tell me!"""
Kumasawa Chiyo,"""Hohohoho, it's no fun if I tell you. If you don't guess it quick, ......then you really will be having mackerel for dessert. Ihihihihihihihihihi......"""
Ushiromiya Ange,"""Tell me, tell me!"""
Kumasawa Chiyo,"""Nope."""
,"Kumasawa smiled cheerily, but remained stubborn. No matter how much I bother her, she probably won't tell me the answer."
Gohda Toshiro,"""That concludes our puzzles. There are probably others waiting for you to challenge them, Ange-sama. Please, on to the next challenge."""
Kumasawa Chiyo,"""We're both rooting for you, Ange-sama."""
Ushiromiya Ange,"""Okay! I'll keep on trying hard and getting more and more medals!"""
Ushiromiya Eva,"""That's the spirit. Don't let it get you down. Plenty more chances left!"""
,"We rushed away. Okay, who should we take on next...?!"
Ushiromiya Ange,"""I got it! The letter is 'b'! If you change the 'b' in Saba-ra to an 'h', you get Sahara!"""
Kumasawa Chiyo,"""Hohohohohoho, that's correct."""
Ushiromiya Eva,"""The last line said you could make a grand 'desert' out of sabara. Not dessert...!"""
Ushiromiya Ange,"""I figured out a trick in Japanese and English! Am I awesome? Am I awesome?!"""
Ushiromiya Eva,"""You're so smart, Ange-chan! You deserve a pat on the head...!"""
Ushiromiya Ange,"""Haha, I like it when you do that."""
Kumasawa Chiyo,"""Just change a single letter, and even mackerel can make a fine desert. Are you starting to see how omnipotent mackerel is?"""
Gohda Toshiro,"""The day I'm forced to serve a joke like that for dessert, I imagine heads will roll......"""
Ushiromiya Ange,"""I wouldn't like it either. I like ice cream for dessert."""
