Speaker,Russian (RU)
Ushiromiya Battler,"""Ты можешь говорить что угодно. Однако поверю ли я тебе или нет, решать лишь мне и только мне!"""
Ushiromiya Battler,"""Не важно, сколько у тебя магии! Моя душа не будет принадлежать тебе. Ты думаешь, это пытка для меня? Ты заблуждаешься!"""
{f:5:Beatrice},"""Тогда что же ты имеешь в виду!"""
Ushiromiya Battler,"""Что это пытка для тебя!"""
Ushiromiya Battler,"""Когда‐нибудь ты уступишь мне и сдашься! До тех пор, ты снова и снова пройдёшь через пытки!"""
{f:5:Beatrice},"""Как интересно! Неплохое сравнение! Пытки, где мы будем истязать друг друга! Звучит воистину интересно! Итак, мы начнём?! Уширомия Баттле‐е‐ер!!!"""
