Speaker,Russian (RU)
,"Приближающееся утро нельзя было заметить, не открыв окно и не посмотрев на облачное небо, на котором наметился лёгкий просвет."
,"Данное утро нельзя было назвать освежающим. Всё, что можно было услышать, это звук дождя, продолжавшего лить с прошлого вечера, смешанного с завываниями ветра..."
Ushiromiya Kyrie,"""......Трудно представить, что на дворе утро. Эта ужасная погода отражает, что творится у нас на душе."""
Ushiromiya Rudolf,"""Так не является ли такая погода мягкой? Дождь из воды всегда лучше, чем дождь из копий."""
Ushiromiya Hideyoshi,"""Ва‐ха‐ха. Из воды или из копий, но он внушителен."""
Ushiromiya Hideyoshi,""".........Уже шесть? Фуа‐а‐а‐а‐а... Не хватит ли с нас пока? В конце концов, мы не можем принять какие‐либо меры, пока таинственный 19‐й человек — {f:5:Беатриче}, не начнёт действовать."""
Ushiromiya Krauss,"""Это так. ......Однако я полагаю, что мы предусмотрели все уловки, которыми она могла бы воспользоваться против нас."""
Ushiromiya Eva,"""Согласна. Пока в наших рядах не заведётся предатель, мы сможем справиться с большинством ситуаций."""
Ushiromiya Rosa,"""......Разве мы не достаточно поговорили на эту тему? Всю ночь просидели. ...Я устала."""
Ushiromiya Natsuhi,"""Ты права. Что скажете насчёт отдыха за завтраком?"""
Ushiromiya Krauss,"""...Хорошая мысль. Бодрствовать всю ночь утомительно в нашем возрасте."""
,"Потянувшись, они старались, насколько это возможно, извлечь приятное из этого столь не освежающего утра."
Ushiromiya Rudolf,"""Я схожу ополоснуть лицо. Видок у нас ещё тот."""
Ushiromiya Kyrie,"""...............? Что это за ужасная вонь?"""
,"Как только они вышли в коридор, Кирие, не таясь, состроила гримасу отвращения."
Ushiromiya Natsuhi,"""...Что случилось?"""
Ushiromiya Kyrie,"""Слушай, ты ничего дурного не чуешь?"""
Ushiromiya Hideyoshi,""".........Хм. ...Что за вонь? Она мне не нравится..."""
,"Встревоженные этим, все высунули головы в коридор.{n}...Запах был слабоват, но когда Кирие высказала своё недовольство запахом, тут уж и остальные чётко ощутили его."
,"Все вышли в коридор и, прибегнув к собственному обонянию, попытались определить источник этого странного смрада..."
Ushiromiya Natsuhi,"""Что же это всё‐таки такое? Предоставим Генджи разобраться с этим. Полагаю, он уже пришёл в комнату для прислуги, чтобы приступить к утренним приготовлениям."""
Ushiromiya Krauss,"""Хм, да, пожалуй. Сложно себе представить, что завтрак, вышедший из‐под руки Годы, станет источать такой смрад..."""
,"Поискав источник запаха, Рудольф и остальные определили, что он исходил снизу, из котельной."
,"Но дверь была закрыта, не давая им проверить, что творится за нею."
,"Затем, когда Нацухи и остальные направились найти кого‐нибудь в комнате для прислуги, то обратили внимание на какую‐то странность в гостиной."
Ushiromiya Natsuhi,"""......Что это?!"""
Ushiromiya Rosa,"""К‐какой ужасный розыгрыш... У кого рука поднялась..."""
,"На двери в гостиную, напоминающей кровь краской, был нарисован магический круг."
Ushiromiya Eva,"""На кухню ещё никто не пришёл. ......Чт‐что это?"""
,"Группа Евы, предположившей, что запах доносится из кухни, вернулась, убедившись, что на кухне нет ни души и приготовления завтрака ещё не начались."
,......И они тоже заметили необычный элемент гостиной.
Ushiromiya Rudolf,"""Бесполезно, дверь в котельную заперта. Разве нам не выйдет боком, если там что‐то сломалось? Здесь хоть какой‐то слуга поблизости наблюдается?"""
Ushiromiya Kyrie,""".........! И здесь эта вульгарная мазня? На двери в котельную она тоже была."""
Ushiromiya Hideyoshi,"""То есть как?! Этот жуткий рисунок не только здесь, но ещё и в других местах?! Ха‐ха, как думаете, это лесная ведьма {f:5:Беатриче} вышла на тропу войны, а?"""
,"Хидэёши попытался обратить происходящее в шутку, но от взгляда на этот жуткий магический круг, фоном которому служили шум ветра и дождя, в голову назойливо закрадывалась мысль, что это было послание от ведьмы."
,"...Капающая ярко‐красная краска наводила на мысли о крови, что вносило свою толику жути."
,"Хидэёши попробовал открыть дверь, но та оказалась заперта."
,"...Обычно гостиную было не принято закрывать.{n}Но кто‐то, похоже, позаботился запереть её."
Ushiromiya Rosa,"""......Что это значит? Неужели, пока мы беседовали в обеденном зале, кто‐то втихаря намалевал это художество? На дверях в гостиную и котельную?"""
Ushiromiya Eva,"""...Уверена, за этим стоят слуги. Мы всё это время были вместе. Так что у нас всех есть алиби. ......Они наверняка получили какой‐нибудь странный приказ от отца и устроили этот розыгрыш."""
Ushiromiya Rudolf,""".........Принимая во внимание вчерашнее происшествие с письмом Марии, становится очень легко заподозрить, что слуги действуют в соответствии с приказами отца и что‐то задумали. ......И вообще, куда все подевались? Не в прятки же они играют. Давайте поищем их."""
Ushiromiya Rosa,"""Первым делом, меня волнуют дети. С ними же всё в порядке, так? Я пойду и проверю, а по пути заодно посмотрю, есть ли поблизости кто‐то из слуг."""
Ushiromiya Rudolf,"""Тогда давайте разделимся. Вы направитесь в домик для гостей, чтобы проверить, как дела у ребятни, а мы пока обследуем особняк. .........Не хочется думать об этом, но эти жутковатые магические круги могут оказаться не только в местах, где мы их обнаружили."""
Ushiromiya Krauss,"""......Мы могли оказаться вовлечены в какую‐нибудь сумасшедшую игру отца. ...Я схожу к нему и послушаю, что он скажет на этот счёт. ......Правда сомневаюсь, что он покладисто меня выслушает."""
,Взрослые разделились.
,"Так они убедились, что дети были в безопасности, находясь в так называемой комнате кузин‐кузенов, расположенной на втором этаже домика для гостей."
,"Судя по всему, они засиделись за игрой до поздней ночи.{n}Все они громко посапывали, так что Роза решила не будить их."
,"Более того, Нанджо, вернувшийся вечером, тоже был в порядке.{n}Он, по‐видимому, придерживался принципа ""кто рано встает, тому Бог даёт"", так что уже не спал и был свеж."
,В это время Кирие с Хидэёши искали слуг.{n}Но никого не нашли.
,...Комната для прислуги в домике для гостей тоже пустовала.
Ushiromiya Rosa,"""......С детьми всё в порядке. Все они засиделись допоздна."""
Ushiromiya Hideyoshi,"""В комнате для прислуги никого. Я проверил график смен, и утренняя смена начинается с шести. Им сейчас полагается работать..."""
Ushiromiya Kyrie,"""В спальной комнате тоже ни души. Там расстелен футон, но он холодный."""
Ushiromiya Hideyoshi,"""Слушай, а ты в этом не ошибаешься? ......Это наверняка игра отца, спланированная по его приказам. Конечно же, он оставил те жуткие рисунки и где‐нибудь спрятался, пытаясь побудить нас к каким‐нибудь действиям."""
Ushiromiya Kyrie,"""......Намекаешь, он пытается выяснить, кто унаследует его богатства и имущество? ...Не слишком ли уж это..."""
Ushiromiya Rosa,"""Нет... ...Если за этим стоит отец, то это может и не оказаться таким уж странным."""
Ushiromiya Hideyoshi,"""Ведь, всё‐таки, отец любит крупные шалости. ......Это может оказаться какой‐нибудь тщательно обдуманный план ещё с тех времён, когда в холле была вывешена та эпитафия."""
Ushiromiya Kyrie,"""...В таком случае, интересно, объявит ли он игру или просто даст всему объяснение. ......Было бы неплохо, если бы сейчас возникло письмо с гербом, вроде того, что вручили Марии."""
Ushiromiya Rosa,"""............Да уж. Нии‐сан и остальные вполне могли уже отыскать подобное в особняке."""
Ushiromiya Hideyoshi,"""Доктор Нанджо. Вам что‐нибудь известно?"""
Nanjo Terumasa,"""......М‐мои извинения, но я не имею ни малейшего представления, что происходит. И всё‐таки... Да, понимаю, я могу легко себе представить, как Кинзо‐сан замыслил нечто столь крупное."""
Ushiromiya Hideyoshi,"""...Не пора ли нам вернуться в особняк? Может быть, они уже что‐нибудь там разыскали."""
Nanjo Terumasa,"""Если я не буду вам мешать, то тоже пойду."""
Ushiromiya Rosa,"""Я... я останусь здесь. ...Дети спят наверху. Мы не знаем, что происходит на самом деле. Так что будет неразумно оставлять их одних."""
Ushiromiya Kyrie,"""......Согласна. Я останусь с Розой‐сан и пригляжу за обстановкой. Передайте моему мужу, хорошо?"""
,Роза с Кирие остались в домике для гостей.{n}А Хидэёши в компании Нанджо вернулся в особняк.
,"А в это время, в особняке..."
,"В это было сложно поверить... Или, правильнее сказать, стремясь оправдать его дурное предчувствие..."
,Предположение Рудольфа попало в цель.
,"...Поскольку круг, нарисованный на дверях в котельную и гостиную, был обнаружен во многих местах в особняке."
Ushiromiya Rudolf,"""Аники!.. Как отец?"""
Ushiromiya Krauss,"""Нет, всё без толку. Он не отозвался. Я приложил ухо к двери, но никого не услышал."""
Ushiromiya Natsuhi,"""...Я нигде не могу найти слуг. ...Да куда же они могли запропаститься?..."""
Ushiromiya Eva,"""Это не смешно. Отец со слугами куда‐то попрятались, а дом разрисован странными магическими кругами. ......Что, чёрт возьми, происходит?!"""
,"Магические круги оказались не только на дверях в котельную и гостиную.{n}Обнаружились также два на втором этаже и один на третьем этаже, так что общее их число составило пять."
,"Одни и те же магические круги при запертых дверях, не позволяющих проверить, что творится за ними."
Ushiromiya Rudolf,"""...В общем, давайте сначала как‐нибудь разберёмся с котельной. Будет худо, если что‐то сломалось, а потом поймает огонь и взорвётся. ...Так что нам нужен ключ."""
Ushiromiya Natsuhi,"""Он должен быть в коробке с ключами в комнате для прислуги."""
,Они проверили коробку с ключами в комнате для слуг.
,"Поскольку каждый из слуг носил при себе универсальный ключ, таковые здесь не хранились."
,Но всем индивидуальным ключам полагалось храниться здесь.
Ushiromiya Krauss,"""............Здесь ключей навалом."""
Ushiromiya Eva,"""...Нужного здесь нет. Как бы мы ни искали, мы его не найдём."""
Ushiromiya Rudolf,"""Взгляни, Анеки. ......Здесь отсутствуют ключи к помещениям на дверях в которые нарисованы круги."""
Ushiromiya Natsuhi,"""......Действительно. ...Вот не было печали..."""
Ushiromiya Eva,"""Как будто кто‐то не хочет, чтобы кто‐то заходил в те комнаты с магическими кругами. ......Нет, они вообще не старались скрыть те круги, так что не наоборот ли?"""
Ushiromiya Rudolf,"""Думаю, что последнее. ...Это не кино, так что выломать дверь наверняка невозможно. Возможно, будет прок, если мы разобьём окно."""
,"Краусс слегка колебался, была ли данная ситуация достаточно критической, чтобы разбивать окно."
,"В это время вернулись Хидэёши и Нанджо.{n}В домике для гостей не обнаружилось ничего странного и дети были в порядке.{n}Они передали, что Роза и Кирие остались сторожить."
Nanjo Terumasa,"""Доброе утро. ...Я слышал, что произошло что‐то странное."""
Ushiromiya Krauss,"""Доброе утро, доктор Нанджо. ...Прошу прощения, что разбудил вас с утра пораньше."""
Ushiromiya Hideyoshi,"""В чём дело? Письмо нашли, что ли? Я был уверен, что вы уже что‐нибудь такое отыскали..."""
Ushiromiya Eva,"""......Ты прав. Я тоже полагала, что это была большая шутка или игра отца... Но в таком случае бы пришло письмо, уведомляющее нас об этом. Вроде того письма Марии‐чан."""
Ushiromiya Rudolf,"""А что если объявлением игры было как раз письмо Марии‐чан? Подробности игры — 'попытайтесь разгадать загадку эпитафии', уже были изложены."""
Ushiromiya Krauss,"""Тогда что означают пять магических кругов, обнаруженных нами в особняке? ...А исчезновение слуг."""
Ushiromiya Eva,"""......Нацухи‐нээ‐сан. Сколько слуг должны были сегодня работать?"""
Ushiromiya Natsuhi,"""А? .........Генджи, Года... Итого пять, а что?"""
Ushiromiya Rudolf,"""......Итак, должно быть пять слуг. А магических кругов тоже пять. ......Может и совпадение, но оно меня тревожит."""
Ushiromiya Eva,"""...Нии‐сан. Давай разобьём окно. Мы должны проверить, что происходит внутри."""
Ushiromiya Krauss,"""............Выбора нет. Только аккуратней."""
,"Приняв решение, Краусс дал добро разбить окно."
,"И он решил, что первой комнатой, в которую они разобьют окно, будет гостиная на первом этаже, до окон которой легче всего дотянуться."
,"Они надеялись, что им удастся заглянуть в окно, но занавески были опущены, закрывая им обзор."
,"Рудольф обошёл сад в поисках чего‐нибудь, чем можно разбить окно."
,"Наконец он набрел на камень, превосходящий размерами его кулак, и вернулся."
Ushiromiya Eva,"""Всё стекло разбивать необязательно. Просто проделай отверстие достаточное, чтобы дотянуться до замка."""
Ushiromiya Rudolf,"""Ты только особо не надейся, ладно?"""
,"Подняв камень, Рудольф несколько раз ударил по стеклу."
,"Наконец он пробил отверстие, размеры которого позволяли дотянуться до замка снаружи."
,"...Прикрыв руку платком, он просунул её в то отверстие и аккуратно отпер окно."
Ushiromiya Rudolf,"""Позже нам следует прикрыть его упаковочной лентой. А то дождь задувает."""
,"Когда он внезапно открыл окно, занавески бешено затанцевали, ведомые ветром и дождём. Затем занавеску отдуло вбок."
,...Их глазам наконец‐то нормально отрылась гостиная.
,"Они ощутили некоторое облегчение. ......Поскольку они думали, что увидят ещё один дикий магический круг внутри комнаты или, быть может, следы какого‐нибудь страшного ритуала."
,"Как бы там ни было, они не горели желанием прохлаждаться под дождём, так что шестеро человек: Краусс, Нацухи, Ева, Хидэёши, Рудольф и Нанджо вместе забрались в гостиную."
Nanjo Terumasa,"""......Вроде... Ничего особенно не изменилось..."""
Ushiromiya Krauss,""".........Э?.."""
Ushiromiya Natsuhi,"""Что случилось с Шаннон?!"""
Ushiromiya Eva,"""Стоп, стоп, ты в порядке?! Что с тобой случилось?!"""
Ushiromiya Hideyoshi,"""Кровь, кровь! Д‐д‐доктор Нанджо, взгляните на это!"""
Ushiromiya Rudolf,"""Эй, Шаннон‐чан! Ты в порядке?! Ответь мне!"""
Nanjo Terumasa,"""Н‐не трясите её... Я исследую её состояние..."""
,"Она находилась в тени дивана, поэтому они не заметили её, пока не забрались в комнату."
,Шаннон лежала на полу с ярко красным пятном на груди...
{f:5:Beatrice},"""Эгей, Баттле‐е‐е‐ер, ты где‐е‐е‐е? Смотри, смотри, вот и труп Шаннон объявился, видишь~~~? Я больше не стану тебя обижать, так что вылезай."""
{f:5:Beatrice},"""......Хм‐м‐м? А, вот ты где. Что ты делаешь схватившись за голову в таком месте?"""
Ushiromiya Battler,"""........................"""
,"Баттлер находился под столом, на корточках, схватившись за голову... Его жалкая поза ясно говорила, что он не хочет ничего ни видеть, ни слышать..."
,Слышал ли он издевательский голос {f:5:Беатриче}?
,"...Не слышал или притворялся, что не слышит? В любом случае было очевидно, что он окружил своё сердце скорлупой..."
Ronove,"""Пу‐ку‐ку‐ку... ......Уж не слишком ли вы его запутали, миледи. После такой демонстрации, а затем требования привести контраргументы, я могу понять, почему он впал в уныние."""
{f:5:Beatrice},"""Эй, Баттлер. Если ты не можешь привести контраргумент, то сдайся, ладно? Сейчас твой ход. Если ты не сделаешь ход, не объявишь, что отказываешься от него или не заявишь, что сдаешься, то так мы далеко не уедем."""
Ushiromiya Battler,"""........................ни."""
{f:5:Beatrice},"""......А? Что ты сказал? Я тебя не расслышала."""
Ushiromiya Battler,"""Я сказал усохни! А‐а‐а, заткнись, заткнись, заткни‐и‐ись!!! Ведьма? Магия?! Делай что хочешь, но я не верю, не верю ни во что из того, блин, блин, блин, блин, блин!"""
Ushiromiya Battler,"""Не разговаривай со мной, не показывай мне ничего, исчезни, исчезни, исчезни! Не маячь своей дурной рожей передо мно‐о‐о‐о‐ой!!!"""
{f:5:Beatrice},"""..................!"""
,{f:5:Беатриче} неосознанно содрогнулась от этой внезапной вспышки ярости Баттлера.
