Speaker,Russian (RU)
{f:5:Beatrice},"""......Ч‐что бы ты ни говорил... Если ты не сделаешь свой ход, мой черёд никогда не настанет. Я пытаюсь донести до тебя, чтобы ты не давал мне скучать, но..."""
Ushiromiya Battler,"""Мне плевать, усохни, заткни‐и‐ись!!! Кому сдалась твоя игра, я больше не стану в ней участвовать! Если твой ход не придёт, пока не сделаю свой, то и жди целую вечность!"""
Ushiromiya Battler,"""А‐а‐а‐а, я не знаю, не знаю, не понимаю! Я не приму ведьм или магию, я не приму подобную чушь! Уо‐о‐о‐о‐о‐о‐о, не разговаривайте со мно‐о‐о‐о‐ой!!!"""
,"......Я больше не знаю, что есть что.{n}Как я могу сопротивляться, когда мне показали такое безумство..."
,Я бесцельно бродил по розарию.
,"......Дождь лил как из ведра, но это не означало, что моё тело намокло. ...Я лишь ощущал одиночество слоняясь среди ветра и дождя без зонта."
Ushiromiya Battler,"""...............Наверное... Я проиграл ей уже очень давно."""
,"...Вообще, в прошлой игре, я всё гадаю, достигли ли мы чёткого исхода."
,"Ведь я сдался на какое‐то время.{n}Итак, мир оказался окрашен ведьмами и магией."
,"......Роккенджима сейчас — иной мир, где, не таясь, разгуливают ведьмы, колдующие странную магию."
,...Дело тут не в принятии или отрицании.
,"Наверное, я ошибочно допустил, будто на равных играю в игру с Беато."
,"Я уже потерпел поражение в прошлой игре... И это, наверное, мой песенный ритуал сдачи."
,Совсем недавно в розарии разыгралась ужасная битва.{n}Я видел её собственными глазами.
,"Я пнул землю. ......Она, разумеется, оказалась твёрдой.{n}Только лужа плюхнула."
,"Несколько башен разверзли эту землю, возносясь, словно какие‐то высотные здания."
,"......Чем больше я пинал землю, тем отчётливее понимал, что подобное не может быть возможным."
,"Но в силу этой причины я не мог объяснить случившееся у меня на глаза ничем иным, кроме магии..."
Ushiromiya Battler,"""......Запертая комната с ключом, запертым внутри. Опять это. Я знаю, что этот приём используют для продления детективного романа. ......Но... всё же... Эта сверкающая громадина... Блин..."""
,"""............Я смотрю, моя ученица доставила тебе изрядно хлопот."""
Ushiromiya Battler,"""...А? .........Это ты..."""
,"Кто‐то внезапно заговорил со мной, что заставило меня обернуться, чтобы в беседке розария увидеть... {f:5:Беатриче}‐предшественницу, которую недавно победила {f:5:Беатриче}."
Ushiromiya Battler,""".........А я думал, что ты померла. Так ты выжила."""
,"""Нет, умерла. ...Теперь я не более чем побежденная шахматная фигура, коротающая время вне шахматной доски."""
Ushiromiya Battler,"""Ты учитель Беато, так? То есть, другими словами, тоже ведьма."""
,"""......Да, это так."""
Ushiromiya Battler,"""Хе. То есть, получается... Что ведьмы и впрямь существуют? И я не тот, кто способен одолеть её. Это по плечу тебе, поскольку в твоём распоряжении классная магия, не так ли? ...Я же теперь бесполезен. Я больше ничего не могу сделать..."""
,"""............Охохонюшки. Неужели ты совсем сдался?"""
Ushiromiya Battler,"""Что значит, сдался?! Как, по‐твоему, мне это объяснить?! Вылезающие из земли и падающие башни! Огромные великаны со щитами, метающие копья!"""
Ushiromiya Battler,"""А‐а, при одном воспоминании мне дурно становится, ведь уже и рассуждать бесполезно, не так ли?!! Мы оставили уровень уловок и объяснений посредством людей‐преступников! А‐а‐а‐а‐а‐а, блин‐блин‐блин‐блин!"""
,"""Успокойся. ......Я не более чем фигура на игровой доске этого дитя. Будучи убранной с игровой доски, я больше не являюсь сущностью, способной что‐нибудь сделать."""
,"""Но именно ты её противник. Поскольку пока ты не сдашься, ты всегда будешь иметь возможность нанести ей ответный удар."""
Ushiromiya Battler,"""Заткнись! Разве не ты тоже декламировала странные заклинания и призывала башни и копья?!!"""
Ushiromiya Battler,"""Какие ещё ответные удары?! Ты собираешься научить меня магии, чтобы я принял участие в том масштабном магическом бою?!!"""
,"""......Если хочешь, я могу немного поучить тебя магии."""
Ushiromiya Battler,"""О, как раз то, что мне надо! Будь добра, надели меня крутой магией, позволяющей раздробить ей грудь одним ударом! Ха, не компостируй мне мозги!"""
,"""Я слышала, что в японской магии есть ритуал молитвы для призыва дождя. Тебе известно о ней?"""
Ushiromiya Battler,"""Ритуал дождя? Это когда бросают вещи в огонь и танцуют? ......Так это не магия. Говорят, что огонь создает восходящую тягу, в результате чего собираются дождевые облака. Это общепринятое научное явление."""
,"""О? ...А я полагала, что это некая форма восточной магии, но это не магия? Я считала, что люди предлагали священный огонь небесам, включая танец уважения, чтобы мольба о дожде достигла богов."""
Ushiromiya Battler,"""Может, люди так и поступали давным‐давно. Но большинство оккультных вещей получили научное объяснение."""
,"""Почему вещи горят? Не потому ли, что они содержат флогистон?"""
Ushiromiya Battler,"""......Нет, горение происходит вследствие химической реакции. Лавуазье опроверг теорию флогистона."""
,"""Почему тепло передаётся через предметы? Не потому ли, что материал содержит калории?"""
Ushiromiya Battler,"""...Если не ошибаюсь, это опроверг Джоуль. Тепло является энергией, а не веществом."""
,"""Ты хорошо учился. Твои знания верны."""
Ushiromiya Battler,"""...Но это всего лишь общеизвестные факты."""
,"""Флогистон, калории и со временем даже любовь божья. ......Все они становятся бессильными перед научным объяснением. В прошлом меня учили, что яблоко падает с дерева, благодаря любви божьей, чтобы людям досталась еда."""
Ushiromiya Battler,"""Любовь божья вместо силы притяжения? ...Ну, это, скорее, пережитки периода, когда всё вокруг предпочитали объяснять религией вместо науки."""
,"""Совершенно верно. В прошлом люди называли предел своих знаний... Нет, само своё невежество, магией. ...Совсем как в случае с тем ритуалом дождя, о котором мы говорили."""
,"""Знали ли люди в древние времена о существовании научного объяснения, что огонь вызывал тепло для создания восходящей тяги, призывающей облака? Даже без понимания сути процесса, они, как минимум, знали результат."""
Ushiromiya Battler,"""......Такое наверняка частенько происходило. Есть так называемая мудрость предков. Даже не понимая причины, благодаря опыту, они знали, что достигнут результата. ...Явления, чьих принципов действия они не понимали, были для них всё равно что магией."""
,"Как и сказала эта особа, древние люди, не знающие принципов действия, наверняка верили, что через ритуал дождя их желание достигнет небес и вызовет дождь."
,Для них это определённо была магия.{n}Пока они не понимали восходящую тягу...
,"""Если нажимаешь на переключатель, загорается свет. ......Дети не знают научные принципы зажжения лампочки, им известен лишь результат, когда они нажимают переключатель. Если они получают результат без знания принципов, разве это не магия для них?"""
Ushiromiya Battler,"""............Очень интересно. ...Ну, логически это так. ...Например, я не имею понятия, почему электронно‐лучевая трубка показывает изображение в телевизоре."""
Ushiromiya Battler,"""Однако я считаю совершенно обычным видеть изображение в телевизоре. Даже если я не понимаю принципов работы этой трубки, я хотя бы знаю, что, нажав на переключатель, я смогу посмотреть телевизор."""
Ushiromiya Battler,"""...Аналогично и с ритуалом дождя без понимания восходящей тяги. ......Другими словами, если я не знаю принципов работы, даже телевизор кажется магией. Нет, можно ли сказать, что это и есть магия?"""
,"""Ты знаешь, из чего сделаны электронно‐лучевые? Тебе доводилось разбирать их и заглядывать внутрь?"""
Ushiromiya Battler,"""......Не‐а. Помнится, я однажды читал об этом в книжке, но материал оказался сложноват для меня, так что я ничего не понял. Если не ошибаюсь, электроны бьют флуоресцентный материал, из‐за чего возникает свечение или что‐то в этом роде..."""
,"""Врёт всё твоя книга. На самом деле в этих трубках заперты маленькие человечки под названием гремлины, которые и делают всю работу магией."""
Ushiromiya Battler,"""А?! Что за вздор, такого не может быть!"""
,"""Как ты можешь отрицать это, если никогда не заглядывал внутрь электронно‐лучевой трубки?"""
Ushiromiya Battler,"""......Хоть и не заглядывал, но могу заявить, что маленьких человечков определённо не существует!"""
,"""Поскольку здесь нет такой трубки, это невозможно доказать."""
Ushiromiya Battler,"""Д‐да, прямо сейчас это не доказать, но позже я могу где‐нибудь разобрать телевизор, показать тебе трубку и сразу же выиграть спор!"""
,"""То есть, другими словами, мою 'магическую теорию' о гремлинах, запертых в электронно‐лучевой трубке и выдающих изображение при помощи магии, невозможно опровергнуть, пока мы не взглянем внутрь этой трубки, верно?"""
Ushiromiya Battler,""".........Э... Ёлки‐палки, опять это? Намекаешь, что это 'Доказательство дьявола'? Это ваш излюбленный ведьмовской трюк."""
,"""Доказательство дьявола представляет собой форму коварной софистики, основанной на заявлении о невозможности доказательства отрицательного факта. Однако это отличается от того, что я сказала о электронно‐лучевых трубках. Спор о трубках можно завершить, разобрав на части какой‐нибудь телевизор."""
Ushiromiya Battler,"""......Ты права. Это не 'Доказательство дьявола'."""
,"""Научная теория, предлагаемая тобой и магическая теория, предлагаемая мною. ...Одна из них является правдой. И убедиться в правдивости одной из них можно, стоит только заглянуть внутрь электронно‐лучевой трубки. Однако, пока этого не произойдёт, мы не можем отрицать теории друг друга."""
,"""Так что хоть и имеется лишь одна правда, пока ты не заглянешь в электронно‐лучевую трубку, то возможно существование двух конфликтующих правд. ......Иная вселенная, где при необходимости существования одной правды, одновременно могут существовать две правды."""
,"Жива или мертва кошка в ящике?{n}Если ты откроешь ящик, то узнаешь ответ. Ты узнаешь ответ."
,"Однако, пока ты не откроешь ящик, ты можешь утверждать, что кошка жива, а также, что она мертва."
,"Каждая из противоборствующих сторон заявляет, что их правда ""верна"", и как бы не конфликтовали обе стороны, ни одна не победит, пока ящик останется закрытым."
,"Другими словами, существует две правды одновременно."
,"И хотя в ящике может быть лишь одна кошка, в нём, как в странном параллельном мире, находятся мёртвая и живая кошки."
,Таким местом сейчас является Роккенджима.
,"......Этот остров на данный момент представляет собой место, где одновременно существуют научная и магическая теории."
,"...На взгляд представителя науки вроде тебя, может показаться, что этот остров засосало в мир магии."
,"Может и так, но не совсем точно."
,"Строго говоря, он переместился из мира науки в пробел между этим миром и миром магии."
,"Поэтому на посторонний взгляд может показаться, что мир склонился в сторону магии."
,......На самом же деле данный остров находится в идеально неопределённом положении по отношению к противоборствующим мирам.
Ushiromiya Battler,"""......Не совсем понял... Пробел между реальностью и магией? Идеально неопределённый мир? Как так? Разве дела у меня постоянно не шли неважно?!"""
,"""Тогда, быть может, тебе следует размышлять в таком ключе. Это судебное разбирательство. Воспринимай это как суд, где ты и {f:5:Беатриче} выдвигаете противоположные иски. Совсем как дело об электронно‐лучевой трубке."""
,"""Это дитя заявляет, что в электронно‐лучевой трубке сидят маленькие человечки. И она объясняет одну вещь за другой, рассказывая о жизни человечков, как они выглядят, каким типом магической силы наделены. ......А ты?"""
Ushiromiya Battler,"""......Ну, а я сижу в библиотеке и привожу контраргументы, объясняя строение электронно‐лучевой трубки."""
,"""На данный момент твое заявление и заявление этого ребёнка существуют в суде одновременно. ......Если ты выслушаешь заявление этого ребёнка, то можешь воспринять его как правду. И начать видеть его как правду.{i:Именно это тебе и продемонстрировали}."""
Ushiromiya Battler,"""........................"""
,"""В данный момент ведьмы и магия могут существовать на Роккенджиме как правда. ...Однако пока не открыт ящик с кошкой, в этом мире наличествует неопределённость. Вся ситуация может быть объяснена обеими сторонами одновременно. Правда, в свою очередь, существует лишь одна."""
,"""Правда становится единой посредством наблюдения, и бесчисленные правды сплетаются в одну правду. Совсем как в суде, когда судья выносит приговор. Две правды из заявлений прокурора и защитника связываются приговором, преображаясь в одну."""
Ushiromiya Battler,""".........Выражаясь твоими словами... Этот остров является миром до заглядывания внутрь электронно‐лучевой трубки, так? Таким образом, ни научную, ни магическую теорию нельзя отрицать. А поскольку их нельзя отрицать..."""
,"""Обе могут существовать как правда. Это значит, что ведьмы с магией могут существовать. ...Однако в то же время твоё отрицающее мнение тоже существует как правда."""
,""".........Это мир, в котором одновременно могут существовать две конфликтующие вещи. И это мир, где две конфликтующие правды не могут опровергнуть одна другую. .........Теперь ты понял?"""
Ushiromiya Battler,"""..................Другими словами... какую бы крутую магию Беато бы мне ни демонстрировала... Это будет всего лишь заявление со стороны магической теории, не опровергающей мою."""
Ushiromiya Battler,"""Итак, 'какую бы магию Беато ни показывала, в данном мире это не может стать абсолютным доказательством существования'."""
,"""Именно так. Это дитя может даже попытаться объяснить падение яблока с дерева посредством магии. Она может взмахнуть своей трубкой и сорвать яблоко при помощи магии, {i:заявив}, что это она заставила его упасть на землю."""
,"""Однако это будет не более чем одно из её заявлений. Ни одно из её заявлений не может помешать тебе сделать своё заявление. ......При таком раскладе данный мир довольно‐таки беспристрастен к обеим сторонам."""
Ushiromiya Battler,""".........Я понял... И всё‐таки. Следуя такой логике, если я приведу веский аргумент при помощи 'научной теории', и он столкнётся с её 'магической теорией', то мне всё равно не выиграть у неё. Более того, окончательный приговор не последует, пока мы не заглянем в электронно‐лучевую трубку."""
Ushiromiya Battler,""".........Да и где в этом мире взять электронно‐лучевую трубку? ...А значит и спора у нас не выйдет. ......Разве не дурно было бы, поладь мы и оба загляни в электронно‐лучевую трубку?"""
Ushiromiya Battler,"""Если там есть маленькие человечки, то её взяла. Если нет, то моя победа. ......Зачем нам продолжать этот спор не заглядывая в трубку?"""
,"""Это и есть 'игра', в которой она бросила тебе вызов. Наверное, вместо суда мне следует в качестве примера привести шахматы. Победа или поражение не определяются судьёй. Вы сами определяете, что есть что."""
Ushiromiya Battler,"""......Можно ли выиграть в споре с оппонентом в двинутом мире, где одновременно существуют несколько правд?"""
,"""Ты на {i:самом} деле проиграл в споре и вот так сдался?"""
Ushiromiya Battler,"""...............Хе. ...Хе‐хе‐хе."""
,"""Вот и всё, что я пока могу тебе посоветовать. Если хочешь, я могу время от времени давать тебе советы."""
