Speaker,Russian (RU)
Leviathan,"""Эй! Он мо‐ой! Отда‐ай!"""
Beelzebub,"""Нет, не‐е‐ет, я съем его‐о‐о! Асмо, Асмо, отстань!"""
Asmodeus,"""Кья‐ха‐ха‐ха! Левия онее‐сама, здесь~!"""
,"Где они его стащили, хотела бы я знать.{n}И теперь они с шумом и гамом дрались из‐за какого‐то пончика."
Satan,"""Э‐э‐э‐э‐эй! Энджи‐сама читает, так что не могли бы вы хоть немного угомониться?!"""
Lucifer,"""А сама‐то как громко кричишь, Сатана! Тише! Вот глупые сестры!"""
Satan,"""Чего орёшь, Люцифер онее‐сама?! Т‐тебе что‐то не нравится?!"""
,"Самая старшая и третья по старшинству сестры вовсю спорили друг с другом. Даже при присущей им раздражающей быстроте перемещения, было немного смешно наблюдать, когда они пытались сдерживаться."
,Они были наделены удивительной схожестью друг с другом.
Belphegor,"""*смешок*смешок*. Вам позволено шуметь, но вы немного переборщили. Может быть, всё же можно потише?"""
Ushiromiya Ange,"""............Они могут делать всё, что душа пожелает. Это ведь куда приятнее, чем смешки в классе."""
Mammon,"""Энджи‐сама‐а‐а‐а, быстро перелистните страницу! Вы читаете слишком ме‐е‐едленно!"""
Ushiromiya Ange,"""Мамона, ты любишь читать? А ты заметила, что делаешь некоторые вещи хуже, чем я?"""
Belphegor,"""Мамона отвечает за алчность. ......Туда же входит и жажда к знаниям. Но она хочет, чтобы эти знания принадлежали лишь ей, так что имейте в виду, она не даёт людям свои книги, а то и вовсе сжигает их после прочтения."""
Mammon,"""Мне нравится изучать вещи, о которых помимо меня никто и духу не ведает. Я люблю делать то, что другому сделать не под силу. Я люблю и теорию, и практику. Потому что хочу знать то, что больше никто не знает."""
,"Когда она говорила, её глаза сверкали, она посмотрела на раскрытую страницу и прочитала её ещё раз."
,"Можно было понять, что грех сделал её жаждущей прочитать ту страницу, и её жажда была в разы больше моей."
,"Как можно было заметить, моя магическая сила выросла по сравнению с той, которой я владела в первый день их призыва."
,Сейчас мне было под силу призвать всех семерых сестёр чистилища и спокойно читать книгу.
,"То место, хоть я и не помню, {i:где} оно находилось, было тихим и спокойным, а рядом стояла скамья."
,"Тогда я была совсем мала, потому и не помню."
,"......Но мне запомнилось, что те деньки, которые я там проводила, были очень беззаботны."
,"Тогда с мамой, папой... и даже братиком, мы провели редкий счастливый денёк, пока были вместе... это прочно вписалось в мою память..."
,"Прохожие, сновавшие туда‐сюда, совсем не замечали меня.{n}Они попросту игнорировали меня и шли мимо, будто всё было в порядке."
,"Даже откровенное одеяние семи сестёр не смущало их, ведь они их не видели."
,"Если подумать, то я уже привыкла к нему. При условии, что меня {i:саму} не заставляют его носить."
,"Я сидела на стильной скамье, запоминая хронологию мировой истории."
,"......В академической системе, основанной на коллективной ответственности, отсутствует терпимость к лентяям."
,"Казалось, что для школы я была чересчур среднего класса."
,"Согласно разговору тех заумных девиц у всего класса бы резко повысился средний балл, улучшь я свой собственный."
,"......Они любезно показали мне график, сделанный цветными ручками на листе ватмана B4."
,"...Я думаю, решение рассказать им всё было неправильным."
,"Но слово — не воробей, я уже выложила им всё, что думала. ......А, да я уже забыла об этом из‐за моей постоянной меланхолии."
,"Семь сестёр иногда возмущались, иногда сострадали, а иногда и плакали вместе со мной."
,"......Я действительно рада тому, что могу разделить с ними ношу моих переживаний как с друзьями."
,"Согласно им, поначалу они были мебелью, созданной для проведения кровавого ритуала {f:5:Беатриче}."
,"......А судя по записке из бутылки, которая мне совсем не нравится, некоторые из них даже нападали на мою семью."
,"Но я считаю, что бессмысленно подвергать их сомнению."
,"Они мебель, и потому вынуждены повиноваться господину."
,"Даже если они действительно нападали на мою семью, я не могу ненавидеть их."
,"......Потому что я ненавижу Золотую Ведьму {f:5:Беатриче}.{n}.........Или главную подозреваемую, тётю Еву."
Mammon,"""......Энджи‐сама, скорее, страница, следующая страница!"""
Ushiromiya Ange,"""Ох, прости. .........Я утомилась. Не возражаете, если я отдохну?"""
Asmodeus,"""Кья‐ха‐ха! Энджи‐сама решила прерваться!"""
Beelzebub,"""Играть, давайте играть! Энджи‐сама, давайте по‐и‐гра‐ем!"""
,"Заметив, что я перестала читать, самые активные и младшие сестры сбежались вокруг меня."
,И это ещё не всё.
,Возникли даже Мария онее‐чан и Сакутаро.
,"Похоже, всё это время они находились рядом, но спрятались, чтобы не мешать мне."
Sakutarou,{p:0:『}Урю‐! Энджи~! Как учёба? Как учёба?{p:0:』}
Mammon,"""Кья‐я‐я‐я! Сакутаро‐! Как дела?!"""
Leviathan,"""Эй! Я тоже хочу его обнять!"""
Lucifer,"""Не мы ли говорим, что кто успел — тот и съел?! Кья‐я‐я, очаровательно, очаровательно!"""
Sakutarou,"{p:0:『}Урю‐ю‐у, вы ведь сломаете меня‐! Урю‐ю‐у!{p:0:』}"
Belphegor,"""Всё, твоему счастью пришел конец, когда ты появился, пришли и все семь сестёр. Сдавайся! А мы обни‐и‐имем тебя!"""
Satan,"""Давай! Он ведь всегда не хочет! Я прошу прощения за моих придурошных старших и младших сестер!"""
Ushiromiya Maria,"""А‐ха‐ха‐ха‐ха‐ха. Все просто рады видеть Сакутаро. ...Как дела, Энджи? Как учёба?"""
Ushiromiya Ange,"""Спасибо. Ну, неплохо."""
Ushiromiya Ange,"""Мой балл по тесту был достаточно хорош, чтобы обойти учениц из параллельного класса. Их чувства солидарности мне достаточно, чтобы расплакаться. ......Ну, по крайней мере, это лучше, чем просто запоминать."""
Sakutarou,"{p:0:『}Урю. Я уверен, что ты хорошо учишься, Энджи. У тебя обязательно будет большой балл, урю~~.{p:0:』}"
Ushiromiya Maria,"""Хорошая работа. Просто у Марии всегда был маленький балл, вот она и завидует. Старания ведь всегда будут вознаграждены."""
Ushiromiya Ange,"""Ты шутишь. Если дело доходит до английского, латинского и оккультных знаний, твоя память куда более удивительна."""
Ushiromiya Maria,"""Мария помнит всё, связанное с магией, но то, что ей неинтересно, она не запоминает совсем. И всё это 'неинтересное' обычно связано с учёбой."""
Ushiromiya Ange,"""Ну, понятно, что оккультизм вполне подойдёт, но твой балл по английскому и подобным предметам, должно быть, очень велик?"""
Ushiromiya Maria,"""В первом классе начальной школы, когда был тест по японскому, Марии была дана картинка пистолета и четыре квадратика, в которые нужно было вписать слово 'пистолет'. Вписала '{ruby:rifle:ружьё}', {ruby:ra‐i‐fu‐ru:{p:0:ライフル}}, и его зачеркнули."""
Ushiromiya Ange,"""Но почему? Оно подходит."""
Ushiromiya Maria,"""Подразумевалось японское именование пистолета, {ruby:te‐p‐po‐u:{p:0:てっぽう}}. Марии сказали, что это неправильно потому, что в первом классе ещё не изучают катакану."""
Ushiromiya Maria,"""......Мария действительно не поняла, и на всех следующих тестах писала хираганой. Из‐за чего попала в перепалку с учителем. С мамой тоже."""
Ushiromiya Ange,"""....................Наверное, ты родилась в неправильной стране, сестричка."""
Ushiromiya Maria,"""Тогда Мария хотела бы родиться в стране ведьм и поступить в школу для ведьм. У‐у."""
Sakutarou,"{p:0:『}Если бы это случилось, у тебя могли бы появиться друзья с намного, намного более чудесной магией! Урю‐!{p:0:』}"
Ushiromiya Maria,"""У‐у{p:0:♪} Но сейчас же Мария не против всего. В конце концов, Мария может использовать много магии и у неё много волшебных друзей. Только Сакутаро уже было бы достаточно для Марии."""
Sakutarou,"{p:0:『}Я не единственный! Ещё есть Сакусуке и Сакукичи, музыкальная группа животных, морской котик Шимода‐кун, кролик Санае‐сан, Мистер Пиг‐кун, и многие другие!{p:0:』}"
,......Невероятно. Число друзей сестрички продолжает увеличиваться.
,"Каждый раз, когда я спрашиваю, число имён её друзей увеличивается.{n}Но, нет сомнений, Сакутаро её лучший друг."
,"...Я немножко завидую тем, у кого есть лучшие друзья."
Ushiromiya Maria,"""......О чем думаешь? О Семи Сёстрах? Ты ведь живешь с ними, да?"""
Ushiromiya Ange,"""Они очень энергичны. Иногда они говорят странные вещи, но они не плохие. ...Я бы хотела себе такую симпапусечку, как Сакутаро, но и быть рядом с ними мне достаточно."""
Ushiromiya Maria,"""*смешок*. Если бы я лучше знала Магию Воссоздания, то я бы сделала тех друзей, которых ты так хочешь, Энджи. А для тебя Воссоздание пока слишком трудно."""
Ushiromiya Ange,"""Существует определённая разница между Созданием и Вызовом. ......А воскрешение уж и подавно от них отличается."""
Ushiromiya Maria,"""............Так получается, что твое самое сокровенное желание — воскресить семью?"""
Ushiromiya Ange,"""Да. .......И у меня есть способ. Вот это."""
Ushiromiya Maria,"""Верно. ...Твоя заколка станет ключом к призыву Баттлера. ......А всё остальное зависит от того, как ты подготовишься, Энджи."""
Ushiromiya Ange,"""Хоть я даже и не знаю, сколько времени займёт, всё равно слёзы на глазах выступают."""
Sakutarou,"{p:0:『}Урю... Мужайся, даже если тебе тяжело... Если ты не сдашься, Энджи, твоё желание когда‐нибудь обязательно сбудется.{p:0:』}"
Ushiromiya Ange,"""Если кто‐нибудь смог дать мне гарантию, что оно сбудется, то тогда у меня хотя бы здорово полегчало на душе."""
Sakutarou,{p:0:『}Урю! Тогда я гарантирую тебе! Твоё желание однажды вне всяких сомнений сбудется!{p:0:』}
Ushiromiya Ange,"""Спасибо. Я рада и такому утешению."""
Sakutarou,"{p:0:『}Это не утешение, урю.{p:0:』}"
Ushiromiya Maria,"""Перестань, Энджи. Такое чувство может преобразиться в антимагический токсин. Тогда как нет лучшего семени, порождающего магическую силу, чем чувство, что твои мечты обязательно сбудутся."""
Ushiromiya Ange,"""...............Пожалуй, что так. Извини, наставница."""
Mammon,"""Вам надо быть поалчней, Энджи‐сама. Заходите так далеко, насколько это потребуется ради обретения объекта ваших желаний! Вам не достаёт силы воли не сдаваться до тех пор, пока не заполучите желанное!"""
Sakutarou,"{p:0:『}Урю‐! Неправда, Энджи старается изо всех сил!{p:0:』}"
Ushiromiya Ange,"""Спасибо, Сакутаро, Мамона. Однако сокрушениями по этому поводу делу не поможешь. Мне ничего не остаётся, кроме как держаться. Я буду упорно трудиться. Стиснув зубы. И обязательно заставлю свои мечты сбыться. Непременно."""
Sakutarou,"{p:0:『}Урю! Ты потрясающая, Энджи, удачи тебе! Мамона и я будет поддерживать тебя!{p:0:』}"
Mammon,"""Да, мы поддержим вас. Чем алчней наша госпожа, тем выше наша цена."""
Beelzebub,"""Что важнее, Энджи‐сама‐а! Нас наконец‐то набралось тут 10 человек!"""
Asmodeus,"""Мы собирались все вместе сыграть в {c:86EF9C:ширитори} или что‐нибудь в этом роде!"""
Beelzebub,"""А за проигрыш — наказание! Дайте мне потеребить да покусать чьи‐нибудь уш~ки!"""
Satan,"""Ёлки‐палки, у тебя в голове есть что‐нибудь помимо мыслей что пожрать?!"""
Lucifer,"""Пожалуйста, простите моих неразумных сестёр за их дурацкие предложения... Разве вам сейчас не лучше было бы вернуться к учёбе?"""
Leviathan,"""Нет, нет, не‐е‐е‐ет! Я так долго ждала, когда вы закончите учиться, потому не перенесу, если вы не поиграете с нами!"""
Belphegor,"""Полагаю, это неплохая мысль. Наверное, время от времени поиграть полезно, чтобы дать голове развеяться."""
Ushiromiya Ange,"""..........Вы пляшете под дудку лени, верно, Вельфи? Ваши слова разумны, но на деле вы хитрите."""
Belphegor,"""Хмф. Мои извинения. .....Вы усердный человек, Энджи‐сама."""
Ushiromiya Maria,"""Если Энджи не возражает, я тоже не прочь поиграть со всеми. Все такие шумные. Игра определённо будет весёлой."""
Sakutarou,"{p:0:『}Урю! Энджи, Энджи, давай играть, давай играть! Давайте поиграем в ширитори‐!{p:0:』}"
Lucifer,"""В таком случае давайте начнём с Сакутариного 'урю'. Итак, с чего же тогда начать? 'Рю'? 'Ю'?"""
Ushiromiya Maria,"""С 'урю'? .........Ну‐ну. Может, всё‐таки не с 'рю'?"""
Ushiromiya Ange,""".....Слово с таким окончанием редко когда встретишь."""
Mammon,"""Тогда я первая! Начну с 'рю'! '{ruby:ryuuzu:Смотровой стебелёк}'!"""
Leviathan,"""Я первой хотела это сказать! '{ruby:ryuuto:Лютня}' сгодилось бы идеально!"""
Ushiromiya Ange,"""'Зу'? Что‐то нам сплошь сложные окончания попадаются. Секундочку, а в каком порядке мы идём? Кто следующий?"""
Sakutarou,"{p:0:『}Урю. Думаю, это не важно. Кто первый что‐нибудь придумает, пусть то и выдаёт.{p:0:』}"
Ushiromiya Maria,"""Даже так? Звучит интересно. Победит тот, кто предложит больше вариантов. Ширитори на скорость!"""
Beelzebub,"""Тогда я скажу! 'Зуччини'! '{ruby:ninniku itame:Чесночная подлива}'! 'Мекабу и паста'~! И все они вкуснющие! Кья‐ха, я сказала все три!"""
Belphegor,"""Вельзи три очка. ......А можно использовать словосочетания?"""
Satan,"""Если воспользоваться союзом 'и', то всё сгодится! Последнее не в счёт! Минус одно очко! Начнём с 'мэ'."""
Ushiromiya Maria,"""Тогда {f:5:Мария}. '{ruby:merenge:Меренга}'~!"""
Sakutarou,"{p:0:『}""Гэ""??? У... у... урю‐!{p:0:』}"
Lucifer,"""'{ruby:gesuidou:Дренажная система}', '{ruby:umetatechi:обретённые земли}', '{ruby:chikashitsu:подвал}'. Что‐то вроде такого?"""
Leviathan,"""Онее‐сама, всё это неизящные слова, *хи‐хи*!"""
Lucifer,"""Н‐ну и что, тогда почему бы тебе ни придумать что‐нибудь изящное в продолжение! В любом случае, мне три очка. Дальше 'цу', хорошо? 'Цу'!"""
Ushiromiya Maria,"""Никогда прежде не играла в такое странное ширитори. У‐у‐у! Интересно!"""
Sakutarou,"{p:0:『}Урю! Я совсем ничего не понимаю, но это интересно. Урю‐!{p:0:』}"
,"Мне доводилось играть в нормальное ширитори, но в такое странное ещё нет."
,"Есть только бойкие семь сестёр, Мария онее‐чан, Сакутаро и я."
,Теперь я окружена друзьями и мне так весело.
,.....Смелость принять мир магии и мир ведьмы...
,"Одно это не изменило факта, что я всё ещё была заточена в этой академии без единой подруги из своего класса."
,"Но несмотря на это, я так весело и энергично провожу время."
,".........Я тоже стану ведьмой, как Мария онее‐чан."
,И когда‐нибудь добавлю в этот весёлый кружок свою семью.
,"Папу, маму. И братика."
,".....И, если получится, Джорджа онии‐чана и Джессику онее‐чан. И всех остальных родственников."
,"Я призову сюда всех, всех без исключения, каждого человека... И мы соберёмся дружной компанией."
Ushiromiya Ange,""".....Такова... моя мечта. .......Точно. Пока я не преуспею в этом, я ни за что не отчаюсь."""
Mammon,"""Я уверена, вы станете Великой Ведьмой, Энджи‐сама. Пока в вас есть вера. Мы, семь кинжалов чистилища, всегда будем прислуживать вам до прихода этого дня."""
Ushiromiya Ange,"""Ты будешь здесь? И неважно, сколь долгим будет срок... ты поделишься со мной своей силой?"""
Mammon,"""Разумеется. Ведь я, как‐никак, ваш друг, верно, Энджи‐сама?"""
Ushiromiya Ange,"""........................Да, это так. Давайте поиграем вместе в дружной компании. Сегодня, в будущем... и всегда... всегда."""
Mammon,"""До того дня, когда сбудутся ваши мечты, Энджи‐сама."""
,"Бойкая игра в ширитори на десять персон, изредка прерываемая улицей, под непрерывными яркими лучами солнца, могла продолжаться вечно..."
,""".......Нет, ну в самом деле. {i:Как это понимать}, Уширомия‐са‐ан?"""
Ushiromiya Ange,"""........................."""
,....В конечном итоге мне не удалось получить достаточно хорошую оценку по контрольной.
,"Я попыталась по‐своему запомнить материал, но если бы всё запоминалось одной зубрёжкой на всю ночь, никому бы не пришлось беспокоиться о тестах."
,"""Обычно, если заранее знаешь вопросы, можно же с лёгкостью хорошо написать, верно? С лёгкостью!"""
,"""Да, мы, конечно, не написали тебе ответы на них. Поскольку подумали, что ты выучишь достаточно материала и сдашь тест."""
