Speaker,Russian (RU)
,"""Какого чёрта? Ты это серьёзно? Поверить не могу! У тебя почти повсеместно отвечено неправильно. Ты хоть училась как следует?!"""
Ushiromiya Ange,"""..............Более и менее..."""
,"""Такой результат 'более и менее' не назовёшь, Уширомия‐сан. Он настолько ужасен, что голова кругом идёт, понимаешь?"""
,"""О, Господи. Прошу, прости её за получение столь ужасной оценки за столь простейшую контрольную, из‐за чего средний балл класса упал ниже некуда!"""
,"""*хи‐хи*хи‐хи*хи‐хи*, *хи‐хи*хи‐хи*хи‐хи*, аха‐ха‐ха‐ха‐ха."""
,"......Эту контрольную сначала написал другой класс.{n}Моему классу удалось заполучить листок с контрольными вопросами, поэтому средний бал за эту контрольную оказался необычайно высок."
,"Достаточно высок, чтобы затмить моё лёгкое усовершенствование знаний."
,"Однако... имелось несколько вещей, которым я не могла найти оправдания."
,"Если бы я потратила целый день, учась как сумасшедшая, то смогла бы получить оценку повыше."
,"......Но увы, я так не поступила."
,"Ведь тот день я потратила время на весёлую игру в ширитори с Семью Сёстрами, Сакутаро и онее‐чан."
,"Как и ожидалось, победила Мария онее‐чан.{n}Она оказалась сильным игроком из‐за своих познаний о всяких разных вещах."
,Наказание досталось Сакутаро.
,"Он потратил всё время на подбадривание других давать ответы, совершенно забыв отвечать самому."
,"Из‐за этого его как следует затискали, а его уши зажевали семь сестёр, не так ли?"
,"""Э‐эй, ты слушаешь, Уширомия‐сан?!"""
Ushiromiya Ange,""".................."""
,"Они окружили меня, галдя, как мелкие птахи.{n}И они раздражали и противно пахли."
,Снаружи этого круга находилась Мамона с шокированным лицом.
Mammon,"""Эта школа как обычно не перестает поражать меня своей отстойностью. Разве им не впору порадоваться за собственные хорошие оценки?"""
Ushiromiya Ange,""".........Это, наверное, бодяга по поводу коллективной ответственности. Вместо беспокойства за собственные оценки, их больше заботит постыдность низкого среднего бала у класса."""
Ushiromiya Ange,"""Или, быть может, они ненавидят дежурства, назначаемые в качестве наказания."""
Mammon,"""То есть, другими словами, они учатся не потому, что хотят получить хорошие оценки, а в силу ненависти к дежурствам из‐за коллективной ответственности?"""
Leviathan,"""...Их снедает зависть и гордыня. Им противно ощущать приниженность по сравнению с другими и они не хотят быть униженными. Это единственное чувство, которое подстёгивает их учиться."""
Lucifer,"""Что за шумный народ. Почему они не могут сами этим заняться?"""
Belphegor,"""Получается, без коллективной ответственности и дежурств у них нет никакой охоты учиться. Какой маразм — учиться, не зная значения и смысла учёбы."""
Satan,"""Однако до чего же это тупой и раздражающий сброд! Не смейте отнимать и минуты от ценного дня Энджи‐сама!"""
Asmodeus,"""Уа‐а‐а, ненавижу этих лахундр! Проваливайте!"""
Beelzebub,"""Я е‐е‐есть хочу! Исчезните неме‐е‐едленно, у‐а‐а!"""
Ushiromiya Ange,"""..........Простите, народ. Хотелось бы мне знать, почему {y:0:Люд}{n:0:люд}и такие бесстыжие."""
Mammon,"""Наверное, потому, что чем упорно трудиться самим, им легче заставить усердно трудиться вас и заработать высший средний бал для класса, тем самым потешив свою жадность. ......Все {y:0:Люд}{n:0:люд}и алчны. И они отягощают других своей алчностью, стремясь упростить себе жизнь."""
Mammon,"""Однажды мы обязательно встретимся с ними на горе чистилища. А когда они дойдут до пятой террасы, им лучше смотреть под ноги."""
,"Мамона управляет пятой террасой на горе, доходящей до небес — горе чистилища."
,"Поскольку это заявляет она, то можно не сомневаться — когда эти девчонки умрут, их путешествие на небеса будет не из лёгких."
,"Нет, почему бы им вообще не отправиться в ад."
,Комитет класса отправился в студенческий совет и попросил воспользоваться классом во время большой перемены и после школы.
,"Целью было организовать группу для повторения материала. Чудесное маленькое собрание, чтобы все они могли окружить меня и принудить учиться. Я так благодарна, что щас аж разрыдаюсь."
,"А означало это, что каждый день вся моя большая перемена и вечерние часы шли коту под хвост."
,"Академия и её студенческий совет, исповедующие принцип ученического самоуправления, моментально дали добро на приятное занятие, которое ученики выбрали по собственной инициативе..."
,"Другими словами, побег из класса после школы был мне отрезан."
,После школы тут же началось первое заседание ученической группы.
,"Открыли ли они учебник и любезно и тщательно объяснили мне материал так, чтобы даже я могла бы его уяснить? Ага, щас, мечтать не вредно."
,Дюжина моих одноклассниц окружила мою парту.
,"Но перед тем, как начать учиться..."
,"Почему мои оценки столь ужасны? В чём причина?{n}Было решено, что мы не сможем начать, пока я чётко не отвечу на эти вопросы, не осознаю свою неправоту и не раскаюсь в своих поступках."
,".....Разумеется, я никак не могла ответить на такой вопрос."
,"Они стали презирать меня. Они отвергали меня и держали на расстоянии, чтобы я не могла влиться в их общество."
,Поэтому я сама стала чураться их общества. Так между нами не возникло бы конфликта.
,"Так что хоть эта группка и горела желанием повысить средний балл класса, они со всей очевидностью держали меня на расстоянии."
,"Даже попытайся я присоединиться к ним, они наверняка бы проигнорировали меня, как делали это в прошлом."
,"""Если попросишь, мы тебя чему угодно научим. Ла‐а‐а‐адно?!"""
,"""""""Ла‐а‐а‐а‐а‐а‐а‐адно?!!"""""""
,"Они начали заводиться. Я, в свою очередь, уже была сыта по горло их ханжеством и лицемерием."
,"""Уширомия‐сан, что в тебе плохо, так это отсутствие чувства локтя. Тебе не следует думать, будто всё в порядке, пока довольна только ты."""
,"""Собравшиеся под крышей Святой Люции должны владеть дружественной душой. Так ведь гласит книга для учениц, верно?"""
,"""Я считаю, что дружественная душа, это то, что порождает желание учиться вместе и делать вклад в весь класс. Полагаю, именно этого тебе недостаёт, прежде чем браться за учёбу, Уширомия‐сан. А как ты сама считаешь?"""
,"""Э‐эй, ты нас слушаешь?! Мы тратим своё послешкольное время, чтобы сказать тебе это ради {i:твоего же блага}, ты понимаешь?!"""
,..................Да я щас прямо всплакну от благодарности.
,"Разумеется, им это не понравилось."
,"""Со стороны это выглядит так, словно мы тебя обижаем"", — выговорили они мне."
,"К счастью, меня нелегко довести до слёз.{n}Если мне говорят не плакать, я могу сдержаться."
,Сначала меня заставили написать покаянное письмо и зачитать его вслух.
,"И, разумеется, это надо было сделать сегодня."
,Комитет класса вежливо обратился в студенческий совет и учительскую для продления времени использования класса.
,".....Похоже, согласие было дано моментально."
,"А это означало, что, начиная с этого момента, я была приговорена к самокритике на битых пять часов..."
,Уширомия Энджи получила низкую оценку по контрольной и доставила неприятности своим одноклассницам.
,"""Нет, не то, не ясно что ли‐и‐и?!"""
,"""Получение тобою плохих оценок и причинение нам неприятностей — ещё не корень всех зол, верно?!"""
,"""Это дух содружества, понимаешь? Дух содружества!"""
,"""Ну‐у же! Почему нам даже приходится учить Уширомию‐сан, как писать покаянное письмо!"""
,Их насмешки сыпались одна за другой.
,"Я выслушала их ""наставления"" и стёрла написанное мною."
,Уширомия Энджи не наделена духом содружества и причинила неприятности своим одноклассницам.
,"""Эй, погоди‐ка секунду, это бессмысленно, если ты всего лишь напишешь сказанное нами, не так ли?!"""
,"""Ты хоть знаешь, что означает 'покаяние'?!"""
,"""Не будет никакого проку, если ты не напишешь это своими собственными словами!"""
,"""Я всегда считала тебя странной, Уширомия‐сан, но это уже перебор! *хи‐хи*хи‐хи*хи‐хи*!"""
,"Даже следование их наставлениям не убавило их насмешек, а им захотелось и дальше помучить меня..."
,"И в течение нескольких часов, без отдыха и даже без возможности сходить в туалет, не говоря уже о возможности перекусить, я вынужденно терпела унижение..."
,Меня вынудили написать текст унижающего меня содержания...
,А в девять часов вечера мне сказали встать и зачитать его вслух.
,Сам текст... был увлажнён слезами и истёрт ластиком.
,"Почерк определённо принадлежал мне. Но сами буквы были бездушны, и я не помнила, что они излагали."
,Всё было написано по их наставлениям.
,"И потому, хоть писала и моя рука, те слова мне не принадлежали."
,"Но меня заставили написать их, а затем зачитать вслух."
,".........И даже спустя столько времени я поразилась, узнав, что, кроме игнорирования и кражи вещей, существуют другие способы обижать людей..."
,"""Э‐эй! Скорее зачитай это вслух!"""
,"""Смотри, сколько людей задержалось тут только из‐за тебя, Уширомия‐сан. Почему бы тебе хоть немного не отблагодарить нас?"""
,"""Не потому ли она не чувствует благодарности, что в ней нет ни крупицы духа содружества?"""
,"""Не волнуйся, Уширомия‐сан. Отныне мы всегда будем вместе. Почему бы не учиться с нами и не изменить себя? Хорошо?"""
,"""*хи‐хи*хи‐хи*""{n}{t}""Аха‐ха‐ха‐ха!!!""{n}{t}""Кья‐хья‐хья‐хья‐хья!!!"""
,"Я стояла, окруженная ими, опустив взгляд на почерневший листок."
,"А затем... я заговорила те унизительные слова, но на меня тут же посыпались насмешки, что, дескать, они меня не слышат и мне следует говорить громче."
,.......Я не могу прочитать это.
,"Я и представить себе не могла, что оказаться принуждённо прочитать унижающий меня текст будет так больно."
,"В горле у меня пересохло. Пальцы задрожали. .....Унизительный текст, написанный моим почерком, ожег мне глаза горячей жидкостью."
,Мир у меня перед глазами расплылся и искривился.
,"Я увидела, как окружающие меня девчонки искривляются и гнутся."
,".....Увидела, как они, искривясь и погнувшись, стали выглядеть так, какими я их себе представляла."
,"Другими словами, таково было моё истинное зрение."
,За этой толпой виднелись мои друзья.
,В их глазах плескалось сострадание.
Ushiromiya Maria,""".......Энджи... мужайся..."""
Sakutarou,{p:0:『}Урю...{p:0:』}
,"Мария онее‐чан и Сакутаро смотрели на меня печальными глазами.{n}Они, похоже, понимали, что даже дешёвые слова сострадания ранят меня."
,".......Они то порывались сказать что‐то, то опускали головы."
Asmodeus,"""Да что творится с этими людьми!"""
Beelzebub,"""Они отвратительны! Они бесят меня! Что весёлого в окружении Энджи‐сама и истязании её?!"""
Leviathan,"""Неприязнь, которую они не могут озвучить, несмотря на свою зависть. Пока они не могут озвучить её, им всё равно, кого мучить. Хуже таких нет никого."""
Satan,"""Энджи‐сама! В подобной ситуации не возбраняется обезуметь от гнева ради вашей же чести! Гнев — адекватное чувство и реакция! Если вы не разозлитесь сейчас, то когда?!!"""
Lucifer,"""Перестань, не подзуживай Энджи‐сама пустой злостью! Если бы Энджи‐сама могла разозлиться, то давно бы уже так поступила!"""
Belphegor,"""Так поступают, если злость может улучшить положение. Однако с объективной точки зрения злость сейчас только ухудшит дело. Это, может, и унизительно, но разумнее всего сейчас будет перетерпеть это."""
Mammon,"""Аха‐ха! Ты и впрямь лентяйка, Вельфи! Кончай валять дурака, мне невыносимо смотреть на это! Я не могу простить их!"""
Sakutarou,"{p:0:『}П‐послушайте, все, успокойтесь... Так мы лишь перегрузим Энджи...{p:0:』}"
Mammon,"""Перегрузим?! Что ты несёшь? Разве сейчас место и время сохранять спокойствие? Мы, мебель, не настолько жестоки, чтобы хладнокровно наблюдать, как унижают нашу госпожу!!!"""
Satan,"""Энджи‐сама! Вы не обязаны зачитывать это унизительное письмо! Если вы не можете испустить гневный возглас, то хотя бы бросьте его на пол!"""
Mammon,"""Вам нет нужды пререкаться с ними, вам не нужно кричать так, чтобы отогнулись! Просто что есть сил бросьте тетрадь на пол! Поступив так, вы сможете продемонстрировать вашу сильную волю!"""
Lucifer,"""Не городи огород, Мамона! Я тебе уже сказала, так?! Если бы Энджи‐сама могла, то давно бы так поступила!"""
Belphegor,"""Моментальной вспышкой эмоций ничего не решишь. Почему ты никак не поймёшь, что после такого поступка Энджи‐сама начнут притеснять ещё сильнее?!"""
Asmodeus,"""Уа‐а‐а‐а‐а‐а‐а!!! Почему это происходит с Энджи‐сама, когда она не сделала ничего плохого?!"""
Beelzebub,"""Не позволить ей поесть и принудить её так надолго задержаться после школы! Мне это противно!"""
Satan,"""И это не только на сегодня, но и на завтра и даже на послезавтра! Довольно, нельзя же просто сидеть там, снося эти издевательства!"""
,"""Эй! Ты нас слушаешь?!"""
,Кто‐то дёрнул меня за волосы.{n}Меня вырвало обратно в жестокую реальность.
,"Мне даже больше не дозволялось слушать семь сестёр, говорящих от моего сердца."
,"Мои волосы подняли вверх, одно из моих украшений для волос открепилось и упало, и я услышала, как оно покатилось по земле."
,Никто не подобрал его.
,"Наоборот, они ненавязчиво избегали его, словно к ним катилось что‐то грязное."
,"Я попыталась отследить своё украшение взглядом, но меня опять дёрнули за волосы."
,"""Почему ты {i:никогда} не слушаешь нас, хоть мы и говорим на очень серьёзную тему?!"""
,"""В одно ухо влетело, из другого вылетело, да? В этой твоей дубовой башке хоть что‐нибудь задерживается?! Возьми себя в руки, а?!"""
,"""Ты соображаешь, какие неприятности нам причиняешь? Ты же не собираешься заявить, что написала всё это с неохотой, поскольку мы заставили тебя, а?!"""
,"""Пока ты не проявишь искреннее и добровольное раскаяние, это не закончится, поняла?! Это не только на сегодня. Это продолжится и завтра и после завтра, поняла?! Не выпендривайся перед нами, ясно тебе?!"""
,"""Я не понимаю, почему ты ещё жива? Это вообще нормально, вот так жить? Я бы на твоём месте уже давно померла!"""
,"""Ты не можешь так жить, не находишь?! Поскольку твоя жизнь будет только мешать другим людям, верно? Я бы на твоём месте такого не пережила!"""
,"""Да, да, я бы тоже умерла. Если бы мир от этого только выиграл, я бы умерла на месте! Ве‐ерно?!"""
Ushiromiya Ange,{a:c:......Тогда умри.}
Mammon,"""Энджи‐сама..."""
Ushiromiya Ange,"""Убейте их всех! Люцифер, ты меня слышишь?!"""
Lucifer,"""Ух... ах..."""
Ushiromiya Ange,"""Вы, семь сестёр чистилища, является невероятной мебелью, способной в один миг убить {y:0:Челове}{n:0:челове}ка, верно?! Вы хвастались мне этим!"""
Ushiromiya Ange,"""Тогда сделайте это! Убейте их прямо сейчас! Прямо здесь и прямо сейчас!"""
Lucifer,"""......Ну..."""
,По какой‐то причине Люцифер медлила.
Ushiromiya Ange,""".....В чём дело? Что случилось?! Вы же смертоносно точная мебель, летающая быстрее, чем успевает заметить взгляд, и моментально пробивающая сердца врагов ведьм, верно? И я приказываю вам, как ваш господин!"""
Ushiromiya Ange,"""Немедленно выполняйте приказ! Убейте! Убейте их все‐е‐е‐е‐ех!!!"""
Lucifer,"""...................Э... Энджи‐сама... Умоляю, успокойтесь..."""
,"Если бы они моментально последовали моему жестокому приказу, завалив класс трупами, в центре которых стояла я..."
