Speaker,Russian (RU)
Ushiromiya Ange,"""...Я, Уширомия Энджи, не наделена духом товарищества и причинила проблемы своим одноклассницам. Причиной этому является не что иное, как мой безмерный комплекс неполноценности по отношению ко всем моим одноклассницам из‐за моей неспособности трудиться. И..."""
Ushiromiya Ange,"""Постыдно, что я вообще живу."""
,"Начиная с этих слов, я больше не читала текст, который они заставили меня написать."
,"Это была моя импровизация, идущая от сердца."
,"Они тоже заметили, что я не произношу ожидаемые ими слова, но хоть они хмурились, ни одна не сказала ни слова."
,И я продолжила.
Ushiromiya Ange,"""Правильно. Постыдно, что я всё ещё жива. Мне следовало уговорить их взять меня с ними в 1986 году. .....Однако же меня не взяли."""
Ushiromiya Ange,""".....Что я вообще здесь делаю? Это не мир, в котором мне следует быть. ............Никто не спасет меня."""
Ushiromiya Ange,"""Какое‐то время... я полагала, будто воображаемые друзья, сотворённые мною, способны спасти меня. Но эти друзья оказались не более чем иллюзией... и не спасли меня. Ведь всё‐таки это не мир иллюзий, а суровая реальность."""
Ushiromiya Ange,"""........Короче говоря... до сегодняшнего дня... я плавала в одних и тех же грёзах. Я ненавидела своих настоящих одноклассниц и жила, общаясь с иллюзорными друзьями. И вот прямо сейчас я с ними порвала. И вот я здесь."""
Ushiromiya Ange,"""............У меня нет семьи. Вдобавок, я отбросила своих друзей. ......У меня больше ничего не осталось."""
Ushiromiya Ange,"""......Почему я не умерла? Кое‐кто недавно задал мне этот вопрос. ...Полагаю, они правы. Почему... я жива, хотела бы я знать? ............Мне следовало погибнуть... в 1986 году. Нет, наверное, я действительно погибла."""
Ushiromiya Ange,"""И однако же... моя убитая душа всё ещё заперта в этой клетке из плоти. Поэтому я спрошу кого‐нибудь. Если никто не ответит... я отвечу сама."""
Ushiromiya Ange,"""Кто‐нибудь... умоляю, дайте мне умереть."""
,"Закончив говорить, я огляделась."
,"Опешившие девушки.{n}Шокированные девушки.{n}Девушки, чей вид говорил, что они понятия не имеют, что несёт эта девчонка."
,"И, с некоторым запозданием, лица девушек, говорящие ""У неё с головой всё в порядке?"""
,*шёпот*. *бормотанье*. А затем *хихиканье*.
,"Когда я приказала друзьям из моих грёз убить их, они не смогли выполнить мой приказ."
,"Поэтому я попросила настоящих {y:0:Люд}{n:0:люд}ей убить меня. Но разумеется, эти девчонки тоже не способны на такое."
,"Другими словами, что грёзы, что реальность — всё едино."
,"Не означает ли это, что, включая этот мир,{n}абсолютно всё является грёзами?"
,"Тогда ведь нет никаких проблем, верно?"
,"В конце концов, в тот день, когда я лишилась своей семьи, я уже умерла."
,"А всё, что случилось после, является не более чем моим бредом, жизнью, мелькающей перед глазами после того, как мне не удалось умереть."
,"Как только я осознала это, я ощутила, как обозреваемый мною мир начал слегка изгибаться и извиваться."
,........Да.{n}Я наконец‐то проснусь.{n}Покину мир грёз.
,"Я чувствую, как теряю сознание."
,"....И хорошо. Ускользай далеко‐далеко, унеси меня ко моей семье..."
,"Поэтому, что бы ни произошло в этом искажённом, стылом мире, меня это совершенно не касается."
,"Я увидела, как толпу растолкал подбежавший учитель."
,"Видать, делающий обход учитель заметил странное сборище людей."
,"Он что‐то громко кричал, подходя ко мне с намерением защитить."
,".......Наблюдая это, я знала, что пришёл мой союзник, пусть хоть и один, и ощутила, как моё сознание слегка вернулось ко мне."
,...............
,"....Единственные, кто могут спасти меня в мире реальности — это настоящие {y:0:Люд}{n:0:люд}и."
,"Никогда, никогда больше я не стану искать убежища в мире грёз."
,...........Это мир {y:0:Люд}{n:0:люд}ей.
,"Единственные, кто способны спасти {y:0:Челове}{n:0:челове}ка... Это сами {y:0:Люд}{n:0:люд}и."
Ushiromiya Maria,"""..........................Что ж, если так ты считаешь, то это твой мир, Энджи."""
Sakutarou,{p:0:『}.......Может ли Энджи так стать счастливой?{p:0:』}
Ushiromiya Maria,"""Если Энджи верит, что это единственный путь к счастью, то только так. Если она неспособна принять синюю птицу в клетке такой, какая она есть, то ей суждено вечно пребывать в поисках."""
Sakutarou,{p:0:『}Урю... Мария... ты порываешь отношения с Энджи?{p:0:』}
Ushiromiya Maria,"""............................Отнюдь. Я поступила так лишь потому, что этого желала сама Энджи. ......Нас, ведьм, иногда подвергают гонениям. Однако мы всегда остаёмся рядом со всеми. И у нас всегда можно попросить помощи."""
Sakutarou,"{p:0:『}......Настанет ли день, когда Энджи снова поиграет с нами?{p:0:』}"
Ushiromiya Maria,"""Или он окажется забыт и никогда не настанет. В мире людей это называется взрослением. И тем не менее."""
,"Если Энджи хотя бы вспомнит, мы всегда будем рядом с ней."
,А покамест... мы будем ждать.
