Speaker,Russian (RU)
,"В этом году розарий был поистине великолепен.{n}Розы расцветали ненормально быстро, словно соревнуясь друг с другом."
,"Там же можно было заметить Кинзо, Канона и Нацухи..."
Ushiromiya Kinzo,"""Снова цветы выросли великолепными. Должно быть, твоя заслуга."""
Kanon,""".........Большое спасибо. Просто в этом году хорошая погода."""
Ushiromiya Natsuhi,"""Благодаря твоим стараниям сад в этом году даже прекраснее обычного. Хорошая работа."""
Kanon,"""Благодарю вас..."""
Ushiromiya Kinzo,"""Если бы сегодняшний день не был таким особенным... мы могли бы за чёрным чаем полюбоваться розами."""
,Кинзо пожал плечами. Сегодня семейное собрание.
,"......Когда доходит до дел других родственников, они не слышат ничего хорошего."
,"Напротив, те, вероятно, планируют перевести разговор на оставшуюся жизнь Кинзо и продолжить междоусобицу по наследству."
Ushiromiya Kinzo,"""......До чего же неприятные люди. Кстати, как там Краусс? План по погашению долгов продвигается?"""
Ushiromiya Natsuhi,"""Этот план выглядит реалистичным......... однако его масштабы весьма велики, и не похоже, что он приносит свои плоды так, как ожидалось."""
Ushiromiya Kinzo,"""По возможности, я надеялся, что что‐то будет готово до сегодняшнего собрания."""
Ushiromiya Natsuhi,"""......Да. Прошу прощения."""
{f:5:Beatrice},"""Кинзо, ты уверен, что можешь беспечно тут разгуливать?"""
,"Как она туда забралась?{n}......Впрочем, бессмысленно задаваться такими вопросами, когда имеешь дело с ведьмой."
,"{f:5:Беатриче} как ни в чём не бывало сидела на крыше беседки, словно греясь на солнце."
{f:5:Beatrice},"""Родственники — сплошной кусок отрицающего магию токсина — будут влиять на нас. Если столкнёшься с ними, твоя душа вмиг испарится."""
Ushiromiya Kinzo,"""Хмф. Я уже мёртв. Даже испарение не будет вредом."""
Ushiromiya Natsuhi,"""......Мы не можем этого допустить. Пожалуйста, ради семьи Уширомия, помогите нам ещё немного."""
{f:5:Beatrice},"""Нацухи. Кажется, катер с родственниками покинул порт. Хорошо бы вам поскорее закончить прогулку."""
Ushiromiya Natsuhi,"""......Да? Спасибо. ...Отец, вернитесь в кабинет, пожалуйста."""
Ushiromiya Kinzo,"""О боже... Позор возвращаться в такую прекрасную погоду."""
{f:5:Beatrice},"""Не ворчи, Кинзо. Сейчас ты не более чем призрак, которому я дала жизнь. У нас с Нацухи будут проблемы, если тебя рассеет токсин. Будь хорошим мальчиком — запрись в кабинете и спрячься под одеялом. *хи‐хи*хи‐хи*!"""
Ushiromiya Kinzo,"""Хмф. ......Одна возможность после смерти полюбоваться розами уже большая удача. Понятно. Сейчас вернусь в кабинет."""
Ushiromiya Kinzo,"""Но я бы хотел чёрного чая. Канон, скажи Генджи принести. Для сегодняшнего дня был бы неплох Марко Поло."""
Kanon,""".......Как пожелаете."""
Ushiromiya Kinzo,"""Что ж, пора расходиться. Нацухи. ......Надеюсь, вы и без меня прекрасно проведёте семейный совет."""
Ushiromiya Natsuhi,"""Конечно, отец. Он не может сказать это при них, но мой муж уже глава семьи Уширомия. И я сделаю всё от меня зависящее, чтобы вести себя достойно его жены."""
Ushiromiya Kinzo,"""......По сравнению с Крауссом, у которого с утра болел живот, ты так спокойна, Нацухи. ......Мой сын безнадёжен."""
Ushiromiya Natsuhi,"""Мой муж талантлив по‐своему. Поддерживать его слабые стороны — мой долг как жены."""
Ushiromiya Kinzo,"""Хм‐м. Постарайся. Я запрусь, чтобы не помешать."""
Ushiromiya Natsuhi,"""Канон. Иди в кабинет с отцом. И скажи Генджи подать чёрный чай."""
Ushiromiya Kinzo,"""Я не так стар, чтобы нуждаться в вашей помощи, когда встаю. Пойду......"""
,"Отказавшись от попытки Канона подать ему руку, Кинзо поднялся с клумбы, на которой сидел."
,Отставной глава оставил всё Нацухи и медленным шагом вернулся в кабинет......
{f:5:Beatrice},"""......Ты неплохо смотришься. У тебя то же чувство собственного достоинства, что у покойной жены Кинзо."""
Ushiromiya Natsuhi,"""На всякий случай. Если токсин, отрицающий волшебство, дойдёт до отца...... магия сразу же рассеется?"""
{f:5:Beatrice},"""Да. В мгновение ока. ......Я могу просто исчезнуть, но если сотрёт и так уже мёртвого Кинзо, его за минуту сдует ветром, как пылинку. Учти это."""
Ushiromiya Natsuhi,"""Да. Понятно."""
{f:5:Beatrice},""".........Ты могла бы стать талантливой ведьмой. Сопротивление к магии накапливалось в тебе год за годом, но ты всё равно ещё способна её понять. ......Если бы мы встретились во времена твоей юности, ты к настоящему моменту могла бы стать могущественной ведьмой."""
Ushiromiya Natsuhi,"""Я жена Уширомии Краусса, жена главы. Чтобы защитить его честь, я бы стала даже ведьмой или демоном. ......Я глубоко признательна тебе за магическую силу. Без тебя я бы не смогла отстаивать честь семьи Уширомия."""
{f:5:Beatrice},"""Давай обсудим это в другой раз. Когда будем вдвоём пить чай."""
Ushiromiya Natsuhi,"""Моя подруга, которая ездила в Шри‐Ланка, прислала мне чёрный чай с прекрасным ароматом роз."""
{f:5:Beatrice},"""Хо, ты про Димбулу. Сойдёт. Тогда захвати с собой и патис. ......Подашь в награду, если у меня получится всех одурачить на предстоящем семейном собрании. Пообещай."""
Ushiromiya Natsuhi,"""Поняла. Обещаю. Что ж, увидимся позже."""
{f:5:Beatrice},"""Да, до скорого."""
,"Ведьма растворилась в шелесте ветра, стала золотыми цветочными лепестками и рассеялась в воздухе."
,"Нацухи посмотрела ей вслед, а потом развернулась на каблуках и направилась к особняку."
,После этого в розарии никого не осталось......
{f:5:Lambdadelta},"""Ну ладно. <Break time>. Есть жалобы на происходящие события?"""
{f:5:Bernkastel},""".........Нет. Если хочешь пи‐пи, беги скорее."""
{f:5:Lambdadelta},"""Как грубо. {p:1:Кинзо мёртв}, верно? Но он ходит и говорит. Ну не магия ли?!"""
{f:5:Lambdadelta},"""Впрочем, сомневаюсь, что после всего такой ход на тебе сработает, Берн. ......Но как насчёт тебя, Баттлер? Разве не странно? Не хочешь признать магию, возродившую Кинзо? Ха‐хи‐хья‐аха‐ха‐ха‐ха!"""
Ushiromiya Battler,"""......Если ты пытаешься подражать Беато, меня это бесит, прекрати сейчас же."""
{f:5:Lambdadelta},"""*хи‐хи*! Заметил?! Ну и, и, как собираешься ответить, Баттлер? Кинзо всего‐то вышел прогуля~ться."""
{f:5:Lambdadelta},"""Почему бы тебе не сделать как обычно, не схватиться за голову и не заорать, что '{i:в этом нет никакого смысла}'?.. Давай, вспомни свою старую коронную фразу '{i:всё это никуда не годится}' и скажи мне свой классический бессмысленный контраргумент."""
{f:5:Lambdadelta},"""Человек, которому полагается быть мёртвым, не может встать и пойти, верно? Всё из‐за неизвестного вируса, называемого синдромом Роккенджимы и вызывающего массовые галлюцинации? Или загадочный вид бабочек, обитающих только на Роккенджиме, оказывается, галлюциногенный?! Или всё из‐за таинственной секретной организации Ямайну, кое‐как сделавшей ранее никому не известный препарат под названием Пурупурупикопуйо, который вызывает массовые глюки?!!"""
{f:5:Lambdadelta},"""Какую ещё сказку ты мне расскажешь? Кья‐аха‐ха‐ха‐ха‐ха‐ха‐ха‐ха‐ха‐ха!!!"""
Ushiromiya Battler,""".........Заткнись уже. Никаких проблем."""
, {p:1:На данный момент дед мёртв}. Он не может существовать.
Ushiromiya Battler,"""Ведя себя так, будто дед существует, тётя Нацухи создала ложь в попытке скрыть его смерть и выкрутиться на семейном собрании."""
{f:5:Lambdadelta},"""О? Ложь Нацухи?! Ты бы смог ложью оживить мертвеца? Разве не значит, что она применила магию?"""
Ushiromiya Battler,"""Этот мир напоминает электронно‐лучевую трубку, прежде чем в неё заглянешь. ......Закрытую кошачью коробку, прежде чем её откроешь."""
Ushiromiya Battler,"""Пока тётя Нацухи говорит, что гуляла с дедом, и пока никто не может это опровергнуть, можно сказать, что 'тётя Нацухи ходила с ним по розарию' в своей действительности. Поэтому дед мог появиться."""
,"*хлоп*, *хлоп*, *хлоп*..."
,Эти крайне нелестные аплодисменты исходили от {f:5:Бернкастель}.
{f:5:Bernkastel},"""......Браво. ............Без Беато поблизости ты гораздо спокойнее."""
Ushiromiya Battler,"""Заткнись. Ты тоже молчи."""
{f:5:Lambdadelta},"""Подожди‐ка, Баттлер. Согласно твоей теории, да, Кинзо может появиться, когда рядом только Нацухи. И если Нацухи утверждает, что видела Кинзо там, где была только она, это уже не опровергнуть."""
{f:5:Lambdadelta},"""Но Канон ведь тоже там был и видел Кинзо? Как ты это объяснишь?"""
Ushiromiya Battler,"""...Нет проблем. Канон — слуга, работающий на семью Уширомия. ......Тётя Нацухи приказала ему подыгрывать ей, чтобы она могла скрыть смерть деда. ......И поэтому — точно так же, как тётя Нацухи — Канон может видеть несуществующего деда."""
{f:5:Bernkastel},"""............Какая жалость, Лямбда. Баттлер больше не поведётся на такие детские трюки."""
{f:5:Lambdadelta},"""Может, и так. ......Хотя это только прелюдия к настоящей игре. Как аперитив перед едой."""
{f:5:Bernkastel},""".........Как закуска в баре. Зелёный чай в суши‐ресторане."""
Ushiromiya Battler,"""Замолчите. Видимо, мы не продвинемся дальше, если я не скажу голубым?"""
{f:5:Lambdadelta},"""Похоже на то. Ты не против?"""
Ushiromiya Battler,"""............ ...... {p:2:Дед гулял как ни в чём не бывало, хотя он уже мёртв... из‐за тех, кто хотел создать впечатление, что он жив, сотворив его иллюзию. Люди, согласные с ними, могут в ней участвовать. Они начали вести себя так, словно дед на самом деле жив и был с ними секунду назад. Вот почему он прогуливается как будто это совершенно естественно}."""
Ushiromiya Battler,"""{p:2:Из‐за этого иллюзия деда не может появиться перед теми, кто не на стороне тёти Нацухи}. {p:2:Поэтому им пришлось сделать вид, что он заперся у себя в кабинете и не выходит}."""
,В предыдущих играх дед всегда оставался заперт в кабинете.
,Мы никогда не виделись с ним напрямую.
,"Однако некоторые говорили так, чтобы казалось, будто он заперся у себя в плохом настроении, и утверждали, что совсем недавно виделись с ним. Мы слепо верили им и считали, что дед в кабинете."
,{a:c:{i:Именно поэтому в кабинете могла существовать иллюзия деда}.}
,"Верно, в прошлых играх деда видели только дядя Краусс, тётя Нацухи и слуги."
,"{p:2: Поскольку все они придерживаются одной и той же истории, на этом острове может существовать иллюзия деда, создающая впечатление, что он жив}."
Ushiromiya Battler,"""......Вы даже показали мне сцену из начала игры, где тётя Нацухи убеждала доктора Нанджо и остальных скрывать смерть деда. ......Я больше не поведусь на такие дешёвые трюки."""
{f:5:Lambdadelta},""".........Неплохо. А я так надеялась на неизвестный препарат Пурупурупикопуйо."""
{f:5:Bernkastel},"""Теперь он уже вряд ли будет пороть подобную чушь. Допустить такое — всё равно что сменить жанр на фантастику. ......Будь то вирус, препарат, болезнь или ещё что‐то, пока не обнаруженное, — всё это нарушает 4‐ю заповедь Нокса."""
Ushiromiya Battler,"""......Какую ещё 4‐ю заповедь?"""
{f:5:Bernkastel},"""4‐й Нокс. Недопустимо использовать неизвестные препараты и трудно понимаемые научные устройства. .........Согласно этому правилу, всем этим нельзя убивать."""
Ushiromiya Battler,"""Какого чёрта... Неизвестный препарат Х и неизвестное научное устройство Х — лучшие виды оружия в борьбе с ведьмой..."""
{f:5:Bernkastel},""".........О чём я и говорю. Всё это нарушает правила надлежащего детектива. Предположим, неизвестный вирус, неизвестный препарат, неизвестную болезнь или неизвестные X постоянно используют в фантастике. Мои соболезнования. Будь это твоей теорией, для тебя игра была бы окончена. *хи‐хи*хи‐хи*."""
Ushiromiya Battler,""".........Э... эй... Что ты несёшь?.."""
{f:5:Bernkastel},"""Ты думаешь, что сражался с Беато в прямом противодействии. Но это не совсем так. Вы не были в прямом противодействии. Ты боролся с ней под несколько другим углом."""
{f:5:Bernkastel},"""Вся эта твоя игра в детектива не была фантастикой против детектива. Только фантастикой против анти‐фантастики."""
Ushiromiya Battler,"""......Понятия не имею, о чём ты. ...Но одно я понимаю. ......Звучит так, словно ты говоришь про брешь в моей стратегии."""
{f:5:Bernkastel},""".........Мы стремимся убить фантастику, известную как иллюзия ведьмы. Что означает толкование истории как {i:правильного детектива}. Иначе говоря, мы должны с самого начала игнорировать любые элементы, нарушающие запреты детективного жанра."""
Ushiromiya Battler,"""И... игнорировать?.."""
{f:5:Bernkastel},"""Например, в прошлых играх множество убийств происходило в закрытых комнатах, так?"""
Ushiromiya Battler,"""......Д‐да."""
{f:5:Bernkastel},"И на каждом месте преступления ты с энтузиазмом проверял у Беато, нет ли там скрытых дверей."
{f:5:Bernkastel},"Что приводило к молниеносным красным правдам, которые повсеместно переплетались повсюду почти так, будто это само по себе сражение."
{f:5:Bernkastel}, Я считаю подобное пустой тратой времени.
{f:5:Bernkastel},"В конце концов, об этом чётко указано в 3‐м Ноксе.{n}'Скрытые проходы недопустимы'.{n}В детективном жанре скрытых дверей {i:быть не должно}."
{f:5:Bernkastel},"Поэтому при попытке истолковать всё как правильный детектив все дебаты по поводу того, есть ли скрытые двери, отпадают сами собой."
{f:5:Bernkastel},"Ведь {i:их нет}.{n}Как только заподозришь, что они могут быть, для тебя уже наступит 'game over'."
{f:5:Bernkastel},"Иначе говоря, со своими предположениями о том, будто нельзя рассуждать лишь потому, что не было доказано несуществование скрытых дверей на месте преступления, в детективном жанре ты становишься попросту наивным неудачником. Ты проиграешь как только задумаешься об этом."
{f:5:Bernkastel}, Ты ведь пытаешься истолковать всё в рамках детективного жанра?..
{f:5:Bernkastel},"Тогда следуй условностям жанра. ...*хи‐хи*хи‐хи*хи‐хи*хи‐хи*, хи‐хи‐хи‐хи‐хи‐хи, хья‐аха‐ха‐ха‐ха‐ха‐ха‐ха‐ха!!!"
{f:5:Bernkastel},"""Кхм. .........Как видишь. На местах преступлений не должно быть скрытых проходов. А значит, всё, что ты делаешь для проверки их наличия, пустая трата времени."""
Ushiromiya Battler,"""...Я знаю, о чём ты. Где‐то слышал об этом. Десять основных правил детективных романов, вроде как?"""
{f:5:Lambdadelta},"""Да, именно. Десять клиньев, пронзающих ведьм, которыми размахивал Нокс — несравненный архиепископ охоты на ведьм. Они истинное оружие, которым можно сражаться и победить фантастику, известную как 'иллюзия ведьмы'."""
{f:5:Lambdadelta},"""......Ты как всегда, Берн. Привлекла такое проблематичное оружие. Оно сильный конкурент фантастике."""
Ushiromiya Battler,"""...............Значит, скрытые двери исключаешь уже в начале, даже не расследуя место преступления... Как по мне, так {i:это} больше напоминает фантастику..."""
{f:5:Bernkastel},"""Лямбда отвечает за сторону ведьмы — фантастику. Я — та, кто с ней сражается, детектив. А ты? Ты даже не 'антифантастика' — только неоднократно уклоняешься от фантастики и отрицаешь её. Ты отвергаешь абсолютно всё, но не можешь сделать встречных предложений. Прямо как политик. *хи‐хи*хи‐хи*."""
Ushiromiya Battler,"""Заткнись. Я пришёл сюда не разговаривать о всякой чуши с вами двумя. Сейчас же продолжим историю!.."""
{f:5:Lambdadelta},"""......Помолчи. Та спящая красавица позади тебя, похоже, страдает?"""
,"Обернувшись, он увидел живой труп Беато, отдыхающий в кресле..."
,"Но по всему её телу блестел пот, и, казалось, она дышала тяжелее обычного."
,"......Она выглядела так, будто страдала от высокой температуры."
Ushiromiya Battler,"""Беато...... Что случилось... ты в порядке?.."""
{f:5:Lambdadelta},"""'В {i:порядке}'? Ты спрашиваешь какие‐то странные вещи. ......Разве не ты пытаешься {i:убить} её?"""
Ushiromiya Battler,"""..............."""
