Speaker,Russian (RU)
{f:5:Lambdadelta},"""Мы ради тебя перемотали пятую игру, но Берн отлично постаралась: загнав противника в угол, она вот‐вот прорвётся сквозь иллюзию ведьмы. ...Существование Беато почти полностью опровергнуто. Естественно, ей плохо."""
{f:5:Bernkastel},""".........Даже сейчас ты разбил иллюзию ведьмы, сказав, что Кинзо не может существовать. ......И её агония доказывает то, что твоя атака попала в неё."""
Ushiromiya Battler,"""....................."""
,......Я попытался хотя бы вытереть платком пот со лба Беато.
,"Да, я обещал дать ей умереть.{n}Но эта смерть должна была быть...... бестревожной.{n}Я не хотел, чтобы она перед этим страдала."
,"......Моя цель — не мучить Беато, прежде чем убить......"
,"Как будто заметив мои сложные чувства, две ведьмы вместе захихикали..."
Ushiromiya Rudolf,"""Отец услышал потому, что ты без остановки кричала о наследстве, сестра!"""
Ushiromiya Eva,"""Я не виновата, это всего лишь неудачное совпадение! Он просто случайно оказался в коридоре и услышал... Совпадение, говорю тебе, совпадение!.."""
Ushiromiya Hideyoshi,"""Может, успокоитесь уже?.. Просто скажем, что нам не повезло, и забудем. Если оставить мужчину в покое, его настроение придёт в норму."""
Ushiromiya Kyrie,"""Надеюсь, чувства отца не были задеты так, что он напишет странное завещание."""
,Родственники глубоко вздохнули и затихли...
Ushiromiya Rosa,"""Эй, не прыгай там, Мария! Вдруг Энджи упадёт?!"""
Ronoue Genji,""".........Прошу прощения, что так долго. Катер готов."""
Ushiromiya Hideyoshi,"""Отлично, пойдёмте. Вы всё равно сейчас ничего не добьётесь своими жалобами."""
Gohda Toshiro,"""Мы с нетерпением ждём вашего возвращения на остров."""
,"Нацухи, выглядящая совсем измотанной, сидела на скамейке в розарии."
,"Однако заметив, что Канон и Кумасава возвращаются, она сразу же выпрямилась, как достойная жена главы."
Ushiromiya Natsuhi,"""............Катер отплыл?"""
Kanon,"""Да. Минуту назад."""
Ushiromiya Natsuhi,"""Понятно. Вы проводили их, хорошая работа. ......Что делает мой муж?"""
Kanon,"""Он вернулся в свою комнату. Отдыхает."""
,"Краусс со вчерашнего дня был поражён беспокойством, думая, что смерть Кинзо могут раскрыть."
,"Когда семейная конференция закончилась, его усталость, должно быть, неожиданно взяла верх."
,"......Хотя то, как он никоим образом не раскрыл свои истинные намерения и вёл себя как ни в чём не бывало, доказало, что мужества Крауссу не занимать."
Ushiromiya Natsuhi,""".........Как всё прошло? Они ничего не заподозрили насчёт отца?.."""
Kumasawa Chiyo,"""Нет. Госпожа Ева и остальные слишком переполошились, когда Господин услышал их разговор о наследстве. Правда ведь? Разве их паника не была бесценна?"""
Kanon,"""Да. Они были просто потрясены."""
Ushiromiya Natsuhi,"""Но всё‐таки, Кумасава, ты и вправду как настоящая актриса. Вся эта паника в коридоре создала такое впечатление, будто отец действительно там был."""
Kanon,""".........Кумасава весьма талантлива в подобных вещах."""
Kumasawa Chiyo,"""О‐ой, что вы, я не заслуживаю такой похвалы. Хо‐хо‐хо‐хо."""
Ushiromiya Natsuhi,"""*хи‐хи* Я всегда строго наказываю Генджи не очень‐то и верить, когда ты звонишь сказать, что заболела."""
Kumasawa Chiyo,"""Как‐то это жестоко, мадам. Охо‐хо‐хо‐хо..."""
Ushiromiya Natsuhi,"""Вы и в самом деле прекрасно справились. Вы оба вместе с Генджи и Шаннон получите плату за месяц предыдущего отпуска, а также пять дополнительных дней, как было обещано. Это должно остаться между нами. Поговорите с Генджи, когда получите свою плату, чтобы другие служащие не прознали."""
Kumasawa Chiyo,"""Коне~чно, мы понимаем. Правда?"""
Kanon,""".........Кумасава. Вы говорите слишком громко."""
Kumasawa Chiyo,"""О‐о, нехорошо, нехорошо... хо‐хо‐хо."""
Ushiromiya Natsuhi,"""Да. Давайте пока оставим всё как есть. Нам всем нужно вернуться к своим привычным обязанностям. Кстати, я говорила Годе сделать один особый чай. Скажите ему подать его."""
,"Нацухи дала им понять, что хочет побыть немного одна, наслаждаясь чашкой чёрного чая в розарии."
,"И чай, что несли к беседке, — Димбула из Шри‐Ланка, который она пообещала Беато наряду с патисом..."
,"Жена главы и ведьма сидели друг напротив друга, любопытно смотря на него."
Ushiromiya Natsuhi,"""......Так это и есть патис... Я представляла испечённую сладость..."""
,"Нацухи, не заметив, что у него был подобный карри пряный аромат, чуть не задохнулась, положив его в рот."
,"Переводя в японскую терминологию, это как {ruby:жареные пельмени:аге‐гёдза} с картофельным пюре и ароматом карри."
,"Как семейное блюдо, оно довольно популярно среди детей."
,"Но оно шокировало Нацухи, ожидавшую, что это будет нечто сладкое, как и полагается к чаю."
{f:5:Beatrice},"""Ты не знала? Димбулу всегда подают с этим. Чёрный чай — с печеньем. О, хотя с шоколадом тоже можно. Японский чай — со сладким бобовым желе, хотя можно и с солёной конбу. Китайский чай — с {ruby:китайскими клёцками:сяолунбао}. Впрочем, мне ещё нравятся лунные пироги."""
Ushiromiya Natsuhi,"""......Удивительно. Ты столько знаешь о культуре."""
{f:5:Beatrice},"""Ну, мне было на что потратить тысячу лет. Я пробовала изысканные чаи со всего мира. Можно назвать это путешествием по чайному миру."""
Ushiromiya Natsuhi,"""Прекрасный способ 'путешествовать по миру', как я вижу. Я не знала, что можно наслаждаться чаем подобным образом. Буду дорожить этим знанием."""
{f:5:Beatrice},"""У меня нет возможности покинуть Роккенджиму, поэтому я могу путешествовать только так. А ты? Ты наверняка путешествовала по миру, как любая богатая жена."""
Ushiromiya Natsuhi,"""............До рождения Джессики мой муж возил меня во многие страны. До свадьбы я ни разу не ездила за границу, поэтому каждая поездка была свежим и новым открытием."""
{f:5:Beatrice},"""......Хмф. Звучит так, словно ты родилась в очень строгой семье."""
Ushiromiya Natsuhi,""".....................В строгой, но мне дали прекрасное воспитание. Было бы грубо по отношению к отцу и матери говорить, что они были строгими."""
{f:5:Beatrice},"""Какой красноречивый способ назвать их строгими. *хи‐хи*."""
,"Краусс, возможно, жалел Нацухи."
,Или же хотел ненадолго забрать её из строгой семьи Уширомия и дать ей отдохнуть.
,"......Хотя, может, ему просто хотелось показать жене страны, которые он хорошо знает, и продемонстрировать свои знания."
Ushiromiya Natsuhi,"""В отличие от отца, моему мужу нравятся страны Азии. Гонконг, Тайвань, Корея, Таиланд. Ещё мы были в Малайзии."""
{f:5:Beatrice},"""*хи‐хи*хи‐хи*. Краусс... пытался сопротивляться одержимости Кинзо Западом? Но Азия тоже хороша. На японцев Запад оказывает сильное влияние. Когда они думают о зарубежных странах, на ум приходят только страны Запада, но ведь ещё есть Восток."""
Ushiromiya Natsuhi,"""Я и сама кое‐что знала о Западе, но о Востоке — почти ничего... Припоминаю, как муж высмеивал меня во время наших путешествий."""
,"Беато тайком заглянула в душу Нацухи, ворчащей по поводу утомительных поездок."
Ushiromiya Krauss,"""Ты слушаешь? Это орех арека. Популярный в этих краях роскошный продукт."""
,"Было похоже на маленький, округлый, как огурец, орех цвета тыквы."
,"На первый взгляд казалось, что он даже на вкус как солёный огурец."
Ushiromiya Natsuhi,"""По... понятно. Значит, мне нужно откусить его вот здесь?.."""
,"Когда она попыталась попробовать орех, который держал её муж, он неожиданно убрал его в сторону."
,"...Ей стало так неловко, будто она была рыбой, захватившей наживку."
Ushiromiya Krauss,"""Эй, подожди. Его нужно есть определённым образом. Да, тебе надо укусить. Укуси. Прожуй. Но не ешь."""
Ushiromiya Natsuhi,"""Э? Можно укусить, прожевать, но нельзя есть?"""
Ushiromiya Krauss,"""Да. Укуси и прожуй, но не ешь. И не пей сок, иначе живот заболит."""
Ushiromiya Natsuhi,"""Не... не понимаю... Зачем есть нечто подобное?"""
Ushiromiya Krauss,"""Считай это жвачкой. Жуй и наслаждайся вкусом, а потом вот так выплюнь остатки в бумажный стаканчик."""
Ushiromiya Natsuhi,"""......До... дорогой, у тебя рот стал ярко‐красным!.. Протри, протри. ......И‐и‐и!"""
,"Даже её любимый платок, которым она протёрла рот Краусса, покрылся красными пятнами."
,"Мало того, что оно выпускает яд, если есть или пить, и красит рот в ярко‐красный, так это ещё и надо выплюнуть, прожевав... Как неприлично! ......С этими мыслями Нацухи наотрез отказалась от предложения Краусса."
Ushiromiya Natsuhi,"""Нет, нет, не надо, не стоит!.."""
Ushiromiya Krauss,"""Таков межкультурный опыт. Какой смысл путешествовать, не делая того, что можно сделать только здесь?"""
,"Краусс продолжал жевать, игнорируя то, что его губы стали ярко‐красными."
Ushiromiya Krauss,"""Отцу они тоже нравятся. Он когда‐то заказывал эти орехи, потому что привык жевать их на террасе особняка. Хотя, кажется, перестал ещё с тех пор, как ты приехала."""
Ushiromiya Krauss,"""Вот видишь, отец, которого ты уважаешь даже больше меня, всё время их ел. Ну же, давай, не стесняйся и возьми парочку."""
Ushiromiya Natsuhi,"""Нет, нет, прекрати, прекрати~, дорого~~й!"""
,......Во время путешествия Краусс был невинен как ребёнок.
,"Он даже не скрывал зависти по поводу того, как уважительно Нацухи всегда относится к Кинзо."
,Одна возможность увидеть такую сторону её мужа сделала стоящей всю дорогу к другой стране...
,"Краусс побудил её укусить орех ещё настойчивее, но несломленная Нацухи побежала от места к месту и наконец прокричала, что он слишком на неё давит."
,Краусс дулся всю дорогу в автобусе.
,"'Он прямо как ребёнок, раз его расстроило нечто подобное', — ошеломлённо думала Нацухи."
,Затем местный гид в автобусе достал один из тех самых орехов арека и начал рассказывать про них.
,"Они с давних времён были в этих краях любимым предметом роскоши, как табак."
,"Как и Нацухи, молодёжь их невзлюбила, и про них начали забывать."
,"......Кроме того, в этих краях они считались хорошим талисманом на удачу и были известны как символ семейных пар."
,"Она посмотрела на лицо мужа. ......Он резко отвернулся, но казалось, что его щеки покраснели..."
{f:5:Beatrice},"""И тогда ты положила голову ему на плечо и взяла его за руку, да?! Что за чёрт, у тебя с твоим мужем такая невинная любовь?! Ты возбудилась? Ну, а потом, ночью{p:0:♪} Ки‐ихи‐хи‐хи‐хи‐хи‐хи!"""
,"Покраснев и избегая взгляда Беато, Нацухи попыталась скрыть смущение, целиком проглотив патис и жуя с надутыми щеками, как у рыбы‐ежа."
,"Беато сказала: 'Да, к этому чаю нет ничего лучше' и несколько раз кивнула с широкой улыбкой на лице..."
Ushiromiya Natsuhi,"""Но так было только когда мы были молодожёнами. Сейчас я не могу покинуть Роккенджиму. Словно птица в клетке."""
{f:5:Beatrice},"""Как и я. Я могу продолжать умирать, но мне не уйти с этого острова. Я тоже птица в клетке."""
Ushiromiya Natsuhi,"""Я не знаю о тебе всего и не буду расспрашивать. ......Но, вижу, ты в ситуации, с которой не поспоришь."""
{f:5:Beatrice},"""Я не желаю быть здесь заключённой. Давай дружить, как две птицы в одной клетке. Ты начинаешь мне нравиться."""
Ushiromiya Natsuhi,"""Вот как? Спасибо."""
{f:5:Beatrice},"""Указания и распоряжения, которые ты дала слугам на время семейного собрания, были потрясающими. Ты учла всё — от того, где был Кинзо и когда, и заканчивая тем, что он делал, что оставлял за собой... И идеально сплела всё это без единого противоречия. Твой детальный письменный план был так же прекрасен, как магический круг высшего уровня."""
,"Чтобы создать впечатление, что Кинзо на самом деле жив и живёт своей жизнью, она составила на день график, расписав там всё до мельчайших деталей, и сказала слугам чётко следовать ему."
,"Кого и где он встречал, что оставлял им?{n}Когда, где и что он делал, что менялось?"
,"В результате, даже если родственники ни разу не видели Кинзо, им и в голову не пришло, что его нет."
,"Ева и остальные всерьёз поверили, что Кинзо только что шёл по коридору, когда услышал их разговор о наследстве и пришёл в ярость."
,"Всё прошло так, как Нацухи и запланировала, вплоть до мельчайших деталей.{n}И совместные действия слуг тоже сделали своё дело......"
Ushiromiya Natsuhi,"""Мы не могли даже в худшем случае позволить этой тайне выйти наружу. Поэтому я как следует перепроверила план."""
{f:5:Beatrice},"""Твоя сила воли и внимание к деталям привели к абсолютному успеху. ......Как ведьма, ты похожа на леди {f:5:Лямбдадельту}. Судя по твоему текущему уровню, начав считать это магией, ты сможешь с уверенностью называть себя начинающей ведьмой."""
Ushiromiya Natsuhi,"""Если ты называешь что‐то такое магией, тогда Кумасава — ведьма притворных болезней. В напряжённые дни она всегда звонит сказать, что берёт перерыв на день из‐за больной спины. Как и каждый год в день семейного собрания."""
{f:5:Beatrice},"""О‐о, нет‐нет, Кумасава совершенно иная. Она ведьма куда более высшего уровня. Ты была бы в шоке, если бы узнала, кто она на самом деле! *хи‐хи*хи‐хи*!"""
,За приятной беседой этих двоих... наблюдала ещё одна пара с дымящимся чёрным чаем.
,"Однако эта пара была в мире, который не видела первая. Там, где цвели золотые розы."
Ushiromiya Battler,"""......Ронове любезно сделал нам такой же чай, Димбулу."""
{f:5:Beatrice},"""........................Н‐н..."""
,"Беато пробормотала.{n}Впервые показалось, будто она могла что‐то передать."
,"Точно, её заинтересовал чёрный чай, и она захотела его выпить..."
,С этими мыслями Баттлер вложил чашку в руку Беато...
{f:5:Beatrice},"""............Н‐н............"""
,"Глаза Беато печально дрогнули, и её пальцы задрожали."
,"Словно она не могла даже пошевелить ими так, как хотела...... и оплакивала то, что уже не может сама насладиться чаем, который когда‐то любила... Вот как она выглядела..."
,"Поэтому Баттлер положил свою руку на её, вложил в неё чашку чая и поднёс к её губам......"
,......Тогда... хоть это и был всего один глоток... Беато выпила.
,Дни на смертельном фестивале с красными лезвиями и синими клиньями... уже казались далёким прошлым.
,"Мало того, что теперь Беато не была способна на это...... она едва могла заставить своё тело делать то, что ей хочется."
,Даже просто сделать глоток чёрного чая было тяжело......
Ushiromiya Battler,"""......Ну как? С ароматом роз этот чёрный чай замечателен. Тебе нравится?.."""
{f:5:Beatrice},""".................."""
,Конечно же............ Беато не ответила.
Ushiromiya Battler,"""......Да что с тобой?.. ......Это... очередная стратегия? Ты притворяешься такой, чтобы потом шокировать меня?"""
{f:5:Beatrice},""".................."""
Ushiromiya Battler,"""......Если в этом твоя цель — перестань, один и тот же трюк не сработает дважды. ......Если продолжишь так вести себя, даже мне станет не по себе."""
{f:5:Beatrice},""".................."""
Ushiromiya Battler,"""Эй. ...Разве тебе не пора уже громко засмеяться и сказать: 'Попался, придурок'? Любая шутка перестаёт быть смешной, если рассказывать её слишком часто. Тем более, когда она становится штампом."""
{f:5:Beatrice},""".................."""
Ushiromiya Battler,"""Смейся. Как сейчас хихикаешь там, выпивая чай с тётей Нацухи."""
{f:5:Beatrice},""".................."""
Ushiromiya Battler,"""............"""
{f:5:Beatrice},"""........................................................................"""
Ushiromiya Battler,"""............Ты можешь хотя бы ухмыльнуться?.."""
,"""Никогда больше. Она больше никогда не засмеётся."""
,Эти внезапные слова...... были невероятно жестоки.
Ushiromiya Battler,"""Откуда тебе знать?! Перестань отбирать у Беато право смеяться."""
{f:5:Bernkastel},"""......О, тогда, может, мне сказать красным?.."""
,Я яростно покачал головой.
,"С выражением, нисколько не раскрывающим её мысли, {f:5:Бернкастель} продолжила, повернувшись к Беато. ......Я совсем не понял её слов."
{f:5:Bernkastel},"{a:c:""Мои поздравления.""}"
Ushiromiya Battler,""".........С чем?"""
