Speaker,Russian (RU)
,Поэтому некоторые почтальоны берут с собой небольшой проволочный инструмент с петлёй на конце и с его помощью через щель в ящике вытаскивают не туда брошенную почтовую карточку...
Ushiromiya Rudolf,"""......Мне говорил нечто похожее друг в здании управляющей компании. ......У них в туалете иногда запирались пьяницы и спали там. Чтобы вытащить их оттуда, они протаскивали тонкий металлический инструмент через щель в двери и открывали защёлку..."""
Furudo Erika,"""Именно. Во всех промышленных отраслях есть небольшие инструменты, которыми можно легко открыть то, что обычно нельзя открыть. ......Ничего удивительного, если у слуг особняка есть нечто подобное."""
Ushiromiya Hideyoshi,"""............Ве... ......верно подмечено..."""
Ushiromiya Rudolf,"""......Научившись такому приёму, быть может, с помощью проволоки можно {i:повесить} цепочку извне. .........Да...... мы не можем быть уверены, что это невозможно..."""
,"......Верно, физически говоря, никто не может с уверенностью сказать, что нельзя повесить или снять цепочку извне."
,Цепной замок позволяет открыть в двери щель.
,"Если через неё что‐нибудь протащить...... можно легко управлять им... ......Естественно, что они так думали."
,Но Эрика знала лучше.
,"Даже если в реальности такое возможно...... красной правдой уже объявлено, что нельзя было образовать закрытые комнаты извне. Иными словами, извне цепным замком нельзя управлять."
,"И всё равно. ......Эрика навела их на мысль, что только слуги могли образовать закрытые комнаты..."
,"Притворяясь, что торжественно раскрывает нечто важное...... она вела ситуацию в нужном ей направлении."
,"Весь её серьёзный вид последние несколько минут...... был спектаклем. Нет, говоря её словами, так детектив обманывал подозреваемых......"
Furudo Erika,"""Я скажу Крауссу то же, что и вам. ......Я не говорю, что все слуги преступники. Но вполне возможно, что один из них либо преступник, либо сообщник. ......Нам надо разделить их и приставить людей с ружьями следить за ними."""
,Рудольф и Хидэёши снова переглянулись.
,"......Её слова были логичны и звучали так, будто она спокойно выкуривает самых подозрительных людей на данный момент."
,Со своими совершенными техниками разговора Эрика умело взяла инициативу в свои руки. ......До такой степени управлять человеческой сущностью можно даже без полномочия детектива.
,"Что скажете, дамы и господа?.."
