Speaker,Russian (RU)
,"Эрика задремала на кровати, и когда раздался стук в дверь, она заметила его не сразу."
,"Она посмотрела на часы и увидела, что с тех пор, как она легла, прошло не так много времени."
Furudo Erika,""".........Да, кто там? Надеюсь, у вас есть хорошая причина стучать по двери детектива в такой час..."""
Furudo Erika,"""Точно. ......Перед началом игры мне нужно кое‐что сказать."""
Ushiromiya Battler,"""А‐а, провозглашение детективом. Делай как знаешь."""
Furudo Erika,"""Нет, я имею в виду обратное. ......Мы повышаем ставки."""
{f:5:Beatrice},""".........Повышаете... ставки?.."""
{f:5:Lambdadelta},"""Что‐что? Звучит интересно. Вы о чём?"""
{f:5:Bernkastel},"""......Всё просто. В прошлой игре Баттлер нагнул нас. Поэтому в этой игре Эрика должна не просто сравнять счёт."""
{f:5:Beatrice},"""Разве в прошлой игре не была ничья?.."""
{f:5:Bernkastel},"""Мы бросили игру, которую должны были с лёгкостью выиграть. Если это не поражение, тогда не знаю что. Так ведь, Эрика?.."""
Furudo Erika,"""Д‐да, госпожа. Если бы не мой жалкий провал, мы бы выиграли ту игру по умолчанию..."""
{f:5:Lambdadelta},"""......О‐о‐о, поняла. Так на этот раз вы намеренно собираетесь бороться в невыгодном положении без провозглашения детективом... и всё равно победить!.. Вы планируете не только смыть провал в предыдущей игре, но и полностью перевернуть счёт с ног на голову, да?"""
{f:5:Beatrice},"""Со... ......собираетесь поставить в игре Баттлера, в которую он влил душу и сердце, такое глупое препятствие?.. Это не только самонадеянно, но и грубо!.."""
Ushiromiya Battler,"""......Действительно. Звучит как оправдание на случай их поражения."""
{f:5:Lambdadelta},"""Да, тоже верно. Если они выиграют, это будет великая победа, а если проиграют — у стороны Эрики появится хорошее оправдание. Как‐то нечестно."""
{f:5:Bernkastel},"""Не беспокойся, ставка уравновешена с обеих сторон. ......Если победит {y:0:Челове}{n:0:челове}к, не провозглашённый в этой игре детективом, Баттлер и другие ни за что не соберут фрагменты иллюзии ведьмы."""
{f:5:Bernkastel},"""......Но, с другой стороны, если Эрика проиграет, это детективное ничтожество отправится в глубины забвения вместе с худшим из всех возможных фрагментов."""
Furudo Erika,"""............"""
{f:5:Bernkastel},"""......Вот видите? Всё уравновешено. Окончательная победа, когда иллюзию ведьмы разрушит обычный {y:0:Челове}{n:0:челове}к, а не сверхчеловек‐детектив. ......Ради этой ставки она ставит на кон свою гибель."""
{f:5:Bernkastel},"""Мне надоели ваши с прежней Беато вялые повторяющиеся игры. ......Поэтому мы повысим ставки и разрешим всё за раз."""
{f:5:Lambdadelta},"""......Ну, что верно, то верно. ......{i:Доведя эту} игру до конца, Баттлер 'победит' игру Беато, и игра закончится. ......В каком‐то смысле вам не избежать решающего столкновения, да?.."""
Ushiromiya Battler,"""..................Мне ясна ваша позиция. ......Тебя всё устраивает, Эрика?"""
Furudo Erika,""".........Д... ......да, разумеется. ......Чтобы вернуть доверие госпожи, потерянное из‐за моего прошлого поражения... я... я рискну даже жизнью..."""
Ushiromiya Battler,"""По своей воле?.."""
Furudo Erika,"""............"""
{f:5:Lambdadelta},"""............"""
{f:5:Bernkastel},""".........В чём дело, Эрика? Ответь ему."""
Furudo Erika,"""Ко... ......конечно же. Я сама так хочу. ......Я ни за что не проиграю......... Даже без провозглашения детективом... я......я одолею вас несмотря ни на что!.."""
{f:5:Beatrice},""".........Баттлер........."""
Ushiromiya Battler,"""..................Отлично. Если ты так хочешь, я принимаю вызов."""
Furudo Erika,"""..................Б‐благодарю. Вы об этом не пожалеете."""
{f:5:Lambdadelta},"""Всё‐таки, когда Баттлер играл на {y:0:Челове}{n:0:челове}ческой стороне, у него не было никаких привилегий вроде полномочия детектива. Ему было позволено лишь использовать синюю правду и просить Беато повторить то, что он скажет."""
{f:5:Bernkastel},"""Именно. Прошлая игра была отчасти несправедливой. .........Мы провалились несмотря на это и поэтому всё равно что проиграли."""
Furudo Erika,""".................."""
Ushiromiya Battler,"""Поступайте как знаете. Если захотите ввести провозглашение детективом — вводите в любое время. ......Я понимаю, что пока вы держите его в резерве."""
Furudo Erika,"""Вы всерьёз думаете...... что я бы стала его использовать?.. Против подобного противника?.."""
Ushiromiya Battler,"""............"""
{f:5:Bernkastel},"""Тогда начинайте. Мне уже становится скучно."""
Furudo Erika,"""......Положитесь на меня, госпожа!.. Я обязательно разобью иллюзию ведьмы!.."""
,В дверь Эрики стучали Джордж и Джессика.
,"Они спрашивали, не заходили ли туда Баттлер и Мария. ......Конечно нет."
Ushiromiya George,"""Они уже давно спустились вниз, сказав, что хотят пить. Мы подумали, может, они зашли в твою комнату..."""
Furudo Erika,"""Конечно нет. ......Вы уверены, что они не пошли в особняк?"""
Ushiromiya Jessica,"""Мы звонили в комнату слуг и в столовую, но никто не взял трубку..."""
Furudo Erika,"""......Оставайтесь здесь. Я схожу проверить особняк."""
Ushiromiya George,"""Э... эй, опасно выходить так поздно."""
Furudo Erika,"""Как чужак мог проникнуть на уединённый остров? Оставайтесь в своей комнате кузенов. Я свяжусь с вами, если что случится. И скажите служащим в комнате слуг не покидать здание. Пока."""
Ushiromiya Jessica,"""По... подожди секунду, Эрика?!"""
Ushiromiya George,""".........Странный ребёнок."""
,"Высказав свои мысли и больше ничего не слушая, Эрика бросилась вниз по лестнице и выскочила наружу."
Furudo Erika,"""......Обычно первые сумерки наступают утром, но, похоже, на этот раз началось раньше. ......В домике для гостей преступлений не произошло. Выходит, место трагедии в особняке..."""
,"Хотя у неё был зонтик, Эрика промокла, пока бежала."
,"Она дерзко слизала капли дождя, упавшие на её лицо......"
,......Эрика была на пике энергии...
,"Судя по тому, что она помнила из предыдущей игры, после начала семейного собрания вход в особняк запирается."
,Но на этот раз было незаперто.
,"......Кто‐то отпер, было изначально незаперто или же нельзя было запереть?"
Furudo Erika,"""Впрочем, сейчас думать об этом нет смысла. Возможно, прихоть Владельца игры."""
,"Как только она вошла в прихожую, дверь в гостиную с грохотом распахнулась.{n}Оттуда выскочил огромный Года."
Furudo Erika,"""О, добрый вечер, Года. Что‐то случилось?"""
Gohda Toshiro,"""А... ава‐ва‐ва, ава‐ва‐ва!!! По... полицию... скорую!.. Ава‐ва‐ва‐ва‐ва!!!"""
,"На удивление жалкое выражение.{n}Идеально подходит первому, кто обнаружил преступление."
Furudo Erika,"""Успокойтесь. Как полиция или скорая доберётся до уединённого острова в разгар тайфуна? Всё равно телефоны наверняка не работают, так что успокойтесь."""
,Из гостиной были слышны крики Рудольфа и Краусса.
,Их потрясение — совершенный признак наступления первых сумерек......
Furudo Erika,"""Что ж, давайте мне жертв, место и реконструкцию ситуации."""
Ushiromiya Battler,"""......Ушедшие на перерыв не вернулись, и взрослые пошли в гостиную. Когда они пришли, дверь была перекрыта изнутри, и у них не вышло открыть её. Позже ты увидишь, но двойные двери перекрыты из гостиной держателем шляп."""
Furudo Erika,"""Хотите сказать, дверь была перекрыта изнутри, и окна тоже были заперты изнутри?.."""
Ushiromiya Battler,"""Да. ......Выйдя наружу и заглянув в гостиную через окно, они увидели Розу, лежащую на диване в неестественном положении, с текущей изо лба кровью. ......Они разбили стекло, вошли в гостиную и также обнаружили там Марию, которая лежала у стены вся в крови."""
Furudo Erika,"""......Ясно. И поэтому они закричали. Другие места преступлений?"""
Ushiromiya Battler,"""Когда ты пришла в особняк, вход не был заперт... потому что они вышли, чтобы проверить гостиную извне. ......Поскольку до их ухода особняк был заперт, и другие пропавшие люди тоже могут лежать где‐то там, сейчас взрослые обыскивают всё здание..."""
Furudo Erika,"""И в том длинном безумстве, показанном ранее, жертвы умерли в тех же местах?"""
Ushiromiya Battler,"""......В тех же."""
Furudo Erika,"""Роза и Мария были в гостиной. Кроме того...... Нацухи была в своей комнате, а Кирие — в кабинете Краусса. Ева — в розарии...... нет, стоп, её ведь перенесли в почётную комнату?"""
Ushiromiya Battler,"""Да. Труп Евы был найден в почётной комнате."""
Furudo Erika,"""Всего пять жертв. Для первых сумерек не хватает ещё одной. Кто шестой, и где?"""
Gohda Toshiro,"""......?! Господин Краусс! На этой двери тоже цепочка!.."""
Ushiromiya Rudolf,"""Перережь её! Там может скрываться преступник!"""
Ushiromiya Krauss,"""Года, давай!"""
,Рудольф и Краусс принесли винчестеры из ценной коллекции Кинзо.
,"Они крикнули Годе, нёсшему кусачки, перерезать цепочку."
,В особняке в нескольких местах нашли жертв одну за другой.
,"Мужчины, потерявшие своих жён, в ярости прочёсывали особняк, разыскивая преступника."
,Это была... гостевая комната.
,"Раньше там останавливались родственники, но после постройки домика для гостей её не часто открывали."
,Эта забытая комната была изнутри заперта на цепочку...
Gohda Toshiro,"""......Н‐н‐н...... хья‐а!"""
,"Как только цепочку разорвали, Рудольф оттолкнул Году и вбежал в комнату."
Ushiromiya Rudolf,"""Здесь кто‐нибудь есть?! Выходи!.."""
Ushiromiya Krauss,"""Там кто‐то на кровати!.."""
Ushiromiya Rudolf,"""Брат, включи свет!.."""
,"Когда Краусс щёлкнул переключателем на стене...... в гостевой комнате загорелся свет, и в обзор вошла фигура, лежащая на кровати..."
Ushiromiya Rudolf,"""Ба... ......Баттлер!.. Ч‐чёрт побери, как ты...... здесь оказался?.."""
,"Рудольф припал к трупу Баттлера, словно у него надломились колени."
,"Никакие слова не могли его утешить, когда он закричал, обезумев от горя..."
,"......За одну ночь... он потерял и жену, и сына."
,"Между тем, Краусс проверил окно, ванную и шкаф на случай, если там кто‐нибудь прячется, но никого не обнаружил..."
Ushiromiya Rudolf,"""Баттле‐ер... Баттле‐е‐е‐е‐е‐е‐ер...... прокля‐а‐атье... а‐а‐а‐а‐а......"""
Gohda Toshiro,"""Ка... ......как грустно......"""
Ushiromiya Krauss,"""......Поверить не могу...... но эта комната тоже... закрытая."""
Gohda Toshiro,"""Ч... ......что, опять?!"""
Ushiromiya Krauss,"""Да...... Мой кабинет, где была Кирие, комната Нацухи, почётная комната с Евой, гостиная с Розой и её дочерью... ...А теперь и Баттлер в этой гостевой комнате. ......Все эти комнаты — закрытые... ...Я...... не понимаю... Это же не самоубийство?!"""
Ushiromiya Rudolf,"""Не может быть!.. Какое {i:ещё} самоубийство?! А‐а‐а‐а‐агх... Баттле‐е‐е‐ер......"""
Furudo Erika,"""O...... вот так сюрприз. Подумать только, шестой жертвой оказались вы сами."""
Ushiromiya Battler,"""Иногда убивать себя гораздо интереснее."""
{f:5:Beatrice},"""И все места преступлений — закрытые комнаты. ......Такие убийства нельзя совершить без магии."""
Furudo Erika,"""Хмф, разве видеть сквозь это не суть игры?...Должно быть так, чтобы убийство можно было совершить без магии. ......Как‐никак, если его действительно можно провернуть только с помощью магии, это уже не игра."""
Ushiromiya Battler,"""......Интересная мысль. ......Да, в такую игру мы и играем."""
,Это честная игра.
,"Её цель — объяснить без магии странные преступления, объявленные совершёнными с помощью магии."
,"{i:Если это нельзя сделать}, игра перестаёт быть игрой."
,"В общем, как Эрика и сказала, должно быть так, чтобы убийства можно было совершить без магии..."
,......На сторону ведьмы возложена определённая ответственность.
,"Нужно создать преступление, которое можно {i:воспроизвести с помощью хитростей}, а не магии."
,"Пока сторона {y:0:Люд}{n:0:люд}ей не раскусила эти хитрости, сторона ведьмы может вводить любые виды магии и иллюзий."
,"......Другими словами, чтобы осуществить убийство в закрытой комнате с помощью магии...{n}Необходимо создать преступление, возможное для рук {y:0:Челове}{n:0:челове}ка."
Ushiromiya Ange,""".........Теперь я понимаю. Вот почему, когда я приказала Семи сёстрам убить моих одноклассниц в Святой Люсии...... они не смогли это сделать. ......И теперь я понимаю значение слов Мамоны."""
{f:5:Featherine},"""'Магия может делать только то, что ты можешь сделать своими руками'... да?"""
,"Если бы у меня тогда была решимость убить своих одноклассниц...... нет, не так."
,Если бы я тогда была способна убить своих одноклассниц... Способна осуществить убийство...
,......Семь сестёр чистилища смогли бы убить их.
,"Они могли брать на себя только то, что я могла сделать сама."
,"......Нет, тоже неверно.{n}Они могли превратить совершённое мной в 'магию'."
,"Но из‐за большого числа свидетелей в классе такое было бы невозможно. ......Это бы сжёг отрицающий магию токсин, о котором всегда говорили сестрёнка Мария и остальные."
,Однако...... если бы я позвала этих одноклассниц в место без свидетелей...... и убила...
,'Семь сестёр чистилища смогли бы совершить магическое убийство'...
Ushiromiya Ange,"""......Даже с помощью магии ведьмы не способны делать то, что не могут сделать сами...... Они могут только 'украсить' магией то, на что способны."""
{f:5:Featherine},"""......Интересно. ......И это потому, что те, кто добивается чего‐то без магии, позже заявляют, что магия была, и называют себя ведьмами."""
{f:5:Featherine},"""Эрика понимала это с самого начала. ......Вот почему она никогда не сдастся ведьмам. ...Она уверена, что всё можно объяснить хитростями. С прежним Баттлером так часто игрались потому, что он не обладал такой уверенностью..."""
Ushiromiya Ange,"""......Если увидеть сквозь это правило, ведьма теряет всяческий шанс на победу. ......Вот почему они заставляют противника сдаться прежде, чем он увидит правду этого правила. ......Чем дольше тянется поединок...... и чем больше даётся намёков...... тем меньше у ведьмы преимуществ..."""
,Опять по кругу.
,"......Зачем Беато затягивала игру, пока не проиграла?"
,..................
,"Нашли много жертв, и особняк по‐прежнему был погружён в хаос."
,"Группа Хидэёши пошла в домик для гостей, беспокоясь о безопасности детей."
,Краусс и Рудольф в холле обсуждали дальнейшие действия...
,За короткий промежуток в этом хаосе...... Эрика пробежала по всему особняку.
,Проверяла места преступлений.
,Обычно с полномочием детектива Эрика имела право открыто исследовать места преступлений до полного удовлетворения.
,"Но в этот раз она ещё не ввела это полномочие. ......Из‐за этого, а также из‐за её положения гостьи и посторонней ей вряд ли позволят вести расследование."
,"Поэтому ей пришлось быстро проверить все места преступлений сейчас, пока она ещё могла бегать где вздумается."
,В комнате слуг была прозрачная папка с макетом особняка.
,"Позаимствовав её, она узнала расположение всех комнат в особняке..."
,"Эрика умело кралась по особняку, по очереди обегая места преступлений..."
Dlanor,"""Леди {f:5:Эрика}...... думаю, вы знаете, но позвольте на всякий {f:5:случай} предупредить вас."""
Furudo Erika,"""Да? В чём дело?"""
Dlanor,"""У вас действительно невероятная фотографическая {f:5:память}, леди {f:5:Эрика}. ......Если объединить её с полномочием детектива, вас невозможно одурачить."""
Furudo Erika,"""Да, знаю. ......Пока я не провозглашена детективом, даже моя фотографическая память не считается надёжным доказательством. Разумеется, я понимаю. ......И всё же, это не значит, что можно не осматривать места преступлений напрямую."""
Furudo Erika,"""......В конце концов, в прошлой игре моя заносчивость в этом деле привела к поистине досадной ошибке."""
Dlanor,"""К примеру, как бы вы ни осматривали труп человека, вы даже не можете с абсолютной точностью гарантировать, что он не подделал свою {f:5:смерть}. Видимо, придётся просить Баттлера повторить красным {f:5:особенности} ситуации."""
