Speaker,Russian (RU)
Furfur,"""А‐а, Зепар! Важное объявление?!"""
Zepar,"""Слушай, Фурфур! Нашу главную песню выпустят на CD!"""
,"""""""Ло‐о‐о‐о‐о‐о‐о‐ожь?"""""""
,"""""Да, ложь! Аха‐ха‐ха‐ха‐ха‐ха‐ха."""""
Zepar,"""Нам просто стало скучно всё время появляться одинаково!.."""
Furfur,"""Мы подумали немного изменить стиль!"""
Zepar,"""Мы артисты! А сцена — действие!"""
Furfur,"""Нужно то и дело импровизировать!.."""
Ushiromiya Jessica,"""Д... ......да, нам без этого никак, чёрт подери..."""
Ushiromiya George,"""......Спасибо, что помогаете снять напряжение. Прошу прощения, но мы ещё обсуждаем второе испытание. Нам нужно чуть больше времени. И тишина, если можно."""
Zepar,"""Извини, Джордж. На самом деле у нас есть очень важное объявление по поводу второго испытания."""
Furfur,"""Для некоторых это хорошие новости! А для других — плохие?"""
Zepar,"""Те, для кого это плохие новости, думаю, уже догадались!"""
,"""""А если вы не знаете, о чём мы, тогда для вас новости хорошие!"""""
Shannon,"""......Госпожа {f:5:Беатриче}?.."""
{f:5:Beatrice},""".........Ничего."""
Kanon,"""............"""
,Было пять человек. Отсутствовал только Баттлер.{n}Беато стояла с низко опущенной головой и мрачным выражением.
,"Все поняли, что, должно быть, что‐то случилось с Баттлером..."
Zepar,"""Мы бы хотели объявить, что перед вторым испытанием Баттлер выбыл."""
,Все забормотали. ......Что же случилось?..
Furfur,"""Игра ведьмы будет ждать его вечно, но пара влюблённых вечно ждать не может."""
Zepar,"""Любовь как мороженое! Она сладкая и сливочная, но если быстро не съешь, то потеряешь её. Наша игра не так щедра, чтобы ждать его возвращения."""
Kanon,"""......Так вот что подразумевалось под хорошими новостями."""
Ushiromiya Jessica,"""Хех. ......Я, конечно, рада сокращению числа наших противников, но вы глубоко ошибаетесь, если думаете, что я стану аплодировать чужой беде..."""
Ushiromiya George,"""Баттлер... Тот, кого мы считали нашим самым главным врагом... ......Я не стану спрашивать причину. Если демоны так говорят, значит, так оно и есть."""
Shannon,"""......Тогда... что будет с госпожой {f:5:Беатриче}?.."""
{f:5:Beatrice},""".........Вероятно, я потеряю право проходить испытание."""
Zepar,"""Ведь это испытание на проверку уз между влюблёнными!"""
Furfur,"""Сейчас Баттлер не в состоянии участвовать. Поэтому его пара дисквалифицирована! Поистине печально!"""
Zepar,"""Но она участница этого трёхстороннего испытания любви. Так что нам стоит позволить ей наблюдать за испытанием!"""
Furfur,"""Прекрасная идея! Она имеет право пожелать счастья паре, преодолевшей испытание!"""
Ushiromiya George,"""......Вас это устраивает?"""
{f:5:Beatrice},"""Да...... Я хочу наблюдать до конца. ......И...... я всё ещё верю, что он скоро вернётся, вернёт право на участие и снова продолжит со мной это испытание."""
Shannon,"""......Думаю, она имеет право быть наблюдателем."""
Ushiromiya Jessica,"""Не возражаю."""
Kanon,"""......Нам незачем быть жестокими."""
Ushiromiya George,"""Но всё равно...... мы потеряли сильного противника. ......Извините, но я хотел бы сейчас же решить исход этого испытания."""
Furfur,"""А‐а, вот он, Джордж! В душе я болею за тебя больше всех!"""
Zepar,"""Холод, которым он подпитывает любовь, только делает её ещё жарче!.."""
Ushiromiya George,"""Так или иначе...... число пар сократилось с трёх до двух, и трёхсторонний тупик разрешён. ......Мы не могли активно бороться потому, что боялись ситуации одного против двух."""
Kanon,"""......Теперь один против одного...... и нужно лишь устроить хорошую, изящную дуэль."""
Shannon,"""............"""
Ushiromiya Jessica,"""Всё‐таки...... надо было сделать так ещё в начале..."""
,"Четверо встали, будто в ответ на невидимый вызов, и решительно посмотрели друг на друга..."
,Только Беато стояла в стороне...... напряжённо следя за ходом противостояния молодых влюблённых.
,......У каждого из них неразрывно сильная связь.
,Тогда...... разве этого мало?
,Их любовь уже настоящая. Не нужно проверять её.
,Но в таком случае...... почему им приходится сражаться?..
,Победившие влюблённые будут связаны вместе чудом магии...... а проигравшие расстанутся.
,"Почему демоны пообещали, что без чуда магии мы разойдёмся?.."
,.........Зачем нужна подобная дьявольская игра?......Я не понимаю.
,"Нет, сейчас они не имеют значения..."
,Мне нужно скорее придумать хитрость...... чтобы вытащить Баттлера из закрытой комнаты......
{f:5:Beatrice},"""............Я слышала о Баттлере. Кажется, у тебя неприятности."""
{f:5:Beatrice},"""Старшая сестра......"""
{f:5:Beatrice},"""Я бы хотела помочь тебе, как дорогой сестре и части конечной меня. ......Я займусь закрытой комнатой Баттлера по‐своему......... но она сложная. Из обычной цепочки словно сделали проволочную головоломку..."""
{f:5:Beatrice},"""Я слышала от {f:5:Лямбдадельты}. ......Она сказала, что прежняя {f:5:Беатриче} обязательно придумала бы трюк. ......У тебя есть идеи?"""
{f:5:Beatrice},"""Прежняя {f:5:Беатриче} — конечная форма после нашего слияния. ......Даже я только часть неё. Мне это не разгадать..."""
,"Иначе говоря...... сколько бы мы ни думали в наших неполных формах, мы не сможем понять."
,"Ни старшей, ни младшей сестре...... не разгадать эту загадку......"
,"Беато тряхнула головой, выкидывая из головы эту мысль."
{f:5:Beatrice},"""Я не сдамся............ Я разберусь с этой закрытой комнатой!.. Если я скорее не спасу Баттлера...... его душа будет сломлена."""
{f:5:Beatrice},""".........Разумеется, я не против прибегнуть к своей мудрости. ......Но даже мне не справиться с этой закрытой комнатой..."""
{f:5:Beatrice},"""Объединившись, мы наверняка сможем найти тот же ответ, что и если бы мы были едины. ......Прошу, не сдавайся и помоги мне своей мудростью!.."""
{f:5:Beatrice},""".........До сих пор не понимаю, почему ты готова так далеко зайти ради Баттлера...... но я сделаю как ты просишь. Ведь это просьба самой меня. Я прибавлю свою мудрость к твоей......"""
Zepar,"""Смотри, Фурфур. Две Беато вместе думают."""
Furfur,""".........Смогут ли они спасти Баттлера?"""
Zepar,"""О, смогут! С чудом любви уж точно!.."""
Furfur,"""Верно, Зепар! С чудом любви они обязательно смогут!"""
Zepar,"""......Эй, Фурфур. Думаешь, они поймут, что мы даём им подсказку к разгадке этой закрытой комнаты?.."""
Furfur,"""................."""
,"Две Беато сблизились лбами...... и, изо всех сил напрягая ум...... искали план по спасению Баттлера."
,"Как будто даже не видели тех четверых, которые метали друг в друга искры и торжественно обсуждали метод дуэли......"
Furfur,""".........Поймут. С любовью они обязательно поймут."""
,Они демоны любви.{n}Любовь — единственный элемент. Источник всех чудес.
,......Может ли чудо любви... дать ответ на трюк закрытой комнаты?..
Ushiromiya Ange,"""Снова. 'Без любви не увидеть'. ......Я понимаю, как этой коронной фразой можно описать некую концепцию. Но трюки закрытой комнаты — подлинные и безжалостные математические головоломки без всяких намёков на любовь. .........О какой подсказке говорят эти демоны?.."""
{f:5:Featherine},"""......У меня уже есть один ответ. ......Слова этих демонов поддерживают его ещё больше..."""
Ushiromiya Ange,"""Да, ясно, ты невероятна. Всегда знаешь верный ответ. И ни за что мне не скажешь. ......По правилу наблюдателей, раз ты не говоришь, возможно, ты только притворяешься, что знаешь, и лжёшь."""
{f:5:Featherine},"""Пф‐ф......... ха‐ха‐ха‐ха‐ха‐ха‐ха. ......Да, мне явно нравятся мико, обливающие грязью. Прекрасно, дитя человека. Для меня сарказм мико и оскорбления как церемониальный танец в мою честь......"""
Ushiromiya Ange,"""Да, ты очень раздражающая госпожа. .........Глупый братик... зачем ты...... создал такую закрытую комнату......"""
{f:5:Featherine},"""Думай, дитя человека. ......Персонажи истории не единственные, кто должен мыслить. ......Как Читатель, ты тоже имеешь право получать удовольствие от размышления. ......А я получаю удовольствие от наблюдения за этим."""
Ushiromiya Ange,"""......Я готова сделать ставку. У твоей последней мико кончилось терпение, и она сбежала от тебя, да?"""
{f:5:Featherine},"""Можешь получать удовольствие, ругая меня. Можешь рассматривать проблему, как две Беато. ......Если не будешь думать, история не продолжится."""
Ushiromiya Ange,"""Почему? Я — Читатель, верно? Разве я не могу просто тихо читать?"""
Hachijo Tohya,""".........Нет. ......Я хочу, чтобы ты думала, чтобы читатели тоже думали."""
Ushiromiya Ange,""".........! Вот как. ......Знаешь, ты очень неприятный автор."""
,"Естественно, Энджи ещё не дошла до конца рукописи, которую читала. ......Однако через несколько страниц она закончится."
,А как же оставшаяся история? Она должна быть гораздо длиннее.
,Должно остаться намного больше страниц......
,Они были в другом коричневом конверте...... в руке Хачиджо.
,"Хачиджо с усмешкой махнула толстым конвертом. ......'Если хочешь прочитать больше, делай как я говорю'."
Amakusa Juuza,"""Круто!.. Как вам, леди? Ха‐ха‐ха‐ха‐ха, аха‐ха‐ха‐ха‐ха‐ха!.."""
,"Давать читать бесплатно...... а потом перестать, когда наконец дойдёшь до самого интересного. Амакуса не мог перестать смеяться над этой дьявольской деловой практикой."
Hachijo Tohya,"""Твои взгляды и рассуждения. ......Вот чего я хочу. ......Скажи мне их...... и я отдам оставшуюся рукопись."""
Ushiromiya Ange,"""Прекрати издеваться. Думаешь, я после такого буду делать так, как ты говоришь?.."""
Amakusa Juuza,"""Да ладно вам, леди, успокойтесь. Я тоже хочу прочитать, так что остыньте."""
Amakusa Juuza,"""......По поводу оставшейся рукописи, Хачиджо. ......Вы ведь написали ответ на трюк закрытой комнаты и правду всех прочих загадок?"""
Hachijo Tohya,"""Конечно. .........Но я не писала так, чтобы поняли те, кто не размышляет и не рассматривает..."""
Ushiromiya Ange,"""......В конце концов твои пылкие читатели скажут, что ты предала их."""
Hachijo Tohya,"""Знаю, потому и не показываюсь. Дитя человека."""
Amakusa Juuza,"""В общем, вот что Хачиджо имеет в виду. ......Сначала скажи мне свой ответ, а потом я дам тебе его проверить."""
Hachijo Tohya,"""......Верно, молодой человек. .........Я не вредничаю. Я спрашиваю, потому что хочу, чтобы ты по‐настоящему поняла конец истории."""
Ushiromiya Ange,"""Веселишься, Амакуса?......Да, если подумать, ты всегда относишься к телевикторинам со всей серьёзностью. ......Похоже, ты наслаждаешься жизнью гораздо больше меня."""
Hachijo Tohya,"""Ну же...... подумай. ......Какой чудесный трюк мог бы вытащить Баттлера из закрытой комнаты? Я хочу дать оставшуюся часть истории специально тем... нет, только тем, кто думал..."""
,"В соборе ведьм...... хотя нет, учитывая всё, что здесь случилось, скорее, в обители демонов..."
,"Эрика, захотевшая посмаковать воспоминания о своей идеальной победе...... стояла одна во всём обширном соборе, и с её щёк медленно сходил румянец."
,"Тогда...... на пустом, как она думала, балконе... показалась тень."
,Это была......{f:5:Лямбдадельта}...
Furudo Erika,"""......О, леди {f:5:Лямбдадельта}. Не часто вас можно застать здесь одну."""
{f:5:Lambdadelta},""".........А‐а, ты. ......Поздравляю с грандиозной победой. .........Хе‐хех, странно. Помнится, в конце прошлой игры я сказала тебе то же самое на этом же месте."""
,"Она хотела съязвить...... но Эрика была в таком хорошем настроении, что даже эти слова прозвучали как комплимент."
Furudo Erika,"""Я тут...... слышала, что вы сказали."""
{f:5:Lambdadelta},"""......Что?"""
Furudo Erika,"""Я слышала, что вы тоже......... однажды были фигурой, с которой игралась на игровой доске великая ведьма, и оказались заточены в ужасном аду..."""
,"У Эрики был неприятный, торжествующий взгляд, словно ей удалось сунуть нос в её обременительные воспоминания о прошлом."
,Но {f:5:Лямбдадельта} ничуть не показалась взволнованной...... и вместо этого молча посмотрела вниз с балкона.
{f:5:Lambdadelta},"""......Да. ......Сколько лет я была заперта там?......Наверное, мне стоило считать, как делала Берн............ Хотя нет, может, и к лучшему, что я не считала. Именно подсчёт лет...... сломал Берн."""
Furudo Erika,"""Моя госпожа...... тоже когда‐то попала в ад логической ошибки?.."""
{f:5:Lambdadelta},"""Да. Хотя не она была ответственна за логическую ошибку."""
Furudo Erika,"""......Потому что не она была Владельцем игры?.."""
{f:5:Lambdadelta},"""Верно. ......В то время она ещё была обычной фигурой, даже не имеющей самосознания. Владельцем игры, совершившим логическую ошибку, была её госпожа."""
Furudo Erika,"""......Моя госпожа тоже была...... фигурой ведьмы?"""
{f:5:Lambdadelta},"""Да. .........Её госпожа...... была жестока. ......Она сама создала игру, но на полпути упустила свою цель. ......В итоге она получила нечто вроде сломанных нард, где начало и цель были связаны как пончик."""
Furudo Erika,"""Что значит 'она упустила свою цель'?.."""
{f:5:Lambdadelta},"""Возникла логическая ошибка. ......В своей игре в нарды она не смогла построить логику, описывающую достижение её цели. И так, без какой‐либо цели, игра осталась сломанной."""
{f:5:Lambdadelta},"""......В этом случае ей следовало успокоиться и самой придумать ответ. ......Но вместо этого она и думать забыла о Берн, своей фигуре. .........Ты слышала теорему о бесконечных обезьянах?"""
Furudo Erika,"""......Если обезьяна будет бесконечно ударять наугад по клавишам пишущей машинки...... она рано или поздно по стечению обстоятельств напечатает тот же текст, что в Гамлете. Вот эта теория. Точнее сказать, абсурд."""
{f:5:Lambdadelta},""".........Разве не страшный ад?.........Берн была вынуждена вечно ударять наугад по клавишам пишущей машинки, даже не зная смысла того, что делает. .........Владелец игры пытался заставить её создать цель, о которой сам даже не думал."""
,......Могла ли Эрика представить...... насколько ужасен этот ад?
,"Работа, которую нужно проделать сто раз, и работа с вероятностью успеха 1/100, которую нужно повторять, пока она не удастся...... могут выглядеть похоже...... но разница в жестокости между ними очень велика."
,"Когда нужно проделать работу сто раз, неуклонно приближаешься к концу, выполняешь её всё более умело, и в конце концов она заканчивается."
,"Но работа, успешная с вероятностью 1/100, ......ни в коей мере не отражает труд человека."
,Всё решается удачей.
,"......В худшем случае даже задача с подбрасыванием монеты, пока та не упадёт на лицевую сторону...... может занять более ста лет......"
{f:5:Lambdadelta},"""Сколько клавиш на печатной машинке? Около ста, наверное. ......Как думаешь, какова вероятность бить по ним наугад и набрать Гамлета?.."""
Furudo Erika,""".........Я даже...... не представляю. ......Она должна быть...... невероятно низкой."""
{f:5:Lambdadelta},"""Верно. ......На такое...... уходит вечность. .........Весь этот головокружительный период времени...... она продолжала ударять по пишущей машинке, пока не набрала чудо."""
Furudo Erika,"""Поэтому она...... ведьма чудес?.."""
{f:5:Lambdadelta},"""Не будь она ведьмой... нет, если бы у неё не вышло стать ведьмой...... она бы до сих пор была чёрной кошкой, навечно привязанной к той пишущей машинке. ......Она была одарена чудом...... успешно набрала чудо, стала ведьмой и вернулась из того ада живой."""
{f:5:Lambdadelta},"""Но после такого долгого и сурового ада...... её разум был полностью сломлен. Вот почему она стала такой злой и бессердечной ведьмой. .........Даже ты не выбрала бы такую госпожу, будь у тебя выбор, правда?"""
Furudo Erika,"""Во... вовсе нет!.. Для меня честь быть фигурой госпожи. Госпожа сильная и деспотичная. Растаптывать слабых — её естественное право."""
{f:5:Lambdadelta},"""......Так ты на стороне хулиганов?.. Хе‐хех. ......Знаешь, как создать превосходного хулигана?"""
Furudo Erika,"""......? Нет."""
