Speaker,Russian (RU)
Shannon,"""Ты проверила ванные принадлежности?"""
,"""Да, прошлась по всему списку."""
Shannon,"""Точно правильно их положила?"""
,"""Да, конечно. Всё как в списке."""
Shannon,"""*хи‐хи*, спасибо. Господин Генджи, гостевые комнаты готовы."""
Ronoue Genji,"""Хорошая работа. Обязательно проверь всё своими глазами, Шаннон. И ещё, мадам снова приказала нам поменять скатерти в столовой."""
Kumasawa Chiyo,"""О, зачем, когда мы ранее с таким трудом их меняли?.."""
Ushiromiya Natsuhi,"""Цвет скатерти не вписывается. Увидев её на фоне комнаты, я поняла, что она ему совсем не соответствует. Нам нужно постелить другую скатерть."""
Ushiromiya Natsuhi,"""Да, и вы точно почистили люстру в гостиной? Я не хочу, чтобы Ева смотрела вверх и говорила 'О, что, пыль? И даже паутина?' в который раз!"""
Ronoue Genji,"""Не беспокойтесь. Она уже была как следует вычищена и проверена. Сейчас я самостоятельно проведу окончательную проверку."""
Ushiromiya Natsuhi,"""Вот как? Хорошо. Займусь тем же. Шаннон, возьми молодых слуг и постели новую скатерть. Поищи что‐нибудь белое, придающее ощущение белизны."""
Shannon,"""Д‐да, как пожелаете."""
,"Нацухи нервничала даже больше, чем обычно. Она ходила тут и там, раздавая приказы."
,"Хотя небо уже темнело, слуги всё спешили."
,Завтра ежегодное семейное собрание.
,"Отдельные семьи нередко посещают остров, но все вместе они приезжают только в это время."
,"Самый важный день в году как для семьи Уширомия, так и для Роккенджимы."
,"Нацухи, несдержанная и нервная, продолжала приказывать слугам повторить то и это из‐за того, что выглядит всё‐таки недостаточно хорошо. Так продолжалось до поздней ночи."
,"Шаннон, у которой уже был многолетний опыт, Нацухи поставила в ответственное положение, поэтому её часто вызывали, чтобы высыпать на неё строгие приказы..."
,"Когда Шаннон закончила принимать душ и легла на кровать в приёмной слуг, она почти сразу же уснула......"
,......Я слышу шум ветра... откуда‐то издалека.
,......Он слегка отличается от шума ветра снаружи.
,"Словно...... я сижу в шезлонге в розарии, переворачиваюсь во сне...... и чувствую ветер в волосах."
,"Точно. ......Не звук, а чувство."
,Это...... сон?..
,"Как только я собралась принять своё предположение...... мне показалось, что со мной разговаривают."
,{m:-5:—}‐О боже. Работа слуги всё такая же скучная.
,"Не только скучная, но и трудная, строгая, ограничивающая, безрадостная..."
,В обмен на годы вашей службы вы получаете лишь определённый уровень уважения со стороны новых слуг.
,"И даже этого отнюдь не достаточно, чтобы отплатить вам за всю вашу тяжёлую работу..."
,"{a:c:""Как ты не устала от такой жизни?""}"
,Э? ......Кто?..
,"Ей не просто казалось, что с ней разговаривают. ......Она была потрясена, поняв, что так и есть."
,Открыв глаза...... Шаннон сглотнула.
Shannon,"""Г... ......где........."""
,Она не смогла сказать больше...... и буквально остолбенела.
,"Шаннон, спавшая на кровати...... очутилась в розарии."
,"Он напоминал розарий на Роккенджиме, но также и совершенно отличался."
,"Ведь...... розы были золотыми.{n}Не только цветы, но и кружащие бабочки."
,Золотой розарий потусторонней красоты.
,Шаннон сидела на стуле в беседке.{n}Словно заснула там и пробудилась ото сна.
,......Но что‐то было не так.
,Разве этот золотой розарий — сон?
,"По какой‐то странной причине казалось, что вся моя жизнь до сих пор была сном, и я наконец проснулась здесь..."
,"{a:c:""Добро пожаловать, Шаннон. Добро пожаловать в мой золотой розарий......""}"
,"Опять этот голос. Шаннон огляделась, смотря, кто это."
,Тогда же золотая бабочка приземлилась на стул напротив неё и немедленно приняла человеческий облик...
{f:5:Beatrice},"""Давно не виделись, Шаннон. Как поживаешь?.. Хотя уж это мне известно. Ведь я каждый день наблюдала за тобой."""
,"Она засмеялась так, будто была давней подругой Шаннон."
,"Но та, очевидно, не помнила ни странный золотой розарий, ни её лицо..."
{f:5:Beatrice},"""Точно. Ты же больше меня не помнишь."""
Shannon,""".........Я забыла вас?.. Прошу прощения, если так..."""
{f:5:Beatrice},"""Не нужно извиняться. Ты не виновата, я сама так сделала. ......Я представлюсь. Золотая ведьма, {f:5:Беатриче}."""
Shannon,"""......Го... госпожа...Беатриче?.. Б‐благодетельница семьи Уширомия, о которой всегда говорит Господин?.."""
{f:5:Beatrice},"""Не та Беатриче. Золотая ведьма, по ночам царствующая на Роккенджиме. ......Другая хозяйка особняка, которой ты всегда отдаёшь дань уважения."""
Shannon,"""В... ......вы... госпожа...{f:5:Беатриче}......"""
{f:5:Beatrice},"""Ха‐ха‐ха... Не нужно бояться. Мы же были подругами...... нет, соседками по комнате. В своё время я боготворила тебя и стремилась стать лучшей слугой."""
Shannon,"""......Я всегда жила в одноместной комнате, и у меня не могло быть......"""
{f:5:Beatrice},"""В последнюю нашу встречу я стёрла твою память. Но я не забыла, что когда‐то мы жили в одной комнате. ......А ещё я помню, как разрушила нашу дружбу и ушла."""
{f:5:Beatrice},"""И чтобы не оставлять тебя в одиночестве и печали, я стёрла все твои воспоминания и сам мир тех дней, которые мы провели вместе."""
Shannon,"""............"""
{f:5:Beatrice},"""Не нужно понимать... Поверь только в одно. Я позвала тебя сюда не для того, чтобы причинять вред."""
Shannon,"""Ра... разве я не во сне?.."""
{f:5:Beatrice},"""Можно сказать и так. Строго говоря, я заманила твою душу в свой сад, пока ты спала. Чтобы пригласить тебя в этот мир."""
,"{f:5:Беатриче} щёлкнула пальцами, и по розарию закружилась буря золотых бабочек."
,"Как только облако золотых бабочек прокружило над столом, появился великолепный чайный сервиз."
,"Чайные чашки и чайник оказались даже элегантнее тех, что были в семье Уширомия."
,"Чай был налит до краёв, и от него исходил сладкий аромат роз, который Шаннон никогда раньше не чувствовала."
,"Прежде чем настало время поразиться этому аромату, бабочки собрались над столом, и прямо из него проросла чайная подставка."
,Словно из‐под земли вырос волшебный гриб из сказочного царства.
,"Многоуровневая чайная подставка была наполнена чудесными пирожными, напоминающими съедобные драгоценности."
,"Разумеется, также было несколько восхитительных, светло‐коричневых булочек. Мёд был самый что ни на есть золотой, и в нём плавали кусочки золотых листьев......"
{f:5:Beatrice},"""В семье Уширомия порой устраивают чаепития, но их не сравнить с моими."""
Shannon,"""......Не... ...невероятно... Никогда не видела ничего подобного..."""
{f:5:Beatrice},"""*хи‐хи*хи‐хи*. Даже если и видела, то только когда была официанткой. Ты моя подруга. Мне не нужна официантка. Я же ведьма. Этого более чем достаточно. Ну же, не стесняйся. Бери что пожелаешь."""
Shannon,"""Бо... ......большое... спасибо......"""
,"Это всё, что Шаннон смогла выговорить. ......Было бы трудно сказать нечто большее после неожиданного приглашения на такое удивительное ведьмино чаепитие."
{f:5:Beatrice},"""Начнём с чёрного чая. Свежее молоко и такой восхитительный сахар, что его чуть ли не хочется съесть прямо так. Но я рекомендую тебе сначала попробовать чай. С плавающим сверху лепестком розы — одним и не более — он непременно окажется таким вкусным, что ты больше никогда не сможешь пить чёрный чай мира людей!.."""
,"Счастливо смеясь, {f:5:Беатриче} вместо сахарницы открыла горшочек с лепестками роз, взяла малиновый лепесток и, насладившись ароматом лепестка, опустила его в свой чай."
,Шаннон тоже взяла лепесток и вдохнула его аромат.
Shannon,"""......Такой приятный запах............ Так... пахнут все розы этого мира?"""
{f:5:Beatrice},"""Рада, что тебе нравится. Я выращиваю эту розу чисто ради лепестков для чёрного чая. Если их измельчить, они прекрасно подойдут и для варенья! К булочкам оно подходит лучше всего, что только можно себе представить. Хочешь попробовать?"""
Shannon,"""Э‐э, а...... да, совсем чуть‐чуть."""
,Шаннон пригласили на чаепитие ни с того ни с сего.
,"Но ведьма выглядела такой невинной, а её улыбка, когда она играла в хозяйку, была до того счастливой, что Шаннон тоже захотелось улыбнуться."
,"Напряжение в её сердце постепенно спало, и беседа с ведьмой начала доставлять ей удовольствие......"
{f:5:Beatrice},"""Работа слуги так утомительна. Я хорошо её помню. Особенно чистку подоконников в часовне."""
Shannon,"""Надо же. Вы тоже работали слугой?"""
{f:5:Beatrice},"""Недолго. Ты вряд ли помнишь, но мы работали вместе. Я была неуклюжей, вечно всё теряющей дурой, а ты была моим представлением об идеальной слуге и той, на кого я хотела походить."""
Shannon,"""......Из‐за этого мне ещё больше жаль, что я не помню."""
{f:5:Beatrice},"""Не нужно извиняться. Здесь ты не слуга, а моя подруга и гостья. Никаких неудобств, испытаний и скуки. Я могу дать тебе всё что пожелаешь. Вот какой силой я сейчас обладаю. ......Я хотела, чтобы ты узнала, каких высот я достигла."""
Shannon,"""......Я искренне благодарна вам за такой необычный приём."""
{f:5:Beatrice},"""*хи‐хи*! Считай это наградой за все те тяжёлые дни, что ты выдержала."""
{f:5:Beatrice},"""Ну же, золотые бабочки! Не дайте моей подруге заскучать! Покажите ей танец! Если тебе надоест, позволь мне позвать группу, которая исполнит для тебя любую песню. Когда устанешь от этого, мои утончённые знакомые покажут тебе фокусы."""
{f:5:Beatrice},"""Не бойся, здесь время бесконечно. И я могу бесконечно исполнять твои желания. Моему чаепитию нет конца!.."""
,"Пребывая в прекрасном настроении, ведьма рассказала Шаннон несколько причудливых историй."
,"Она никогда раньше не слышала их. Очень интересные истории. И все они были странными, причудливыми сказками."
,"Шаннон показалось, что она стала Алисой в стране чудес. Время, которое она провела за этим чаепитием, было странным, приятным и спокойным."
,"Нет, на этом чаепитии у часов нет стрелок."
,"Время шло словно в воскресное утро, когда можно насколько хочешь закутаться в одеяло......"
Shannon,"""......Мне не выразить, как я благодарна вам."""
{f:5:Beatrice},"""Меня не нужно благодарить. В мире людей слова благодарности стоят рядом с прощальными словами. Этому чаепитию не будет конца. Поэтому и благодарность не нужна."""
Shannon,"""*хи‐хи*. И всё же, я благодарна. Большое спасибо за удивительное чаепитие, госпожа {f:5:Беатриче}. ......Но все сны должны заканчиваться, в том числе и этот."""
{f:5:Beatrice},"""Хо. И почему же?"""
Shannon,"""Потому что...... мне завтра рано начинать. Я просплю, если задержусь здесь, и мадам меня отругает..."""
{f:5:Beatrice},"""Пф‐ф, ха‐ха‐ха‐ха‐ха‐ха‐ха‐ха! Почему тебе так не терпится вернуться в мир этой вспыльчивой Нацухи? Нет, в самом деле. Ты всерьёз хочешь вернуться в мир {y:0:Люд}{n:0:люд}ей, где одна работа и никаких наград?"""
Shannon,"""Но я {y:0:Человек}{n:0:человек}. Я не могу вечно навязываться вам."""
{f:5:Beatrice},"""Шаннон. Ты не понимаешь. Я пригласила тебя сюда, но не желаю выпроваживать."""
{f:5:Beatrice},"""Здесь время вечно. Ты вовсе не обязана прощаться. Мне никогда не надоест наслаждаться с тобой чаем. Напротив, с тобой очень приятно разговаривать."""
Shannon,"""Я благодарна вам за ваши слова, но я {y:0:Человек}{n:0:человек}. Мне нужно вернуться в свой мир."""
{f:5:Beatrice},"""Зачем тебе возвращаться в тот бесцветный мир, где ты всё своё время тратишь на школу и работу и перегружаешься в этом доме?"""
Shannon,"""И всё же...... тот мир по‐прежнему мой."""
{f:5:Beatrice},"""Шаннон. Твоим миром действительно должен быть такой мир? Буду с тобой откровенна. ......Шаннон. Я не просто пригласила тебя сюда. Я пришла отвести тебя домой."""
Shannon,"""Отвести домой?.."""
{f:5:Beatrice},"""Когда‐то так же, как ты, я стремилась стать хорошей слугой. ......Потом меня очаровали ведьмы, и я сама стала ведьмой, познав все прелести магии. ......И теперь я пришла отвести тебя домой."""
,Тихо сказала {f:5:Беатриче} и медленно поднялась с места.
{f:5:Beatrice},"""Шаннон. ......Мир ведьм гораздо интереснее жизни слуги. На этом чаепитии я лишь встретила старую подругу. Мы можем устраивать сколько угодно весёлых праздников. Всегда, бесконечно."""
{f:5:Beatrice},"""......Раз этот золотой розарий завершён, я достигла своей цели. Это место — рай. Да, назовём его Золотым раем. И с его завершением я пришла пригласить тебя сюда. Никаких неудобств, давления и тяжёлой работы. Здесь мы с тобой можем развлекать себя целую вечность. Это будет похоже на бесконечную сказку......"""
Shannon,"""......Я искренне благодарна вам за великолепное предложение. ......И всё же, мне нужно вернуться в свой первоначальный мир."""
{f:5:Beatrice},"""Почему?"""
Shannon,"""Потому что этот мир — не мой."""
{f:5:Beatrice},"""Я признаю. Это не тот мир, в котором ты жила. Вот почему я пригласила тебя сюда!"""
{f:5:Beatrice},"""Отныне этот мир станет нашим. Ты больше не гостья. Ты — вторая хозяйка этого мира. Не нужно сдерживаться ради меня. Мы просто будем жить в этом бесконечном мире так же, как раньше жили в одной комнате......"""
Shannon,"""Жаль, что я не помню то время. ......Hо мне придётся отклонить ваше приглашение."""
{f:5:Beatrice},"""Почему?......Какая ответственность вынуждает тебя вернуться в мир людей?"""
,"Да, мир людей или же мир слуг всё время завален работой."
,"Мадам строгая, чересчур нервная и вспыльчивая."
,"Было бы ложью говорить, что повседневные заботы не доставляют хлопот, а балансирование работы с учёбой только всё усложняет."
,{f:5:Беатриче} постоянно наблюдала за тяжёлыми днями Шаннон.
,"Она много раз видела, как у неё тяжелели плечи от усталости."
,Именно поэтому она пригласила Шаннон сюда. В этот Золотой рай.
,"Она постаралась идеально встретить её, чтобы по‐настоящему осчастливить."
,......Так почему Шаннон выбрала свой первоначальный мир взамен этому?
,"{f:5:Беатриче} одолел шок, и она совершенно не понимала."
{f:5:Beatrice},"""Я устроила тебе идеальный приём в этот рай. Последующие дни будут ещё веселее."""
{f:5:Beatrice},"""......И если ты после всего этого до сих пор выбираешь человеческий мир, получается, там ты нашла нечто ещё лучше радостей ведьм?"""
Shannon,"""......Да. В мире {y:0:Люд}{n:0:люд}ей есть то, что ещё лучше магии."""
{f:5:Beatrice},"""Абсурд... Не может быть!.."""
Shannon,"""...Нет, может."""
,Выражение Шаннон было мягким.
,Но говорила она твёрдо. В мире {y:0:Люд}{n:0:люд}ей есть нечто восхитительно‐ завораживающее.
,"И этого нет в раю, где должно быть всё, что они захотят......"
{f:5:Beatrice},""".........Абсурд... ......Я... не понимаю......"""
,"Пробормотав, {f:5:Беатриче} беспокойно дёрнулась."
,"Но сколько бы она ни говорила, улыбка Шаннон не померкла, и {f:5:Беатриче} не нашла что ответить..."
Shannon,"""Что ж...... мне пора уходить. Ваш чай был восхитителен."""
{f:5:Beatrice},""".........Я... не понимаю. ......Я — великая Золотая ведьма, у которой бесконечно может быть что угодно. Хочешь сказать, я не могу дать тебе то, что ты хочешь?"""
Shannon,""".........Да."""
{f:5:Beatrice},"""Я хочу знать. Я считала, что у меня есть всё, так скажи, чего мне не хватает!.."""
Shannon,"""Думаю...... вы уже знаете. Разве не поэтому вы пригласили меня сюда?.."""
{f:5:Beatrice},"""......Говоришь с ведьмой загадками? ......Хех... *хи‐хи*."""
Shannon,"""Тогда на этом всё...... Я не могу жить здесь, но буду рада прийти в любое время, когда вы пригласите меня на чай."""
{f:5:Beatrice},"""Я больше не позову тебя... Не бойся."""
,"{f:5:Беатриче} щёлкнула пальцами, и Шаннон исчезла."
,Её душа вернулась в сон первоначальной Шаннон.
,"Хотя людям за ночь много чего снится, они ничего не помнят."
,Чаепитие в этом раю смешалось со многими другими снами и исчезло.
