,"No, it wasn't shadows of ""people"". ...Because ","No, the phrase ""shadows of people"" wasn't right.{n}Because that referred to {y:0:Human}{n:0:human} shadows."," No, the phrase 'shadows of people' wasn't right. Because that referred to human shadows.",いや、それは人影という言葉は相応しくない。なぜなら、人影はニンゲンの影のことだ。,いや、それは人影という言葉は相応しくない。{n}なぜなら、人影はニンゲンの影のことだ。,"Нет, фраза ""людские тени"" была не совсем верна.{n}Поскольку это относилось к {y:0:Челове}{n:0:челове}ческим теням.","Não, a frase ""sombra de uma pessoa"" não está correta.{n}Porque ela se refere a sombras {y:0:Humanas}{n:0:humanas}.","No, the phrase ""shadows of people"" wasn't right.{n}Because that referred to {y:0:Human}{n:0:human} shadows.",不對，人影這個詞用得不恰當。{n}因為人影，指的是人類的身影。,不对，人影这个词用得不恰当。{n}因为人影，指的是人类的身影。,"No, the phrase ""shadows of people"" wasn't right.{n}Because that referred to {y:0:Human}{n:0:human} shadows.","No, l'espressione ‘ombre di alcune persone’ non era giusta. Perché si riferisce a ombre umane.","No, l'espressione ‘figure ombrose’ non era appropriata.{n}Perché essa fa riferimento alle ombre degli {y:0:Umani}{n:0:umani}...","Hayır, ""insan gölgeleri"" ifadesi doğru değildi.{n}Çünkü bu, {y:0:İnsan}{n:0:insan} gölgelerine atıfta bulunuyordu."
,they weren't Human at all!! ,"......You can't call the shadows of beings that aren't {y:0:Human}{n:0:human} ""shadows of people""!!",......You can't call the shadows of beings that aren't human shadows of people!!,……ニンゲンじゃない存在の影は、人影とは表現できない！！,……ニンゲンじゃない存在の影は、人影とは表現できない！！,"......Невозможно назвать тени существ, не являющихся {y:0:Л}{n:0:л}юдьми, тенями {y:0:Л}{n:0:л}юдей!","......Você não pode dizer que aquelas sombras de seres que não são {y:0:Humanos}{n:0:humanos} são ""sombras de uma pessoa""!!","......You can't call the shadows of beings that aren't {y:0:Human}{n:0:human} ""shadows of people""!!",……並非人類的東西的身影，不能用人影來表達！！,……并非人类的东西的身影，不能用人影来表达！！,"......You can't call the shadows of beings that aren't {y:0:Human}{n:0:human} ""shadows of people""!!",... Non si possono definire così le ombre di creature che non sono umane!!,Le ombre di chi non è {y:0:Umano}{n:0:umano} non possono essere descritte in quella maniera!!,"......{y:0:İnsan}{n:0:insan} olmayan varlıkların gölgelerine ""insan gölgeleri"" diyemezsiniz!!"
Gohda Toshiro,"""...............G‐ George-sama!!! H- Hurry..."" ","""...............G‐......George‐sama!!! H‐......hurry......""","""............G, ......George-sama!!! H, ......hurry......""",「……………じょ、……譲治さまッ！！！　い、……急いで……。」,「……………じょ、……譲治さまッ！！！　い、……急いで……」,"""............Д... Джордж‐сама!!! П... поспешите...""","""...............G‐......George‐sama!!! R‐......Rápido......""","""...............G‐......George‐sama!!! H‐......hurry......""",「……………讓、……讓治少爺！！！快、……快一點……」,「……………让、……让治少爷！！！快、……快一点……」,"""...............G‐......George‐sama!!! H‐......hurry......""","""... G... George-sama!!! P... Presto...""","""...S‐Signorino George!!! P‐Presto...""","""...............G-......George-sama!!! Ç-......Çabuk......"""
,Gohda's voice trailed off... It was the shock...of seeing a procession of those not of this world. ,Gohda's voice trailed off...{n}It was the shock from seeing a procession of those not of this world.,Gohda's voice trailed off... It was the shock from seeing a procession of those not of this world.,郷田の語尾が弱々しくなっていく…。それはこの世ならぬ者たちの行列を見ての、驚愕。,郷田の語尾が弱々しくなっていく…。{n}それはこの世ならぬ者たちの行列を見ての、驚愕。,"Голос Годы затих...{n}Затих от шока, вызванным зрелищем процессии тех, кто не принадлежал этому миру.",A voz de Gohda foi interrompida...{n}Era o choque de ver um processo de algo que não era deste mundo.,Gohda's voice trailed off...{n}It was the shock from seeing a procession of those not of this world.,鄉田的語尾越來越沒中氣…。{n}這是看了非人世者們的行列後的，驚愕。,乡田的语尾越来越没中气…。{n}这是看了非人世者们的行列后的，惊愕。,Gohda's voice trailed off...{n}It was the shock from seeing a procession of those not of this world.,La voce di Gohda si spense... era lo shock di aver visto una processione di coloro che non appartengono a questo mondo.,"Alla fine della sua frase, la voce di Gouda si affievolì...{n}Era lo spavento dovuto all'aver assistito alla processione di una folla che non apparteneva a questo mondo.",Gohda'nın sesi yarıda kesildi...{n}Bu dünyadan olmayanların alayını görmenin şokuydu.
,He was a servant. So he knew all the servants working for the Ushiromiya family. ,He was a servant.{n}So he knew all of the servants that worked for the Ushiromiya family., He was a servant. So he knew all of the servants that worked for the Ushiromiya family.,彼は使用人だった。だから右代宮家に勤める使用人たちを全て知っていた。,彼は使用人だった。{n}だから右代宮家に勤める使用人たちを全て知っていた。,"Он был слугой.{n}Поэтому он знал всех слуг, работавших на семью Уширомия.",Ele era um serviçal.{n}Por isso conhecia todos os serviçais que trabalhavam para a família Ushiromiya.,He was a servant.{n}So he knew all of the servants that worked for the Ushiromiya family.,他是傭人。{n}所以認識在右代宮家工作的所有傭人。,他是佣人。{n}所以认识在右代宫家工作的所有佣人。,He was a servant.{n}So he knew all of the servants that worked for the Ushiromiya family.,Lui era un domestico. Perciò conosceva tutti i domestici che lavoravano per la famiglia Ushiromiya.,"Lui era un domestico.{n}Pertanto, conosceva tutti i domestici al servizio della famiglia Ushiromiya...",Gohda bir hizmetkârdı.{n}Yani Ushiromiya ailesi için çalışan tüm hizmetkârları tanıyordu.
,"...But he didn't know about these. However, they were definitely servants...!! ","...But he didn't know about these.{n}However, they were definitely servants...!!","...But he didn't know about these. However, they were definitely servants...!! ",…でも彼らの存在は知らなかった。しかし、彼らは間違いなく使用人なのだ…！！,…でも彼らの存在は知らなかった。{n}しかし、彼らは間違いなく使用人なのだ…！！,"...Но этих он не знал.{n}Однако, это несомненно была прислуга!","...Mas ele não sabia sobre aqueles.{n}Entretanto, eles definitivamente eram serviçais...!!","...But he didn't know about these.{n}However, they were definitely servants...!!",…但他並不知道他們的存在。{n}然而，他們卻毫無疑問就是傭人…！！,…但他并不知道他们的存在。{n}然而，他们却毫无疑问就是佣人…！！,"...But he didn't know about these.{n}However, they were definitely servants...!!","... Ma non conosceva questi qui. Eppure, essi erano senza ombra di dubbio dei domestici...!!","Ma non sapeva della loro esistenza.{n}Loro però erano dei domestici, senza ombra di dubbio...!!","...Ama bunları tanımıyordu.{n}Ancak, onlar kesinlikle hizmetkârlardı...!!"
,And not servants working for Ushiromiya Kinzo or Ushiromiya Krauss. ,They weren't servants working for Ushiromiya Kinzo or Ushiromiya Krauss.,They weren't servants working for Ushiromiya Kinzo or Ushiromiya Krauss.,右代宮金蔵や右代宮蔵臼に仕える使用人ではない。,右代宮金蔵や右代宮蔵臼に仕える使用人ではない。,"Они не были прислугой, служащей Уширомии Кинзо или Уширомии Крауссу.",Não eram os serviçais que trabalhavam para Ushiromiya Kinzo nem para Ushiromiya Krauss.,They weren't servants working for Ushiromiya Kinzo or Ushiromiya Krauss.,不是仕奉右代宮金藏和右代宮藏臼的傭人。,不是仕奉右代宫金藏和右代宫藏臼的佣人。,They weren't servants working for Ushiromiya Kinzo or Ushiromiya Krauss.,Non erano domestici alle dipendenze di Kinzo Ushiromiya o Krauss Ushiromiya.,"Non erano domestici alle dipendenze di Kinzo Ushiromiya, e neppure a quelle di Klaus Ushiromiya...",Ushiromiya Kinzo ya da Ushiromiya Krauss için çalışan hizmetkârlar değillerdi.
,"...These new servants, who worked for the new master of the mansion, the Golden Witch {f:5:Beatrice}, had goat heads and bright-red, boiled eyes of lava!! ","...They were new servants, who worked for the new master of the mansion, the Golden Witch {f:5:Beatrice}, and who had goats' heads and bright‐red, boiled eyes of lava!!","...They were new servants, who worked for the new master of the mansion, the Golden Witch Beatrice, who had goat's heads and bright-red, boiled eyes of lava!! ",…新しき屋敷の主、黄金の魔女ベアトリーチェに仕える、山羊の頭を持ち、真っ赤に煮えたぎった溶岩の眼を持つ、新しき使用人たちッ！！,…新しき屋敷の主、黄金の魔女ベアトリーチェに仕える、山羊の頭を持ち、真っ赤に煮えたぎった溶岩の眼を持つ、新しき使用人たちッ！！,"...То были новые слуги, служившие новой хозяйке особняка, Золотой Ведьме {f:5:Беатриче}, у которых были козлиные головы и ярко‐красные, кипящие лавой глаза!","...Eram novos servos, que trabalhavam para o novo mestre da mansão, a Bruxa Dourada {f:5:Beatrice}, e que tinham cabeças de cabras e olhos de um vermelho vibrante, ferventes como lava!!","...They were new servants, who worked for the new master of the mansion, the Golden Witch {f:5:Beatrice}, and who had goats' heads and bright‐red, boiled eyes of lava!!",…而是仕奉大屋的新主人，黃金的魔女貝阿朵莉切，長著山羊頭，有沸騰著的紅色熔岩之眼的新傭人！！,…而是仕奉大屋的新主人，黄金的魔女贝阿朵莉切，长着山羊头，有沸腾着的红色熔岩之眼的新佣人！！,"...They were new servants, who worked for the new master of the mansion, the Golden Witch {f:5:Beatrice}, and who had goats' heads and bright‐red, boiled eyes of lava!!","... Erano dei nuovi servitori, che lavoravano per il nuovo padrone della villa, la Strega Dorata Beatrice, che avevano teste di caproni e occhi rossi di lava!!","Erano dei nuovi domestici, i quali erano al servizio della Strega Dorata {f:5:Beatrice}, la nuova padrona della villa, e avevano la testa di capra e degli occhi rosso vivo come la lava ardente!!","...Onlar, malikanenin yeni efendisi Altın Cadı {f:5:Beatrice} için çalışan, keçi kafalı ve parlak kırmızı, kaynayan lav gözlü yeni hizmetkârlardı!"
,"As the new master laughed loudly and trimly directed six of the new servants, he saw them approach, piercing the darkness as they came. ","As the new master laughed loudly and trimly directed six of the new servants, he saw her pierce the darkness as she came.","As the new master laughed loudly and trimly directed six of the new servants, he saw them pierce the darkness as they came.",新しき主が高笑いしながら、新しき使用人たちを６人も整然と率いながら、廊下の彼方から暗闇を切り裂きながらやって来るのが見えた。,新しき主が高笑いしながら、新しき使用人たちを６人も整然と率いながら、廊下の彼方から暗闇を切り裂きながらやって来るのが見えた。,"В то время как новая хозяйка громко рассмеялась и лёгким жестом направила шесть новых слуг, он разглядел их фигуры, рассекающие темноту.","Quando o novo mestre deu uma grande risada e se direcionou para seus seis novos servos, ele a viu perfurando a escuridão enquanto se aproximava.","As the new master laughed loudly and trimly directed six of the new servants, he saw her pierce the darkness as she came.",鄉田看到了新主人率領著整然有序的六名新傭人，一邊高聲笑著一邊撕裂了黑暗，從走廊的彼方向這邊走來。,乡田看到了新主人率领着整然有序的六名新佣人，一边高声笑着一边撕裂了黑暗，从走廊的彼方向这边走来。,"As the new master laughed loudly and trimly directed six of the new servants, he saw her pierce the darkness as she came.","Mentre la nuova padrona rideva forte e dava istruzioni a sei dei nuovi servitori senza esitare, li vide perforare l'oscurità mentre si facevano avanti.","Ridendo fragorosamente, la nuova padrona capitanava con disciplina sei nuovi servitori, e li vide farsi strada mentre laceravano la lontana oscurità del corridoio...","Yeni efendi yüksek sesle kahkahalar atarak altı yeni hizmetkârı yönlendirirken, kadının karanlığı delerek geldiğini gördü."
,"...Of course, she was clad in the gold butterflies that were her symbol. ","...Of course, she was clad in the gold butterflies that were her symbol.","...Of course, she was clad in the gold butterflies that were her symbol.",…もちろん、彼女の象徴である黄金の蝶たちをまといながら。,…もちろん、彼女の象徴である黄金の蝶たちをまといながら。,"...Разумеется, она была окружена золотыми бабочками, являвшимися её символом.","...É claro, ela estava revestida pelas borboletas douradas que eram o seu símbolo.","...Of course, she was clad in the gold butterflies that were her symbol.",…當然，她的象徵黃金蝴蝶們也緊隨左右。,…当然，她的象征黄金蝴蝶们也紧随左右。,"...Of course, she was clad in the gold butterflies that were her symbol.","... Naturalmente, lei era avvolta dalle farfalle dorate che erano il suo simbolo.","Come c'era da aspettarsi, lei era attorniata dalle sue icone, le farfalle dorate.","...Tabii ki, kendisinin sembolü olan altın kelebeklerle kaplıydı."
,Gohda hurriedly closed the door and locked it! ,Gohda hurriedly closed the door and locked it!, Gohda hurriedly closed the door and locked it! ,郷田は慌てて扉を閉め、そして施錠する！,郷田は慌てて扉を閉め、そして施錠する！,Года поспешно захлопнул дверь и запер её!,Gohda apressadamente fechou a porta e a trancou!,Gohda hurriedly closed the door and locked it!,鄉田手忙腳亂地關上門，然後上了鎖！,乡田手忙脚乱地关上门，然后上了锁！,Gohda hurriedly closed the door and locked it!,Gohda chiuse la porta in fretta e la chiuse a chiave!,"Gouda si affrettò a chiudere la porta, e la serrò a chiave!",Gohda aceleyle kapıyı kapattı ve kilitledi!
,"However, just as he locked it, it returned to normal, just as though a spring or something had knocked it back! ","However, the instant he locked it, it returned to normal, just as though it had been knocked back by a spring or something!","However, just as he locked it, it returned to normal, just as though a spring or something had knocked it back! ",ところが施錠した途端、まるでバネか何かで弾き返されるように元に戻ってしまう！,ところが施錠した途端、まるでバネか何かで弾き返されるように元に戻ってしまう！,"Однако как только он запер её, она снова разблокировалась, как будто кто‐то открыл её обратно!","Porém, no instante que ele a trancou, ela retornou ao normal, como se tivesse sido empurrada por uma mola ou algo assim!","However, the instant he locked it, it returned to normal, just as though it had been knocked back by a spring or something!",可是剛一鎖好，門就像被彈簧還是別的什麼彈回來似的變回了原樣！,可是刚一锁好，门就像被弹簧还是别的什么弹回来似的变回了原样！,"However, the instant he locked it, it returned to normal, just as though it had been knocked back by a spring or something!","Tuttavia, appena l'ebbe chiusa a chiave, essa tornò normale, come se una molla o qualcosa del genere avesse riaperto la serratura!","Ciononostante, non appena fece scattare la serratura, quella ritornò come prima, come se fosse stata respinta da una molla o da qualcosa di simile!","Ancak, tam kilitlediği anda, kilit sanki bir şey onu geri çevirmiş gibi normale döndü!"
,It gave the illusion that some prankster beyond the door was unlocking it every time he locked it. ,It almost gave the illusion that some prankster on the other side of the door was opening it every time he closed it.,Just as though some prankster on the other side of the door was creating the illusion that it was opening every time he closed it.,まるで、扉の向こうにいるイタズラ者が、閉める度に開けてしまっているような、錯覚。,まるで、扉の向こうにいるイタズラ者が、閉める度に開けてしまっているような、錯覚。,"Словно какой‐то шутник по другую сторону двери создал иллюзию, что она открывается, каждый раз, когда он запирает её.",Quase dando a ilusão de que algum brincalhão do outro lado da porta estivesse abrindo‐a cada vez que era fechada.,It almost gave the illusion that some prankster on the other side of the door was opening it every time he closed it.,簡直給人造成一種，門的另一邊有個搗蛋鬼，每當關上門他就再開鎖推門的錯覺。,简直给人造成一种，门的另一边有个捣蛋鬼，每当关上门他就再开锁推门的错觉。,It almost gave the illusion that some prankster on the other side of the door was opening it every time he closed it.,Come se dall'altra parte della porta qualche burlone stesse creando l'illusione che la porta si aprisse ogni volta che lui la chiudeva.,"Era come se, dall'altro lato della porta, qualche burlone stesse creando l'illusione che la porta si aprisse ogni qualvolta lui la chiudeva...",Adeta her kilitlediğinde kapının diğer tarafındaki bir şakacının kilidi geri açtığı izlenimini veriyordu.
,...They couldn't have reached the other side of the door yet!! ,"......Distance‐wise, they shouldn't have reached the other side of the door yet!!",......They shouldn't have reached the other side of the door yet!! ,……距離的に、彼らはまだ扉の向こうに至っていないはず！！,……距離的に、彼らはまだ扉の向こうに至っていないはず！！,......Она же ещё не успела добраться до другой стороны двери!!!,"......Daquela distância, eles não deveriam ter chegado ao outro lado da porta ainda!!","......Distance‐wise, they shouldn't have reached the other side of the door yet!!",……從距離上講，他們理應還沒有到門邊！！,……从距离上讲，他们理应还没有到门边！！,"......Distance‐wise, they shouldn't have reached the other side of the door yet!!",... I servi non avrebbero potuto raggiungere già la porta!!,"A giudicare dalla distanza, non dovevano ancora essere giunti dall'altro lato della porta!!","......Uzaklık nedeniyle, henüz kapının diğer tarafına ulaşmamış olmaları gerekirdi!!"
,"So who was doing it, and how...?! ","Then who, how...?!","Then who, how...?! ",じゃあ、誰が、どうやって…？！,じゃあ、誰が、どうやって…？！,В таком случае как?!,"Então, quem, como...?!","Then who, how...?!",那麼到底是誰，又是怎麼做的…？！,那么到底是谁，又是怎么做的…？！,"Then who, how...?!","Allora chi, come...?!",Allora chi... Come...?!,"O zaman kim, nasıl...?!"
,It almost felt like playing with a broken toy. ,It felt just like playing with a broken toy.,It felt just like playing with a broken toy.,まるで壊れた玩具で遊んでいるような感覚。,まるで壊れた玩具で遊んでいるような感覚。,"Он чувствовал себя так, словно играет со сломанной игрушкой.",Era como se estivesse brincando com um brinquedo quebrado.,It felt just like playing with a broken toy.,簡直就像是在玩壞了的玩具似的。,简直就像是在玩坏了的玩具似的。,It felt just like playing with a broken toy.,Sembrava di giocare con un giocattolo rotto.,Era come armeggiare con un giocattolo rotto.,Kırık bir oyuncakla oynuyormuş gibi hissediyordu.
,"*click*, *boing*. *click*, *boing*. ","Click, boing.{n}Click, boing!!","*click*, *boing*.*click*, *boing*.",ガチャリ、ビヨン。ガチャリ、ビヨン！！,ガチャリ、ビヨン。{n}ガチャリ、ビヨン！！,"*Клац*, *щелк*.{n}*Клац*, *щелк*.","*click*, *boing*.{n}*click*, *boing*!!","Click, boing.{n}Click, boing!!",咔嚓，嘭～。{n}咔嚓，嘭～！！,咔嚓，嘭～。{n}咔嚓，嘭～！！,"Click, boing.{n}Click, boing!!","*click*, *boing*. *click*, *boing*.","Clink, boing.{n}Clink, boing!!","*klik*, *boing*.{n}*klik*, *boing*!!"
Gohda Toshiro,"""U-Uwaaaaaaaaaaaaaaa!! I-It won't lock!! Even if I lock it, it unlocks! What's going on, dammitdammitdammitdammit!!"" ","""U‐uwaaaaaaaaaaaaaaa!! I‐it won't close!! It opens even if I close it! What's going on, damnitdamnitdamnitdamnit!!""","""U, uwaaaaaaaaaaaaaaa!! I, it won't close!! Even if I close it, it opens! What's going on, damnitdamnitdamnitdamnit!!""",「う、うわあああぁああああぁあ！！　し、閉まらない！！　閉めても開いてしまう！　どうなってんだこりゃ、くそくそくそくそ！！」,「う、うわあああぁああああぁあ！！　し、閉まらない！！　閉めても開いてしまう！　どうなってんだこりゃ、くそくそくそくそ！！」,"""У... ува‐а‐а‐а‐а‐а‐а‐аа‐а‐а‐а‐а‐а‐а!!! О... она не закрывается!!! Даже когда я замыкаю, она открывается! Что происходит, проклятьепроклятьепроклятьепроклятье!!!""","""U‐Uwaaaaaaaaaaaaaaa!! N‐Não fecha!! Ela abre toda vez que eu a fecho! O que está acontecendo?! Merdamerdamerdamerda!!""","""U‐uwaaaaaaaaaaaaaaa!! I‐it won't close!! It opens even if I close it! What's going on, damnitdamnitdamnitdamnit!!""",「嗚、嗚哇啊啊啊啊啊啊啊啊啊啊啊！！關、關不上！！就算關好了也會開！怎麼回事啊這個，可惡可惡可惡可惡！！」,「呜、呜哇啊啊啊啊啊啊啊啊啊啊啊！！关、关不上！！就算关好了也会开！怎么回事啊这个，可恶可恶可恶可恶！！」,"""U‐uwaaaaaaaaaaaaaaa!! I‐it won't close!! It opens even if I close it! What's going on, damnitdamnitdamnitdamnit!!""","""U-Uwaaaaaaaaaaaaaaa!! N-Non si chiude!! Anche se la chiudo, si riapre! {n}Che sta succedendo, dannazione,dannazione,dannazione,dannazione!!""","""U-Uwaaaaaaaaaaah!! N-Non si chiude!! Si apre anche se la chiudo! Ma che ha, cazzocazzocazzocazzo!!""","""U-uwaaaaaaaaaaaaaaa!! K-Kilitlenmiyor!! Kilitlesem bile açılıyor! Neler oluyor, kahretsinkahretsinkahretsinkahretsin!!"""
