{f:5:Beatrice},"""...If there's even a small loophole, they'll immediately say something like ""increase the number of wishes to one hundred"", or ""go turn yourself into a bean""."" ","""...If there's even a small loophole, they'll immediately say something like ""increase the number of wishes to one hundred"", or ""try transforming into a tiny speck"".""","""...If there's even a small loophole, they'll immediately say something like 'Increase the number of wishes to one hundred', or 'try changing into a tiny speck'.""",「…少しでも隙があると、連中はすぐに“叶える願いの数を百に増やせ”とか“小さな豆粒に変身してみろ”とか言い出す。」,「…少しでも隙があると、連中はすぐに“叶える願いの数を百に増やせ”とか“小さな豆粒に変身してみろ”とか言い出す」,"""...Если есть хоть малейшая лазейка, то вы тут же говорите что‐то вроде 'увеличь количество желаний до ста' и 'используете любую возможность'.""","""...Se tiver uma pequena lacuna, eles imediatamente vão dizer coisas como ""aumente o número de desejos para cem"", ou ""tente transformar isso em uma pequena partícula"".""","""...If there's even a small loophole, they'll immediately say something like ""increase the number of wishes to one hundred"", or ""try transforming into a tiny speck"".""",「…稍有空子可鑽，那伙人就會馬上說出“把願望的數量增加到一百”呀“變身成小豆粒看看”呀。」,「…稍有空子可钻，那伙人就会马上说出“把愿望的数量增加到一百”呀“变身成小豆粒看看”呀。」,"""...If there's even a small loophole, they'll immediately say something like ""increase the number of wishes to one hundred"", or ""try transforming into a tiny speck"".""","""... Se c'è anche la più piccola scappatoia, diranno subito qualcosa come ‘Aumenta il numero dei desideri da uno a cento’, oppure ‘prova a trasformarti in un granello minuscolo’.""","""...Se c'è anche la benché minima scappatoia, chiederanno subito cose come: ‘Aumenta il numero dei desideri a cento’, o: ‘Prova a trasformarti in un minuscolo granello’.""","""...Küçük bir boşluk bile olsa, hemen ""dilek sayısını yüze çıkar"" veya ""küçük bir nesneye dönüşmeyi dene"" gibi ifadelerde bulunurlar."""
Ushiromiya Battler,"""...There's this thing Dad always says. He says there's nothing as scary as contracts. ...According to him, it's only natural that people who sign without reading them thoroughly will get chewed to the bone. ...He's made a killing through vice."" ","""......Dad often tells me something. He says that there's nothing as scary as contracts. ......He said it's only natural that people who agree without reading them thoroughly will be chewed to the bone. ...He made a killing through vice.""","""......Dad often tells me something. He says that there's nothing as scary as contracts. ......He said it's only natural that people who agree without reading them thoroughly will be chewed to the bone. ...He made a killing through vice.""",「……親父によく言われたぜ。契約書ほど怖ぇもんはねぇって。……よく読まずにハンコを押すヤツは、骨の髄までしゃぶられて当然だって言ってたぜ。…悪徳で荒稼ぎしてやがったんだな。」,「……親父によく言われたぜ。契約書ほど怖ぇもんはねぇって。……よく読まずにハンコを押すヤツは、骨の髄までしゃぶられて当然だって言ってたぜ。…悪徳で荒稼ぎしてやがったんだな」,"""......Мой отец часто говорил мне. Он повторял, что нет ничего страшней контрактов. ......Он говорил, что люди, подписывающие их не читая, естественно будут обглоданы до костей. ...Эдакое убийство через безнравственность.""","""......Meu pai me disse algo assim uma vez. Ele disse que não existe nada mais assustador que contratos. ......Ele disse que é natural que pessoas que concordam sem ler tudo sejam mastigadas até os ossos. ...Ele fez dinheiro fácil através do vício.""","""......Dad often tells me something. He says that there's nothing as scary as contracts. ......He said it's only natural that people who agree without reading them thoroughly will be chewed to the bone. ...He made a killing through vice.""",「……老爸常跟我說。契約書比什麼都可怕。……不好好看過就蓋上圖章的傢伙，活該被啃到骨髓。…定是做過缺德圈錢的勾當了吧。」,「……老爸常跟我说。契约书比什么都可怕。……不好好看过就盖上图章的家伙，活该被啃到骨髓。…定是做过缺德圈钱的勾当了吧。」,"""......Dad often tells me something. He says that there's nothing as scary as contracts. ......He said it's only natural that people who agree without reading them thoroughly will be chewed to the bone. ...He made a killing through vice.""","""... Papà mi dice spesso una cosa. Lui dice che non c'è nulla di più spaventoso di un contratto. ... Mi ha detto che è normale che le persone che acconsentono all'accordo senza leggere saranno divorati fino al midollo. ... Ha fatto un sacco di soldi tramite inganni.""","""...Il mio vecchio mi diceva spesso una cosa: ‘Non c'è nulla di più spaventoso di un contratto’. Mi raccontava come sia normale che le persone che firmano senza leggere attentamente vengano spolpate fino al midollo... Ha guadagnato una fortuna con questi mezzucci.""","""......Babamın bana sık sık söylediği bir şey var. Sözleşmeler kadar korkutucu bir şey olmadığını söyler. ......Sözleşmeleri iyice okumadan kabul eden insanların iliklerine kadar kemirilmesinin doğal olduğunu söylerdi. ...Kötü yollardan para kazandı."""
{f:5:Beatrice},"""......Imagine it. When people are born, they know nothing of fraud. ...They get it from somewhere. And so they learn it."" ","""............Realize this. People do not know of fraud from birth. ...They suffer it somewhere. And so it is learned.""","""............Imagine it. When people are born, they don't know of fraud. ...They get it from somewhere. And so they learn it.""",「…………察しろ。人は生まれながらに詐欺を知りはせぬ。…どこかで被った。だから覚えた。」,「…………察しろ。人は生まれながらに詐欺を知りはせぬ。…どこかで被った。だから覚えた」,"""............Только представь. Рождаясь люди не ведают об обмане. ...Они узнают о нём из окружающего мира. И сами учатся обманывать.""","""............Perceba isto. As pessoas não conhecem a fraude desde o nascimento. ...Eles sofrem com ela em determinado momento. E então aprendem.""","""............Realize this. People do not know of fraud from birth. ...They suffer it somewhere. And so it is learned.""",「…………體諒一下呀。人出生時是不懂欺詐的。…在哪遭過殃，才會學會。」,「…………体谅一下呀。人出生时是不懂欺诈的。…在哪遭过殃，才会学会。」,"""............Realize this. People do not know of fraud from birth. ...They suffer it somewhere. And so it is learned.""","""... Immaginalo. Quando le persone nascono, non conoscono la frode. ... La subiscono in un certo momento. E quindi l'apprendono.""","""...Considera questo. La gente non nasce con la consapevolezza che esistano le truffe... Ad un certo punto ne subiscono una. E così apprendono.""","""............Düşün. İnsanlar sahtekarlığı doğuştan bilmezler. ...Bir yerlerde acı çekerler. Ve bu şekilde öğrenirler."""
Ushiromiya Battler,"""........."" ","""...........................""","""..................""",「………………………。」,「………………………」,"""..................""","""...........................""","""...........................""",「………………………」,「………………………」,"""...........................""","""...""","""...""","""..........................."""
{f:5:Beatrice},"""Yes, the crimes of the human world, where people must press up against each other. ...Let me see, I've heard that from a witch somewhere. Oh well. ...I'm not as heartless as you think, you see? *cackle*cackle*cackle*!"" ","""Yes, the sins of the human world, which must be forced on one another. ......Now who was the witch I heard that from...? Oh well. ......I'm not as heartless as you think, you see? *cackle*cackle*cackle*!""","""Yes, the crimes of the human world, which must be forced on one another. ......Let me see, I've heard that from a witch somewhere. Oh well. ......I'm not as heartless as you think, you see? *cackle*cackle*cackle*!""",「押し付けあわずにはいられぬ人の世の罪、か。……はて、どこの魔女に聞いたやら。まぁいい。……そなたが思っているほど、妾も無慈悲ではないぞ？　くっくくくっくっく！」,「押し付けあわずにはいられぬ人の世の罪、か。……はて、どこの魔女に聞いたやら。まぁいい。……そなたが思っているほど、妾も無慈悲ではないぞ？　くっくくくっくっく！」,"""Да, преступления человеческого мира сами порождают друг друга. ......Посмотрим, кажется, я уже слышала это от одной ведьмы. Ах, ну да ладно. ......Вот видишь, не такая уж я и бессердечная, какой ты меня себе представлял? *хи‐хи*хи‐хи*хи‐хи*!""","""Sim, os pecados do mundo humano, que devem ser forçados uma para o outro. ......Pois bem, de qual bruxa foi que eu ouvi isso...? Bem, tanto faz. ......Eu não sou sem coração como você pensa, sabia? *gargalhada*gargalhada*gargalhada*!""","""Yes, the sins of the human world, which must be forced on one another. ......Now who was the witch I heard that from...? Oh well. ......I'm not as heartless as you think, you see? *cackle*cackle*cackle*!""",「無法不互相推來推去的人世之罪，麼。……哎呀，是從何處的魔女那裡聽說的來著。算了。……妾身並沒有汝想的那麼冷酷無情哦？呵呵呵呵呵呵！」,「无法不互相推来推去的人世之罪，么。……哎呀，是从何处的魔女那里听说的来着。算了。……妾身并没有汝想的那么冷酷无情哦？呵呵呵呵呵呵！」,"""Yes, the sins of the human world, which must be forced on one another. ......Now who was the witch I heard that from...? Oh well. ......I'm not as heartless as you think, you see? *cackle*cackle*cackle*!""","""Già, i crimini del mondo degli umani, che devono essere perpetrati vicendevolmente. ... Vediamo, l'ho sentito da una strega da qualche parte. Oh beh. ... Vedi, non sono senza cuore come pensi? *cackle*cackle*cackle*!""","""‘I peccati del mondo umano, che non possono fare a meno di venire scaricati sull'altro’, giusto...? Vediamo, mi pare di averlo sentito da una strega. Oh, beh... Vedi che non sono così senza cuore come tu pensi? Mhmhmhmhmhmh!""","""Evet, insanların birbirlerini boğazlamak zorunda kaldığı insan dünyasının günahları. ......Şimdi, bunu hangi cadıdan duymuştum...? Oh pekâlâ. ......Senin düşündüğün kadar kalpsiz olmadığımı anlayabiliyor musun? *cackle*cackle*cackle*!"""
Ushiromiya Battler,"""Liar!! You killed so many people!! And you did it in such horrible ways too! How could you not be heartless?!! ","""Liar!! All these people, and it's not even the first time!! And you did it in such a horrible way too, how could you not be heartless?!!""","""Liar!! You killed so many people!! And you did it in such a horrible way too, how could you not be heartless?!! ",「嘘をつけ！！　これだけの大勢を、しかもまたッ！！　こんな残酷な方法で殺しておいて、何が無慈悲ではないだ！！,「嘘をつけ！！　これだけの大勢を、しかもまたッ！！　こんな残酷な方法で殺しておいて、何が無慈悲ではないだ！！」,"""Лгунья!!! Ты убила стольких людей!!! И ты сделала это такими ужасными способами!!! И после этого ты ещё заявляешь, что не бессердечна?!!""","""Mentirosa!! Todas essas pessoas, e não é nem a primeira vez!! E você fez isso de uma forma horrível, como você pode ter um coração?!""","""Liar!! All these people, and it's not even the first time!! And you did it in such a horrible way too, how could you not be heartless?!!""",「你就吹吧！！你殺了那麼多人，而且！！而且又是以如此殘酷的方法殺害，哪裡不算冷酷無情了！！」,「你就吹吧！！你杀了那么多人，而且！！而且又是以如此残酷的方法杀害，哪里不算冷酷无情了！！」,"""Liar!! All these people, and it's not even the first time!! And you did it in such a horrible way too, how could you not be heartless?!!""","""Bugiarda!! Hai ucciso così tante persone!! E l'hai anche fatto in un modo tanto orrendo, come potresti avere un cuore?!!","""Bugiarda!! Hai ucciso tutte queste persone, e non è neanche la prima volta!! Come puoi non essere senza cuore, dopo averle ammazzate in modo tanto cruento?!!""","""Yalancı!! Bütün bu insanları öldürdün, ve bu ilk bile değil!! Ve sen bunu korkunç bir şekilde yaptın, nasıl kalpsiz olmazsın?!!"""
Ushiromiya Battler,"You say you keep your promises?! Don't say stuff like that!! I won't accept you. Ever. I believe my only way to resist you is never giving up on that!"" ","""You say you keep your promises?! Don't say stuff like that!! I won't accept you. Never. I believe that not giving that up is the only way I can resist you!""","You say you keep your promises?! Don't say stuff like that!! I won't accept you. Never. I believe that not giving that up is the only way I can resist you!""",約束は守るだと？！　いい加減なことを言うな！！　俺はお前を認めない。断じて。それを譲らないことだけが、お前への抵抗だと俺は信じてるッ！」,「約束は守るだと？！　いい加減なことを言うな！！　俺はお前を認めない。断じて。それを譲らないことだけが、お前への抵抗だと俺は信じてるッ！」,"""Ты говоришь, что держишь свои обещания?! Не смеши меня! Я не приму твоего 'бытия'. Ни‐ког‐да. Я верю, что отказ от капитуляции — это единственный способ сопротивляться тебе!""","""Você disse que cumpre suas promessas?! Não diga coisas assim!! Eu não vou aceitar você. Nunca. Eu acredito que a única maneira na qual eu posso resistir a você é não desistindo disso!""","""You say you keep your promises?! Don't say stuff like that!! I won't accept you. Never. I believe that not giving that up is the only way I can resist you!""",「會遵守約定？！少隨口亂說！！我不會承認你的。斷然不會。我相信唯有在這點上不讓步，正是對你的抵抗！」,「会遵守约定？！少随口乱说！！我不会承认你的。断然不会。我相信唯有在这点上不让步，正是对你的抵抗！」,"""You say you keep your promises?! Don't say stuff like that!! I won't accept you. Never. I believe that not giving that up is the only way I can resist you!""","Dici di mantenere le tue promesse?! Non dire cose simili!! Non ti accetterò. Mai. Credo che non arrendermi sia l'unico modo in cui posso resisterti!""","""Dici di mantenere la parola data?! Dacci un taglio con questi discorsi!! Io non ti riconoscerò. Giammai. Ciò in cui credo, è che non cedere su questo punto è l'unico modo che ho per tenerti testa!""","""Sözlerini tuttuğunu mu söylüyorsun?! Böyle şeyler söyleme!! Seni kabul etmeyeceğim. Asla. Sana karşı koyabilmemin tek yolunun bundan vazgeçmemek olduğunu biliyorum!"""
{f:5:Beatrice},"""......I see. So you're saying this eternal torture will be the same for me. ......*cackle*cackle*cackle*cackle* ","""............I see. So you're saying that this eternal torment will be the same for me. .........*cackle*cackle*cackle*cackle*.""",""".........I see. So you're saying that this eternal torture, will be the same for me. .........*cackle*cackle*cackle*cackle*. ",「…………なるほど。永遠の拷問であるのは、妾に対しても同じであるというわけか。………くっくくくくくくく。,「…………なるほど。永遠の苛みであるのは、妾に対しても同じであるというわけか。………くっくくくくくくく」,""".........Ясно. Так ты говоришь, что эта бесконечная пытка будет пыткой и для меня тоже? .........*хи‐хи*хи‐хи*хи‐хи*хи‐хи*.""","""............Entendo. Então você está dizendo que esse tormento eterno será o mesmo para mim. .........*gargalhada*gargalhada*gargalhada*gargalhada*.""","""............I see. So you're saying that this eternal torment will be the same for me. .........*cackle*cackle*cackle*cackle*.""",「…………原來如此。永遠的拷問，對妾身也是一樣麼。………呵呵呵呵呵呵呵呵。」,「…………原来如此。永远的拷问，对妾身也是一样么。………呵呵呵呵呵呵呵呵。」,"""............I see. So you're saying that this eternal torment will be the same for me. .........*cackle*cackle*cackle*cackle*.""","""... Capisco. Dunque stai dicendo che questa tortura eterna, sarà la stessa anche per me. ... *cackle*cackle*cackle*cackle*.","""...Capisco. Stai dicendo che la tortura sarà eterna anche per me... Kuahahahahahahahah...""","""............Anlıyorum. Yani bu ebedi işkencenin benim için de aynı olacağını söylüyorsun. .........*cackle*cackle*cackle*cackle*."""
{f:5:Beatrice},"...Perhaps. One thousand years is a long time... Maybe a witch's true strength is decided not by their magical power, but by the strength of their endurance. ...Yes, I can accept how terrifying Lady Bern is."" ","""......Maybe so. One thousand years is a long time...... Maybe a witch's true strength is decided not by their magical power, but by their endurance. ...Yes, it explains how terrifying Lady Bern is.""","......Maybe. One thousand years is a long time...... Maybe a witch's true strength is decided not by their magical power, but by the strength of their determination. ...I see, I can accept how terrifying Lady Bern is.""",……かも知れぬな。千年は長い……。魔女の強さは魔力より、我慢強さで決まるのかもしれんな。…なるほど、ベルン卿の恐ろしさも頷ける。」,「……かも知れぬな。千年は長い……。魔女の強さは魔力より、我慢強さで決まるのかもしれんな。…なるほど、ベルン卿の恐ろしさも頷ける」,"""......Вполне может быть. Тысяча лет — и впрямь долгий срок... Может быть, истинная сила ведьмы проистекает не из её магической силы, но из её решимости. ...Ясно, я могу понять, насколько страшна леди Берн.""","""......Pode ser que sim. Mil anos é muito tempo..... talvez a verdadeira força de uma bruxa não seja decidida pelo seu poder mágico, mas pela sua resistência. ...Sim, isso explica o quão terrível é a Lady Bern.""","""......Maybe so. One thousand years is a long time...... Maybe a witch's true strength is decided not by their magical power, but by their endurance. ...Yes, it explains how terrifying Lady Bern is.""",「……或許確是如此呢。千年很長……。這魔女的強弱，比起說是以魔力，沒准更該說是以忍耐力來決定的呢。…原來如此，貝倫卿的可怕，倒也能讓人信服了。」,「……或许确是如此呢。千年很长……。这魔女的强弱，比起说是以魔力，没准更该说是以忍耐力来决定的呢。…原来如此，贝伦卿的可怕，倒也能让人信服了。」,"""......Maybe so. One thousand years is a long time...... Maybe a witch's true strength is decided not by their magical power, but by their endurance. ...Yes, it explains how terrifying Lady Bern is.""","... Può darsi. Mille anni è un periodo lungo... Forse la forza di una strega è determinata non dal suo potere magico, ma dalla forza della sua determinazione. ... Capisco, riesco a capire quanto sia terrificante Lady Bern.""","""Può darsi. Mille anni sono tanti... Forse, più che dal suo potere magico, la forza di una strega è determinata dalla forza della sua perseveranza... Sì, posso capire come mai Lady Bern sia così temibile.""","""......Belki de. Bin yıl uzun bir süre...... Belki de bir cadının gerçek gücünü büyü gücü değil, dayanıklılığı belirliyor olabilir. ...Anlıyorum, bu Leydi Bern'in neden bu kadar korkunç olduğunu açıklıyor."""
Ushiromiya Battler,"""Damn you, babbling on and on about this incomprehensible stuff. ......Let's quickly get back to this eternal torture. I'm prepared to stick around for one thousand years or even ten thousand years."" ","""Damn you, babbling on and on about incomprehensible stuff. .........Hurry up and continue that eternal torment or whatever. I'm prepared to stick around for a thousand years, or even ten thousand.""","""Damn you, babbling on and on about this incomprehensible stuff. .........Let's quickly continue this eternal torture. I'm prepared to stick around for one thousand years or even ten thousand years.""",「何をわけのわかんねぇ話をぶつぶつ言ってやがる。………さっさと永遠の拷問とやらを続けろよ。俺は千年でも一万年でも付き合う覚悟だぜ。」,「何をわけのわかんねぇ話をぶつぶつ言ってやがる。………さっさと永遠の苛みとやらを続けろよ。俺は千年でも一万年でも付き合う覚悟だぜ」,"""К чёрту тебя и твой бессмысленный треп. .........Давай уже поскорее продолжим эту бесконечную пытку. Я готов к тому, чтобы провести здесь ещё хоть одну, хоть десять тысяч лет.""","""Maldita, resmungando sobre você e sobre coisas incompreensíveis.{n}.........Vai logo e continue com esse tormento eterno ou seja lá o que for. Eu estou preparado para ficar por aqui por mil anos, ou até dez mil anos.""","""Damn you, babbling on and on about incomprehensible stuff. .........Hurry up and continue that eternal torment or whatever. I'm prepared to stick around for a thousand years, or even ten thousand.""",「幹嘛嘮叨些莫名其妙的話？………快點繼續這永遠的拷問。我可有千年也好一萬年也好，陪你玩下去的決心。」,「干嘛唠叨些莫名其妙的话？………快点继续这永远的拷问。我可有千年也好一万年也好，陪你玩下去的决心。」,"""Damn you, babbling on and on about incomprehensible stuff. .........Hurry up and continue that eternal torment or whatever. I'm prepared to stick around for a thousand years, or even ten thousand.""","""Dannazione a te, sempre a borbottare questa roba incomprensibile. ... Torniamo subito a questa tortura eterna. Sono pronto a resistere per mille anni o persino diecimila anni.""","""Che cazzo di discorsi senza senso vai blaterando... Riprendiamo subito questa presunta ‘tortura eterna’. Sono pronto ad andare avanti per mille anni, se non addirittura diecimila.""","""Anlaşılmaz şeyler hakkında gevezelik edip duruyorsun. .........Acele et de şu ebedi işkenceye falan devam et. Bin yıl, hatta on bin yıl bile burada kalmaya hazırım."""
