Speaker,Umineko Project (UP),Steam (ST),Original Witch Hunt (OG),PC Japanese (JP),PS3 Japanese - Censored (JPC),Russian (RU),Brazilian Portuguese (PT),Vietnamese (VI),Chinese Traditional (CHT),Chinese Simplified (CN),Indonesian (IDN),Italian (IT),Turkish (TR)
,"...Even though it was a pitch‐black world where nothing could be seen, ......for some reason, I felt Beato's presence right next to me.","...Even though it was a pitch-black world where nothing could be seen, ...for some reason, I felt Beato's presence right next to me. ","...Even though it was a pitch-black world where nothing could be seen, ......for some reason, I felt Beato's presence right next to me.",…真っ暗で、何も見えない世界なのに、……なぜかすぐ近くに、ベアトがいるような気配を感じた。,…真っ暗で、何も見えない世界なのに、……なぜかすぐ近くに、ベアトがいるような気配を感じた。,"...Хоть это и был чёрный как смоль мир, в котором ничего не было видно, я почему‐то чувствовал присутствие Беато рядом с собой.","...Mesmo sendo um mundo completamente escuro onde nada podia ser visto, ......por algum motivo, eu conseguia sentir a presença da Beato ao meu lado.","...Even though it was a pitch‐black world where nothing could be seen, ......for some reason, I felt Beato's presence right next to me.",…在一片漆黑，什麼都看不見的世界中，……不知為何感覺到了，貝阿朵好像就在身邊。,…在一片漆黑，什么都看不见的世界中，……不知为何感觉到了，贝阿朵好像就在身边。,"...Even though it was a pitch‐black world where nothing could be seen, ......for some reason, I felt Beato's presence right next to me.","...Even though it was a pitch‐black world where nothing could be seen, ......for some reason, I felt Beato's presence right next to me.","...Even though it was a pitch‐black world where nothing could be seen, ......for some reason, I felt Beato's presence right next to me."
,......So I tried calling out to her.{n}...You can exchange words with someone whether they're a human or a witch.,...So I tried calling out to her. ...You can exchange words with someone whether they're a human or a witch. ,......So I tried calling out to her....You can exchange words with someone whether they're a human or a witch.,……だから呼び掛けてみる。…言葉を交わすことは、魔女でも人間でもできる。,……だから呼び掛けてみる。{n}…言葉を交わすことは、魔女でも人間でもできる。,".....Поэтому я попытался окликнуть её.{n}...Будь то человек или ведьма, с ними можно разговаривать.","......Por isso, eu tentei chamar por ela.{n}...Você pode trocar palavras com alguém sendo essa pessoa um humano ou uma bruxa.",......So I tried calling out to her.{n}...You can exchange words with someone whether they're a human or a witch.,……所以，我試著喊了她一下。{n}…交談是魔女與人類都做得到的事。,……所以，我试着喊了她一下。{n}…交谈是魔女与人类都做得到的事。,......So I tried calling out to her.{n}...You can exchange words with someone whether they're a human or a witch.,......So I tried calling out to her.{n}...You can exchange words with someone whether they're a human or a witch.,......So I tried calling out to her.{n}...You can exchange words with someone whether they're a human or a witch.
,......So even in a world where witches have been denied......I should be allowed to talk to her...,"...So even in a world where witches have been denied, ...I should be allowed to talk to her... ","......So even in a world where witches have been denied, ......I should be allowed to talk to her...",……だから、魔女が否定された世界でも、……言葉をかけることは許されるはずなんだ…。,……だから、魔女が否定された世界でも、……言葉をかけることは許されるはずなんだ…。,......Так что даже в отрицающем ведьм мире у меня должно было получиться поговорить с ней...,"......Então, mesmo em um mundo onde as bruxas são negadas......eu devo ser capaz de falar com ela...",......So even in a world where witches have been denied......I should be allowed to talk to her...,……所以，即便是在否定了魔女的世界裡，……也理應能夠與她交談…。,……所以，即便是在否定了魔女的世界里，……也理应能够与她交谈…。,......So even in a world where witches have been denied......I should be allowed to talk to her...,......So even in a world where witches have been denied......I should be allowed to talk to her...,......So even in a world where witches have been denied......I should be allowed to talk to her...
Ushiromiya Battler,"""...............Beato......""","""......Beato..."" ","""............Beato......""",「……………ベアト……。」,「……………ベアト……」,"""............Беато......""","""...............Beato......""","""...............Beato......""",「……………貝阿朵……」,「……………贝阿朵……」,"""...............Beato......""","""...............Beato......""","""...............Beato......"""
{f:5:Beatrice},"""......Battler, is it... ...............It is done. ......I...did it.""","""...Battler, is it...? .........It is done. ...I...did it."" ","""......Battler, is it..................It is done. ......I, ...did it.""",「……戦人か…。……………やったぞ。……妾は、…やった。」,「……戦人か…。………やったぞ。……妾は、…やった」,"""......Баттлер... ...............Сделала. ......Я... сделала это.""","""......Battler, é você...? ...............Terminou. ......Eu...fiz isso.""","""......Battler, is it... ...............It is done. ......I...did it.""",「……戰人嗎…？……………做到了哦。……妾身，…做到了。」,「……战人吗…？……………做到了哦。……妾身，…做到了。」,"""......Battler, is it... ...............It is done. ......I...did it.""","""......Battler, is it... ...............It is done. ......I...did it.""","""......Battler, is it... ...............It is done. ......I...did it."""
Ushiromiya Battler,"""...Yeah. ......I didn't hear it, .........but I watched you...until the very end... I was watching......as you boldly stood up to that evil witch...""","""Yeah. ...I didn't hear it, ......but I watched you until the very end... I definitely saw you...boldly stand up to that evil witch..."" ","""Yeah. ......I didn't hear it, .........but I watched you until the very end... I definitely saw you, ......boldly stand up to that evil witch...""",「…あぁ。……聞こえはしなかったが、………俺はお前の姿を、…最後まで見ていたぜ…。お前が、邪悪な魔女に毅然と立ち向かうところを、……ちゃんと見てたぜ…。」,「…あぁ。……聞こえはしなかったが、………俺はお前の姿を、…最後まで見ていたぜ…。お前が、邪悪な魔女に毅然と立ち向かうところを、……ちゃんと見てたぜ…」,"""Да. ......Я ничего не слышал, но смотрел на тебя до самого конца... Я ясно видел как ты... храбро противостояла этой злой ведьме...""","""...Sim. ......Eu não ouvi, .........mas eu observei você...até o final... Eu estava observando......como você bravamente permanecia de pé perante aquela terrível bruxa...""","""...Yeah. ......I didn't hear it, .........but I watched you...until the very end... I was watching......as you boldly stood up to that evil witch...""",「…啊啊。……雖然我沒有聽到，………但我直到最後，…都在看著你…。有好好把你，毅然迎向邪惡魔女的英勇身姿，……看在眼中…」,「…啊啊。……虽然我没有听到，………但我直到最后，…都在看着你…。有好好把你，毅然迎向邪恶魔女的英勇身姿，……看在眼中…」,"""...Yeah. ......I didn't hear it, .........but I watched you...until the very end... I was watching......as you boldly stood up to that evil witch...""","""...Yeah. ......I didn't hear it, .........but I watched you...until the very end... I was watching......as you boldly stood up to that evil witch...""","""...Yeah. ......I didn't hear it, .........but I watched you...until the very end... I was watching......as you boldly stood up to that evil witch..."""
{f:5:Beatrice},""".........With this, ...I am no longer a witch. ............But, I will definitely...become a witch again... ......And......I will make it so that I can be called the Golden Witch again, .........and then, ......when I am ready to be accepted as your opponent, .........I will return once more......""","""......With this, ...I am no longer a witch. .........But I will definitely...become a witch again... ...And then, ...I will make it so that I can be called the Golden Witch again, ......and once again, ......return... so that I can be accepted as your opponent......"" ","""............With this, ...I am no longer a witch. ...............So, I will definitely...become a witch again.........And then, ......I will make it so that I can be called the Golden Witch again, .........and once again, ............return, ......so that I can be accepted as your opponent.........""",「…………これでもう、…妾は魔女ではない。……………だが、必ず、妾は再び魔女になるぞ…。……そして、……再び黄金の魔女と呼ばれるに至って、………再び、……そなたの対戦相手だと認められに、…………帰ってくるから………。」,「………これでもう、…妾は魔女ではない。…………だが、必ず、妾は再び魔女になるぞ…。……そして、……再び黄金の魔女と呼ばれるに至って、……再び、……そなたの対戦相手だと認められに、………帰ってくるから……」,"""............Теперь... я больше не ведьма. ...............А значит, я безусловно... вновь стану ведьмой... ......И тогда... я стану трудиться, чтобы снова называться Золотой Ведьмой... и ещё раз... вернусь, чтобы оказаться принятой твоим противником...""",""".........Com isto, ...eu não sou mais uma bruxa. ............Mas eu definitivamente vou...me tornar uma bruxa novamente... ......E......ao fazer isto, poderei ser chamada novamente de Bruxa Dourada, .........e então, ......quando eu estiver pronta para ser aceita como sua oponente, .........eu retornarei novamente......""",""".........With this, ...I am no longer a witch. ............But, I will definitely...become a witch again... ......And......I will make it so that I can be called the Golden Witch again, .........and then, ......when I am ready to be accepted as your opponent, .........I will return once more......""",「…………就此，…妾身已不是魔女了。……………但是，妾身，一定會再次成為魔女的…。……然後，……等能夠再次被稱為黃金的魔女之時，………妾身，……會為了重新被汝認同為對戰敵手，…………而回來的………」,「…………就此，…妾身已不是魔女了。……………但是，妾身，一定会再次成为魔女的…。……然后，……等能够再次被称为黄金的魔女之时，………妾身，……会为了重新被汝认同为对战敌手，…………而回来的………」,""".........With this, ...I am no longer a witch. ............But, I will definitely...become a witch again... ......And......I will make it so that I can be called the Golden Witch again, .........and then, ......when I am ready to be accepted as your opponent, .........I will return once more......""",""".........With this, ...I am no longer a witch. ............But, I will definitely...become a witch again... ......And......I will make it so that I can be called the Golden Witch again, .........and then, ......when I am ready to be accepted as your opponent, .........I will return once more......""",""".........With this, ...I am no longer a witch. ............But, I will definitely...become a witch again... ......And......I will make it so that I can be called the Golden Witch again, .........and then, ......when I am ready to be accepted as your opponent, .........I will return once more......"""
Ushiromiya Battler,"""No. .........You...were a witch.""","""No. ......You...were a witch."" ","""No. .........You...were a witch.""",「いや。………お前は、魔女だったぜ。」,「いや。………お前は、魔女だったぜ」,"""Нет. .........Ты... была ведьмой.""","""Não. .........Você...é uma bruxa.""","""No. .........You...were a witch.""",「不。………你是，魔女。」,「不。………你是，魔女。」,"""No. .........You...were a witch.""","""No. .........You...were a witch.""","""No. .........You...were a witch."""
{f:5:Beatrice},"""...............Huh......?""","""......Huh...?"" ","""............Huh......?""",「……………え……。」,「……………え……」,"""............Что?..""","""...............Hã......?""","""...............Huh......?""",「……………哎……？」,「……………哎……？」,"""...............Huh......?""","""...............Huh......?""","""...............Huh......?"""
Ushiromiya Battler,"""...I...was watching. .........When you took that evil witch, ......and blew her away with that awesome magic, exposing her true form, ...I was watching with my own eyes...""","""...I...saw it. ......When you took that evil witch, ...and blew her away with that awesome magic, exposing her true form, ...I saw it with my own eyes..."" ","""...I...saw it. .........When you took that evil witch, ......and blew her away with that awesome magic, exposing her true form, ...I saw it with my own eyes...""",「…俺は、見てたぜ。………お前が、あの邪悪な魔女を、……すっげえ魔法で吹き飛ばして、その正体を暴き出すところを、…俺はちゃんとこの目で見ていたぜ…。」,「…俺は、見てたぜ。………お前が、あの邪悪な魔女を、……すっげえ魔法で吹き飛ばして、その正体を暴き出すところを、…俺はちゃんとこの目で見ていたぜ…」,"""...Я... увидел. .........Когда ты противостояла злой ведьме, и разоблачила её той удивительной магией, явив её настоящую форму, я увидел это своими собственными глазами...""","""...Eu...estava observando. .........Quando você derrotou aquela bruxa maligna ......e mandou ela para longe com a sua magia incrível, expondo a verdadeira forma dela, ...eu estava observando com meus próprios olhos...""","""...I...was watching. .........When you took that evil witch, ......and blew her away with that awesome magic, exposing her true form, ...I was watching with my own eyes...""",「…我，看到了。………我用這雙眼睛，……清楚地看到了你用超猛的魔法，轟飛了那位邪惡的魔女，…揭露了她的真面目…」,「…我，看到了。………我用这双眼睛，……清楚地看到了你用超猛的魔法，轰飞了那位邪恶的魔女，…揭露了她的真面目…」,"""...I...was watching. .........When you took that evil witch, ......and blew her away with that awesome magic, exposing her true form, ...I was watching with my own eyes...""","""...I...was watching. .........When you took that evil witch, ......and blew her away with that awesome magic, exposing her true form, ...I was watching with my own eyes...""","""...I...was watching. .........When you took that evil witch, ......and blew her away with that awesome magic, exposing her true form, ...I was watching with my own eyes..."""
{f:5:Beatrice},"""Th‐...that wasn't magic, ......but the red—""","""Th-That wasn't magic, ...but the red-"" ","""Th, ...that wasn't magic, ......but the red-""",「あ、…あれは魔法ではなく、……赤き、」,「あ、…あれは魔法ではなく、……赤き、」,"""Эт...это была не магия, а красная...""","""A‐Aquilo não era magia, ......mas o vermelho—""","""Th‐...that wasn't magic, ......but the red—""",「那、…那不是魔法，……是紅色，」,「那、…那不是魔法，……是红色，」,"""Th‐...that wasn't magic, ......but the red—""","""Th‐...that wasn't magic, ......but the red—""","""Th‐...that wasn't magic, ......but the red—"""
Ushiromiya Battler,"""No, it was magic. .........You were definitely...the Golden Witch. .........Even if you deny it yourself, .........I'll accept it. ............‘You are definitely...the Golden Witch’.""","""No, it was magic. ......You were definitely...the Golden Witch. ......Even if you deny it yourself, ......I'll acknowledge it. 'You are definitely... the Golden Witch'."" ","""No, it was magic. .........You were definitely...the Golden Witch. .........You even denied yourself. .........I'll accept it.............'You are definitely, ...the Golden Witch'.""",「いいや、魔法だったぜ。………お前は確かに、黄金の魔女だった。………お前自らが否定しようとも。………俺が認めてやるよ。…………“お前は確かに、…黄金の魔女だ”。」,「いいや、魔法だったぜ。………お前は確かに、黄金の魔女だった。………お前自らが否定しようとも。………俺が認めてやるよ。…………“お前は確かに、…黄金の魔女だ”」,"""Нет, это была магия. .........Ты точно... Золотая Ведьма. .........Ты даже отрицала саму себя. .........Я признаю это. ............'Ты действительно... Золотая Ведьма'.""","""Não, era magia. .........Você definitivamente é...a Bruxa Dourada. .........Mesmo que você negue isso a si mesma, .........eu irei reconhecer. ............‘Você definitivamente é...a Bruxa Dourada’.""","""No, it was magic. .........You were definitely...the Golden Witch. .........Even if you deny it yourself, .........I'll accept it. ............‘You are definitely...the Golden Witch’.""",「不，是魔法。………你的的確確是黃金的魔女。………縱使你自行否定。………我也要承認你。“你的的確確是，…黃金的魔女”。」,「不，是魔法。………你的的确确是黄金的魔女。………纵使你自行否定。………我也要承认你。“你的的确确是，…黄金的魔女”。」,"""No, it was magic. .........You were definitely...the Golden Witch. .........Even if you deny it yourself, .........I'll accept it. ............‘You are definitely...the Golden Witch’.""","""No, it was magic. .........You were definitely...the Golden Witch. .........Even if you deny it yourself, .........I'll accept it. ............‘You are definitely...the Golden Witch’.""","""No, it was magic. .........You were definitely...the Golden Witch. .........Even if you deny it yourself, .........I'll accept it. ............‘You are definitely...the Golden Witch’."""
,.........When Battler said those words...,...When Battler said those words... ,......When Battler said those words...,………戦人がその言葉を口にした時。,………戦人がその言葉を口にした時。,......Когда Баттлер произнёс эти слова...,.........Quando Battler disse aquelas palavras...,.........When Battler said those words...,………當戰人將這句話說出口時。,………当战人将这句话说出口时。,.........When Battler said those words...,.........When Battler said those words...,.........When Battler said those words...
,"In the world that had been dark, ...there was suddenly a single grain.","In the world that had been dark, ...there was suddenly a single grain. "," In the world that had been dark, there was suddenly a single grain.",真っ暗だった世界に、…ぽっと一粒。,真っ暗だった世界に、…ぽっと一粒。,"В мире, погружённом во тьму, внезапно возникла единственная песчинка.","No mundo que havia se tornado escuro, ...de repente um pequeno grão...","In the world that had been dark, ...there was suddenly a single grain.",在漆黑的世界中，…忽然閃現了一粒。,在漆黑的世界中，…忽然闪现了一粒。,"In the world that had been dark, ...there was suddenly a single grain.","In the world that had been dark, ...there was suddenly a single grain.","In the world that had been dark, ...there was suddenly a single grain."
,"...A small grain of gold, like a wheat seed, shone brightly.{n}...Even though it was small, it had a strong, gold‐colored glow.","...A small grain of gold, like a wheat seed, shone brightly. And...even though it was small, it had a strong, gold-colored sparkle. ","...A small grain of gold, like a wheat seed, shone brightly. And...even though it was small, it had a strong, gold-colored sparkle.",…小麦の種のように小さな黄金の一粒が眩く光った。それは…小さいけれど力強く黄金色に輝く。,…小麦の種のように小さな黄金の一粒が眩く光った。{n}それは…小さいけれど力強く黄金色に輝く。,"...Миниатюрная крупица золота, похожая на пшеничное зёрнышко, ярко сияла.{n}И пусть даже она была маленькой, она сверкала сильным золотым блеском.","...Um pequeno grão de ouro, como uma semente, brilhou de forma radiante.{n}...Mesmo que fosse pequeno, ele tinha um forte brilho dourado.","...A small grain of gold, like a wheat seed, shone brightly.{n}...Even though it was small, it had a strong, gold‐colored glow.",…如小麥種子般的，小小的黃金光團。{n}它…閃耀著小而矯健的黃金色光芒。,…如小麦种子般的，小小的黄金光团。{n}它…闪耀着小而矫健的黄金色光芒。,"...A small grain of gold, like a wheat seed, shone brightly.{n}...Even though it was small, it had a strong, gold‐colored glow.","...A small grain of gold, like a wheat seed, shone brightly.{n}...Even though it was small, it had a strong, gold‐colored glow.","...A small grain of gold, like a wheat seed, shone brightly.{n}...Even though it was small, it had a strong, gold‐colored glow."
,"And......it illuminated the two of them, sitting with their backs together...","Then, ...it shone on the two of them, sitting with their backs together... "," Then, ......it shone on the two of them, sitting with their backs together...",そして、……背中を寄せ合って座っていた二人を照らし出す…。,そして、……背中を寄せ合って座っていた二人を照らし出す…。,"А затем она осветила их обоих, сидевших спиной друг к другу...","E......ele iluminou sobre os dois, sentados de costas um para o outro...","And......it illuminated the two of them, sitting with their backs together...",然後，……照出了背靠背坐著的兩人…。,然后，……照出了背靠背坐着的两人…。,"And......it illuminated the two of them, sitting with their backs together...","And......it illuminated the two of them, sitting with their backs together...","And......it illuminated the two of them, sitting with their backs together..."
,So they each became aware of their own form.,"So, they each became aware of their own form. ", So they each became aware of their own form.,だから、二人は互いに自分の姿を自覚する。,だから、二人は互いに自分の姿を自覚する。,И пара стала осознавать собственное бытие.,"E assim, eles passaram a ter consciência de suas próprias formas.",So they each became aware of their own form.,所以，兩人自我意識到了自己的身姿。,所以，两人自我意识到了自己的身姿。,So they each became aware of their own form.,So they each became aware of their own form.,So they each became aware of their own form.
,...They did not exist only as consciousness.,...They did not exist only as consciousness. ,...They did not exist only as consciousness.,…自分たちは、意識だけの存在ではない。,…自分たちは、意識だけの存在ではない。,...Они существовали не только как сознание.,...Eles não existem apenas como uma consciência.,...They did not exist only as consciousness.,…自己並不是僅為意識的存在。,…自己并不是仅为意识的存在。,...They did not exist only as consciousness.,...They did not exist only as consciousness.,...They did not exist only as consciousness.
