{f:5:Beatrice},"""..............................""","""............"" ",""".....................""",「…………………………。」,「…………………………」,""".....................""","""..............................""","""..............................""",「…………………………」,「…………………………」,"""..............................""","""..............................""",""".............................."""
{f:5:Beatrice},"""......Hi......hihhihahhahhahaaaHAAaHAHHH!!""","""...H-Hihhihahhahhahaaaaaaaaah!! ","""......Hi, ......hihhihahhahhahaaaaaaaaah!! ",「……ひ、……ひっひはっはっははぁあああぁあァア！！,「……ひ、……ひっひはっはっははぁあああぁあァア！！」,"""......Хи... хи‐хи‐ха‐ха‐ха‐ха‐а‐а‐а‐а‐а‐а‐а‐а!!!""","""......Hi......hihhihahhahhahaaaHAAaHAHHH!!""","""......Hi......hihhihahhahhahaaaHAAaHAHHH!!""",「……嘿、……嘿、嘿哈、哈、哈哈啊啊啊啊啊啊——！！」,「……嘿、……嘿、嘿哈、哈、哈哈啊啊啊啊啊啊——！！」,"""......Hi......hihhihahhahhahaaaHAAaHAHHH!!""","""......Hi......hihhihahhahhahaaaHAAaHAHHH!!""","""......Hi......hihhihahhahhahaaaHAAaHAHHH!!"""
{f:5:Beatrice},"""Sorrrrry, Battleerrr, I am that kind of persooooooooooon!! Aah, it's no good, I can't keep this up, it looks like sentimental sob stories don't match well with meeeeeeeeeee!! Master, with all your strength, if you please!! That was such a plain role to play, and I got so bored!""","Sorry, Battleer, I am that kind of persooooooooooon!! Aah, it's useless now, it looks like sentimental sob stories don't suit meeeeeeeeeee!! Teacher, I'm counting on you to use all your strength!! That was such a plain role to play, and I got so bored!"" ","Sorry, Battleer, I am that kind of persooooooooooon!! Aah, it's useless now, it looks like sentimental {c:86EF9C:naniwa-bushi}s don't match well with meeeeeeeeeee!! Teacher, I'm counting on you to use all your strength!! That was such a plain role to play, and I got so bored! ",悪ィなぁ戦人ァ、こんなヤツでよぉおおおおぉ！！　あぁもう駄目だ、甘ったるい浪花節はやっぱ妾の肌にゃ合わねぇやああぁあぁ！！　お師匠様ァ、力尽くで頼むぜぇ！！　地味ィな役回りだったんで、すっかり退屈してたんだッ！,「悪ィなぁ戦人ァ、こんなヤツでよぉおおおおぉ！！　あぁもう駄目だ、甘ったるい浪花節はやっぱ妾の肌にゃ合わねぇやああぁあぁ！！　お師匠様ァ、力尽くで頼むぜぇ！！　地味ィな役回りだったんで、すっかり退屈してたんだッ！」,"""Извини, Баттлер, такая уж я из себя‐а‐а‐а!!! А‐ах, теперь это бессмысленно, видать, сентиментальная маска мне не подхо‐о‐оди‐ит!!! Наставница, я рассчитываю, что вы приложите все свои силы!!! Это была столь простая роль, что я уже успела соскучиться!""","""Desculpaaaaa, Battleerrr, eu sou esse tipo de pessooooooooooa!! Aah, isso não está certo, eu não posso continuar com isso, parece aquelas histórias sentimentais que não combinam naaaaaada comigo! Professora, com toda a sua força, se assim desejar!! Esse é um papel muito chato de se atuar, e acabei ficando entediada!""","""Sorrrrry, Battleerrr, I am that kind of persooooooooooon!! Aah, it's no good, I can't keep this up, it looks like sentimental sob stories don't match well with meeeeeeeeeee!! Master, with all your strength, if you please!! That was such a plain role to play, and I got so bored!""",「抱歉吶戰人～，我就這種人——————！！啊啊已經不行了，甜蜜諂媚的{c:86EF9C:浪花節}果然不合妾身的風格啊————！！{c:86EF9C:（詳見魔導書同名條目）}師傅大人～，來硬的吧！！擔當土氣的角色，真是無聊死了！」,「抱歉呐战人～，我就这种人——————！！啊啊已经不行了，甜蜜谄媚的{c:86EF9C:浪花节}果然不合妾身的风格啊————！！{c:86EF9C:（详见魔导书同名条目）}师傅大人～，来硬的吧！！担当土气的角色，真是无聊死了！」,"""Sorrrrry, Battleerrr, I am that kind of persooooooooooon!! Aah, it's no good, I can't keep this up, it looks like sentimental sob stories don't match well with meeeeeeeeeee!! Master, with all your strength, if you please!! That was such a plain role to play, and I got so bored!""","""Sorrrrry, Battleerrr, I am that kind of persooooooooooon!! Aah, it's no good, I can't keep this up, it looks like sentimental sob stories don't match well with meeeeeeeeeee!! Master, with all your strength, if you please!! That was such a plain role to play, and I got so bored!""","""Sorrrrry, Battleerrr, I am that kind of persooooooooooon!! Aah, it's no good, I can't keep this up, it looks like sentimental sob stories don't match well with meeeeeeeeeee!! Master, with all your strength, if you please!! That was such a plain role to play, and I got so bored!"""
{f:5:Beatrice},"""I don't know who you are, woman!! But I'll beat you to death, mash you and crush you until threads start trailing, got iii{-}i{-}i{-}i{-}i{-}i{-}i{-}i{-}i{-}iiit?! I'll make you regret being born a womaaa{-}a{-}a{-}a{-}a{-}a{-}a{-}aaan, hyahhaa{0}a{0}a{0}a{0}a{0}a{0}a{0}a{0}a{0}a{0}a{0}a{0}a{0}a{0}a{0}aaahh!!""","""I don't know who you are, girl, but I'll beat you to death, mash you and crush you until threads start trailing, okaaaaaaaaaaaayy?! I'll make you regret being born a womaaaaaaaaaaaan, hyahhaaaaaaaaaaaaaaaaaaahh!!"" ","I don't know who you are, girl!! But I'll beat you to death, mash you and crush you until threads start trailing, alriiiiiiiiiiiiiiiiight?! I'll make you regret being born a womaaaaaaaaaaaan, hyahhaaaaaaaaaaaaaaaaaaahh!!""",何者か知らねぇが、女ァ！！　たっぷりグチャグチャのネチャネチャに、糸が引くほどぶっ殺してやるぜぇえええぇええ？！　女に生まれてきたことを後悔させてやるよォオオォ、ひゃっはあああああぁああぁああぁッ！！」,「何者か知らねぇが、女ァ！！　たっぷりグチャグチャのネチャネチャに、糸が引くほどぶっ殺してやるぜぇえええぇええ？！　女に生まれてきたことを後悔させてやるよォオオォ、ひゃっはあああああぁああぁああぁッ！！」,"""Я не знаю, кто ты такая, девочка! Но я забью тебя до смерти, раздавлю тебя в пюре, пока от тебя мокрого места не останется, готова‐а‐а‐а‐а‐а‐а‐а‐а‐а‐а‐а‐а‐а‐а‐а‐а?! Ты ещё пожалеешь, что родилась на свет женщино‐о‐о‐ой, хья‐ха‐а‐а‐а‐а‐а‐а‐а‐а‐а‐а‐а‐а‐а‐а‐а!!!""","""Eu não sei quem é você, mulher!! Mas vou acabar com você, esmagar e amassar você até que as tripas comecem a se arrastar, enntendeee{‐}e{‐}e{‐}e{‐}e{‐}e{‐}e{‐}e{‐}e{‐}eeeu?! Vou fazer você se arrepender de ter nascido uma mulheee{‐}e{‐}e{‐}e{‐}e{‐}e{‐}e{‐}eeer, hyahhaa{0}a{0}a{0}a{0}a{0}a{0}a{0}a{0}a{0}a{0}a{0}a{0}a{0}a{0}a{0}aaahh!!""","""I don't know who you are, woman!! But I'll beat you to death, mash you and crush you until threads start trailing, got iii{-}i{-}i{-}i{-}i{-}i{-}i{-}i{-}i{-}iiit?! I'll make you regret being born a womaaa{-}a{-}a{-}a{-}a{-}a{-}a{-}aaan, hyahhaa{0}a{0}a{0}a{0}a{0}a{0}a{0}a{0}a{0}a{0}a{0}a{0}a{0}a{0}a{0}aaahh!!""",「不知是誰的那個女的！！妾身會將汝搗得碎渣渣粘糊糊，能拉出絲來地殺了你———————！！令汝後悔生為女人————，嚇哈——————————————！！」,「不知是谁的那个女的！！妾身会将汝捣得碎渣渣粘糊糊，能拉出丝来地杀了你———————！！令汝后悔生为女人————，吓哈——————————————！！」,"""I don't know who you are, woman!! But I'll beat you to death, mash you and crush you until threads start trailing, got iii{-}i{-}i{-}i{-}i{-}i{-}i{-}i{-}i{-}iiit?! I'll make you regret being born a womaaa{-}a{-}a{-}a{-}a{-}a{-}a{-}aaan, hyahhaa{0}a{0}a{0}a{0}a{0}a{0}a{0}a{0}a{0}a{0}a{0}a{0}a{0}a{0}a{0}aaahh!!""","""I don't know who you are, woman!! But I'll beat you to death, mash you and crush you until threads start trailing, got iii{-}i{-}i{-}i{-}i{-}i{-}i{-}i{-}i{-}iiit?! I'll make you regret being born a womaaa{-}a{-}a{-}a{-}a{-}a{-}a{-}aaan, hyahhaa{0}a{0}a{0}a{0}a{0}a{0}a{0}a{0}a{0}a{0}a{0}a{0}a{0}a{0}a{0}aaahh!!""","""I don't know who you are, woman!! But I'll beat you to death, mash you and crush you until threads start trailing, got iii{-}i{-}i{-}i{-}i{-}i{-}i{-}i{-}i{-}iiit?! I'll make you regret being born a womaaa{-}a{-}a{-}a{-}a{-}a{-}a{-}aaan, hyahhaa{0}a{0}a{0}a{0}a{0}a{0}a{0}a{0}a{0}a{0}a{0}a{0}a{0}a{0}a{0}aaahh!!"""
,"Beato raised her gold pipe high, and the massive chandelier hanging in the hall crackled with electricity, and from that fell an almighty purple thunderbolt...!","As Beato waved her gold pipe, the massive chandelier hanging in the hall was electrocuted, and from that, a terrible purple thunderbolt fell...! ","As Beato waved her gold pipe, the massive chandelier hanging in the hall was electrocuted, and from that, a terrible purple thunderbolt fell...! ",ベアトが黄金の煙管を振り上げると、ホールの天上の巨大なシャンデリアがバリバリと帯電して、そこから凄まじい紫の落雷が落ちる…！,ベアトが黄金の煙管を振り上げると、ホールの天上の巨大なシャンデリアがバリバリと帯電して、そこから凄まじい紫の落雷が落ちる…！,"Как только Беато взмахнула золотой трубкой, огромная люстра, висевшая в зале, заискрилась, и жуткая фиолетовая молния сорвалась с неё!","Beato ergue seu cachimbo dourado para o alto, e o enorme candelabro pendurado sob o hall foi eletrocutado, e de lá caiu um poderoso raio roxo...!","Beato raised her gold pipe high, and the massive chandelier hanging in the hall crackled with electricity, and from that fell an almighty purple thunderbolt...!",隨著貝阿朵高舉黃金煙管，門廳天花板上的巨大吊燈“啪嚓啪嚓”地冒出電流，從此處劈下了駭人的紫色落雷…！,随着贝阿朵高举黄金烟管，门厅天花板上的巨大吊灯“啪嚓啪嚓”地冒出电流，从此处劈下了骇人的紫色落雷…！,"Beato raised her gold pipe high, and the massive chandelier hanging in the hall crackled with electricity, and from that fell an almighty purple thunderbolt...!","Beato raised her gold pipe high, and the massive chandelier hanging in the hall crackled with electricity, and from that fell an almighty purple thunderbolt...!","Beato raised her gold pipe high, and the massive chandelier hanging in the hall crackled with electricity, and from that fell an almighty purple thunderbolt...!"
,"It was a direct hit on the woman right below it, and should have turned her to ash.","It should have been a direct hit on the girl right below it, turning her to ash. ","It should have been a direct hit on the girl right below it, turning her to ash.",それは、真下の女に直撃し、消し炭にしてしまうはずだった。,それは、真下の女に直撃し、消し炭にしてしまうはずだった。,Молния должна была попасть прямо на девушку под ней и обратить её в пепел.,"Foi um ataque direto contra a mulher que estava embaixo dele, e deveria tê‐la reduzido às cinzas.","It was a direct hit on the woman right below it, and should have turned her to ash.",這道雷理應直接劈中了下方的女人，將其轟為了焦炭。,这道雷理应直接劈中了下方的女人，将其轰为了焦炭。,"It was a direct hit on the woman right below it, and should have turned her to ash.","It was a direct hit on the woman right below it, and should have turned her to ash.","It was a direct hit on the woman right below it, and should have turned her to ash."
,"However, ......not a single hair was singed.","However, ...not a single hair was singed. "," However, ......not a single hair was singed.",しかし、……髪の毛一本、焦がせていない。,しかし、……髪の毛一本、焦がせていない。,Однако... не пострадал даже ни один её волос.,"No entanto, ......nem um fio de cabelo foi chamuscado.","However, ......not a single hair was singed.",可是，……她卻連一根頭髮都沒有燒焦。,可是，……她却连一根头发都没有烧焦。,"However, ......not a single hair was singed.","However, ......not a single hair was singed.","However, ......not a single hair was singed."
{f:5:Beatrice},"""Hoh...!! I see you have what it takes to show up uninvited...!! Tell me! Say your name!!""","""Hoh...!! So, your sudden appearance here wasn't just a fluke...!! Tell me! State your name!!"" ","""Hoh...!! So it was worth having you show up uninvited...!! Tell me! Say your name!!""",「ほぉ…！！　飛び入りするだけのことはある…！！　聞こう！　名を名乗れ！！」,「ほぉ…！！　飛び入りするだけのことはある…！！　聞こう！　名を名乗れ！！」,"""Хо!.. Значит, что твоё неожиданное появление стоило того!!!.. Скажи мне! Скажи своё имя!""","""Hoh...!! Parece que tem coragem de aparecer sem ter sido convidada...!!{n}Diga‐me! Conte‐me seu nome!!""","""Hoh...!! I see you have what it takes to show up uninvited...!! Tell me! Say your name!!""",「呵…！！到底是有敢闖進來的本事呢…！！就聽汝說說！報上名來！！」,「呵…！！到底是有敢闯进来的本事呢…！！就听汝说说！报上名来！！」,"""Hoh...!! I see you have what it takes to show up uninvited...!! Tell me! Say your name!!""","""Hoh...!! I see you have what it takes to show up uninvited...!! Tell me! Say your name!!""","""Hoh...!! I see you have what it takes to show up uninvited...!! Tell me! Say your name!!"""
,"""I don't have any name to tell {i:you}. .........More importantly.""","""I don't have any name to give you. ......More importantly, ","""I don't have any name to tell you. .........More importantly, ",「あんたに名乗る名前なんてないわ。………それより。,「あんたに名乗る名前なんてないわ。………それより」,"""У меня нет имени, которое могу сказать {i:тебе}. .........Что важнее,""","""Eu não tenho nenhum nome para contar a {i:você}. .........Mais importante.""","""I don't have any name to tell {i:you}. .........More importantly.""",「我對你，無名可報。………比起這個。」,「我对你，无名可报。………比起这个。」,"""I don't have any name to tell {i:you}. .........More importantly.""","""I don't have any name to tell {i:you}. .........More importantly.""","""I don't have any name to tell {i:you}. .........More importantly."""
,"""......You idiot!!! How long are you going to be tricked?!! Stop being so naive and trusting!! Figure it out already!! All this, all of this is the witch's trap!!""","...you idiot!!! How long are you going to be tricked?!! You softy!! Figure it out already!! This is all the witch's trap!!"" ","......you idiot!!! How long are you going to be tricked?!! You softy!! Figure it out quickly!! This is all the witch's trap!!""",……馬鹿ッ！！！　いつまで騙されてるのよ！！　このお人好し！！　早く気付いて！！　これが全て全て魔女の罠であることに！！」,「……馬鹿ッ！！！　いつまで騙されてるのよ！！　このお人好し！！　早く気付いて！！　これが全て全て魔女の罠であることに！！」,"""ты — феерический идиот!!! Как долго ты ещё собираешься позволять себя обманывать?!! Тряпка!!! Сообрази уже!!! Это все ведьмины уловки!!!""","""......Seu idiota!!! Quanto tempo pretende continuar sendo enganado?! Pare de ser tão ingênuo e confiável!! Perceba logo!! Tudo isso, tudo isso é uma armadilha da bruxa!!""","""......You idiot!!! How long are you going to be tricked?!! Stop being so naive and trusting!! Figure it out already!! All this, all of this is the witch's trap!!""",「……笨蛋！！！你要被騙到幾時啊？！！這個老好人！！快點醒悟呀！！這些全部全部都是魔女的圈套！！」,「……笨蛋！！！你要被骗到几时啊？！！这个老好人！！快点醒悟呀！！这些全部全部都是魔女的圈套！！」,"""......You idiot!!! How long are you going to be tricked?!! Stop being so naive and trusting!! Figure it out already!! All this, all of this is the witch's trap!!""","""......You idiot!!! How long are you going to be tricked?!! Stop being so naive and trusting!! Figure it out already!! All this, all of this is the witch's trap!!""","""......You idiot!!! How long are you going to be tricked?!! Stop being so naive and trusting!! Figure it out already!! All this, all of this is the witch's trap!!"""
,Those words were aimed at me.,Those words were aimed at me. ,Those words were aimed at me.,その言葉は俺に掛けられているものだ。,その言葉は俺に掛けられているものだ。,Эти слова предназначались мне.,Aqueles palavras eram direcionadas a mim.,Those words were aimed at me.,這話是在對我說。,这话是在对我说。,Those words were aimed at me.,Those words were aimed at me.,Those words were aimed at me.
,"......This is all......the witch's trap, she says...?","...This is all... the witch's trap, she says...? ","......This is all, ...the witch's trap, she says...? ",……これらが全て、…魔女の罠だって…？,……これらが全て、…魔女の罠だって…？,"......Это всё — ловушка ведьм, как она говорит?..","......Tudo isso é......uma armadilha da bruxa, ela disse...?","......This is all......the witch's trap, she says...?",……這些全部都是，…魔女的圈套…？,……这些全部都是，…魔女的圈套…？,"......This is all......the witch's trap, she says...?","......This is all......the witch's trap, she says...?","......This is all......the witch's trap, she says...?"
,That can't be...{n}Beato reformed and swore to become a good witch......,That can't be... Beato reformed and swore to become a good witch... ,That can't be... Beato reformed and swore to become a good witch......,そんなはずはない…。ベアトは、改心して良い魔女になろうと誓って……。,そんなはずはない…。{n}ベアトは、改心して良い魔女になろうと誓って……。,Не может быть...{n}Беато изменилась и поклялась стать хорошей ведьмой...,Isso não pode ser...{n}A Beato se converteu e jurou ser uma boa bruxa......,That can't be...{n}Beato reformed and swore to become a good witch......,不可能這樣的…。{n}貝阿朵已經改過自新，發誓要當個好魔女了啊……。,不可能这样的…。{n}贝阿朵已经改过自新，发誓要当个好魔女了啊……。,That can't be...{n}Beato reformed and swore to become a good witch......,That can't be...{n}Beato reformed and swore to become a good witch......,That can't be...{n}Beato reformed and swore to become a good witch......
Ushiromiya Battler,""".....................Beato............... ...Calling it a trap......is a lie, right......? Please.........tell me it's a lie......""","""......Beato......... ...All this about traps... ...It's a lie, right...? Please, ......tell me it's a lie..."" ","""............Beato..................Calling it a trap, ......is a lie, right......? Please........., tell me it's a lie......""",「…………………ベアト……………。…罠なんて、……嘘だよな……？　嘘だと………、言ってくれ……。」,「…………………ベアト……………。…罠なんて、……嘘だよな……？　嘘だと………、言ってくれ……」,"""............Беато... ...Эти слова про ловушку... являются ложью, так ведь?.. Пожалуйста... скажи мне, что это ложь...""",""".....................Beato............... ...Chamando isso de armadilha......é uma mentira, certo......? Por favor.........me diga que é mentira......""",""".....................Beato............... ...Calling it a trap......is a lie, right......? Please.........tell me it's a lie......""",「…………………貝阿朵……………。…圈套什麼的，……是騙人的吧……？告訴我………，那是騙人……」,「…………………贝阿朵……………。…圈套什么的，……是骗人的吧……？告诉我………，那是骗人……」,""".....................Beato............... ...Calling it a trap......is a lie, right......? Please.........tell me it's a lie......""",""".....................Beato............... ...Calling it a trap......is a lie, right......? Please.........tell me it's a lie......""",""".....................Beato............... ...Calling it a trap......is a lie, right......? Please.........tell me it's a lie......"""
{f:5:Beatrice},"""......Sorry, Battleer. It was pretty interesting.""","""...Sorry, Battleer. It was pretty fun. ","""......Sorry, Battleer. It was pretty interesting. ",「……悪いなァ、戦人ァ。結構面白かったぜぇ。,「……悪いなァ、戦人ァ。結構面白かったぜぇ」,"""......Извини, Баттле‐ер. Это было довольно интересно.""","""......Desculpa, Battleer. Isto está muito interessante.""","""......Sorry, Battleer. It was pretty interesting.""",「……抱歉吶～，戰人～。挺好玩的哦。」,「……抱歉呐～，战人～。挺好玩的哦。」,"""......Sorry, Battleer. It was pretty interesting.""","""......Sorry, Battleer. It was pretty interesting.""","""......Sorry, Battleer. It was pretty interesting."""
{f:5:Beatrice},"""...Still, I was just trying to do what Master told me, but it really did work very well!""","...Sure, I just did what Teacher told me, but look how great it turned out!"" ","...Still, I was just trying to do what Teacher told me, but it really did work very well! ",…しかしお師匠様の言う通りにしてみたんだが、本当に結構、いいとこまでイケたなぁ！,「…しかしお師匠様の言う通りにしてみたんだが、本当に結構、いいとこまでイケたなぁ！」,"""...Однако я просто пыталась делать то, что говорила мне наставница, но это действительно неплохо сработало!""","""...Ainda assim, eu estava apenas tentando fazer o que minha professora me instruiu, mas isso funcionou muito bem!""","""...Still, I was just trying to do what Master told me, but it really did work very well!""",「…妾身只是照著師傅大人所講的試了試，但確實很管用！」,「…妾身只是照着师傅大人所讲的试了试，但确实很管用！」,"""...Still, I was just trying to do what Master told me, but it really did work very well!""","""...Still, I was just trying to do what Master told me, but it really did work very well!""","""...Still, I was just trying to do what Master told me, but it really did work very well!"""
