Ushiromiya Hideyoshi,"""Give it a rest, Eva. For now, you gotta stay quiet and bless the two young 'uns. The Golden Land is a capital of bliss. We should never quarrel here...!""","""Could you give it a rest, Eva? For now, you gotta stay quiet and bless the two young'uns. The Golden Land is a city of bliss. We should never quarrel here...!"" ","""Could you give it a rest, Eva? For now, you gotta stay quiet and bless the two young 'uns. The Golden Land is a city of bliss. We should never quarrel here...!""",「よさんか絵羽。今は黙って若い二人を祝福せなあかん。黄金郷は至福の都や。ここではいがみ合いは一切なしやで…！」,「よさんか絵羽。今は黙って若い二人を祝福せなあかん。黄金郷は至福の都や。ここではいがみ合いは一切なしやで…！」,"""Может, не будем ему мешать, Ева? Покамест, давай‐ка лучше промолчим и молча благословим молодую пару. Золотая Земля — это город радости. Нам никогда не следует здесь ссориться!..""","""Dá um tempo, Eva. A partir de agora, você precisa ficar quieta e abençoar os dois jovens. A Terra Dourada é a Capital da Bem‐aventurança. Nós nunca devemos discutir aqui...!""","""Give it a rest, Eva. For now, you gotta stay quiet and bless the two young 'uns. The Golden Land is a capital of bliss. We should never quarrel here...!""",「別這樣吶，繪羽。就不能在此刻，默默地祝福兩人麼？黃金鄉是至福之地吶。在這不可有衝突吶…！」,「别这样呐，绘羽。就不能在此刻，默默地祝福两人么？黄金乡是至福之地呐。在这不可有冲突呐…！」,"""Give it a rest, Eva. For now, you gotta stay quiet and bless the two young 'uns. The Golden Land is a capital of bliss. We should never quarrel here...!""","""Give it a rest, Eva. For now, you gotta stay quiet and bless the two young 'uns. The Golden Land is a capital of bliss. We should never quarrel here...!""","""Give it a rest, Eva. For now, you gotta stay quiet and bless the two young 'uns. The Golden Land is a capital of bliss. We should never quarrel here...!"""
Mammon,"""Here, any people are free to love each other. ...No one needs to hesitate over it.""","""Here, any people are free to love each other. ...No one needs to hesitate over it."" ","""Here, any people are free to love each other. ...No one needs to hesitate over it.""",「ここでは、愛し合う者たちは全てが自由。…誰にもはばかられることはない。」,「ここでは、愛し合う者たちは全てが自由。…誰にもはばかられることはない」,"""Здесь любой человек может свободно любить другого. ...Пусть никто в этом не сомневается.""","""Aqui, qualquer pessoa é livre para amar quem ela quiser. ...Ninguém precisa hesitar quanto a isso.""","""Here, any people are free to love each other. ...No one needs to hesitate over it.""",「在這裡，相愛之人一切自由。…不用顧忌任何人。」,「在这里，相爱之人一切自由。…不用顾忌任何人。」,"""Here, any people are free to love each other. ...No one needs to hesitate over it.""","""Here, any people are free to love each other. ...No one needs to hesitate over it.""","""Here, any people are free to love each other. ...No one needs to hesitate over it."""
Asmodeus,"""Jessica‐chan, Kanon‐kun, so wonderfuul! I'm so jealouuus!""","""Jessica-chan, Kanon-kun, you look so wonderfuul! I'm jealo-us!"" ","""Jessica-chan, Kanon-kun, so wonderfuul! I'm jealo-us!""",「朱志香ちゃん、嘉音くん、素敵ぃ！　妬けちゃうわー！」,「朱志香ちゃん、嘉音くん、素敵ぃ！　妬けちゃうわー！」,"""Джессика‐чан, Канон‐кун, как здорово! Как же мне завид‐но!""","""Jessica‐chan, Kanon‐kun, é maravilhoso! Estou com tanta invejaaaa!""","""Jessica‐chan, Kanon‐kun, so wonderfuul! I'm so jealouuus!""",「朱志香、嘉音君，好般配！令人嫉妒呢——！」,「朱志香、嘉音君，好般配！令人嫉妒呢——！」,"""Jessica‐chan, Kanon‐kun, so wonderfuul! I'm so jealouuus!""","""Jessica‐chan, Kanon‐kun, so wonderfuul! I'm so jealouuus!""","""Jessica‐chan, Kanon‐kun, so wonderfuul! I'm so jealouuus!"""
Ushiromiya Jessica,"""......H‐hey, Battler... This is kinda, umm, wahahahaha...""","""...H-Hey, Battler... I'm a little, umm, wahahahaha..."" ","""......H, hey, Battler... I'm a little, umm, wahahahaha...""",「……い、いよう、戦人…。何だかその、わははははは…。」,「……い、いよう、戦人…。何だかその、わははははは…」,"""......Э‐эй, Баттлер... Мне немного того, м‐м‐м, ва‐ха‐ха‐ха‐ха...""","""......E‐Ei, Battler... Isso é meio, bem, wahahahaha...""","""......H‐hey, Battler... This is kinda, umm, wahahahaha...""",「……喲、喲，戰人…。那個什麼，哇哈哈哈哈哈…」,「……哟、哟，战人…。那个什么，哇哈哈哈哈哈…」,"""......H‐hey, Battler... This is kinda, umm, wahahahaha...""","""......H‐hey, Battler... This is kinda, umm, wahahahaha...""","""......H‐hey, Battler... This is kinda, umm, wahahahaha..."""
Kanon,"""Battler‐sama, welcome. And welcome home...""","""Battler-sama, welcome. And welcome home..."" ","""Battler-sama, welcome. And welcome home...""",「戦人さま、ようこそ。そしてお帰りなさいませ…。」,「戦人さま、ようこそ。そしてお帰りなさいませ…」,"""Баттлер‐сама, добро пожаловать. И с возвращением домой...""","""Battler‐sama, bem‐vindo. E bem‐vindo ao lar...""","""Battler‐sama, welcome. And welcome home...""",「戰人少爺，歡迎。歡迎歸來…」,「战人少爷，欢迎。欢迎归来…」,"""Battler‐sama, welcome. And welcome home...""","""Battler‐sama, welcome. And welcome home...""","""Battler‐sama, welcome. And welcome home..."""
,Jessica was probably embarrassed because she was holding hands with Kanon‐kun.,Jessica was probably embarrassed because she was holding hands with Kanon-kun. ,Jessica was probably embarrassed because she was holding hands with Kanon-kun.,朱志香は多分、嘉音くんと手をつないでいることを恥ずかしがっているのだろう。,朱志香は多分、嘉音くんと手をつないでいることを恥ずかしがっているのだろう。,"Джессика, вероятно, была смущена, поскольку она держалась с Канон‐куном за руки.",A Jessica provavelmente estava com vergonha porque estava de mãos dadas com o Kanon‐kun.,Jessica was probably embarrassed because she was holding hands with Kanon‐kun.,朱志香大概是因為與嘉音君手拉手而很害羞吧。,朱志香大概是因为与嘉音君手拉手而很害羞吧。,Jessica was probably embarrassed because she was holding hands with Kanon‐kun.,Jessica was probably embarrassed because she was holding hands with Kanon‐kun.,Jessica was probably embarrassed because she was holding hands with Kanon‐kun.
,"And Kanon‐kun wanted to act humbly like a servant and bow, but since neither of them could let go of the other's hand, he couldn't do it so well, and the whole scene looked fairly comical.","Kanon-kun wanted to act humbly like a servant and bow, but since neither of them could let go of the other's hand, he couldn't do it so well, and the whole scene looked fairly comical. "," And Kanon-kun wanted to act humbly like a servant and bow, but since neither of them could let go of the other's hand, he couldn't do it so well, and the whole scene looked fairly comical.",そして嘉音くんは使用人らしく畏まって頭を下げたいのだが、二人は互いに手を離さないので、うまく頭が下げられず、何だかちょっぴり滑稽な光景だ。,そして嘉音くんは使用人らしく畏まって頭を下げたいのだが、二人は互いに手を離さないので、うまく頭が下げられず、何だかちょっぴり滑稽な光景だ。,"А Канон‐кун попытался соответствовать образу слуги и поклониться, но поскольку никто из них не отпустил друг друга, ему не удалось сделать это соответствующим образом, из‐за чего его потуги выглядели довольно комично.","E o Kanon‐kun queria agir de forma respeitosa, como um serviçal, e se curvar, mas como nenhum deles conseguia soltar a mão do outro, ele não conseguiu fazer isso muito bem, e a cena toda acabou se tornando algo cômico.","And Kanon‐kun wanted to act humbly like a servant and bow, but since neither of them could let go of the other's hand, he couldn't do it so well, and the whole scene looked fairly comical.",而嘉音君雖然想像個傭人樣地恭敬地鞠躬，但由於兩人彼此都沒有鬆手，所以沒法好好行禮，不由得令人感到有點滑稽。,而嘉音君虽然想像个佣人样地恭敬地鞠躬，但由于两人彼此都没有松手，所以没法好好行礼，不由得令人感到有点滑稽。,"And Kanon‐kun wanted to act humbly like a servant and bow, but since neither of them could let go of the other's hand, he couldn't do it so well, and the whole scene looked fairly comical.","And Kanon‐kun wanted to act humbly like a servant and bow, but since neither of them could let go of the other's hand, he couldn't do it so well, and the whole scene looked fairly comical.","And Kanon‐kun wanted to act humbly like a servant and bow, but since neither of them could let go of the other's hand, he couldn't do it so well, and the whole scene looked fairly comical."
Ushiromiya Natsuhi,"""With a servant child...?!! I forbid it, I couldn't possibly give away our Jessica to such a person...!!""","""With a servant child...?!! You can't, our Jessica cannot do such a thing...!!"" ","""With a servant child...?!! You can't, our Jessica cannot do such a thing...!!""",「使用人の子となんて…！！　駄目です、うちの朱志香がやれるわけありません…！！」,「使用人の子となんて…！！　駄目です、うちの朱志香をやれるわけありません…！！」,"""Ты с юношей из прислуги?!!.. Ты не можешь, наша Джессика не может пойти на такое!..""","""Com uma criança‐serviçal...?! Eu proíbo isso, como eu poderia dar a Jessica para uma pessoa dessas...!!""","""With a servant child...?!! I forbid it, I couldn't possibly give away our Jessica to such a person...!!""",「怎麼能和傭人…！！不行，不能把我家的朱志香交給傭人…！！」,「怎么能和佣人…！！不行，不能把我家的朱志香交给佣人…！！」,"""With a servant child...?!! I forbid it, I couldn't possibly give away our Jessica to such a person...!!""","""With a servant child...?!! I forbid it, I couldn't possibly give away our Jessica to such a person...!!""","""With a servant child...?!! I forbid it, I couldn't possibly give away our Jessica to such a person...!!"""
Ushiromiya Krauss,"""Why not allow it? Let her at least choose the person she likes.""","""It's hardly a big deal, correct? Let her at least choose the person she likes."" ","""It isn't really a problem, is it? Let her at least choose the person she likes.""",「いいじゃないかね。好きな相手くらい、自由に選ばせてやるといい。」,「いいじゃないかね。好きな相手くらい、自由に選ばせてやるといい」,"""Это ведь не проблема, согласна? Пусть она хотя бы выберет того человека, которого она любит.""","""Por que não permite? Deixe ao menos ela escolher a pessoa que ela gosta.""","""Why not allow it? Let her at least choose the person she likes.""",「有什麼不好呢？喜歡的對象，就由她自己選吧。」,「有什么不好呢？喜欢的对象，就由她自己选吧。」,"""Why not allow it? Let her at least choose the person she likes.""","""Why not allow it? Let her at least choose the person she likes.""","""Why not allow it? Let her at least choose the person she likes."""
Ushiromiya Natsuhi,"""I forbid it, I forbid it, aaa{0}a{0}a{0}a{0}a{0}aaahhh, Jessicaaaaaaaaa!""","""She can't, she can't, aaaaaaaaaahhh, Jessicaaaaaaaaa!"" ","""She can't, she can't, aaaaaaaaaahhh, Jessicaaaaaaaaa!""",「駄目です駄目です、あああぁあぁ、朱志香ぁああぁあぁ！」,「駄目です駄目です、あああぁあぁ、朱志香ぁああぁあぁ！」,"""Она не должна, она не должна, а‐а‐а‐а‐а‐а‐а‐а‐а‐аххх, Джессика‐а‐а‐а‐а‐а‐а‐а‐а!""","""Eu proíbo, eu proíbo, aaa{0}a{0}a{0}a{0}a{0}aaahhh, Jessicaaaaaaaaa!""","""I forbid it, I forbid it, aaa{0}a{0}a{0}a{0}a{0}aaahhh, Jessicaaaaaaaaa!""",「不行不行，啊啊啊啊啊啊，朱志香——————！」,「不行不行，啊啊啊啊啊啊，朱志香——————！」,"""I forbid it, I forbid it, aaa{0}a{0}a{0}a{0}a{0}aaahhh, Jessicaaaaaaaaa!""","""I forbid it, I forbid it, aaa{0}a{0}a{0}a{0}a{0}aaahhh, Jessicaaaaaaaaa!""","""I forbid it, I forbid it, aaa{0}a{0}a{0}a{0}a{0}aaahhh, Jessicaaaaaaaaa!"""
Ushiromiya Eva,"""Mine has gone awry toooooo, ohhhhh, Geooooooooorge!""","""You can't eitheeeeeer, Geooooooooorge!"" ","""You can't eitheeeeeer, Geooooooooorge!""",「うちも駄目なのよぉおおぉ、譲治ぃいいいぃいぃ！」,「うちも駄目なのよぉおおぉ、譲治ぃいいいぃいぃ！」,"""Тебе тоже нельзя‐а‐а‐а‐а, Джо‐о‐о‐о‐о‐о‐о‐о‐ордж!""","""O meu também ficou malllllllll, Geooooooooorge!""","""Mine has gone awry toooooo, ohhhhh, Geooooooooorge!""",「我家也不行喲————，讓治———————！」,「我家也不行哟————，让治———————！」,"""Mine has gone awry toooooo, ohhhhh, Geooooooooorge!""","""Mine has gone awry toooooo, ohhhhh, Geooooooooorge!""","""Mine has gone awry toooooo, ohhhhh, Geooooooooorge!"""
,"...As Aunt Natsuhi and Auntie Eva hugged each other, they cried tears of regret for their darling children.","...As Aunt Natsuhi and Aunt Eva hugged each other, they cried tears of regret for their adorable children. ","...As Natsuhi oba-san and Eva oba-san hugged each other, they cried tears of regret for their cute children.",…夏妃伯母さんと絵羽伯母さんが抱き合いながら、可愛い子どもに未練の涙を流し合っている。,…夏妃伯母さんと絵羽伯母さんが抱き合いながら、可愛い子どもに未練の涙を流し合っている。,"...Обняв друг друга, Тётя Нацухи и тётя Ева, проливали слёзы сожаления о своих милых детях.","...Com a tia Natsuhi e a tia Eva se abraçando, elas choraram lágrimas de arrependimento por seus queridos filhos.","...As Aunt Natsuhi and Auntie Eva hugged each other, they cried tears of regret for their darling children.",…夏妃伯母與繪羽姑母抱在一起，為心愛的兒女一同流下了不捨的淚水。,…夏妃伯母与绘羽姑母抱在一起，为心爱的儿女一同流下了不舍的泪水。,"...As Aunt Natsuhi and Auntie Eva hugged each other, they cried tears of regret for their darling children.","...As Aunt Natsuhi and Auntie Eva hugged each other, they cried tears of regret for their darling children.","...As Aunt Natsuhi and Auntie Eva hugged each other, they cried tears of regret for their darling children."
,......Even though they had always been at odds. ...It was a very bizarre scene.,...Even though they had always been at odds. ...It was a very bizarre scene. ,......Even though they had always been at odds....It was a very bizarre scene.,……犬猿の仲の二人がだ。…何とも不思議な光景。,……犬猿の仲の二人がだ。…何とも不思議な光景。,......Хотя они и всегда конфликтовали друг с другом. ...Это была довольно невероятная сцена.,......Mesmo elas sempre tendo sido estranhas. ...Foi uma cena muito bizarra.,......Even though they had always been at odds. ...It was a very bizarre scene.,……貓狗之交的兩人。…何其奇妙的情景。,……猫狗之交的两人。…何其奇妙的情景。,......Even though they had always been at odds. ...It was a very bizarre scene.,......Even though they had always been at odds. ...It was a very bizarre scene.,......Even though they had always been at odds. ...It was a very bizarre scene.
Ushiromiya Rosa,"""......It isn't really a problem, right? It doesn't matter who likes who.""","""...It isn't really a problem, right? It doesn't matter who likes who."" ","""......It isn't really a problem, right? It doesn't matter who likes who.""",「……いいじゃないですか。誰が誰を好きになったって。」,「……いいじゃないですか。誰が誰を好きになったって」,"""......Это ведь и правда не проблема, верно? Какая разница, кто кого любит.""","""......Isso não é realmente um problema, certo? Não importa quem gosta de quem.""","""......It isn't really a problem, right? It doesn't matter who likes who.""",「……有什麼不好呢？誰喜歡誰，又有什麼關係呢？」,「……有什么不好呢？谁喜欢谁，又有什么关系呢？」,"""......It isn't really a problem, right? It doesn't matter who likes who.""","""......It isn't really a problem, right? It doesn't matter who likes who.""","""......It isn't really a problem, right? It doesn't matter who likes who."""
Ushiromiya Kyrie,"""Exactly. It's proof the parent hasn't let go of their child.""","""That's right. It's proof that a parent's too attached to their child."" ","""That's right. It's proof that a parent can let go of their children.""",「そうよ。親が子離れしてない証拠ね。」,「そうよ。親が子離れしてない証拠ね」,"""Это точно. Это доказывает, что родители способны отпустить своих детей.""","""Exatamente. É uma prova que os pais não deixam seus filhos irem.""","""Exactly. It's proof the parent hasn't let go of their child.""",「是喲。這是當父母的，還沒對孩子放手的證據呢。」,「是哟。这是当父母的，还没对孩子放手的证据呢。」,"""Exactly. It's proof the parent hasn't let go of their child.""","""Exactly. It's proof the parent hasn't let go of their child.""","""Exactly. It's proof the parent hasn't let go of their child."""
Ushiromiya Rudolf,"""Battleer, you can bring home whatever kind of woman you want, I'll accept her waaarmly, alright?""","""Battleer, no matter what kind of woman you bring home, I'll give her a warm welcome, okay?"" ","""Battleer, no matter what kind of woman you bring home, I'll accept her waaarmly, alright?""",「戦人ぁ。俺はお前が、どんな女を連れ帰っても、生温かぁく受け入れてやるからな？」,「戦人ぁ。俺はお前が、どんな女を連れ帰っても、生温かぁく受け入れてやるからな？」,"""Баттле‐ер, какую бы женщину ты ни привёл домой, я устрою ей тё‐ёплый приём, договорились?""","""Battleer, você pode trazer para casa qualquer tipo de mulher que você quiser, eu vou aceitar ela com muito carinho, certoooo?""","""Battleer, you can bring home whatever kind of woman you want, I'll accept her waaarmly, alright?""",「戰人啊。我是不管你帶什麼女人回來，都會和藹可親地接受的哦？」,「战人啊。我是不管你带什么女人回来，都会和蔼可亲地接受的哦？」,"""Battleer, you can bring home whatever kind of woman you want, I'll accept her waaarmly, alright?""","""Battleer, you can bring home whatever kind of woman you want, I'll accept her waaarmly, alright?""","""Battleer, you can bring home whatever kind of woman you want, I'll accept her waaarmly, alright?"""
Ushiromiya Kyrie,"""You can't introduce her to this guy, you know? He'll get his hands on her immediately. He'll elope right away.""","""Don't you dare introduce her to this man, okay? He'll get his hands on her immediately. They'll run off together right away."" ","""You can't introduce her to this guy, alright? He'll get his hands on her immediately. He'll elope right away.""",「この人に紹介しちゃ駄目よ？　すぐ手を出すから。とっとと駆け落ちしちゃうのよ。」,「この人に紹介しちゃ駄目よ？　すぐ手を出すから。とっとと駆け落ちしちゃうのよ」,"""Не вздумай знакомить её с ним, ладно? Он её немедленно присвоит себе. И с ней сбежит.""","""Você sabe que não pode apresentar ela para esse cara, sabe? Ele vai colocar as mãos nela na mesma hora. Ela vai fugir no mesmo momento.""","""You can't introduce her to this guy, you know? He'll get his hands on her immediately. He'll elope right away.""",「不能介紹給他喲？他會立馬出手。然後迅速私奔哦。」,「不能介绍给他哟？他会立马出手。然后迅速私奔哦。」,"""You can't introduce her to this guy, you know? He'll get his hands on her immediately. He'll elope right away.""","""You can't introduce her to this guy, you know? He'll get his hands on her immediately. He'll elope right away.""","""You can't introduce her to this guy, you know? He'll get his hands on her immediately. He'll elope right away."""
Ushiromiya Maria,"""............Battler. You finally came here. Kihhi{0}hi{0}hi{0}hi{0}hi{0}hihihi.""","""......Battler. You finally came here. Kihhihihihihihihihi."" ","""............Battler. You finally came here. Kihhihihihihihihihi.""",「…………戦人。やっとここへ来た。きっひひひひひひひひ。」,「…………戦人。やっとここへ来た。きっひひひひひひひひ」,"""............Баттлер. Ты, наконец, пришёл сюда. Ки‐хи‐хи‐хи‐хи‐хи‐хи‐хи‐хи.""","""............Battler. Você finalmente veio. Kihhi{0}hi{0}hi{0}hi{0}hi{0}hihihi.""","""............Battler. You finally came here. Kihhi{0}hi{0}hi{0}hi{0}hi{0}hihihi.""",「…………戰人。總算來這兒了呢。唧、嘻嘻嘻嘻嘻嘻嘻嘻。」,「…………战人。总算来这儿了呢。唧、嘻嘻嘻嘻嘻嘻嘻嘻。」,"""............Battler. You finally came here. Kihhi{0}hi{0}hi{0}hi{0}hi{0}hihihi.""","""............Battler. You finally came here. Kihhi{0}hi{0}hi{0}hi{0}hi{0}hihihi.""","""............Battler. You finally came here. Kihhi{0}hi{0}hi{0}hi{0}hi{0}hihihi."""
Ushiromiya Battler,"""Maria... .........From the beginning, .........you knew that we would be coming here......?""","""Maria, ......from the very beginning, ...you knew we'd be coming here...?"" ","""Maria............From the beginning, ......you knew that we would be coming here......?""",「真里亞…。………お前は最初から、………ここへ来ることになると、…知っていたのか……？」,「真里亞…。………お前は最初から、………ここへ来ることになると、…知っていたのか……？」,"""Мария... .........С самого начала... Ты ведь знала, что мы попадём сюда?..""","""Maria... .........Desde o começo, .........você sabia que nós viríamos para cá......?""","""Maria... .........From the beginning, .........you knew that we would be coming here......?""",「真里亞…。………你從一開始，………就知道，…會來這兒嗎……？」,「真里亚…。………你从一开始，………就知道，…会来这儿吗……？」,"""Maria... .........From the beginning, .........you knew that we would be coming here......?""","""Maria... .........From the beginning, .........you knew that we would be coming here......?""","""Maria... .........From the beginning, .........you knew that we would be coming here......?"""
