,"But even in the case of an incomplete address, the local post office will often courteously, and to the best of its ability, research to find whether the sender's intended destination exists. ","But even in the case of a faulty address, the local post office will often courteously, and to the best of its ability, research to find whether the sender's intended destination exists.","But even in the case of an incomplete address, the local post office will often courteously, and to the best of its ability, research to find whether the sender's intended destination exists. ",ただ、不完全な住所ではあっても、現地の郵便局の好意的努力により、可能な限り、差出人が意図した送付先が存在しないか調査されることが多い。,ただ、不完全な住所ではあっても、現地の郵便局の好意的努力により、可能な限り、差出人が意図した送付先が存在しないか調査されることが多い。,"Но даже в случае неполного адреса местное почтовое отделение, вежливо и в меру своих возможностей, попытается выяснить, существует ли такой адрес назначения.","Mas no caso de um endereço errado, o serviço local muitas vezes, como forma de cortesia, e usando o máximo de suas habilidades, pesquisa para saber se o endereço pretendido realmente existe.","But even in the case of a faulty address, the local post office will often courteously, and to the best of its ability, research to find whether the sender's intended destination exists.",只不過，就算是不正確的住址，當地的郵局也常常會以出於善意的努力，盡可能地去調查，寄件人寫的郵寄地址到底存不存在。,只不过，就算是不正确的住址，当地的邮局也常常会以出于善意的努力，尽可能地去调查，寄件人写的邮寄地址到底存不存在。,"But even in the case of a faulty address, the local post office will often courteously, and to the best of its ability, research to find whether the sender's intended destination exists.","Ma anche nel caso di un indirizzo incompleto, l'ufficio postale locale spesso cortesemente, e al meglio delle sue abilità, cercherà di scoprire se l'indirizzo che intendeva il destinatario esiste.","But even in the case of a faulty address, the local post office will often courteously, and to the best of its ability, research to find whether the sender's intended destination exists.","But even in the case of a faulty address, the local post office will often courteously, and to the best of its ability, research to find whether the sender's intended destination exists."
,"When they still can't find it, the mail is sometimes returned after an investigation of several days. ","When they still can't find it, the mail is sometimes returned after an investigation of several days.","When they still can't find it, the mail is sometimes returned after an investigation of several days. ",それでも見つからない場合、数日の調査を経て返送されるケースもある。,それでも見つからない場合、数日の調査を経て返送されるケースもある。,"Когда у них так и не выходит его разыскать, почту иногда возвращаются несколько дней спустя после поисков.","Quando não conseguem encontrar, a correspondência normalmente retorna após uma investigação que dura alguns dias.","When they still can't find it, the mail is sometimes returned after an investigation of several days.",即便這樣都找不到的話，那就會在經過幾天的調查後再退回郵件。,即便这样都找不到的话，那就会在经过几天的调查后再退回邮件。,"When they still can't find it, the mail is sometimes returned after an investigation of several days.","Quando non lo riescono ancora a trovare, la posta certe volte è ritornata dopo vari giorni di indagini.","When they still can't find it, the mail is sometimes returned after an investigation of several days.","When they still can't find it, the mail is sometimes returned after an investigation of several days."
,"It seemed that the same thing had happened with this envelope, and the stamp was postmarked on October 3. ","It seemed that this was what had happened with this envelope, and the stamp was postmarked October 3rd.","It seemed that the same thing had happened with this envelope, and the stamp was postmarked on October 3. ",この封筒もそうだったらしく、切手の消印は、１０月３日になっていた。,この封筒もそうだったらしく、切手の消印は、１０月３日になっていた。,"Похоже, так случилось и с этим конвертом, а марка была проштемпелёвана 3 октября.","Parece que foi o que aconteceu com este envelope, e o selo foi carimbado dia 3 de outubro.","It seemed that this was what had happened with this envelope, and the stamp was postmarked October 3rd.",這個信封貌似就屬於上述這種情況，郵票上的郵戳是，10 月 3 日。,这个信封貌似就属于上述这种情况，邮票上的邮戳是，10 月 3 日。,"It seemed that this was what had happened with this envelope, and the stamp was postmarked October 3rd.","Sembra che la stessa cosa sia accaduta a questa lettera, e il francobollo era stato timbrato il 3 ottobre.","It seemed that this was what had happened with this envelope, and the stamp was postmarked October 3rd.","It seemed that this was what had happened with this envelope, and the stamp was postmarked October 3rd."
,It was postmarked on Niijima. Niijima was a long way away from Rebun Island. ,It was postmarked on Niijima.{n}Niijima is a long way away from Rebun Island.,It was postmarked on Niijima. Niijima was a long way away from Rebun Island. ,消印は新島内だ。新島から礼文島は遠く離れている。,消印は新島内だ。{n}新島から礼文島は遠く離れている。,Причём почтовый штемпель поставили на Нииджиме.{n}Сам Нииджима находился довольно далеко от острова Ребун.,Foi carimbado em Niijima.{n}Niijima é bem longe da Ilha Rebun.,It was postmarked on Niijima.{n}Niijima is a long way away from Rebun Island.,郵戳是在新島蓋的。{n}新島與禮文島相距甚遠。,邮戳是在新岛盖的。{n}新岛与礼文岛相距甚远。,It was postmarked on Niijima.{n}Niijima is a long way away from Rebun Island.,Era stato timbrato a Niijima. Niijima era molto lontana dell'Isola Rebun.,It was postmarked on Niijima.{n}Niijima is a long way away from Rebun Island.,It was postmarked on Niijima.{n}Niijima is a long way away from Rebun Island.
,"On top of that, the destination was also nonsensical. ...It had taken more than a week for the mail to be returned. ","On top of that, the destination was also nonsensical.{n}......It had taken more than a week for the mail to be returned.","On top of that, the destination was also nonsensical. ...It had taken more than a week for the mail to be returned. ",その上、住所もでたらめ。……返送には１週間以上の期間を経ていた。,その上、住所もでたらめ。{n}……返送には１週間以上の期間を経ていた。,"Более того, место назначение тоже сбивало с толку.{n}На возвращение почты ушло больше недели.","Mais do que isso, o destino é ridículo.{n}......Levou mais de uma semana para a correspondência ser retornada.","On top of that, the destination was also nonsensical.{n}......It had taken more than a week for the mail to be returned.",再加上，住址也是亂寫的。{n}……距退回到他手上經過了超過一星期的時間。,再加上，住址也是乱写的。{n}……距退回到他手上经过了超过一星期的时间。,"On top of that, the destination was also nonsensical.{n}......It had taken more than a week for the mail to be returned.","In più, la destinazione era anche senza senso. ... Ci è voluto più di una settimana per ritornare la posta.","On top of that, the destination was also nonsensical.{n}......It had taken more than a week for the mail to be returned.","On top of that, the destination was also nonsensical.{n}......It had taken more than a week for the mail to be returned."
,"...In other words, there was probably a high chance that having the envelope returned to the sender after an unfixed amount of time... had been the goal from the very beginning. ","......In other words, there was an extremely high chance that having this envelope returned to the sender after an indeterminate amount of time...had been the goal from the very beginning.","...In other words, there was probably a high chance that having the envelope returned to the sender after an unfixed amount of time... had been the goal from the very beginning. ",……つまりこの封筒は、不定期間を経て差出人に返送されることを、初めから目論んでいた可能性が極めて高いということだろう。,……つまりこの封筒は、不定期間を経て差出人に返送されることを、初めから目論んでいた可能性が極めて高いということだろう。,"Другими словами, имелась высокая вероятность, что в возвращении конверта адресанту неопределённое время спустя и заключалась цель с самого начала.","......Ou seja, há uma alta chance de que este envelope, que retornou para o remetente após um período de tempo indeterminado...tivesse esse propósito deste o princípio.","......In other words, there was an extremely high chance that having this envelope returned to the sender after an indeterminate amount of time...had been the goal from the very beginning.",……也就是說，這個信封極有可能一開始就是為了，經由不定期限，退回到寄件人手中，才這麼填寫的。,……也就是说，这个信封极有可能一开始就是为了，经由不定期限，退回到寄件人手中，才这么填写的。,"......In other words, there was an extremely high chance that having this envelope returned to the sender after an indeterminate amount of time...had been the goal from the very beginning.","... In altre parole, c'era un'alta possibilità che il ritorno della lettera al destinatario dopo un certo periodo di tempo... era l'obiettivo iniziale.","......In other words, there was an extremely high chance that having this envelope returned to the sender after an indeterminate amount of time...had been the goal from the very beginning.","......In other words, there was an extremely high chance that having this envelope returned to the sender after an indeterminate amount of time...had been the goal from the very beginning."
,Why do something like that......? ,Why do something like that.........?,Why do something like that......? ,何のためにそんなことを………？,何のためにそんなことを………？,Зачем было делать такое?,Por que alguém faria isso.........?,Why do something like that.........?,為什麼，要這麼做………？,为什么，要这么做………？,Why do something like that.........?,Perché fare qualcosa del genere...?,Why do something like that.........?,Why do something like that.........?
,"Even before asking what it was that had been sent, this envelope was already wrapped in mystery... ","Even before asking what it was that had been sent, this envelope was already veiled in mystery......","Even before asking what it was that had been sent, this envelope was already wrapped in mystery... ",何が送られてきたのかを問う以前の段階でさえ、この封筒は謎に包まれている……。,何が送られてきたのかを問う以前の段階でさえ、この封筒は謎に包まれている……。,"Этот конверт окутывала тайна ещё до того, как вставал вопрос, что послано в нём.","Mesmo depois de ter sido enviado, este envelope ainda estava velado pelo mistério......","Even before asking what it was that had been sent, this envelope was already veiled in mystery......",在問送來了什麼之前，這個信封本身就已充滿了謎團……。,在问送来了什么之前，这个信封本身就已充满了谜团……。,"Even before asking what it was that had been sent, this envelope was already veiled in mystery......","Anche dopo aver chiesto cosa ci fosse all'interno, questa busta è già avvolta nel mistero...","Even before asking what it was that had been sent, this envelope was already veiled in mystery......","Even before asking what it was that had been sent, this envelope was already veiled in mystery......"
Ushiromiya Ange,""".........And inside it?"" ","""..................And inside it?""",""".........And inside it?"" ",「………………中身は？」,「………………中身は？」,"""...............А что внутри?""","""..................E o conteúdo?""","""..................And inside it?""",「………………裡面裝的是？」,「………………里面装的是？」,"""..................And inside it?""","""... E dentro?""","""..................And inside it?""","""..................And inside it?"""
Nanjo Masayuki,"""Go ahead."" ","""Go ahead.""","""Go ahead."" ",「どうぞ。」,「どうぞ」,"""Откройте.""","""À vontade.""","""Go ahead.""",「請。」,「请。」,"""Go ahead.""","""Va' avanti.""","""Go ahead.""","""Go ahead."""
,"After getting the doctor's permission, I tilted the already opened envelope. ","After getting the doctor's permission, I tilted the already opened envelope.","After getting the doctor's permission, I tilted the already opened envelope. ",医師に許可をもらい、すでに口の開いている封筒を傾ける。,医師に許可をもらい、すでに口の開いている封筒を傾ける。,"С разрешения доктора, я вытряхнула уже открытый конверт.","Após receber permissão, eu virei o envelope já aberto.","After getting the doctor's permission, I tilted the already opened envelope.",得到了醫師的許可後，緣壽將已開封了的信封傾斜。,得到了医师的许可后，缘寿将已开封了的信封倾斜。,"After getting the doctor's permission, I tilted the already opened envelope.","Dopo aver ottenuto il permesso del dottore, aprii la busta già aperta.","After getting the doctor's permission, I tilted the already opened envelope.","After getting the doctor's permission, I tilted the already opened envelope."
,"From the inside came a small, folded letter, and a small key with a number plate attached. Then, a magnetic card slid out. ","From the inside came a small, folded letter, and a small key with a number tag attached. A swipe card slid out in addition.","From the inside came a small, folded letter, and a small key with a number plate attached. Then, a magnetic card slid out. ",すると中から、畳まれた小さな手紙と、ナンバープレートの付いた小さな鍵。それと磁気カードが溢れ出てきた。,すると中から、畳まれた小さな手紙と、ナンバープレートの付いた小さな鍵。それと磁気カードが溢れ出てきた。,"Наружу выпало маленькое сложенное письмо и ключик с номерком. Кроме того, ещё выскользнула магнитная карта.","Dele saiu uma pequena carta dobra e uma pequena chave, com um número de identificação anexado. Saiu também um cartão magnético.","From the inside came a small, folded letter, and a small key with a number tag attached. A swipe card slid out in addition.",接著，從中滑出了折疊好的小小信紙，連著塊號碼牌的小小鑰匙。以及一張磁卡。,接着，从中滑出了折叠好的小小信纸，连着块号码牌的小小钥匙。以及一张磁卡。,"From the inside came a small, folded letter, and a small key with a number tag attached. A swipe card slid out in addition.","Dall'interno arrivò una piccola, lettera piegata, e una piccola chiave con una piccola placca numerata. Dopo, una carta magnetica scivolò fuori.","From the inside came a small, folded letter, and a small key with a number tag attached. A swipe card slid out in addition.","From the inside came a small, folded letter, and a small key with a number tag attached. A swipe card slid out in addition."
,A112 was engraved on the key's number plate. ...I didn't know what it meant. ,A112 was engraved on the key's number tag.{n}......I didn't know what it meant.,A112 was engraved on the key's number plate. ...I didn't know what it meant. ,鍵のナンバープレートにはＡ１１２と刻印されている。……何を指すのかはわからない。,鍵のナンバープレートにはＡ１１２と刻印されている。{n}……何を指すのかはわからない。,"На номерке ключа было выгравировано А112.{n}......Я не знаю, что это значит.",A112 estava gravado no número de identificação da chave.{n}......Eu não sei o que isso significa.,A112 was engraved on the key's number tag.{n}......I didn't know what it meant.,鑰匙的號碼牌上刻著 A112。{n}……不知道這是指什麼。,钥匙的号码牌上刻着 A112。{n}……不知道这是指什么。,A112 was engraved on the key's number tag.{n}......I didn't know what it meant.,Sulla placca c'era inciso A112. ... Non sapevo cosa significasse.,A112 was engraved on the key's number tag.{n}......I didn't know what it meant.,A112 was engraved on the key's number tag.{n}......I didn't know what it meant.
,The magnetic card was pitch black and had gold characters engraved in it. ,The swipe card was pitch black and had gold letters engraved on it.,The magnetic card was pitch black and had gold characters engraved in it. ,磁気カードは真っ黒で、金文字が刻印されている。,磁気カードは真っ黒で、金文字が刻印されている。,"Магнитная карта была чёрная, как смоль, с выгравированными золотыми буквами.",O cartão magnético era completamente preto e possuía letras douradas nele.,The swipe card was pitch black and had gold letters engraved on it.,磁卡通體漆黑，卡上刻著金色的文字。,磁卡通体漆黑，卡上刻着金色的文字。,The swipe card was pitch black and had gold letters engraved on it.,La carta magnetica era nera come la pece e aveva dei caratteri in oro incisi su di essa.,The swipe card was pitch black and had gold letters engraved on it.,The swipe card was pitch black and had gold letters engraved on it.
,"""Members"" was written in English. The jet-black, gold-lettered card design made it feel like something very high-class. ","""MEMBERS"" was written there in English. The jet‐black, gold‐lettered card design made it feel like something very high‐class.","""Members"" was written in English. The jet-black, gold-lettered card design made it feel like something very high-class. ",英語で、メンバーズと記されていた。漆黒に金文字のカードデザインは、かなりの高級感を感じさせる。,英語で、メンバーズと記されていた。漆黒に金文字のカードデザインは、かなりの高級感を感じさせる。,"На ней по‐английски было написано ""Members"", то есть ""Члены"". Сам вид блестящей чёрной карты с золотыми буквами производил впечатление чего‐то принадлежащего к высшей прослойке общества.","Nele estava escrito ""MEMBERS"". O preto azeviche e as letras em ouro do cartão passavam a impressão de ser algo de alta‐classe.","""MEMBERS"" was written there in English. The jet‐black, gold‐lettered card design made it feel like something very high‐class.",其文字是英語，members。黑底金字的卡片造型令人感到了非同一般的高檔感。,其文字是英语，members。黑底金字的卡片造型令人感到了非同一般的高档感。,"""MEMBERS"" was written there in English. The jet‐black, gold‐lettered card design made it feel like something very high‐class.","‘Members’ era scritto in inglese. Il design nero, con lettere dorate della carta lo fece sembrare come qualcosa di alta classe.","""MEMBERS"" was written there in English. The jet‐black, gold‐lettered card design made it feel like something very high‐class.","""MEMBERS"" was written there in English. The jet‐black, gold‐lettered card design made it feel like something very high‐class."
,"...But of course, I didn't have a clue what kind of card it was just from that. ","......But of course, I didn't have a clue what kind of card it was just from that.","...But of course, I didn't have a clue what kind of card it was just from that. ",……しかしもちろん、それだけでは何のカードなのか見当もつかない。,……しかしもちろん、それだけでは何のカードなのか見当もつかない。,"Но я, разумеется, не могла определить, для чего эта карта, руководствуясь только такими предпосылками.","......Mas é claro, eu não fazia ideia de que tipo de cartão era aquele.","......But of course, I didn't have a clue what kind of card it was just from that.",……不過，當然，光憑這些是完全想不出這是張什麼卡的。,……不过，当然，光凭这些是完全想不出这是张什么卡的。,"......But of course, I didn't have a clue what kind of card it was just from that.","... Ma ovviamente, non avevo la più pallida idea di che tipo di carta fosse solo da quello.","......But of course, I didn't have a clue what kind of card it was just from that.","......But of course, I didn't have a clue what kind of card it was just from that."
,"...I unfolded the letter. Its contents were extremely brief, and only the following was written: ","......I unfolded the letter.{n}Its contents were extremely brief, and only the following was written:","...I unfolded the letter. Its contents were extremely brief, and only the following was written: ",……折り畳まれた手紙を広げる。そこには非常に簡潔に、以下のことだけが記されていた。,……折り畳まれた手紙を広げる。{n}そこには非常に簡潔に、以下のことだけが記されていた。,......Я раскрыла письмо.{n}Его содержание было предельно коротким и значилось там лишь следующее:,"......Eu abri a carta.{n}Seu conteúdo era extremamente breve, e tudo que estava escrito era:","......I unfolded the letter.{n}Its contents were extremely brief, and only the following was written:",……攤開折疊好的信紙。{n}紙上非常簡潔地記著以下內容。,……摊开折叠好的信纸。{n}纸上非常简洁地记着以下内容。,"......I unfolded the letter.{n}Its contents were extremely brief, and only the following was written:","... Aprii la lettera. I suoi contenuti erano estremamente brevi, e c'era scritto solo questo:","......I unfolded the letter.{n}Its contents were extremely brief, and only the following was written:","......I unfolded the letter.{n}Its contents were extremely brief, and only the following was written:"
,07151129. ,07151129.,07151129. ,０７１５１１２９。,０７１５１１２９。,07151129.,07151129.,07151129.,07151129。,07151129。,07151129.,07151129.,07151129.,07151129.
,"Also written was the name of a certain massive bank known throughout Japan, as well as the words ""Central Branch"". ","And the name of a certain massive bank known throughout Japan, as well as the words ""Central Branch"".","Also written was the name of a certain massive bank known throughout Japan, as well as the words ""Central Branch"". ",そして、誰もが知る日本の某巨大銀行の名が記され、本店とも書かれていた。,そして、誰もが知る日本の某巨大銀行の名が記され、本店とも書かれていた。,"Также в нём было написано имя крупного и известного по всей Японии банка и слова ""Центральный филиал"".","O nome de um grande banco conhecido através do Japão, assim como as palavras ""Agência Central"".","And the name of a certain massive bank known throughout Japan, as well as the words ""Central Branch"".",以及，人盡皆知的日本某巨大銀行的名字及“總行”的字樣。,以及，人尽皆知的日本某巨大银行的名字及“总行”的字样。,"And the name of a certain massive bank known throughout Japan, as well as the words ""Central Branch"".","C'era anche scritto il nome di una certa grande banca conosciuta in tutto il Giappone, insieme alle parole ‘Sede Centrale’.","And the name of a certain massive bank known throughout Japan, as well as the words ""Central Branch"".","And the name of a certain massive bank known throughout Japan, as well as the words ""Central Branch""."
