Mammon,"""......For the past 12 years, you've been constantly enslaved by {f:5:Beatrice}-sama's curse. ...This might be proof of that a curse. But please, hang in there. Breaking through that was supposed to be part of the goal of this journey."" ",""".........For the past twelve years, you have been enslaved by {f:5:Beatrice}‐sama's curse. ...This might be proof that this really was a curse. But please, don't fall apart. Part of this journey should be to break through that.""","""......For the past 12 years, you've been constantly enslaved by {f:5:Beatrice}-sama's curse. ...This might be proof of that a curse. But please, hang in there. Breaking through that was supposed to be part of the goal of this journey."" ",「………この１２年間。縁寿さまはずっとベアトリーチェさまの呪縛に捕らわれてきた。…これがその、まさに呪縛の証となるのかもしれません。ですが、どうかしっかり。それを打ち破るための旅でもあるはずです。」,「………この１２年間。縁寿さまはずっとベアトリーチェさまの呪縛に捕らわれてきた。…これがその、まさに呪縛の証となるのかもしれません。ですが、どうかしっかり。それを打ち破るための旅でもあるはずです」,"""........За прошедшие 12 лет. Вы всегда находились во власти проклятия {f:5:Беатриче}‐сама. Это может служить доказательством, что то действительно было проклятье. Но пожалуйста, не расклеивайтесь. Одна из целей вашего путешествия — избавиться от него.""",""".........Nos últimos doze anos, você esteve escravizada pela maldição da {f:5:Beatrice}‐sama. ...Esta deve ser uma prova de que era mesmo uma maldição. Mas não se deprima, por favor. Parte dessa jornada deve servir para superá‐la.""",""".........For the past twelve years, you have been enslaved by {f:5:Beatrice}‐sama's curse. ...This might be proof that this really was a curse. But please, don't fall apart. Part of this journey should be to break through that.""",「………這十二年間。緣壽小姐一直在被貝阿朵莉切夫人的咒縛所困。…這反應也許就正是那咒縛的鐵證。不過，請千萬堅強點。這趟旅程，理應是為了打破這個咒縛吧。」,「………这十二年间。缘寿小姐一直在被贝阿朵莉切夫人的咒缚所困。…这反应也许就正是那咒缚的铁证。不过，请千万坚强点。这趟旅程，理应是为了打破这个咒缚吧。」,""".........For the past twelve years, you have been enslaved by {f:5:Beatrice}‐sama's curse. ...This might be proof that this really was a curse. But please, don't fall apart. Part of this journey should be to break through that.""","""... Per i passati 12 anni, lei è stata sempre stata resa schiava dalla maledizione di Beatrice-sama. ... Questa può essere la prova che era davvero una maledizione. Ma la prego, non si scoraggi. Parte di questo viaggio dovrebbe servire a rivelarlo.""",""".........For the past twelve years, you have been enslaved by {f:5:Beatrice}‐sama's curse. ...This might be proof that this really was a curse. But please, don't fall apart. Part of this journey should be to break through that.""",""".........For the past twelve years, you have been enslaved by {f:5:Beatrice}‐sama's curse. ...This might be proof that this really was a curse. But please, don't fall apart. Part of this journey should be to break through that."""
Ushiromiya Ange,"""That's right... Just letting the blood rise to my head won't get me anywhere. Got to think calmly. ......What's going on? What's the meaning of handing out a hundred million yen to the relatives? Is she trying to provoke us...? Damn that {f:5:Beatrice}......"" ","""That's right...... Just letting the blood rise to my head won't get me anywhere. Got to think calmly. .........What's going on? What's the meaning of handing out a hundred million yen to each of the relatives? Was she trying to provoke us......? Damn that {f:5:Beatrice}.........""","""That's right... Just letting the blood rise to my head won't get me anywhere. Got to think calmly. ......What's going on? What's the meaning of handing out a hundred million yen to the relatives? Is she trying to provoke us...? Damn that {f:5:Beatrice}......"" ",「そうね……。頭に血を上らせたって、何の役にも立たないわ。冷静に考えなくちゃ。………これはどういうことなの？　遺族に１億円をばら蒔く意味は何？挑発だとでも言うの……？　ベアトリーチェめ………。」,「そうね……。頭に血を上らせたって、何の役にも立たないわ。冷静に考えなくちゃ。………これはどういうことなの？　遺族に１億円をばら蒔く意味は何？　挑発だとでも言うの……？　ベアトリーチェめ………」,"""Правильно... Если дам крови ударить себе в голову, проку будет мало. Надо мыслить спокойно. ........Что происходит? Какой смысл в выдаче родственникам сотен миллионов йен? Она пытается спровоцировать нас? Чёрт бы побрал эту {f:5:Беатриче}...""","""Isso mesmo...... Deixar o sangue subir à cabeça não vai me levar a lugar nenhum. Preciso raciocinar com calma. .........O que está acontecendo? Qual o sentido de passar cem milhões de ienes para cada parente? Ela está tentando nos provocar......? {f:5:Beatrice}, sua.........""","""That's right...... Just letting the blood rise to my head won't get me anywhere. Got to think calmly. .........What's going on? What's the meaning of handing out a hundred million yen to each of the relatives? Was she trying to provoke us......? Damn that {f:5:Beatrice}.........""",「是呢……。熱血上頭不會派上任何用場。得冷靜地思考。………這到底是怎麼回事？給遺族送去一億日元的意義是什麼呢？難道是挑釁嗎……？死貝阿朵莉切………」,「是呢……。热血上头不会派上任何用场。得冷静地思考。………这到底是怎么回事？给遗族送去一亿日元的意义是什么呢？难道是挑衅吗……？死贝阿朵莉切………」,"""That's right...... Just letting the blood rise to my head won't get me anywhere. Got to think calmly. .........What's going on? What's the meaning of handing out a hundred million yen to each of the relatives? Was she trying to provoke us......? Damn that {f:5:Beatrice}.........""","""Giusto... farmi salire il sangue alla testa non mi porterà da nessuna parte. {n}Devo riflettere con calma. ... Cosa sta succedendo? Qual è il significato di lasciare 100 milioni di yen ai parenti? Sta cercando di provocarci...? {n}Maledetta Beatrice...""","""That's right...... Just letting the blood rise to my head won't get me anywhere. Got to think calmly. .........What's going on? What's the meaning of handing out a hundred million yen to each of the relatives? Was she trying to provoke us......? Damn that {f:5:Beatrice}.........""","""That's right...... Just letting the blood rise to my head won't get me anywhere. Got to think calmly. .........What's going on? What's the meaning of handing out a hundred million yen to each of the relatives? Was she trying to provoke us......? Damn that {f:5:Beatrice}........."""
Sakutarou,"‘Ange, ...calm down... ...Uryu...’ ",‘Ange......calm down...... ......Uryu......’,"‘Ange, ...calm down... ...Uryu...’ ",『縁寿……、落ち着いて……。……うりゅ……。』,『縁寿……、落ち着いて……。……うりゅ……』,"{p:0:『}Энджи, успокойся... Урю...{p:0:』}",‘Ange......se acalme...... ......Uryu......’,‘Ange......calm down...... ......Uryu......’,『緣壽……，請冷靜點……。……嗚溜……』,『缘寿……，请冷静点……。……呜溜……』,‘Ange......calm down...... ......Uryu......’,{p:0:『}Ange... calmati... uryu... {p:0:』},‘Ange......calm down...... ......Uryu......’,‘Ange......calm down...... ......Uryu......’
,"As Sakutaro buried his head in my stomach, he urged me to stay calm. ","As Sakutaro buried his head in my stomach, he urged me to stay calm.","As Sakutaro buried his head in my stomach, he urged me to stay calm. ",さくたろが、私のお腹に顔を埋めながら、冷静になるよう促す。,さくたろが、私のお腹に顔を埋めながら、冷静になるよう促す。,"Зарывшись головой мне в живот, Сакутаро призывал меня к спокойствию.","Sakutaro enfiou seu rosto na minha barriga, pedindo para eu me acalmar.","As Sakutaro buried his head in my stomach, he urged me to stay calm.",櫻太郎邊把臉埋到我的肚子上，邊催促我保持冷靜。,樱太郎边把脸埋到我的肚子上，边催促我保持冷静。,"As Sakutaro buried his head in my stomach, he urged me to stay calm.","Mentre Sakutarou sprofondava la sua testa nella mia pancia, mi pregò di star calma.","As Sakutaro buried his head in my stomach, he urged me to stay calm.","As Sakutaro buried his head in my stomach, he urged me to stay calm."
,...I took another deep breath...and started thinking. ,"......I took another deep breath, and started thinking.",...I took another deep breath...and started thinking. ,……私はもう一度深く深呼吸し、思考を働かせた。,……私はもう一度深く深呼吸し、思考を働かせた。,"......Ещё раз глубоко вздохнув, я начала думать.",......Eu respirei fundo mais uma vez e comecei a pensar.,"......I took another deep breath, and started thinking.",……我再次深深地做了個深呼吸後，開始了思考。,……我再次深深地做了个深呼吸后，开始了思考。,"......I took another deep breath, and started thinking.","... Feci un altro respiro profondo, e provai a pensare.","......I took another deep breath, and started thinking.","......I took another deep breath, and started thinking."
Ushiromiya Ange,"""......I wonder if this envelope was sent to support the theory that {f:5:Beatrice} was behind that crime."" ",""".........I wonder if the sending of these envelopes was to demonstrate that this was a premeditated crime by {f:5:Beatrice}.""","""......I wonder if this envelope was sent to support the theory that {f:5:Beatrice} was behind that crime."" ",「………この封筒の送付はつまり、ベアトリーチェによる事件の、計画性を裏付けるものかしら。」,「………この封筒の送付はつまり、ベアトリーチェによる事件の、計画性を裏付けるものかしら」,""".......Что если конверты посылали с целью поддержать теорию, что за тем преступлением стояла {f:5:Беатриче}.""",""".........Me pergunto se o envio desses envelopes foi para demonstrar que aquele foi um crime premeditado pela {f:5:Beatrice}.""",""".........I wonder if the sending of these envelopes was to demonstrate that this was a premeditated crime by {f:5:Beatrice}.""",「………曾寄出過這種信，是否印證了貝阿朵莉切所犯下的事件是有計劃的呢？」,「………曾寄出过这种信，是否印证了贝阿朵莉切所犯下的事件是有计划的呢？」,""".........I wonder if the sending of these envelopes was to demonstrate that this was a premeditated crime by {f:5:Beatrice}.""","""... Mi chiedo se la spedizione di questa lettera è stata fatta per supportare la teoria che c'era Beatrice dietro quel crimine.""",""".........I wonder if the sending of these envelopes was to demonstrate that this was a premeditated crime by {f:5:Beatrice}.""",""".........I wonder if the sending of these envelopes was to demonstrate that this was a premeditated crime by {f:5:Beatrice}."""
Mammon,"""It was postmarked right before the family conference. And it was intentionally set up so that it would be sent back after some time."" ","""They were postmarked right before the family conference. And they were intentionally set up so that they would be sent back after some time.""","""It was postmarked right before the family conference. And it was intentionally set up so that it would be sent back after some time."" ",「消印は親族会議の直前。そして、わざと時間を掛けて返送されてくるように仕組まれている。」,「消印は親族会議の直前。そして、わざと時間を掛けて返送されてくるように仕組まれている」,"""Его проштемпелевали прямо перед семейным собранием. И подстроили всё так, чтобы его отослали какое‐то время спустя.""","""Eles foram seladas pouco antes da conferência familiar. E foram intencionalmente preparados para serem enviadas algum tempo depois.""","""They were postmarked right before the family conference. And they were intentionally set up so that they would be sent back after some time.""",「郵戳是臨近親族會議時蓋的。並且，還故意把它寫得，需要經過一段時間後才會被退回。」,「邮戳是临近亲族会议时盖的。并且，还故意把它写得，需要经过一段时间后才会被退回。」,"""They were postmarked right before the family conference. And they were intentionally set up so that they would be sent back after some time.""","""Il timbro postale risale a subito prima della riunione di famiglia. Ed è stata intenzionalmente preparata in modo che tornasse indietro dopo un po' di tempo.""","""They were postmarked right before the family conference. And they were intentionally set up so that they would be sent back after some time.""","""They were postmarked right before the family conference. And they were intentionally set up so that they would be sent back after some time."""
Sakutarou,"‘...They wanted it to arrive after the incident, is that it...?’ ","‘......They wanted them to arrive after the incident, is that it......?’","‘...They wanted it to arrive after the incident, is that it...?’ ",『……事件の後に届くようにしたかった、ということかな……？』,『……事件の後に届くようにしたかった、ということかな……？』,"{p:0:『}...Они хотели, чтобы конверты отослали сразу после инцидента, так что ли?{p:0:』}","‘......Ela queria que chegassem depois do incidente, certo......?’","‘......They wanted them to arrive after the incident, is that it......?’",『……會不會，是想讓信在事件之後送到呢……？』,『……会不会，是想让信在事件之后送到呢……？』,"‘......They wanted them to arrive after the incident, is that it......?’","{p:0:『}... Si voleva che fossero mandate dopo l'incidente, non è così...?{p:0:』}","‘......They wanted them to arrive after the incident, is that it......?’","‘......They wanted them to arrive after the incident, is that it......?’"
Ushiromiya Ange,"""Yeah. That's what it implies. ......But it raises a few questions. Why use such an uncertain method?"" ","""Yeah. That's what it implies. .........But it still leaves me wondering a little. Why such an uncertain method?""","""Yeah. That's what it implies. ......But it raises a few questions. Why use such an uncertain method?"" ",「うん。そうなるわ。………でも、少し疑問もあるの。なぜこんな不確実な方法で？」,「うん。そうなるわ。………でも、少し疑問もあるの。なぜこんな不確実な方法で？」,"""Да. Напрашивается именно такой вывод. .....Но есть и сомнительные части. Почему был избран столь ненадёжный метод?""","""Sim. É o que isso implica. .........Mas ainda me deixa com uma leve indagação.{n}Por que um método tão incerto?""","""Yeah. That's what it implies. .........But it still leaves me wondering a little. Why such an uncertain method?""",「嗯。是如此呢。………但是，稍微有個疑問。為什麼要用這種靠不住的方法？」,「嗯。是如此呢。………但是，稍微有个疑问。为什么要用这种靠不住的方法？」,"""Yeah. That's what it implies. .........But it still leaves me wondering a little. Why such an uncertain method?""","""Già. Questo è ciò che implica. ... Ma ci sono delle parti dubbie. Perché un simile metodo incerto?""","""Yeah. That's what it implies. .........But it still leaves me wondering a little. Why such an uncertain method?""","""Yeah. That's what it implies. .........But it still leaves me wondering a little. Why such an uncertain method?"""
Mammon,"""Uncertain?"" ","""Uncertain?""","""Uncertain?"" ",「不確実？」,「不確実？」,"""Ненадёжный?""","""Incerto?""","""Uncertain?""",「靠不住？」,「靠不住？」,"""Uncertain?""","""Incerto?""","""Uncertain?""","""Uncertain?"""
Ushiromiya Ange,"""Yes. After all, no one could even guess at how many days it would take for the mail to return before you used this trick. ...Normally, you couldn't even guess at the amount of time it would take for the receiving post office to do their research, determine that the recipient was unknown, and return it."" ","""Yes. After all, you can't even guess in advance at how many days it would take for the mail to return. ......Normally, you can't even guess at the amount of time it will take for the receiving post office to do the research, make a determination of unknown recipient, and send it back.""","""Yes. After all, no one could even guess at how many days it would take for the mail to return before you used this trick. ...Normally, you couldn't even guess at the amount of time it would take for the receiving post office to do their research, determine that the recipient was unknown, and return it."" ",「えぇ。だって、何日で郵便が戻ってくるかなんて、事前には想像もできないじゃない。……郵送先の郵便局が調査し、送付先不明と判断し返送するまでの期間なんて、普通は想像も出来ない。」,「えぇ。だって、何日で郵便が戻ってくるかなんて、事前には想像もできないじゃない。……郵送先の郵便局が調査し、送付先不明と判断し返送するまでの期間なんて、普通は想像も出来ない」,"""Да. Ведь почти невозможно предугадать, сколько дней уйдёт на возвращение почты. Обычно нельзя даже рассчитать, сколько времени у получившего письмо почтового отделения уйдёт на поиски и установление, что получатель неизвестен, после чего письмо возвращают.""","""Sim. Afinal, não tem como você prever quantos dias vai levar para a correspondência retornar. ......Normalmente, você sequer consegue imaginar quanto tempo vai levar para o posto do correio fazer a busca, determinar como destinatário desconhecido, e então enviar de volta.""","""Yes. After all, you can't even guess in advance at how many days it would take for the mail to return. ......Normally, you can't even guess at the amount of time it will take for the receiving post office to do the research, make a determination of unknown recipient, and send it back.""",「嗯。畢竟，事前根本猜不到，郵件會在幾天後退回吧。……到寄送地的郵局進行調查，判斷為郵寄地址不明而退回，此間的時間一般是根本猜不出來的。」,「嗯。毕竟，事前根本猜不到，邮件会在几天后退回吧。……到寄送地的邮局进行调查，判断为邮寄地址不明而退回，此间的时间一般是根本猜不出来的。」,"""Yes. After all, you can't even guess in advance at how many days it would take for the mail to return. ......Normally, you can't even guess at the amount of time it will take for the receiving post office to do the research, make a determination of unknown recipient, and send it back.""","""Sì. Dopotutto, non si poteva essere certi di quanti giorni ci sarebbero voluti perché la posta tornasse. ... Normalmente, non si può nemmeno sapere quanto tempo venga impiegato dal centro posta per cercare, determinare che il destinatario era sconosciuto, e farla tornare.""","""Yes. After all, you can't even guess in advance at how many days it would take for the mail to return. ......Normally, you can't even guess at the amount of time it will take for the receiving post office to do the research, make a determination of unknown recipient, and send it back.""","""Yes. After all, you can't even guess in advance at how many days it would take for the mail to return. ......Normally, you can't even guess at the amount of time it will take for the receiving post office to do the research, make a determination of unknown recipient, and send it back."""
Sakutarou,"‘Yeah, now that you mention it... It'd be more dependable if they just set an arrival date and mailed it that way... Uryu...’ ","‘Yeah, now that you mention it...... It'd be more certain if they just set an arrival date and mailed it that way...... Uryu...’","‘Yeah, now that you mention it... It'd be more dependable if they just set an arrival date and mailed it that way... Uryu...’ ",『そう言えばそうだね……。ちゃんと到着の期日を決めて、そういう郵便で出した方が確実なのにね……。うりゅ…。』,『そう言えばそうだね……。ちゃんと到着の期日を決めて、そういう郵便で出した方が確実なのにね……。うりゅ…』,"{p:0:『}Да, теперь, когда ты упомянула... Было бы гораздо надёжней установить дату прибытия и тогда отправить почту... Урю...{p:0:』}","‘Sim, agora que mencionou...... Seria mais preciso se tivesse determinado uma data de chegada e enviado desta forma...... Uryu...’","‘Yeah, now that you mention it...... It'd be more certain if they just set an arrival date and mailed it that way...... Uryu...’",『說來倒是如此呢……。好好定好送到的日期，這麼寄才確實可靠呢……。嗚溜…』,『说来倒是如此呢……。好好定好送到的日期，这么寄才确实可靠呢……。呜溜…』,"‘Yeah, now that you mention it...... It'd be more certain if they just set an arrival date and mailed it that way...... Uryu...’","{p:0:『}Già, ora che lo fai notare... sarebbe stato più affidabile specificare una data di arrivo e spedirla in quel modo... uryu... {p:0:』}","‘Yeah, now that you mention it...... It'd be more certain if they just set an arrival date and mailed it that way...... Uryu...’","‘Yeah, now that you mention it...... It'd be more certain if they just set an arrival date and mailed it that way...... Uryu...’"
