Captain Kawabata,"""I getcha. It won't be easy to find a boat eager to go to that island. ...By now, there are even some who call it by its old name, Akujikishima, instead of Rokkenjima. It's understandable why the sailors around here would turn down your request."" ","""No need to explain. It'd be no easy job finding a boat willing to go to that island at this point. ......Nowadays, some of 'em don't even call it Rokkenjima any more, they call it by its old name, Akujikijima. Can't see you getting any sailor round here to help you out.""","""I getcha. It won't be easy to find a boat eager to go to that island. ...By now, there are even some who call it by its old name, Akujikishima, instead of Rokkenjima. It's understandable why the sailors around here would turn down your request."" ",「わかってる。今、あの島に行きたがる船なんぞ、簡単には見つからんだろ。……今じゃ六軒島と呼ばず、古い名前の悪食島と呼ぶ者までおる。この辺りの船乗りじゃ、首を縦には振るまいな。」,「わかってる。今、あの島に行きたがる船なんぞ、簡単には見つからんだろ。……今じゃ六軒島と呼ばず、古い名前の悪食島と呼ぶ者までおる。この辺りの船乗りじゃ、首を縦には振るまいな」,"""Я понимаю. Тебе не удастся так легко найти судно, которое с охотой доставит тебя на тот остров. .........Тут ещё остались люди, называющие этот остров старым именем Акуджикишима, вместо Роккенджимы. Поэтому не удивительно, что местные моряки будут качать головой в ответ на твою просьбу.""","""Não precisa explicar. Não vai ser fácil encontrar um barco disposto a ir até aquela ilha. ......Nos dias de hoje, alguns nem chamam mais aquela ilha de Rokkenjima, todos chamam pelo antigo nome, Akujikijima. Não consigo imaginar um marinheiro disposto a ajudar você.""","""No need to explain. It'd be no easy job finding a boat willing to go to that island at this point. ......Nowadays, some of 'em don't even call it Rokkenjima any more, they call it by its old name, Akujikijima. Can't see you getting any sailor round here to help you out.""",「明白。當今肯去那個島的船是沒法輕易找到的吧。……現如今，就連不叫它六軒島，而是以古時候的名字“惡食島”稱呼它的人都有。這一帶的船夫是不會點頭的。」,「明白。当今肯去那个岛的船是没法轻易找到的吧。……现如今，就连不叫它六轩岛，而是以古时候的名字“恶食岛”称呼它的人都有。这一带的船夫是不会点头的。」,"""No need to explain. It'd be no easy job finding a boat willing to go to that island at this point. ......Nowadays, some of 'em don't even call it Rokkenjima any more, they call it by its old name, Akujikijima. Can't see you getting any sailor round here to help you out.""","""Capisco. Non sarò facile trovare una barca disposta ad andare su quell'isola. Di questi tempi, c'è anche chi continua a chiamarla col suo vecchio nome, Akujikishima, invece di Rokkenjima. È comprensibile che i marinai si rifiutino di accompagnarvi.""","""No need to explain. It'd be no easy job finding a boat willing to go to that island at this point. ......Nowadays, some of 'em don't even call it Rokkenjima any more, they call it by its old name, Akujikijima. Can't see you getting any sailor round here to help you out.""","""No need to explain. It'd be no easy job finding a boat willing to go to that island at this point. ......Nowadays, some of 'em don't even call it Rokkenjima any more, they call it by its old name, Akujikijima. Can't see you getting any sailor round here to help you out."""
,"From the start, fishermen had feared Rokkenjima as an island of misfortune. ","Originally, Rokkenjima had been feared as an island of disaster by the fishermen.","From the start, fishermen had feared Rokkenjima as an island of misfortune. ",元々、漁民たちの間では六軒島は不吉の島と恐れられていた。,元々、漁民たちの間では六軒島は不吉の島と恐れられていた。,Изначально Роккенджима внушал рыбакам страх как остров несчастий.,"Originalmente, Rokkenjima era temida pelos pescadores por ser a ilha dos desastres.","Originally, Rokkenjima had been feared as an island of disaster by the fishermen.",原本漁民們之間就認為六軒島是不吉之島，畏懼著六軒島。,原本渔民们之间就认为六轩岛是不吉之岛，畏惧着六轩岛。,"Originally, Rokkenjima had been feared as an island of disaster by the fishermen.","In origine, Rokkenjima era temuta dai pescatori in quanto isola sfortunata.","Originally, Rokkenjima had been feared as an island of disaster by the fishermen.","Originally, Rokkenjima had been feared as an island of disaster by the fishermen."
,"And because of that incident 12 years ago, this fear had reached a peak... ","And when that incident happened twelve years ago, that fear reached its peak......","And because of that incident 12 years ago, this fear had reached a peak... ",そして、１２年前のあの事件で、それは頂点に達した……。,そして、１２年前のあの事件で、それは頂点に達した……。,"А из‐за того инцидента 12 лет назад, этот страх достиг своего пика...","E quando aconteceu o incidente doze anos atrás, o medo chegou ao pico......","And when that incident happened twelve years ago, that fear reached its peak......",然後，因十二年前的那起事件，畏懼到達了頂點……。,然后，因十二年前的那起事件，畏惧到达了顶点……。,"And when that incident happened twelve years ago, that fear reached its peak......","E a causa dell'incidente di 12 anni fa, quella paura si è fatta ancora più grande...","And when that incident happened twelve years ago, that fear reached its peak......","And when that incident happened twelve years ago, that fear reached its peak......"
,"They respected the sea, feared it, and revered it. There were almost no sailors who would try to take a boat to the cursed island. ","They respected the sea, feared it, and revered it. There were almost no sailors who would try to take a boat to the cursed island.","They respected the sea, feared it, and revered it. There were almost no sailors who would try to take a boat to the cursed island. ",彼らは海を尊敬し、畏怖し、そして信心深い。呪われた島に船を出そうとする船乗りはほとんどいなかった。,彼らは海を尊敬し、畏怖し、そして信心深い。呪われた島に船を出そうとする船乗りはほとんどいなかった。,"Они уважали море, боялись и боготворили его. Не было ни одного моряка, дерзнувшего бы направить лодку к проклятому острову.","Eles respeitavam o mar, temiam o mar, reverenciavam o mar. Quase não há marinheiros que conduziriam um barco até a ilha amaldiçoada","They respected the sea, feared it, and revered it. There were almost no sailors who would try to take a boat to the cursed island.",他們尊敬大海、畏懼大海，並且深具信仰。幾乎沒有肯開船去受詛咒的島的船夫。,他们尊敬大海、畏惧大海，并且深具信仰。几乎没有肯开船去受诅咒的岛的船夫。,"They respected the sea, feared it, and revered it. There were almost no sailors who would try to take a boat to the cursed island.","Essi rispettano il mare, lo temono e lo riveriscono. Non dovrebbe esserci nemmeno un marinaio disposto a guidare una barca fino a quell'isola maledetta.","They respected the sea, feared it, and revered it. There were almost no sailors who would try to take a boat to the cursed island.","They respected the sea, feared it, and revered it. There were almost no sailors who would try to take a boat to the cursed island."
,"Because of that, most of the Witch Hunters were unable to cross over to Rokkenjima... and were limited to taking a trip around the island. ","Because of that, most of the Witch Hunters were unable to cross over to Rokkenjima, and were limited to taking a trip around the island.","Because of that, most of the Witch Hunters were unable to cross over to Rokkenjima... and were limited to taking a trip around the island. ",その為、ウィッチハンターの多くは六軒島へ渡ることが出来ず、せいぜい、島の周りを周遊するのが限界だった。,その為、ウィッチハンターの多くは六軒島へ渡ることが出来ず、せいぜい、島の周りを周遊するのが限界だった。,Из‐за этого большая часть охотников на ведьм не смогла переправиться на Роккенджиму и была вынуждена ограничиться путешествием вокруг острова.,"Por causa disso, a grande maioria dos Witch Hunters nunca foi capaz de chegar em Rokkenjima, e ficavam limitados a fazer viagens no entorno da ilha..","Because of that, most of the Witch Hunters were unable to cross over to Rokkenjima, and were limited to taking a trip around the island.",因此，大多數魔女獵人沒法登上六軒島，充其量只能在島的周邊轉轉圈。,因此，大多数魔女猎人没法登上六轩岛，充其量只能在岛的周边转转圈。,"Because of that, most of the Witch Hunters were unable to cross over to Rokkenjima, and were limited to taking a trip around the island.","Per questo motivo, molti dei cacciatore di streghe non sono stati in grado di raggiungere Rokkenjima, e sono stati costretti ad accontentarsi di un giro intorno all'isola.","Because of that, most of the Witch Hunters were unable to cross over to Rokkenjima, and were limited to taking a trip around the island.","Because of that, most of the Witch Hunters were unable to cross over to Rokkenjima, and were limited to taking a trip around the island."
,"...Ironically, this had caused the sense of mystery surrounding Rokkenjima to increase even more, which had resulted in the propagation of the bizarre witch stories they loved so much... ","......Ironically, this caused the mystique surrounding Rokkenjima to increase even more, and resulted in the proliferation of the bizarre witch stories they loved so much...","...Ironically, this had caused the sense of mystery surrounding Rokkenjima to increase even more, which had resulted in the propagation of the bizarre witch stories they loved so much... ",……皮肉にも、そのせいでますますに六軒島の神秘性が増し、彼らが喜ぶようなおかしな魔女話が増殖する結果となるのだが…。,……皮肉にも、そのせいでますますに六軒島の神秘性が増し、彼らが喜ぶようなおかしな魔女話が増殖する結果となるのだが…。,"По иронии судьбы, это лишь прибавило окружавшей остров таинственности и вылилось в пропагацию так любимых ими историй о ведьмах.","......Ironicamente, isso fez com que o misticismo que cercava Rokkenjima crescesse ainda mais, resultando na proliferação de bizarras histórias sobre bruxas que eles tanto amavam...","......Ironically, this caused the mystique surrounding Rokkenjima to increase even more, and resulted in the proliferation of the bizarre witch stories they loved so much...",……諷刺的是，這越發增添了六軒島的神秘感，結果，又增生了魔女獵人們喜好的可笑的魔女軼聞…。,……讽刺的是，这越发增添了六轩岛的神秘感，结果，又增生了魔女猎人们喜好的可笑的魔女轶闻…。,"......Ironically, this caused the mystique surrounding Rokkenjima to increase even more, and resulted in the proliferation of the bizarre witch stories they loved so much...","... Ironicamente, questo ha contribuito a far crescere ulteriormente il mistero intorno a Rokkenjima, sfociando nella diffusione delle strane storie sulle streghe che amano tanto...","......Ironically, this caused the mystique surrounding Rokkenjima to increase even more, and resulted in the proliferation of the bizarre witch stories they loved so much...","......Ironically, this caused the mystique surrounding Rokkenjima to increase even more, and resulted in the proliferation of the bizarre witch stories they loved so much..."
Ushiromiya Ange,"""......Would you take me in your boat?"" ",""".........Would you take me in your boat?""","""......Would you take me in your boat?"" ",「………船は、出してもらえるでしょうか。」,「………船は、出してもらえるでしょうか」,""".......Вы отвезёте меня на своём катере?""",""".........Você me levaria no seu barco?""",""".........Would you take me in your boat?""",「………那麼，可否請您幫忙開船出海呢？」,「………那么，可否请您帮忙开船出海呢？」,""".........Would you take me in your boat?""","""... Mi dareste un passaggio con la vostra barca?""",""".........Would you take me in your boat?""",""".........Would you take me in your boat?"""
Captain Kawabata,"""Yep. They're supposed to give it back to me just for tomorrow. Though it seems its engine has been in a pretty bad mood lately. I'll knock it into shape!"" ","""Mm. They're sposed to give her back to me just for tomorrow. I hear the engine's been acting up lately, though. We'll crank it up to full throttle!""","""Yep. They're supposed to give it back to me just for tomorrow. Though it seems its engine has been in a pretty bad mood lately. I'll knock it into shape!"" ",「うむ。明日だけ返してもらう約束になっとる。最近はエンジンがだいぶご機嫌斜めらしいがな。かっ飛ばしてやるわい！」,「うむ。明日だけ返してもらう約束になっとる。最近はエンジンがだいぶご機嫌斜めらしいがな。かっ飛ばしてやるわい！」,"""Хм‐м‐м. Мне должны отдать его завтра. Хотя последнее время двигатель пошаливает. Но я приведу его в форму!""","""Mm. Devem entregar ele amanhã. O motor estava mal das pernas recentemente. Mas vou fazer ele voar de novo!""","""Mm. They're sposed to give her back to me just for tomorrow. I hear the engine's been acting up lately, though. We'll crank it up to full throttle!""",「嗯。約好明天把船還給我一天了。最近引擎好像是在鬧情緒啊。那就去痛快地發泄下吧！」,「嗯。约好明天把船还给我一天了。最近引擎好像是在闹情绪啊。那就去痛快地发泄下吧！」,"""Mm. They're sposed to give her back to me just for tomorrow. I hear the engine's been acting up lately, though. We'll crank it up to full throttle!""","""Hmm. Dovrebbero rendermela solo per domani. Anche se sembra che il motore faccia le bizze ultimamente. Vedrò di farlo funzionare!""","""Mm. They're sposed to give her back to me just for tomorrow. I hear the engine's been acting up lately, though. We'll crank it up to full throttle!""","""Mm. They're sposed to give her back to me just for tomorrow. I hear the engine's been acting up lately, though. We'll crank it up to full throttle!"""
,"The former boat captain promised that tomorrow, he would go back to his previous job and take his boat out to Rokkenjima. ","The former boat captain promised that tomorrow, he would go back to his previous job and take his boat out to Rokkenjima.","The former boat captain promised that tomorrow, he would go back to his previous job and take his boat out to Rokkenjima. ",元船長は、明日、前職に復帰し、六軒島まで船を出してくれることを約束してくれた。,元船長は、明日、前職に復帰し、六軒島まで船を出してくれることを約束してくれた。,"Бывший капитан палубного катера пообещал, что завтра он возобновит свою предыдущую работу и отвезёт меня на своём катере на Роккенджиму.","O ex‐capitão prometeu que amanhã, ele retomaria seu antigo trabalho e velejaria seu barco até Rokkenjima.","The former boat captain promised that tomorrow, he would go back to his previous job and take his boat out to Rokkenjima.",原船長許諾了，在明天撿起老本行，開船出海去六軒島。,原船长许诺了，在明天捡起老本行，开船出海去六轩岛。,"The former boat captain promised that tomorrow, he would go back to his previous job and take his boat out to Rokkenjima.",L'ex capitano della nave ci promise che domani sarebbe tornato al suo vecchio lavoro conducendo la sua barca fino a Rokkenjima.,"The former boat captain promised that tomorrow, he would go back to his previous job and take his boat out to Rokkenjima.","The former boat captain promised that tomorrow, he would go back to his previous job and take his boat out to Rokkenjima."
,"Now, my method of transport to Rokkenjima is ensured. This is probably all I can do on Niijima. ","With this, I'd managed to secure a method of transport to Rokkenjima.{n}This is probably all I can do on Niijima.","Now, my method of transport to Rokkenjima is ensured. This is probably all I can do on Niijima. ",これで、六軒島への渡航手段は確保できた。新島で出来ることは、これで全てだろう。,これで、六軒島への渡航手段は確保できた。{n}新島で出来ることは、これで全てだろう。,"Таким образом, поездка на Роккенджиму мне обеспечена.{n}Это всё, что я могу сделать на Нииджиме.","Com isto, eu consegui um método de transporte seguro até Rokkenjima.{n}Provavelmente isso é tudo o que eu posso fazer em Niijima.","With this, I'd managed to secure a method of transport to Rokkenjima.{n}This is probably all I can do on Niijima.",這下，前往六軒島的航海手段得到了保證。{n}在新島所能做的事，就此全都做完了吧。,这下，前往六轩岛的航海手段得到了保证。{n}在新岛所能做的事，就此全都做完了吧。,"With this, I'd managed to secure a method of transport to Rokkenjima.{n}This is probably all I can do on Niijima.","In questo modo, mi sono assicurata un passaggio. Probabilmente è tutto ciò che posso fare a Niijima.","With this, I'd managed to secure a method of transport to Rokkenjima.{n}This is probably all I can do on Niijima.","With this, I'd managed to secure a method of transport to Rokkenjima.{n}This is probably all I can do on Niijima."
,"All that's left...is tomorrow. On Rokkenjima, ...I'll reach the final destination of a journey that stretches back 12 years. ","All that's left is...tomorrow. On Rokkenjima, ......I'll reach the final destination of a journey that stretches back twelve years.","All that's left...is tomorrow. On Rokkenjima, ...I'll reach the final destination of a journey that stretches back 12 years. ",あとは、明日。六軒島で、……１２年前に遡る旅は、終点を迎える。,あとは、明日。六軒島で、……１２年前に遡る旅は、終点を迎える。,"Остался только завтрашний день. На Роккенджиме... я достигну конечной точки моего путешествия, затянувшегося на 12 лет.","Tudo que resta é...o amanhã. Em Rokkenjima, ......eu irei alcançar o destino final desta jornada que teve início doze anos atrás.","All that's left is...tomorrow. On Rokkenjima, ......I'll reach the final destination of a journey that stretches back twelve years.",接下來，就是明天。在六軒島，……迎來追溯十二年前之旅的終點。,接下来，就是明天。在六轩岛，……迎来追溯十二年前之旅的终点。,"All that's left is...tomorrow. On Rokkenjima, ......I'll reach the final destination of a journey that stretches back twelve years.",Tutto ciò che rimane da fare è... aspettare domani. A Rokkenjima... raggiungerò la meta di un viaggio iniziato 12 anni fa.,"All that's left is...tomorrow. On Rokkenjima, ......I'll reach the final destination of a journey that stretches back twelve years.","All that's left is...tomorrow. On Rokkenjima, ......I'll reach the final destination of a journey that stretches back twelve years."
Sakutarou,"‘Isn't that great...? This way, it looks like you'll be able to go to the island...’ ",‘That's great news... You'll be able to go to the island now...’,"‘Isn't that great...? This way, it looks like you'll be able to go to the island...’ ",『よかったね…。これで島へ行けるようになったね…。』,『よかったね…。これで島へ行けるようになったね…』,{p:0:『}Разве не замечательно? Теперь ты сможешь добраться до острова.{p:0:』},‘Isso é ótimo... Agora vai conseguir ir até a ilha...’,‘That's great news... You'll be able to go to the island now...’,『太好了…。這下，就能去那個島了呢…』,『太好了…。这下，就能去那个岛了呢…』,‘That's great news... You'll be able to go to the island now...’,{p:0:『}Non è fantastico...? In questo modo potresti tornare sull'isola... {p:0:』},‘That's great news... You'll be able to go to the island now...’,‘That's great news... You'll be able to go to the island now...’
Ushiromiya Ange,"""It sure does. ...I'd heard that it would be hard to find a boat, so the boat captain's helpfulness really saved me."" ","""Yes. ......I'd heard that it would be hard to find a boat, so the boat captain's cooperation really helped me out.""","""It sure does. ...I'd heard that it would be hard to find a boat, so the boat captain's helpfulness really saved me."" ",「そうね。……船を見つけるのは難しいと聞いていたから、船長が協力的で助かったわ。」,「そうね。……船を見つけるのは難しいと聞いていたから、船長が協力的で助かったわ」,"""И не говори. .....Я слышала, что будет не просто найти судно, так что этот капитан меня здорово выручил.""","""Sim. ......Eu ouvi que seria difícil conseguir um barco, mas a cooperação do capitão realmente foi de grande ajuda.""","""Yes. ......I'd heard that it would be hard to find a boat, so the boat captain's cooperation really helped me out.""",「是呢。……因為聽說了船很難找，所以船長樂意協助實在是幫大忙了。」,「是呢。……因为听说了船很难找，所以船长乐意协助实在是帮大忙了。」,"""Yes. ......I'd heard that it would be hard to find a boat, so the boat captain's cooperation really helped me out.""","""Certo. ... Avevo sentito che sarebbe stato difficile trovare una barca, quindi la gentilezza del capitano è stata davvero d'aiuto.""","""Yes. ......I'd heard that it would be hard to find a boat, so the boat captain's cooperation really helped me out.""","""Yes. ......I'd heard that it would be hard to find a boat, so the boat captain's cooperation really helped me out."""
