Speaker,Steam (ST),Umineko Project (UP),Original Witch Hunt (OG),PC Japanese (JP),PS3 Japanese - Censored (JPC),Russian (RU),Brazilian Portuguese (PT),Vietnamese (VI),Chinese Traditional (CHT),Chinese Simplified (CN),Indonesian (IDN),Italian (Ars Magica) (Old) (ITA),Italian (Majotachi no Sub) (New) (IT),Turkish (TR)
Ushiromiya Jessica,"""......A test...?"" ",""".........A test......?""","""......A test...?"" ",「………テストって……？」,「………テストって……？」,"""..............Испытание?""",""".........Um teste......?""",""".........A test......?""",「………考試……？」,「………考试……？」,""".........A test......?""","""... Un test...?""",""".........A test......?""",""".........A test......?"""
Ushiromiya Krauss,"""...Y-Yes. Listen well..."" ","""......M‐mm. Listen well...""","""...Y-Yes. Listen well..."" ",「……う、うむ。よく聞きなさい……。」,「……う、うむ。よく聞きなさい……」,"""......Д‐да. Слушайте внимательно.""","""......M‐Mmm. Ouçam bem...""","""......M‐mm. Listen well...""",「……嗯、嗯。仔細聽好了……」,「……嗯、嗯。仔细听好了……」,"""......M‐mm. Listen well...""","""... S-Sì. Ascolta bene...""","""......M‐mm. Listen well...""","""......M‐mm. Listen well..."""
,"Once again, there was a call from Krauss to the guesthouse. ","Once again, there was a call from Krauss to the guesthouse.","Once again, there was a call from Krauss to the guesthouse. ",  再びゲストハウスに蔵臼たちから電話が掛かってきた。,再びゲストハウスに蔵臼たちから電話が掛かってきた。,Краусс вновь позвонил в домик для гостей.,"Mais uma vez, houve outra ligação de Krauss para a casa de hóspedes.","Once again, there was a call from Krauss to the guesthouse.",待在賓館的眾人再次接到了藏臼等人打來的電話。,待在宾馆的众人再次接到了藏臼等人打来的电话。,"Once again, there was a call from Krauss to the guesthouse.","Ancora una volta, ci fu una chiamata di Krauss alla casa degli ospiti.","Once again, there was a call from Krauss to the guesthouse.","Once again, there was a call from Krauss to the guesthouse."
,...And the message was...that Kinzo wanted to hold a test to see if the grandchildren had the qualifications to become his successor. ,......And the message was......that Kinzo wanted to hold a test to see if the grandchildren had the qualifications to be the next head.,...And the message was...that Kinzo wanted to hold a test to see if the grandchildren had the qualifications to become his successor. ,  ……そして告げられたのは、……金蔵が孫たちに、次期当主の資格を問うテストを行ないたい、とするものだった。,……そして告げられたのは、……金蔵が孫たちに、次期当主の資格を問うテストを行ないたい、とするものだった。,"......И рассказал, что Кинзо хотел испытать своих внуков на право получения звания следующего главы семьи.",......E a mensagem era......de que Kinzo queria fazer um teste para ver se os netos eram qualificados para serem o novo chefe.,......And the message was......that Kinzo wanted to hold a test to see if the grandchildren had the qualifications to be the next head.,……而他們被告知的是，……金藏想對孫兒們來一場，測試下任當主資格的考試。,……而他们被告知的是，……金藏想对孙儿们来一场，测试下任当主资格的考试。,......And the message was......that Kinzo wanted to hold a test to see if the grandchildren had the qualifications to be the next head.,... E il messaggio era... che Kinzo voleva tenere un test per vedere se i nipoti avessero le qualifiche per essere il prossimo capofamiglia.,......And the message was......that Kinzo wanted to hold a test to see if the grandchildren had the qualifications to be the next head.,......And the message was......that Kinzo wanted to hold a test to see if the grandchildren had the qualifications to be the next head.
Ushiromiya Krauss,"""......The Head has said that his successor will not be one of us siblings... That he wants...to pick from among his grandchildren..."" ",""".........The head has said that his successor will not be one of us siblings, that he wants to......pick from you grandchildren...""","""......The Head has said that his successor will not be one of us siblings... That he wants...to pick from among his grandchildren..."" ",「………当主様は次期当主を、お父さんたちの兄弟からではなく、孫たちの中から選びたいと、そう、……仰っている…。」,「………当主様は次期当主を、お父さんたちの兄弟からではなく、孫たちの中から選びたいと、そう、……仰っている…」,""".........Глава сказал, что его наследником не станет кто‐то из его детей... Он решил... выбирать из внуков...""",""".........O chefe da família disse que seu sucessor não seria nenhum de nós, irmãos, por isso ele quer......escolher um dos netos...""",""".........The head has said that his successor will not be one of us siblings, that he wants to......pick from you grandchildren...""",「………當主大人說了，下任當主，不在爸爸几兄妹中選，而是，要在孫兒中，……選出…」,「………当主大人说了，下任当主，不在爸爸几兄妹中选，而是，要在孙儿中，……选出…」,""".........The head has said that his successor will not be one of us siblings, that he wants to......pick from you grandchildren...""","""... Il capofamiglia ha detto che il prossimo non sarà uno dei miei fratelli... che lui vuole... scegliere fra i nipoti...""",""".........The head has said that his successor will not be one of us siblings, that he wants to......pick from you grandchildren...""",""".........The head has said that his successor will not be one of us siblings, that he wants to......pick from you grandchildren..."""
,"From Krauss's restrained style of speech, Jessica realized as his daughter that he was being forced to speak. ","From Krauss's restrained style of speech, Jessica realized as his daughter that he was being forced to speak.","From Krauss's restrained style of speech, Jessica realized as his daughter that he was being forced to speak. ",  蔵臼の抑圧されたしゃべり方から、娘である朱志香は、そう話すよう強要されていることを理解する。,蔵臼の抑圧されたしゃべり方から、娘である朱志香は、そう話すよう強要されていることを理解する。,"Судя по сдержанному голосу Краусса, Джессика, как его дочь, поняла, что он был вынужден это говорить.","Pela forma contida de falar de Krauss, Jessica, sendo sua filha, percebeu que ele estava sendo forçado a falar.","From Krauss's restrained style of speech, Jessica realized as his daughter that he was being forced to speak.",藏臼那不順暢的語調，令身為其女的朱志香明白了，他是在被人強迫著這麼說。,藏臼那不顺畅的语调，令身为其女的朱志香明白了，他是在被人强迫着这么说。,"From Krauss's restrained style of speech, Jessica realized as his daughter that he was being forced to speak.","Dal modo di parlare trattenuto di Krauss, Jessica da figlia qual era capì che era stato obbligato a parlare.","From Krauss's restrained style of speech, Jessica realized as his daughter that he was being forced to speak.","From Krauss's restrained style of speech, Jessica realized as his daughter that he was being forced to speak."
,"And she was forced to realize that the hostages were being exposed to danger even now, and that if they refused this test, there was a possibility that the hostages would be harmed. ","And she was forced into the realization that the hostages were being exposed to danger even now, and that if they refused this test, there was a possibility that the hostages would be harmed.","And she was forced to realize that the hostages were being exposed to danger even now, and that if they refused this test, there was a possibility that the hostages would be harmed. ",そして、父親たち人質は今も危険に晒されていて、テストとやらを断れば、人質に危害が加えられる可能性があることまでも理解せざるを得なかった。,そして、父親たち人質は今も危険に晒されていて、テストとやらを断れば、人質に危害が加えられる可能性があることまでも理解せざるを得なかった。,"И ей пришлось осознать, что заложники даже теперь находились в опасности, так что в случае отказа им вполне могли причинить вред.","E isso a fez perceber que os reféns estavam sendo expostos a algum tipo perigo, e que se eles recusassem o teste, havia a possibilidade de que os reféns fossem feridos.","And she was forced into the realization that the hostages were being exposed to danger even now, and that if they refused this test, there was a possibility that the hostages would be harmed.",並且，關於父親等人質此時此刻正處於危險之中，若是拒絕參加考試，敵方就有可能加害人質的這一點，也是不得不心知肚明。,并且，关于父亲等人质此时此刻正处于危险之中，若是拒绝参加考试，敌方就有可能加害人质的这一点，也是不得不心知肚明。,"And she was forced into the realization that the hostages were being exposed to danger even now, and that if they refused this test, there was a possibility that the hostages would be harmed.","E fu obbligata a capire che gli ostaggi erano esposti al pericolo anche ora, e che se loro avessero rifiutato questo test, c'era la possibilità che agli ostaggi venisse fatto del male.","And she was forced into the realization that the hostages were being exposed to danger even now, and that if they refused this test, there was a possibility that the hostages would be harmed.","And she was forced into the realization that the hostages were being exposed to danger even now, and that if they refused this test, there was a possibility that the hostages would be harmed."
Ushiromiya Jessica,"""Th-Then, ......what should we do?"" ","""S‐......so......what should we do?""","""Th-Then, ......what should we do?"" ",「そ、……それで……。私たちは、どうすればいいの。」,「そ、……それで……。私たちは、どうすればいいの」,"""Т‐тогда... что же нам делать?""","""E‐......Então......o que devemos fazer?""","""S‐......so......what should we do?""",「那、……那麼……。我們，該怎麼做呢？」,「那、……那么……。我们，该怎么做呢？」,"""S‐......so......what should we do?""","""A... Allora... cosa dovremmo fare?""","""S‐......so......what should we do?""","""S‐......so......what should we do?"""
Ushiromiya Krauss,"""...I-Indeed. Hold on..."" ","""......M‐...mm. Hold on...""","""...I-Indeed. Hold on..."" ",「……う、…うむ。待て…。」,「……う、…うむ。待て…」,"""......Хм‐м‐м. Секунду...""","""......M‐...mm. Espere...""","""......M‐...mm. Hold on...""",「……嗯、…嗯。等下…」,「……嗯、…嗯。等下…」,"""......M‐...mm. Hold on...""","""... Hm... hmm. Aspetta...""","""......M‐...mm. Hold on...""","""......M‐...mm. Hold on..."""
,"Krauss put down the receiver, then looked at the grinning Kinzo on the other side of the bars. ","Krauss held the receiver away from his ear, then looked at the grinning Kinzo on the other side of the bars.","Krauss put down the receiver, then looked at the grinning Kinzo on the other side of the bars. ",  蔵臼は受話器を離し、鉄格子の向こうでにやにやと見ている金蔵を見る。,蔵臼は受話器を離し、鉄格子の向こうでにやにやと見ている金蔵を見る。,"Положив трубку, Краусс взглянул на ухмылявшегося Кинзо, стоящего по другую сторону решетки.","Krauss afastou o receptor do telefone de seu ouvido, então olhou para Kinzo, que estava do outro lado daquela grade, sorrindo ironicamente.","Krauss held the receiver away from his ear, then looked at the grinning Kinzo on the other side of the bars.",藏臼拿開話筒，朝在鐵窗另一邊笑嘻嘻地看著的金藏望去。,藏臼拿开话筒，朝在铁窗另一边笑嘻嘻地看着的金藏望去。,"Krauss held the receiver away from his ear, then looked at the grinning Kinzo on the other side of the bars.","Krauss abbassò il ricevitore, poi guardò il Kinzo ghignante dall'altra parte delle sbarre.","Krauss held the receiver away from his ear, then looked at the grinning Kinzo on the other side of the bars.","Krauss held the receiver away from his ear, then looked at the grinning Kinzo on the other side of the bars."
,Kinzo gave his next order. ,Kinzo gave his next order.,Kinzo gave his next order. ,  そして金蔵は次なる連絡を命じた。,そして金蔵は次なる連絡を命じた。,Кинзо отдал следующий приказ.,Kinzo deu a próxima ordem.,Kinzo gave his next order.,然後，金藏對接下來所要傳達的內容，下達了指示。,然后，金藏对接下来所要传达的内容，下达了指示。,Kinzo gave his next order.,Kinzo diede il suo prossimo ordine.,Kinzo gave his next order.,Kinzo gave his next order.
Ushiromiya Kinzo,"""Before the test, those not involved must be removed. ......Gohda and Kumasawa are there, I believe? It will be a problem if they interfere with the test. Banish them from the guesthouse."" ","""Before the test, those unrelated must be removed. .........Gohda and Kumasawa are there, I believe? It will be a problem if they interfere with the test. Banish them from the guesthouse.""","""Before the test, those not involved must be removed. ......Gohda and Kumasawa are there, I believe? It will be a problem if they interfere with the test. Banish them from the guesthouse."" ",「テストの前に、無関係な者を排除しなくてはならない。………郷田と熊沢がそこにいるのであろう？　テストに干渉されては邪魔なのでな。彼らをゲストハウスより追放せよ。」,「テストの前に、無関係な者を排除しなくてはならない。………郷田と熊沢がそこにいるのであろう？　テストに干渉されては邪魔なのでな。彼らをゲストハウスより追放せよ」,"""Перед испытанием посторонние лица должны уйти. ..........Года и Кумасава находятся там, надо полагать? Они могут доставить неприятностей, если станут мешать испытанию. Прогоните их из гостевого домика.""","""Antes do teste, todos aqueles sem relação devem ser removidos. .........Gohda e Kumasawa estão aí, eu presumo? Seria um problema se eles interferissem no teste. Bana‐os da casa de hóspedes.""","""Before the test, those unrelated must be removed. .........Gohda and Kumasawa are there, I believe? It will be a problem if they interfere with the test. Banish them from the guesthouse.""",「在考試前，必須先排除無關人等。………鄉田與熊澤都在那吧？要是干涉到考試，那就礙事了。把他們逐出賓館。」,「在考试前，必须先排除无关人等。………乡田与熊泽都在那吧？要是干涉到考试，那就碍事了。把他们逐出宾馆。」,"""Before the test, those unrelated must be removed. .........Gohda and Kumasawa are there, I believe? It will be a problem if they interfere with the test. Banish them from the guesthouse.""","""Prima del test, coloro che non hanno niente a che fare devono essere rimossi. Gohda e Kumasawa sono lì, credo? Sarà un problema se loro intralciano il test. Falli allontanare dalla casa degli ospiti.""","""Before the test, those unrelated must be removed. .........Gohda and Kumasawa are there, I believe? It will be a problem if they interfere with the test. Banish them from the guesthouse.""","""Before the test, those unrelated must be removed. .........Gohda and Kumasawa are there, I believe? It will be a problem if they interfere with the test. Banish them from the guesthouse."""
Ushiromiya Krauss,"""......Banish, ...you say...?"" ",""".........Banish, ...you say......?""","""......Banish, ...you say...?"" ",「………追放、…ですか……。」,「………追放、…ですか……」,""".........Прогнать... говоришь?""",""".........Você disse ...banir......?""",""".........Banish, ...you say......?""",「………逐出，…他們……？」,「………逐出，…他们……？」,""".........Banish, ...you say......?""","""... Farli allontanare... hai detto...?""",""".........Banish, ...you say......?""",""".........Banish, ...you say......?"""
Ushiromiya Kinzo,"""There should be a gardening storehouse in the rose garden. Lock Gohda and Kumasawa in there. Hmm, we'll begin from there. Tell them to do it immediately. ","""There should be a gardening storehouse in the rose garden. Lock Gohda and Kumasawa in there. Hmm, we'll begin from there. Tell them to do it immediately.""","""There should be a gardening storehouse in the rose garden. Lock Gohda and Kumasawa in there. Hmm, we'll begin from there. Tell them to do it immediately. ",「薔薇庭園に園芸倉庫があったはず。そこへ郷田と熊沢を閉じ込めて施錠せよ。ふむ、まずはそれからだ。直ちに遂行するように伝えよ。,「薔薇庭園に園芸倉庫があったはず。そこへ郷田と熊沢を閉じ込めて施錠せよ。ふむ、まずはそれからだ。直ちに遂行するように伝えよ」,"""В розарии должен быть склад для садового инвентаря. Заприте их там. Хм‐м‐м, пожалуй, начнём с этого. Скажи им, чтобы они немедля это сделали.""","""Deve haver um depósito de jardinagem no jardim de rosas. Tranquem Gohda e Kumasawa lá. Hmm, vamos começar com isto. Informe‐os sobre isso imediatamente.""","""There should be a gardening storehouse in the rose garden. Lock Gohda and Kumasawa in there. Hmm, we'll begin from there. Tell them to do it immediately.""",「玫瑰庭園裡，應該有個園藝倉庫。把鄉田與熊澤關到倉庫裡，上好鎖。哼，先從這事開始。立刻去叫他們照辦。」,「玫瑰庭园里，应该有个园艺仓库。把乡田与熊泽关到仓库里，上好锁。哼，先从这事开始。立刻去叫他们照办。」,"""There should be a gardening storehouse in the rose garden. Lock Gohda and Kumasawa in there. Hmm, we'll begin from there. Tell them to do it immediately.""","""Ci dovrebbe essere un capanno per gli attrezzi da giardino nel roseto. {n}Chiudi Gohda e Kumasawa lì dentro. Hmm, inizieremo da lì. Dì loro di farlo immediatamente.","""There should be a gardening storehouse in the rose garden. Lock Gohda and Kumasawa in there. Hmm, we'll begin from there. Tell them to do it immediately.""","""There should be a gardening storehouse in the rose garden. Lock Gohda and Kumasawa in there. Hmm, we'll begin from there. Tell them to do it immediately."""
Ushiromiya Kinzo,"......My weapons will be watching. If they happen to do anything questionable, I'll instantly stop the test and execute all of you as sacrifices!"" ",""".........My weapons will be watching. Should they do anything questionable, I'll instantly stop the test and execute all of you as sacrifices!""","......My weapons will be watching. If they happen to do anything questionable, I'll instantly stop the test and execute all of you as sacrifices!"" ",………我が武具たちが監視する。疑わしい行為に及べば、テストは直ちに中止し、お前たち全てを生贄として処刑する！」,「………我が武具たちが監視する。疑わしい行為に及べば、テストは直ちに中止し、お前たち全てを生贄として処刑する！」,""".........Мои орудия проследят за выполнением. Если случится что‐либо сомнительное, то я прекращу испытания и всех вас превращу в жертв!""",""".........Minhas armas estarão observando. Caso eles façam algo questionável, irei parar o teste e executarei todos vocês como sacrifícios!""",""".........My weapons will be watching. Should they do anything questionable, I'll instantly stop the test and execute all of you as sacrifices!""",「………吾之武具們會進行監視。若有可疑之舉，即刻中止考試，將你們所有人處刑獻祭！」,「………吾之武具们会进行监视。若有可疑之举，即刻中止考试，将你们所有人处刑献祭！」,""".........My weapons will be watching. Should they do anything questionable, I'll instantly stop the test and execute all of you as sacrifices!""","... Le mie armi staranno guardando. Se succederà qualcosa di sospetto, fermerò immediatamente il test e vi giustizierò tutti come sacrifici!""",""".........My weapons will be watching. Should they do anything questionable, I'll instantly stop the test and execute all of you as sacrifices!""",""".........My weapons will be watching. Should they do anything questionable, I'll instantly stop the test and execute all of you as sacrifices!"""
Ushiromiya Krauss,"""...I-I understand... ...Hello, Jessica...? Listen closely to what I say..."" ","""......I, ......I understand...... ......Hello, Jessica... Listen closely to what I'm going to tell you......""","""...I-I understand... ...Hello, Jessica...? Listen closely to what I say..."" ",「……わ、……わかりました……。……もしもし朱志香…。今から父さんの言うことをよく聞きなさい……。」,「……わ、……わかりました……。……もしもし朱志香…。今から父さんの言うことをよく聞きなさい……」,"""......П‐понятно... ......Алло, Джессика... Слушай внимательно...""","""......Eu, ......eu entendi...... ......Alô, Jessica... Ouça atentamente o que seu pai irá dizer a você......""","""......I, ......I understand...... ......Hello, Jessica... Listen closely to what I'm going to tell you......""",「……明、……明白了……。……喂喂朱志香…。仔細聽好，爸爸接下來所說的話……」,「……明、……明白了……。……喂喂朱志香…。仔细听好，爸爸接下来所说的话……」,"""......I, ......I understand...... ......Hello, Jessica... Listen closely to what I'm going to tell you......""","""... Ho... ho capito... pronto, Jessica... ascolta attentamente ciò che ti dico...""","""......I, ......I understand...... ......Hello, Jessica... Listen closely to what I'm going to tell you......""","""......I, ......I understand...... ......Hello, Jessica... Listen closely to what I'm going to tell you......"""
,Krauss relayed the orders to lock up Gohda and Kumasawa... ,Krauss relayed to Jessica the orders to lock up Gohda and Kumasawa......,Krauss relayed the orders to lock up Gohda and Kumasawa... ,蔵臼は朱志香に、郷田と熊沢を閉じ込めるようにとの指示を伝える……。,蔵臼は朱志香に、郷田と熊沢を閉じ込めるようにとの指示を伝える……。,Краусс передал приказал Годе и Кумасаве запереться в сарае...,Krauss repassou para Jessica a ordem para prender Gohda e Kumasawa......,Krauss relayed to Jessica the orders to lock up Gohda and Kumasawa......,藏臼向朱志香傳達了，去把鄉田與熊澤關起來的指示……。,藏臼向朱志香传达了，去把乡田与熊泽关起来的指示……。,Krauss relayed to Jessica the orders to lock up Gohda and Kumasawa......,Krauss trasmise gli ordini di rinchiudere Gohda e Kumasawa...,Krauss relayed to Jessica the orders to lock up Gohda and Kumasawa......,Krauss relayed to Jessica the orders to lock up Gohda and Kumasawa......
Ushiromiya Kyrie,"""...What kind of test are you planning?"" ","""......What kind of test are you planning?""","""...What kind of test are you planning?"" ",「……どんなテストを、なさるつもりですか。」,「……どんなテストを、なさるつもりですか」,"""......Что за за испытание ты задумал?""","""......Que tipo de teste você está planejando?""","""......What kind of test are you planning?""",「……您是打算，進行一場怎樣的考試呢？」,「……您是打算，进行一场怎样的考试呢？」,"""......What kind of test are you planning?""","""... Che tipo di test stai architettando?""","""......What kind of test are you planning?""","""......What kind of test are you planning?"""
