,The man who kept yelling about preserving the secrecy of the base is lying there dead.,The man who kept yelling about preserving the secrecy of the base is lying there dead. , The man who kept yelling about preserving the secrecy of the base is lying there dead.,秘密基地だから外部との交流を禁ずる云々を叫ぶ当の本人は、もうそこで息絶えている。,秘密基地だから外部との交流を禁ずる云々を叫ぶ当の本人は、もうそこで息絶えている。,"Тот, кто вопил о сохранении секретности базы, мёртв.",O homem que resmungava sobre preservar o sigilo da base estava morto.,The man who kept yelling about preserving the secrecy of the base is lying there dead.,叫囂著“這裡是秘密基地，所以禁止與外界往來”等等的本人，現已在那斷了氣。,叫嚣着“这里是秘密基地，所以禁止与外界往来”等等的本人，现已在那断了气。,The man who kept yelling about preserving the secrecy of the base is lying there dead.,The man who kept yelling about preserving the secrecy of the base is lying there dead.,The man who kept yelling about preserving the secrecy of the base is lying there dead.
,"......The next island over, Niijima, is close. A small boat should be able to take us there.","...The next island over, Niijima, is close. A small boat should be more than enough to get us there. ","......The next island over, Niijima, is close. A small boat should be able to take us there.",……隣の新島は近い。小船でも充分に辿り着けるはずだ。,……隣の新島は近い。小船でも充分に辿り着けるはずだ。,"......Соседний остров, Нииджима, совсем рядом. Добраться туда можно даже на лодке.","......A próxima ilha, Niijima, ficava perto. Um barco pequeno seria capaz de nos levar até lá.","......The next island over, Niijima, is close. A small boat should be able to take us there.",……鄰島新島離這很近。哪怕是小船，也足以順利抵達。,……邻岛新岛离这很近。哪怕是小船，也足以顺利抵达。,"......The next island over, Niijima, is close. A small boat should be able to take us there.","......The next island over, Niijima, is close. A small boat should be able to take us there.","......The next island over, Niijima, is close. A small boat should be able to take us there."
Ushiromiya Kinzo,"""<I need to take you to a hospital. ......The wound might be more serious than you realize.>""","""<I need to take you to a hospital. ...The wound might be more serious than you realize.>"" ","""<I need to take you to a hospital. ......The wound might be more serious than you realize.>""",『君を病院へ運ばなければならない。……君が思っているより、傷が深かったらいけない。』,『君を病院へ運ばなければならない。……君が思っているより、傷が深かったらいけない』,"""<Мне нужно отвезти тебя в больницу. ......Рана может быть серьёзнее, чем ты думаешь.>""","""‹Eu preciso levá‐la a um hospital. ......Esse ferimento pode ser mais sério do que imagina.›""","""<I need to take you to a hospital. ......The wound might be more serious than you realize.>""",『必須將你送去醫院。……傷要是比你想的更嚴重，那就不妙了。』,『必须将你送去医院。……伤要是比你想的更严重，那就不妙了。』,"""<I need to take you to a hospital. ......The wound might be more serious than you realize.>""","""<I need to take you to a hospital. ......The wound might be more serious than you realize.>""","""<I need to take you to a hospital. ......The wound might be more serious than you realize.>"""
Beatrice,"""<......That's interesting. Never knew there was a hospital on this island.>""","""<...That's interesting. I never knew there was a hospital on this island.>"" ","""<......That's interesting. Never knew there was a hospital on this island.>""",『……知らなかった。この島には病院もあるのね。』,『……知らなかった。この島には病院もあるのね』,"""<......Надо же. Не знала, что на этом острове есть больница.>""","""‹......Interessante. Não sabia que tinha um hospital nessa ilha.›""","""<......That's interesting. Never knew there was a hospital on this island.>""",『……我都不知道哦。這個島，還有醫院嗎？』,『……我都不知道哦。这个岛，还有医院吗？』,"""<......That's interesting. Never knew there was a hospital on this island.>""","""<......That's interesting. Never knew there was a hospital on this island.>""","""<......That's interesting. Never knew there was a hospital on this island.>"""
Ushiromiya Kinzo,"""<There isn't. I'll use a boat to take you to the next island. ......I'll take you to a hospital, but I need to return here and clean up the mess on this island, ......or it'll mean a court‐martial.>""","""<There isn't. A boat should get us to the next island over. ...We'll get you to a hospital. As for me, ...unless I cleverly cover up what happened on this island, ...I might end up getting court-martialed just for being here.>"" ","""<There isn't. I'll use a boat to take you to the next island. ......To a hospital. If we don't clean up the mess on this island, ......it'll mean a court-martial.>""",『ない。隣の島へ船で運ぶ。……君は病院へ。私は、この島での出来事をうまく片付けないと、……とばっちりで軍法会議ものだ。』,『ない。隣の島へ船で運ぶ。……君は病院へ。私は、この島での出来事をうまく片付けないと、……とばっちりで軍法会議ものだ』,"""<Не здесь. Я на лодке переправлю тебя на соседний остров. ......В больницу. Если не навести на этом острове порядок...... будет военный трибунал.>""","""‹Não tem. Vou usar um barco e levá‐la para a próxima ilha. ......Vou levá‐la a um hospital, mas eu preciso voltar aqui e limpar a bagunça nessa ilha, ......ou vai acabar na corte marcial.›""","""<There isn't. I'll use a boat to take you to the next island. ......I'll take you to a hospital, but I need to return here and clean up the mess on this island, ......or it'll mean a court‐martial.>""",『沒有。用船把你送去鄰島。……你去醫院。而我，若不去妥善處理好這島上發生的事，……就會受到牽連，上軍事法庭。』,『没有。用船把你送去邻岛。……你去医院。而我，若不去妥善处理好这岛上发生的事，……就会受到牵连，上军事法庭。』,"""<There isn't. I'll use a boat to take you to the next island. ......I'll take you to a hospital, but I need to return here and clean up the mess on this island, ......or it'll mean a court‐martial.>""","""<There isn't. I'll use a boat to take you to the next island. ......I'll take you to a hospital, but I need to return here and clean up the mess on this island, ......or it'll mean a court‐martial.>""","""<There isn't. I'll use a boat to take you to the next island. ......I'll take you to a hospital, but I need to return here and clean up the mess on this island, ......or it'll mean a court‐martial.>"""
Beatrice,"""<I have a request. ......Please, don't take me to a hospital.>""","""<I have a request. ...Please, don't take me to a hospital.>"" ","""<I have a request. ......Please, don't take me to a hospital.>""",『頼みがあるの。……私を病院へ、連れて行かないで。』,『頼みがあるの。……私を病院へ、連れて行かないで』,"""<У меня есть просьба. ......Не отвози меня в больницу.>""","""‹Eu tenho um pedido. ......Por favor, não me leve para um hospital.›""","""<I have a request. ......Please, don't take me to a hospital.>""",『我有個請求。……請別把我，送去醫院。』,『我有个请求。……请别把我，送去医院。』,"""<I have a request. ......Please, don't take me to a hospital.>""","""<I have a request. ......Please, don't take me to a hospital.>""","""<I have a request. ......Please, don't take me to a hospital.>"""
Ushiromiya Kinzo,"""<Why...?>""","""<Why...?>"" ","""<Why...?>""",『どうして…。』,『どうして…』,"""<Почему?..>""","""‹Por quê...?›""","""<Why...?>""",『為什麼…？』,『为什么…？』,"""<Why...?>""","""<Why...?>""","""<Why...?>"""
Beatrice,"""<If we go to a hospital and the embassy is contacted, I'll eventually be sent back to Italy. ......If that happens, I'll be interrogated about all kinds of things. I won't acknowledge those people, who let Mama die.>""","""<If we go to a hospital and the embassy is contacted, I'll eventually be sent back to Italy. ...If that happens, I'll be interrogated about all kinds of things. I won't acknowledge the bastards who let Mama die.>"" ","""<If we go to a hospital and the embassy is contacted, I'll eventually be sent back to Italy. ......If that happens, I'll be interrogated about all kinds of things. I won't acknowledge the bastards who let Mama die.>""",『病院へ行って、大使館に連絡が行けば、私はやがて本国へ送還されるわ。……そしてきっと、あれこれと尋問を受けるんだわ。私は、ママを見殺しにしたヤツらを、自分の祖国とは認めないの。』,『病院へ行って、大使館に連絡が行けば、私はやがて本国へ送還されるわ。……そしてきっと、あれこれと尋問を受けるんだわ。私は、ママを見殺しにしたヤツらを、自分の祖国とは認めないの』,"""<Если мы поедем в больницу и свяжутся с посольством, меня в конечном итоге отправят обратно в Италию. ......И тогда станут допрашивать о всевозможных вещах. Я не признаю тех, кто оставил маму умирать.>""","""‹Se formos para um hospital e a embaixada entrar em contato, eventualmente eu serei mandada de volta para a Itália. ......Se isso acontecer, eu serei interrogada sobre todo o tipo de coisa. Eu não reconheço aquelas pessoas que deixaram a mamãe morrer.›""","""<If we go to a hospital and the embassy is contacted, I'll eventually be sent back to Italy. ......If that happens, I'll be interrogated about all kinds of things. I won't acknowledge those people, who let Mama die.>""",『一旦去了醫院，聯繫了大使館，我就終將會被送回本國。……然後，我一定會被他們質問這質問那的。我可不承認，那幫對我媽媽見死不救的傢伙，是我的祖國。』,『一旦去了医院，联系了大使馆，我就终将会被送回本国。……然后，我一定会被他们质问这质问那的。我可不承认，那帮对我妈妈见死不救的家伙，是我的祖国。』,"""<If we go to a hospital and the embassy is contacted, I'll eventually be sent back to Italy. ......If that happens, I'll be interrogated about all kinds of things. I won't acknowledge those people, who let Mama die.>""","""<If we go to a hospital and the embassy is contacted, I'll eventually be sent back to Italy. ......If that happens, I'll be interrogated about all kinds of things. I won't acknowledge those people, who let Mama die.>""","""<If we go to a hospital and the embassy is contacted, I'll eventually be sent back to Italy. ......If that happens, I'll be interrogated about all kinds of things. I won't acknowledge those people, who let Mama die.>"""
Ushiromiya Kinzo,"""<........................>""","""<............>"" ","""<............>""",『……………………。』,『……………………』,"""<............>""","""‹........................›""","""<........................>""",『……………………』,『……………………』,"""<........................>""","""<........................>""","""<........................>"""
Beatrice,"""<There's no homeland for me to return to now. This is the end for me. So, there's nowhere I want to go anymore. ......The people who were so kind to me—Ensign Angelo, Rubens, and everyone else, ......they're all dead.>""","""<There's no homeland for me to return to now. This is the end for me. So, there's nowhere I want to go anymore. ...Lieutenant Angelo, Rubens, everyone who was so kind to me... ...They're all dead.>"" ","""<There's no homeland for me to return to now. This is the end for me. So, there's nowhere I want to go anymore. ......Ensign Angelo, Rubens, everyone who was so kind to me......they're all dead.>""",『もう、私の帰るべき祖国はないの。ここが私の終点。だからもう、私はどこへも行きたくないの。……私にやさしくしてくれたアンジェロ少尉も、ルーベンスも、みんなみんな、……死んでしまった。』,『もう、私の帰るべき祖国はないの。ここが私の終点。だからもう、私はどこへも行きたくないの。……私にやさしくしてくれたアンジェロ少尉も、ルーベンスも、みんなみんな、……死んでしまった』,"""<Теперь у меня нет родины, чтобы туда возвращаться. Для меня всё кончено. Поэтому я больше никуда не хочу. ......Прапорщик Анджело, Рубенс, все те, кто был так добр ко мне, ......погибли.>""","""‹Não existe pátria para eu retornar agora. Não existe fim para mim. Por isso, eu não posso ir para lugar nenhum. ......As pessoas que foram tão gentis comigo — o subtenente Angelo, o Rubens e todos os outros, ......eles estão todos mortos.›""","""<There's no homeland for me to return to now. This is the end for me. So, there's nowhere I want to go anymore. ......The people who were so kind to me—Ensign Angelo, Rubens, and everyone else, ......they're all dead.>""",『我已經沒有，能回去的祖國了。這裡就是我的終點。所以，我已經不想去任何地方了。……對我很好的安杰洛少尉、魯本斯、大家大家，……全都死了。』,『我已经没有，能回去的祖国了。这里就是我的终点。所以，我已经不想去任何地方了。……对我很好的安杰洛少尉、鲁本斯、大家大家，……全都死了。』,"""<There's no homeland for me to return to now. This is the end for me. So, there's nowhere I want to go anymore. ......The people who were so kind to me—Ensign Angelo, Rubens, and everyone else, ......they're all dead.>""","""<There's no homeland for me to return to now. This is the end for me. So, there's nowhere I want to go anymore. ......The people who were so kind to me—Ensign Angelo, Rubens, and everyone else, ......they're all dead.>""","""<There's no homeland for me to return to now. This is the end for me. So, there's nowhere I want to go anymore. ......The people who were so kind to me—Ensign Angelo, Rubens, and everyone else, ......they're all dead.>"""
Ushiromiya Kinzo,"""<And because of that, you want to die here too? I thought you said Italian women weren't weak. Live.>""","""<And because of that, you want to die here too? I thought you said Italian women weren't weak. Live.>"" ","""<And because of that, you want to die here too? I thought you said Italian women weren't weak. Live.>""",『だから、君までここで死ぬと？　イタリア女はヤワじゃないんだろう？　生きるんだ。』,『だから、君までここで死ぬと？　イタリア女はヤワじゃないんだろう？　生きるんだ』,"""<И поэтому ты тоже хочешь здесь умереть? Ты же говорила, что итальянки не слабые. Живи.>""","""‹E por causa disso, você também quer morrer aqui? Pensei ter dito que italianas não eram fracas. Viva.›""","""<And because of that, you want to die here too? I thought you said Italian women weren't weak. Live.>""",『所以，你也要在這兒死嗎？意大利女人可並不嬌弱吧？活下去。』,『所以，你也要在这儿死吗？意大利女人可并不娇弱吧？活下去。』,"""<And because of that, you want to die here too? I thought you said Italian women weren't weak. Live.>""","""<And because of that, you want to die here too? I thought you said Italian women weren't weak. Live.>""","""<And because of that, you want to die here too? I thought you said Italian women weren't weak. Live.>"""
Beatrice,"""<Hey, Kinzo? What does it mean...to live? You're the one who taught me, aren't you? Living is more than just breathing. .........I don't want to go back to Italy.>""","""<Hey, Kinzo? What does it mean...to live? You're the one who taught me, aren't you? Living is more than just breathing. ...I don't want to go back to Italy.>"" ","""<Hey, Kinzo? What does it mean...to live? You're the one who taught me, aren't you? Living is more than just breathing. ......I don't want to go back to Italy.>""",『ねぇ、金蔵。生きるってどういう意味？　あなたが教えてくれたはずよ。生きるってのは、ただ息をすることじゃないわ。………私は、イタリアへ帰りたくないの。』,『ねぇ、金蔵。生きるってどういう意味？　あなたが教えてくれたはずよ。生きるってのは、ただ息をすることじゃないわ。………私は、イタリアへ帰りたくないの』,"""<Эй, Кинзо. Что значит... жить? Разве не ты объяснил мне? Жить означает не только дышать. ......Я не хочу возвращаться в Италию.>""","""‹Ei, Kinzo? O que significa...viver? Foi você quem me ensinou, não foi? Viver é mais do que apenas respirar. .........Eu não quero voltar à Itália.›""","""<Hey, Kinzo? What does it mean...to live? You're the one who taught me, aren't you? Living is more than just breathing. .........I don't want to go back to Italy.>""",『喂，金藏。所謂活著，是怎麼個意思呢？你應該有教給過我喲。活著，並非僅僅是指在呼吸。………我，不想回意大利。』,『喂，金藏。所谓活着，是怎么个意思呢？你应该有教给过我哟。活着，并非仅仅是指在呼吸。………我，不想回意大利。』,"""<Hey, Kinzo? What does it mean...to live? You're the one who taught me, aren't you? Living is more than just breathing. .........I don't want to go back to Italy.>""","""<Hey, Kinzo? What does it mean...to live? You're the one who taught me, aren't you? Living is more than just breathing. .........I don't want to go back to Italy.>""","""<Hey, Kinzo? What does it mean...to live? You're the one who taught me, aren't you? Living is more than just breathing. .........I don't want to go back to Italy.>"""
Ushiromiya Kinzo,"""<......Bice.>""","""<...Bice.>"" ","""<......Bice.>""",『……ビーチェ。』,『……ビーチェ』,"""<......Биче.>""","""‹......Bice.›""","""<......Bice.>""",『……碧切。』,『……碧切。』,"""<......Bice.>""","""<......Bice.>""","""<......Bice.>"""
Beatrice,"""<You've said that you were dead before you met me. But it's the same for me. ......I died in that submarine. My homeland fell, Mama died. Even Papa died.>""","""<You said that you were dead until you met me. But it's the same for me. ...I died in that submarine. My homeland fell, Mama died. Even Papa died. ","""<You've said that you were dead until you met me. But it's the same for me. ......I died in that submarine. My homeland fell, Mama died. Even Papa died. ",『あなたは私と出会うまで、死んでいたと言ってくれたわ。でも、それは私も同じなの。……潜水艦の中で、私は死んでいた。祖国も滅び、ママも死んだ。パパもね。,『あなたは私と出会うまで、死んでいたと言ってくれたわ。でも、それは私も同じなの。……潜水艦の中で、私は死んでいた。祖国も滅び、ママも死んだ。パパもね』,"""<Ты сказал, что до встречи со мной был мёртв. Но я тоже. ......Я умерла в той субмарине. Моя родина пала, мама умерла. Даже папа умер.>""","""‹Você disse que estava morto antes de me encontrar. Mas eu também estava. ......Eu morri naquele submarino. Minha pátria caiu, a mamãe morreu. Até o papai morreu.›""","""<You've said that you were dead before you met me. But it's the same for me. ......I died in that submarine. My homeland fell, Mama died. Even Papa died.>""",『你曾對我說過，在遇到我之前，你是個死人。然而，這點我也一樣。……在潛水艇中時，我是個死人。祖國滅亡，媽媽也死了。爸爸也死了。』,『你曾对我说过，在遇到我之前，你是个死人。然而，这点我也一样。……在潜水艇中时，我是个死人。祖国灭亡，妈妈也死了。爸爸也死了。』,"""<You've said that you were dead before you met me. But it's the same for me. ......I died in that submarine. My homeland fell, Mama died. Even Papa died.>""","""<You've said that you were dead before you met me. But it's the same for me. ......I died in that submarine. My homeland fell, Mama died. Even Papa died.>""","""<You've said that you were dead before you met me. But it's the same for me. ......I died in that submarine. My homeland fell, Mama died. Even Papa died.>"""
Beatrice,"""<......I prayed that our sub would just sink to the bottom of the ocean. So, when we reached this place, I was actually disappointed that we'd survived. .........Then, right after that, Ensign Angelo started asking whether anyone could speak English.>""","...I prayed that our sub would just sink to the bottom of the ocean. So, when we reached this place, I was actually disappointed that we'd survived. ...Then, right after that, Lieutenant Angelo started asking whether anyone could speak English.>"" ","......I prayed that our sub would just sink to the bottom of the ocean. So, when we reached this place, I was actually disappointed that we'd survived. ......Then, right after that, Ensign Angelo started asking whether anyone could speak English.>""",……私は、こんな船、沈んでしまえと願ったわ。だから、ここに辿り着いた時、実は死に損ねたとがっかりした。………その矢先よ。少尉が、英語がわかる者はいるかと騒ぎ出したのは。』,『……私は、こんな船、沈んでしまえと願ったわ。だから、ここに辿り着いた時、実は死に損ねたとがっかりした。………その矢先よ。少尉が、英語がわかる者はいるかと騒ぎ出したのは』,"""<......Я пожелала, чтобы наша субмарина опустилась на дно океана. Когда мы прибыли сюда, на самом деле я была разочарована тем, что мы выжили. ......И сразу после этого прапорщик Анджело начал искать того, кто знает английский.>""","""‹......Eu rezei para que o nosso submarino afundasse no oceano. Por isso, quando chegamos aqui, eu fiquei desapontada por termos sobrevivido. .........Então, logo depois, o subtenente Angelo começou a perguntar se alguém podia falar inglês.›""","""<......I prayed that our sub would just sink to the bottom of the ocean. So, when we reached this place, I was actually disappointed that we'd survived. .........Then, right after that, Ensign Angelo started asking whether anyone could speak English.>""",『……我在心中祈願著，這船沉了得了。所以，在抵達此地時，我其實曾對沒能死成很是失望。………就是在這個時候喲。少尉吵吵著問，有沒有懂英語的人。』,『……我在心中祈愿着，这船沉了得了。所以，在抵达此地时，我其实曾对没能死成很是失望。………就是在这个时候哟。少尉吵吵着问，有没有懂英语的人。』,"""<......I prayed that our sub would just sink to the bottom of the ocean. So, when we reached this place, I was actually disappointed that we'd survived. .........Then, right after that, Ensign Angelo started asking whether anyone could speak English.>""","""<......I prayed that our sub would just sink to the bottom of the ocean. So, when we reached this place, I was actually disappointed that we'd survived. .........Then, right after that, Ensign Angelo started asking whether anyone could speak English.>""","""<......I prayed that our sub would just sink to the bottom of the ocean. So, when we reached this place, I was actually disappointed that we'd survived. .........Then, right after that, Ensign Angelo started asking whether anyone could speak English.>"""
