Ushiromiya Kinzo,"""<......He's giving you until noon tomorrow. ......That bastard, it's like he's trying to threaten you.>""","""<...He's giving you until noon tomorrow. ...That bastard, he's practically threatening you.>"" ","""<......He's giving you until noon tomorrow. ......That bastard, it's like he's trying to threaten you.>""",『……回答期限は明日の正午だそうだ。……中尉め、まるで脅迫だ。』,『……回答期限は明日の正午だそうだ。……中尉め、まるで脅迫だ』,"""<......Он даёт вам время до завтрашнего полудня. ......Вот сволочь, звучит как угроза.>""","""‹......Eles está dando a vocês até o meio‐dia de amanhã. ......Aquele desgraçado, é como se estivesse ameaçando vocês.›""","""<......He's giving you until noon tomorrow. ......That bastard, it's like he's trying to threaten you.>""",『……答覆期限為明天的正午。……死中尉，這簡直就是在威脅。』,『……答复期限为明天的正午。……死中尉，这简直就是在威胁。』,"""<......He's giving you until noon tomorrow. ......That bastard, it's like he's trying to threaten you.>""","""<......He's giving you until noon tomorrow. ......That bastard, it's like he's trying to threaten you.>""","""<......He's giving you until noon tomorrow. ......That bastard, it's like he's trying to threaten you.>"""
Beatrice,"""<Ensign Angelo is saying he'll ask everyone's opinions...>""","""<Lieutenant Angelo says he'll ask for everyone's thoughts on the matter...>"" ","""<Ensign Angelo is asking everyone's opinions...>""",『少尉は、全員の意見を聞くと言ってるわ…。』,『少尉は、全員の意見を聞くと言ってるわ…』,"""<Прапорщик Анджело спрашивает мнения остальных...>""","""‹O subtenente Angelo está dizendo que vai perguntar a opinião de todos...›""","""<Ensign Angelo is saying he'll ask everyone's opinions...>""",『少尉在講，他想聽聽所有人的意見…』,『少尉在讲，他想听听所有人的意见…』,"""<Ensign Angelo is saying he'll ask everyone's opinions...>""","""<Ensign Angelo is saying he'll ask everyone's opinions...>""","""<Ensign Angelo is saying he'll ask everyone's opinions...>"""
Ushiromiya Kinzo,"""<How does it look?>""","""<Which way do you think they'll go?>"" ","""<How does it look?>""",『感触は？』,『感触は？』,"""<И что думаешь?>""","""‹O que acha?›""","""<How does it look?>""",『情況怎樣？』,『情况怎样？』,"""<How does it look?>""","""<How does it look?>""","""<How does it look?>"""
Beatrice,"""<It'll probably be tough going. ......It seems the ensign is willing to consider splitting it, but his subordinates and the others will probably oppose that. ......All of them have lost close friends on their voyage to the Far East. They're firm in their desire to do their duty for our homeland.>""","""<It'll probably be tough going. ...It seems Lieutenant Angelo is willing to consider splitting it, but his subordinates and the others will probably oppose that. ...All of them have lost close friends on their voyage to the Far East. They're firm in their desire to do their duty for our homeland.>"" ","""<It'll probably be tough going. ......It seems the ensign is willing to consider splitting it, but his subordinates and the others will probably oppose that. ......All of them have lost close friends on their voyage to the Far East. They're firm in their desire to do their duty for our homeland.>""",『多分、難航するわ。……少尉自身は山分けもありえると考えてるみたいだけど、下士官や、他の仲間たちは多分反対するわ。……みんな、この極東までの航海で、大切な仲間を大勢失ってる。彼らは頑なに祖国への忠誠を貫きたがってる。』,『多分、難航するわ。……少尉自身は山分けもありえると考えてるみたいだけど、下士官や、他の仲間たちは多分反対するわ。……みんな、この極東までの航海で、大切な仲間を大勢失ってる。彼らは頑なに祖国への忠誠を貫きたがってる』,"""<Будет трудно. ......Прапорщик готов рассмотреть раздел, но его подчинённые и другие, вероятно, выступят против. ......Все они потеряли близких друзей в их путешествии на Дальний Восток. Они тверды в желании исполнить свой долг ради нашей родины.>""","""‹Provavelmente vai ser duro. ......Parece que o subtenente está disposto a considerar a divisão, mas seus subordinados e os demais provavelmente vão se opor. ......Todos perderam amigos próximos durante essa viagem para o Extremo Oriente. Eles estão resolutos em seus desejos de cumprirem seus deveres com a pátria.›""","""<It'll probably be tough going. ......It seems the ensign is willing to consider splitting it, but his subordinates and the others will probably oppose that. ......All of them have lost close friends on their voyage to the Far East. They're firm in their desire to do their duty for our homeland.>""",『多半難有進展。……雖然少尉自己好像也在想著，平分能商量，但下屬士官及其他同伴們十有八九會反對。……大家在這趟來到遠東之地的航海中，失去了許許多多重要的伙伴。他們都在積極頑固地想要貫徹對祖國的忠誠。』,『多半难有进展。……虽然少尉自己好像也在想着，平分能商量，但下属士官及其他同伴们十有八九会反对。……大家在这趟来到远东之地的航海中，失去了许许多多重要的伙伴。他们都在积极顽固地想要贯彻对祖国的忠诚。』,"""<It'll probably be tough going. ......It seems the ensign is willing to consider splitting it, but his subordinates and the others will probably oppose that. ......All of them have lost close friends on their voyage to the Far East. They're firm in their desire to do their duty for our homeland.>""","""<It'll probably be tough going. ......It seems the ensign is willing to consider splitting it, but his subordinates and the others will probably oppose that. ......All of them have lost close friends on their voyage to the Far East. They're firm in their desire to do their duty for our homeland.>""","""<It'll probably be tough going. ......It seems the ensign is willing to consider splitting it, but his subordinates and the others will probably oppose that. ......All of them have lost close friends on their voyage to the Far East. They're firm in their desire to do their duty for our homeland.>"""
Ushiromiya Kinzo,"""<......Will they refuse the lieutenant's proposal?>""","""<...Will they refuse Lieutenant Yamamoto's proposal?>"" ","""<......Will they refuse the lieutenant's proposal?>""",『……中尉の申し出は断ると？』,『……中尉の申し出は断ると？』,"""<......Они откажутся от предложения лейтенанта?>""","""‹......Eles vão rejeitar a proposta do tenente?›""","""<......Will they refuse the lieutenant's proposal?>""",『……是打算，拒絕中尉的提議？』,『……是打算，拒绝中尉的提议？』,"""<......Will they refuse the lieutenant's proposal?>""","""<......Will they refuse the lieutenant's proposal?>""","""<......Will they refuse the lieutenant's proposal?>"""
Beatrice,"""<Even if they do, the gold will just fall into someone else's hands. ......If nothing is going to be left anyway, Ensign Angelo suggests that they each sneak at least one ingot back with them, and some of the others seem to agree, but...... Men always get carried away at times like this. Even I can't guess what they'll do...>""","""<Even if they do, the gold will just fall into someone else's hands. ...If nothing is going to be left anyway, Lieutenant Angelo suggests that they each sneak at least one ingot back with them, and some of the others seem to agree, but... Men always get carried away at times like this. Even I can't guess what they'll do...>"" ","""<Even if they do, the gold will just fall into someone else's hands. ......If nothing is going to be left anyway, Ensign Angelo suggests that they each sneak at least one ingot back with them, and some of the others seem to agree, but...... Men always get carried away at times like this. Even I can't guess what they'll do...>""",『断っても、どうせ黄金は誰かの手に渡るわ。……何も残らないなら、せめてインゴットの１本ずつでも密かに持ち帰ろうという少尉の言い分に、同調者も出そうだけど……。こういう時の男って、勢いだけが迷走するわ。私も見当が付かない…。』,『断っても、どうせ黄金は誰かの手に渡るわ。……何も残らないなら、せめてインゴットの１本ずつでも密かに持ち帰ろうという少尉の言い分に、同調者も出そうだけど……。こういう時の男って、勢いだけが迷走するわ。私も見当が付かない…』,"""<Даже если откажутся, золото просто попадёт в руки кого‐нибудь другого. ......Раз ничего не останется в любом случае, прапорщик Анджело предлагает каждому из них увезти с собой хотя бы один слиток, и некоторые вроде согласны, но...... В такие времена мужчины всегда увлекаются. Даже я не представляю, как они поступят...>""","""‹Mesmo que o façam, o ouro simplesmente vai cair nas mãos de alguém. ......Se não vai sobrar nada mesmo, o subtenente Angelo sugeriu que cada um deles leve consigo ao menos um lingote, e alguns parecem ter concordado, mas...... Homens sempre acabam se empolgando em horas assim. Nem mesmo eu consigo dizer o que eles vão fazer...›""","""<Even if they do, the gold will just fall into someone else's hands. ......If nothing is going to be left anyway, Ensign Angelo suggests that they each sneak at least one ingot back with them, and some of the others seem to agree, but...... Men always get carried away at times like this. Even I can't guess what they'll do...>""",『哪怕拒絕了，黃金也終歸會落入他人之手。……“既然什麼都不會留下，那麼就至少一人一塊偷偷地把黃金帶回去吧”，對少尉的這個意見，好像都要出現贊同者了……。這種時候的男人，光憑心頭一股勁可是會走錯路的。我也沒辦法了…』,『哪怕拒绝了，黄金也终归会落入他人之手。……“既然什么都不会留下，那么就至少一人一块偷偷地把黄金带回去吧”，对少尉的这个意见，好像都要出现赞同者了……。这种时候的男人，光凭心头一股劲可是会走错路的。我也没办法了…』,"""<Even if they do, the gold will just fall into someone else's hands. ......If nothing is going to be left anyway, Ensign Angelo suggests that they each sneak at least one ingot back with them, and some of the others seem to agree, but...... Men always get carried away at times like this. Even I can't guess what they'll do...>""","""<Even if they do, the gold will just fall into someone else's hands. ......If nothing is going to be left anyway, Ensign Angelo suggests that they each sneak at least one ingot back with them, and some of the others seem to agree, but...... Men always get carried away at times like this. Even I can't guess what they'll do...>""","""<Even if they do, the gold will just fall into someone else's hands. ......If nothing is going to be left anyway, Ensign Angelo suggests that they each sneak at least one ingot back with them, and some of the others seem to agree, but...... Men always get carried away at times like this. Even I can't guess what they'll do...>"""
Ushiromiya Lion,"""......I imagine the Italians had some complicated feelings about all this.""","""...I imagine the Italians had some complicated feelings about all this."" ","""......I imagine the Italians had some complicated feelings about all this.""",「……イタリア人たちの胸中は、複雑でしょうね。」,「……イタリア人たちの胸中は、複雑でしょうね」,"""......Должно быть, для итальянцев всё было сложно.""","""......Eu imagino que os italianos tenham alguns sentimentos complicados sobre tudo isso.""","""......I imagine the Italians had some complicated feelings about all this.""",「……那幫意大利人的內心，一定很複雜吧。」,「……那帮意大利人的内心，一定很复杂吧。」,"""......I imagine the Italians had some complicated feelings about all this.""","""......I imagine the Italians had some complicated feelings about all this.""","""......I imagine the Italians had some complicated feelings about all this."""
Willard H. Wright,"""In their eyes, Italy after the surrender was probably like an enemy country. Letting the gold go back to that Italy would erase the meaning of their entire voyage.""","""In their eyes, the Italy that surrendered was probably little better than an enemy country. Letting the gold go back there would make their entire voyage meaningless."" ","""In their eyes, Italy that surrendered was probably like an enemy country. Letting the gold go back to that Italy would erase the meaning of their entire voyage.""",「彼らにとって、降伏後のイタリアは敵国同然だろう。黄金をそのイタリアに返還するのは、彼らの長い旅路を全て否定するのと同じだ。」,「彼らにとって、降伏後のイタリアは敵国同然だろう。黄金をそのイタリアに返還するのは、彼らの長い旅路を全て否定するのと同じだ」,"""В их глазах капитулировавшая Италия была врагом страны. Позволить золоту вернуться в такую Италию как стереть смысл всего путешествия.""","""Em seus olhos, a Itália pós‐rendição provavelmente era como uma nação inimiga. Deixar o ouro retornar à Itália seria como apagar o significado de toda a viagem.""","""In their eyes, Italy after the surrender was probably like an enemy country. Letting the gold go back to that Italy would erase the meaning of their entire voyage.""",「對他們來說，投降後的意大利等同於敵國吧。把黃金還給這個意大利，等於完全否定他們那段長長的旅途。」,「对他们来说，投降后的意大利等同于敌国吧。把黄金还给这个意大利，等于完全否定他们那段长长的旅途。」,"""In their eyes, Italy after the surrender was probably like an enemy country. Letting the gold go back to that Italy would erase the meaning of their entire voyage.""","""In their eyes, Italy after the surrender was probably like an enemy country. Letting the gold go back to that Italy would erase the meaning of their entire voyage.""","""In their eyes, Italy after the surrender was probably like an enemy country. Letting the gold go back to that Italy would erase the meaning of their entire voyage."""
Ushiromiya Lion,"""However, embezzling and splitting the gold would also erase the meaning of their journey...""","""However, embezzling and divvying up the gold would also make their whole voyage meaningless..."" ","""However, embezzling and splitting the gold would also erase the meaning of their journey...""",「しかし、黄金を着服して山分けすることも、彼らの旅路の否定になります…。」,「しかし、黄金を着服して山分けすることも、彼らの旅路の否定になります…」,"""И всё же, хищение и раздел золота тоже стирают его смысл...""","""Porém, desviar e dividir o ouro também seria apagar o significado da viagem...""","""However, embezzling and splitting the gold would also erase the meaning of their journey...""",「可是，把黃金中飽私囊地平分，也會否定他們這段旅途…」,「可是，把黄金中饱私囊地平分，也会否定他们这段旅途…」,"""However, embezzling and splitting the gold would also erase the meaning of their journey...""","""However, embezzling and splitting the gold would also erase the meaning of their journey...""","""However, embezzling and splitting the gold would also erase the meaning of their journey..."""
Willard H. Wright,"""The country they felt obligated to serve had already fallen. That alone destroyed the significance of their journey. Not a happy story for them.""","""The country they felt obligated to serve had already fallen. That alone destroyed the significance of their journey. Not a happy story for them."" ","""The country they felt obligated to serve had already fallen. That alone destroyed the significance of their journey. Not a happy story for them.""",「彼らが義理立てすべき祖国はすでに滅んでる。その時点で、彼らの旅路の意味など、もう失われてる。気の毒な話だ。」,「彼らが義理立てすべき祖国はすでに滅んでる。その時点で、彼らの旅路の意味など、もう失われてる。気の毒な話だ」,"""Страна, которой они были обязаны служить, уже пала. Это само по себе уничтожило значение их путешествия. Несчастливая история.""","""O país que eles se sentiam na obrigação de servir já pereceu. Isso sozinho já destruiu o significado da viagem deles. É uma história lamentável.""","""The country they felt obligated to serve had already fallen. That alone destroyed the significance of their journey. Not a happy story for them.""",「他們當盡忠義的祖國已經滅亡。在那時，他們的旅途就已經失去意義了。可怜。」,「他们当尽忠义的祖国已经灭亡。在那时，他们的旅途就已经失去意义了。可怜。」,"""The country they felt obligated to serve had already fallen. That alone destroyed the significance of their journey. Not a happy story for them.""","""The country they felt obligated to serve had already fallen. That alone destroyed the significance of their journey. Not a happy story for them.""","""The country they felt obligated to serve had already fallen. That alone destroyed the significance of their journey. Not a happy story for them."""
Ushiromiya Lion,"""......If it's bound to be meaningless anyway, wouldn't keeping hold of even just a few ingots be better than nothing?""","""...If it's bound to be meaningless anyway, wouldn't keeping hold of even just a few ingots be better than nothing?"" ","""......If it's bound to be meaningless anyway, wouldn't keeping hold of even just a few ingots be better than nothing?""",「……どうせ意味のないことなら、インゴットの１本でもありつけた方が、まだマシだと？」,「……どうせ意味のないことなら、インゴットの１本でもありつけた方が、まだマシだと？」,"""......Если всё бессмысленно в любом случае, разве хотя бы несколько слитков не лучше, чем ничего?""","""......Se está atado a perder seu significado de qualquer jeito, manter apenas alguns poucos lingotes não seria melhor do que nada?""","""......If it's bound to be meaningless anyway, wouldn't keeping hold of even just a few ingots be better than nothing?""",「……反正都沒意義了，那還不如，至少順個一塊金塊麼？」,「……反正都没意义了，那还不如，至少顺个一块金块么？」,"""......If it's bound to be meaningless anyway, wouldn't keeping hold of even just a few ingots be better than nothing?""","""......If it's bound to be meaningless anyway, wouldn't keeping hold of even just a few ingots be better than nothing?""","""......If it's bound to be meaningless anyway, wouldn't keeping hold of even just a few ingots be better than nothing?"""
Willard H. Wright,"""Sure, if you want to calculate straight‐up profit and loss. ............But men aren't like that.""","""Sure, if you want to calculate straight-up profit and loss. ......But men aren't like that."" ","""Sure, if you want to calculate straight-up profit and loss. .........But men aren't like that.""",「損得勘定で言えばそうなる。…………そうならねぇのが、男ってもんだがな。」,「損得勘定で言えばそうなる。…………そうならねぇのが、男ってもんだがな」,"""Конечно, если прямо рассчитывать прибыль и убытки. .........Но мужчины не такие.""","""Claro, se você calcular as perdas e ganhos diretos. ............Mas homens não são assim.""","""Sure, if you want to calculate straight‐up profit and loss. ............But men aren't like that.""",「從得失計算上講，就是如此。…………不過，男人這種生物，是不會算得那麼清的。」,「从得失计算上讲，就是如此。…………不过，男人这种生物，是不会算得那么清的。」,"""Sure, if you want to calculate straight‐up profit and loss. ............But men aren't like that.""","""Sure, if you want to calculate straight‐up profit and loss. ............But men aren't like that.""","""Sure, if you want to calculate straight‐up profit and loss. ............But men aren't like that."""
,"The Italians were gathered in a cramped room, arguing fiercely.","The Italians were gathered in a cramped room, arguing fiercely. ","The Italians were gathered in a cramped room, arguing fiercely.",狭い部屋にイタリア人たちが集まり、激論を交わしていた。,狭い部屋にイタリア人たちが集まり、激論を交わしていた。,"Итальянцы собрались в тесной комнате, отчаянно споря.","Os italianos estavam reunidos em uma saleta, discutindo vigorosamente.","The Italians were gathered in a cramped room, arguing fiercely.",那幫意大利人擠在了一間小屋子裡，激烈爭論。,那帮意大利人挤在了一间小屋子里，激烈争论。,"The Italians were gathered in a cramped room, arguing fiercely.","The Italians were gathered in a cramped room, arguing fiercely.","The Italians were gathered in a cramped room, arguing fiercely."
,"«I don't like it! We must remain true to our soldier spirit until the end, for the sake of our fallen comrades!»","""I don't like it! We must remain true to our soldier spirit until the end, for the sake of our fallen comrades!' ","'I don't like it! We must remain true to our soldier spirit until the end, for the sake of our fallen comrades!'",“反対です！　死んだ戦友たちのためにも、断固、軍人魂を貫くべきです！”,“反対です！　死んだ戦友たちのためにも、断固、軍人魂を貫くべきです！”,«Так не пойдёт! Ради наших погибших товарищей мы должны до последнего оставаться верными своему солдатскому духу!»,"«Eu não gosto disso! Devemos nos manter verdadeiros a nossos espíritos de soldado até o fim, pelo bem de nossos companheiros que pereceram!»","«I don't like it! We must remain true to our soldier spirit until the end, for the sake of our fallen comrades!»",“反對！就當是為死了的戰友們，我們也得堅決貫徹軍人魂！”,“反对！就当是为死了的战友们，我们也得坚决贯彻军人魂！”,"«I don't like it! We must remain true to our soldier spirit until the end, for the sake of our fallen comrades!»","«I don't like it! We must remain true to our soldier spirit until the end, for the sake of our fallen comrades!»","«I don't like it! We must remain true to our soldier spirit until the end, for the sake of our fallen comrades!»"
