,"He always makes a fuss when no one's looking, but when the time comes, he makes his decision with pride.","He always makes a fuss when no one's looking, but when the time comes, he makes his decision with pride. "," He always makes a fuss when no one's looking, but when the time comes, he makes his decision with pride.",こうして、見えないところでは大騒ぎしながらも、本番になればバッチリ決めてみせる。,こうして、見えないところでは大騒ぎしながらも、本番になればバッチリ決めてみせる。,"Он постоянно суетится, когда никто не видит, но когда приходит время, принимает решение с гордостью.","Ele sempre faz por menos quando ninguém está olhando, mas quando chega a hora, ele sempre toma suas decisões com muito orgulho.","He always makes a fuss when no one's looking, but when the time comes, he makes his decision with pride.",就這樣，雖然在私下裡總是很喧鬧，到了正經的時候還是能完美地做出決定的。,就这样，虽然在私下里总是很喧闹，到了正经的时候还是能完美地做出决定的。,"He always makes a fuss when no one's looking, but when the time comes, he makes his decision with pride.","He always makes a fuss when no one's looking, but when the time comes, he makes his decision with pride.","He always makes a fuss when no one's looking, but when the time comes, he makes his decision with pride."
,"After asking Nanjo to come down by lunch at the latest, Krauss snuck out of the study...","After asking Nanjo to come down by lunch at the latest, Krauss snuck out of the study... "," After asking Nanjo to come down by lunch at the latest, Krauss snuck out of the study...",遅くともランチまでには必ず降りてくるようにお願いしますと南條に伝え、蔵臼はそっと書斎を出る…。,遅くともランチまでには必ず降りてくるようにお願いしますと南條に伝え、蔵臼はそっと書斎を出る…。,"Попросив Нанджо спуститься по крайней мере к обеду, Краусс выбрался из кабинета...","Após pedir a Nanjo para descer para o almoço, Krauss escapuliu do estúdio...","After asking Nanjo to come down by lunch at the latest, Krauss snuck out of the study...",告訴南條“最晚也請在午飯之前下來”後，藏臼悄悄地走出了書房…。,告诉南条“最晚也请在午饭之前下来”后，藏臼悄悄地走出了书房…。,"After asking Nanjo to come down by lunch at the latest, Krauss snuck out of the study...","After asking Nanjo to come down by lunch at the latest, Krauss snuck out of the study...","After asking Nanjo to come down by lunch at the latest, Krauss snuck out of the study..."
Gohda Toshiro,"""What do you think? A splendid aroma, is it not?! And a unique one, as well!""","""What do you think? A splendid aroma, is it not?! And a unique one, as well!"" ","""What do you think? A splendid aroma, is it not?! And a unique one, as well!""",「どうです？　いい香りでしょう！　そして珍しいでしょう！」,「どうです？　いい香りでしょう！　そして珍しいでしょう！」,"""Что скажете? Великолепный аромат, правда?! И к тому же уникальный!""","""O que acha? Não é um aroma maravilhoso?! Bem como também é único!""","""What do you think? A splendid aroma, is it not?! And a unique one, as well!""",「怎麼樣？很香吧！而且很稀罕沒錯吧！」,「怎么样？很香吧！而且很稀罕没错吧！」,"""What do you think? A splendid aroma, is it not?! And a unique one, as well!""","""What do you think? A splendid aroma, is it not?! And a unique one, as well!""","""What do you think? A splendid aroma, is it not?! And a unique one, as well!"""
Shannon,"""I've never had pumpkin tea before... That little touch of sweetness makes it delicious.""","""I've never had pumpkin tea before... That little touch of sweetness makes it delicious."" ","""I've never had pumpkin tea before... That little touch of sweetness makes it delicious.""",「パンプキンティーなんて、初めて飲みました…。ほんのり甘くて美味しいですね。」,「パンプキンティーなんて、初めて飲みました…。ほんのり甘くて美味しいですね」,"""Никогда раньше не пробовала тыквенный чай... Сладкий привкус делает его восхитительным.""","""Eu nunca tomei chá de abóbora antes... Esse pequeno toque de doçura deixa delicioso.""","""I've never had pumpkin tea before... That little touch of sweetness makes it delicious.""",「南瓜茶還真是，頭一次喝到…。有微微的甜味，真是好喝。」,「南瓜茶还真是，头一次喝到…。有微微的甜味，真是好喝。」,"""I've never had pumpkin tea before... That little touch of sweetness makes it delicious.""","""I've never had pumpkin tea before... That little touch of sweetness makes it delicious.""","""I've never had pumpkin tea before... That little touch of sweetness makes it delicious."""
,"Before serving the tea to the guests, Gohda served some to Shannon.","As one step in preparing the tea for the guests, Gohda let Shannon try a bit first. ","As one step in preparing the tea for the guests, Gohda let Shannon try a bit first.",客人たちに振舞う予定の紅茶を、郷田は先に紗音に振舞っていた。,客人たちに振舞う予定の紅茶を、郷田は先に紗音に振舞っていた。,В рамках подготовки чая для гостей Года дал Шаннон попробовать первой.,"Antes de servir o chá aos convidados, Gohda serviu um pouco para Shannon.","Before serving the tea to the guests, Gohda served some to Shannon.",鄉田先向紗音展現了預定要展現給客人們的紅茶。,乡田先向纱音展现了预定要展现给客人们的红茶。,"Before serving the tea to the guests, Gohda served some to Shannon.","Before serving the tea to the guests, Gohda served some to Shannon.","Before serving the tea to the guests, Gohda served some to Shannon."
,"Until then, Shannon had thought it would be outrageous for a servant such as herself to drink the same thing as the family and their guests.","Until then, Shannon had thought it would be outrageous for a servant such as herself to drink the same thing as the family and their guests. "," Until then, Shannon had thought it would be outrageous for a servant such as herself to drink the same thing as the family and their guests.",紗音はそれまで、使用人たる者は、家人や客人と同じ物を口にするなどとんでもないと思っていた。,紗音はそれまで、使用人たる者は、家人や客人と同じ物を口にするなどとんでもないと思っていた。,"До сих пор она думала, что для слуги возмутительно пить то же самое, что семья и гости.","Até então, Shannon pensava que era um ultraje que serviçais como ela bebessem o mesmo que a família e os convidados.","Until then, Shannon had thought it would be outrageous for a servant such as herself to drink the same thing as the family and their guests.",在此之前，紗音一直都認為，身為傭人，是不能和家人以及客人們吃同樣的東西的。,在此之前，纱音一直都认为，身为佣人，是不能和家人以及客人们吃同样的东西的。,"Until then, Shannon had thought it would be outrageous for a servant such as herself to drink the same thing as the family and their guests.","Until then, Shannon had thought it would be outrageous for a servant such as herself to drink the same thing as the family and their guests.","Until then, Shannon had thought it would be outrageous for a servant such as herself to drink the same thing as the family and their guests."
,"However, according to Gohda, that kind of thinking was a mistake.","However, according to Gohda, that kind of thinking was a mistake. "," However, according to Gohda, that kind of thinking was a mistake.",しかし、郷田に言わせるとそれは違うらしい。,しかし、郷田に言わせるとそれは違うらしい。,"Однако, по словам Годы, такое мнение ошибочно.","Entretanto, de acordo com Gohda, esse pensamento era equivocado.","However, according to Gohda, that kind of thinking was a mistake.",但是，鄉田說，這是不對的。,但是，乡田说，这是不对的。,"However, according to Gohda, that kind of thinking was a mistake.","However, according to Gohda, that kind of thinking was a mistake.","However, according to Gohda, that kind of thinking was a mistake."
Gohda Toshiro,"""One must not serve something if one does not know the taste beforehand. ......For example, when you visit a restaurant, what are you likely to ask the waiter if a dish you've never heard of catches your eye? ""How does this dish taste"", correct?""","""One must not serve something if one does not know the taste beforehand. ...For example, when you visit a restaurant and a dish you've never heard of catches your eye, what are you likely to ask the waiter? ""How does this dish taste"", correct?"" ","""One must not serve something if one does not know the taste beforehand. ......For example, when you visit a restaurant and a dish you've never heard of catches your eye, what are you likely to ask the waiter? 'How does this dish taste', correct?""",「お客様にお出しする物を、味も知らずに出すことは出来ません。……例えば、訪れたレストランで。初めて知る料理に興味を持った時、ウェイターを呼び止めたならこう聞くでしょう？　この料理はどんな味ですか、と。」,「お客様にお出しする物を、味も知らずに出すことは出来ません。……例えば、訪れたレストランで。初めて知る料理に興味を持った時、ウェイターを呼び止めたならこう聞くでしょう？　この料理はどんな味ですか、と」,"""Ничего нельзя подавать, если заранее не знаешь вкуса. ......К примеру, если бы в ресторане вам бросилось в глаза блюдо, о котором вы никогда не слышали, о чём бы вы захотели спросить официанта? «Какое оно на вкус», верно?""","""Não se deve servir algo sem experimentar seu sabor de antemão.{n}......Por exemplo, quando você visita um restaurante, o que você perguntaria à atendente sobre um prato que despertou sua atenção mas você nunca provou? ""Como é o gosto"", correto?""","""One must not serve something if one does not know the taste beforehand. ......For example, when you visit a restaurant, what are you likely to ask the waiter if a dish you've never heard of catches your eye? ""How does this dish taste"", correct?""",「給客人遞上的食物，不可以連味道都不知道就遞上去。……比如說，你去飯店吃飯。對頭一次聽說的菜品有興趣的時候，會叫服務員來問的吧？問這道菜是個什麼味道。」,「给客人递上的食物，不可以连味道都不知道就递上去。……比如说，你去饭店吃饭。对头一次听说的菜品有兴趣的时候，会叫服务员来问的吧？问这道菜是个什么味道。」,"""One must not serve something if one does not know the taste beforehand. ......For example, when you visit a restaurant, what are you likely to ask the waiter if a dish you've never heard of catches your eye? ""How does this dish taste"", correct?""","""One must not serve something if one does not know the taste beforehand. ......For example, when you visit a restaurant, what are you likely to ask the waiter if a dish you've never heard of catches your eye? ""How does this dish taste"", correct?""","""One must not serve something if one does not know the taste beforehand. ......For example, when you visit a restaurant, what are you likely to ask the waiter if a dish you've never heard of catches your eye? ""How does this dish taste"", correct?"""
Shannon,"""I see... If the waiter says that he's never tried it, that would seem a bit odd......""","""I see... So, if the waiter says that he's never eaten it before, that would seem a bit odd..."" ","""I see... So, if the waiter says that he's never eaten it before, that would seem a bit odd......""",「そうですね…。そこで、食べたことがないから知りませんでは、何だかおかしな話ですものね……。」,「そうですね…。そこで、食べたことがないから知りませんでは、何だかおかしな話ですものね……」,"""Вот как... Было бы странно, если бы официант сказал, что никогда его не пробовал......""","""Entendi... Seria estranho se a atendente dissesse que nunca o provou......""","""I see... If the waiter says that he's never tried it, that would seem a bit odd......""",「說的也是呢…。那時候如果因為沒嘗過而說不知道的話，會顯得很奇怪……」,「说的也是呢…。那时候如果因为没尝过而说不知道的话，会显得很奇怪……」,"""I see... If the waiter says that he's never tried it, that would seem a bit odd......""","""I see... If the waiter says that he's never tried it, that would seem a bit odd......""","""I see... If the waiter says that he's never tried it, that would seem a bit odd......"""
Gohda Toshiro,"""Precisely. As a matter of course, anyone serving their customers must be deeply acquainted with the taste of the tea and food they serve.""","""Precisely. As a matter of course, anyone serving their customers must be deeply acquainted with the taste of the tea and food they serve."" ","""Precisely. As a matter of course, anyone serving their customers must be deeply acquainted with the taste of the tea and food they serve.""",「そういうことです。給仕に携る者ならば、お客様にお出しするお茶やお料理の味については、熟知していて当然なのです。」,「そういうことです。給仕に携る者ならば、お客様にお出しするお茶やお料理の味については、熟知していて当然なのです」,"""Именно. Как само собой разумеющееся, все те, кто обслуживает клиентов, должны как следует распробовать вкус подаваемых блюд и чая.""","""Precisamente. Por necessidade, qualquer um servindo seus clientes deve ter profundo conhecimento sobre o sabor dos chás e pratos antes de servi‐los.""","""Precisely. As a matter of course, anyone serving their customers must be deeply acquainted with the taste of the tea and food they serve.""",「就是這樣。為他人服務者，對於給客人端上的茶水飯食的味道，是理應熟知的。」,「就是这样。为他人服务者，对于给客人端上的茶水饭食的味道，是理应熟知的。」,"""Precisely. As a matter of course, anyone serving their customers must be deeply acquainted with the taste of the tea and food they serve.""","""Precisely. As a matter of course, anyone serving their customers must be deeply acquainted with the taste of the tea and food they serve.""","""Precisely. As a matter of course, anyone serving their customers must be deeply acquainted with the taste of the tea and food they serve."""
Kumasawa Chiyo,"""Hoh‐hoh‐hoh‐ho. And you'll always feel happier serving a sort of tea that you've tried and enjoyed for yourself.""","""Hohohoho. And, you'll always feel happier serving a sort of tea that you've tried and enjoyed for yourself."" ","""Hohohoho. And you'll always feel happier serving a sort of tea that you've tried and enjoyed for yourself.""",「ほっほっほっほ。それに、自分で飲んで美味しかったお茶なら、お出しする時にも、自然と嬉しくなってしまうものですしねぇ。」,「ほっほっほっほ。それに、自分で飲んで美味しかったお茶なら、お出しする時にも、自然と嬉しくなってしまうものですしねぇ」,"""Хо‐хо‐хо‐хо. И всегда радостнее подавать тот чай, который сами уже пробовали.""","""Hoh‐hoh‐hoh‐ho. E você sempre se sente mais feliz ao servir um chá que já experimentou e aproveitou.""","""Hoh‐hoh‐hoh‐ho. And you'll always feel happier serving a sort of tea that you've tried and enjoyed for yourself.""",「嚯嚯嚯嚯。而且自己喝著覺得好喝的茶，在端出來的時候，自然也就會覺得高興了。」,「嚯嚯嚯嚯。而且自己喝着觉得好喝的茶，在端出来的时候，自然也就会觉得高兴了。」,"""Hoh‐hoh‐hoh‐ho. And you'll always feel happier serving a sort of tea that you've tried and enjoyed for yourself.""","""Hoh‐hoh‐hoh‐ho. And you'll always feel happier serving a sort of tea that you've tried and enjoyed for yourself.""","""Hoh‐hoh‐hoh‐ho. And you'll always feel happier serving a sort of tea that you've tried and enjoyed for yourself."""
Shannon,"""That's right. After tasting tea this delicious, I can't wait to let everyone else try it.""","""That's right. After tasting tea this delicious, I can't wait to let everyone else try it."" ","""That's right. After tasting tea this delicious, I can't wait to let everyone else try it.""",「その通りですね。こんな美味しいお茶なら、ぜひ皆さんにも飲んでもらいたいって気持ちになります。」,「その通りですね。こんな美味しいお茶なら、ぜひ皆さんにも飲んでもらいたいって気持ちになります」,"""Точно. Продегустировав такой вкусный чай, мне не терпится дать попробовать его всем остальным.""","""Isso mesmo. Após provar este delicioso chá, eu mal posso esperar para que todos experimentem também.""","""That's right. After tasting tea this delicious, I can't wait to let everyone else try it.""",「正是如此呢。這樣好喝的茶，讓人有種一定要讓大家也喝一喝的感覺。」,「正是如此呢。这样好喝的茶，让人有种一定要让大家也喝一喝的感觉。」,"""That's right. After tasting tea this delicious, I can't wait to let everyone else try it.""","""That's right. After tasting tea this delicious, I can't wait to let everyone else try it.""","""That's right. After tasting tea this delicious, I can't wait to let everyone else try it."""
Kumasawa Chiyo,"""And because of that! We servants must be very familiar with the tastes of all sorts of foods. So if you ever catch me stealing a little nibble, that's all part of my job description... Hoh‐hoh‐ho.""","""And because of that! We servants must be very familiar with the tastes of all sorts of foods. That's why ""sampling"" food whenever I can is part of my job description, ...hohoho."" ","""And because of that! We servants must be very familiar with the tastes of all sorts of foods. That's why 'sampling' food whenever I can is part of my job description, ...hohoho.""",「だからこそ！　私たち使用人は、あらゆるお料理の味に熟知しなければならないのです。だから私が、ひょいと摘み食いをしてしまったとしても、それも使用人の務め務め…、ほっほっほ。」,「だからこそ！　私たち使用人は、あらゆるお料理の味に熟知しなければならないのです。だから私が、ひょいと摘み食いをしてしまったとしても、それも使用人の務め務め…、ほっほっほ」,"""И поэтому! Мы, служащие, должны хорошо знать вкусы всех видов пищи. Вот почему пробовать еду при каждой возможности — часть моей должностной инструкции... хо‐хо‐хо.""","""Justamente por isso! Nós, serviçais, devemos estar familiarizados com o sabor de todo tipo de alimento. Por isso, se já tiver me visto pegando uma provinha, é tudo parte do meu trabalho de descrição... Hoh‐hoh‐ho.""","""And because of that! We servants must be very familiar with the tastes of all sorts of foods. So if you ever catch me stealing a little nibble, that's all part of my job description... Hoh‐hoh‐ho.""",「正因為這樣！我們傭人才必須熟知各種料理的味道。所以我稍微偷吃一點點，也是傭人的本分…，嚯嚯嚯。」,「正因为这样！我们佣人才必须熟知各种料理的味道。所以我稍微偷吃一点点，也是佣人的本分…，嚯嚯嚯。」,"""And because of that! We servants must be very familiar with the tastes of all sorts of foods. So if you ever catch me stealing a little nibble, that's all part of my job description... Hoh‐hoh‐ho.""","""And because of that! We servants must be very familiar with the tastes of all sorts of foods. So if you ever catch me stealing a little nibble, that's all part of my job description... Hoh‐hoh‐ho.""","""And because of that! We servants must be very familiar with the tastes of all sorts of foods. So if you ever catch me stealing a little nibble, that's all part of my job description... Hoh‐hoh‐ho."""
Gohda Toshiro,"""It's both a perk and a part of the job. Do you understand?""","""It's a perk as well as our job. Do you understand?"" ","""It's our role in the household as well as our job. Do you understand?""",「役得であり、仕事であるわけです。わかりましたか？」,「役得であり、仕事であるわけです。わかりましたか？」,"""Такова наша работа и роль в домашнем хозяйстве. Понимаете?""","""É tanto por mim quanto pelo meu trabalho. Entendeu?""","""It's both a perk and a part of the job. Do you understand?""",「既有額外獲益，也是分內之事。明白了嗎？」,「既有额外获益，也是分内之事。明白了吗？」,"""It's both a perk and a part of the job. Do you understand?""","""It's both a perk and a part of the job. Do you understand?""","""It's both a perk and a part of the job. Do you understand?"""
Shannon,"""Yes!""","""Yes!"" ","""Yes!""",「はいっ。」,「はいっ」,"""Да!""","""Sim!""","""Yes!""",「明白！」,「明白！」,"""Yes!""","""Yes!""","""Yes!"""
Ronoue Genji,"""......Everything is proceeding smoothly. Are there any problems with the tea?""","""...Everything is proceeding smoothly. Are there any problems with the tea?"" ","""......Everything is proceeding smoothly. Are there any problems with the tea?""",「……準備ご苦労。お茶の方は問題ないか。」,「……準備ご苦労。お茶の方は問題ないか」,"""......Всё продвигается гладко. С чаем не возникло проблем?""","""......Tudo está prosseguindo de acordo com os conformes. Tem algum problema com o chá?""","""......Everything is proceeding smoothly. Are there any problems with the tea?""",「……各位準備辛苦了。茶沒有問題吧？」,「……各位准备辛苦了。茶没有问题吧？」,"""......Everything is proceeding smoothly. Are there any problems with the tea?""","""......Everything is proceeding smoothly. Are there any problems with the tea?""","""......Everything is proceeding smoothly. Are there any problems with the tea?"""
Gohda Toshiro,"""Oh, Genji‐san, you must try some as well. Seeing as it's almost Halloween, I decided to make some pumpkin tea.""","""Oh, Genji-san, you must try some as well. Seeing as it's almost Halloween, I decided to make some pumpkin tea."" ","""Oh, Genji-san, you must try some as well. Seeing as it's almost Halloween, I decided to make some pumpkin tea.""",「あぁ、源次さんもぜひ飲んでみて下さい。ハロウィンらしく、今日はカボチャの紅茶ですよ。」,「あぁ、源次さんもぜひ飲んでみて下さい。ハロウィンらしく、今日はカボチャの紅茶ですよ」,"""О, Генджи, вы тоже должны попробовать. Надвигается Хэллоуин, и я решил сделать тыквенный чай.""","""Ora, Genji‐san, você também deveria provar. Por ser quase Halloween, eu decidi fazer um chá com abóboras.""","""Oh, Genji‐san, you must try some as well. Seeing as it's almost Halloween, I decided to make some pumpkin tea.""",「嗯，源次先生也請嘗一口吧。為迎合萬聖夜，今天準備了南瓜的紅茶呢。」,「嗯，源次先生也请尝一口吧。为迎合万圣夜，今天准备了南瓜的红茶呢。」,"""Oh, Genji‐san, you must try some as well. Seeing as it's almost Halloween, I decided to make some pumpkin tea.""","""Oh, Genji‐san, you must try some as well. Seeing as it's almost Halloween, I decided to make some pumpkin tea.""","""Oh, Genji‐san, you must try some as well. Seeing as it's almost Halloween, I decided to make some pumpkin tea."""
