,That expression.........was the one always worn by the Kinzo inside Ange's mind.,That expression...was the one always worn by the Kinzo inside Ange's mind. , That expression......was the one always worn by the Kinzo inside Ange's mind.,その表情こそが、………縁寿が想像する金蔵が、いつも浮かべているもののはずなのだ。,その表情こそが、………縁寿が想像する金蔵が、いつも浮かべているもののはずなのだ。,Его выражение...... в представлении Энджи всегда было таким.,Aquela expressão.........sempre pertenceu a Kinzo dentro da cabeça de Ange.,That expression.........was the one always worn by the Kinzo inside Ange's mind.,這個表情才是，………緣壽印象中的金藏，最常浮現出的表情才對。,这个表情才是，………缘寿印象中的金藏，最常浮现出的表情才对。,That expression.........was the one always worn by the Kinzo inside Ange's mind.,That expression.........was the one always worn by the Kinzo inside Ange's mind.,That expression.........was the one always worn by the Kinzo inside Ange's mind.
,This {i:was} Ushiromiya Kinzo.,This was Ushiromiya Kinzo. , This was Ushiromiya Kinzo.,それこそが、右代宮金蔵。,それこそが、右代宮金蔵。,Уширомия Кинзо.,Este {i:era} Ushiromiya Kinzo.,This {i:was} Ushiromiya Kinzo.,這才是，右代宮金藏。,这才是，右代宫金藏。,This {i:was} Ushiromiya Kinzo.,This {i:was} Ushiromiya Kinzo.,This {i:was} Ushiromiya Kinzo.
,"He was fickle, short‐tempered, always with a stern expression on his face. ......The most terrifying person in the Ushiromiya family...","He was fickle, short-tempered, and always wore a stern expression on his face. ...This was the most terrifying person in the Ushiromiya family... "," He was fickle, short-tempered, always with a stern expression on his face. ......The most terrifying person in the Ushiromiya family...",いつも険しい表情をしていて、短気で気紛れ。……右代宮家で、最も恐ろしい人間…。,いつも険しい表情をしていて、短気で気紛れ。……右代宮家で、最も恐ろしい人間…。,"Непостоянный, вспыльчивый, всегда с суровым выражением лица. ......Самый страшный человек в семье Уширомия...","Um homem caprichoso e temperamental, sempre com uma dura expressão em seu rosto. ......A pessoa mais assustadora dentro da família Ushiromiya...","He was fickle, short‐tempered, always with a stern expression on his face. ......The most terrifying person in the Ushiromiya family...",永遠板著臉，性急而又反覆無常。……右代宮家的，最可怕的一人…。,永远板着脸，性急而又反复无常。……右代宫家的，最可怕的一人…。,"He was fickle, short‐tempered, always with a stern expression on his face. ......The most terrifying person in the Ushiromiya family...","He was fickle, short‐tempered, always with a stern expression on his face. ......The most terrifying person in the Ushiromiya family...","He was fickle, short‐tempered, always with a stern expression on his face. ......The most terrifying person in the Ushiromiya family..."
Ushiromiya Ange,"""...........................""","""............"" ","""............""",「………………………。」,「………………………」,"""............""","""...........................""","""...........................""",「………………………」,「………………………」,"""...........................""","""...........................""","""..........................."""
Ushiromiya Kinzo,""".................................""","""............"" ","""............""",「……………………………。」,「……………………………」,"""...............""",""".................................""",""".................................""",「……………………………」,「……………………………」,""".................................""",""".................................""","""................................."""
,"It felt as though the world had gone suddenly quiet, and it had only done it when it was my turn to step forward.","It felt as though the world went suddenly quiet, and it only did it when I stepped forward. ","It felt as though the world went suddenly quiet, and it only did it when I stepped forward.",私の時にだけ、世界が静まり返った気がする。,私の時にだけ、世界が静まり返った気がする。,"Словно мир неожиданно замолк, и именно когда я шагнула вперёд.","Como se o mundo tivesse ficado em silêncio de repente, tendo ocorrido apenas quando pisei em frente.","It felt as though the world had gone suddenly quiet, and it had only done it when it was my turn to step forward.",只有輪到我時，整個世界都還以寂靜。,只有轮到我时，整个世界都还以寂静。,"It felt as though the world had gone suddenly quiet, and it had only done it when it was my turn to step forward.","It felt as though the world had gone suddenly quiet, and it had only done it when it was my turn to step forward.","It felt as though the world had gone suddenly quiet, and it had only done it when it was my turn to step forward."
,......Why? Why only for me?,...Why? Why only for me? ,......Why? Why only for me? ,……どうして？　どうして私だけ？,……どうして？　どうして私だけ？,......Почему? Почему только на меня?,......Por quê? Por que só eu?,......Why? Why only for me?,……為什麼？為什麼只對我這樣？,……为什么？为什么只对我这样？,......Why? Why only for me?,......Why? Why only for me?,......Why? Why only for me?
,"But, even so, ......isn't this the way it should be?{n}Isn't this the Ushiromiya Kinzo I expect? ...The Ushiromiya Kinzo I understand......?","But, ...isn't this how it should be? Isn't this the Ushiromiya Kinzo I expect? ...The Ushiromiya Kinzo I understand...? ","But, even so, ......isn't this the way it should be? Isn't this the Ushiromiya Kinzo I expect? ...The Ushiromiya Kinzo I understand......? ",でも、なら、……これがむしろ、正しいのでは？これが、私が期待、……いや、理解する右代宮金蔵なのでは……？,でも、なら、……これがむしろ、正しいのでは？{n}これが、私が期待、……いや、理解する右代宮金蔵なのでは……？,"Хотя...... разве так не должно быть?{n}Разве это не тот Уширомия Кинзо, которого я знаю и ожидала увидеть?..","Mas, mesmo assim, ......não é assim que deveria ser?{n}Esse não é o Ushiromiya Kinzo que eu esperava? ...O Ushiromiya Kinzo que eu entendia......?","But, even so, ......isn't this the way it should be?{n}Isn't this the Ushiromiya Kinzo I expect? ...The Ushiromiya Kinzo I understand......?",不過，這樣，……反倒是正確的吧？{n}這才是，我所期待，……不，我所了解的右代宮金藏才對……？,不过，这样，……反倒是正确的吧？{n}这才是，我所期待，……不，我所了解的右代宫金藏才对……？,"But, even so, ......isn't this the way it should be?{n}Isn't this the Ushiromiya Kinzo I expect? ...The Ushiromiya Kinzo I understand......?","But, even so, ......isn't this the way it should be?{n}Isn't this the Ushiromiya Kinzo I expect? ...The Ushiromiya Kinzo I understand......?","But, even so, ......isn't this the way it should be?{n}Isn't this the Ushiromiya Kinzo I expect? ...The Ushiromiya Kinzo I understand......?"
,"I was like a puppet carrying tea.{n}I walked forward, bewildered, with the present held out in front of me, ......and stopped in front of Kinzo.","I was like a puppet carrying a tea tray. I walked forward, bewildered, with the present held out in front of me, ...and stopped in front of Kinzo. ","I was like a puppet carrying tea. I walked forward, bewildered, with the present box held out in front of me, ......and stopped in front of Kinzo.",まるで、お茶を運ぶカラクリ人形のように。私はプレゼントボックスを突き出すように持ちながら、呆然と歩き、……金蔵の前で止まった。,まるで、お茶を運ぶカラクリ人形のように。{n}私はプレゼントボックスを突き出すように持ちながら、呆然と歩き、……金蔵の前で止まった。,"Я была как марионетка, несущая чай.{n}Сбитая с толку, я вышла вперёд, держа перед собой подарочную коробку...... и остановилась перед Кинзо.","Eu era como uma boneca carregando chá.{n}Eu caminhei em frente, atônita, com o presente à minha frente, ......e parei diante de Kinzo.","I was like a puppet carrying tea.{n}I walked forward, bewildered, with the present held out in front of me, ......and stopped in front of Kinzo.",就好像，是在端茶水的機械人偶一樣。{n}我舉著那禮物盒，茫然地走了過去，……在金藏的面前站住了。,就好像，是在端茶水的机械人偶一样。{n}我举着那礼物盒，茫然地走了过去，……在金藏的面前站住了。,"I was like a puppet carrying tea.{n}I walked forward, bewildered, with the present held out in front of me, ......and stopped in front of Kinzo.","I was like a puppet carrying tea.{n}I walked forward, bewildered, with the present held out in front of me, ......and stopped in front of Kinzo.","I was like a puppet carrying tea.{n}I walked forward, bewildered, with the present held out in front of me, ......and stopped in front of Kinzo."
,"Without letting his expression change in the slightest, Kinzo slowly reached out and touched the present......","Without letting his expression change in the slightest, Kinzo slowly reached out and touched the present... "," Without letting his expression change in the slightest, Kinzo slowly reached out and touched the present......",金蔵は表情一つ変えずに、ゆっくりとプレゼントボックスに触れる……。,金蔵は表情一つ変えずに、ゆっくりとプレゼントボックスに触れる……。,"Ничуть не меняя выражение, он медленно протянул руку и прикоснулся к подарку......","Sem permitir que sua expressão mudasse minimamente, Kinzo lentamente esticou sua mão e tocou o presente......","Without letting his expression change in the slightest, Kinzo slowly reached out and touched the present......",金藏的表情毫無改變，慢慢地碰到了禮物盒子……。,金藏的表情毫无改变，慢慢地碰到了礼物盒子……。,"Without letting his expression change in the slightest, Kinzo slowly reached out and touched the present......","Without letting his expression change in the slightest, Kinzo slowly reached out and touched the present......","Without letting his expression change in the slightest, Kinzo slowly reached out and touched the present......"
Ushiromiya Kinzo,"""MmmmmAAAAAaaannnggeeee{-}e{-}e{-}e{-}e{-}e{-}e{-}e{-}e{-}e{-}e{-}e{-}e{-}e{-}e{-}e{-}eee!!!""","""AAAAAaaaaannnggeeeeeeeeeeeeeeeeeeeeee!!!"" ","""AAAAAaaaaannnggeeeeeeeeeeeeeeeeeeeeee!!!""",「んんんんん縁寿ぇえええぇえぇええぇぬぇええぇえぇえぇぇッ！！！」,「んんんんん縁寿ぇえええぇえぇええぇぬぇええぇえぇえぇぇッ！！！」,"""Э‐Э‐Э‐э‐э‐э‐э‐э‐э‐э‐э‐э‐э‐э‐энж!!!""","""MmmmmAAAAAaaannnggeeee{‐}e{‐}e{‐}e{‐}e{‐}e{‐}e{‐}e{‐}e{‐}e{‐}e{‐}e{‐}e{‐}e{‐}e{‐}e{‐}eee!!!""","""MmmmmAAAAAaaannnggeeee{-}e{-}e{-}e{-}e{-}e{-}e{-}e{-}e{-}e{-}e{-}e{-}e{-}e{-}e{-}e{-}eee!!!""",「嗯嗯嗯嗯緣壽————————————————————！！！」,「嗯嗯嗯嗯缘寿————————————————————！！！」,"""MmmmmAAAAAaaannnggeeee{-}e{-}e{-}e{-}e{-}e{-}e{-}e{-}e{-}e{-}e{-}e{-}e{-}e{-}e{-}e{-}eee!!!""","""MmmmmAAAAAaaannnggeeee{-}e{-}e{-}e{-}e{-}e{-}e{-}e{-}e{-}e{-}e{-}e{-}e{-}e{-}e{-}e{-}eee!!!""","""MmmmmAAAAAaaannnggeeee{-}e{-}e{-}e{-}e{-}e{-}e{-}e{-}e{-}e{-}e{-}e{-}e{-}e{-}e{-}e{-}eee!!!"""
,"In an instant, Ange was caught in a firm embrace, present and all.{n}Kinzo's white beard rubbed against her cheek.","In an instant, Ange was caught in a firm embrace, present and all. Kinzo's white beard rubbed against her cheek. ","In an instant, Ange was caught in a firm embrace, present and all. Kinzo's white beard rubbed against her cheek.",途端、プレゼントボックスごと激しく抱擁。金蔵はその白ヒゲを、縁寿の頬にぞりぞりと押し付ける。,途端、プレゼントボックスごと激しく抱擁。{n}金蔵はその白ヒゲを、縁寿の頬にぞりぞりと押し付ける。,Энджи вместе с подарком попала в крепкие объятия.{n}Об её щеку тёрлась белая борода Кинзо.,"Do nada, Ange foi pega em um forte abraço, com seu presente e tudo mais.{n}A barba branca de Kinzo roçou contra a bochecha dela.","In an instant, Ange was caught in a firm embrace, present and all.{n}Kinzo's white beard rubbed against her cheek.",突然，來了個連禮物盒子一起的深深擁抱。{n}金藏的白鬍子，扎在緣壽的小臉上蹭來蹭去。,突然，来了个连礼物盒子一起的深深拥抱。{n}金藏的白胡子，扎在缘寿的小脸上蹭来蹭去。,"In an instant, Ange was caught in a firm embrace, present and all.{n}Kinzo's white beard rubbed against her cheek.","In an instant, Ange was caught in a firm embrace, present and all.{n}Kinzo's white beard rubbed against her cheek.","In an instant, Ange was caught in a firm embrace, present and all.{n}Kinzo's white beard rubbed against her cheek."
Ushiromiya Kinzo,"""Grandpa......Grandpa is so happyyyyyyyyyyyyyy!! I'm so glad to be blessed with such lovely grandchildren!! I feel happyyyyyyy!! So happy the tears just won't...just won't stooo{-}o{-}o{-}o{-}o{-}o{-}o{-}o{-}oop!!""","""Grandpa...Grandpa is so happyyyyyyyyyyyyyy!! I'm so glad to be blessed with such lovely grandchildren!! I feel happyyyyyyy!! So happy the tears just won't...just won't stoooooooooooop!!"" ","""Grandpa......Grandpa is so happyyyyyyyyyyyyyy!! I'm so glad to be blessed with such lovely grandchildren!! I feel happyyyyyyy!! So happy the tears just won't...just won't stoooooooooooop!!""",「お祖父ちゃんはッ、お祖父ちゃんは嬉しいぞぉおおぉおぉぉ！！私はこんなにも可愛らしい孫たちを持てて嬉しい！！　嬉ちい！！　嬉ちくて涙が止まらん、止まらぬぅううぅぅぅうぅぅううう！！」,「お祖父ちゃんはッ、お祖父ちゃんは嬉しいぞぉおおぉおぉぉ！！　私はこんなにも可愛らしい孫たちを持てて嬉しい！！　嬉ちい！！　嬉ちくて涙が止まらん、止まらぬぅううぅぅぅうぅぅううう！！」,"""Дедуля...... дедуля так сча‐а‐а‐а‐астлив!!! Я так рад, что у меня такие милые внуки! Я сча‐а‐а‐а‐астлив! Так счастлив, что слёзы никак... никак не остана‐а‐а‐а‐авливаются!!!""","""O vovô......o vovô está tão feliiiiiiiiizzzzz!! Estou tão feliz por ter sido abençoado com uma netinha tão adorável!! Tão feliiiiiizzzz!! Tão feliz que as lágrimas não param...elas não querem para{‐}a{‐}a{‐}a{‐}a{‐}a{‐}a{‐}a{‐}arrr!!""","""Grandpa......Grandpa is so happyyyyyyyyyyyyyy!! I'm so glad to be blessed with such lovely grandchildren!! I feel happyyyyyyy!! So happy the tears just won't...just won't stooo{-}o{-}o{-}o{-}o{-}o{-}o{-}o{-}oop!!""",「爺爺我，爺爺我好高興哦哦哦哦哦哦哦！！我居然能擁有如此可愛的孫兒們真是高興！！太高興了！！高興得眼淚都止不住了，止不住啊嗚嗚嗚嗚嗚嗚嗚嗚嗚嗚嗚嗚！！」,「爷爷我，爷爷我好高兴哦哦哦哦哦哦哦！！我居然能拥有如此可爱的孙儿们真是高兴！！太高兴了！！高兴得眼泪都止不住了，止不住啊呜呜呜呜呜呜呜呜呜呜呜呜！！」,"""Grandpa......Grandpa is so happyyyyyyyyyyyyyy!! I'm so glad to be blessed with such lovely grandchildren!! I feel happyyyyyyy!! So happy the tears just won't...just won't stooo{-}o{-}o{-}o{-}o{-}o{-}o{-}o{-}oop!!""","""Grandpa......Grandpa is so happyyyyyyyyyyyyyy!! I'm so glad to be blessed with such lovely grandchildren!! I feel happyyyyyyy!! So happy the tears just won't...just won't stooo{-}o{-}o{-}o{-}o{-}o{-}o{-}o{-}oop!!""","""Grandpa......Grandpa is so happyyyyyyyyyyyyyy!! I'm so glad to be blessed with such lovely grandchildren!! I feel happyyyyyyy!! So happy the tears just won't...just won't stooo{-}o{-}o{-}o{-}o{-}o{-}o{-}o{-}oop!!"""
Ronoue Genji,""".........Master, your nose is running. ......That...and your dignity.""","""...Master, your nose is running. ...That...and your dignity."" ","""......Master, your nose is running. ......That...and your dignity.""",「………お館様。鼻水が。……ついでに威厳もお忘れなく。」,「………お館様。鼻水が。……ついでに威厳もお忘れなく」,"""......Господин, у вас из носа течёт. ......И ещё... ваше достоинство.""",""".........Mestre, seu nariz está escorrendo. ......E também...sua dignidade.""",""".........Master, your nose is running. ......That...and your dignity.""",「………老爺。流鼻涕了。……另外請別忘了威嚴。」,「………老爷。流鼻涕了。……另外请别忘了威严。」,""".........Master, your nose is running. ......That...and your dignity.""",""".........Master, your nose is running. ......That...and your dignity.""",""".........Master, your nose is running. ......That...and your dignity."""
Ushiromiya Kinzo,"""Oh, Genji, forgive me!! I...alwa{0}n{0}t{0}h{0}f{0}n{0}h{0}h{0}h{0}hnnn... *honkkkk*!!""","""Oh, Genji, forgive me!! I...alwa{0}n{0}t{0}h{0}f{0}n{0}h{0}h{0}h{0}hnnn... *sniffle*!!"" ","""Oh, Genji, forgive me!! *sniffle*!!""As the old man blew his nose, ",「うむッ、源次、すまぬ！！　あひおふあふぅううぅううぅぅぅぅッ！！　ずびびー！！」,「うむッ、源次、すまぬ！！　あひおふあふぅううぅううぅぅぅぅッ！！　ずびびー！！」,"""О, Генджи, прости меня! Я всегда‐а‐а‐а..."" *хлюп*!""","""Ah, Genji, me perdoe!! Eu...sempr{0}e{0}e{0}a{0}a{0}n{0}h{0}h{0}h{0}hnnn... *brrrr*!!""","""Oh, Genji, forgive me!! I...alwa{0}n{0}t{0}h{0}f{0}n{0}h{0}h{0}h{0}hnnn... *honkkkk*!!""",「嗯，源次，不好意思！！擤——————————！！唏嗞——！！」,「嗯，源次，不好意思！！擤——————————！！唏嗞——！！」,"""Oh, Genji, forgive me!! I...alwa{0}n{0}t{0}h{0}f{0}n{0}h{0}h{0}h{0}hnnn... *honkkkk*!!""","""Oh, Genji, forgive me!! I...alwa{0}n{0}t{0}h{0}f{0}n{0}h{0}h{0}h{0}hnnn... *honkkkk*!!""","""Oh, Genji, forgive me!! I...alwa{0}n{0}t{0}h{0}f{0}n{0}h{0}h{0}h{0}hnnn... *honkkkk*!!"""
,"As the old man blew his nose, he didn't look like he could possibly be anyone other than a kindly grandpa overcome with tears at his grandchildren's gifts.",he didn't look like he could possibly be anyone other than a kindly grandpa overcome with tears at his grandchildren's gifts. ,he didn't look like he could possibly be anyone other than a kindly grandpa overcome with tears at his grandchildren's gifts.,ハンカチで鼻をかむその姿は、孫たちからの贈り物に感涙を浮かべる、ただの好々爺にしか見えない。,ハンカチで鼻をかむその姿は、孫たちからの贈り物に感涙を浮かべる、ただの好々爺にしか見えない。,"Высморкавшись, старик не выглядел так, будто он может быть кем‐то другим, кроме доброго дедушки, проливающего слёзы благодарности за подарки внуков.","Enquanto o velho homem assoava seu nariz, ele não parecia ninguém mais além de um avô que foi às lágrimas diante dos presentes de seus netos.","As the old man blew his nose, he didn't look like he could possibly be anyone other than a kindly grandpa overcome with tears at his grandchildren's gifts.",看到金藏用手帕擤鼻涕的樣子，只會覺得，他是個被孫兒們的禮物感動而落淚的好爺爺而已。,看到金藏用手帕擤鼻涕的样子，只会觉得，他是个被孙儿们的礼物感动而落泪的好爷爷而已。,"As the old man blew his nose, he didn't look like he could possibly be anyone other than a kindly grandpa overcome with tears at his grandchildren's gifts.","As the old man blew his nose, he didn't look like he could possibly be anyone other than a kindly grandpa overcome with tears at his grandchildren's gifts.","As the old man blew his nose, he didn't look like he could possibly be anyone other than a kindly grandpa overcome with tears at his grandchildren's gifts."
Ushiromiya Kinzo,"""Thank you, Ange. I heard that you chose to come even though you weren't feeling well at all... I'm so glad...! Here, this is for you.""","""Thank you, Ange. I heard that you chose to come even though you weren't feeling well at all... I'm so glad...! Here, this is for you."" ","""Thank you, Ange. I heard that you chose to come even though you weren't feeling well at all... I'm so glad...! Here, this is for you.""",「ありがとう、縁寿。聞けば、体調が悪いのに無理をして来てくれたそうだな…。お祖父ちゃんは本当に嬉しいぞ…！　さぁ、お前にはこれだ。」,「ありがとう、縁寿。聞けば、体調が悪いのに無理をして来てくれたそうだな…。お祖父ちゃんは本当に嬉しいぞ…！　さぁ、お前にはこれだ」,"""Спасибо, Энджи. Я слышал, что ты решила приехать несмотря на плохое самочувствие... Я так рад!.. Вот, это тебе.""","""Obrigado, Ange. Eu fiquei sabendo que decidiu vir mesmo não estando muito bem... O vovô ficou muito feliz...! Aqui, este é o seu.""","""Thank you, Ange. I heard that you chose to come even though you weren't feeling well at all... I'm so glad...! Here, this is for you.""",「謝謝啊，緣壽。我聽說，你身體不好，還專門趕了過來…。爺爺真是高興極了…！來，這是給你的。」,「谢谢啊，缘寿。我听说，你身体不好，还专门赶了过来…。爷爷真是高兴极了…！来，这是给你的。」,"""Thank you, Ange. I heard that you chose to come even though you weren't feeling well at all... I'm so glad...! Here, this is for you.""","""Thank you, Ange. I heard that you chose to come even though you weren't feeling well at all... I'm so glad...! Here, this is for you.""","""Thank you, Ange. I heard that you chose to come even though you weren't feeling well at all... I'm so glad...! Here, this is for you."""
,He pressed a large gift box to Ange's chest.,He pressed a large gift box to Ange's chest. ,He pressed a large gift box to Ange's chest.,縁寿の胸に、大きなプレゼントボックスを押し付ける。,縁寿の胸に、大きなプレゼントボックスを押し付ける。,Он прижал к груди Энджи большую подарочную коробку.,Ele pressionou uma grande caixa de presente contra o peito de Ange.,He pressed a large gift box to Ange's chest.,緣壽的胸前，被塞了個大大的禮物盒子。,缘寿的胸前，被塞了个大大的礼物盒子。,He pressed a large gift box to Ange's chest.,He pressed a large gift box to Ange's chest.,He pressed a large gift box to Ange's chest.
