,I just happened to catch it at a bad moment...and was pretty freaked out seeing it for the first time... ,"This was just bad timing, and furthermore, it was the first time I'd seen it, so it really shocked me..."," This was just bad timing, and furthermore, it was the first time I'd seen it so it really shocked me...",タイミングがタイミングだったし、しかも俺は初めて見たから度肝を抜かれたが…。,[=JP],"Поскольку события совпали так неудачно, и, вдобавок к этому, я услышал это её хихиканье в первый раз — оно шокировало меня...","Foi apenas uma hora ruim e, além disso, foi a primeira vez que eu vi, por isso realmente me chocou...",不過由於現在正處於這種時候，再加上我是第一次目睹，還真是被她嚇到了…。,不过由于现在正处于这种时候，再加上我是第一次目睹，还真是被她吓到了…。,"In quest'occasione era successo in un momento delicato, e per di più, era la prima volta che la vedevo così quindi ero rimasto davvero scioccato...","Ne ero stupito perché era successo in un momento delicato, e per di più era la prima volta che la vedevo in quello stato, però...","Bu sadece kötü bir zamanlamaydı ve dahası, bunu ilk kez gördüğüm için beni gerçekten şok etti..."
Ushiromiya Battler,"""So what is that? Does Maria have a dual personality or something? Or are you saying that her spiritual sense really is that strong, and she's being possessed by a spirit or whatever?"" ","""So what is that? Does Maria have a dual personality or something? Or are you saying that her spiritual sense really is that strong, and she gets possessed by stuff like that?""","""So what is that? Does Maria have a dual personality or something? Or are you saying that her spiritual sense really is that strong, and she's being possessed by it?""",「あれってのは何なんだ？　真里亞は二重人格か何かなのか。それとも本当に霊感が強かったりとかして、そういうのに憑依されたりとかしちまうのかよ。」,「あれってのは何なんだ？　真里亞は二重人格か何かなのか。それとも本当に霊感が強かったりとかして、そういうのに憑依されたりとかしちまうのかよ」,"""Так что же это такое? У Марии раздвоение личности или как? Или ты хочешь сказать, что её духовное восприятие на самом деле настолько сильно и она одержима этим?""","""Então o que é isso? A Maria tem uma dupla personalidade ou algo assim? Ou você está dizendo que o sentido espiritual dela é realmente forte, e ela acaba sendo possuída por aquelas coisas?""",「她那到底是什麼啊？真里亞是有什麼雙重人格嗎？還是說她真的靈感特別強，被那類東西附身了嗎？」,「她那到底是什么啊？真里亚是有什么双重人格吗？还是说她真的灵感特别强，被那类东西附身了吗？」,"""Allora di che si tratta? Maria ha una doppia personalità o qualcosa del genere? Oppure stai dicendo che il suo sesto senso è particolarmente forte e lei ne è posseduta?""","""Cos'è quello che ha? Maria ha una doppia personalità o qualcosa del genere? Oppure mi stai dicendo che il suo sesto senso è talmente sviluppato da riuscire davvero a vedere gli spiriti?""","""Peki bu ne böyle? Maria'nın çift kişiliği falan mı var? Yoksa ruhani hislerinin gerçekten o kadar güçlü olduğunu ve öyle şeyler tarafından ele geçirildiğini mi söylüyorsunuz?"""
Ushiromiya George,"""...No, I don't think it's that. Haven't you ever experienced it? When you were small, didn't you ever want to be someone other than yourself?"" ","""...No, I don't think it's that. Didn't you ever experience it? A desire to be someone other than yourself, when you were small.""","""...No, I don't think it's that. Haven't you ever experienced it? When you were small, did you have someone other than yourself who you wanted to be?""",「…うーん、そういうのじゃないと思うよ。戦人くんにも経験ない？　小さい頃、自分以外の誰かになりたかったなんてこと。」,「…うーん、そういうのじゃないと思うよ。戦人くんにも経験ない？　小さい頃、自分以外の誰かになりたかったなんてこと」,"""...Нет, думаю, это не то. Разве ты никогда не испытывал такого? Когда ты был маленьким, был ли у тебя кто‐то, кроме тебя, кем бы ты хотел быть?""","""...Não, eu não acho que seja isso. Você nunca experimentou isso? Um desejo de ser alguém além de você, quando você era pequeno.""",「…唔，我覺得不是這樣。戰人君小時候有沒有這樣想過？想變成自己以外的別人。」,「…唔，我觉得不是这样。战人君小时候有没有这样想过？想变成自己以外的别人。」,"""... No, non penso sia questo. Non ti è mai successo? Quando eri piccolo, non c'era qualcuno diverso da te stesso che aspiravi ad essere?""","""...No, non penso sia qualcosa di simile. A te non è mai successo, Battler? Quando eri piccolo non hai mai voluto essere qualcun altro, uno diverso da te stesso?""","""...Hayır, öyle olduğunu sanmıyorum. Battler-kun, sen hiç tecrübe etmedin mi? Küçükken kendinden başka biri olma arzusu."""
,"When humans are born, no one has any individuality. However, when they reach their growth period, their sense of self starts to be born. ","Right when humans are born, no one has any individuality.{n}However, when they reach their growth period, and their sense of self starts to be born, they start to gain a sense of individuality.","Right when humans are born, no one has any individuality,Even so, when they reach their growth period, their sense of self starts to be born, and they start to gain a sense of individuality.",人間、生まれたばかりの時は誰だって没個性だ。ところが成長期を迎え、自我ってやつが生まれ始めると、没個性なのが許せなくなる。,人間、生まれたばかりの時は誰だって没個性だ。{n}ところが成長期を迎え、自我ってやつが生まれ始めると、没個性なのが許せなくなる。,"Когда люди рождаются, ни у кого нет никакой индивидуальности.{n}Несмотря на это, когда они достигают периода роста, в них начинает рождаться чувство себя, и они начинают приобретать чувство индивидуальности.","Assim que os humanos nascem, eles não têm nenhum tipo de individualidade.{n}No entanto, quando eles chegam no período de crescimento e seu senso de si mesmo começa a nascer, eles passam a ganhar um senso de individualidade.",任何一個人，在剛出生的時候都是沒有個性的。{n}但是在迎來成長期，有了自我意識之後，就會開始不允許自己沒有個性。,任何一个人，在刚出生的时候都是没有个性的。{n}但是在迎来成长期，有了自我意识之后，就会开始不允许自己没有个性。,"Nel momento in cui gli esseri umani nascono, nessuno possiede un'individualità propria. Tuttavia, quando raggiungono l'età dello sviluppo, iniziano ad essere coscienti di se stessi e cominciano a sviluppare un senso di individualità.","Quando sono appena nate, le persone sono prive di ogni tipo d'identità.{n}Ma quando raggiungono l'età dello sviluppo, iniziano ad acquisire coscienza di sé, e la loro mancanza di individualità svanisce.","İnsanlar doğdukları zaman, kişiliğe sahip değillerdir.{n}Ancak büyüme dönemine ulaştıklarında ve benlik duyguları oluşmaya başladığında, kişilik kazanmaya başlarlar."
,They want to be different than other people. ,They want to be different from other people., They want to be different from other people.,人と違う何かを持ちたくなる。,[=JP],Они хотят отличаться от других людей.,Eles querem ser diferentes das outras pessoas.,想讓自己身上有和別人不一樣的特徵。,想让自己身上有和别人不一样的特征。,Vogliono essere diversi dalle altre persone.,Vogliono essere diversi rispetto agli altri in qualcosa...,Diğer insanlardan farklı olmak isterler.
,"...But since everyone else in their class is learning the same things at the same rate and being forced into the same lifestyle, of course they aren't going to find anything that makes them different from everyone else around them. ","...But of course, they will find that they're no different from the others in their class, since they are learning the same thing in school and forced into the same lifestyle.","...But that doesn't mean that they will find that they're different from the others in their class, since they are learning the same thing in school and forced into the same lifestyle.",…しかしだからと言って、学校で等しく同じことを習い、同じ生活を強いられている自分に、クラスの他の連中と違う何かを得られるはずもない。,[=JP],"...Но это не значит, что они будут отличаться от других в своём классе, потому что в школе их учат тем же вещам и заставляют вести одинаковый образ жизни.","...Mas é claro, eles vão descobrir que não são diferentes dos outros em suas classes, já que eles aprendem as mesmas coisas na escola e são forçados a terem o mesmo estilo de vida.",…雖是這麼說，但被迫在學校學同樣的東西，過同樣的生活的自己，是沒有可能得到和班上其他同學們不一樣的特徵的。,…虽是这么说，但被迫在学校学同样的东西，过同样的生活的自己，是没有可能得到和班上其他同学们不一样的特征的。,"... Ma questo non significa che scopriranno di essere diversi dagli altri nella loro classe, dato che impareranno le stesse cose a scuola e condurranno lo stesso stile di vita.","Ma non è detto che scopriranno qualcosa che li contraddistinguerà dagli altri della loro classe, dato che a scuola impareranno in maniera simile le stesse nozioni, e verrà imposto loro lo stesso stile di vita.","...Ancak elbette, okulda aynı şeyi öğrendikleri ve aynı yaşam tarzına zorlandıkları için, sınıflarındaki diğerlerinden farklı olmadıklarını fark edeceklerdir."
,"Once they realize that, the first thing they do is to start breaking the rules, in what's called their rebellious stage. Since everyone else follows the rules, they want to show off their individuality by breaking them. ","When they realize that, they start off by breaking the rules, in what's called the rebellious age.{n}Since everyone follows the rules, they want to show off their individuality by breaking them."," When they realize that, they start off by breaking the rules, in what's called the rebellious age. Since everyone follows the rules, they want to show off their individuality by breaking them.",すると最初に始めるのはルール破り、いわゆる反抗期だ。みんながルールを守るから、自分だけルールを破って個性を示したい。,すると最初に始めるのはルール破り、いわゆる反抗期だ。{n}みんながルールを守るから、自分だけルールを破って個性を示したい。,"Когда они понимают это, они начинают нарушать правила во время так называемого трудного возраста.{n}...Поскольку все следуют правилам, они хотят показать свою индивидуальность, нарушая их.","Quando eles percebem isso, começam então a quebrar as regras, é a chamada fase de rebeldia.{n}Já que todos seguem as regras, eles querem mostrar suas individualidades quebrando‐as.",所以最開始的第一步就是違反規則，也就是大家常說的叛逆期。{n}因為大家都遵守規矩，所以自己就想通過違反規則來彰顯個性。,所以最开始的第一步就是违反规则，也就是大家常说的叛逆期。{n}因为大家都遵守规矩，所以自己就想通过违反规则来彰显个性。,"Quando se ne accorgono, iniziano innanzitutto a infrangere le regole durante quella che viene chiamata l'età della ribellione. Siccome tutti seguono le regole, loro vogliono dimostrare la loro individualità infrangendole.","Al che la prima cosa che fanno è infrangere le regole, durante la cosiddetta età della ribellione. Siccome tutti seguono le regole, infrangendole, vogliono affermare la loro individualità...","Bunun farkına vardıklarında, asilik çağı olarak adlandırılan dönemde kuralları çiğneyerek işe başlarlar.{n}Herkes kurallara uyduğu için, kuralları çiğneyerek bireyselliklerini göstermek isterler."
,"...So even those who try to act tough, mocking everyone around them and calling them childish... can actually be viewed as cute kids searching for themselves, if you look at it this way. ",...Even those who call everyone around them babies and stir up trouble...are just cute kids searching for themselves when you look at them this way.,"...Even people who call this behavior childish and make fun of it, will realize that it's just a cute kid searching for themselves when they look at it this way.",…周りを子どもっぽいと言って馬鹿にしながらワルぶる連中も、こうして見りゃあ可愛いお子様の自分探しってわけだ。,[=JP],"Даже те, кто называет такое поведение детским и смеётся над ним, поймут, если взглянут на это с точки зрения, что таким образом милый ребёнок просто ищет себя.",...Mesmo aqueles que chamam todos a sua volta de bebês e se agitam com problemas...são apenas crianças fofas procurando por si mesmas quando você os olha dessa forma.,…那些嘲笑周圍的人幼稚，欺負同學的壞孩子們，從這個角度看，也不過就是在尋找自我的可愛小孩而已。,…那些嘲笑周围的人幼稚，欺负同学的坏孩子们，从这个角度看，也不过就是在寻找自我的可爱小孩而已。,"... Anche le persone che definiscono questo comportamento infantile e ne ridono, capiranno che si tratta solo di un adorabile marmocchio che cerca se stesso, quando guarderanno questa storia sotto questa luce.","Anche le persone attorno a loro che con fare gradasso derideranno questi comportamenti, definendoli infantili, guardando le cose da quella prospettiva, capiranno che si tratta solo di un adorabile marmocchio alla ricerca di sé stesso...",...Etrafındaki herkese bebek diyen ve ortalığı birbirine katanlar bile...bu şekilde baktığınızda sadece kendilerini bulmaya çalışan sevimli çocuklardır.
,"...Well, I'm lecturing about all this like I'm so smart, but I actually got it secondhand from George-aniki. ","......Well, I'm lecturing about all this like I'm so smart, but I actually got it second‐hand from George‐aniki.","......Well, I'm lecturing about all this like I'm so smart, but I actually got it second hand from George-aniki.",……なんて、偉そうに講釈を垂れてるが、この辺は譲治の兄貴の受け売りだ。,[=JP],"......Ну, я читаю об этом лекцию, как будто я такой умный, но на самом деле я сам всё это узнал от Джорджа‐аники.","......Bem, eu estou falando tudo isso como se eu fosse entendido, mas na verdade eu ouvi tudo do George‐aniki.",……雖然我好像挺了不起似的講解了這麼多，但其實這些都是在照搬讓治大哥的話。,……虽然我好像挺了不起似的讲解了这么多，但其实这些都是在照搬让治大哥的话。,"... Beh, sto parlando di questa roba come fossi un genio, ma in realtà l'ho sentita prima da George-aniki.","Beh, sto facendo uno spiegone come un saccente, ma sto solo ripetendo quello che diceva il fratellone George.",......Bütün bunları çok akıllıymışım gibi anlatıyorum ama aslında bunları George-aniki'den ikinci elden öğrendim.
,I myself was one of those embarrassing guys who thought it was cool to act like a little bastard... ,I myself was one of those embarrassing guys who thought it was cool to act like a little bastard..., I myself was one of those embarrassing guys who thought it was cool to act like a little bastard...,俺自身、小悪党ぶっててそれがカッコイイと思ってきた恥ずかしいヤツでもある…。,[=JP],"Я и сам был одним из тех глупых парней, которые думают, что вести себя, как маленький ублюдок — это круто...",Eu mesmo sou um daqueles caras que ficam envergonhados quando pensam que estão sendo legais como aquele desgraçado...,就連我自己，也是個愛裝壞還自以為很帥的丟人玩意…。,就连我自己，也是个爱装坏还自以为很帅的丢人玩意…。,Io stesso ero uno di quei ragazzini vergognosi che pensavano che comportarsi come dei piccoli bastardi fosse figo...,Io stesso ero uno di quei ragazzini antipatici che pensavano fosse figo comportarsi come delle piccole carogne...,Ben de küçük bir piç gibi davranmanın havalı olduğunu düşünen o utanç verici adamlardan biriydim...
,"Well, that was when I was at the age where you try to show off for the opposite sex. ","Well, that was when I was the age where you try standing out for the opposite sex."," Well, that was when I was the age where you try standing out for the opposite sex.",まぁ、そうして目立って、異性の気を引きたいお年頃もあったと。,[=JP],"Ну, я вёл себя так в том возрасте, когда ты пытаешься выделиться перед противоположным полом.","Bem, isso foi quando eu estava na idade onde você tenta se opor ao sexo oposto.",不過嘛，這個年紀，本就是會想要以此來引起異性的注意。可能這也是原因之一吧。,不过嘛，这个年纪，本就是会想要以此来引起异性的注意。可能这也是原因之一吧。,"Ecco, ero nell'età in cui cerchi di farti notare dal sesso opposto.","Beh, sapete, quando si è nell'età in cui si vuole farsi notare per attirare l'attenzione del sesso opposto...","Yani, o zamanlar karşı cinsin dikkatini çekmeye çalıştığım yaşlardaydım."
Ushiromiya George,"""The main feature of the growing period lies in an impulse to break away from your life as a kid, like a chick trying to crack open the shell of their egg. Do you know what makes children and adults different?"" ","""At the very foundation of the growing period is an impulse to escape from being a kid, much the same as a chick trying to crack the shell of their egg. Do you know what the difference between a child and an adult is?""","""The whole point of the growing period is that people try to separate themselves from being a kid. It's the same impulse as a chick trying to crack the shell of their egg. Do you know what the difference between a child and an adult is?""",「成長期の根底には子どもから脱却したいという、ヒヨコが殻を破るのに似た衝動がある。子どもと大人の違いは何かわかるかい？」,[=JP],"""Весь смысл периода роста заключается в том, что люди пытаются отречься от себя‐ребёнка. Это тот же порыв, что и у цыплёнка, пытающегося пробить скорлупу яйца. Знаешь ли ты разницу между ребёнком и взрослым?""","""Bem no começo desse período de crescimento, cada fundamento é um impulso para escapar de ser uma criança, assim como um pintinho tentando quebrar a casca de seu ovo. Você sabe qual a diferença entre uma criança e um adulto?""",「成長期的本質之中，存在著一種類似於小雞破殻一般的，想要擺脫小孩子身份的衝動。知道小孩和大人的不同之處是什麼嗎？」,「成长期的本质之中，存在着一种类似于小鸡破壳一般的，想要摆脱小孩子身份的冲动。知道小孩和大人的不同之处是什么吗？」,"""La caratteristica principale della crescita è che le persone cercando di dimostrare che non sono più bambini. È lo stesso impulso che spinge un pulcino a rompere il guscio dell'uovo. Sapete qual è la differenza tra un bambino e un adulto?""","""Alla base dell'età dello sviluppo risiede l'impulso di liberarsi della propria infantilità, simile all'istinto di un pulcino di rompere il suo guscio. Conosci la differenza fra un bambino e un adulto?""","""Büyüme döneminin temelinde çocuk olmaktan kaçma dürtüsü vardır, tıpkı bir civcivin yumurtasının kabuğunu kırmaya çalışması gibi. Bir çocuk ile bir yetişkin arasındaki fark nedir biliyor musunuz?"""
Ushiromiya Battler,"""Age? Or do you mean size?"" ","""Age? Or physique?""","""Age? Or is it the condition of their body?""",「年齢？　それとも体格？」,[=JP],"""Возраст? Или может состояние тела?""","""Idade? Ou o físico?""",「年齡？還是體格？」,「年龄？还是体格？」,"""L'età? O l'aspetto fisico?""","""L'età? O la corporatura?""","""Yaş mı? Yoksa fiziği mi?"""
Ushiromiya George,"""No, it's experience. Adults can look down on children because children have very little life experience. The reason they snort at everything children say...is because they think kids know nothing about the real world."" ","""No, it's experience. Adults look down on children because children have very little life experience. The reason they snort and look down on children whenever they say anything is because children don't know anything about the world.""","""No, it's experience. Adults can look down on children because children have very little life experience. The reason they snort and look down on children whenever they say anything is because children don't know anything about the world.""",「違うよ、経験だよ。大人が子ども見下すのは人生経験が少ないからだよ。子どもが何を言っても鼻で笑ってしまうのは、世間知らずのくせにと見下しているからだよ。」,「違うよ、経験だよ。大人が子ども見下すのは人生経験が少ないからだよ。子どもが何を言っても鼻で笑ってしまうのは、世間知らずのくせにと見下しているからだよ」,"""Нет, это опыт. Взрослые могут смотреть свысока на детей, потому что у детей очень маленький жизненный опыт. Причина того, что они смеются и смотрят свысока на детей каждый раз, когда они что‐нибудь скажут, заключается в том, что дети ничего не знают о мире.""","""Não, é a experiência. Adultos olham as crianças de cima porque elas possuem poucas experiências de vida. O motivo deles zombarem e desprezarem qualquer coisa que as crianças dizem é porque as crianças não sabem nada sobre o mundo.""",「不對，是經驗。大人會輕視小孩子們，是因為小孩的人生經驗比較少。之所以大人們不管聽到小孩子說什麼都會嗤之以鼻，是因為懷著輕視的心態，覺得他們什麼都不懂。」,「不对，是经验。大人会轻视小孩子们，是因为小孩的人生经验比较少。之所以大人们不管听到小孩子说什么都会嗤之以鼻，是因为怀着轻视的心态，觉得他们什么都不懂。」,"""No, è l'esperienza. Gli adulti possono prendere alla leggera i bambini perché questi hanno pochissima esperienza. Il motivo per cui sbuffano e non prendono sul serio i bambini quando dicono qualcosa è perché i bambini non sanno nulla del mondo.""","""No, è l'esperienza. Gli adulti sono accondiscendenti coi bambini perché questi ultimi hanno pochissima esperienza di vita. Si finisce per ridere con fare assecondante a quello che dicono i bambini, perché guardano tutti dall'alto in basso, pur non sapendo nulla di come funziona il mondo.""","""Hayır, deneyimdir. Yetişkinler çocuklara tepeden bakar çünkü çocukların çok az hayat deneyimi vardır. Çocuklar bir şey söylediklerinde burun kıvırmalarının ve onları küçümsemelerinin nedeni, çocukların dünya hakkında hiçbir şey bilmemeleridir."""
