Ushiromiya Battler,"...No, in the first place, they chose the wrong time of day to do it. If this invisible 19th person really wanted to show themselves, they had to make sure that the crime took place {i:under conditions which proved that the remaining twelve people were all innocent}. ","""...No, in the first place, the timing was a mistake. If this invisible 19th person really wanted to show themselves, they had to make sure that the crime took place {i:under conditions which proved that the remaining twelve people were all innocent}.""","...No, in the first place, it was a mistake in the timing. If this invisible 19th person really wanted to show themselves, they had to make sure that the crime took place under conditions which proved that the remaining twelve people were all innocent.",…いや、そもそも時間帯がミステイクだ。不可視の１９人目をアピールするためには、死んだ６人以外の１２人が{i:全員シロであることが確定している状況下で行われなければならない。},「…いや、そもそも時間帯がミステイクだ。不可視の１９人目をアピールするためには、死んだ６人以外の１２人が、{i:全員シロであることが確定している状況下で行われなければならない}」,"""...Нет, в первую очередь было подобрано не то время. Если бы 19‐й человек действительно хотел дать о себе знать, ему следовало бы убедиться, что преступление было совершено {i:при условиях, которые указывали бы, что все оставшиеся двенадцать человек являются невиновными}.""","""...Não, em primeiro lugar, o {i:timing} foi um erro. Se essa 19ª pessoa invisível quer se mostrar para nós, ela deveria ter cometido o crime em algum lugar {i:sob a condição que provasse que as doze pessoas restantes eram todas inocentes}.""",「…不對，應該說時間段本身就選錯了。要展示出看不見的第十九人的存在，必須在除死去的六人以外的十二人，{i:全都可以證實是清白的情況下下手}。」,「…不对，应该说时间段本身就选错了。要展示出看不见的第十九人的存在，必须在除死去的六人以外的十二人，{i:全都可以证实是清白的情况下下手}。」,"... No, in primo luogo, è stato un errore di tempismo. Se questa invisibile diciannovesima persona avesse voluto davvero farsi notare, avrebbe dovuto accertarsi che il crimine avesse luogo in condizioni che potessero provare che le restanti dodici persone fossero innocenti.","""Anzi, ha proprio scelto il momento sbagliato della giornata per farlo. Se questa 19ª persona invisibile avesse davvero voluto mettersi in mostra, avrebbe dovuto commettere il crimine {i:in un contesto che potesse dimostrare l'innocenza di tutte le restanti dodici persone}.""","""...Hayır, her şeyden önce zamanlama bir hataydı. Eğer bu görünmez 19. kişi gerçekten kendini göstermek istediyse, suçun, {i:geri kalan on iki kişinin masum olduğunu kanıtlayan koşullar altında} gerçekleştiğinden emin olmak zorundaydılar."""
Ushiromiya Battler,"""As long as there's a single human we can suspect, this 19th person's attempt to highlight their presence fails. That's why near midnight, when everyone's alibis are at their vaguest, the 19th person's existence is also at its vaguest. And yet, the culprit chose to commit the crime at that time."" ","""Unless there are no suspicious humans, they can't prove that they exist. So by killing them in the middle of the night, when everyone's alibi was at its most ambiguous, whether or not this 19th person exists was also at its most ambiguous. Even so, they chose that time to commit the crime."""," Unless there are no suspicious humans, they can't prove that they exist. So by killing them in the middle of the night, when everyone's alibis were at their most ambiguous, whether or not this 19th person exists was also at its most ambiguous. Even so, they chose that time to commit the crime.""",疑わしい人間がゼロにならなきゃ、自分の存在をアピールできないんだよ。だから、全員のアリバイが一番あやふやになる深夜の時間帯は、１９人目にとって自分が一番あやふやになる時間帯でもある。にもかかわらず、その時間を選んで犯行に及んだ。」,「疑わしい人間がゼロにならなきゃ、自分の存在をアピールできないんだよ。だから、全員のアリバイが一番あやふやになる深夜の時間帯は、１９人目にとって自分が一番あやふやになる時間帯でもある。にもかかわらず、その時間を選んで犯行に及んだ」,"""Они смогут доказать своё существование только если нет подозрительных людей. Поэтому, при совершении убийства ночью, когда у всех было ненадёжное алиби, существование этого 19‐го человека остаётся под большим вопросом. Но, даже несмотря на такой расклад, они выбрали именно это время для совершения преступления.""","""Enquanto houver ao menos um humano suspeito, a tentativa dela de provar sua existência falha. Por isso, ao cometer o crime no meio da noite, quando todos têm álibis ambíguos, a existência ou não dessa 19ª pessoa também é ainda mais ambígua. Mesmo assim, ela escolheu aquela hora para cometer o crime.""",「只要可疑的人物不為零，他就是證明不了自己的存在的。所以，深夜這一所有人的不在場證明最為含糊不清的時間段，對這第十九人而言，也是自己的存在最為模棱兩可的時間段。可他偏偏還是選了這個時間下手。」,「只要可疑的人物不为零，他就是证明不了自己的存在的。所以，深夜这一所有人的不在场证明最为含糊不清的时间段，对这第十九人而言，也是自己的存在最为模棱两可的时间段。可他偏偏还是选了这个时间下手。」,"A meno che non ci siano umani sospetti, non può provare che esista. {n}Quindi uccidendoli nel cuore della notte, quando gli alibi di tutti quanti erano nel momento più ambiguo, anche il fatto che questa diciannovesima persona esista era al massimo dell'ambiguità. Eppure, ha scelto quell'ora per commettere il crimine.""","""Finché c'è anche solo un umano di cui possiamo sospettare, la 19ª persona non è riuscita a rendere chiara la sua esistenza. Ecco perché la mezzanotte, un orario in cui l'alibi di ognuno di noi è il più incerto, è anche l'orario più incerto per questa 19ª persona. Eppure, il colpevole ha scelto di commettere il crimine in quel momento.""","""Şüpheli insanlar olduğu sürece, var olduklarını kanıtlayamazlar. Dolayısıyla, herkesin mazeretinin en belirsiz olduğu gece yarısı onları öldürerek, 19. kişinin var olup olmadığını da en belirsiz hale getirmiş oldular. Yine de suçu işlemek için o zamanı seçtiler."""
Ushiromiya George,"""...By committing the crime then, one of the 18 would obviously be suspected. ...And yet, someone handed Maria the letter and called themselves a witch, even though everyone denies they did it."" ","""......By committing the crime then, it's obvious that one of the 18 would be suspected. ...Yet they took the name of the witch and handed Maria the letter, and everyone denies doing it.""","""......By committing the crime then, it's obvious that one of the 18 would be suspected. ...Even so, everyone has denied that they were the one who took the name of the witch and handed Maria the letter.""",「……そんな時間に犯行を起こせば、１８人の誰かが疑われるのは明白。…にもかかわらず、真里亞に手紙を渡して魔女を名乗り、誰もが自分でないと否定している。」,「……そんな時間に犯行を起こせば、１８人の誰かが疑われるのは明白。…にもかかわらず、真里亞に手紙を渡して魔女を名乗り、誰もが自分でないと否定している」,"""......И при таких условиях совершения преступления становится очевидно, что один из восемнадцати окажется под подозрением. ...Но тем не менее никто так и не признался, что взял имя ведьмы и вручил Марии письмо.""","""......Ao cometer o crime, é óbvio então que um dos 18 seria suspeito. ...E ainda assim, ela tomou o nome da bruxa e deu a carta à Maria, e todos negaram isso.""",「……若是在這種時間犯罪，那受到懷疑的明顯會是十八人中的某人。…然而每個人卻都否認稱，自稱魔女並把信交給真里亞的，不是自己。」,「……若是在这种时间犯罪，那受到怀疑的明显会是十八人中的某人。…然而每个人却都否认称，自称魔女并把信交给真里亚的，不是自己。」,"""... Così facendo, è ovvio che sarebbe stato sospettato uno dei diciotto. ... Tuttavia, tutti hanno negato di aver preso il nome della strega e aver dato la lettera a Maria.""","""...Commettendo il crimine a quell'ora, uno di noi diciotto sarebbe stato certamente sospettato... Ciononostante, qualcuno ha consegnato una lettera a Maria definendosi una strega, e tutti negano di essere stati loro a farlo.""","""......Suçu o zaman işleselerdi, 18 kişiden birinden şüphelenileceği aşikârdı. ...Yine de, birisi Maria'ya mektubu verdi ve herkes bunu inkâr edecek olsa da kendisine cadı dedi."""
Ushiromiya Jessica,"""In other words, ...you're trying to say that one of the 18 is trying to make it look like a 19th person called {f:5:Beatrice} exists...? ","""In other words, ......you're trying to say that one of the 18 is trying to make it look like a 19th person called {f:5:Beatrice} exists...?""","""In other words, ......you're trying to say that one of the 18 is trying to make it look like a 19th person called Beatrice exists...? ",「つまり、……ベアトリーチェという１９人目がいるように見せ掛けたい人間が、１８人の中にいると、こう言いたいのかよ…？,「つまり、……ベアトリーチェという１９人目がいるように見せ掛けたい人間が、１８人の中にいると、こう言いたいのかよ…？」,"""Другими словами... Ты хочешь сказать, что один из восемнадцати пытается создать видимость существования 19‐го человека по имени {f:5:Беатриче}?..""","""Em outras palavras, ......você está tentando dizer que um dos 18 está tentando parecer ser uma 19ª pessoa chamada {f:5:Beatrice}...?""",「也就是說，……想製造出“第十九人貝阿朵莉切真實存在”這一假象之人，就在十八人之中，是這個意思嗎…？」,「也就是说，……想制造出“第十九人贝阿朵莉切真实存在”这一假象之人，就在十八人之中，是这个意思吗…？」,"""In altre parole... stai cercando di dire che uno dei diciotto sta cercando di far sembrare che esista una diciannovesima persona chiamata Beatrice...?","""In altre parole... stai cercando di dire che uno di noi diciotto vuole farci credere che esista una 19ª persona che si chiama {f:5:Beatrice}...?""","""Yani, ......18 kişiden birinin {f:5:Beatrice} adında bir 19. kişiyi gerçekten varmış gibi göstermeye çalıştığını mı söylemeye çalışıyorsun...?"""
Ushiromiya Jessica,"That's a pretty crazy idea... ...I think Mom's theory about someone hiding outside the mansion is a bit more credible... ...Battler, don't tell me you actually think someone in this room is the culprit..."" ","""That's pretty crazy...... ...I think my mom's theory that someone is hiding outside the mansion is a little more credible... ...Battler, don't tell me you actually suspect that someone in this room is the culprit...?""","That's pretty crazy.........I think that my mom's theory that someone is hiding outside the mansion is a little more credible......Battler, do you actually suspect that someone in this room is the culprit...?""",何だかぶっ飛んだ発想だな……。…まだお袋の、屋敷の外に不審者が潜んでいるって話の方が信憑性があるってもんだぜ…。…まさか戦人は、この客間の中に犯人がいると疑っているのかよ…？」,「何だかぶっ飛んだ発想だな……。…まだお袋の、屋敷の外に不審者が潜んでいるって話の方が信憑性があるってもんだぜ…。…まさか戦人は、この客間の中に犯人がいると疑っているのかよ…？」,"""Это слишком безумно...... ...Я считаю, что теория моей мамы, что кто‐то скрывается в этом особняке, наиболее вероятна... ...Баттлер, ты думаешь, что в этом зале в самом деле находится преступник?..""","""Isso é bem maluco...... ...Eu acho a teoria da minha mãe de que tem alguém escondido fora da mansão é muito mais crível... ...Battler, não me diga que você suspeita mesmo que alguém nesta sala é o culpado...?""",「這個想法有夠飛越的啊……。…相比之下，還是老媽說的屋外潛伏著可疑者的說法更有可信度嘞…。…難道戰人你懷疑犯人就在這客廳之中嗎…？」,「这个想法有够飞越的啊……。…相比之下，还是老妈说的屋外潜伏着可疑者的说法更有可信度嘞…。…难道战人你怀疑犯人就在这客厅之中吗…？」,"È piuttosto folle... penso che la teoria di mia Madre che qualcuno si stia nascondendo fuori dalla villa sia un po' più credibile... Battler, sospetti davvero che qualcuno in questa stanza sia il colpevole...?""","""È un'ipotesi molto azzardata... Credo che la teoria di mia madre che qualcuno si stia nascondendo fuori dalla villa sia più credibile... Battler, non dirmi che sospetti che il colpevole sia in questo salotto...""","""Bu çok çılgınca...... ...Bence annemin birinin malikanenin dışında saklandığına dair teorisi biraz daha inandırıcı... ...Battler, sakın bana gerçekten bu odadaki birinin suçlu olduğundan şüphelendiğini söyleme...?"""
Ushiromiya Battler,"""I do. ...Someone's trying to force us to accept that {f:5:Beatrice} exists. ...That's right, this whole thing started as far back as the letter last night. ...I don't have any basis or proof, ","""Yeah. ...Someone trying to force us to accept that {f:5:Beatrice} exists. ......That's right, the letter last night is when this whole thing started. ...I don't have any basis or proof, but...""","""Yeah. ...Someone trying to force us to accept that Beatrice exists. ......That's right, the letter last night is when this whole thing started. ...I don't have any basis or proof, but... ",「あぁ。…何者かが、俺たちにベアトリーチェが存在すると、認めさせようとしている。……そうさ、昨夜のあの手紙からもう事件は始まっていたんだ。…証拠も根拠も何もねぇけどな…。,「あぁ。…何者かが、俺たちにベアトリーチェが存在すると、認めさせようとしている。……そうさ、昨夜のあの手紙からもう事件は始まっていたんだ。…証拠も根拠も何もねぇけどな…」,"""Да. ...Кто‐то пытается заставить нас поверить в существование {f:5:Беатриче}. ......Точно, всё началось прошлым вечером с этим письмом. ...Я не могу этого обосновать или привести этому доказательства, но...""","""Sim. ...Alguém está tentando nos forçar a aceitar que a {f:5:Beatrice} existe. ......Isso mesmo, tudo começou com aquela carta ontem à noite. ...Eu não tenho nada para usar como base ou uma prova, mas...""",「沒錯。…有人，想讓我們承認貝阿朵莉切的存在。……就是這樣，昨晚收到那封信時事件就已經開始了。…雖說是什麼證據都沒有…」,「没错。…有人，想让我们承认贝阿朵莉切的存在。……就是这样，昨晚收到那封信时事件就已经开始了。…虽说是什么证据都没有…」,"""Sì. ... Qualcuno che sta cercando di costringerci ad accettare che Beatrice esista. ... Giusto, è cominciato tutto con la lettera della scorsa notte. ... Non ho alcuna base o prova, ma...","""Sì... Qualcuno sta cercando di costringerci ad accettare che {f:5:Beatrice} esista... Proprio così, tutto ebbe già inizio con quella lettera di ieri sera... Non ho né basi, né prove...","""Evet. ...Birisi bizi {f:5:Beatrice}'in varlığını kabul etmeye zorluyor. ......Doğru, bütün bunlar dün geceki mektupla başladı. ...Herhangi bir dayanağım ya da kanıtım yok ama..."""
Ushiromiya Battler,"...but with the chessboard turned around, this is my best guess."" ","""......With the chessboard upside‐down, this is my best guess.""","......With the chessboard upside-down, this is my best guess.""",……チェス盤を逆さにした限りじゃ、俺の見立てはこんなところだ。」,「……チェス盤を逆さにした限りじゃ、俺の見立てはこんなところだ」,"""......Это лучшее предположение, которое я могу сделать, развернув шахматную доску.""","""......Com o tabuleiro virado, esta é a minha melhor aposta.""",「……但是把棋盤反過來看的話，我的見解就是如此。」,「……但是把棋盘反过来看的话，我的见解就是如此。」,"... Capovolgendo la scacchiera, questa è la mia miglior ipotesi."""," Ma se rigiro la scacchiera, questa è la mia congettura.""","""......Satranç tahtasını ters çevirmemle beraber, bu benim en iyi tahminim."""
Ushiromiya Jessica,"""...Seriously, that's too crazy... You sure you haven't been reading too many weird detective novels...?"" ","""......Seriously, that's too crazy... Haven't you been reading too many weird detective novels...?""",[=UP],「……ぶっ飛びまくってるにも程があるぜ…。妙な推理小説の読みすぎじゃねぇのかよ…。」,「……ぶっ飛びまくってるにも程があるぜ…。妙な推理小説の読みすぎじゃねぇのかよ…」,"""......Нет, это уж слишком... Тебе не кажется, что ты слишком увлёкся чтением детективов?..""","""......Sério, isso é loucura demais... Você não tem lido muitas histórias estranhas de detetive ultimamente...?""",「……放飛想像也該有個限度嘞…。亂七八糟的推理小說讀太多了吧…」,「……放飞想象也该有个限度嘞…。乱七八糟的推理小说读太多了吧…」,"""... Seriamente, è troppo assurdo... non avrai letto troppe strane storie di detective...?""","""...Ma è troppo assurda... Devi aver letto troppi romanzi gialli strani...""","""......Cidden, bu çok çılgınca... Çok fazla tuhaf dedektiflik romanı okumuyor musun...?"""
Ushiromiya George,"""However, it's an angle we can't ignore. ...Whether there's a 19th person or not, the culprit's definitely planning something involving that rule about this island. ","""But it does hit on a point that we can't ignore. ......Whether there's a 19th person or not, the culprit is definitely planning something based around that rule about this island.""","""But it's a viewpoint that we can't ignore. ......Whether there's a 19th person or not, the culprit is definitely planning something involving that rule about this island. ",「でも、無視できない着眼点もあるね。……１９人目がいるかいないかは別にしても、その犯人は確実にこの島のルールに則って、何かを仕掛けてきている。,「でも、無視できない着眼点もあるね。……１９人目がいるかいないかは別にしても、その犯人は確実にこの島のルールに則って、何かを仕掛けてきている」,"""Однако мы не можем сбросить эту точку зрения со счетов. ......Существует ли 19‐й человек или нет, преступник наверняка что‐то замышляет, руководствуясь правилом этого острова.""","""Mas isso bate em um ponto que não podemos ignorar. ......Existindo ou não uma 19ª pessoa, o culpado definitivamente está planejando algo baseado na regra dessa ilha.""",「不過，這也是個無法置之不理的觀點呢。……就算先不管有沒有第十九人，這個犯人毫無疑問是遵循著這個島的規則，在謀劃些什麼。」,「不过，这也是个无法置之不理的观点呢。……就算先不管有没有第十九人，这个犯人毫无疑问是遵循着这个岛的规则，在谋划些什么。」,"""Ma è un punto di vista che non possiamo ignorare. ... Che ci sia una diciannovesima persona o no, il colpevole sta certamente architettando qualcosa con quella regola su quest'isola.","""Comunque sia, è una prospettiva che non possiamo ignorare... Sia che esista una 19ª persona o meno, il colpevole sta sicuramente tramando qualcosa in accordanza con la regola dell'isola...""","""Ama görmezden gelemeyeceğimiz bir noktaya parmak basıyor. ......19. kişi olsun ya da olmasın, suçlu kesinlikle bu ada hakkındaki kurala dayalı bir şeyler planlıyor."""
Ushiromiya George,"...Just now, listening to Battler-kun talk, I remembered something that's a little disturbing."" ","""......Just now, listening to Battler‐kun talk, I remembered something that's a little disturbing.""","......Just now, listening to Battler-kun talk, I've remembered something that's a little disturbing.""",……僕はね、今、戦人くんの話を聞いていて、少しだけ気持ち悪いことを思い出してたんだよ。」,「……僕はね、今、戦人くんの話を聞いていて、少しだけ気持ち悪いことを思い出してたんだよ」,"""......Сейчас, после того, как я послушал Баттлера, мне вспомнилось кое‐что тревожное.""","""......Neste momento, ouvindo o Battler‐kun falando, eu lembrei de algo um pouco perturbador.""",「……我在剛才，聽了戰人君的話後，想起了一件讓人有些不舒服的事。」,「……我在刚才，听了战人君的话后，想起了一件让人有些不舒服的事。」,"... Proprio ora, ascoltando Battler-kun parlare, mi sono ricordato una cosa un po' inquietante.""","""Ora che sto ascoltando Battler-kun mentre parla, mi è venuto in mente un dettaglio raccapricciante.""","""......Şimdi Battler-kun'un konuşmasını dinlerken, biraz rahatsız edici bir şey hatırladım."""
Ushiromiya Battler,"""Something disturbing...?"" ","""Something disturbing...?""",[=UP],「気持ち悪いことって…？」,[=JP],"""Кое‐что тревожное?..""","""Algo perturbador...?""",「讓人不舒服的事…？」,「让人不舒服的事…？」,"""Qualcosa di inquietante...?""","""Un dettaglio raccapricciante...?""","""Rahatsız edici bir şey mi...?"""
