Ushiromiya Natsuhi,"""Ridiculous. After all, detective novels are merely books for the purpose of entertainment! You can only think of such an indiscreet idea because you read them all the time!"" ","""How preposterous. Detective novels are nothing more than indulgent entertainment! You can only think of such an indiscreet idea because you read them all the time!""","""Ridiculous. After all, detective novels are just entertainment novels! You can only think of such an indiscreet idea because you read them all the time!""",「馬鹿馬鹿しい。推理小説など所詮は娯楽小説！　そんなものばかり読んでいるから、そのような不謹慎な発想に至るのです！」,[=JP],"""Чушь. В конце концов, детективные романы — всего лишь средства для развлечения! Ты могла придумать такой безрассудный план только потому, что ты их постоянно читаешь!""","""Que absurdo. Romances de detetive não passam de um entretenimento indulgente! Você só é capaz de pensar em algo tão imprudente porque você fica lendo‐os o tempo todo!""",「荒唐至極。推理小說歸根結底不過是娛樂小說！老是讀這種東西，才會產生這種唐突冒犯的想法！」,「荒唐至极。推理小说归根结底不过是娱乐小说！老是读这种东西，才会产生这种唐突冒犯的想法！」,"""Ridicolo. Dopotutto, i gialli son solo romanzi da intrattenimento! Puoi solo pensare una idea così assurda solo perché li leggi sempre!""","""Ridicolo! I libri gialli sono romanzi d'intrattenimento! Leggere solo storie di questo tipo porta ad idee oltraggiose del genere!""","""Ne kadar gülünç. Dedektiflik romanları hoş bir eğlenceden başka bir şey değil! Böyle düşüncesiz bir fikri ancak onları sürekli okuduğun için aklına getirebilirsin!"""
Ushiromiya Jessica,"""That's right!! Even if she did try to fake the time of death a little, all that would be blown away in an instant once the police did their autopsy!! That might've worked in the past, but do you really think that kind of trick would work in modern Japan?! It doesn't make sense!"" ","""Yeah!! Even if she tried to fake the time of death a little, all of that would be blown away in an instant once the police did their autopsy!! It might have fooled the people in old books, but do you seriously think that kind of trick would fly in modern Japan?! Are you insane?!""","""That's right!! Even if she tried to fake the time of death a little, all of that would be blown away in an instant once the police did their autopsy!! It might been effective in the past, but do you really think that kind of trick would work in modern Japan?! Are you insane?!""",「そうだぜ！！　死亡時刻を少しくらい誤魔化したって、そんなの警察が検死すりゃ一発でバレるじゃねぇかよ！！　古典の世界だったらともかく、現代日本でそんなトリック、本気で通用すると思ってんのかよ？！　おっかしいぜ？！」,[=JP],"""Верно!!! Даже если бы она пыталась скрыть время смерти, всё это было бы раскрыто после того, как полиция провела бы вскрытие!!! В прошлом бы это ещё могло пройти, но неужели ты думаешь, что подобный трюк сработает в современной Японии?! Ты что, больная?!""","""Isso!! Mesmo se ela tentasse mentir um pouco sobre a hora da morte, tudo isso iria pelos ares uma vez que a polícia fizesse a autópsia!! Isso pode ter enganado as pessoas nos livros antigos, mas você acha mesmo que esse tipo de truque iria funcionar no Japão moderno?! Você é louca?!""",「沒錯嘞！！就算在死亡時間上搞鬼，警察一旦驗屍不就會被揭穿嗎！！不管在古代世界裡怎麼樣，現代日本誰會覺得這種手法有用啊？！太奇怪嘞！！」,「没错嘞！！就算在死亡时间上搞鬼，警察一旦验尸不就会被揭穿吗！！不管在古代世界里怎么样，现代日本谁会觉得这种手法有用啊？！太奇怪嘞！！」,"""Giusto!! Anche se avesse provato a falsare il tempo del decesso, sarebbe stato tutto inutile al momento dell'autopsia condotta dalla polizia!! Poteva essere efficace in passato, ma pensi davvero che un trucco del genere possa funzionare nel Giappone moderno?! Sei impazzita?!""","""Esatto! Anche se avesse cercato di falsificare di poco l'ora del decesso, tutto verrà spazzato via dall'autopsia della polizia! Potrebbe funzionare nel mondo dei classici, ma pensate davvero che un trucchetto del genere funzionerebbe nel Giappone moderno?! Non è assurdo?!""","""Evet!! Ölüm saatini biraz uydurmaya çalışmış olsa bile, polis otopsi yaptığında tüm bunlar bir anda anlamsız olur!!! Eski kitaplardaki insanları kandırabilir, ama modern Japonya'da böyle bir numaranın işe yarayacağını gerçekten düşünüyor musun?! Delirdin mi sen?!"""
Ushiromiya Eva,"""...You think so? This morning, when Doctor Nanjo looked at the corpses, he was only able to give a vague estimate of the time of death, right? Autopsy results are very easily affected by the environment and individual differences. It's a very relative estimate with an uncertainty of several hours. ","""......You think so? This morning, when Doctor Nanjo looked at the corpses, he was only able to give a vague estimate of the time of death, right? Autopsy results are affected greatly by the corpse's surroundings and individual peculiarities. It's a very rough estimate with an uncertainty of several hours.""","""......You think so? This morning, when Doctor Nanjo looked at the corpses, he was only able to give a vague estimate of the time of death, right? It would be very easy to influence the results of the autopsy by messing around with the corpses' surroundings. It's a very relative estimate with an uncertainty of several hours. ",「……そうかしらぁ？　今朝、南條先生が亡くなった人たちの死体を見て、死亡時刻を曖昧に見積もられたわよぅ？　検死結果は、環境や個体差に非常に左右されやすい。数時間単位で誤差の出る非常にアバウトなものなのよぅ。,「……そうかしらぁ？　今朝、南條先生が亡くなった人たちの死体を見て、死亡時刻を曖昧に見積もられたわよぅ？　検死結果は、環境や個体差に非常に左右されやすい。数時間単位で誤差の出る非常にアバウトなものなのよぅ」,"""......Ты так думаешь? Этим утром, когда доктор Нанджо осматривал трупы, он смог дать лишь примерную оценку времени смерти, верно? Было бы очень легко повлиять на результаты вскрытия, поигравшись с окружающей трупы обстановкой. Это довольно относительная оценка с погрешностью в несколько часов.""","""......Você acha? Esta manhã, quando o doutor Nanjo olhou os corpos, ele era o único capaz da dar uma vaga estimativa da hora da morte, certo? Os resultados da autópsia são afetados dependendo do ambiente que cerca o cadáver e de suas peculiaridades individuais. É uma estimativa grosseira, com uma incerteza de várias horas no tempo da morte.""",「……是這樣嗎？今天早上，南條大夫看了去世的那些人的屍體後，估計的是一個含糊不清的死亡時間喲？驗屍結果非常容易受環境和個人體質不同的影響。有幾小時誤差也不奇怪，是非常不精確的啊。」,「……是这样吗？今天早上，南条大夫看了去世的那些人的尸体后，估计的是一个含糊不清的死亡时间哟？验尸结果非常容易受环境和个人体质不同的影响。有几小时误差也不奇怪，是非常不精确的啊。」,"""... Lo pensi davvero? Questa mattina, quando il dottor Nanjo ha guardato i cadaveri, fu capace di stimare solo vagamente il tempo del decesso, giusto? Sarebbe molto facile influenzare i risultati dell'autopsia confondendo ciò che circonda i cadaveri. È una stima molto relativa con una incertezza di alcune ore.","""...Lo pensi davvero? Stamattina, quando il dottor Nanjo ha visto i corpi dei deceduti, ci ha dato una vaga stima dell'ora del decesso, giusto? I risultati di un'autopsia sono molto influenzati dall'ambiente e dalle differenze individuali.{n}È una stima incredibilmente approssimativa, con un margine d'errore di diverse ore.""","""......Öyle mi diyorsun? Bu sabah, Doktor Nanjo cesetlere baktığında, ölüm zamanı hakkında sadece belirsiz bir tahminde bulunabildi, değil mi? Otopsi sonuçları cesedin çevresinden ve bireysel özelliklerinden büyük ölçüde etkilenir. Bu, birkaç saatlik belirsizliği olan çok tahmini bir değerdir."""
Ushiromiya Eva,"And, unfortunately, the police's scientific investigation will have to wait until tomorrow. It wouldn't be easy to measure the correct time of death so accurately, even in modern Japan. Isn't that right, Doctor Nanjo...?"" ","""And, unfortunately, the police's scientific investigation will have to wait until tomorrow. Measuring the exact time of death after that, even in modern Japan like you said, wouldn't be that easy, you know? Right, Doctor Nanjo...?""","And, unfortunately, the police's scientific investigation will have to wait until tomorrow. Measuring the correct time of death after that, even in modern Japan like you said, wouldn't be that easy, right? Right, Doctor Nanjo...?""",しかも困ったことに、警察の科学的な捜査は明日にならないとできない。そこまでの正確な死亡時刻を測ることなんて、朱志香ちゃんの言う現代日本でも、そうそう簡単なことじゃないのよぅ？　ねぇ、南條先生…？」,「しかも困ったことに、警察の科学的な捜査は明日にならないとできない。そこまでの正確な死亡時刻を測ることなんて、朱志香ちゃんの言う現代日本でも、そうそう簡単なことじゃないのよぅ？　ねぇ、南條先生…？」,"""И, к сожалению, научное расследование полиции вынуждено подождать до завтра. После этого определить точное время смерти даже в современной Японии, как ты только что сказала, будет не так уж просто. Верно, Доктор Нанджо?..""","""E, infelizmente, as investigações da perícia policial vão ter que esperar até amanhã. Calcular o tempo exato da morte depois disso, mesmo no Japão moderno, como você disse, não é nada fácil, certo? Não é mesmo, doutor Nanjo...?""",「而且傷腦筋的是，必須等到明天才有警察來做科學調查。要精確檢測出死亡時間，即便是在朱志香所說的現代日本，也不是那麼簡單喲？是吧，南條大夫…？」,「而且伤脑筋的是，必须等到明天才有警察来做科学调查。要精确检测出死亡时间，即便是在朱志香所说的现代日本，也不是那么简单哟？是吧，南条大夫…？」,"E, sfortunatamente, la scientifica dovrà aspettare fino a domani. Misurare il corretto tempo di decesso dopo una cosa del genere, anche nel Giappone moderno come hai fatto notare, non sarebbe così facile, no? Giusto, Dottor Nanjo...?""","""E purtroppo, l'indagine della scientifica dovrà aspettare fino a domani. Non è così semplice determinare l'ora del decesso in modo così accurato, neanche nel Giappone moderno di cui parli, Jessica, sai? Non è così, dottor Nanjo...?""","""Ve ne yazık ki polisin bilimsel araştırması yarına kadar beklemek zorunda. Modern Japonya'da bile ölüm zamanını bu kadar doğru ölçmek kolay olmaz. Değil mi, Doktor Nanjo...?"""
Nanjo Terumasa,"""......Examining a corpse is an extremely difficult task that requires both experience and instinct... I have heard that there is a very high chance of a mistaken diagnosis... I imagine it is very possible for a misreading of just a few hours to occur..."" ","""............Examining a corpse is an extremely difficult task that requires both experience and instinct... I have heard that there is a very high rate of mistaken diagnoses... I imagine it is very possible for a misreading of just a few hours to occur...""","""............Examining a corpse an extremely difficult task that requires both experience and instinct... I have heard that there is a very high chance of a mistaken diagnosis... I imagine it is very possible for a misreading of just a few hours to occur...""",「…………検死は、経験と勘の必要な、非常に難しい作業です…。誤診率も非常に高いと聞いております…。確かに、ほんの数時間程度の誤差を出してしまうことは大いにありえるでしょうな…。」,「…………検死は、経験と勘の必要な、非常に難しい作業です…。誤診率も非常に高いと聞いております…。確かに、ほんの数時間程度の誤差を出してしまうことは大いにありえるでしょうな…」,"""............Вскрытие требует одновременно опыта и интуиции. Это крайне сложная процедура... Я слышал, что вероятность неверного диагноза велика... Во многих случаях, ошибка в несколько часов безусловно возможна...""","""............Examinar um cadáver é uma tarefa extremamente difícil que requer experiência e instinto... Eu ouvi que há uma alta taxa de erros no diagnóstico... Realmente, eu imagino que seja bem possível que haja uma leitura errada de algumas horas...""",「…………驗屍是個非常困難的工作，經驗和悟性缺一不可…。據我聽說誤診率也是非常高的…。確實，幾小時程度的誤差，是非常有可能出現的吶…」,「…………验尸是个非常困难的工作，经验和悟性缺一不可…。据我听说误诊率也是非常高的…。确实，几小时程度的误差，是非常有可能出现的呐…」,"""... Un'autopsia richiede sia istinto che esperienza, è un compito estremamente difficile... ho sentito che c'è un'alta percentuale di diagnosi sbagliata... è altamente possibile che, in molti casi, può avvenire un errore di alcune ore...""","""...Effettuare un'autopsia è un compito estremamente complesso, che richiede sia esperienza che intuito... Ho sentito che c'è un tasso molto alto di diagnosi errate... Effettivamente, mi pare che siano frequenti errori di qualche ora nelle misurazioni...""","""............Bir cesedi incelemek hem deneyim hem de içgüdü gerektiren son derece zor bir iştir... Yanlış teşhis oranının çok yüksek olduğunu duymuştum... Sadece birkaç saatlik bir yanlış teşhisin çok mümkün olabileceğini düşünüyorum..."""
Ushiromiya Hideyoshi,"""...However, for an alibi, that's more than enough! It's an old trick! It's a trick that works well enough! ...Natsuhi nee-san, it's not like we want to suspect you, okay? We just want you to prove your innocence so we don't have to suspect you."" ","""...However, for an alibi, that's more than enough! It's not just a trick for the classics! It's a trick that actually works! ......Natsuhi nee‐san. It's not like we want to suspect you, alright? We don't, an' that's why we just want you to prove you're innocent.""","""...However, for an alibi, that's more than enough! It's an old trick! It's a trick that works well enough! ......Natsuhi nee-san. It's not like we want to suspect you, alright? We just want you to prove your innocence so we don't have to suspect you.""",「…しかしアリバイの世界は数時間もあれば充分やで！　古典のトリックとちゃう！　充分に通用するトリックなんや！　……夏妃姉さん。わしら、あんたを疑いたいわけやないんやで？　疑いとうないから、潔白を示してほしいだけなんや。」,「…しかしアリバイの世界は数時間もあれば充分やで！　古典のトリックとちゃう！　充分に通用するトリックなんや！　……夏妃姉さん。わしら、あんたを疑いたいわけやないんやで？　疑いとうないから、潔白を示してほしいだけなんや」,"""...Однако этого более чем достаточно для алиби! Это старый трюк! Этот трюк, который работает достаточно хорошо! ......Нацухи нээ‐сан. Не то чтобы мы хотим подозревать тебя, ладно? Мы просто хотим, чтобы ты доказала свою невиновность, и нам не пришлось тебя подозревать.""","""...No entanto, para um álibi, isso é mais do que o suficiente! Não é um truque dos clássicos! É um truque que realmente funciona! ......Natsuhi nee‐san. Não é que nós queiramos suspeitar de você, tudo bem? Nós não queremos, e por isso só queremos que você prove que é inocente.""",「…可是，在不在場證明的領域裡，有幾小時就足夠吶！這不是什麼古典手法！是完全可以起作用的手法吶！……夏妃姐。俺們不是故意要懷疑你吶？正因為不想懷疑，所以才希望你能證明自己的清白吶。」,「…可是，在不在场证明的领域里，有几小时就足够呐！这不是什么古典手法！是完全可以起作用的手法呐！……夏妃姐。俺们不是故意要怀疑你呐？正因为不想怀疑，所以才希望你能证明自己的清白呐。」,"""... Tuttavia, per un alibi, è più che sufficiente! È un vecchio trucco! Un trucco che funziona abbastanza bene! ... Natsuhi Nee-san. Non è che ti stiamo sospettando, va bene? Vogliamo solo che tu provi la tua innocenza così che non dobbiamo sospettarti.""","""Ma anche qualche ora è più che sufficiente per crearsi un alibi! È un classico espediente! Ed è un espediente che funziona piuttosto bene...! Natsuhi-san. Non è che vogliamo sospettare di te, ok? Vogliamo solo che provi la tua innocenza, in modo da non dover dubitare di te.""","""...Ancak, bir mazeret için bu fazlasıyla yeterli! Bu sadece klişe bir numara değil! Gerçekten işe yarayan bir numara! ......Natsuhi nee-san. Senden şüphelenmek istediğimiz falan yok, tamam mı? Bu yüzden sadece masum olduğunu kanıtlamanı istiyoruz."""
Ushiromiya Natsuhi,"""What is this innocence you want me to prove?!! This morning, I definitely met with Father!! And he told me to keep the One-Winged Eagle engraved in my heart... ...Are you denying that he said that, too?!! ","""What is this innocence you want me to prove?!! This morning, I definitely met with Father!! And he told me to keep the One‐winged Eagle engraved in my heart... ......Are you denying that he said that, too?!!""","""What is this innocence you want me to prove!!? This morning, I definitely met with Father!! And he told me to keep the One-winged Eagle engraved in my heart.........Are you denying that he said that, too!!?",「何の潔白を示せというのですか！！　今朝、私は確かにお父様にお会いしました！！　そして心の中に片翼の鷲を刻めとお言葉をいただいて…。……あのお言葉をも否定するというのですかッ！！,「何の潔白を示せというのですか！！　今朝、私は確かにお父様にお会いしました！！　そして心の中に片翼の鷲を刻めとお言葉をいただいて…。……あのお言葉をも否定するというのですかッ！！」,"""Какую ещё невиновность я должна вам доказать?!! Этим утром я действительно встречалась с отцом!!! И он сказал мне хранить Однокрылого орла, выгравированного на моём сердце... ......Вы отрицаете, что он сказал это?!!""","""Que inocência é essa que você quer que eu prove?! Esta manhã, eu definitivamente me encontrei com o pai!!! E ele me disse para eu continuar mantendo o símbolo da Águia de Uma Asa gravada em meu coração... ......Você também está negando aquilo que ele disse antes?!""",「要我證明什麼清白！！今天早上，我確確實實地見過爸！！然後領受了“去將片翼之鷲銘刻於心”的言辭…。……你連這句話也要否定嗎！！」,「要我证明什么清白！！今天早上，我确确实实地见过爸！！然后领受了“去将片翼之鹫铭刻于心”的言辞…。……你连这句话也要否定吗！！」,"""Che innocenza vuoi che provi!!? Questa mattina, mi sono sicuramente incontrata con Papà!! E mi ha detto di mantenere l'aquila mono-alata incisa nel mio cuore... e tu stai negando che abbia perfino detto così!!?","""Quale innocenza dovrei provare?! Stamattina, ho senz'altro incontrato nostro padre!! E ha detto che sul mio cuore è incisa l'aquila monoalata... State negando anche che abbia detto questo?!!""","""Kanıtlamamı istediğiniz masumiyet nedir?!! Bu sabah kesinlikle Babamla konuştum!! Ve bana Tek Kanatlı Kartal'ı kalbime kazımamı söyledi... ......Bunu söylediğini de mi inkâr ediyorsun?!!"""
Ushiromiya Natsuhi,"I will certainly not permit that!! I won't let you deny that Father said those words!!"" ","""I will definitely not permit that!! I won't permit you to deny that Father said those words!!"""," I will definitely not permit that!! I won't permit you to deny that Father said those words!!""",　それだけは断じて許せません！！　お父様が掛けられた言葉までも否定することは断じて許せません！！」,「それだけは断じて許せません！！　お父様が掛けられた言葉までも否定することは断じて許せません！！」,"""Я ни за что не допущу подобного!!! Я не позволю вам отрицать, что отец сказал эти слова!!!""","""Eu definitivamente não vou permitir isso!! Eu não vou permitir que você negue que o pai disse aquelas palavras!!""",「這種說法我絕對無法原諒！！連爸送給我的話都要否定，我是絕對不會原諒的！！」,「这种说法我绝对无法原谅！！连爸送给我的话都要否定，我是绝对不会原谅的！！」,"Di sicuro non permetterò una cosa del genere!! Non ti permetterò di negare che nostro Padre abbia detto quelle parole!!""","""Di certo non lo permetterò!! Non vi permetterò mai di negare che nostro padre mi abbia confidato queste parole!!""","""Buna kesinlikle izin vermeyeceğim!! Babamın bu sözleri söylediğini inkâr etmenize izin vermeyeceğim!!"""
