Ushiromiya Jessica,"""S-S-S-Sorry, Kanon-kun, could you close your eyes for juuust three seconds...?"" ","""S‐ss‐sorry, Kanon‐kun, just for three seconds, could you close your eyes...""","""S s s, sorry, Kanon-kun, just for three seconds, could you close your eyes...""",「ごごご、ごめん嘉音くん、３秒でいいから、目ェ瞑っててくれるかな…。」,「ごごご、ごめん嘉音くん、３秒でいいから、目ェ瞑っててくれるかな…」,"""И‐и‐извини, Канон‐кун, только на три секунды, не мог бы ты закрыть глаза...""","""D‐D‐Desculpe, Kanon‐kun, só por três segundos, você poderia fechar seus olhos...""",「對對對、對不起嘉音君，你給我三秒就行，能把眼睛閉起來嗎…？」,「对对对、对不起嘉音君，你给我三秒就行，能把眼睛闭起来吗…？」,"""S-S-S-Scusa, Kanon-kun, solo per tre secondi, potresti chiudere gli occhi...""","""S-S-S-Scusa, Kanon-kun, potresti chiudere gli occhi solo per tre secondi...?""","""Ü-Üü-Üzgünüm, Kanon-kun, sadece üç saniyeliğine gözlerini kapatabilir misin...?"""
,"((((((Hiiyaaaaaaa, a kiss, it's a kiss, she's gonna kiss him!!)))))) ","(((Hiiyaaaaaaa, kiss, it's a kiss, she's going to kiss him!!!!)))","((((((Hiiyaaaaaaa, kiss, it's a kiss, she's going to kiss him!!))))))",（（（（（（ひぃやあああぁああ、キスよキス、キスするのよぉおお！！））））））,（（（ひぃやあああぁああ、キスよキス、キスするのよぉおお！！）））,"(((Хья‐а‐а‐а‐а, поцелуй, это поцелуй, она собирается поцеловать его!!!)))","(((Hiiyaaaaaaa, beijo, é um beijo, ela vai beijá‐lo!!!!)))",（（（哇啊啊啊啊啊啊，要親了要親了，他們要親了———！！）））,（（（哇啊啊啊啊啊啊，要亲了要亲了，他们要亲了———！！）））,"((((((Hiiyaaaaaaa, bacio, è un bacio, sta per baciarlo!!))))))","""""""Hiiyaaaaaaa, lo bacia, lo bacia, sta per baciarloooo!!""""""","(((Hiiyaaaaaaa, öpücük, bu bir öpücük, onu öpecek!!!!)))"
Kanon,"""...A-As you wish."" ","""O‐...okay, here goes.""","""S, ...sure.""",「で、…では瞑ります。」,「で、…では瞑ります」,"""То... тогда я закрою их.""","""T‐Tudo bem, eu farei isso.""",「那、…那我閉眼睛了。」,「那、…那我闭眼睛了。」,"""C... Certo.""","""L-Lo faccio subito.""","""T-...Tamam, nasıl isterseniz."""
,"BANG, *thunk*! *bam*bam*, *slam*, *crash*!! ","BANG, thunk! BAMBAM, SLAM, CRASH!!","*bang*, *thunk*! *bam*bam*, *slam*, *crash*!!",　ズガッ、どぎゃッ！ブンブン、ドッガーン、ぐぴゃごべッ！！,ズガッ、どぎゃッ！　ブンブン、ドッガーン、ぐぴゃごべッ！！,"*бац*, *хрясь*! *бам*бам*, *треск*, *грохот*!","BANG, DOGYAA! BAMBAM, DOKKAAN, GUPYAGOBEE!!",嘎吱，咣當！砰砰，磅——！噼里啪啦！！,嘎吱，咣当！砰砰，磅——！噼里啪啦！！,[=OG],"BANG, THUNK! BAM BAM, KABOOM, CRASH!!","BANG, güm! BAMBAM, PAT, GÜM!!"
,"...By the time Kanon opened his eyes, a horrible tragedy had occurred in the room. Everyone had been driven into the walls, their arms and legs outstretched. ","...When Kanon opened his eyes, for some reason, there was a horrible tragedy in the room.{n}Everyone had been driven into the walls, their arms and legs outstretched.","...When Kanon opened his eyes, for some reason, there was a horrible tragedy in the room. Everyone had been driven into the walls, their arms and legs outstretched.",…嘉音が目を開くと、なぜか教室内はひどい惨劇。みんな大の字型になって壁に打ち込まれていた。,…嘉音が目を開くと、なぜか教室内はひどい惨劇。{n}みんな大の字型になって壁に打ち込まれていた。,"...Когда Канон открыл глаза, в помещении по какой‐то странной причине приключилась ужасная трагедия.{n}Все были впечатаны в стены с раскинутыми руками и ногами.","...Quando Kanon abriu seus olhos, por alguma razão, havia uma tragédia horrível na sala de aula.{n}Todas haviam sido jogadas contra as paredes, com seus braços e pernas estendidos.",…等嘉音睜開眼時，教室裡不知為何已成了恐怖的慘劇現場。{n}大家都被打進了牆壁中，宛如一個個的大字。,…等嘉音睁开眼时，教室里不知为何已成了恐怖的惨剧现场。{n}大家都被打进了墙壁中，宛如一个个的大字。,"... Quando Kanon aprì gli occhi, per qualche motivo, si era verificata una orribile tragedia nella stanza. Tutti erano stati scaraventati contro le pareti, con le loro braccia e le loro gambe distese.","...Quando Kanon aprì gli occhi, vide che nell'aula era avvenuta un'orribile e inspiegabile tragedia.{n}Erano state tutte scaraventate contro le pareti, con braccia e gambe all'aria.","...Kanon gözlerini açtığında, nedense odada korkunç bir trajedi vardı.{n}Herkes kollarını ve bacaklarını açmış bir şekilde duvarlara gömülmüştü."
,Jessica had slipped her brass knuckles back into her pocket before Kanon's eyes opened. ,Jessica put her brass knuckles in her pocket before Kanon opened his eyes., Jessica put her brass knuckles in her pocket before Kanon opened his eyes.,朱志香は嘉音が目を開く前にメリケンサックをポケットにしまう。,[=JP],"Джессика спрятала свой кастет в карман прежде, чем Канон открыл глаза.",Jessica colocou suas soqueiras de bronze em seu bolso antes que Kanon abrisse seus olhos.,朱志香在嘉音睜開眼前，利索地把鐵指虎放進了口袋中。,朱志香在嘉音睁开眼前，利索地把铁指虎放进了口袋中。,Jessica mise i suoi tirapugni in tasca prima che Kanon aprisse gli occhi.,Jessica aveva messo i suoi tirapugni in tasca prima che Kanon avesse riaperto le palpebre.,"Jessica, Kanon gözlerini açmadan önce muştasını cebine koydu."
Ushiromiya Jessica,"""A-Anyway, let's go over to the stage. Our turn's coming up soon, so take a seat and wait for a bit. ","""A‐anyway, let's go over to the stage. Our turn is coming up soon, so wait in a seat for a bit.""","""A, anyway, let's go over to the stage. Our turn is coming up soon, so wait in a seat for bit. ",「と、とにかくステージの方に行こう。私たちの出番はもうすぐだから、しばらく席で待っててよ。,「と、とにかくステージの方に行こう。私たちの出番はもうすぐだから、しばらく席で待っててよ」,"""В... в любом случае, пора идти к сцене. Скоро будет наша очередь, поэтому подождёшь пока там.""","""D‐De qualquer forma, vamos para o palco. Logo será a nossa vez, então sente‐se e espere um pouco.""",「總、總之先去舞台那邊吧。馬上就到我們出場了，你就先去座位上稍等一會吧。」,「总、总之先去舞台那边吧。马上就到我们出场了，你就先去座位上稍等一会吧。」,"""C-Comunque, andiamo verso il palco. Il nostro turno arriverà fra poco, per cui aspetta seduto per un po'.","""C-Comunque, andiamo verso il palco. Il nostro turno arriverà fra poco, perciò siediti e aspetta un po'.""","""N-Neyse, hadi sahneye gidelim. Sıra birazdan bize gelecek, o yüzden biraz oturup bekle."""
Ushiromiya Jessica,"'Cause we've gotta get ready! Go straight to the end here and you'll see a temporary stage, you'll know where to go. Please wait there!"" ","""'Cause we have to get ready! If you go straight to the end here, there'll be a temporary stage, so you'll know where to go, just wait there!""","'Cause we have to get ready! If you go straight to the end here, there'll be a temporary stage, so you'll know where to go. Please wait there!""",私たちは準備あるからさ！　この先、突き当たりまでいけば仮設舞台があるからわかるぜ、そこで待ってて！」,「私たちは準備あるからさ！　この先、突き当たりまでいけば仮設舞台があるからわかるぜ、そこで待ってて！」,"""Нам ведь ещё нужно собраться! Если пойдёшь отсюда и прямо до конца, там будет сцена, поэтому ты не заблудишься. Пожалуйста, подожди там!""","""Porque temos que nos preparar! Se você for reto até o fim aqui, haverá um palco temporário, então você saberá para onde ir, só espere lá!""",「我們還要準備一下！從這往前走到盡頭就是臨時舞台，一過去就知道嘞，在那兒等著就好！」,「我们还要准备一下！从这往前走到尽头就是临时舞台，一过去就知道嘞，在那儿等着就好！」,"Perché dobbiamo prepararci! Se da qui prosegui dritto fino alla fine, c'è un palco provvisorio, per cui saprai dove andare. Per favore aspetta lì!""","""Dobbiamo prepararci! Se da qui proseguirai dritto fino alla fine non potrai sbagliare, perché troverai un palco provvisorio, tu aspetta lì!""","""Çünkü hazırlanmamız gerekiyor! Doğrudan buranın sonuna doğru gidersen, geçici bir sahne göreceksin, yani gideceğin yer orası, sadece orada bekle!"""
,"She pushed Kanon's back, as he seemed to be having trouble moving himself, and chased him out. ","Kanon seemed to be having a hard time adjusting; pushing him in the back, Jessica sent him out into the corridor.","She pushed Kanon's back, as it looked like it would be hard for him to go by himself, and chased him out.",何だか勝手が違ってやりにくそうにしている嘉音の背中をぐいぐい押して、廊下に追い出す。,[=JP],"Она упёрлась в спину Канона, который выглядел, как будто ему было трудно оставаться одному, и выставила его.","Kanon parecia estar tendo dificuldade de se ajustar; empurrando‐o pelas costas, Jessica o mandou para fora.",因人生地不熟而顯得有些不知所措的嘉音，被朱志香從背後用力推著趕到了走廊上。,因人生地不熟而显得有些不知所措的嘉音，被朱志香从背后用力推着赶到了走廊上。,"Spinse la schiena di Kanon, come se fosse difficile per lui andarci da solo, e lo cacciò via.","Jessica spinse con forza la schiena di Kanon, il quale sembrava leggermente confuso e in difficoltà, e lo buttò fuori nel corridoio.",Kanon duruma uyum sağlamakta zorlanıyor gibiydi; Jessica onu arkadan iterek koridora çıkardı.
,"Even though Kanon was confused by Jessica's attitude and her panicky state, which he'd never seen before, he followed her instructions and headed in the direction she had indicated. ","Even though Kanon was confused by Jessica's attitude and show of agitation, which he had never seen before, he followed her instructions and headed in the direction she had indicated."," Even though Kanon was confused by Jessica's attitude and panic, which he had never seen before, he followed her instructions and headed in the direction she had indicated.",嘉音も、初めて見る朱志香の態度や狼狽ぶりに困惑しながらも指示に従い、指差された方へ向かうのだった。,[=JP],"Хотя Канона и озадачило поведение Джессики вкупе с паникой, которую ему раньше не доводилось видеть, он последовал её указанию и двинулся в указанном ею направлении.","Mesmo que Kanon estivesse confuso pela atitude e agitação de Jessica, que ele nunca havia visto antes, ele seguiu as instruções dela e seguiu na direção que ela havia indicado.",朱志香的這副態度和狼狽相，嘉音還是第一次見到。他雖然對此有些丈二和尚摸不著頭腦，但還是聽從了指示，朝她手指的地方走去。,朱志香的这副态度和狼狈相，嘉音还是第一次见到。他虽然对此有些丈二和尚摸不着头脑，但还是听从了指示，朝她手指的地方走去。,"Nonostante Kanon fosse confuso dal panico e dal comportamento di Jessica, che non aveva mai visto così prima d'ora, seguì le sue istruzioni, e si diresse nel punto da lei indicato.","Nonostante Kanon fosse sorpreso dai modi e dall'atteggiamento impanicato di Jessica, a lui completamente nuovi, seguì le sue istruzioni e si diresse nel punto da lei indicato.","Kanon, Jessica'nın daha önce hiç görmediği tavrı ve telaşlı hali karşısında şaşkınlığa uğramış olsa da onun talimatlarına uyarak gösterdiği yöne doğru ilerledi."
,"After seeing him off with an awkward smile, Jessica slammed the door shut and yelled loudly. ","After seeing him off with an awkward smile, Jessica slammed the door shut and yelled loudly."," After seeing him off with an awkward smile, Jessica slammed the door shut and yelled loudly.",その姿をぎこちない笑顔で見送った後、朱志香は教室の戸をぴしゃりと閉めて大声で叫ぶ。,[=JP],"Проводив его со смущённой улыбкой, Джессика захлопнула дверь и громко закричала.","Depois de despedir‐se dele com um sorriso desconfortável, Jessica bateu a porta e gritou.",以僵硬的笑容目送嘉音遠去後，朱志香砰然一聲關上了教室的門，大聲嚷了起來。,以僵硬的笑容目送嘉音远去后，朱志香砰然一声关上了教室的门，大声嚷了起来。,"Dopo averlo visto allontanarsi con un sorriso impacciato, Jessica sbatté la porta e gridò ad alta voce.","Dopo averlo salutato con un sorriso ingessato, Jessica sbattè la porta dell'aula e urlò a gran voce.",Jessica onu garip bir gülümsemeyle uğurladıktan sonra kapıyı sertçe çarparak kapattı ve yüksek sesle bağırdı.
Ushiromiya Jessica,"""There you go, you saw, right? You saw that, are you happy now?! Wahahahahahahahaha, sucks for you!!!"" ","""There you go, you saw, right? You saw, happy now?! Wahahahahahahahaha, sucks for you!!!""","""There you go, you saw, right? Did you see, are you satisfied?! Wahahahahahahahaha, sucks for you!!!""",「ささ、見たね？　見たでしょ、満足したッ？！わはははははははは、ざまーねーぜー！！！」,「ささ、見たね？　見たでしょ、満足したッ？！　わはははははははは、ざまーねーぜー！！！」,"""Ну что, видали, а? Насмотрелись? Теперь‐то удовлетворены?! Ва‐ха‐ха‐ха‐ха‐ха‐ха‐ха‐ха, какая жалость!!!""","""Aí está, vocês viram, não viram? Vocês viram, felizes agora?! Wahahahahahahahaha, que pena pra vocês!!!""",「怎麼樣，看到了沒？都看到了吧，滿足了沒？！哇哈哈哈哈哈哈哈哈哈，大——快——人——心——啊——！！！」,「怎么样，看到了没？都看到了吧，满足了没？！哇哈哈哈哈哈哈哈哈哈，大——快——人——心——啊——！！！」,"""Eccovelo, avete visto, vero? L'avete visto, siete soddisfatte?! Wahahahahahahahaha, così imparate!!!""","""Eccolo, lo avete visto, no? L'avete visto, siete contente?! Wahahahahahahahah, così imparate!!!""","""İşte gördünüz, değil mi? Gördünüz, şimdi mutlu musunuz?! Wahahahahahahahaha, size üzüldüm!!!"""
,"""...Ugugugugugugu, I lost the bet."" ","""......ugggggggh, I lost the bet.""","""......Ugugugugugugu, I lost the bet.""",「……うぐぐぐぐぐぐ、賭けに負けたぁ。」,「……うぐぐぐぐぐぐ、賭けに負けたぁ」,"""......У‐у‐у‐у, я проиграла пари.""","""......ugggggggh, perdi a aposta.""",「……嗚咕咕咕咕咕咕，賭輸啦。」,「……呜咕咕咕咕咕咕，赌输啦。」,"""... Ugugugugugugu, ho perso la scommessa.""","""...Uuuuuuugh, ho perso la scommessa.""","""......ugggggggh, bahsi kaybettim."""
,"""I was sure Jessie didn't have a boyfriend."" ","""I was so sure that Jessie didn't have a boyfriend.""","""I was sure that Jessie didn't have a boyfriend.""",「絶対、ジェシに彼氏なんかいないと思ってたのにィ。」,「絶対、ジェシに彼氏なんかいないと思ってたのにィ」,"""Я была уверена, что у Джесси нет парня.""","""Eu tinha tanta certeza de que a Jessie não tinha um namorado.""",「我還以為杰西鐵定沒這個男朋友呢。」,「我还以为杰西铁定没这个男朋友呢。」,"""Ero sicura che Jessie non avesse il ragazzo.""",[=ITA],"""Jessie'nin erkek arkadaşı olmadığından o kadar emindim ki."""
,"""Are you sure that was her boyfriend? I'll bet she's just abusing one of her servants, right?"" ","""That wasn't a boyfriend, right, she's just harassing one of her servants, right?""",[=UP],「彼氏じゃないんでしょ、使用人へのパワハラでしょォオオ。」,「彼氏じゃないんでしょ、使用人へのパワハラでしょォオオ」,"""Это не парень, верно, она просто воспользовалась одним из своих слуг, разве не так?""","""Aquilo não era um namorado, certo? Ela está só assediando um de seus serviçais, certo?""",「這不是你男朋友吧，是你對傭人濫用職權，假公濟私吧——？」,「这不是你男朋友吧，是你对佣人滥用职权，假公济私吧——？」,"""Quello non era il suo ragazzo, giusto, ha solo assillato uno dei suoi domestici, vero?""","""Siamo sicure che sia il ragazzo e che non stia molestando uno dei suoi servi?""","""O erkek arkadaşı değildi, değil mi? Sadece hizmetkârlarından birini rahatsız ediyordu, değil mi?"""
,"""Waaaah, Jessie's boyfriend's incredibleeee...!"" ","""Waaaah, Jessie's boyfriend's incredibleeee...!""",[=UP],「うわあぁん、ジェシの彼氏ステキだオォォ…！」,[=JP],"""Ва‐а‐ах, парень Джесси просто отпадный!..""","""Waaaah, o namorado da Jessie é incríííível...!""",「嗚哇啊啊啊，杰西的男朋友好贊啊啊啊…！」,「呜哇啊啊啊，杰西的男朋友好赞啊啊啊…！」,"""Waaaah, il ragazzo di Jessie è incredibileeeee...!""","""Waaaah, Il ragazzo di Jessie è stupendooooo...!""","""Waaaah, Jessie'nin erkek arkadaşı inanılmaaaaaz...!"""
Ushiromiya Jessica,"""Sh-Sh-Shut up!! Come on, let's get ready!!"" ","""Sh‐sh‐shut up!! Let's get ready, move it move it!!""","""Sh, sh, shut up!! Come on, let's get ready!!""",「やや、やっかましいぜ！！　ほらほら準備準備！！」,[=JP],"""З‐з‐заткнитесь вы уже! Ладно, пора готовиться!""","""Ca‐Ca‐Calada!! Vamos, vamos, mexam‐se, mexam‐se!!""",「吵吵、吵死嘞！！好了好了快準備快準備！！」,「吵吵、吵死嘞！！好了好了快准备快准备！！」,"""S-S-State zitte!! Dai, prepariamoci!!""","""C-C-Chiudete il becco!! Forza, forza, prepariamoci, prepariamoci!!""","""Ka-Ka-Kapa çeneni! Hadi hadi, kımıldayın kımıldayın!"""
,"When Jessica took the brass knuckles out of her pocket again, everyone energetically returned to their tasks. ","Jessica took the brass knuckles out of her pocket again, and everyone energetically returned to their tasks.","When Jessica took the brass knuckles out of her pocket again, everyone energetically returned to their tasks.",朱志香がもう一度ポケットからメリケンサックを取り出すと、みんなはキビキビと作業に戻るのだった。,[=JP],"Стоило Джессике снова достать кастет из своего кармана, как все сразу бодро вернулись к своим делам.","Jessica tirou suas soqueiras de bronze de seu bolso de novo, e todas energeticamente retornaram às suas tarefas.",朱志香又一次從口袋中取出了鐵指虎，大家一看這架勢，就都麻溜地回去繼續做準備工作了。,朱志香又一次从口袋中取出了铁指虎，大家一看这架势，就都麻溜地回去继续做准备工作了。,"Quando Jessica tirò fuori ancora i tirapugni dalla sua tasca, tutte tornarono subito al proprio compito.","Quando Jessica tirò nuovamente fuori i tirapugni dalla tasca, tornarono tutte in un lampo ai propri compiti.",Jessica cebinden muştaları tekrar çıkardı ve herkes enerjik bir şekilde görevlerine döndü.
Kanon,""".........Haah."" ","""...............haah.""","""............Haah.""",「……………はぁ。」,「……………はぁ」,"""............Ха‐а‐ах.""",[=UP],「……………哈啊。」,[=CHT],"""... Haah.""","""...Aah.""",[=UP]
,Kanon went down the corridor Jessica had shown him...and ran into a temporary stage set up where the vending machines should have been. ,"Kanon went down the corridor as Jessica had told him to, and found a temporary stage set up where the vending machines should have been.","When Kanon went down the corridor as Jessica had told him to, he ran into a temporary stage set up where the vending machines should have been.",嘉音は、朱志香に言われたように廊下を進むと、自動販売機のスペースを流用した仮設舞台があった。,[=JP],"Пройдя по коридору, Канон, как и сказала ему Джессика, набрёл на временную сцену, стоящую там, где полагалось стоять торговым автоматам.","Kanon seguiu o corredor como Jessica havia dito a ele, e achou um palco temporário armado onde as máquinas de venda deveriam ficar.",嘉音照著朱志香的話走到走廊盡頭後，看到了挪用了自動販賣機區域搭建的臨時舞台。,嘉音照着朱志香的话走到走廊尽头后，看到了挪用了自动贩卖机区域搭建的临时舞台。,"Quando Kanon proseguì per il corridoio come Jessica gli aveva detto di fare, si imbatté in un palco temporaneo messo dove ci sarebbero dovuti essere i distrubutori automatici.","Kanon proseguì lungo il corridoio come gli era stato detto da Jessica, e si imbatté in un palco temporaneo posto in uno spazio normalmente riservato a distributori automatici.","Kanon, Jessica'nın söylediği gibi koridorda ilerledi ve otomatların olması gereken yerde kurulmuş geçici bir sahne buldu."
,It was probably being rented by the hour by some group or club. ,It was probably being shared in timeslots between the individual groups and clubs., It was probably being rented by the hour by some group or circle.,多分、グループやサークル単位で時間貸ししているのだろう。,[=JP],"Возможно, она сдавалась в почасовую аренду каким‐нибудь группам или кружкам.",Ele provavelmente estava sendo compartilhado em intervalos de tempo entre os grupos individuais e clubes.,這舞台大概是以樂隊或者社團為單位，租賃時間使用的吧。,这舞台大概是以乐队或者社团为单位，租赁时间使用的吧。,Era probabilmente stato noleggiato per quell'ora da qualche gruppo o circolo.,Probabilmente era noleggiato con tariffa ad ore da qualche club o circolo.,Muhtemelen zaman aralıkları bireysel gruplar ve kulüpler arasında paylaştırılıyordu.
,"The ones singing were student groups, but the crowd was still incredibly excited. ","A student group was singing, and the place was already fired up."," Groups from the school where singing songs, but the place was already getting excited.",学生のグループが歌を歌っているが、それも大いに盛り上がっていた。,[=JP],"Выступление ещё не началось, но в этом месте уже царило оживление.","Um grupo de estudantes estava cantando, e o lugar já estava agitado.",雖說只是學生樂隊在唱歌，但現場的場面還是非常熱烈。,虽说只是学生乐队在唱歌，但现场的场面还是非常热烈。,"Alcuni gruppi della scuola avrebbero dovuto cantare, ma il posto si stava già infiammando.","Dei gruppi studenteschi stavano cantando, e il posto era molto affollato.",Bir öğrenci grubu şarkı söylüyordu ve mekan çoktan alevlenmişti.
,"Disliking that clatter, he leaned against a wall in the darkness by himself. ","Disliking that ruckus, he found a dark wall to lean against, alone."," Disliking that clatter, he approached a dark wall alone.",その喧騒を嫌い、薄暗い壁にひとり寄りかかる。,[=JP],"Канон, которому не пришлась по душе эта шумиха, в одиночестве встал у тёмной стены.","Desgostando daquele tumulto, ele encontrou uma parede escura para se encostar, sozinho.",討厭這份喧囂的嘉音，獨自一人把背靠到了陰暗處的牆壁上。,讨厌这份喧嚣的嘉音，独自一人把背靠到了阴暗处的墙壁上。,"Dato che non gli piaceva quel baccano, si avvicinò da solo ad una parete buia.","Non sopportando quel baccano, si appoggiò ad una parete oscurata in solitudine.","Bu gürültüyü sevmediğinden, tek başına yaslanabileceği karanlık bir duvar buldu."
