Ushiromiya Jessica,"""......... ...Well, even if she did show up, I'm sure she would've said something about how it wasn't appropriate for a successor of the Ushiromiya Family. ...So isn't it better this way? Ahahahahahaha."" ","""............... ...Well, even if she had come, she'd just have said something about how it wasn't appropriate for the successor to the Ushiromiya family anyway. ...So what the hell's my problem. Ahahahahahaha.""","""...............Well, if she had been talking about that, I'm sure she'd have said something about how it wasn't appropriate for the successor to the Ushiromiya family. ...So isn't it alright this way? Ahahahahahaha.""",「……………。…まぁ、来たところでどうせ、右代宮家の跡継ぎとして相応しくないとか何とか言うんだろうぜ。…ならこれでいいんじゃねぇかよ。あはははははは。」,「……………。…まぁ、来たところでどうせ、右代宮家の跡継ぎとして相応しくないとか何とか言うんだろうぜ。…ならこれでいいんじゃねぇかよ。あはははははは」,"""............ ...Ну, если бы она заговорила об этом, уверена, она бы заявила, что это недостойно преемника семьи Уширомия. ...Так может хорошо, что всё обернулось именно таким образом? Аха‐ха‐ха‐ха‐ха‐ха.""","""............... ...Bom, mesmo se ela tivesse aparecido lá, tenho certeza que ele só teria dito algo sobre como não era apropriado para a sucessora da família Ushiromiya fazer aquilo. ...Então não é melhor assim? Ahahahahahaha.""",「……………。…反正就算來了，也肯定會說些什麼“這與右代宮家繼承者不相稱”之類的吧。…既然如此，那現在這樣不就正好嘛。啊哈哈哈哈哈哈。」,「……………。…反正就算来了，也肯定会说些什么“这与右代宫家继承者不相称”之类的吧。…既然如此，那现在这样不就正好嘛。啊哈哈哈哈哈哈。」,"""... Beh, se ha parlato di quello, sono certa che avrà detto qualcosa riguardo quanto sia inappropriato per un successore della famiglia Ushiromiya. ... Quindi in questo modo non va bene? Ahahahahahaha.""","""...Beh, anche se fosse venuta, avrebbe detto qualcosa su come questo non fosse appropriato per l'erede della famiglia Ushiromiya. Quindi non è forse meglio così? Ahahahahahaha.""","""............... ...Yani, gelseydi bile, Ushiromiya ailesinin halefi için bunun uygun olmadığı hakkında bir şeyler söylerdi zaten. ...Böylesi daha iyi değil mi? Ahahahahahaha."""
,Jessica laughed at what she was sulking over. ,Jessica laughed at what she was sulking over.,[=UP],朱志香は、自分が何を不貞腐れてるのだろうと笑う。,[=JP],"Джессика смеялась, одновременно чувствуя обиду.",Jessica riu do que ela estava amuada.,朱志香笑了，心想自己都在慪什麼氣啊。,朱志香笑了，心想自己都在怄什么气啊。,Jessica rideva su ciò che la faceva imbronciare.,"Jessica rise, chiedendosi il motivo per cui si stesse deprimendo...",Jessica surat astığı şeye güldü.
,...She laughed at what kind of words she could possibly have been expecting. ,...Laughed at what kind of words she would have had to receive to be satisfied.,...She laughed at what kind of words she would have had to receive to be satisfied.,…さっき、どんな言葉を掛けられれば自分は満足したのかを想像して、笑う。,[=JP],"...Стараясь окончательно успокоиться, она смеялась над тем, какие слова ей пришлось бы выслушать.",...Riu do tipo de palavra que ela teria que ter recebido para ficar satisfeita.,…她笑著，想像著剛才自己究竟是要聽到什麼話才會滿足。,…她笑着，想象着刚才自己究竟是要听到什么话才会满足。,... rise pensando a quali parole avrebbe voluto sentirsi dire per essere soddisfatta.,"Rise, immaginandosi le parole che avrebbero potuto soddisfarla.",...Ne tür sözler beklediğini düşünerek güldü.
,"...That was dumb of me. In the end, I was just acting like an entitled brat. I'm a little exasperated with myself, and it makes me want to laugh. ","......Ridiculous. In the end, I'm just a spoiled little kid.{n}I can't believe myself—it's almost funny.","......It was ridiculous. In the end, I was just acting like a kid. I'm a little surprised, and it makes me want to laugh.",……馬鹿馬鹿しかった。結局、自分がお子様なだけだった。何だか呆れて、笑いたくなる。,……馬鹿馬鹿しかった。結局、自分がお子様なだけだった。{n}何だか呆れて、笑いたくなる。,"......Ну что за глупости. В конечном итоге, я просто повела себя как ребёнок.{n}Я слегка удивлена, и это меня смешит.","......Ridículo. No fim, sou só uma garota mimada.{n}Não consigo acreditar em mim mesma — chega a ser engraçado.",……真是好蠢啊。結果，我只是個想被捧的小孩子。{n}總覺得自己好傻，好想笑。,……真是好蠢啊。结果，我只是个想被捧的小孩子。{n}总觉得自己好傻，好想笑。,"... Era ridicolo. Alla fine, mi stavo comportando come una bambina. Sono un po' sorpresa e questo mi fa venire da ridere.","Che stupidaggine. Alla fine mi stavo solo comportando come una bambina.{n}Ero un po' esasperata con me stessa, e questo mi faceva venire da ridere.","......Saçmalık. Nihayetinde, ben sadece şımarık küçük bir çocuğum.{n}Kendime biraz kızıyorum ve bu bende gülme isteği uyandırıyor."
Kanon,"""...Milady."" ","""......Milady.""",[=UP],「……お嬢様。」,「……お嬢様」,"""......Миледи.""","""......Ojou‐sama.""",「……小姐。」,[=CHT],"""... Milady.""","""...Signorina.""","""......Leydim."""
Ushiromiya Jessica,"""Wah, ...Kanon-kun. D-Don't scare me like that, hahaha...! *cough*cough*!"" ","""wah!—Kanon‐kun... D‐don't scare me like that, hahaha...! *cough*cough*!""","""Wa, ...Kanon-kun. D, don't scare me like that, hahaha...! *cough*cough*!""",「わッ、…嘉音くんか。お、驚かすなよ、ははは…！ごほんごほん！」,「わッ、…嘉音くんか。お、驚かすなよ、ははは…！　ごほんごほん！」,"""Ой... Канон‐кун. Н‐не пугай меня так, ха‐ха‐ха!..*кха*кха*!""","""Wah! Kanon‐kun... N‐Não me assuste assim, hahaha...! *cof*cof*!""",「哇啊，…是嘉音君啊。別、別嚇我呀，哈哈哈…！咳哄咳哄！」,「哇啊，…是嘉音君啊。别、别吓我呀，哈哈哈…！咳哄咳哄！」,"""Wa... Kanon-kun. N-Non spaventarmi così, hahaha...! *cough*cough*!""","""Wah... Kanon-kun? M-Mi hai spaventata, ahahah...! Coff, coff!""","""wah!—Kanon-kun... B-Beni böyle korkutma, hahaha...! *cough*cough*!"""
,"Just as she was about to force a laugh, Kanon suddenly started talking to her, and she choked. ","Kanon had suddenly started talking to her just as she had tried to force a laugh, so she choked.","Just as she had tried to force a laugh, Kanon had suddenly started talking to her, and she choked.",無理に笑おうとした矢先に、不意に嘉音が声をかけてきたので、咽込んでしまう。,[=JP],"Когда она попыталась вновь рассмеяться, Канон неожиданно заговорил с ней, и она поперхнулась.","Kanon havia começado a falar de repente com ela, logo quando Jessica tentava forçar uma risada, e com isso ela acabou se engasgando.",她正要強逼自己再次大笑起來的時候，冷不防被嘉音打了聲招呼，搞得她咳嗽了起來。,她正要强逼自己再次大笑起来的时候，冷不防被嘉音打了声招呼，搞得她咳嗽了起来。,"Non appena provò a forzare un sorriso, Kanon cominciò improvvisamente a parlarle, e lei si emozionò.","Kanon le rivolse la parola all'improvviso proprio mentre stava per forzare una risata, per cui finì col strozzarsi.","Tam kendini gülmeye zorlarken Kanon aniden kendisiyle konuşmaya başlamıştı, bu yüzden tıkandı."
Ushiromiya Jessica,"""What's up? Got something to say...?"" ","""What? Something to say...?""",[=UP],「何？　何か用…？」,[=JP],"""Что? Ты хочешь мне чего‐то сказать?""","""O quê? Algo a dizer...?""",「怎麼了？有什麼事嗎…？」,「怎么了？有什么事吗…？」,"""Cosa? Qualcosa da dire...?""","""Che c'è? Ti serve qualcosa...?""","""Ne oldu? Bir şey mi söyleyecektin...?"""
Kanon,"""..................... Umm."" ",""".....................umm.""","""..............., umm.""",「…………………、その。」,「…………………、その」,"""............... М‐м‐м.""",""".....................Bem.""",「…………………，這個。」,「…………………，这个。」,"""... umm.""","""...Ehm.""",[=UP]
Ushiromiya Jessica,"""...Yes?"" ","""......Yeah?""","""......Yes?""",「……うん？」,[=JP],"""......Да?""","""......Sim?""",「……嗯？」,[=CHT],"""... Sì?""","""...Sì?""","""......Evet?"""
,Jessica's expression became the one she always wore when looking at Kanon. The listless Jessica from a second ago was gone. ,Jessica's expression had become the one Kanon always saw.{n}The listless Jessica from a second ago was gone.,Jessica's expression became the one she always had when looking at Kanon. The listless Jessica from a second ago was gone.,朱志香の表情は、嘉音がいつも見るそれになっていた。ついさっきまでの物憂げな朱志香ではない。,朱志香の表情は、嘉音がいつも見るそれになっていた。{n}ついさっきまでの物憂げな朱志香ではない。,"Выражение лица Джессики стало тем, которое оно всегда приобретало, когда она смотрела на Канона.{n}От вялой Джессики не осталось и следа.",A expressão de Jessica havia se tornado aquela que Kanon sempre via.{n}A Jessica apática de um segundo atrás desapareceu.,朱志香的表情，化作了嘉音平時一直都有看到的那副樣子。{n}不再是直至剛才的那個無精打采的朱志香了。,朱志香的表情，化作了嘉音平时一直都有看到的那副样子。{n}不再是直至刚才的那个无精打采的朱志香了。,L'espressione di Jessica divenne quella che aveva sempre quando guardava Kanon. La Jessica indifferente di un secondo prima era andata via.,L'espressione di Jessica divenne quella che Kanon vedeva abitualmente.{n}Non era più la Jessica malinconica di un secondo prima.,Jessica'nın ifadesi Kanon'un her zaman gördüğü ifadeye dönüşmüştü.{n}Bir saniye önceki cansız Jessica gitmişti.
,"If he had still only known Jessica as the eventual successor to the Ushiromiya family, as he had until yesterday, ...he might have mistakenly thought that Jessica's mood had sprung back to normal. ","If he still only knew Jessica as the successor to the Ushiromiya family, as he did until today, ...he would have mistakenly thought that Jessica's mood had sprung back to normal."," If he had still only known of Jessica as the successor to the Ushiromiya family, as he had until yesterday, ...he would have mistakenly thought that Jessica's mood had sprung back to normal.",それは、右代宮本家跡継ぎの朱志香しか知らなかった昨日までの自分だったなら、…朱志香はもう吹っ切れて元気を取り戻したと勘違いをするところだろう。,[=JP],"Если бы Канон знал Джессику только как преемницу семьи Уширомия, как было до вчерашнего дня... То ошибочно бы посчитал, что настроение Джессики пришло в норму.","Se ele ainda conhecesse Jessica apenas como a sucessora da família Ushiromiya, como ele fez até hoje, ...ele teria erroneamente pensado que o humor de Jessica havia dado um salto de volta ao normal.",如果我還是那個昨天之前的我，那個只認識作為右代宮本家繼承者的朱志香的我的話，…那麼我一定會把這誤會成，朱志香已經扔掉了心中的委屈，重新打起精神來了吧。,如果我还是那个昨天之前的我，那个只认识作为右代宫本家继承者的朱志香的我的话，…那么我一定会把这误会成，朱志香已经扔掉了心中的委屈，重新打起精神来了吧。,"Se avesse conosciuto Jessica solo come successore della famiglia Ushiromiya, come aveva fatto sino a ieri... avrebbe erroneamente pensato che il suo umore fosse ritornato alla normalità.","Se Kanon fosse rimasto la stessa persona che, fino al giorno prima, conosceva Jessica solo in quanto erede della famiglia Ushiromiya... avrebbe potuto erroneamente pensare che si fosse calmata, e che il suo umore fosse tornato alla normalità...","Bugüne kadar olduğu gibi Jessica'yı sadece Ushiromiya ailesinin halefi olarak tanısaydı, ...yanılgıya düşerek Jessica'nın ruh halinin normale döndüğünü düşünebilirdi."
,...But that wasn't right. ,......But that was wrong.,[=UP],……でも、それは違う。,[=JP],......Но это было не так.,......Mas isso estava errado.,……然而，這麼想是錯的。,……然而，这么想是错的。,... Ma questo era sbagliato.,Ma non era così.,......Ama bu yanlıştı.
,"He now knew a part of her that he couldn't have {y:1:""seen""}{n:1:""seen""} until yesterday, so he understood that there was no way Jessica actually felt the way she appeared. ","He now knew a part of her that he could not {y:1:‘see’}{n:1:see} until today, so he understood that there was no way that, on the inside, Jessica was just as she appeared."," He now knew a part of her that he could not have seen until yesterday, so he understood that there was no way that, on the inside, Jessica was just as she appeared.",昨日までは視えなかった彼女を知ってしまったから、今の朱志香が見掛け通りの胸中であるわけがないと理解できた。,[=JP],"Теперь Канон знал ту её часть, которую он не {y:1:‘видел’}{n:1:видел} до вчерашнего дня, поэтому он понял, что внутри Джессика не такая, как внешне.","Ele agora conhecia uma parte dela que até então ele não conseguia {y:1:‘ver’}{n:1:ver}, por isso ele entendia que não tinha como, no interior, Jessica estar assim como ela parecia.",正因為我知曉了那個昨日以前無法見到的她，所以我清楚，此刻朱志香的內心，絕不可能和她外表所展露出的神情一樣。,正因为我知晓了那个昨日以前无法见到的她，所以我清楚，此刻朱志香的内心，绝不可能和她外表所展露出的神情一样。,"Ora lui conosceva una parte di lei che non aveva visto sino a ieri, così capì che Jessica, dentro, non era affatto come appariva.","Ora conosceva una parte di lei che fino a ieri non avrebbe potuto {y:1:‘vedere’}{n:1:vedere} veramente, per cui poté comprendere che non c'era modo che Jessica si sentisse così come appariva dall'esterno.",Jessica'nın bugüne kadar {y:1:‘göremediği’}{n:1:göremediği} bir parçasını artık biliyordu ve bu yüzden Jessica'nın içten içe göründüğü gibi olmasının mümkün olmadığını anladı.
Ushiromiya Jessica,"""Oh, ...about today's cultural festival... ...Well, thanks for coming with me so I could show off. You saved my butt out there."" ","""Ah... About today's cultural festival... ...Well, thanks for coming with me so I could show off. You really helped.""","""Ah..., about today's cultural festival, ...well, thanks for coming with me so I could show off. You really helped.""",「あ…、今日は文化祭、…いや、私の見栄に付き合ってくれてありがとうな。助かったぜ。」,「あ…、今日は文化祭、…いや、私の見栄に付き合ってくれてありがとうな。助かったぜ」,"""Ах... О сегодняшнем культурном фестивале... ...Ну, спасибо за то, что пришёл и помог мне похвастаться. Ты действительно меня выручил.""","""Ah... Sobre o festival cultural de hoje... ...Bem, obrigada por ir comigo para que eu pudesse me exibir. Você realmente me salvou.""",「啊…，今天的文化祭，…不對，今天能來給我撐面子，真是太謝謝你了。得救嘞。」,「啊…，今天的文化祭，…不对，今天能来给我撑面子，真是太谢谢你了。得救嘞。」,"""Ah... riguardo al festival culturale di oggi... beh, grazie per essere venuto in modo tale che potessi esibirmi. Sei stato davvero d'aiuto.""","""Ah... riguardo al festival di oggi... Beh, grazie per essere venuto con me in modo da farmi fare bella figura. Mi hai parato il sedere.""","""Ah, ...bugünkü kültür festivali hakkında... ...Şey, gösteriş yapabilmem için benimle geldiğin için teşekkürler. Gerçekten yardımcı oldun."""
Kanon,"""...That song. ...You were really good."" ","""......Your singing. ...It was good.""","""......That song. ...You were good.""",「……お歌。…お上手でした。」,「……お歌。…お上手でした」,"""......Та песня. ...Вы были великолепны.""","""......Sua música. ...Era boa.""",「……您的歌。…唱得很不錯。」,「……您的歌。…唱得很不错。」,"""... Quella canzone. ... È stata brava.""","""...La sua canzone... era molto bella.""","""......Şarkı söyleyişiniz. ...Güzeldi."""
Ushiromiya Jessica,"""Wha?! ......Ah, ......ahahahahahaha?! Re‐really? I'm embarrassed..."" ","""Wha?! ......Ah, .........ahahahahahaha?! Re‐really? I'm embarrassed...""","""Wha?! ......Ah, .........ahahahahahaha?! R, really, I'm embarrassed...""",「っえ？！　……あ、………あはははははは？！　そ、そうかよ、照れるぜ…。」,「っえ？！　……あ、………あはははははは？！　そ、そうかよ、照れるぜ…」,"""Что?! ......Ах... аха‐ха‐ха‐ха‐ха‐ха‐ха?! П‐право, ты меня смущаешь...""","""Quê?! ......Ah, .........ahahahahahaha?! Me‐Mesmo? Que vergonha...""",「哎？！……啊、………啊哈哈哈哈哈哈？！是、是嘛，我會臉紅嘞…」,「哎？！……啊、………啊哈哈哈哈哈哈？！是、是嘛，我会脸红嘞…」,"""Cos?! ... Ah... ahahahahahaha?! D-Davvero, sono imbarazzata...""","""Eeh...?! Ah... Ahahahahahah?! D-Davvero? Mi fai arrossire...""","""Ne?! ......Ah, .........ahahahahahaha?! Ge-Gerçekten mi? Utandım..."""
,"Even though she had heard the words she most wanted to hear, Jessica acted shyly and couldn't accept them openly. ","Even though she had heard the words she had most wanted to hear, ...Jessica became shy, and couldn't accept them frankly.","Even though she had heard the words she had most wanted to hear, Jessica acted shyly, and couldn't accept them seriously.",一番欲しかった言葉をもらえたくせに、…朱志香は照れてしまい、それを素直に受け取れない。,[=JP],"Даже при том, что она услышала слова, которые ей хотелось слышать, Джессика вела себя застенчиво и не принимала их всерьёз.","Mesmo tendo ouvido as palavras que ela mais queria ouvir, ...Jessica ficou tímida, e não conseguiu aceitá‐las francamente.",明明得到了最想要的一句話，…但朱志香卻紅起了臉，無法坦率接受。,明明得到了最想要的一句话，…但朱志香却红起了脸，无法坦率接受。,"Nonostante le avesse detto le parole che più voleva sentire, Jessica si comportò timidamente, e non riusciva ad accettarle seriamente.","Nonostante avesse ricevuto le parole che avrebbe voluto sentire di più... Jessica si sentì in imbarazzo, e non riuscì a prenderle con sincerità.","En çok duymak istediği sözleri duymuş olmasına rağmen, ...Jessica utangaçlaştı ve bunları dürüstçe kabul edemedi."
Kanon,"""...I cannot sing. And I don't know how to play any instruments other than the harmonica and the recorder, which I learned in elementary school. ...So I simply assumed you were the same, Milady."" ","""......I cannot sing. And I don't know how to play any instruments other than the harmonica and the recorder, which I learned in elementary school. ...So I had just assumed that you were the same, Milady.""","""......I cannot sing. And I don't know how to play any instruments other than the harmonica and the recorder, which I learned in elementary school. ...So I had just assumed that Milady was the same.""",「……僕には歌は歌えません。楽器も、小学校で習ったハーモニカとリコーダー笛しか知りません。…だからお嬢様も同じだろうと決め付けていました。」,「……僕には歌は歌えません。楽器も、小学校で習ったハーモニカとリコーダー笛しか知りません。…だからお嬢様も同じだろうと決め付けていました」,"""......Я не умею петь. И я не знаю, как играть на каких либо иных инструментах, кроме губной гармошки и проигрывателя, освоенных мною в начальной школе. ...Поэтому я и полагал, что миледи в этом отношении имеет такой же уровень.""","""......Eu não consigo cantar. E não sei como tocar nenhum instrumento além da gaita e da flauta, os quais aprendi no primário. ...Por isso eu havia apenas assumido que você era igual, ojou‐sama.""",「……我不會唱歌。樂器也只知道小學的時候學過的口琴和豎笛。…所以我一直以為小姐應該也是這樣。」,「……我不会唱歌。乐器也只知道小学的时候学过的口琴和竖笛。…所以我一直以为小姐应该也是这样。」,"""... Io non so cantare. E non so suonare nessuno strumento che non sia l'armonica o il flauto dolce, che ho imparato alle elementari... quindi avevo ipotizzato che anche per Milady fosse lo stesso.""","""...Io non sono capace di cantare. E non so suonare nessuno strumento che non sia l'armonica o il flauto dolce, che ho imparato alle elementari... Perciò avevo dato per scontato che per lei fosse lo stesso, signorina.""","""......Ben şarkı söyleyemiyorum. Ve ilkokulda öğrendiğim armonika ve flüt dışında herhangi bir enstrüman çalmayı bilmiyorum. ...Bu yüzden Leydim, sizin de öyle olduğunuzu düşünmüştüm."""
,"...At the time, Kanon had never felt as though he'd been looking down on Jessica in this way. ",...Kanon hadn't been consciously looking down on Jessica to that degree.,...Kanon hadn't planned on looking down on Jessica that much.,…嘉音はそこまで朱志香を見下していたつもりはない。,[=JP],...Канон вовсе не пытался смотреть на Джессику свысока.,...Kanon não estava conscientemente menosprezando Jessica àquele degrau.,…嘉音並沒有那麼看不起朱志香。,…嘉音并没有那么看不起朱志香。,... Kanon non aveva intenzione di sottovalutare Jessica così tanto.,...Kanon non aveva mai avuto l'intenzione di giudicare Jessica con una tale accondiscendenza.,"...Bu sırada Kanon, Jessica'ya bu şekilde tepeden baktığını hiç hissetmemişti."
,But all the people he'd seen playing special instruments were on the other side of the Braun tubes in the TV. ,But people playing unique instruments were always on the other side of the Braun tubes in the TV., But people playing unique instruments were always on the other side of the Braun tubes in the TV.,でも、特殊な楽器を演奏する人物はいつもテレビのブラウン管の向こう側。,[=JP],"Но люди, играющие на уникальных инструментах, всегда были по другую сторону электронно‐лучевой трубки телевизора.",Todas as pessoas que tocavam instrumentos únicos estavam sempre do outro lado dos tubos de Braun na TV.,只不過，由於在演奏特殊樂器的人物總是在電視機顯像管的另一邊。,只不过，由于在演奏特殊乐器的人物总是在电视机显像管的另一边。,Ma le persone che suonano strumenti unici sono sempre dall'altra parte del tubo catodico delle TV.,Ma le persone che suonavano strumenti musicali particolari erano sempre dall'altra parte del tubo catodico della TV...,Ama benzersiz enstrümanlar çalan insanlar her zaman televizyondaki Braun tüplerinin diğer tarafındaydı.
