Ushiromiya Jessica,"""If you want to say Kanon-kun's furniture when he's working as a servant, that's fine. ...But...in that case, ...don't you think you can create a self for when you aren't furniture, for when you're human?"" ","""If you want to say that the Kanon‐kun working as a servant is furniture, that's alright. ......But, ...in that case, ......don't you think you can make another self for when you aren't furniture, when you're human?""","""If you want to say that the Kanon-kun working as a servant is furniture, that's alright. ......But, ...in that case, ......don't you think that you can make a part of yourself for when you aren't furniture, when you're human?""",「使用人としての嘉音くんが家具だというなら、それでもいいよ。……でも、…なら。……嘉音くんは家具でない時の、人間の時の自分を作ってもいいとは思わない？」,[=JP],"""Если ты хочешь сказать, что Канон‐кун, работающий слугой, является мебелью, то ладно. ......Но... в таком случае... разве тебе не стоит создать часть себя, являющуюся не мебелью, но человеком?""","""Se você quer dizer que o Kanon‐kun, que trabalha como serviçal, é uma mobília, então tudo bem. ......Mas, ...nesse caso, ......você não acha que pode fazer outro ""eu"" para quando você não é uma mobília, quando você é humano?""",「如果要說作為傭人的嘉音君是家具的話，那就這樣好了。……不過，…既然如此。……嘉音君你就不覺得，在不是家具的時候，再去創造個身為人類的自己也無妨嗎？」,「如果要说作为佣人的嘉音君是家具的话，那就这样好了。……不过，…既然如此。……嘉音君你就不觉得，在不是家具的时候，再去创造个身为人类的自己也无妨吗？」,"""Se vuoi dire che quando Kanon-kun lavora come maggiordomo è un mobile, va bene. ... Tuttavia... in questo caso... non pensi che tu possa creare una parte di te per quando non sei un mobile, per quando sei un umano?""","""Se il Kanon nel ruolo di domestico vuole dire di essere un mobile, va bene... Però... in tal caso... non pensi di poterti creare una versione di te stesso per quando non sei un mobile, ossia per quando sei un umano?""","""Hizmetkâr olarak çalışan Kanon-kun'un mobilya olduğunu söylemek istiyorsan, sorun değil. ......Ama, ...bu durumda, ......mobilya olmadığın, insan olduğun zamanlar için başka bir benlik yaratabileceğini düşünmüyor musun?"""
Kanon,"""...Only a human like Milady can embrace that possibility. ...I am not like that. I have no future, no possibilities, ...no dream that I am allowed to see. ","""......Only a human like you can embrace that possibility. ...I am not like that. I have no future, no possibilities, and no dreams I am permitted to see.""","""......Only a human like Milady can embrace that possibility. ...I am not like that. My future and possibilities, aren't even a dream I am supposed to see. ",「……そんな可能性を抱けるのはお嬢様が人間だからです。…僕はそうじゃない。僕には未来も可能性も、見るべき夢もない。,「……そんな可能性を抱けるのはお嬢様が人間だからです。…僕はそうじゃない。僕には未来も可能性も、見るべき夢もない」,"""......Лишь такой человек как вы, миледи, обладаете подобной возможностью. ...Я не такой. Мне не дозволено даже мечтать о своем будущем и возможностях.""","""......Apenas uma humana como você consegue abraçar essa possibilidade.{n}...Eu não sou assim. Não tenho futuro, ou possibilidades, ou sonhos que sou permitido ver.""",「……小姐能抱有這種可能性，是因為您是人類。…但我不是。我沒有未來，沒有可能性，也沒有該去仰望的夢想。」,「……小姐能抱有这种可能性，是因为您是人类。…但我不是。我没有未来，没有可能性，也没有该去仰望的梦想。」,"""... Solo un umano come Milady può abbracciare questa possibilità. ... Io non sono così. Il mio futuro e le mie possibilità non sono neanche un sogno che io possa vedere.","""...Solo un'umana come lei, signorina, può considerare tale possibilità... Io non sono fatto così. Non ho nessun futuro, nessun'aspettativa, nessun sogno a cui poter aspirare.""","""......Sadece senin gibi bir insan bu olasılığı kucaklayabilir. ...Ben öyle değilim. Geleceğim, imkanlarım ve görmeme izin verilen hayallerim yok."""
Kanon,"......So, Milady, Please don't... say any more... ...cruel things..."" ","""............So, Milady. Please don't...say any more.......cruel things......""","............So, Milady. Please don't, ...say any more, ......cruel things......""",…………だからお嬢様。それ以上、…残酷なことを、……言わないでください……。」,「…………だからお嬢様。それ以上、…残酷なことを、……言わないでください……」,"""............Поэтому, миледи, умоляю... не произносите больше... этих жестоких слов...""","""............Por isso, ojou‐sama. Por favor, não...diga mais......coisas cruéis......""",「…………所以小姐。您就別再，…對我說，……這些殘酷的話了……」,「…………所以小姐。您就别再，…对我说，……这些残酷的话了……」,"... quindi, Milady... per favore non... dire più... cose crudeli...""","""Perciò, signorina. Per favore, la smetta... di pronunciare... simili crudeltà...""","""............Yani, Leydim. Lütfen...daha fazla acımasızca.......şey söylemeyin......"""
Ushiromiya Jessica,"""Why... Why...do you say stuff like that...?"" ","""Why... Why......are you saying that...""","""Why... Why, ......are you saying that...""",「何でだよ…。何で、……そんなことを言うんだよ…。」,「何でだよ…。何で、……そんなことを言うんだよ…」,"""Почему... почему... ты говоришь такое...""","""Por quê...? Por que você está dizendo isso...?""",「為什麼啊…。你為什麼，……要說這種話啊…」,「为什么啊…。你为什么，……要说这种话啊…」,"""Perché... perché... dici questo...""","""Perché... Perché... dici queste cose...?""","""Neden... Neden......böyle şeyler söylüyorsun...?"""
Kanon,"""Because it seems you mistakenly think I'm a human, the same as you, Milady. We are different sorts of beings. I just wanted to make that clear."" ","""Because it seems that you are mistaking me for...a human just like you, Milady. We are different beings. I just wanted to make that clear.""","""Because it seems that you are making the mistake that I am a human, just like you are, Milady. We are different beings. I just wanted to make that clear.""",「お嬢様が僕のことを、…ご自分と同じ、人間だと勘違いなされているようだからです。僕とお嬢様は違う存在。それをはっきり申し上げておきたかったのです。」,「お嬢様が僕のことを、…ご自分と同じ、人間だと勘違いなされているようだからです。僕とお嬢様は違う存在。それをはっきり申し上げておきたかったのです」,"""Потому что вы, по‐видимому, пребываете в заблуждении, будто я такой же человек, как и вы, миледи. Мы разные люди. Я просто хотел ясно дать это понять.""","""Porque parece que você está me confundindo com...um humano como você, ojou‐sama. Somos seres diferentes. Eu só queria deixar isto claro.""",「因為小姐您好像把我誤會成了，…和您一樣的人類。我和小姐是不同的存在。我想把這點明明白白地告訴您。」,「因为小姐您好像把我误会成了，…和您一样的人类。我和小姐是不同的存在。我想把这点明明白白地告诉您。」,"""Perché sembra che stia commettendo l'errore di credere che io sia un umano come lei, Milady. Noi siamo cose diverse. Volevo solo mettere in chiaro questa cosa.""","""Perché pare che stia commettendo l'errore di credere che... io sia un umano come lei, signorina. Io e lei siamo creature diverse. Volevo esprimermi a riguardo in maniera chiara.""","""Leydim, çünkü siz beni tıpkı sizin gibi bir...insan sanıyorsunuz. Biz farklı varlıklarız. Bunu açıklığa kavuşturmak istedim."""
Kanon,"""...I heard from Shannon. Something about Milady liking me."" ","""......I heard from Shannon. Something about you taking a liking to me.""","""......I heard from Shannon. Something about Milady starting to like me.""",「……紗音に聞きました。お嬢様は、僕のことをお気に入りになられているとか。」,「……紗音に聞きました。お嬢様は、僕のことをお気に入りになられているとか」,"""......Я слышал от Шаннон, что являюсь предметом вашего романтического интереса.""","""......Eu ouvi da Shannon. Algo sobre você gostar de mim.""",「……紗音告訴過我了。說小姐您，很中意我之類的。」,「……纱音告诉过我了。说小姐您，很中意我之类的。」,"""... Ho sentito da Shannon. Qualcosa circa al fatto che sto cominciando a piacere a Milady.""","""...Shannon me lo ha detto. Qualcosa in merito al fatto che lei si sia affezionata a me.""","""......Shannon'dan duydum. Benden hoşlandığınızla ilgili bir şeyler."""
Ushiromiya Jessica,"""Huh, ...wha?! Ah, ......no, wahaha..."" ","""Huh, ......huh?! Ah, .........no, wahaha...""","""Huh, ......wha?! Ah, .........no, wahaha...""",「え、……え？！　あ、………いや、わはは…。」,「え、……え？！　あ、………いや、わはは…」,"""А... чт‐?! Ах... нет, ва‐ха‐ха...""","""Hã, ......hã?! Ah, .........não, wahaha...""",「哎、……哎？！啊，………也沒，哇哈哈…」,「哎、……哎？！啊，………也没，哇哈哈…」,"""Huh... cos?! Ah... no, wahaha...""","""Eh... Eh?! Ah... no, wahahah...""","""Ha, ......ne?! Ah, .........hayır, wahaha..."""
Kanon,"""...I look almost identical to a human. So, ......like Shannon, I could probably delude myself into thinking I'm human...and pretend to love, for a time."" ","""...I look almost identical to a human. Therefore, .........like Shannon, maybe I could delude myself that I am human, and for a time, pretend to love.""",[=UP],「…僕は人間に限りなく近い姿をしています。だから、………紗音のように、自分を人間だと錯覚して、一時、恋愛の真似事をすることもできるかもしれない。」,「…僕は人間に限りなく近い姿をしています。だから、………紗音のように、自分を人間だと錯覚して、一時、恋愛の真似事をすることもできるかもしれない」,"""...Я выгляжу почти как человек. Поэтому... как и Шаннон, возможно, я могу обманывать себя, будто я человек, и на какое‐то время притвориться влюбленным.""","""...Pareço quase idêntico a um humano. Mas, .........assim como a Shannon, talvez eu possa me iludir pensando que sou humano e, por um tempo, até fingir amar.""",「…我長著無限接近於人類的外貌。所以，………或許我也可以像紗音一樣，誤以為自己是人類，模仿人類去談一時的戀愛。」,「…我长着无限接近于人类的外貌。所以，………或许我也可以像纱音一样，误以为自己是人类，模仿人类去谈一时的恋爱。」,"""... Io sembro quasi identico ad un umano. Pertanto... come Shannon, potrei illudermi di essere un umano e, per un certo periodo, ritenermi capace di amare.""","""...Il mio aspetto è quasi identico a quello di un umano. Pertanto... potrei illudermi come Shannon di essere un umano, e, per un certo periodo di tempo, riuscire a pretendere di amarla...""","""...Neredeyse bir insanla aynı görünüyorum. Bu nedenle, .........Shannon'un yaptığı gibi, belki kendimi insanmışım gibi kandırabilir ve bir süreliğine seviyormuş gibi yapabilirim."""
Kanon,"""...But then, I would surely be fooling myself. No, I would be fooling you too, Milady. Shannon and George-sama will definitely fall apart. ...Even though Shannon herself probably realizes that day will come, ...she's taking part in such a stupid..."" ","""...But that would surely be fooling myself. No, it would also be fooling you, Milady. Shannon and George‐sama will definitely fall apart. ...Shannon herself must understand that day will come, and yet she does this...stupid...""","""...But that would surely be fooling myself. No, it would also be fooling you, Milady. Shannon and George-sama will definitely fall apart. ...Even though Shannon herself probably realizes that day will come, ...such a stupid thing...""",「…でも、それは自分を騙しているに違いない。いえ、お嬢様を騙すことにもなるのです。紗音と譲治さまも必ず破綻する。…その日が訪れることを紗音だって理解しているだろうに、…馬鹿なことを。」,「…でも、それは自分を騙しているに違いない。いえ、お嬢様を騙すことにもなるのです。紗音と譲治さまも必ず破綻する。…その日が訪れることを紗音だって理解しているだろうに、…馬鹿なことを」,"""...Но это несомненно будет самообман. Нет, это будет ещё и обманом по отношению к вам, миледи. Шаннон и Джордж‐сама, несомненно, расстанутся. ...Даже несмотря на то, что Шаннон, возможно, понимает, что однажды такой день придёт... Как же это глупо...""","""...Mas isso certamente seria enganar a mim mesmo. Não, também seria o mesmo que enganá‐la, ojou‐sama. A Shannon e o George‐sama definitivamente irão ruir. ...A própria Shannon deve entender que esse dia virá, e ainda assim ela faz isto...é estúpido...""",「…但是，這毫無疑問是在欺騙自己。不，也是欺騙了小姐。紗音和讓治少爺的關係必定會破裂。…紗音自己也知道會有那麼一天到來，…卻還做了那種蠢事。」,「…但是，这毫无疑问是在欺骗自己。不，也是欺骗了小姐。纱音和让治少爷的关系必定会破裂。…纱音自己也知道会有那么一天到来，…却还做了那种蠢事。」,"""... Ma questo equivarrebbe sicuramente a prendermi in giro. No, sarebbe anche prendere in giro lei, Milady. Shannon e George-sama sicuramente non dureranno insieme. ... Anche se Shannon probabilmente ha capito che quel giorno verrà... che cosa stupida...""","""Ma sarebbe di certo un inganno nei confronti di me stesso. No, sarebbe un inganno anche nei suoi confronti, signorina. Shannon e il signorino George sicuramente non dureranno... Anche Shannon forse ha capito che quel giorno arriverà... Che cosa stupida...""","""...Ama bu kesinlikle kendimi kandırmak olurdu. Hayır, bu sizi de kandırmak olurdu Leydim. Shannon ve George-sama kesinlikle birbirlerinden ayrı düşecekler. ...Shannon da o günün geleceğini biliyor olmalı, ama yine de bunu sürdürüyor...aptalca..."""
Ushiromiya Jessica,"""...Th-There's nothing stupid about it!! Sure, George nii-san's a wonderful person, and he's gotta match up to his parents' expectations. ","""There, ......there's nothing stupid about it!! Sure, George nii‐san's a brilliant person, and he's bearing both of his parents' expectations.""","""Th, ......there's nothing stupid about it!! And, George nii-san's a wonderful person, and he's bearing both of his parents' expectations.",「ば、……馬鹿なってことはないだろ！！そりゃ、譲治兄さんは立派な人だし、両親の期待も背負ってる。,「ば、……馬鹿なってことはないだろ！！　そりゃ、譲治兄さんは立派な人だし、両親の期待も背負ってる」,"""З‐здесь нет ничего глупого! Джордж нии‐сан замечательный человек, и он пытается оправдать ожидания своих родителей.""","""Não, ......não tem nada estúpido sobre isso!! É claro, o George nii‐san é uma pessoa brilhante, e ele está carregando as expectativas de ambos os seus pais.""",「怎、……怎麼可以說是蠢事！！沒錯，讓治哥是出色的青年，是背負著雙親的期望。」,「怎、……怎么可以说是蠢事！！没错，让治哥是出色的青年，是背负着双亲的期望。」,"""N... Non c'è niente di stupido in tutto questo!! Inoltre, George nii-san è una persona fantastica, e sta realizzando le aspettative di entrambi i suoi genitori.","""...N-Non c'è niente di stupido in tutto questo!! Inoltre, il cugino George è una persona fantastica, che si fa carico anche delle aspettative di entrambi i suoi genitori.""","""Bunda, ......bunda aptalca bir şey yok!! Elbette, George nii-san çok zeki bir insan ve her iki ebeveyninin de beklentilerini karşılıyor."""
Ushiromiya Jessica,"...I'm sure when it comes to marriage, Aunt Eva'll interfere in various ways, and, umm, I think their future prospects look like they'll be full of trouble, okay?! ...But you know what? George nii-san isn't the kind of guy who'll surrender to that shit! Shannon's no Juliet, and he'll definitely bring her happiness!!"" ","""...And yeah, when it comes to marriage, I'm sure Auntie Eva's gonna interfere in a bunch of ways, and, umm, I think they've got a really tough road ahead of them, alright?! ...But you know, George nii‐san isn't the kind of guy who'll surrender to all that! He won't turn Shannon into Juliet, he'll definitely make her happy!!"""," ...Yeah, when it comes to marriage, I'm sure Eva oba-san will interfere in various ways, and, umm, I think their future prospects look like they'll be full of trouble, alright?! ...But you know, George nii-san isn't the kind of person who'll surrender to all that! Shannon isn't Juliet, he'll definitely bring her happiness!!""",…確かに、結婚とかになれば絵羽叔母さんが色々と口出しをしてくるだろうし、まぁその、前途は多難だと思うぜ？！　…でもな、譲治兄さんはそんなのに屈する人じゃねぇ！　紗音をジュリエットになんかしねぇぜ、きっと幸せにしてくれる！！」,「…確かに、結婚とかになれば絵羽叔母さんが色々と口出しをしてくるだろうし、まぁその、前途は多難だと思うぜ？！　…でもな、譲治兄さんはそんなのに屈する人じゃねぇ！　紗音をジュリエットになんかしねぇぜ、きっと幸せにしてくれる！！」,"""...Да, когда дело дойдёт до брака, я уверена, что тётя Ева любым способом попытается вмешаться, и, м‐м‐м, я думаю, будущее сулит им много испытаний, ладно?! ...Но знаешь, Джордж нии‐сан не тот человек, который так просто сдастся из‐за всего этого! Шаннон не Джульетта, он непременно сможет сделать её счастливой!""","""...Realmente, quando se falar em casamento, tenho certeza que a tia Eva vai interferir de todas as formas e, hmm, acho que eles têm uma estrada realmente difícil à frente deles, tá?! ...Mas você sabe, o George nii‐san não é o tipo de cara que se renderá a tudo isso! Ele não transformará a Shannon em uma Julieta, ele definitivamente a fará feliz!!""",「…而且確實，哥要結婚的話繪羽姑母估計也會從各方面插手，這個嘛，我也覺得他們前途多難嘞？！…可是啊，讓治哥才不會是會向這種事情屈服的人！才不會去讓紗音成為朱麗葉，一定是會使她幸福的！！」,「…而且确实，哥要结婚的话绘羽姑母估计也会从各方面插手，这个嘛，我也觉得他们前途多难嘞？！…可是啊，让治哥才不会是会向这种事情屈服的人！才不会去让纱音成为朱丽叶，一定是会使她幸福的！！」,"... Certo, quando si parlerà del matrimonio, sono sicura che Eva oba-san interferirà in vari modi, e, umm, penso che il loro prospetto per il futuro sarà pieno di problemi, va bene?! ... Ma sai, George nii-san non è il genere di persona che si arrende davanti a tutto ciò! Shannon non è Giulietta, lui le porterà sicuramente tanta felicità!!""","""Certo, quando si parlerà di matrimonio, forse zia Eva interferirà in vari modi, e, ecco, penso che avranno un futuro ricco di ostacoli, va bene...?! Ma vedi, il cugino George non è tipo da arrendersi davanti a tutto questo! Shannon non è una Giulietta qualsiasi, sono certa che la renderà felice!!""","""...Ve evet, iş evliliğe geldiğinde, Eva Teyze'nin çeşitli şekillerde müdahale edeceğinden eminim ve bence önlerinde gerçekten zorlu bir yol var, tamam mı?! ...Ama biliyorsun, George nii-san tüm bunlara teslim olacak türden bir adam değil! Shannon'u Juliet'e dönüştürmeyecek, onu kesinlikle mutlu edecek!!"""
Kanon,"""People cannot engage in romance with furniture. ...What I'm trying to say...is that even if you can love furniture, I cannot love you, Milady."" ","""People and furniture cannot love one another. ...I am trying to say that even if you can love furniture, I cannot love you, Milady.""","""People cannot love furniture. ...I am trying to say that even if Milady can love furniture, I cannot love Milady.""",「人は家具と恋などできない。…お嬢様が家具を愛することができても、僕にお嬢様を愛することができないと、そう申し上げたいのです。」,「人は家具と恋などできない。…お嬢様が家具を愛することができても、僕にお嬢様を愛することができないと、そう申し上げたいのです」,"""Люди не могут любить мебель. ...Я пытаюсь сказать, что даже если вы, миледи, можете любить мебель, я не могу любить вас в ответ.""","""Pessoas e mobílias não podem se amar. ...Estou tentando dizer que mesmo se você puder amar uma mobília, eu não posso amá‐la, ojou‐sama.""",「人和家具無法談戀愛。…就算小姐您能去愛家具，我也無法去愛小姐，我想說的就是這些。」,「人和家具无法谈恋爱。…就算小姐您能去爱家具，我也无法去爱小姐，我想说的就是这些。」,"""Le persone non possono amare i mobili. ... Sto cercando di dire che, anche se Milady può amare i mobili, io non posso amare Milady.""","""Le persone non possono amare i mobili... Sto cercando di dire che, anche se lei è capace di amare un mobile, io non sono capace di amare lei, signorina.""","""İnsanlar mobilyalarla romantizm yaşayamazlar. ...Leydim, siz mobilyaları sevebilseniz bile ben sizi sevemem, söylemeye çalıştığım şey bu."""
Ushiromiya Jessica,"""............Nn-"" ","""..................nn—""","""..................nn-""",「………………ん、」,[=JP],"""..................Нн...""",[=UP],「………………嗯…」,[=CHT],"""... nn-""","""...Nn-""",[=UP]
,Those words of Kanon's...crushed all of Jessica's bittersweet feelings from that day. ,Those words of Kanon's......crushed all of Jessica's bittersweet feelings from today.,"Those words of Kanon's, ......crushed all of Jessica's bittersweet feelings from that day.",その嘉音の言葉は、……朱志香の今日一日の甘酸っぱい気持ち全てを打ち砕く。,[=JP],Сказанные Каноном слова... Разрушили все горько‐сладостные чувства Джессики с того дня.,Aquelas palavras de Kanon......esmagaram todos os sentimentos agridoces que Jessica sentiu hoje.,嘉音的這句話，……將朱志香今天一天酸甜的心情完全打成了碎片。,嘉音的这句话，……将朱志香今天一天酸甜的心情完全打成了碎片。,Quelle parole di Kanon... infransero tutte le sensazioni agrodolci di Jessica di quel giorno.,Quelle parole di Kanon... frantumarono tutti i sentimenti dolceamari che Jessica aveva provato quel giorno.,Kanon'un bu sözleri......Jessica'nın bugün yaşadığı tüm acı-tatlı duyguları yerle bir etti.
