,"But now she had to escape...{n}......If she was targeted next, she would probably lose her life.","But now, she had to escape... ...If she was targeted next, she would probably lose her life. "," But now she had to escape.........If she was targeted next, she would probably lose her life.",だが、今は逃げなければ…。……次に狙われれば命を落とすだろう。,だが、今は逃げなければ…。{n}……次に狙われれば命を落とすだろう。,"Но теперь ей приходилось спасаться бегством...{n}......Если она станет следующей целью, то, несомненно, тут же лишится жизни.","Mas agora ela precisava escapar...{n}......Se ela se tornasse o próximo alvo, provavelmente perderia sua vida.",[=UP],但是，現在得先逃跑…。{n}……如果再被盯上，就會喪命吧。,但是，现在得先逃跑…。{n}……如果再被盯上，就会丧命吧。,[=UP],[=UP],[=UP]
,"And it wouldn't even be funny if the chess player, descended like a god, ended up being attacked and killed by the pieces.","To think that a chess player had descended, thinking they were like a god, ...only to be attacked by the pieces. "," It wasn't even funny that the chess player had descended like a god, and had been attacked by the pieces.",チェスのプレイヤーが、神様気取りで降臨し、駒に討ち取られたなんて、笑い話にもならないのだから。,[=JP],"И смеха не вызывал даже тот факт, что шахматист сошёл, подобно богу, и подвергся нападению фигур.","E não seria engraçado se um jogador de xadrez descendesse como um deus, e terminasse sendo atacado e morto pelas peças.",[=UP],畢竟，棋局棋手自以為是神一般地降臨棋盤，反被棋子吃掉，這可一點都不好笑。,毕竟，棋局棋手自以为是神一般地降临棋盘，反被棋子吃掉，这可一点都不好笑。,[=UP],[=UP],[=UP]
Chiester45,"""45, impact confirmed, target scattered. ......W‐without a doubt, we crushed the Predecessor...!""","""45, Impact Confirmed, Target Scattered. ...W-Without a doubt, we crushed the Predecessor-sama...!"" ","""45, Impact Confirmed, Target Scattered. ......W, without a doubt, we crushed the Predecessor-sama...!""",「４５、着弾確認、標的四散。……ま、間違いなく、先代さまを撃破しました…！」,[=JP],"""45, Подтверждаю Поражение, Цель Рассеялась. ......В‐вне всякий сомнений, мы сокрушили госпожу Предшественницу!..""","""45, impacto confirmado, alvo despedaçado. ......S‐Sem dúvida, nós esmagados a predecessora...!""",[=UP],「45，確認命中，目標四散。……毫、毫無疑問地擊破了先代夫人…！」,「45，确认命中，目标四散。……毫、毫无疑问地击破了先代夫人…！」,[=UP],[=UP],[=UP]
Chiester410,"""Our pile of kill medals is gonna get bigger yeeeet again nyeh. Nihi!""","""Looks like our pile of kill medals is gonna get bigger again nyeh. Nihi!"" ","""Our pile of kill medals is gonna get bigger o-nce again nyeh. Nihi!""",「まぁた私たちの撃墜記章が増えちまうにぇ。にひ！」,[=JP],"""Наша куча медалей за меткую стрельбу вновь станет ещё больше. Нихи!""","""Nossa pilha de medalhas por mortes está ficando caaada vez maior, nyeh. Nihi!""",[=UP],「又可以增加我們的擊墜紀念章了捏。泥嘻！」,「又可以增加我们的击坠纪念章了捏。泥嘻！」,[=UP],[=UP],[=UP]
{f:5:Eva Beatrice},"""What was that about loving couples? You get to enjoy them thrice—once tearing the two apart, once reuniting them, and once tearing them apart again...right? *cackle*hihi{0}hi{0}hi{0}hi{0}hhihi!""","""What was that about loving couples? You get to enjoy tearing the two apart by death, reuniting them, and then tearing them apart again, right? *cackle* Hihihihihihhihi!"" ","""What was that about loving couples? You get to enjoy tearing the two apart by death, reuniting them, and then tearing them apart again, right? *cackle*hihihihihihhihi! ",「愛し合う二人、……何だっけ？　引き裂いて一度、会わせて二度、もう一度引き裂いて三度楽しめる、だっけ？くっくくひひひひひっひひ！,「愛し合う二人、……何だっけ？　引き裂いて一度、会わせて二度、もう一度引き裂いて三度楽しめる、だっけ？　くっくくひひひひひっひひ！」,"""Что там было про пару влюблённых? Можно насладиться разрывом пары влюбленных через смерть, затем воссоединить их, а потом снова разорвать, верно? *смешок*хи‐хи‐хи‐хи‐хи‐хи‐хи!""","""E quanto aos casais apaixonados? Você os aproveita três vezes — uma vez separando os dois, outra reunindo eles, e mais uma vez os separando...certo? *gargalhada*hihi{0}hi{0}hi{0}hi{0}hhihi!""",[=UP],「相愛的兩人，……是要怎麼樣來著？拆散是一次，讓之相會是兩次，然後通過再次拆散樂三次來著？呵、呵呵嘻嘻嘻嘻嘻嘻、嘻嘻！」,「相爱的两人，……是要怎么样来着？拆散是一次，让之相会是两次，然后通过再次拆散乐三次来着？呵、呵呵嘻嘻嘻嘻嘻嘻、嘻嘻！」,[=UP],[=UP],[=UP]
{f:5:Eva Beatrice},"""And I feel great about getting to say goodbye to that fussy‐as‐fuck old hag at the same time. ......Ronove, you don't have any complaints, right?""","""And along with that, I get to say goodbye to that damn fussy old hag. ...Ronove, you don't have any complaints, right?"" ","Along with that, I feel great about getting to say goodbye to that damn fussy granny. ......Ronove, you don't have any complaints, right?""",そのついでにあのクソ五月蝿いババアまでさよならできて、最高にご機嫌よ。……ロノウェ、文句ないわよね？」,「そのついでにあのクソ五月蝿いババアまでさよならできて、最高にご機嫌よ。……ロノウェ、文句ないわよね？」,"""Вдобавок я отлично себя чувствую после того, как окончательно распрощалась с этой суетливой старушенцией. ......Ронове, у тебя ведь нет никаких претензий, верно?""","""E eu me sinto ótima por estar próxima de dar adeus àquela velha espalhafatosa ao mesmo tempo. ......Ronove, você não tem nenhuma objeção, certo?""",[=UP],「順這便，還告別了煩得要死的臭老太婆，心情舒暢到了極點喲。……羅諾威，沒有怨言吧？」,「顺这便，还告别了烦得要死的臭老太婆，心情舒畅到了极点哟。……罗诺威，没有怨言吧？」,[=UP],[=UP],[=UP]
Ronove,"""......Why, of course not, {f:5:Beatrice}‐sama.""","""...I do not, {f:5:Beatrice}-sama."" ","""......I do not, Beatrice-sama.""",「……ございませんとも。ベアトリーチェさま。」,「……ございませんとも。ベアトリーチェさま」,"""......Никак нет, {f:5:Беатриче}‐сама.""","""......É claro que não, {f:5:Beatrice}‐sama.""",[=UP],「……當然沒有。貝阿朵莉切夫人。」,「……当然没有。贝阿朵莉切夫人。」,[=UP],[=UP],[=UP]
{f:5:Eva Beatrice},"""She interfered with the ritual of the witch's epitaph, you see? She revived a sacrifice from the first twilight without permission, and interfered with my ritual. No one has aaany right at all to complain.""","""That person interfered with the ceremony of the witch's epitaph, you see? She revived a sacrifice from the first twilight without permission, obstructing my ceremony. She's got no right at all to complain."" ","""That person interfered with the ceremony of the witch's epitaph, you see? She revived a sacrifice from the first twilight without permission, and interfered with my ceremony. No one has any right at all to complain.",「あいつは、魔女の碑文の儀式を妨害したのよ？　第一の晩の生贄を勝手に蘇らせて、私の儀式を妨害したわ。文句言われる筋合いなんか、なぁんにもないわよ。,「あいつは、魔女の碑文の儀式を妨害したのよ？　第一の晩の生贄を勝手に蘇らせて、私の儀式を妨害したわ。文句言われる筋合いなんか、なぁんにもないわよ」,"""Это особа пыталась помешать проведению ведьминого ритуала, так ведь? Она возродила жертву первых сумерек, не имея на это права, и помешала моему ритуалу. Никто не имеет права предъявлять претензии при таком раскладе.""","""Ela interferiu com o ritual do epitáfio da bruxa, não foi? Ela reviveu um sacrifício do primeiro crepúsculo sem permissão e interferiu no meu ritual. Ninguém tem direito alguuumm de reclamar""",[=UP],「是她在妨礙魔女碑文的儀式喲？擅自復生第一晚的活祭，妨礙了我的儀式。沒有任何理由好對我說三道四。」,「是她在妨碍魔女碑文的仪式哟？擅自复生第一晚的活祭，妨碍了我的仪式。没有任何理由好对我说三道四。」,[=UP],[=UP],[=UP]
{f:5:Eva Beatrice},"""Kuhhihihihhyahyahyahya...! Sucks that she doesn't leave a corpse behind though. ......I was thinking of torturing that old hag to death over and over again endlessly. Kuhhi{0}hihya{0}hyahya...!!""","""Kuhhihihihhyahyahyahya...! But it sucks that she didn't leave a corpse behind. ...And I thought I'd be able to torture that old hag to death over and over again endlessly. Kuhhihihyahyahya...!!"" "," Kuhhihihihhyahyahyahya...! But it sucks that she didn't leave a corpse behind. ......And I thought I'd be able to torture that granny to death over and over again endlessly. Kuhhihihyahyahya...!!""",くっひひひっひゃひゃひゃひゃ…！　しかしズルイなぁ、あいつは死体を残さないのね。……あのババァも、思いっきり何度も無限に虐め殺して遊んでやろうと思ったのに。くっひひひゃひゃひゃ…！！」,「くっひひひっひゃひゃひゃひゃ…！　しかしズルイなぁ、あいつは死体を残さないのね。……あのババァも、思いっきり何度も無限に虐め殺して遊んでやろうと思ったのに。くっひひひゃひゃひゃ…！！」,"""Куххи‐хи‐хи‐хья‐хья‐хяь‐хья!.. Но это досадно, что она не оставила за собой трупа. ......А я то планировала, что смогу ещё очень много раз запытать старушку до смерти. Куххи‐хи‐хья‐хья‐хья!!!""","""Kuhhihihihhyahyahyahya...! Mas é injusto ela não ter deixado um cadáver para trás. ......Eu estava pensando em torturar aquela velha até a morte de novo e de novo eternamente. Kuhhi{0}hihya{0}hyahya...!!""",[=UP],「呵、嘻嘻嘻、嚇嚇嚇嚇…！不過好詐呢，那傢伙不會留下屍體。……虧我還想著，也去無限反覆虐殺下那個老太婆，玩個痛快呢。呵、嘻嘻嚇嚇嚇…！！」,「呵、嘻嘻嘻、吓吓吓吓…！不过好诈呢，那家伙不会留下尸体。……亏我还想着，也去无限反复虐杀下那个老太婆，玩个痛快呢。呵、嘻嘻吓吓吓…！！」,[=UP],[=UP],[=UP]
Ronove,"""........................""","""............"" ",[=UP],「……………………。」,「……………………」,[=UP],[=UP],[=UP],[=JPC],[=JPC],[=UP],[=UP],[=UP]
Ushiromiya Eva,"""G‐George did...?! He didn't show up, when did he come down?!""","""G-George did...?! No, I didn't see him. When did he come down?!"" ","""G, George did...?! He didn't show up, when did he go down?!""",「じょ、譲治が…？！　来てないわよ、いつ降りたのよ？！」,[=JP],"""Д‐Джордж?! Он не пришел! Когда он спускался вниз?!""","""O G‐George...?! Ele não apareceu, quando foi que ele desceu?!""",[=UP],「讓、讓治…？！沒來過，什麼時候下樓的？！」,「让、让治…？！没来过，什么时候下楼的？！」,[=UP],[=UP],[=UP]
Ushiromiya Battler,"""......Wh‐when...? What time was that, again...?""","""...Wh-When, you say...? Uh, what hour was that, again...?"" ","""......Wh, when, you say... What time was that, again...?""",「……い、いつって…。あれは何時位だったっけ…？」,[=JP],"""......Ко‐когда, говоришь... Ещё раз, во сколько это было?..""","""......Q‐Quando...? Que horas foi aquilo...?""",[=UP],「……什、什麼時候…。那是幾點來著…？」,「……什、什么时候…。那是几点来着…？」,[=UP],[=UP],[=UP]
Ushiromiya Jessica,"""I think...it was probably about four or five. ...It was at least an hour ago...""","""I think...it was probably around 4:00 or 5:00. ...At the very least, it was more than an hour ago..."" ","""I think, ...it was probably around 4:00 or 5:00. ...At the very least, it was more than an hour ago...""",「確か、…４時か５時くらいだったかなぁ。…最低でも１時間以上は前だよ…。」,「確か、…４時か５時くらいだったかなぁ。…最低でも１時間以上は前だよ…」,"""Мне кажется, около четырёх или пяти. ...По крайней мере, это было больше часа назад...""","""Eu acho...que foi por volta das cinco ou seis. ...Faz ao menos uma hora...""",[=UP],「好像，…是四、五點左右吧。…最少也是一個多小時前的事了…」,「好像，…是四、五点左右吧。…最少也是一个多小时前的事了…」,[=UP],[=UP],[=UP]
Ushiromiya Battler,"""We got sleepy, and probably dozed off after that... But I think Jessica probably has it right. About one or two hours ago.""","""We got sleepy...and probably dozed off after that... But I think it's probably like Jessica says. About one or two hours ago."" ","""We got sleepy, and probably dozed off after that... But I think it's probably like Jessica says. About one or two hours ago.""",「俺たち、眠くなってその後は多分、居眠りしてたし…。でも多分、朱志香の言う通りだと思うぜ。１時間か２時間くらい前だった。」,「俺たち、眠くなってその後は多分、居眠りしてたし…。でも多分、朱志香の言う通りだと思うぜ。１時間か２時間くらい前だった」,"""Мы были сонными и, наверное, уснули после этого... Но мне кажется, всё так, как Джессика и говорит. Около одного или двух часов назад.""","""Nós ficamos com sono, e provavelmente acabamos cochilando depois disso... Mas eu acho que a Jessica deve estar certa. Cerca de uma ou duas horas atrás.""",[=UP],「在犯困後，我們大概有打過盹吧…。不過，我想多半就是照朱志香所說的，是一兩個小時前的事。」,「在犯困后，我们大概有打过盹吧…。不过，我想多半就是照朱志香所说的，是一两个小时前的事。」,[=UP],[=UP],[=UP]
Nanjo Terumasa,"""I, I also remember it being around that time. Because I was asked whether I wanted more coffee...""","""I-I also remember something from around that time. I was asked if I wanted more coffee..."" ","""I, I also remember something from around that time. Because I was asked whether I wanted more coffee...""",「わ、私もそのくらいの頃だと記憶しています。コーヒーのお代わりはいるかと聞かれましたからな…。」,「わ、私もそのくらいの頃だと記憶しています。コーヒーのお代わりはいるかと聞かれましたからな…」,"""Я... я тоже помню что‐то из того времени. Поскольку у меня спрашивали, буду ли я ещё кофе...""","""E‐Eu também lembro de ter sido por volta desse horário. Porque me foi perguntado se eu queria mais café...""",[=UP],「我、我也記得，是在這段時間吶。因為有來問過我，要不要再來杯咖啡…」,「我、我也记得，是在这段时间呐。因为有来问过我，要不要再来杯咖啡…」,[=UP],[=UP],[=UP]
,Something hard to believe had happened...,Something hard to believe had happened... ,[=UP],信じ難いことが起きた…。,[=JP],Случилось нечто совсем невероятное...,Algo difícil de se acreditar aconteceu...,[=UP],發生了難以置信之事…。,发生了难以置信之事…。,[=UP],[=UP],[=UP]
,"Apparently, when Auntie Eva had left for a second to visit the lavatory, Uncle Krauss and Aunt Natsuhi had disappeared.","Apparently, when Aunt Eva had left for a second to wash her hands, Uncle Krauss and Aunt Natsuhi had disappeared. "," Apparently, when Eva oba-san had left for a second to wash her hands, Krauss oji-san and Natsuhi oba-san had disappeared.",絵羽伯母さんが、ちょっとお手洗いに行っている間に、蔵臼伯父さんと夏妃伯母さんがいなくなってしまったというのだ。,[=JP],"Похоже, пока тётя Ева отлучилась в туалет помыть руки, дядя Краусс с тётей Нацухи вдруг исчезли.","Aparentemente, quando a tia Eva saiu por um segundo para ir ao lavabo, o tio Krauss e a tia Natsuhi desapareceram.",[=UP],在繪羽姑母去洗手間的那一小會兒，藏臼伯父與夏妃伯母不見了。,在绘羽姑母去洗手间的那一小会儿，藏臼伯父与夏妃伯母不见了。,[=UP],[=UP],[=UP]
,"There's no way they went hiding somewhere. Of course, the doors and windows had all been rigorously checked, and all were locked from the inside. Not one of them was broken.","There's no way they went hiding somewhere. Of course, the doors and windows had all been rigorously checked, and all were locked from the inside. Not one of them was broken. "," There's no way they went hiding somewhere. Of course, the doors and windows had all been rigorously checked, and all were locked from the inside. Not one of them was broken.",どこかに隠れているわけもない。もちろん、戸締りは全て厳重で、内側から鍵が掛けられている。破られているものはひとつもない。,[=JP],"Им совершенно незачем было где‐то прятаться. Разумеется, все двери и окна были тщательно проверены, и все они были заперты изнутри. Нигде не было обнаружено следов взлома.","Não é possível que eles estejam se escondendo. É claro, todas as portas e janelas foram rigorosamente verificadas, e todas estão trancadas por dentro. Nenhuma delas foi quebrada.",[=UP],並不是去了哪裡藏起來了。當然，門與窗戶全都從內側牢牢鎖著，鎖得密不透風。沒有一處被闖破。,并不是去了哪里藏起来了。当然，门与窗户全都从内侧牢牢锁着，锁得密不透风。没有一处被闯破。,[=UP],[=UP],[=UP]
,"And that wasn't just the first floor—the second floor was the same. Also, all of the doors and windows were designed in such a way that they couldn't be locked from the outside.","And that wasn't just true for the first floor. The second floor was the same. Again, all the doors and windows had locks built in a way that made it impossible to lock them from the outside. "," And that wasn't just the first floor. The second floor was the same. Again, all of the doors and windows possessed locks which had been designed so that they couldn't be set from the outside.",それは１階だけじゃない、２階も同様だ。また、全ての扉や窓について、その構造上、外からは掛けられない形の鍵を有している。,[=JP],"И так было не только на первом этаже, но и на втором. И снова на всех дверях и окнах были установлены замки, разработанные таким образом, чтобы их невозможно было открыть снаружи.","E não é apenas o primeiro andar — o segundo andar também está igual. Além disso, todas as portas e janelas foram desenhadas de forma que não pudessem ser trancadas por fora.",[=UP],這不僅僅是指一樓，二樓也一樣。另外，關於所有的窗戶與門，其構造上全都有無法從外面鎖上的鎖。,这不仅仅是指一楼，二楼也一样。另外，关于所有的窗户与门，其构造上全都有无法从外面锁上的锁。,[=UP],[=UP],[=UP]
,"...In other words, there was no way that Uncle Krauss and Aunt Natsuhi had gone outside.{n}......And yet, they couldn't be found.","...In other words, there was no way that Uncle Krauss and Aunt Natsuhi had gone outside. ...And yet, they couldn't be found. ","...In other words, there was no way that Krauss oji-san and Natsuhi oba-san had gone outside.......And yet, they couldn't be found.",…つまり、蔵臼伯父さんたちが外へ出たわけもないのだ。……にもかかわらず、その姿がない。,…つまり、蔵臼伯父さんたちが外へ出たわけもないのだ。{n}……にもかかわらず、その姿がない。,"...Другими словами, было совершенно исключено, что дядя Краусс и тётя Нацухи могли выйти наружу.{n}......И несмотря на это, их невозможно было найти.","...Em outras palavras, não há como o tio Krauss e a tia Natsuhi terem saído.{n}......E mesmo assim, não conseguimos encontrá‐los.",[=UP],…也就是說，藏臼伯父他們不可能去了外面。{n}……可儘管如此，他們還是不見了踪影。,…也就是说，藏臼伯父他们不可能去了外面。{n}……可尽管如此，他们还是不见了踪影。,[=UP],[=UP],[=UP]
,"Furthermore, they weren't the only ones who had disappeared......astonishingly, George‐aniki had too.","Furthermore, they weren't the only ones who had disappeared. ...So had George-aniki, of all people. "," Furthermore, they weren't the only ones who had disappeared. ......Even George-aniki had.",そして、姿を消したのは二人だけではなく、……何と譲治の兄貴もだった。,[=JP],"Кроме того, они были не единственными, кто исчез. Даже Джордж‐аники пропал.","E mais, eles não foram os únicos que desapareceram......surpreendentemente, o George‐aniki também.",[=UP],而且，失踪的並不只是兩人，……連讓治大哥都不見了。,而且，失踪的并不只是两人，……连让治大哥都不见了。,[=UP],[=UP],[=UP]
,"George‐aniki had left saying that he was going to get more coffee, and had gone downstairs more than an hour earlier.","George-aniki had left saying he was going to get more coffee, and had gone downstairs more than an hour earlier. "," George-aniki had left saying that he was going to get more coffee, and had gone downstairs more than an hour earlier.",譲治の兄貴は、コーヒーのお代わりを取りに行くと言い残し、１時間以上は前に、下へ降りていったきりだ。,[=JP],"Джордж‐аники вышел, сказав, что идёт налить ещё кофе, и ушёл вниз более часа назад.","O George‐aniki tinha saído dizendo que ia buscar mais café, e desceu as escadas uma hora antes.",[=UP],讓治大哥在一個多小時前留下了一句“去添咖啡”，下了樓，一去不返。,让治大哥在一个多小时前留下了一句“去添咖啡”，下了楼，一去不返。,[=UP],[=UP],[=UP]
,"I'd been under the impression that he was having a good conversation with Auntie Eva and the rest, ......but Auntie Eva, who had been in the lobby the whole time, said that no one had come down.","We'd assumed that he was having a conversation with Aunt Eva and the rest, ...but Aunt Eva, who had been in the lobby the whole time, said that no one had come down. "," We had been under the impression that he was having a conversation with Eva oba-san and the rest, ......but Eva oba-san, who had been in the lobby the whole time, said that no one had come down.",きっと、絵羽伯母さんたちと会話が弾んでいるのだろうと思い込んでいたのだが、……ずっとロビーにいた絵羽伯母さんは、誰も降りてこなかったと話す。,[=JP],"Мы полагали, что он остался поговорить с тётей Евой и остальными, но тётя Ева, которая находилась в вестибюле всё это время, сказала, что не спускался никто.","Eu pensei que ele estivesse tendo uma boa conversa com a tia Eva e os outros, ......mas a tia Eva, que estava no lobby o tempo inteiro, disse que ninguém havia descido.",[=UP],雖然我還以為，大哥一定是在與繪羽姑母他們聊天，……但一直都待在大廳裡的繪羽姑母卻說，沒人下過樓。,虽然我还以为，大哥一定是在与绘羽姑母他们聊天，……但一直都待在大厅里的绘羽姑母却说，没人下过楼。,[=UP],[=UP],[=UP]
