,"......It slipped through the door to the corridor, dragging the corpses, gradually increasing in speed,","...They slipped through the door to the corridor, dragging the bodies, gradually increasing in speed, ","......They slipped through the door to the corridor, dragging the bodies, gradually increasing in speed, ",……廊下への扉をすり抜けて死体を引き摺り、次第に速度を上げて、,[=JP],"......Он вылетел через дверь в коридор, волоча за собой тела и постепенно увеличивая скорость,","......Ela deslizou pela porta para o corredor, arrastando os corpos, gradualmente aumentando a velocidade.",[=UP],……鑽出通往走廊的門，拖著屍體，漸漸加快速度，,……钻出通往走廊的门，拖着尸体，渐渐加快速度，,[=UP],[=UP],[=UP]
," and in the blink of an eye, it had pulled them outside the guesthouse.",and rapidly pulled them outside the guesthouse. ,and rapidly pulled them outside the guesthouse.,あっという間にゲストハウスの外へ引っ張り出していく。,[=JP],и тут же вытащил их наружу из домика для гостей.," Em um piscar de olhos, ela havia os tirado para fora da casa de hóspedes.",[=UP],轉眼間就把兩人拖到了賓館外。,转眼间就把两人拖到了宾馆外。,[=UP],[=UP],[=UP]
,"So the lobby was still, as though nothing had happened at all.","So, the lobby was silent, as though nothing had happened. "," So the lobby was still, as though nothing had happened.",だからロビーは、まるで何事もなかったかのように静寂だった。,[=JP],"В фойе всё было по‐прежнему, словно ничего и не произошло.","O lobby permaneceu como estava, como se nada tivesse acontecido.",[=UP],所以，大廳內靜寂得就像什麼都沒發生過一樣。,所以，大厅内静寂得就像什么都没发生过一样。,[=UP],[=UP],[=UP]
,...As though Krauss and Natsuhi had never been there to begin with.,...As though Krauss and Natsuhi had not been there since the beginning. ,...As though Krauss and Natsuhi had not been there since the beginning.,…初めから蔵臼も夏妃もいなかったかのよう。,[=JP],...Как будто Краусса и Нацухи изначально не было в этом месте.,...Como se Krauss e Natsuhi nunca tivessem estado ali.,[=UP],…宛如房中本就沒有夏妃、藏臼兩個人。,…宛如房中本就没有夏妃、藏臼两个人。,[=UP],[=UP],[=UP]
,"Only the sound of the wind and the rain remained, as though feigning ignorance and pretending that they had been the only ones there......","Only the sound of the wind and the rain remained, as if they were playing dumb and pretending to be the only ones there... "," Only the sound of the wind and the rain remained, as though feigning ignorance and pretending that they were the only ones there......",雨と風の音だけが、ここには自分たちだけしかいなかったと、素知らぬ顔をして居座っていた……。,[=JP],"Остался лишь шум дождя и ветра, словно прикидывающихся незнающими и притворяющимися, будто были единственными, кто находился здесь...","Restou apenas o som do vento e da chuva, como se estivessem forjando a ignorância e fingindo que eram os únicos presentes......",[=UP],僅剩風雨假惺惺地擺出了副“這兒就我倆”的面孔，死賴著不走……。,仅剩风雨假惺惺地摆出了副“这儿就我俩”的面孔，死赖着不走……。,[=UP],[=UP],[=UP]
Ushiromiya Eva,"""......Sorry, I'm fine now. ...Now, I'll go make some coffee.""","""...Sorry, I'm fine now. ...I'll go make some coffee."" ",[=UP],「……ごめんなさい、もう大丈夫よ。…今、コーヒーを淹れるわね。」,「……ごめんなさい、もう大丈夫よ。…今、コーヒーを淹れるわね」,"""......Извините, я уже в порядке. ...Сейчас я схожу и сварю кофе.""","""......Desculpem, eu estou bem agora. ...Irei fazer um pouco de café.""",[=UP],「……對不起，我已經沒事了。…這就去衝咖啡。」,「……对不起，我已经没事了。…这就去冲咖啡。」,[=UP],[=UP],[=UP]
,Eva returned from the lavatory.{n}But no one was in the lobby.,Eva returned from the bathroom. But no one was in the lobby. ,Eva returned from the lavatory. But no one was in the lobby.,化粧室より絵羽が戻ってくる。しかし、ロビーには誰もいない。,化粧室より絵羽が戻ってくる。{n}しかし、ロビーには誰もいない。,Ева вернулась из туалета.{n}Но в вестибюле никого не было.,Eva retornou do lavabo.{n}Mas não havia ninguém no lobby.,[=UP],繪羽從化妝室回來了。{n}然而，大廳裡卻空無一人。,绘羽从化妆室回来了。{n}然而，大厅里却空无一人。,[=UP],[=UP],[=UP]
,"Even though they had been in that sofa until the very moment she had choked and gone to the lavatory, they had now gone, as if they had been an illusion from the beginning.","Even though they had supposedly been in that sofa until the moment she had choked and gone to the bathroom, they were gone, as if they'd been an illusion from the very beginning. "," Even though they had supposedly been in that sofa until the moment she had choked and gone to the lavatory, they had gone, as if they had been an illusion from the beginning.",咽込んで化粧室に行ったその瞬間まで、彼らはそこのソファーにいたはずなのに、まるでそれが幻であったかのようにいなくなっていた。,[=JP],"И хотя они сидели на том самом диване в момент, когда она подавилась и пошла в туалет, они исчезли, словно с самого начала были лишь иллюзией.","Mesmo eles tendo estado no sofá até o instante em que ela sufocou e se dirigiu ao lavabo, eles agora haviam sumido, como se não fossem mais do que uma ilusão desde o princípio.",[=UP],直到自己因被嗆著而去了化妝室的那一瞬間，他們都是坐在那張沙發上的，可此刻卻不見了踪影，就如同那是一場幻覺一般。,直到自己因被呛着而去了化妆室的那一瞬间，他们都是坐在那张沙发上的，可此刻却不见了踪影，就如同那是一场幻觉一般。,[=UP],[=UP],[=UP]
Ushiromiya Eva,"""...How careless... ......Where did those two go off together?""","""...How careless of them... ...Where did those two go off to together?"" ","""...How careless.........Where did those two go off together?""",「…無用心ね…。……二人揃ってどこに行っちゃったの？」,[=JP],"""...Какая неосторожность... ......Куда эти двое ушли?""","""...Quanto descuido... ......Aonde aqueles dois foram?""",[=UP],「…真不小心…。……兩人一起去了哪兒呢？」,「…真不小心…。……两人一起去了哪儿呢？」,[=UP],[=UP],[=UP]
,"Like she was pretending to be in a detective novel, Eva put her hand on the sofa.",Eva put her hand on the sofa as though acting out a scene from a detective novel. ,[=UP],探偵小説の真似事っぽく、絵羽はソファーに手を当てる。,[=JP],"Словно сыщик из детективного романа, Ева положила руку на диван.","Como se simulasse estar em um livro de detetive, Eva aproximou sua cabeça do sofá.",[=UP],就像是學偵探小說的樣似的，繪羽把手貼到了沙發上。,就像是学侦探小说的样似的，绘羽把手贴到了沙发上。,[=UP],[=UP],[=UP]
,......She felt a warmth indicating that they had been sitting there until a short while ago.,...She felt a warmth that meant that they'd been sitting there until a short while ago. ,......She felt a warmth which meant that they had been sitting there until a short while ago.,……ついさっきまで彼らが座っていたことを示す温もりが感じられた。,[=JP],"......Она ощутила тепло, означающее, что они сидели здесь совсем недавно.",......Ela sentiu um calor que indicava que eles estavam sentados ali até um momento atrás.,[=UP],……手上感受到了，表明著他們不久前還在此處坐著的餘溫。,……手上感受到了，表明着他们不久前还在此处坐着的余温。,[=UP],[=UP],[=UP]
,Maybe they had gone to do the rounds or something.,Maybe they went to do the rounds or something. , Maybe they had gone to do the rounds or something.,見回りにでも行っているのかもしれない。,[=JP],"Может быть, они пошли делать обход или что‐то в это роде.",Talvez tenham ido fazer a ronda ou algo assim.,[=UP],也許是去巡視了吧。,也许是去巡视了吧。,[=UP],[=UP],[=UP]
,"For the time being, Eva sat down and waited for their return...","For the time being, Eva sat down and waited for their return... "," For the time being, Eva sat down and waited for their return...",絵羽はとりあえず腰を下ろし、彼らの戻りを待つのだった…。,[=JP],Тогда Ева решила покамест присесть и подождать их возвращения...,"Daquele momento em diante, Eva sentou‐se no sofá e esperou pelo retorno deles...",[=UP],繪羽姑且是選擇坐了下來，等待他們歸來…。,绘羽姑且是选择坐了下来，等待他们归来…。,[=UP],[=UP],[=UP]
,"Beato and George could be seen in the parlor of the mansion.{n}George was kneeling near Shannon's body as though praying...{n}His face was sincerity itself, and there was even sweat on his forehead.","Beato and George could be seen in the parlor of the mansion. George was kneeling near Shannon's body as though praying... His face was serious, and there was even sweat on his forehead. "," Beato and George could be seen in the parlor of the mansion. George was kneeling near Shannon's body as though praying... His face was serious, and there was even sweat on his forehead.",屋敷の客室には、ベアトと譲治の姿があった。譲治は紗音の遺体の脇に、祈るように跪いている…。その表情は真剣そのもので、額には汗さえ浮いていた。,屋敷の客間には、ベアトと譲治の姿があった。{n}譲治は紗音の遺体の脇に、祈るように跪いている…。{n}その表情は真剣そのもので、額には汗さえ浮いていた。,"Беато и Джордж в это время находились в гостиной особняка.{n}Джордж стоял на коленях возле тела Шаннон, словно молясь...{n}У него было предельно серьёзное лицо, а на лбу даже выступили капли пота.","Beato e George podiam ser visto na sala de visitas da mansão.{n}George estava ajoelhado próximo do corpo de Shannon, como se estivesse rezando... Seu rosto demonstrava a mais pura sinceridade, com gotas de suor em sua testa.",[=UP],貝阿朵與讓治身處大屋客廳。{n}讓治如在祈禱般地，跪在了紗音的遺體身邊…。{n}他的表情十分認真，額頭上甚至浮起了汗珠。,贝阿朵与让治身处大屋客厅。{n}让治如在祈祷般地，跪在了纱音的遗体身边…。{n}他的表情十分认真，额头上甚至浮起了汗珠。,[=UP],[=UP],[=UP]
,"However, Beato was the same. Now that she had handed her name over, most of her previous power had been lost.","However, Beato was the same. Now that she had handed her name over, most of her previous power had been lost. "," However, Beato was the same. Now that she had handed her name over, most of her previous power had been lost.",しかし、それはベアトも同じだった。自らの名を譲り渡した彼女には、かつての魔力のほとんどが失われている。,[=JP],"Однако Беато тоже была здесь. После того, как она передала своё имя, большая часть её прежней магической силы была утрачена.","Entretanto, Beato permanecia a mesma. Agora que ela havia passado seu nome, a maior parte do poder que ela detinha havia se perdido.",[=UP],而貝阿朵的神情也與他完全一樣。讓出了自身名號的她，幾乎失去了所有以往的魔力。,而贝阿朵的神情也与他完全一样。让出了自身名号的她，几乎失去了所有以往的魔力。,[=UP],[=UP],[=UP]
,"...Of course, she still had more than enough power to be called a witch, but compared to the past, it was a very faint thing.","...Of course, she still had more than enough power to be called a witch, but compared to the past, it was a very faint thing. ",[=UP],…もちろん、それでも充分に魔女と呼べる魔力はあるが、かつてを思えば、あまりにささやかなものだ。,[=JP],"...Разумеется, пока ещё у неё оставалось достаточно силы, чтобы называться ведьмой, но в сравнении с прошлым, эта была достаточно скромной.","...É claro, ela ainda possuía poder mais do que suficiente para ser considerada uma bruxa, mas comparado ao passado, era algo muito fraco.",[=UP],…當然，儘管如此，她還是具有著足以被稱為魔女的魔力，不過相比以前，這就實在太過於微薄了。,…当然，尽管如此，她还是具有着足以被称为魔女的魔力，不过相比以前，这就实在太过于微薄了。,[=UP],[=UP],[=UP]
{f:5:Beatrice},"""......Good. Don't talk to her, don't touch her with your hand. ...Call to her with the voice of your heart; seek her with the hand of your heart. ...Only your strong feelings can make my magic reach Shannon's lost soul.""","""...Good. Don't talk to her, don't touch her with your hand. ...Call to her with the voice of your heart, and seek her with the hand of your heart. ...Only your strong feelings can make my magic reach Shannon's lost soul."" ","""......Fine. Don't talk to her, don't touch her with your hand. ...Call to her with the voice of your heart, and seek her with the hand of your heart. ...Only your strong feelings can make my magic reach Shannon's lost soul.""",「……いいぞ。声を掛けるな、手で触れるな。…心の声で呼べよ、心の手で求めよ。…そなたの強き想いだけが、紗音の失われた魂に妾の魔法を届かせる。」,「……いいぞ。声を掛けるな、手で触れるな。…心の声で呼べよ、心の手で求めよ。…そなたの強き想いだけが、紗音の失われた魂に妾の魔法を届かせる」,"""......Именно так. Не разговаривай с ней, не касайся её руками. ...Призывай её голосом своего сердца и ищи рукой своего сердца. ...Лишь твои сильные чувства могут позволить моей магии вернуть утерянную душу Шаннон.""","""......Muito bem. Não fale com ela, não a toque com suas mãos. ...Chame‐a com a voz do seu coração, busque por ela com a mão do seu coração. ...Apenas os seus fortes sentimentos podem fazer minha magia chegar até a alma perdida da Shannon.""",[=UP],「……很好。勿以聲喊，勿以手觸。…用心之聲呼喚，用心之手探求。…只有汝的強烈思念，才能將妾身的魔法傳遞給紗音失去的靈魂。」,「……很好。勿以声喊，勿以手触。…用心之声呼唤，用心之手探求。…只有汝的强烈思念，才能将妾身的魔法传递给纱音失去的灵魂。」,[=UP],[=UP],[=UP]
Ushiromiya George,""".................................hh.""","""............!"" ","""........................ha.""",「……………………………っ。」,「……………………………っ」,"""........................ха.""",[=UP],[=UP],「……………………………」,[=CHT],[=UP],[=UP],[=UP]
,"George maintained a single‐minded focus.{n}He kept frantically yelling inside his heart, trying to call back the soul of the person he loved.","George kept praying earnestly and silently. He kept frantically yelling inside his heart, trying to call back the soul of the person he loved. ","George kept praying earnestly and silently. He kept frantically yelling inside his heart, trying to call back the soul of the person he loved.",譲治はひたすらに念じ続ける。愛しき人の魂を呼び戻そうと、心の中で必死に叫び続ける。,譲治はひたすらに念じ続ける。{n}愛しき人の魂を呼び戻そうと、心の中で必死に叫び続ける。,"Джордж продолжал молиться искренне и молча.{n}Он продолжал неистово кричать в своём сердце, пытаясь дозваться до души человека, которого любил.",George manteve sua mente focada apenas naquilo.{n}Ele continua a gritar freneticamente dentro de seu coração a fim de chamar de volta a alma da pessoa que ele amava.,[=UP],讓治一個勁兒地祈禱著。{n}為了喚回深愛之人的靈魂，在心中不停地拚命呼喊著。,让治一个劲儿地祈祷着。{n}为了唤回深爱之人的灵魂，在心中不停地拼命呼喊着。,[=UP],[=UP],[=UP]
,"...He strongly envisioned his soul leaving his body, and searching for her as she wandered through Hell.",...He strongly envisioned his soul leaving his body...and searching for her as she wandered through the Land of the Dead. ,"...He strongly envisioned his soul leaving his body, and searching for her as she wandered through hell.",…自らの肉体より魂だけが抜け出して、冥府に迷い込んだ彼女を探すところを強くイメージした。,[=JP],"...Он чётко представил, как его душа оставила своё тело и искала её, блуждая в адском мире.","...Ele fortemente visionou sua alma deixando seu corpo, e procurando por ela como se vagasse pelo Inferno.",[=UP],…靈魂脫出自身的肉體，以精神強烈地描繪出了，探尋在冥府中彷徨著的她的情景。,…灵魂脱出自身的肉体，以精神强烈地描绘出了，探寻在冥府中彷徨着的她的情景。,[=UP],[=UP],[=UP]
,"......Beato turned that strong force into magical power, supplementing her own magic. It was magic that, in the past, she could have performed easily, without anyone's help.","...Beato turned that strong force into magical power that supplemented her own magic. This was magic that, in the past, she could have performed easily, without anyone's help. ",[=UP],……その強い力を、ベアトは魔力に変換し、自らの魔法に加える。かつては誰の助けも借りずに、片手間で出来た魔法だ。,[=JP],"......Беато, в свою очередь, обращала эту силу в магию, дополняя её своей магической силой. Это была та магия, которую она в прошлом, с лёгкостью могла использовать без посторонней помощи.","......Beato converteu aquela força em poder mágico, suplementando sua própria magia. Era a magia que, no passado, ela podia dar forma facilmente, sem a ajuda de ninguém.",[=UP],……貝阿朵將這份強勁的力量變換為魔力，加於自己的魔法上。這是她以前不用借助任何人幫忙，就能隨隨便便完成的魔法。,……贝阿朵将这份强劲的力量变换为魔力，加于自己的魔法上。这是她以前不用借助任何人帮忙，就能随随便便完成的魔法。,[=UP],[=UP],[=UP]
,"...But now, if she didn't rely on someone's help, she wouldn't be able to finish the chant, much less succeed.","...But now, if she didn't rely on someone's assistance, she wouldn't be able to finish the chant, much less succeed. ",[=UP],…しかし今は、助けを借りなければ、成功は愚か、詠唱を終えるには至らない。,…しかし今は、助けを借りなければ、成功はおろか、詠唱を終えるには至らない。,"...Но теперь, если она не положится на чью‐либо помощь, она не сможет закончить это дело, не говоря уже о его успехе.","...Mas agora, se ela não dependesse da ajuda de alguém, não seria capaz de terminar o encantamento, muito menos obter sucesso.",[=UP],…不過，在現今，若是不借助他人的幫助，別提成功了，就連咒語都沒法唱完。,…不过，在现今，若是不借助他人的帮助，别提成功了，就连咒语都没法唱完。,[=UP],[=UP],[=UP]
{f:5:Beatrice},""".........I have forgotten after several hundred years... .........Was magic, ......was resurrection...always this difficult of a magic......?""","""......I'd forgotten for several centuries... ......Was magic... was resurrection... always this difficult...?"" ",""".........I have forgotten after several hundred years............Was magic, ......was resurrection, ...always this difficult of a magic......?""",「………数百年近くも忘れておったわ…。………魔法とは、……反魂とは、…こんなにも辛い魔法であったか……。」,「………数百年近くも忘れておったわ…。………魔法とは、……反魂とは、…こんなにも辛い魔法であったか……」,""".........Несколько сотен лет спустя я позабыла... но неужели магия... неужели воскрешение... было столь сложной магией?..""",""".........Após diversas centenas de anos eu acabei esquecendo... .........Era a magia, ......a ressurreição...sempre essa forma de magia tão difícil......?""",[=UP],「………忘了將近數百年呢…。………魔法，……返魂，…竟是此等辛苦的魔法嗎……？」,「………忘了将近数百年呢…。………魔法，……返魂，…竟是此等辛苦的魔法吗……？」,[=UP],[=UP],[=UP]
,An even more strained expression than George's had risen to Beato's face.,Beato was wearing an even more strained expression than George. ,An even more strained expression rose to Beato's face than George's.,ベアトは、譲治以上に辛い表情を浮かべている。,[=JP],"Лицо Беато было напряжено даже сильнее, чем у Джорджа.",Com uma expressão ainda mais exaurida daquela que George havia direcionado para beato.,[=UP],貝阿朵的臉上，浮現出了比讓治更辛苦的表情。,贝阿朵的脸上，浮现出了比让治更辛苦的表情。,[=UP],[=UP],[=UP]
,"...She was still forgetting this, but the magic to revive a life is fundamentally the ultimate hidden art.","...It had slipped her mind, but originally, the magic to revive a life was the ultimate hidden art. ","...It had slipped her mind, but originally, the magic to revive a life was the ultimate hidden art.",…彼女はまだ失念しているが、本来、命を蘇らせる魔法は究極の秘術だ。,[=JP],"...Она уже успела позабыть, но изначально магия возрождения являлась одним из самых тайных искусств.","...Ela ainda estava esquecendo sobre isso, mas a magia para reviver uma vida é fundamentalmente a mais poderosa das artes ocultas.",[=UP],…雖然她還沒有記起來，但復甦生命的魔法本就是究極的秘術。,…虽然她还没有记起来，但复苏生命的魔法本就是究极的秘术。,[=UP],[=UP],[=UP]
,"It was her previous magical power, giving her the ability to use that magic over and over with a snap of her fingers, that was abnormal.","The abnormal thing was her previous magical power, which could be used over and over with a snap of her fingers. ", It was her previous magical power that could be used over and over with a snap of her fingers that was abnormal.,それを指を鳴らすだけで何度でも扱えたかつての魔力の方が逸脱しているのだ。,[=JP],"Это её прошлая магическая сила, которую можно было использовать снова и снова одним щелчком пальцев, была невероятной.","Era seu antigo poder mágico que dava a ela a habilidade de usar essa magia incontáveis vezes com o estalar de dedos, que era algo anormal.",[=UP],以前她那只需打個響指，就能無數次實現這魔法的魔力，才超越了常理。,以前她那只需打个响指，就能无数次实现这魔法的魔力，才超越了常理。,[=UP],[=UP],[=UP]
