Speaker,Umineko Project (UP),Steam (ST),Original Witch Hunt (OG),PC Japanese (JP),PS3 Japanese - Censored (JPC),Russian (RU),Brazilian Portuguese (PT),Vietnamese (VI),Chinese Traditional (CHT),Chinese Simplified (CN),Indonesian (IDN),Italian (IT),Turkish (TR)
,The guesthouse lobby had been engulfed by silence.,The guesthouse lobby was wrapped in silence. ,The guesthouse lobby was wrapped in silence.,ゲストハウスのロビーは静寂に包まれていた。,[=JP],В вестибюле домика для гостей царила тишина.,O lobby da casa de hóspedes foi engolido pelo silêncio.,[=UP],靜寂包圍著賓館的大廳。,静寂包围着宾馆的大厅。,[=UP],[=UP],[=UP]
,"The strings of tension which bound Krauss, Natsuhi, and Eva had already loosened; they were completely tired; and their consciousness was beginning to waver.","The strings of tension binding Krauss, Natsuhi, and Eva had already loosened, and they were completely worn out, with their minds beginning to waver. "," The strings of tension which bound Krauss, Natsuhi, and Eva had already loosened, they were completely tired, and their consciousness was beginning to waver.",蔵臼、夏妃、絵羽の３人はもはや緊張感の糸も弛み、疲れきって、意識を朦朧とさせている。,[=JP],"Нити напряжения, связывавшие Краусса, Нацухи и Еву, уже ослабли, они были полностью измотаны, а их сознание расплывалось.","As cordas de tensão que vinculavam Krauss, Natsuhi e Eva já haviam se desprendido; eles estavam completamente exaustos; e suas consciências estavam começando a vacilar.",[=UP],藏臼、夏妃、繪羽三人的緊張感都已有所鬆懈，他們疲憊到了極點，意識趨於朦朧。,藏臼、夏妃、绘羽三人的紧张感都已有所松懈，他们疲惫到了极点，意识趋于朦胧。,[=UP],[=UP],[=UP]
,"Every once in a while, they would stand up and walk around pointlessly, fighting their drowsiness.","Every once in a while, they would stand up and walk around pointlessly, as though fighting their drowsiness. "," Every once in a while, they would stand up and walk around pointlessly, as though fighting their drowsiness.",彼らは時折、席を立ち、無意味に歩き回ったりすることで眠気と戦っているようだった。,[=JP],"Время от времени они поднимались и бессмысленно слонялись, словно это помогало им одолеть сонливость.","De tempos em tempos, eles se levantavam e andavam sem rumo, lutando contra a sonolência.",[=UP],看來，他們是在通過時而站起身來，無目的地隨便亂走，來與睡意較著勁。,看来，他们是在通过时而站起身来，无目的地随便乱走，来与睡意较着劲。,[=UP],[=UP],[=UP]
Ushiromiya Natsuhi,""".........Are you alright, Eva‐san? ...Please, do take it easy and rest.""","""......Are you okay, Eva-san? ...Please, do take it easy and rest."" ",""".........Are you alright, Eva-san? ...Please, do take it easy and rest.""",「………大丈夫ですか、絵羽さん。…やはり無理をせず、休んでいてください。」,「………大丈夫ですか、絵羽さん。…やはり無理をせず、休んでいてください」,""".........С тобой всё в порядке, Ева‐сан? ...Пожалуйста, успокойся и отдохни.""",""".........Você está bem, Eva‐san? ...Por favor, não se force tanto e descanse.""",[=UP],「………還好嗎，繪羽？…請還是別勉強了，去歇著吧。」,「………还好吗，绘羽？…请还是别勉强了，去歇着吧。」,[=UP],[=UP],[=UP]
Ushiromiya Eva,"""I told you, I'm fine...... ...The three of us are now the only adults... There's no time to rest... I'll guard this place even if I have to go through hell and high water...... ......haah......haah......""","""I told you, I'm fine... ...The three of us are now the only adults... There's no time to rest... No matter what the cost, we must guard this place until the end... ...Haah, ...haah..."" ","""I told you, I'm fine.........The three of us are now the only adults... There's no time to rest... No matter what the cost, we must guard this place until the end............Haah, ......haah......""",「大丈夫だって言ってるわ……。…もう、大人は私たち３人しかいないのよ…。休んでる暇なんかないわ…。石にかじりついてでも、ここを死守するわよ……。……はぁ、……はぁ……。」,「大丈夫だって言ってるわ……。…もう、大人は私たち３人しかいないのよ…。休んでる暇なんかないわ…。石にかじりついてでも、ここを死守するわよ……。……はぁ、……はぁ……」,"""Я же сказала тебе, я в порядке...... ...Теперь нас лишь трое взрослых... Нет никакого времени на отдых... Чего бы нам это ни стоило, мы должны до последнего охранять это место...... ......Ха‐а... ха‐а...""","""Eu já disse que estou bem......! ...Nós três somos os únicos adultos... Não há tempo para descansarmos... Irei vigiar este lugar a qualquer custo, mesmo que seja preciso atravessar o Inferno...... ......haah......haah......""",[=UP],「都說了沒事……。…就只剩我們三個大人了喲…。才沒工夫去歇著呢…。就算是硬著頭皮，也要死守此處……。……哈啊，……哈啊……」,「都说了没事……。…就只剩我们三个大人了哟…。才没工夫去歇着呢…。就算是硬着头皮，也要死守此处……。……哈啊，……哈啊……」,[=UP],[=UP],[=UP]
,"She spoke a brave line, but she couldn't hide her rough breathing.{n}...It seemed that the fever, which had been calmed with medicine for a time, had returned.","She spoke bravely, but she couldn't hide her rough breathing. ...It seemed that the fever, which had been calmed with medicine for a short time, had returned. ","She spoke a brave line, but she couldn't hide her rough breathing....It seemed that the fever, which had been calmed with medicine for a time, had returned.",勇ましい台詞を口にするが、荒い息は隠せていない。…一度は薬で落ち着いた熱だったが、再びぶり返してきたらしい。,勇ましい台詞を口にするが、荒い息は隠せていない。{n}…一度は薬で落ち着いた熱だったが、再びぶり返してきたらしい。,"Она говорила уверенным тоном, но ей было не под силу скрыть своё затруднённое дыхание.{n}...Судя по всему температура, на время сбитая лекарством, снова поднялась.","Ela falou algo bravo, mas incapaz de esconder sua respiração ofegante.{n}...Parece que a febre, que havia diminuído com os medicamentos, havia retornado.",[=UP],雖然說著豪言壯語，但她並沒有藏住急促的呼吸。{n}…看來是再度發起了，一度因藥而穩定下來的高燒。,虽然说着豪言壮语，但她并没有藏住急促的呼吸。{n}…看来是再度发起了，一度因药而稳定下来的高烧。,[=UP],[=UP],[=UP]
,It was very obvious that Eva's condition was not good.,It was very obvious that Eva's health was not good. , It was very obvious that Eva's health was not good.,絵羽の体調が悪いのは一目瞭然だった。,[=JP],"Было вполне очевидно, что Еве явно нездоровится.",Estava claro que as condições de Eva não eram boas.,[=UP],繪羽那糟糕的身體狀況一看便知。,绘羽那糟糕的身体状况一看便知。,[=UP],[=UP],[=UP]
Ushiromiya Krauss,"""Don't push yourself. At least close your eyes. If we have to wake you, we definitely will.""","""Take it easy. At least close your eyes. If something happens that you need to be awake for, we will definitiely wake you."" ","""Take it easy. At least close your eyes. Because if we have to wake you, we definitely will.""",「無理はするな。せめて目を閉じていたまえ。もし、起こさねばならぬ時は必ず起こしてやるから。」,「無理はするな。せめて目を閉じていたまえ。もし、起こさねばならぬ時は必ず起こしてやるから」,"""Не напрягайся. Хотя бы закрой глаза. Поскольку если нам потребуется разбудить тебя, мы обязательно это сделаем.""","""Não se esforce demais. Ao menos feche seus olhos. Se precisamos acordá‐la, certamente o faremos.""",[=UP],「別硬撐了。至少去合會兒眼吧。如果有必須叫你起來的情況，一定會來叫醒你的。」,「别硬撑了。至少去合会儿眼吧。如果有必须叫你起来的情况，一定会来叫醒你的。」,[=UP],[=UP],[=UP]
Ushiromiya Eva,"""I'm telling you that I'm fine...! Leave me alone......!!""","""I'm telling you I'm fine...! Leave me alone...!!"" ",[=UP],「だから平気だって言ってるわ…！　放っておいて……！！」,[=JP],"""Говорю же тебя, я в порядке!.. Оставь меня в покое!..""","""Estou dizendo que estou bem...! Me deixem sozinha......!!""",[=UP],「我不說了沒事了嘛…！別管我……！！」,「我不说了没事了嘛…！别管我……！！」,[=UP],[=UP],[=UP]
Ushiromiya Natsuhi,"""..............................""","""............"" ","""........................""",「…………………………。」,「…………………………」,[=OG],[=UP],[=UP],[=JPC],[=JPC],[=UP],[=UP],[=UP]
,"It seemed that she had now become stubborn. ......Krauss and Natsuhi realized that no matter what else they said to her, in her current state, it wouldn't reach her ears.","It seemed she was already unwilling to budge. ...Krauss and Natsuhi realized that even if they talked to her any more when she was like this, it wouldn't reach her ears. ","It seemed that she had already become obstinate.......Krauss and Natsuhi realized that even if they talked to her any more when she was like this, it wouldn't reach her ears.",もはや意地になっているようだった。……今の彼女には、これ以上、何を言っても耳に届かないだろうことを、蔵臼たちも悟る。,[=JP],"Похоже, её упрямство сейчас достигло своего предела. ......Краусс и Нацухи поняли, что даже если они продолжат уговаривать её, то пока она пребывает в таком состоянии, их слова пройдут мимо её ушей.","Parece que ela se tornou um incômodo agora. ......Krauss e Natsuhi perceberam que não importava o que fosse dito para ela, em seu estado atual, não chegaria aos seus ouvidos.",[=UP],看來是徹底鐵了心了。……藏臼夫婦也意識到了，不管再說什麼，都是不會傳進現今的她的耳朵裡的。,看来是彻底铁了心了。……藏臼夫妇也意识到了，不管再说什么，都是不会传进现今的她的耳朵里的。,[=UP],[=UP],[=UP]
,"So they decided to say nothing more, and to let her be.","So without saying anything more, they decided to let her be. "," So without saying anything more, they decided to let her be.",だからそれ以上は何も言わず、そっとしておくことにした。,[=JP],"Поэтому, больше не сказав ни слова, они решили оставить её в покое.","Por isso eles decidiram não dizer mais nada, e deixá‐la a sós.",[=UP],所以，他們就此不再說話，隨她去了。,所以，他们就此不再说话，随她去了。,[=UP],[=UP],[=UP]
,"To Eva right now, even an argument like that was putting a burden on her.{n}It would probably be better for her if she just sat there with her mouth closed.","To Eva right now, even having an argument like that would be burdensome. It would probably be better for her body if she just sat there with her mouth closed. "," To Eva right now, even an argument like that became a burden. It would probably be better if she just sat there with her mouth closed.",今の絵羽には、そんな口論すらも負担になっている。口を閉ざし、ただ静かに座っているだけの方が、まだ体に楽だろう。,今の絵羽には、そんな口論すらも負担になっている。{n}口を閉ざし、ただ静かに座っているだけの方が、まだ体に楽だろう。,"Для Евы в данный момент было болезненно даже спорить с ними.{n}Вероятно, было бы лучше, если бы она просто сидела с закрытым ртом.","Para Eva, naquele momento, mesmo um argumento como aquele jogava um peso para cima dela. Provavelmente seria melhor se ela apenas se sentasse e ficasse em silêncio.",[=UP],對現在的繪羽而言，就連吵嘴都成了身體的負擔。{n}閉上嘴，只是靜靜地坐著，倒還能讓身體舒服些。,对现在的绘羽而言，就连吵嘴都成了身体的负担。{n}闭上嘴，只是静静地坐着，倒还能让身体舒服些。,[=UP],[=UP],[=UP]
,"As a matter of fact, Eva was already on the point of succumbing to her drowsiness. ...She might have talked back with a temper because she was trying to encourage herself and throw off her sleepiness.","In truth, Eva was just a step away from being beaten down by drowsiness. ...Perhaps she shot back at them with a temper because she was trying to rouse herself and throw off her sleepiness. "," Actually, Eva was already being beaten down by drowsiness....She might have talked back with a temper because she was trying to encourage herself and throw off her sleepiness.",実際、絵羽はもう眠気に挫けようとしている。…短気に言い返すのは、自らを鼓舞して眠気を飛ばすためなのかもしれない。,[=JP],"На самом деле Ева уже не могла противостоять сонливости. ...Причиной её вспыльчивых ответов, вероятно, являлась попытка взбодрить себя и прогнать сонливость.","De fato, Eva já estava no limite de sucumbir à sonolência. ...Ela possivelmente havia respondido daquela maneira porque estava tentando encorajar a si mesma e dispersar seu sono.",[=UP],其實，繪羽已經快輸給睡意了。…她暴躁地還嘴，或許是為了鼓起自己的精神頭，趕走睡意也說不定。,其实，绘羽已经快输给睡意了。…她暴躁地还嘴，或许是为了鼓起自己的精神头，赶走睡意也说不定。,[=UP],[=UP],[=UP]
,The clock would very soon be pointing to six in the afternoon.,The clock would be pointing to 6:00 in the afternoon very soon. , The clock would be pointing to 6:00 in the afternoon very soon.,時計は、もうじき午後の６時を指そうとしている。,[=JP],Часы должны были показывать шесть в ближайшее время.,O relógio estava para bater seis da tarde.,[=UP],時鐘已快指向下午六點。,时钟已快指向下午六点。,[=UP],[=UP],[=UP]
,"Because she had been snacking over and over again to fool her drowsiness, she didn't feel hungry, but instead, her lack of sleep made it feel like it was six in the morning rather than the afternoon.","She'd had several snacks to distract herself from her drowsiness, so she didn't feel hungry, but now her lack of sleep made it feel like it was 6:00 in the morning, not the afternoon. "," Because she had been snacking over and over again to fool her drowsiness, she didn't feel hungry, but instead, her lack of sleep made it feel like it was 6:00 in the morning, not the afternoon.",眠気を誤魔化すために、何度も間食を取ったせいで空腹感はなく、むしろ寝不足のせいで、午後どころか明け方の６時のようにさえ感じられた。,[=JP],"Поскольку она всё ела и ела, чтобы обмануть свою сонливость, она не ощущала голода, наоборот, недосыпание заставило её думать, будто сейчас шесть утра, а не вечера.","Por ter beliscado pequenos lanches em diversos momentos para combater a sonolência, ela não estava com fome, mas, por outro lado, sua falta de sono fez parecer que eram seis da manhã e não seis da tarde.",[=UP],為了壓下睡意吃了好幾次點心，所以肚子一點都不餓，倒不如說，因為缺乏睡眠，別說是下午了，甚至感覺現在像是凌晨六點。,为了压下睡意吃了好几次点心，所以肚子一点都不饿，倒不如说，因为缺乏睡眠，别说是下午了，甚至感觉现在像是凌晨六点。,[=UP],[=UP],[=UP]
,"......Even supposing that the boat would come at precisely nine in the morning tomorrow, ......there were still more than twelve full hours to go.","...Even supposing that the boat came at precisely 9:00 in the morning tomorrow, ...they still had more than 12 full hours to go. ","......Even if they supposed that the boat came at precisely 9:00 in the morning tomorrow, ......there was still more than 12 full hours to go.",……明日の朝の９時にぴったりに船が来てくれると仮定しても、……まだ１２時間以上たっぷりある。,[=JP],......Даже если по их предположениям катер должен был явиться в девять утра завтрашнего дня... Требовалось прождать ещё полных 12 часов.,"......Mesmo supondo que o barco chegaria precisamente às nove da manhã do dia seguinte, ......ainda havia mais de doze horas até lá.",[=UP],……即便假定船會一秒不差地在明天早上九點到來，……也還有漫長的十二個多小時。,……即便假定船会一秒不差地在明天早上九点到来，……也还有漫长的十二个多小时。,[=UP],[=UP],[=UP]
,...That was a dizzyingly long stretch of time.,...It was an overwhelmingly long stretch of time. ,...That was an overwhelmingly long stretch of time.,…気の遠くなるような時間だった。,[=JP],...Это был невероятно длинный отрезок времени.,...Era um logo e vertiginoso tempo a ser superado.,[=UP],…這是一段令人犯暈的漫長時間。,…这是一段令人犯晕的漫长时间。,[=UP],[=UP],[=UP]
,............Long. .........Painful...... ......Hot...,......Long. ......Painful... ...Hot... ,............Long..........Painful............Hot...,…………長い。………辛い……。……熱い…。,[=JP],............Долгий. .........Болезненный... ......Жаркий...,............Longo. .........Doloroso...... ......Quente...,[=UP],…………好漫長。………好難受……。……好熱…。,…………好漫长。………好难受……。……好热…。,[=UP],[=UP],[=UP]
,Even the sound of the clock torments my body now.,Even the sound of the clock torments my body now. , Even the sound of the clock torments my body now.,時計の音さえ、今はこの身を苛む。,[=JP],"Даже звук часов теперь, кажется, истязает моё тело.",Mesmo o som do relógio atormenta meu corpo agora.,[=UP],此刻，就連時鐘的聲音，都在折磨著這具身軀。,此刻，就连时钟的声音，都在折磨着这具身躯。,[=UP],[=UP],[=UP]
,"In times like this, ......he would put his hand on my forehead, and the fever would always fade at once.","In times like this, ...when that person puts his hand on my forehead, the fever fades at once. "," In times like this, ......when that person puts his hand on my forehead, the fever fades at once.",こんな時はいつだって、……あの人が私の額に手を当ててくれれば、たちどころに熱が引いたのに。,[=JP],"В такие моменты... Когда этот человек кладёт мне руку на лоб, весь жар сразу же проходит.","Em horas como essa, ......ele colocaria sua mão na minha testa, e a febre iria começar a desaparecer.",[=UP],每當這種時候，……只要他將手搭在我的額頭上，就會馬上退燒。,每当这种时候，……只要他将手搭在我的额头上，就会马上退烧。,[=UP],[=UP],[=UP]
,...But he isn't here anymore.........,...But that person no longer exists...... ,...But that person no longer exists.........,…でももう、あの人はいない………。,[=JP],...Но этого человека больше нет...,...Mas ele não está mais aqui.........,[=UP],…可是，他已經不在了………。,…可是，他已经不在了………。,[=UP],[=UP],[=UP]
,"As Eva's mind grew foggy, she was once again gripped by a deep sadness...","As Eva's mind grew foggy, she was once again gripped by a deep sadness... "," As Eva's mind grew foggy, she was once again gripped by a deep sadness...",絵羽は朦朧とした意識の中で、再び深い悲しみに囚われていた…。,[=JP],"Разум Евы затуманился, и её снова охватила глубокая печаль...","A mente de Eva ficava cada vez mais nebulosa, e mais uma vez ela era consumida por uma profunda tristeza...",[=UP],繪羽在朦朧的意識中，再次陷入了深深的悲傷裡…。,绘羽在朦胧的意识中，再次陷入了深深的悲伤里…。,[=UP],[=UP],[=UP]
,"She had already cried herself dry.{n}Even so, the sadness from losing her beloved husband had not been exhausted...","She had already cried herself dry. Even so, the sadness of losing her beloved husband had not been exhausted... "," She had already cried herself dry. Even so, the sadness from losing her beloved husband had not been exhausted...",もう涙は枯れ果てた。それでも最愛の夫を失った悲しみが、尽き果てない…。,もう涙は枯れ果てた。{n}それでも最愛の夫を失った悲しみが、尽き果てない…。,"Она уже выплакала все слёзы.{n}Но, несмотря на это, горе от потери любимого мужа так и не ушло...","Ela já havia chorado até não restarem mais lágrimas.{n}Mesmo assim, a tristeza por perder seu querido marido ainda não havia se esgotado...",[=UP],淚已哭盡。{n}儘管如此，還是未能流盡失去最愛的丈夫的悲傷…。,泪已哭尽。{n}尽管如此，还是未能流尽失去最爱的丈夫的悲伤…。,[=UP],[=UP],[=UP]
Ushiromiya Eva,"""...............I......was wrong...""","""......I... ...was wrong..."" ","""............I, ......made a mistake...""",「……………私は、……間違っていたんだわ…。」,「……………私は、……間違っていたんだわ…」,"""............Я... совершила ошибку...""","""...............Eu......estava errada...""",[=UP],「……………我，……錯了…」,「……………我，……错了…」,[=UP],[=UP],[=UP]
{f:5:Eva Beatrice},"""...Why?""","""...What do you mean?"" ",[=UP],「…どうして？」,[=JP],"""...Почему?""","""...Por quê?""",[=UP],「…為何？」,「…为何？」,[=UP],[=UP],[=UP]
,"Originally, the new witch had been the same being as Eva.{n}...If Eva talked to her, she would always respond...","The new witch and Eva were fundamentally the same being. ...If Eva talked to her, she would always respond... ","From the start, the new witch had been the same being as Eva....If Eva talked to her, she would always respond...",元々、新しき魔女は絵羽と一なる存在。…絵羽が話しかければ、いつだって返事を返す…。,元々、新しき魔女は絵羽と一なる存在。{n}…絵羽が話しかければ、いつだって返事を返す…。,"Новая ведьма с самого начала была той же сущностью, что и Ева.{n}...Если Ева обращалась к ней, она всегда отвечала...","Originalmente, a nova bruxa era uma mesma existência de Eva.{n}...Se Eva falasse com ela, ela sempre responderia...",[=UP],新魔女與繪羽本是同一存在。{n}…只要繪羽搭話，她就會作出回答，無論何時…。,新魔女与绘羽本是同一存在。{n}…只要绘羽搭话，她就会作出回答，无论何时…。,[=UP],[=UP],[=UP]
