Mammon,"""C'mon, c'mon, go back, welcome home to reality!! Just call on us only when it's convenient for you and pretend you have friends, then spur us on even though you don't have the guts to dirty your own hands, then deny and erase us once you realize that it's hopeless! ","""Go on then, go on, back you go, back to reality!! Just call on us only when it's convenient for you and pretend you have friends, set us on your enemies when you don't have the guts to dirty your own hands, and deny and erase us once you realize that's not gonna work!""",[=ST],ほらほら戻りなさいよ、お帰りなさいな現実にッ！！　都合のいい時だけ私たちを呼び出してお友達ごっこで、自分の手を汚す覚悟もないくせにそれをけしかけ、駄目とわかったら否定して消し去る！,「ほらほら戻りなさいよ、お帰りなさいな現実にッ！！　都合のいい時だけ私たちを呼び出してお友達ごっこで、自分の手を汚す覚悟もないくせにそれをけしかけ、駄目とわかったら否定して消し去る！」,"""Давайте, ну же, возвращайтесь домой в реальность! А нас зовите тогда, когда вам удобно и притворяйтесь, будто у вас есть друзья, а затем срывайтесь на нас, хотя у вас не хватает духу испачкать свои руки, а затем отрицайте и стирайте нас, после осознания безнадёжности вашей затеи!""","""Então vá, volte, volte para realidade!! Nós chame apenas quando for conveniente para você e finja que tem amigas, nos coloque como suas inimigas quando não tiver coragem de sujar as mãos, nos negue e nos apague uma vez que perceba que isso não funciona!""",「喂喂，快回去呀，請回吧，回現實！！只在想要的時候把我們召喚出來玩朋友遊戲，連弄髒自己的手的覺悟都沒有還唆使我們去殺，知道不行了就否定、抹消！」,「喂喂，快回去呀，请回吧，回现实！！只在想要的时候把我们召唤出来玩朋友游戏，连弄脏自己的手的觉悟都没有还唆使我们去杀，知道不行了就否定、抹消！」,"Su, su, torni indietro, bentornata nella realtà!! Ci chiami solo quando le conviene e faccia finta di avere degli amici, poi ci inciti anche se non ha il fegato per sporcarsi le mani, poi ci neghi e ci cancelli una volta che capisce che è inutile!"
Mammon,"Yes, please enjoy it, I'll leave with a shriek of anguish just like you want, Ange-sama!!"" ","""Yes, I'll leave with a shriek of anguish just like you want, go ahead and enjoy it!!""",[=ST],えぇ、どうぞお楽しみ下さいよ、縁寿さまが期待されるような苦悶の声と悲鳴をあげて退場しますとも！！,「えぇ、どうぞお楽しみ下さいよ、縁寿さまが期待されるような苦悶の声と悲鳴をあげて退場しますとも！！」,"""Так развлекайтесь же, Энджи‐сама, я испущу вскрик ужаса, как вам того и хочется!""","""Sim, eu irei junto a um grito de angústia assim como você deseja, vá em frente e aproveite!!""",「是啊，好好享受吧，我會發出緣壽小姐所期望的痛苦之聲與慘叫聲退場的！！」,「是啊，好好享受吧，我会发出缘寿小姐所期望的痛苦之声与惨叫声退场的！！」,"Sì, per favore si diverta, me ne andrò con un grido di dolore proprio come desidera, Ange-sama!!"
Mammon,"""Just copy the jeering that you're being showered with right now, and do the same to us to get it off your chest. ","""Just copy the jeering that you're being bombarded with right now, and do the same to us to get it off your chest.""",[=ST],縁寿さまがたった今、浴びせられている罵声を、私たちにも同じように浴びせ掛けて胸の内をスゥっとさせるがいいです。,「縁寿さまがたった今、浴びせられている罵声を、私たちにも同じように浴びせ掛けて胸の内をスゥっとさせるがいいです」,"""Просто имитируйте насмешки, которыми вас сейчас обливают, поведите себя так с нами, чтобы дать выход накопившейся в вас безысходной злости.""","""Apenas copie esses escárnios que estão sendo direcionados a você agora, e então faça o mesmo com a gente para nos expulsar de seu peito.""",「緣壽小姐，您就去以讓我們也遭受同等的，您此刻所遭受的罵言，來發泄胸中怨氣好了。」,「缘寿小姐，您就去以让我们也遭受同等的，您此刻所遭受的骂言，来发泄胸中怨气好了。」,"Copi solamente gli insulti con cui è stata sommersa in questo momento, e faccia lo stesso con noi per togliersi un peso dal cuore."
Mammon,That's also furniture's duty!! Getting slammed against the floor when someone's pissed off is also a chair's important duty!! ,"""That too is the duty of furniture!! Getting slammed against the floor when someone's pissed off is also a chair's important duty!!""",[=ST],それもまた家具の役目！！　ムカついて床に叩き付けられることもまた、椅子の大事なお役目ですからァ！！,「それもまた家具の役目！！　ムカついて床に叩き付けられることもまた、椅子の大事なお役目ですからァ！！」,"""Это тоже долг мебели! Быть ударенными об пол, когда кто‐то выводит вас из себя — так же важный долг мебели.""","""Isso também é o dever de uma mobília!! Ser batida contra o chão quando alguém se irritar também é um importante dever de uma cadeira!!""",「這也是家具的職責！！被火大了的主人拎起來往地上砸，也是椅子重要的職責——！！」,「这也是家具的职责！！被火大了的主人拎起来往地上砸，也是椅子重要的职责——！！」,Anche questo è il dovere di un mobile!! Anche venir sbattuto sul pavimento quando qualcuno è arrabbiato è un dovere importante di una sedia!!
Mammon,"If that alone can absorb their master's bad mood even for an instant, there can be no greater honor for furniture. Kill me, deny me, your first and final friend...!!!"" ","""If by that trifling service we manage to absorb our master's bad mood even for an instant, there can be no greater honor for furniture. Kill me, deny me, your first and final friend...!!!!!!!""",[=ST],その程度のことで主の不機嫌を一時でも受け止められたなら、家具としてこれほどの栄誉はありません。殺しなさいよッ、否定しなさいよ、あなたの最初で最後の友達をぉおおおッ…！！！」,「その程度のことで主の不機嫌を一時でも受け止められたなら、家具としてこれほどの栄誉はありません。殺しなさいよッ、否定しなさいよ、あなたの最初で最後の友達をぉおおおッ…！！！」,"""Если одно это способно хоть на мгновение прогнать дурное настроение господина, то для мебели нет чести более великой. Убейте меня, вашего первого и последнего друга!""","""Se, com esse insignificante serviço, nós formos capazes de absorver o mal humor da nossa mestra por um instante, então não há honra maior para uma mobília. Me matem, me neguem, sua primeira e última amiga...!!!!!!!""",「通過這種程度的事就能一時分擔主人的不快的話，那這就是家具至高無上的榮譽。殺吧，否定吧，殺死否定掉您第一個也是最後一個的朋友吧————…！！！」,「通过这种程度的事就能一时分担主人的不快的话，那这就是家具至高无上的荣誉。杀吧，否定吧，杀死否定掉您第一个也是最后一个的朋友吧————…！！！」,"Se solo questo può assorbire il cattivo umore del proprio padrone anche per un istante, non potrebbe esserci un onore più grande per un mobile. Mi uccida, mi rinneghi, la sua prima e ultima amica...!!!"""
,"At the end, Mammon had a mocking expression on her face, ...but for some reason, it looked splashed with tears. ","At the end, Mammon had a derisive expression on her face, ......but for some reason it looked like teardrops had scattered from her eyes.",[=ST],マモンは最後に、嘲り笑いの表情を浮かべたけれど、……なぜか涙の粒を散らしたように見えた。,[=JP],К концу её речи лицо Мамоны приобрело насмешливое выражение... Но по какой‐то причине в глазах её плескались слёзы.,"Em seu fim, Mammon estava com uma insolente expressão em seu rosto, ......mas por algum motivo parecia que lágrimas escorriam de seus olhos.",雖然馬蒙最後浮現的是嘲笑的表情，……但不知為何，那看起來就像是在甩落淚滴。,虽然马蒙最后浮现的是嘲笑的表情，……但不知为何，那看起来就像是在甩落泪滴。,"Alla fine, Mammon aveva un'espressione beffarda sul viso... ma per qualche ragione sembrava piena di lacrime."
,"Mammon, Beelzebub and Asmodeus were smashed and fell to the floor... ","Mammon, Beelzebub and Asmodeus smashed to pieces and rolled across the floor......",[=ST],マモンと、ベルゼブブとアスモデウスの３人は砕け散り、床に転げた……。,[=JP],"Мамона, Вельзевул и Асмодей разбились и упали на пол...","Mammon, Beelzebub e Asmodeus foram esmagadas em pedaços e rolaram pelo piso......",馬蒙、貝露賽布布、阿絲磨德烏絲三人分崩離析，倒到了地上……。,马蒙、贝露赛布布、阿丝磨德乌丝三人分崩离析，倒到了地上……。,"Mammon, Beelzebub e Asmodeus si frantumarono e caddero sul pavimento..."
Sakutarou,‘......U-Uryu.........’ ,‘.........U‐......uryu..................’,[=ST],『………う、……うりゅ………………。』,『………う、……うりゅ………………』,{p:0:『}У... урю...{p:0:』},[=UP],『………嗚、……嗚溜………………』,『………呜、……呜溜………………』,{p:0:『}... U... Uryu... {p:0:』}
Ushiromiya Maria,"""...... Come over here, Sakutaro. Ange is a little agitated right now. ...So you mustn't get close."" ",""".................. Come over here, Sakutaro. Ange is just a little agitated right now. ......So you mustn't get close.""",[=ST],「………………。こっちへおいで、さくたろ。今の縁寿は、少し冷静じゃないだけ。……だから、近寄っちゃ駄目だよ。」,「………………。こっちへおいで、さくたろ。今の縁寿は、少し冷静じゃないだけ。……だから、近寄っちゃ駄目だよ」,"""........Поди сюда, Сакутаро. Энджи сейчас слегка на взводе, поэтому не подходи к ней.""",""".................. Pode vir, Sakutaro. A Ange só está um pouco agitada agora. ......Então é melhor não chegar muito perto.""",「………………。來這邊，櫻太郎。現在的緣壽稍微有點不冷靜。……所以，不可以靠近喲。」,「………………。来这边，樱太郎。现在的缘寿稍微有点不冷静。……所以，不可以靠近哟。」,"""... Vieni qui, Sakutarou. Ange è un po' agitata in questo momento. ... Quindi non devi avvicinarti."""
Sakutarou,‘What about everyone else? Are all the Seven Sisters alive? Did they die...?’ ,‘What about the others? Are the Seven Sisters alive? Did they die...?’,[=ST],『みんなは？　七姉妹のみんなは生きてるの？　死んじゃったの…？』,[=JP],{p:0:『}Но как же девочки? Живы ли семь сестёр? Или же умерли?..{p:0:』},‘E quanto as outras? As Sete Irmãs estão vivas? Elas morreram...?’,『大家呢？七姐妹都活著？還是死了…？』,『大家呢？七姐妹都活着？还是死了…？』,{p:0:『}E gli altri? Tutte le Sette Sorelle sono vive? Sono morte...?{p:0:』}
Ushiromiya Maria,"""...It's okay. It looks gruesome, but those are the remains of their vessels after being deported from the human world. Shells that have been shed. ","""......It's alright. It looks very gruesome, but those are the remains of their vessels after they were forcibly evicted from the human world. They're shells that have been shed.""",[=ST],「……大丈夫だよ。とても無残な姿だけど、あれは人間界を強制退去させられて残された、依り代の残滓。抜け殻だよ。,「……大丈夫だよ。とても無残な姿だけど、あれは人間界を強制退去させられて残された、依り代の残滓。抜け殻だよ」,"""Все в порядке. Смотрится неприятно, но это остатки сосудов, остающиеся после того, как их наполнение исторгнуто из мира людей. Оболочка сброшена.""","""......Está tudo bem. Pareceu bem horrível, mas esses são resquícios de seus receptáculos após serem vigorosamente deportadas do mundo humano. São cascas vazias.""",「……沒事的。儘管慘不忍睹，但那只是被強制逐出人界時留下的依代的殘渣。只是個空殻喲。」,「……没事的。尽管惨不忍睹，但那只是被强制逐出人界时留下的依代的残渣。只是个空壳哟。」,"""... Va tutto bene. Sembra decisamente macabro, ma quelli sono i resti dei contenitori dopo che vengono estromessi dal mondo umano. Sono gusci che sono stati tolti."
Ushiromiya Maria,"...So it's all right. They're probably deeply hurt, but they're okay. Everyone is alive. I'm sure we'll be able to meet them again someday."" ","""......So it's alright. They're probably deeply hurt, but they're safe. They're all alive. I'm sure we'll be able to meet them again someday.""",[=ST],……だから大丈夫。とても傷ついただろうけど、無事だよ。みんな生きてるよ。きっといつか、また会えるよ。」,「……だから大丈夫。とても傷ついただろうけど、無事だよ。みんな生きてるよ。きっといつか、また会えるよ」,"""Так что не переживай. Им наверняка здорово досталось, но они в порядке. Все живы. Уверена, когда‐нибудь мы сможем встретиться.""","""......Por isso está tudo bem. Elas provavelmente se feriram profundamente, mas estão seguras. Todas estão vivas. Tenho certeza que iremos encontrar com elas algum dia.""",「……所以沒事兒。雖然大家都受了傷吧，但沒事喲。大家都活著。總有一天，一定能再見面的。」,「……所以没事儿。虽然大家都受了伤吧，但没事哟。大家都活着。总有一天，一定能再见面的。」,"... Quindi va tutto bene. Probabilmente sono gravemente ferite, ma stanno bene. Sono tutte vive. Sono sicura che potremo rivederle un giorno."""
Sakutarou,"‘Uryu... ...Thank goodness, ......thank goodness......’ ",‘Uryu... ......Thank goodness..........thank goodness............’,[=ST],『うりゅ…。……良かった………良かった…………。』,『うりゅ…。……良かった………良かった…………』,"{p:0:『}Урю... Какое облегчение, какое облегчение...{p:0:』}",‘Uryu... ......Ainda bem..........Ainda bem............’,『嗚溜…。……太好了………太好了…………』,『呜溜…。……太好了………太好了…………』,{p:0:『}Uryu... grazie al cielo... grazie al cielo... {p:0:』}
Ushiromiya Maria,"""...Ange has violated the contract of Mariage Sorcière. ...To do such a horrible thing, ...even though witches of the alliance must respect and accept one another... Even though they were all important friends to you, Ange..."" ","""......Ange, you violated the treaty of Mariage Sorcière. ......Doing such a horrible thing, ......even though witches of the alliance must respect and accept one another...... They were all your precious friends......""",[=ST],「……縁寿はマリアージュ・ソルシエールの条約に違反した。……同盟の魔女は、互いを敬い認め合わなくちゃならないのに、……こんな酷いことを……。みんな縁寿の大切な、お友達だったのに……。」,「……縁寿はマリアージュ・ソルシエールの条約に違反した。……同盟の魔女は、お互いを敬い認め合わなくちゃならないのに、……こんな酷いことを……。みんな縁寿の大切な、お友達だったのに……」,"""Энджи нарушила договор Меридж Сорсьер. Совершить столь ужасный поступок... И это при том, что ведьмы альянса должны уважать и принимать друг друга... при том, что все были твоими дорогими друзьями, Энджи...""","""......Ange, você violou o tratado da Mariage Sorcière. ......Fazendo coisas tão horríveis, ......mesmo bruxas da aliança devem respeitar e aceitar uma as outras...... Todas eram suas preciosas amigas......""",「……緣壽違反了 Mariage Sorcière 的條約。……同盟中的魔女必須互相尊敬，互相承認，……但緣壽卻做出了這麼過分的事……。大家明明都是緣壽重要的朋友……」,「……缘寿违反了 Mariage Sorcière 的条约。……同盟中的魔女必须互相尊敬，互相承认，……但缘寿却做出了这么过分的事……。大家明明都是缘寿重要的朋友……」,"""... Ange ha violato il contratto della Mariage Sorcière. ... Fare una cosa così orribile... anche se le streghe dell'alleanza devono rispettarsi e accettarsi reciprocamente... anche se tutte loro erano tue grandi amiche, Ange..."""
Ushiromiya Ange,"""No witches' alliance has anything to do with this. Magic friends? Give me a break. ......I killed them, erased them. I smashed the Seven Sisters!"" ","""No witches' alliance has anything to do with this. Magic friends? Give me a break. .........I killed them, erased them. I smashed the Seven Sisters!""",[=ST],「そんな魔女の同盟なんて関係ない。魔法のお友達？　いい加減にして。………私が殺したわ、消し去った。私が七姉妹を、砕け散らせた！」,[=JP],"""Нет, альянс ведьм не имеет к этому никакого отношения. Волшебные друзья? Не смешите мои тапочки. .........Я убила их, стёрла их. Я разбила семерых сестёр!""","""Nenhuma bruxa da aliança tem relação com isso. Amigas mágicas? Me poupe. .........Eu as matei, apaguei elas. Eu esmaguei as Sete Irmãs!""",「這個魔女同盟什麼的與我無關。魔法的朋友？得了吧。………我殺了她們，抹消了她們。我粉碎了七姐妹！」,「这个魔女同盟什么的与我无关。魔法的朋友？得了吧。………我杀了她们，抹消了她们。我粉碎了七姐妹！」,"""Nessuna alleanze di streghe ha a che fare con tutto ciò. Amici magici? Ma lasciami in pace. ... Le ho uccise, cancellate. Ho distrutto le Sette Sorelle!"""
Sakutarou,"‘Uryu, ...that's so cruel, ...so cruel......’ ",‘Uryu......that's so cruel......so cruel.........’,[=ST],『うりゅ……、そんなの酷いよ……、酷いよ………。』,『うりゅ……、そんなの酷いよ……、酷いよ………』,{p:0:『}Урю... какая жестокость... это слишком жестоко.{p:0:』},‘Uryu......isso é muito cruel......muito cruel.........’,『嗚溜……，這太過分了……，太過分了………』,『呜溜……，这太过分了……，太过分了………』,{p:0:『}Uryu... questo è così crudele... così crudele... {p:0:』}
Ushiromiya Ange,"""...Just give it a rest with this playing witches thing. ...I'm begging you. Maria onee-chan and Sakutaro, I want you to disappear by yourselves. ......Even in my imagination, ...I don't want to kill and erase you."" ","""......Just give it a rest with this playing witches thing. .....Please. Maria onee‐chan and Sakutaro, I want you to disappear by yourselves. .........Because even amid my delusions, ......I don't want to kill or erase you.""",[=ST],「……もう、魔女ごっこはいい加減にして。……お願いだから。真里亞お姉ちゃんもさくたろも、自ら消えてほしい。………私が殺して消したなんて、……妄想の中ですら、したくないから。」,「……もう、魔女ごっこはいい加減にして。……お願いだから。真里亞お姉ちゃんもさくたろも、自ら消えてほしい。………私が殺して消したなんて、……妄想の中ですら、したくないから」,""".......Завязывайте уже с этой игрой в ведьм. Умоляю вас. Мария онее‐чан и Сакутаро, я хочу, чтобы вы исчезли сами. ...........Поскольку, хоть вы и являетесь моим воспалённым бредом... Я не хочу убивать и стирать вас.""","""......Apenas me deem um descanso dessas brincadeiras de bruxa. .....Por favor. Maria onee‐chan, Sakutaro, eu quero que vocês desapareçam. .........Porque, mesmo em meio às minhas delusões, ......eu não quero ter que matar ou apagar vocês.""",「……別再搞魔女遊戲了。……拜託了。真里亞姐姐還有櫻太郎，請自行消失吧。………殺死、抹消你們，…即便是在妄想中，我都不想這麼做…」,「……别再搞魔女游戏了。……拜托了。真里亚姐姐还有樱太郎，请自行消失吧。………杀死、抹消你们，…即便是在妄想中，我都不想这么做…」,"""... Piantatela con questa cosa di giocare alle streghe. ... Vi prego. {n}Maria Onee-chan e Sakutarou, voglio che scompariate di vostra iniziativa. ... Perché anche tra le mie illusioni... non voglio uccidervi e cancellarvi."""
Sakutarou,"‘...W-We aren't your imagination... We're your friends, Ange, ...uryu......!’ ","‘W‐...we aren't delusions...... We're your friends, Ange... Uryu.........!’",[=ST],『ボ、…ボクたちは妄想なんかじゃないよ……。縁寿のお友達だよ…、うりゅ………！』,[=JP],"{p:0:『}М‐мы не бред... Мы твои друзья, Энджи, урю!{p:0:』}","‘N‐Nós não somos delusões...... Nós somos seus amigos, Ange... Uryu.........!’",『偶、…偶們不是妄想喲……。是緣壽的朋友喲…，嗚溜………！』,『偶、…偶们不是妄想哟……。是缘寿的朋友哟…，呜溜………！』,"{p:0:『}N... Noi non siamo illusioni... noi siamo tuoi amici, Ange... uryu...!{p:0:』}"
,"Sakutaro said that as he hid behind Maria onee-chan, sobbing. ",Sakutaro sobbed those words as he hid behind Maria onee‐chan.,[=ST],さくたろは真里亞お姉ちゃんの背中に身を隠しながら、そう言って涙ぐむ。,[=JP],"Сказал Сакутаро, всхлипывая и прячась за Марией онее‐чан.",Sakutaro soluçou aquelas palavras enquanto se escondida atrás da {nobr:Maria onee‐chan}.,櫻太郎邊躲在真里亞姐姐的身後，邊含淚說了這句話。,樱太郎边躲在真里亚姐姐的身后，边含泪说了这句话。,"Sakutarou disse questo mentre si nascondeva dietro Maria Onee-chan, singhiozzando."
,......Sakutaro doesn't exist. ,.........Sakutaro doesn't exist.,[=ST],………さくたろなんて存在しない。,[=JP],.........Сакутаро не существует.,.........O Sakutaro não existe.,………櫻太郎根本不存在。,………樱太郎根本不存在。,... Sakutarou non esiste.
,Sakutaro is also...an imaginary creature Onee-chan created to distract herself from her loneliness...... ,Sakutaro is also...a delusion Onee‐chan created to distract herself from her loneliness.........,[=ST],さくたろもまた、お姉ちゃんが寂しさを紛らわすために生み出した、妄想なんだ………。,[=JP],"Он тоже... созданная сестричкой иллюзия, призванная отвлечь её от одиночества...",O Sakutaro também é...uma delusão que você criou para se distrair de sua solidão.........,櫻太郎也是姐姐為了排遣寂寞而創造出來的妄想………。,樱太郎也是姐姐为了排遣寂寞而创造出来的妄想………。,Anche Sakutarou è... un'illusione che Onee-chan ha creato per distrarsi dalla sua solitudine...
