,"And then...I spoke those humiliating words, but right away, jeers flew at me saying that they couldn't hear and to speak up. ","And then......I began to speak those humiliating words, but right away, jeers flew at me saying that they couldn't hear and to speak up.",[=ST],そして……その辱めの言葉を口にするが、すぐに、よく聞こえない、もっと大きな声でと罵声が飛んだ。,[=JP],"А затем... я заговорила те унизительные слова, но на меня тут же посыпались насмешки, что, дескать, они меня не слышат и мне следует говорить громче.","E então......comecei a falar aquelas palavras humilhantes, mas da mesma forma, escárnios voaram na minha direção, dizendo que não conseguiam ouvir o que eu estava falando.",然後……雖然我念起了屈辱的文字，但“聽不清”、“再大聲點”等等的罵聲馬上就迎面飛來。,然后……虽然我念起了屈辱的文字，但“听不清”、“再大声点”等等的骂声马上就迎面飞来。,"E poi... dissi quelle parole umilianti, ma immediatamente, scherni volarono verso di me, dicendo che non si sentiva nulla e di alzare la voce."
,......I can't read it. ,...............I can't read this.,[=ST],……………読めない。,[=JP],.......Я не могу прочитать это.,...............Eu não posso ler isto.,……………念不下去。,[=CHT],... Non posso leggerlo.
,I had no idea... that being forced to read a paragraph humiliating me would be so painful. ,I had no idea...that being forced to read a paragraph humiliating me would be so painful.,[=ST],自らの口で、自らを辱める文章を読まされることが、こんなにも辛いことだなんて、知らなかった。,[=JP],"Я и представить себе не могла, что оказаться принуждённо прочитать унижающий меня текст будет так больно.",Eu não fazia ideia...de que ser forçada a ler um parágrafo de humilhação poderia ser tão doloroso para mim.,沒想到，以自己的嘴，去念侮辱自己的文章，竟是此等的，難受。,没想到，以自己的嘴，去念侮辱自己的文章，竟是此等的，难受。,Non avevo idea... che essere costretta a leggere un paragrafo che mi umiliava sarebbe stato così doloroso.
,My throat shook. My fingertips shook. ...The paragraph of humiliation written in my own handwriting made my eyes burn with a hot liquid. ,My throat shook. My fingertips shook. ......The paragraph of humiliation written in my own handwriting made my eyes burn with a hot liquid.,[=ST],喉が震える。指先も震える。……自らの筆跡で書かれた屈辱的な文章が、瞳の奥を熱い液体が焼く。,[=JP],"В горле у меня пересохло. Пальцы задрожали. .....Унизительный текст, написанный моим почерком, ожег мне глаза горячей жидкостью.","Minha garganta tremeu. Meus dedos tremeram. ......O parágrafo de humilhação, escrito com minha própria letra, fez meus olhos queimarem com um líquido quente.",咽喉在顫抖。指尖也在顫抖。……自己親筆寫下的屈辱文章，令我瞳孔深處沸騰起了火熱的液體。,咽喉在颤抖。指尖也在颤抖。……自己亲笔写下的屈辱文章，令我瞳孔深处沸腾起了火热的液体。,La mia gola tremò. Le punte delle mie dita tremarono. ... Il paragrafo dell'umiliazione scritto con la mia scrittura fece bruciare i miei occhi con un caldo liquido.
,So my world blurred and twisted. ,So my world blurred and twisted.,[=ST],だから世界が潤んで歪んだ。,[=JP],Мир у меня перед глазами расплылся и искривился.,Enquanto meu mundo se tornava enevoado e distorcido.,所以，世界蒙上了一層水簾，扭曲了。,所以，世界蒙上了一层水帘，扭曲了。,Quindi il mio mondo si inumidì e si contorse.
,I saw the girls surrounding me twist and bend. ,The girls surrounding me all appeared warped.,[=ST],私を取り囲む彼女らがみんな歪んで見えた。,[=JP],"Я увидела, как окружающие меня девчонки искривляются и гнутся.",As garotas que me cercavam pareciam todas se deformarem.,在我的眼中，環繞著我的她們全都扭曲了。,在我的眼中，环绕着我的她们全都扭曲了。,Vidi le ragazze che mi circondavano contorcersi e piegarsi.
,...I saw them twist and bend into the impression I had of them. ,......I saw them warped into exactly the impression I had of them.,[=ST],……私が彼女たちに持っていた印象そのままの姿に歪んで見えた。,[=JP],".....Увидела, как они, искривясь и погнувшись, стали выглядеть так, какими я их себе представляла.",......Eu as vi se deformarem até a exata impressão que tenho delas.,……扭曲成了，與我印象中的她們完全一樣的外形。,……扭曲成了，与我印象中的她们完全一样的外形。,... Le vidi contorcersi e piegarsi nell'impressione che io avevo di loro.
,"In other words, ...that was my true field of vision. ","In other words, ......this was the correct view.",[=ST],だからそれはつまり、……正しい視界だった。,[=JP],"Другими словами, таково было моё истинное зрение.","Em outras palavras, ......essa era a forma correta de vê‐las.",所以，換言之，……這才是正確的視野。,所以，换言之，……这才是正确的视野。,In altre parole... quello era il mio vero campo di visione.
,"Beyond that twisted crowd of people, ...I could see my friends. ","Beyond that twisted crowd of people, ......I could see my friends.",[=ST],その歪んだ人垣の向こうに、……私の友人たちの姿が見える。,[=JP],За этой толпой виднелись мои друзья.,"Além daquela distorcida multidão de pessoas, ......eu pude ver minhas amigas.",在這扭曲的人牆的另一邊，……我看到了我的朋友。,在这扭曲的人墙的另一边，……我看到了我的朋友。,Oltre quella folla contorta di persone... potevo vedere i miei amici.
,Compassion could be seen in all of their eyes. ,Compassion could be seen in all of their eyes.,[=ST],皆、瞳には同情を浮かべていた。,[=JP],В их глазах плескалось сострадание.,Compaixão podia ser vista nos olhos de todas.,大家的瞳孔中全都浮現著同情。,大家的瞳孔中全都浮现着同情。,Potevo vedere compassione in tutti i loro occhi.
Ushiromiya Maria,"""......Ange, ......stay strong..."" ",""".........Ange, .........stay strong...""",[=ST],「………縁寿、………しっかり…。」,「………縁寿、………しっかり…」,""".......Энджи... мужайся...""",""".........Ange, .........aguente firme...""",「………緣壽，………挺住…」,「………缘寿，………挺住…」,"""... Ange... resisti..."""
Sakutarou,‘Uryu-......’ ,‘Uryuu.........’,[=ST],『うりゅー………。』,『うりゅー………』,{p:0:『}Урю...{p:0:』},[=UP],『嗚溜——………』,『呜溜——………』,{p:0:『}Uryu-... {p:0:』}
,Maria onee-chan and Sakutaro were looking at me with sad eyes. Probably because they realized that even cheap words of compassion would hurt me. ,Maria onee‐chan and Sakutaro were looking at me with sad eyes.{n}Perhaps because they realized that even cheap words of compassion would hurt me.,[=ST],真里亞お姉ちゃんとさくたろが、悲しい目で私を見ている。安っぽい同情の言葉すらも、私を傷つけると知っているからだろうか。,真里亞お姉ちゃんとさくたろが、悲しい目で私を見ている。{n}安っぽい同情の言葉すらも、私を傷つけると知っているからだろうか。,"Мария онее‐чан и Сакутаро смотрели на меня печальными глазами.{n}Они, похоже, понимали, что даже дешёвые слова сострадания ранят меня.",A Maria onee‐chan e o Sakutaro estavam olhando para mim com a tristeza refletida em seus olhos.{n}Possivelmente porque eles perceberam que até mesmo palavras baratas de compaixão iriam me ferir.,真里亞姐姐與櫻太郎以悲傷的目光看著我。{n}他們是清楚，就連不值錢的同情之言，都會刺傷我麼？,真里亚姐姐与樱太郎以悲伤的目光看着我。{n}他们是清楚，就连不值钱的同情之言，都会刺伤我么？,Maria Onee-chan e Sakutarou mi stavano guardando con occhi tristi. Forse perché si accorsero che persino scadenti parole di compassione mi avrebbero ferito.
,...They kept alternating between trying to say something...and hanging their heads. ,"......They kept alternating between trying to say something, and hanging their heads.",[=ST],……何かを口にしようとしては俯くことを、繰り返す。,[=JP],".......Они то порывались сказать что‐то, то опускали головы.",......Eles continuaram a alternar entre tentar dizer algo e inclinarem suas cabeças.,……反反覆覆地做出剛抬頭要說些什麼，就又重新低下了頭的動作。,……反反复复地做出刚抬头要说些什么，就又重新低下了头的动作。,... Continuarono ad alternarsi tra provare a dire qualcosa e guardare in basso.
Asmodeus,"""What the hell's wrong with these people...?!!"" ","""What the hell's wrong with these people...!!""",[=ST],「何なのよ、こいつら…！！」,[=JP],"""Да что творится с этими людьми!""","""Qual o problema delas...!!""",「啥呀，那幫傢伙…！！」,「啥呀，那帮家伙…！！」,"""Ma che diavolo hanno queste persone...!!"""
Beelzebub,"""They're just the worst! Really pisses me off! What's so fun about gathering around Ange-sama and torturing her?!"" ","""They're such dirtbags! Really pisses me off! What's so fun about ganging up on Ange‐sama and tormenting her?!""",[=ST],「最低のヤツら！　腸が煮えくり返るわよ！　縁寿さまを寄って集って嬲り者にして、何が楽しいわけッ？！」,[=JP],"""Они отвратительны! Они бесят меня! Что весёлого в окружении Энджи‐сама и истязании её?!""","""Elas são desprezíveis! Me deixam muito irritada! Qual a graça de ficar conspirando contra a Ange‐sama e atormentar ela?!""",「差勁到極點！肚子都氣炸了！一大幫人聚在一起數落緣壽小姐又有什麼好開心的？！」,「差劲到极点！肚子都气炸了！一大帮人聚在一起数落缘寿小姐又有什么好开心的？！」,"""Sono le peggiori! Mi fanno davvero incazzare! Che c'è di così divertente nel riunirsi attorno a Ange-sama e torturarla?!"""
Leviathan,"""It's a resentment they can't voice despite their jealousy. They don't care who it hurts, as long as they can let it out. What horrible people."" ","""The resentment of not being able to spit out their jealousy. Anyone would do, just as long as they can spit it out. They're the worst.""",[=ST],「妬ましくても吐き出せない怨嗟。誰でもいいのよ、吐き出せればね。最低のヤツら。」,「妬ましくても吐き出せない怨嗟。誰でもいいのよ、吐き出せればね。最低のヤツら」,"""Неприязнь, которую они не могут озвучить, несмотря на свою зависть. Пока они не могут озвучить её, им всё равно, кого мучить. Хуже таких нет никого.""","""O ressentimento de não serem capazes de colocar para fora suas invejas.{n}Não importa quem elas machuquem, desde que consigam colocar para fora. Elas são as piores.""",「她們那股心存嫉妒卻吐不出口的怨氣。對誰都一樣，能吐出來就行。差勁到了極點。」,「她们那股心存嫉妒却吐不出口的怨气。对谁都一样，能吐出来就行。差劲到了极点。」,"""Il risentimento che non può essere sputato fuori, a dispetto della loro gelosia. Non importa chi sia, finché possono sputarlo fuori. Sono le peggiori."""
Satan,"""Ange-sama! In this kind of situation, it's okay to go mad with rage for your own honor's sake!! Anger is an appropriate emotion and an appropriate reaction! If you don't get mad now, when will you get mad?!!"" ","""Ange‐sama! In this kind of situation, going mad with rage for the sake of your own honor is perfectly acceptable!! Anger is an appropriate emotion and an appropriate reaction! If you don't get mad now, when {i:are} you going to?!!""",[=ST],「縁寿さまッ！　ここはご自身の名誉のために怒り狂うことが許される場面です！！　怒りは正当な感情で正当な反応！　ここで怒らなかったら、どこで怒るんですかッ！！」,「縁寿さまッ！　ここはご自身の名誉のために怒りくるうことが許される場面です！！　怒りは正当な感情で正当な反応！　ここで怒らなかったら、どこで怒るんですかッ！！」,"""Энджи‐сама! В подобной ситуации не возбраняется обезуметь от гнева ради вашей же чести! Гнев — адекватное чувство и реакция! Если вы не разозлитесь сейчас, то когда?!!""","""Ange‐sama! Neste tipo de situação, ficar enfurecida pelo bem da sua própria honra é perfeitamente aceitável!! A raiva é uma emoção apropriada em situações apropriadas! Se não ficar brava agora, quando {i:vai} ficar?!""",「緣壽小姐！此刻是允許為自身的名譽勃然大怒的場面！！憤怒是正當的感情，正當的反應！現在不發怒，什麼時候發怒？！！」,「缘寿小姐！此刻是允许为自身的名誉勃然大怒的场面！！愤怒是正当的感情，正当的反应！现在不发怒，什么时候发怒？！！」,"""Ange-sama! In questo tipo di situazioni, è giusto infuriarsi per il bene del proprio onore!! La rabbia è un'emozione e una reazione appropriata! Se non ci si infuria ora, quando lo si farà?!!"""
Lucifer,"""Stop it, don't stir Ange-sama up with cheap anger!! If Ange-sama could do that, she would've done it already!!"" ","""Stop it, don't stir Ange‐sama up with cheap anger!! If Ange‐sama could do that, she would have done it already!!""",[=ST],「やめなさいよ、安っぽく縁寿さまを怒らせないでっ！！　それが出来たらもうやってるわよ縁寿さまはっ！！」,[=JP],"""Перестань, не подзуживай Энджи‐сама пустой злостью! Если бы Энджи‐сама могла разозлиться, то давно бы уже так поступила!""","""Pare com isso, não incitem a Ange‐sama com essa raiva barata!! Se a Ange‐sama pudesse fazer isto, ela já teria feito!!""",「別這樣，別沒心沒肺地去叫緣壽小姐發怒！！要是能發怒，緣壽小姐就已經發怒了！！」,「别这样，别没心没肺地去叫缘寿小姐发怒！！要是能发怒，缘寿小姐就已经发怒了！！」,"""Ferma, non turbare Ange-sama con rabbia gratuita!! Se Ange-sama potesse farlo, l'avrebbe già fatto!!"""
Belphegor,"""......You should only get angry if doing so will improve the situation. However, from a objective standpoint, doing that now would probably only aggravate the situation further. It may be humiliating, but the wisest thing to do now is to withstand it."" ","""...............If the situation could improve by you getting angry, then that is what you should do. However, objectively speaking, that would only serve to aggravate the situation further. ......It may be humiliating, but the wisest thing to do now is to withstand it.""",[=ST],「……………怒って状況が改善できるならそうすべきだ。だが、客観的に判断して、それはますますに状況を悪化させるだけだろう。……屈辱的だが、今は耐えるのが賢明だ。」,「……………怒って状況が改善できるならそうすべきだ。だが、客観的に判断して、それはますますに状況を悪化させるだけだろう。……屈辱的だが、今は耐えるのが賢明だ」,"""Так поступают, если злость может улучшить положение. Однако с объективной точки зрения злость сейчас только ухудшит дело. Это, может, и унизительно, но разумнее всего сейчас будет перетерпеть это.""","""...............Se essa situação pudesse melhorar ficando brava, então é o que você deveria fazer. Porém, objetivamente falando, isso apenas serviria como um agravante para uma situação futura. ......Pode ser humilhante, mas o mais sábio a se fazer agora é suportar isto.""",「……………發怒就能改善狀況的話，那自當發怒。但是，依客觀判斷，這樣做只會使狀況進一步地惡化。……雖然屈辱，但現在忍耐方為上策。」,「……………发怒就能改善状况的话，那自当发怒。但是，依客观判断，这样做只会使状况进一步地恶化。……虽然屈辱，但现在忍耐方为上策。」,"""... Si può fare in questo modo solo se la situazione può migliorare arrabbiandosi. Però, da un punto di vista oggettivo, sembra che farlo in questo caso aggraverebbe semplicemente la situazione. Può essere umiliante, ma la cosa più saggia da fare è sopportare."""
Mammon,"""Ahha! You really are a sloth, Belpha! Quit fooling around, I can't stand this!! I can't forgive them!!"" ","""Ahha! You really are a sloth, Belphe‐nee! Screw that, I can't stand this!! I can't forgive them!!""",[=ST],「あっは！　さっすがベルフェ姉は怠惰やってます！ふざけないでよ、私は耐えられない！！　こいつらが許せないッ！！」,「あっは！　さっすがベルフェ姉は怠惰やってます！　ふざけないでよ、私は耐えられない！！　こいつらが許せないッ！！」,"""Аха‐ха! Ты и впрямь лентяйка, Вельфи! Кончай валять дурака, мне невыносимо смотреть на это! Я не могу простить их!""","""Ahha! Você é mesmo uma preguiça, Belphe‐nee! Dane‐se isso, eu não consigo aguentar!! Eu não posso perdoá‐las!!""",「啊哈！貝露菲姐，不愧是懶惰啊！少胡扯了，我已經忍不住了！！饒不了那幫傢伙！！」,「啊哈！贝露菲姐，不愧是懒惰啊！少胡扯了，我已经忍不住了！！饶不了那帮家伙！！」,"""Ahha! Sei davvero pigra, Belpha! Smettetela di scherzare, io non lo sopporto!! Non posso perdonarle!!"""
Sakutarou,"‘...E-Everyone, calm down... It'll become a burden for Ange...’ ","‘...E‐everyone, settle down... You're putting a burden on Ange...’",[=ST],『…み、みんな騒がないで…。縁寿の負担になっちゃうよ…。』,『…み、みんな騒がないで…。縁寿の負担になっちゃうよ…』,"{p:0:『}П‐послушайте, все, успокойтесь... Так мы лишь перегрузим Энджи...{p:0:』}","‘...M‐Meninas, se acalmem... Você está colocando um peso sobre a Ange...’",『…大、大家別吵了…。會給緣壽造成負擔的…』,『…大、大家别吵了…。会给缘寿造成负担的…』,{p:0:『}... C-Calmatevi tutte... diventerà un peso per Ange... {p:0:』}
Mammon,"""A burden?! What are you talking about? Is this the time or place to be calm?! We furniture are not so cruel as to coolly watch when our master is humiliated!!"" ","""A burden?! What are you talking about? Is this the time or place to be calm?! We furniture are not so cruel as to be able to coolly watch our master being humiliated!!""",[=ST],「負担？！　なに言ってんのよ、ここは騒ぐところでしょ？！　私たち家具は、主が侮辱されているのを見て冷静で居られるほど残酷じゃないッ！！」,[=JP],"""Перегрузим?! Что ты несёшь? Разве сейчас место и время сохранять спокойствие? Мы, мебель, не настолько жестоки, чтобы хладнокровно наблюдать, как унижают нашу госпожу!!!""","""Um peso?! Do que você está falando? Esse não é um lugar muito menos um momento de se manter calma?! Nós, mobílias, não somos tão cruéis a ponto de ficarmos friamente assistindo nossa mestra ser humilhada!!""",「負擔？！你在說什麼呢，這正是要吵的時候吧？！我們家具還沒殘酷到，看了主人受辱，還能冷靜地待著！！」,「负担？！你在说什么呢，这正是要吵的时候吧？！我们家具还没残酷到，看了主人受辱，还能冷静地待着！！」,"""Un peso?! Di che stai parlando? È questo il momento o il luogo in cui essere calmi?! Noi mobili non siamo così crudeli da guardare freddamente quando il nostro padrone è umiliato!!"""
Satan,"""Ange-sama!! You have no obligation to read such a humiliating letter! If you can't let out a cry of rage, then at least throw it onto the floor!!"" ","""Ange‐sama!! You have no obligation to read such a humiliating essay! If you can't let out a cry of rage, then at least throw that insulting message onto the floor!!""",[=ST],「縁寿さまッ！！　そんな侮辱の文章を読む義務はありません！　怒りの声を上げられないなら、せめてその屈辱の文面を床に叩きつけて！！」,[=JP],"""Энджи‐сама! Вы не обязаны зачитывать это унизительное письмо! Если вы не можете испустить гневный возглас, то хотя бы бросьте его на пол!""","""Ange‐sama!! Você não tem obrigação de ler essa redação humilhante! Se não consegue libertar seus gritos de fúria, ao menos jogue essas mensagem insultante longe!!""",「緣壽小姐！！您沒義務去念這種侮辱性文章！沒法大聲怒喝的話，那就將這屈辱文章扔到地上！！」,「缘寿小姐！！您没义务去念这种侮辱性文章！没法大声怒喝的话，那就将这屈辱文章扔到地上！！」,"""Ange-sama!! Non è obbligata a leggere una lettera così umiliante! Se non può piangere di rabbia, almeno la butti a terra!!"""
Mammon,"""You don't need to trash talk them, you don't need to yell so loud that they bend over backwards! Just throw the notebook on the floor with all your might...!! By doing just that, you'll be able to show your strong will!!"" ","""You don't need to trash‐talk them, you don't need to yell so loud that they bend over backwards! Just throw that notebook on the floor with all your might...!! That's all you need to do to show how strong‐willed you are!!""",[=ST],「口汚く罵らなくていい、仰け反らせるほどの大声をあげなくていい！ただ渾身の力でそのノートを床に叩きつけて…！！　それだけのことで、縁寿さまは強い意思を示すことが出来る！！」,「口汚く罵らなくていい、仰け反らせるほどの大声をあげなくていい！　ただ渾身の力でそのノートを床に叩きつけて…！！　それだけのことで、縁寿さまは強い意思を示すことが出来る！！」,"""Вам нет нужды пререкаться с ними, вам не нужно кричать так, чтобы отогнулись! Просто что есть сил бросьте тетрадь на пол! Поступив так, вы сможете продемонстрировать вашу сильную волю!""","""Você não precisa falar mal delas, não precisa gritar alto para quem está nos bancos do pátio escutem! Apenas jogue esse caderno no chão com toda sua força...!! Isso é tudo o que você precisa para mostrar a sua força de vontade!!""",「不用以髒話罵人，不用發出令人嚇得後仰的巨大聲音！只需用渾身的力氣將那本筆記本砸到地上…！！只要這樣，就能顯示出緣壽小姐的強烈意志！！」,「不用以脏话骂人，不用发出令人吓得后仰的巨大声音！只需用浑身的力气将那本笔记本砸到地上…！！只要这样，就能显示出缘寿小姐的强烈意志！！」,"""Non c'è bisogno di insultarle, non c'è bisogno di gridare così tanto da farle piegare all'indietro! Tira il quaderno a terra con tutta la tua forza e basta...!! Facendo solo quello, riuscirai a mostrare il tuo forte volere!!"""
