Speaker,Steam (ST),Umineko Project (UP),Original Witch Hunt (OG),PC Japanese (JP),PS3 Japanese - Censored (JPC),Russian (RU),Brazilian Portuguese (PT),Chinese Traditional (CHT),Chinese Simplified (CN),Italian (Ars Magica) (Old) (ITA)
Leviathan,"""Hey!! That's miiine! Giiive iiit baaack!!"" ","""Heyyyy!! That's miiine! Give—it—back!!""",[=ST],「ちょっとー！！　それ、私のー！　かーえーしーてぇー！！」,[=JP],"""Эй! Он мо‐ой! Отда‐ай!""","""Eiiii!! Isso é meeeu! De—vol—ve!!""",「喂喂——！！那是我的——！還——給——我——！！」,「喂喂——！！那是我的——！还——给——我——！！」,"""Ehi!! Quello è miiiiooo! Ri-dam-me-looo!!"""
Beelzebub,"""No, no, I'll eat iiit! Asmo, Asmo, pass!"" ","""Nonono, I'm gonna eat i~t! Asmo, Asmo, pass!""",[=ST],「やだやだ、私が食べるの〜！　アスモ、アスモ、パース！」,[=JP],"""Нет, не‐е‐ет, я съем его‐о‐о! Асмо, Асмо, отстань!""","""Sem chance, eu vou come~r! Asmo, Asmo, pega!""",「不給不給，我要吃～！阿絲磨，阿絲磨，傳球！」,「不给不给，我要吃～！阿丝磨，阿丝磨，传球！」,"""No, no, lo mangio iooo-! Asmo, Asmo, passa!"""
Asmodeus,"""Kya-hahahaha! Over here, Levia onee-samaaa!"" ","""Kyaahahahaha! Levia onee‐sama, over here, over here~!""",[=ST],「きゃーはははは！　レヴィアお姉様、こっちこっちぃ〜！」,[=JP],"""Кья‐ха‐ха‐ха! Левия онее‐сама, здесь~!""","""Kyaahahahaha! Levia onee‐sama, aqui, aqui~!""",「呀——哈哈哈哈！雷維阿姐姐，這邊這邊～！」,「呀——哈哈哈哈！雷维阿姐姐，这边这边～！」,"""Kya-hahahaha! Quaggiù, Levia Onee-sama~!"""
,"I wonder where they swiped it from. They were fighting over a donut or something, playing around really loudly. ","I wonder where they swiped it from.{n}They were fighting over a donut or something, playing around really loudly.",[=ST],どこからくすねて来たのだろう。ドーナツか何かを争って、実に賑やかに戯れている。,どこからくすねて来たのだろう。{n}ドーナツか何かを争って、実に賑やかに戯れている。,"Где они его стащили, хотела бы я знать.{n}И теперь они с шумом и гамом дрались из‐за какого‐то пончика.","Me pergunto de onde ela pegou isso.{n}Elas estavam brigando por causa de um donut ou algo assim, se divertindo e fazendo muito barulho.",是從哪兒順手牽羊拿來的吧。{n}姐妹們爭搶著甜甜圈之類的玩意兒，鬧得實在很大聲。,是从哪儿顺手牵羊拿来的吧。{n}姐妹们争抢着甜甜圈之类的玩意儿，闹得实在很大声。,"Mi chiedo dove l'abbiano rubato. Si stavano contendendo una ciambella o qualcosa del genere, facendo un gran baccano."
Satan,"""HEY!!!!! Ange‐sama is reading, can't you be the slightest bit quiet?!"" ","""HEY!!!!! Ange‐sama is reading, can't you be the slightest bit quiet?!""",[=ST],「こらあああ！！　縁寿さまは読書をなさってるのよ、少しは静かに出来ないのッ？！」,[=JP],"""Э‐э‐э‐э‐эй! Энджи‐сама читает, так что не могли бы вы хоть немного угомониться?!""","""EI!!!!! A Ange‐sama está lendo, não podem fazer um pouco de silêncio?!""",「喂——！！緣壽小姐正在看書，你們就不能稍微安靜點嘛？！」,「喂——！！缘寿小姐正在看书，你们就不能稍微安静点嘛？！」,"""Eeeehi!! Ange-sama sta leggendo, non riuscite a fare un po' più di silenzio?!"""
Lucifer,"""Yelling stuff like that makes you the loudest one, Satan! Be silent!! You foolish little sister!"" ","""And yet you're the loudest one, Satan, silence yourself!! You cretinous sister!""",[=ST],「そう言ってるサタンが一番うるさいのよ、沈黙なさい！！　この愚妹が！」,[=JP],"""А сама‐то как громко кричишь, Сатана! Тише! Вот глупые сестры!""","""Mesmo você sendo a mais barulhenta, Satan, faça silêncio você!! Suas irmãs cretinas!""",「在這麼說的撒旦是最吵的喲，給我保持沉默！！你這愚妹！」,「在这么说的撒旦是最吵的哟，给我保持沉默！！你这愚妹！」,"""Sei tu a fare più rumore di tutte gridando, Satan! Fai silenzio!! Stupida sorella!"""
Satan,"""Y-You're the loud one, Lucifer onee-sama!! I-Is there something you'd like to say to me?!"" ","""Y‐you're louder than me, Lucifer onee‐sama!! I‐is there something you want to say to me?!""",[=ST],「ル、ルシファーお姉様の方がうるさいです！！　も、文句がおあり？！」,[=JP],"""Чего орёшь, Люцифер онее‐сама?! Т‐тебе что‐то не нравится?!""","""V‐Você está fazendo mais barulho que eu, Lucifer onee‐sama!! T‐Tem alguma coisa que você queira me dizer?!""",「路、路西法姐姐比我更吵！！有、有意見？！」,「路、路西法姐姐比我更吵！！有、有意见？！」,"""S-Sei tu a fare rumore, Lucifer Onee-sama!! D-Di che ti lamenti?!"""
,"I was already used to the oldest and the third oldest sister arguing with each other. Even though they're both so quick to anger, it's a bit funny how they're both having to hold back a little. ","By now, I was used to the fights between the eldest and the third‐eldest sister. It's a bit funny how they're both a little hesitant even though they're so quick to anger.",[=ST],長女と三女の口喧嘩ももうお馴染みだ。二人とも怒りんぼのくせに、少し腰が引けているっぽいところが何だか面白い。,[=JP],"Самая старшая и третья по старшинству сестры вовсю спорили друг с другом. Даже при присущей им раздражающей быстроте перемещения, было немного смешно наблюдать, когда они пытались сдерживаться.",Já estou acostumada com brigas entre a mais velha e a terceira irmã mais velha.{n}É um pouco engraçado em como ambas sempre hesitam um pouco mesmo que elas rapidamente fiquem furiosas.,我已經習慣長女與三女的吵嘴了。她倆那儘管都很易怒，卻又都有點腰板不硬之處，令人不由得感到好玩。,我已经习惯长女与三女的吵嘴了。她俩那尽管都很易怒，却又都有点腰板不硬之处，令人不由得感到好玩。,"La sorella maggiore e la terza sorella più grande erano abituate a litigare tra loro. Anche se entrambe si arrabbiano rapidamente, è piuttosto divertente vedere come cerchino di trattenersi un po'."
,They might be surprisingly like each other. ,They might be surprisingly similar.,[=ST],案外、似た者同士なのかもしれない。,[=JP],Они были наделены удивительной схожестью друг с другом.,Elas são surpreendentemente parecidas.,搞不好，她們說不定是一對頗為相似的人。,搞不好，她们说不定是一对颇为相似的人。,"Si somigliano moltissimo, incredibilmente."
Belphegor,"""*cackle*cackle* You were told to be noisy, but this is a bit too much. Should I make them lower the volume a little?"" ","""Heh heh. You ordered us to be noisy, but this is surely too much. Should I make them lower the volume a little?""",[=ST],「くっくくく。賑やかにしていろとの仰せでしたが、これではさすがに。少しボリュームを下げさせますか？」,[=JP],"""*смешок*смешок*. Вам позволено шуметь, но вы немного переборщили. Может быть, всё же можно потише?""","""Heh heh. Você nos ordenou para sermos barulhentas, mas isso certamente é demais. Eu deveria fazer elas baixarem um pouco o volume?""",「呵、呵呵呵。雖然您有說過“去搞熱鬧點”，但這樣實在是有點過了。請問，需不需要叫大家小聲點？」,「呵、呵呵呵。虽然您有说过“去搞热闹点”，但这样实在是有点过了。请问，需不需要叫大家小声点？」,"""*cackle*cackle*. Ti è stato detto di essere rumorosa, ma questo è un po' troppo. Non puoi abbassare un po' il tono?"""
Ushiromiya Ange,"""......They can mess around all they want. It's a hundred times more pleasant than that shrill laughter in the classroom."" ","""............You can all mess around all you want. It's a hundred times more pleasant than the shrill laughter in the classroom.""",[=ST],「…………気にしないで騒いでてくれていいわ。教室の黄色い笑い声より百倍心地良いもの。」,「…………気にしないで騒いでてくれていいわ。教室の黄色い笑い声より百倍心地良いもの」,"""............Они могут делать всё, что душа пожелает. Это ведь куда приятнее, чем смешки в классе.""","""............Você pode bagunçar o quanto quiser. É cem vezes mais agradável do que as estridentes risadas na sala de aula.""",「…………不用在意，隨大家鬧好了。這可比教室裡的煩人笑聲舒心百倍。」,「…………不用在意，随大家闹好了。这可比教室里的烦人笑声舒心百倍。」,"""... Possono fare tutto il rumore che vogliono. È cento volte più piacevole delle risate stridule nella mia classe."""
Mammon,"""Ange-samaa, go to the next page quickly! You read really sloow!"" ","""Ange‐samaa, hurry up, next paaage! You read really slooww!""",[=ST],「縁寿さまぁ、早く次のページぃ！　縁寿さまは読むのが遅いぃ！」,[=JP],"""Энджи‐сама‐а‐а‐а, быстро перелистните страницу! Вы читаете слишком ме‐е‐едленно!""","""Ange‐samaa, rápido, próxima páginaaaa! Você lê muito devagaaar!""",「緣壽小姐——，快翻到下一頁——！緣壽小姐看得好慢——！」,「缘寿小姐——，快翻到下一页——！缘寿小姐看得好慢——！」,"""Ange-sama, passate in fretta alla prossima pagina! Leggete davvero molto lentamente!"""
Ushiromiya Ange,"""You like to read, Mammon? You looked like you'd be the worst at doing boring things."" ","""You like to read, Mammon? You look like you'd be the most averse to such ordinary things.""",[=ST],「マモンは読書が好きなの？　地味なことが一番苦手そうに見えるのにね。」,「マモンは読書が好きなの？　地味なことが一番苦手そうに見えるのにね」,"""Мамона, ты любишь читать? А ты заметила, что делаешь некоторые вещи хуже, чем я?""","""Gosta de ler, Mammon? Você parece ser a que possui maior aversão a coisas tão ordinárias.""",「馬蒙喜歡看書？我還覺得，你看起來最討厭這種樸實無華的事了呢。」,「马蒙喜欢看书？我还觉得，你看起来最讨厌这种朴实无华的事了呢。」,"""Ti piace leggere, Mammon? E pensare che sembravi la peggiore a fare cose semplici."""
Belphegor,"""Mammon controls greed. ...That also includes a thirst for knowledge. Still, she wants to keep that knowledge all for herself, so be warned that she refuses to let people read any book you give her, and sometimes burns them after reading them."" ","""Mammon's domain is greed. ......That also includes a thirst for knowledge. But she tends to want to keep that knowledge all for herself, so when someone gives her a book, she'll sometimes burn it after reading it so that no one else can—please watch out for that.""",[=ST],「マモンが司るのは強欲。……知識欲にもそれは通じます。ただし、独占したがるので、本を与えると人に読ませまいと、読書後に焼いてしまうこともあるのでご注意を。」,「マモンが司るのは強欲。……知識欲にもそれは通じます。ただし、独占したがるので、本を与えると人に読ませまいと、読書後に焼いてしまうこともあるのでご注意を」,"""Мамона отвечает за алчность. ......Туда же входит и жажда к знаниям. Но она хочет, чтобы эти знания принадлежали лишь ей, так что имейте в виду, она не даёт людям свои книги, а то и вовсе сжигает их после прочтения.""","""O domínio da Mammon é a ganância. ......Isso também inclui sede por conhecimento. Mas ela tende a querer manter esse conhecimento todo para si, por isso, quando alguém dá um livro a ela, algumas vezes ela o queima após ler para que ninguém mais possa ler — tome cuidado com isso.""",「馬蒙掌管的是貪婪。……求知欲也與此相通。只不過，由於她好獨佔，所以一給她書，她就會為了不讓別人看，而在看完後把書燒掉，還請多加注意。」,「马蒙掌管的是贪婪。……求知欲也与此相通。只不过，由于她好独占，所以一给她书，她就会为了不让别人看，而在看完后把书烧掉，还请多加注意。」,"""Mammon controlla l'avarizia. ... Ciò include anche la sete di conoscenza. Tuttavia, vuole tenere quella conoscenza tutta per sé, quindi fate attenzione, perché si rifiuta di far leggere alle altre persone ogni libro che le viene dato, e a volte li brucia dopo averli letti."""
Mammon,"""I like knowing things that no one else knows. I like being able to do things that no one else can do. So I like studying and practicing. Because I want to keep wisdom that no one else knows about all to myself."" ","""I like knowing things that no one else knows. I like being able to do things that no one else can do. So I like studying and practicing. Because I want to keep wisdom that no one else knows about all to myself.""",[=ST],「私は、誰も知らないことを、私だけが知っているのが好き。誰も出来ないことを、私だけが出来るのが好き。だから勉強は好き、練習は好き。私だけが、誰も知らない英知を、独り占めしたいから。」,「私は、誰も知らないことを、私だけが知っているのが好き。誰も出来ないことを、私だけが出来るのが好き。だから勉強は好き、練習は好き。私だけが、誰も知らない英知を、独り占めしたいから」,"""Мне нравится изучать вещи, о которых помимо меня никто и духу не ведает. Я люблю делать то, что другому сделать не под силу. Я люблю и теорию, и практику. Потому что хочу знать то, что больше никто не знает.""","""Eu gosto de saber coisas que ninguém mais sabe. Gosto de ser capaz de fazer coisas que ninguém mais consegue. Por isso eu gosto de estudar e praticar. Porque quero agregar mais sabedoria que ninguém mais sabe, só para mim.""",「我喜歡只有我知道，別人都不知道。我喜歡只有我做得到，別人都做不到。所以喜歡學習，喜歡練習。因為我想一人獨佔誰都不知道的知識。」,「我喜欢只有我知道，别人都不知道。我喜欢只有我做得到，别人都做不到。所以喜欢学习，喜欢练习。因为我想一人独占谁都不知道的知识。」,"""Mi piace apprendere cose che nessun altro conosce. Mi piace poter fare cose che nessun altro può fare. Per cui mi piace studiare ed esercitarmi. Poiché voglio avere un'intelligenza sconosciuta a tutti, tutta per me."""
,"As Mammon said that, her eyes sparkling, she peered down at the page that was open and read through it again. ","As Mammon said that, her eyes sparkling, she stared transfixed at the open page, reading through it again.",[=ST],マモンはそう言い、目を輝かせながら、今開かれているページをもう一度読み直すように凝視する。,[=JP],"Когда она говорила, её глаза сверкали, она посмотрела на раскрытую страницу и прочитала её ещё раз.","Os olhos de Mammon brilharam quando ela disse isso, e ela começou a olhar transfixada para a página aberta, lendo‐a novamente.",馬蒙邊如此說著，邊雙目閃閃發光地，如要重讀一遍般地凝視起了正翻開著的那一頁。,马蒙边如此说着，边双目闪闪发光地，如要重读一遍般地凝视起了正翻开着的那一页。,"Mentre Mammon lo diceva, i suoi occhi luccicavano, guardò la pagina su cui era aperto il libro e la lesse di nuovo."
,You could see the greed that made her covet that page even more thoroughly than I did. ,You could see the greed that made her even more intent than me on devouring that page.,[=ST],同じページを、私以上に貪り尽くしてやろうという強欲さが現れていた。,[=JP],"Можно было понять, что грех сделал её жаждущей прочитать ту страницу, и её жажда была в разы больше моей.","Você podia ver a ganância que a fazia cobiçar mais do que eu, devorando aquela página.",這正是表現出了，要在同一頁上榨取到比我更多的收獲的，貪婪。,这正是表现出了，要在同一页上榨取到比我更多的收获的，贪婪。,"Si poteva vedere l'avidità, che le faceva leggere la stessa pagina con più sforzo di me."
,"As you can see, my magical power has grown much stronger than it was on the first day I summoned them. ","As you can see, my magical power was now much stronger compared to the first day I summoned them.",[=ST],見ての通り、私の魔力は初めて彼女らを呼び出した日に比べ、ずっと強くなっていた。,[=JP],"Как можно было заметить, моя магическая сила выросла по сравнению с той, которой я владела в первый день их призыва.","Como você pode ver, meu poder mágico agora está muito mais forte do que comparado ao primeiro dia em que eu a invoquei.",如你所見，與當初第一次召喚出她們的那一天相比，我的魔力要強了很多。,如你所见，与当初第一次召唤出她们的那一天相比，我的魔力要强了很多。,"Come si può vedere, il mio potere magico è aumentato di molto rispetto al primo giorno che le ho evocate."
,"By now, I've gotten so that I can summon all of the Seven Sisters of Purgatory at once and still calmly read a book like this. ",I was now at the point where I could summon all of the Seven Sisters of Purgatory at once and still calmly read a book like this.,[=ST],今では、煉獄の七姉妹を同時に呼び出しながら、こうしてのんびり読書が出来るまでになっている。,[=JP],Сейчас мне было под силу призвать всех семерых сестёр чистилища и спокойно читать книгу.,Eu agora estou no nível onde eu posso invocar todas as Sete Irmãs do Purgatório e continuar a ler calmamente um livro como este.,如今，我已能邊同時召喚出煉獄七姐妹，邊像這樣悠閑看書。,如今，我已能边同时召唤出炼狱七姐妹，边像这样悠闲看书。,"Ora, sono in grado di evocare tutte e sette le Sorelle del Purgatorio nello stesso momento e posso anche leggere un libro in tutta tranquillità come sto facendo ora."
,"This place, although I can't recall exactly where it is, is a quiet and calm street-side bench. ","This place, although I couldn't recall {i:where} it was, was a quiet and calm street‐side bench.",[=ST],ここは、どこだか思い出せないけれど、のんびりとした静かな街並のベンチ。,[=JP],"То место, хоть я и не помню, {i:где} оно находилось, было тихим и спокойным, а рядом стояла скамья.","Este lugar, embora eu não posso lembrar {i:onde} ficava, era um quieto e calmo banco na calçada.",雖然記不起這是哪兒，但我坐在悠然恬靜的街邊長椅上。,虽然记不起这是哪儿，但我坐在悠然恬静的街边长椅上。,"Questo posto, anche se non posso ricordare dove si trovi, è una tranquilla panchina al lato della strada."
,"I'd been young back then, so I don't remember the details of its location. ","The reason that I couldn't remember the location of this place was that at the time I visited it, I was very young.",[=ST],私は幼かったから、ここがどこなのか、覚えていないのだ。,[=JP],"Тогда я была совсем мала, потому и не помню.","O motivo pela qual eu não consigo lembrar a localização deste lugar é porque na época em que eu o visitei, eu era muito jovem.",我在小時候就沒記住這是哪兒。,我在小时候就没记住这是哪儿。,"All'epoca ero giovane, quindi non ricordo dove sia."
,"...Still, I remember that my days walking here were a lot of fun. ","......Still, I remembered the day we'd walked here, and how much fun it was.",[=ST],……しかし、ここを歩いた日が、とても楽しかったことは覚えてる。,[=JP],"......Но мне запомнилось, что те деньки, которые я там проводила, были очень беззаботны.","......Mas, eu lembro do dia em que eu caminhei aqui, e como esse dia foi divertido.",……不過我記得，來這散步的那天非常地開心。,……不过我记得，来这散步的那天非常地开心。,"... Tuttavia, ricordo che i miei giorni passati camminando nei dintorni erano molto divertenti."
,"Together with Dad, Mom, ...and even Onii-chan, it was a memory of a very rare and very happy day when everyone had been together... ","Mom, Dad, ...and even Onii‐chan had been there—it was a memory of a very rare and very happy day when all the family had actually been together...",[=ST],お父さんとお母さんと、…そしてお兄ちゃんも揃った、本当に全員が揃ったとても珍しくてとても幸せな日の記憶…。,[=JP],"Тогда с мамой, папой... и даже братиком, мы провели редкий счастливый денёк, пока были вместе... это прочно вписалось в мою память...","Minha mãe, meu pai, ...e até o onii‐chan estavam lá — é uma memória muito rara e muito feliz do dia em que toda a família estava junta...",那是爸爸、媽媽、…還有哥哥都在一起，真真正正全家團聚，非常難得非常幸福的一天的記憶…。,那是爸爸、妈妈、…还有哥哥都在一起，真真正正全家团聚，非常难得非常幸福的一天的记忆…。,"Insieme a Mamma, Papà... e anche Onii-chan, era il ricordo di un giorno davvero raro e davvero felice in cui siamo stati tutti insieme..."
,The people who walked by every once in a while didn't notice me. They just pleasantly ignored me and passed by as though everything was normal. ,The people walking by every once in a while weren't noticing me.{n}They were just pleasantly ignoring me and passing by as normal.,[=ST],時折、道往く人々は私たちの姿には気付かない。ただ、心地良く無視して、普通に通り過ぎてくれるだけだ。,時折、道往く人々は私たちの姿には気付かない。{n}ただ、心地良く無視して、普通に通り過ぎてくれるだけだ。,"Прохожие, сновавшие туда‐сюда, совсем не замечали меня.{n}Они попросту игнорировали меня и шли мимо, будто всё было в порядке.",As pessoas que passavam de tempos em tempos não me notavam.{n}Elas apenas me ignoravam agradavelmente e passavam como se fosse normal.,時而路過的行人並沒有在意我們。{n}只是令人舒心地給予了我無視，若無其事地走過我們的身邊。,时而路过的行人并没有在意我们。{n}只是令人舒心地给予了我无视，若无其事地走过我们的身边。,"Le persone che passavano di tanto in tanto non si accorgevano di me. Semplicemente mi ignoravano passando oltre, come se fosse tutto normale."
,"Even the Seven Sisters' incredible outfits weren't embarrassing or anything, because it wasn't like anyone was actually watching. ","I wasn't even the slightest bit embarrassed by the Seven Sisters' shameless outfits, because it wasn't like they were actually being seen by anyone.",[=ST],七姉妹たちのすごい格好も、別に誰かに見られているわけでもないのだから、恥ずかしくも何ともない。,[=JP],"Даже откровенное одеяние семи сестёр не смущало их, ведь они их не видели.","Eu não estava nem um pouco envergonhada pelas roupas indecentes das Sete Irmãs, porque não é como se alguém realmente estivesse vendo elas.",七姐妹們那大膽的裝束也是，又沒有被人看到，所以沒什麼好為之害羞的。,七姐妹们那大胆的装束也是，又没有被人看到，所以没什么好为之害羞的。,"Persino gli assurdi vestiti delle Sette Sorelle non erano imbarazzanti o altro, perché era come se nessuno guardasse."
