Belphegor,"""I don't think it's a bad idea. Perhaps playing every once in a while is good for softening the mind."" ","""I don't think it's a bad idea. I would suggest that playing every once in a while is a good way of exercising the mind.""",[=ST],「悪くない提案と思います。たまには遊ぶのも、良い頭の柔軟になるかと。」,「悪くない提案と思います。たまには遊ぶのも、頭の良い柔軟になるかと」,"""Полагаю, это неплохая мысль. Наверное, время от времени поиграть полезно, чтобы дать голове развеяться.""","""Eu não acho que seja uma má ideia. É sempre bom brincar de vez em quando. É uma boa forma de exercitar a mente.""",「我覺得，這提議不壞。偶爾玩下，也能很好地放鬆下大腦。」,「我觉得，这提议不坏。偶尔玩下，也能很好地放松下大脑。」,"""Non penso sia una cattiva idea. Magari giocare di tanto in tanto aiuta ad alleggerire la mente."""
Ushiromiya Ange,"""......You govern Sloth, right, Belpha? What you're saying sounds reasonable, but you're actually being sneaky, aren't you?"" ","""............Your domain was sloth, right, Belphe? What you're saying sounds reasonable, but you're actually being sneaky, aren't you?""",[=ST],「…………ベルフェが司るのは怠惰だっけ？　もっともらしいことを言ってるけど、うまいことを言ってるわね。」,「…………ベルフェが司るのは怠惰だっけ？　もっともらしいことを言ってるけど、うまいことを言ってるわね」,"""..........Вы пляшете под дудку лени, верно, Вельфи? Ваши слова разумны, но на деле вы хитрите.""","""............Seu domínio é a preguiça, certo, Belphe? O que você está dizendo parece sensato, mas na verdade você só está sendo sorrateira, não está?""",「…………貝露菲掌管的是，懶惰來著？雖然講得很有道理，但這話可暗藏玄機呢。」,「…………贝露菲掌管的是，懒惰来着？虽然讲得很有道理，但这话可暗藏玄机呢。」,"""... Tu controlli l'accidia, giusto Belpha? Ciò che dici sembra ragionevole, ma in realtà sei piuttosto subdola."""
Belphegor,"""Hmph. My apologies. ...You are diligent, Ange-sama."" ","""Heh. My apologies. ......You are a diligent one, Ange‐sama.""",[=ST],「ふ。失礼しました。……縁寿さまは勤勉でおられる。」,「ふ。失礼しました。……縁寿さまは勤勉でおられる」,"""Хмф. Мои извинения. .....Вы усердный человек, Энджи‐сама.""","""Heh. Eu peço desculpas. ......Você é diligente, Ange‐sama.""",「呼。失禮了。……緣壽小姐很是勤奮呢。」,「呼。失礼了。……缘寿小姐很是勤奋呢。」,"""Hmph. Le mie scuse. ... È diligente, Ange-sama."""
Ushiromiya Maria,"""If it's okay with Ange, I'd also like to play with everyone. Let's make some noise. It'll definitely be fun."" ","""If it's okay with you, Ange, I'd like to play with everyone, too. All noisy together. It'll definitely be fun.""",[=ST],「縁寿さえ良ければ、私もみんなで遊びたいな。みんなでわいわい。きっと楽しい。」,「縁寿さえ良ければ、私もみんなと遊びたいな。みんなでわいわい。きっと楽しい」,"""Если Энджи не возражает, я тоже не прочь поиграть со всеми. Все такие шумные. Игра определённо будет весёлой.""","""Se está tudo bem para você, Ange, eu gostaria de brincar com todas também. Vamos nos animar. Certamente vai ser divertido.""",「要是緣壽同意的話，我也希望大家一起來玩。大家一起鬧哄哄的。一定很開心。」,「要是缘寿同意的话，我也希望大家一起来玩。大家一起闹哄哄的。一定很开心。」,"""Se sta bene ad Ange, anch'io vorrei giocare con tutti. Sono tutti così rumorosi. Sarà divertente di sicuro."""
Sakutarou,"‘Uryu-! Ange, Ange, let's play, let's play! Let's all do shiritori!’ ","‘Uryuu! Ange, Ange, let's play, let's play! Let's all do shiritori!’",[=ST],『うりゅー！　縁寿縁寿、遊ぼう遊ぼう！　みんなでしりとりをやろー！』,[=JP],"{p:0:『}Урю! Энджи, Энджи, давай играть, давай играть! Давайте поиграем в ширитори‐!{p:0:』}","‘Uryuu! Ange, Ange, vamos brincar, vamos brincar! Vamos todos brincar de shiritori!’",『嗚溜——！緣壽緣壽，來玩吧來玩吧！大家來玩詞語接龍——！』,『呜溜——！缘寿缘寿，来玩吧来玩吧！大家来玩词语接龙——！』,"{p:0:『}Uryu! Ange, Ange, giochiamo, giochiamo! Giochiamo tutti a shiritori!{p:0:』}"
Lucifer,"""In that case, let's start from Sakutaro's ""uryu-"". ......In that case, which sound should we start the next word from? ""Ryu""? Or ""yu""?"" ","""In that case, let's start from Sakutaro's ""uryu"". .........What does the next word have to start with in this case? ""Ryu""? ""Yu""?""",[=ST],「では、さくたろの“うりゅー”からスタートで。………この場合、何からになるの？　“りゅ”？　“ゆ”？」,[=JP],"""В таком случае давайте начнём с Сакутариного 'урю'. Итак, с чего же тогда начать? 'Рю'? 'Ю'?""","""Nesse caso, vamos começar com o ""uryu"" do Sakutaro. .........Então, com o que a próxima palavra precisa começar? ""Ryu""? ""Yu""?""",「那麼，就從櫻太郎的“{ruby:uryu:嗚溜}——”開始。………這個，該從哪個開始接呢？“ryu”？“yu”？」,「那么，就从樱太郎的“{ruby:uryu:呜溜}——”开始。………这个，该从哪个开始接呢？“ryu”？“yu”？」,"""E allora cominciamo dall' ‘uryu’ di Sakutarou. ... In questo caso, da dove cominciamo? ‘Ryu’? ‘Yu’?"""
Ushiromiya Maria,"""From ""uryu-""? ......I wonder. Maybe it really should be ""ryu""?"" ","""If it's ""uryu""? ...............I wonder. Maybe it really would be ""ryu""?""",[=ST],「“うりゅー”から？　……………何だろね。やっぱり、“りゅ”？」,[=JP],"""С 'урю'? .........Ну‐ну. Может, всё‐таки не с 'рю'?""","""Pode ser ""uryu""? ...............O que pode ser? Talvez seja mesmo ""ryu""?""",「從“嗚溜——”開始？……………算哪個呢？果然該算“ryu”？」,「从“呜溜——”开始？……………算哪个呢？果然该算“ryu”？」,"""Da ‘uryu’? ... Mmmh. Magari dovrebbe essere proprio ‘ryu’?"""
Ushiromiya Ange,"""...It's rare for a word that ends like that to come up."" ","""......It's rare for a word that ends weirdly like that to come up.""",[=ST],「……こんなおかしな語尾の単語が出てくるなんて滅多にないし。」,「……こんなおかしな語尾の単語が出てくるなんて滅多にないし」,""".....Слово с таким окончанием редко когда встретишь.""","""......É raro surgir uma palavra que termina de forma estranha assim.""",「……這種怪怪的語尾的詞，可極少出現呢。」,「……这种怪怪的语尾的词，可极少出现呢。」,"""... È raro che appaia una parola che finisce così."""
Mammon,"""Then I'm first!! I'll do a word starting with ""ryu""! Ryuuzu (watch crown)!"" ","""Okay, I'm first then!! I'll start from ""ryu""! A {ruby:ryuuzu:""watch ste~m""}!""",[=ST],「じゃあ私が一番！！　“りゅ”から行くね！　時計のネジの“竜頭”〜！」,[=JP],"""Тогда я первая! Начну с 'рю'! '{ruby:ryuuzu:Смотровой стебелёк}'!""","""Certo, eu sou a primeira!! Vou começar com ""ryu""! {ruby:ryuuzu:""Coroa de reló~gio""}!""",「那，我來接第一個！！從“{ruby:ryu:溜}”開始接！鐘錶上調時間的“{ruby:ryuuzu:發條}”～！」,「那，我来接第一个！！从“{ruby:ryu:溜}”开始接！钟表上调时间的“{ruby:ryuuzu:发条}”～！」,"""Allora vado io per prima!! Comincerò da ‘ryu’! Un ‘cinturino di orologio’ (ryuuzu)!"""
Leviathan,"""I wanted to go first! ""Ryuuto"" (lute) would've been wonderful!"" ","""I wanted to be the one to speak first! {ruby:ryuuto:""Lute""} would have been so much more wonderful!""",[=ST],「私が一番に言いたかったのにぃ！　“リュート”の方が素敵ぃ！」,[=JP],"""Я первой хотела это сказать! '{ruby:ryuuto:Лютня}' сгодилось бы идеально!""","""Eu queria ser a primeira a falar! {ruby:ryuuto:""Alaúde""} teria sido muito mais divertido!""",「我想第一個說呀！“{ruby:ryuuto:琉特琴}”更帥！」,「我想第一个说呀！“{ruby:ryuuto:琉特琴}”更帅！」,"""Volevo dirlo io per prima! ‘Liuto’ sarebbe stato fantastico!"""
Ushiromiya Ange,"""""Zu""? Feels like we keep getting tough ones. ...Wait a sec, what order are we going in? Who's next?"" ","""‘Zu’? Feels like we keep getting tough ones. ...Wait a sec, what order are we going in? Who's next?""",[=ST],「“ず”？　何だかさっきから難しいのばっかりね。…というか、順番どうなってるの？　次は誰？」,[=JP],"""'Зу'? Что‐то нам сплошь сложные окончания попадаются. Секундочку, а в каком порядке мы идём? Кто следующий?""","""‘Zu’? Sinto que vamos continuar nos difíceis. ...Espera um pouco, em que ordem estamos indo? Quem é a próxima?""",「“zu”？感覺從剛才起就盡是些難的呢。…話說回來，順序怎麼辦？下一個輪到誰？」,「“zu”？感觉从刚才起就尽是些难的呢。…话说回来，顺序怎么办？下一个轮到谁？」,"""‘Zu’? Sembra che continuiamo ad incappare in parole difficili. ... Aspettate un attimo, che ordine seguiamo? A chi tocca?"""
Sakutarou,‘Uryu. I don't think it matters who. Whoever thinks of a matching word first.’ ,‘Uryu. I don't think it matters who. Whoever thinks of something first.’,[=ST],『うりゅ。誰でもいいと思うよ。思いついた人順でいいよ。』,『うりゅ。誰でもいいと思うよ。思いついた人順でいいよ』,"{p:0:『}Урю. Думаю, это не важно. Кто первый что‐нибудь придумает, пусть то и выдаёт.{p:0:』}",‘Uryu. Eu não acho que isso importa. Tanto faz quem for a próxima.’,『嗚溜。偶覺得，誰都無所謂。就誰想到誰接好了。』,『呜溜。偶觉得，谁都无所谓。就谁想到谁接好了。』,{p:0:『}Uryu. Non credo importi chi. Chiunque pensi a qualcosa per primo. {p:0:』}
Ushiromiya Maria,"""What's that? Sounds interesting. How about the person who can say the most wins? It's fast-talking shiritori!"" ","""Huh, that sounds fun. The person who can say the most wins? It's fast‐talking shiritori!""",[=ST],「何それ、面白いね。いっぱい言えた人が勝ち？　早口しりとりだね！」,[=JP],"""Даже так? Звучит интересно. Победит тот, кто предложит больше вариантов. Ширитори на скорость!""","""Parece mais divertido assim! Então a pessoa que falar mais vence? É shiritori de quem fala primeiro!""",「什麼什麼，這個好玩。誰接得最多算誰贏？搶答接龍！」,「什么什么，这个好玩。谁接得最多算谁赢？抢答接龙！」,"""Eeeh? Sembra interessante. La persona che ne dice di più vince? È uno shiritori veloce!"""
Beelzebub,"""Then I'll go! ""Zucchini""! ""Ninniku itame"" (garlic stir-fry)! ""Mekabu with pasta""! All of them delicious! Kyaha, I said three of them!"" ","""OK, I'll go, then! ""Zucchini""! {ruby:ninniku itame:""Garlic stir‐fry""}! ""Mekabu and pasta""~! All of them delicious! Kyaha, I said three!""",[=ST],「じゃあ私行くね！“ズッキーニ”！“ニンニク炒め”！“芽かぶのパスタ”〜！どれも美味しそう！　きゃは、３つも言っちゃったぁ！」,「じゃあ私行くね！　“ズッキーニ”！　“ニンニク炒め”！　“芽かぶのパスタ”〜！　どれも美味しそう！　きゃは、３つも言っちゃったぁ！」,"""Тогда я скажу! 'Зуччини'! '{ruby:ninniku itame:Чесночная подлива}'! 'Мекабу и паста'~! И все они вкуснющие! Кья‐ха, я сказала все три!""","""Certo, então eu vou agora! ""{i:Zucchini}""! {ruby:ninniku itame:""Alho frito""}! ""{i:Mekabu} com {i:pasta}""~! Todos parecem deliciosos! Kyaha, eu disse três!""",「那，我來接了哦！“{ruby:zukkiini:夏南瓜}”！“{ruby:ninniku itame:炒大蒜}”！“{ruby:mekabu no pasuta:嫩芽菜拌的面}”～！不管哪個，聽著都很好吃！呀哈，一口氣說了三個！」,「那，我来接了哦！“{ruby:zukkiini:夏南瓜}”！“{ruby:ninniku itame:炒大蒜}”！“{ruby:mekabu no pasuta:嫩芽菜拌的面}”～！不管哪个，听着都很好吃！呀哈，一口气说了三个！」,"""Allora vado io! ‘Zucchini’! ‘Saltare aglio in padella’ (ninniku itame)! ‘Mekabu e pasta’~! Tutti deliziosi! Kyaha, ne ho detti tre!"""
Belphegor,"""Belz takes three points. ...Can you use conjunctions?"" ","""Belzie takes three points. ......Can you use conjunctions?""",[=ST],「ベルゼ、３点獲得っと。……接続詞はありなのか？」,[=JP],"""Вельзи три очка. ......А можно использовать словосочетания?""","""Belzie fica com três pontos. ......Podemos usar conjunções?""",「貝露賽，得三分。……能加接續詞？」,「贝露赛，得三分。……能加接续词？」,"""Belz fa tre punti. ... Puoi usare congiunzioni?"""
Satan,"""If you could use ""with"", then anything would work!! That last one doesn't count! Minus one point!! Let's start from ""me""."" ","""If you could use ""and"" then anything would work!! That last one doesn't count! Minus one point!! Start over at ""me"".""",[=ST],「“の”がありになったら、何でもありになっちゃうわ！！最後のは駄目よ！　１点減点！！　“め”からよ。」,「“の”がありになったら、何でもありになっちゃうわ！！　最後のは駄目よ！　１点減点！！　“め”からよ」,"""Если воспользоваться союзом 'и', то всё сгодится! Последнее не в счёт! Минус одно очко! Начнём с 'мэ'.""","""Se você puder usar ""e"" então qualquer coisa deve funcionar!! A última não contou! Menos um ponto!! Comecem de novo com ""me"".""",「加上“{ruby:no:的}”的話，那就什麼都能說了！！最後一個不算！減一分！！從“me”開始接。」,「加上“{ruby:no:的}”的话，那就什么都能说了！！最后一个不算！减一分！！从“me”开始接。」,"""Se puoi usare ‘e’ allora va bene tutto!! L'ultima non conta! Un punto in meno!! Iniziamo da ‘me’."""
Ushiromiya Maria,"""Then I'll go. ""Meringue""-!"" ","""Okay, my turn. {ruby:merenge:""Meringue""~!""}",[=ST],「じゃあ真里亞ね。“メレンゲ”〜！」,[=JP],"""Тогда {f:5:Мария}. '{ruby:merenge:Меренга}'~!""","""Certo, minha vez. {ruby:merenge:""Merengue""~!""}",「那，真里亞來。“{ruby:merenge:蛋白酥皮}”～！」,「那，真里亚来。“{ruby:merenge:蛋白酥皮}”～！」,"""Allora Maria. ‘Meringhe’~!"""
Sakutarou,"‘""Ge""?? ...U-U- Uryu-!’ ",‘‘Ge’?? ...U...u......uryuu!’,[=ST],『“げ”？？　…う、…う、……うりゅー！』,[=JP],"{p:0:『}""Гэ""??? У... у... урю‐!{p:0:』}",[=UP],『“ge”？？…嗚、…嗚、……嗚溜——！』,『“ge”？？…呜、…呜、……呜溜——！』,{p:0:『} Ghe?? ... U... U... Uryu-!{p:0:』}
Lucifer,"""""Gesuidou"" (Drainage system), ""umetatechi"" (reclaimed land), ""chikashitsu"" (basement). How'd you like them apples?"" ","""{ruby:gesuidou:‘Drainage system’}, {ruby:umetatechi:""reclaimed land""}, {ruby:chikashitsu:""basement""}. Something like that?""",[=ST],「“下水道”、“埋立地”、“地下室”。ざっとこんな感じ？」,[=JP],"""'{ruby:gesuidou:Дренажная система}', '{ruby:umetatechi:обретённые земли}', '{ruby:chikashitsu:подвал}'. Что‐то вроде такого?""","""{ruby:gesuidou:‘Rede de drenagem’}, {ruby:umetatechi:""Aterramento marítimo""}, {ruby:chikashitsu:""Porão""}. Algo assim?""",「“{ruby:gesuidou:下水道}”、“{ruby:umetatechi:填埋地}”、“{ruby:chikashitsu:地下室}”。小試牛刀哦？」,「“{ruby:gesuidou:下水道}”、“{ruby:umetatechi:填埋地}”、“{ruby:chikashitsu:地下室}”。小试牛刀哦？」,"""‘Sistema di drenaggio’ (gesuidou), ‘Terra bonificata’ (umetatechi), ‘Cantina’ (chikashitsu). Qualcosa del genere?"""
Leviathan,"""Onee-sama, those are all pretty crummy words, *giggle*!"" ","""Onee‐sama, those are all pretty unrefined words, *giggle*!""",[=ST],「お姉様、何だか品のない単語ばっかりー、くすくす！」,[=JP],"""Онее‐сама, всё это неизящные слова, *хи‐хи*!""","""Onee‐sama, essas são todas palavras nada refinadas, *risos*!""",「姐姐，怎麼盡是接些沒品的詞呀——，嘻嘻！」,「姐姐，怎么尽是接些没品的词呀——，嘻嘻！」,"""Onee-sama, queste non sono parole molto raffinate, *giggle*!"""
Lucifer,"""S-So what? Then why don't you try following up with something refined!! Anyway, that's three points for me. The next one's ""tsu"", okay, ""tsu""!"" ","""S‐so what, why don't you try following up with something refined, then!! Anyway, that's three points for me. The next one's ""tsu"", alright, ""tsu""!""",[=ST],「な、何よ、じゃあ品のいい単語で続けてみなさいよっ！！とにかく私、３点ね。次は“つ”よ、“つ”！」,「な、何よ、じゃあ品のいい単語で続けてみなさいよっ！！　とにかく私、３点ね。次は“つ”よ、“つ”！」,"""Н‐ну и что, тогда почему бы тебе ни придумать что‐нибудь изящное в продолжение! В любом случае, мне три очка. Дальше 'цу', хорошо? 'Цу'!""","""E‐E daí, então por que não tenta seguir com algo refinado!! De qualquer forma, são três pontos para mim. A próxima é com ""tsu"", certo, ""tsu""!""",「怎、怎麼，那、那你來接個有品的詞看看呀！！總之我得三分。下一個是“tsu”喲、“tsu”！」,「怎、怎么，那、那你来接个有品的词看看呀！！总之我得三分。下一个是“tsu”哟、“tsu”！」,"""E... e allora, allora perché non provi tu ad andare avanti con qualche parola raffinata!! Comunque, sono tre punti per me. Il prossimo è ‘tsu’, eh, ‘tsu’!"""
Ushiromiya Maria,"""I've never played such a weird shiritori before. Uu-uu-! It's fun!"" ","""Never played such a weird shiritori before. Uu‐uu! Fun!""",[=ST],「こんな変なしりとり初めて。うーうー！　面白い！」,[=JP],"""Никогда прежде не играла в такое странное ширитори. У‐у‐у! Интересно!""","""Nunca brinquei de um shiritori tão estranho. Uu‐uu! Tão divertido!""",「第一次碰上這麼怪的接龍。嗚——嗚——！好玩！」,「第一次碰上这么怪的接龙。呜——呜——！好玩！」,"""Mai giocato ad uno shiritori così strano. Uu-uu-! Interessante!"""
Sakutarou,"‘Uryu-! I don't get it at all, but it's fun. Uryu-!’ ","‘Uryuu! I don't get it at all, but it's fun. Uryuu!’",[=ST],『うりゅー！　全然わかんないけど面白い。うりゅー！』,[=JP],"{p:0:『}Урю! Я совсем ничего не понимаю, но это интересно. Урю‐!{p:0:』}","‘Uryuu! Eu não entendi nada, mas é divertido. Uryuu!’",『嗚溜——！雖然完全想不出來，但好好玩。嗚溜——！』,『呜溜——！虽然完全想不出来，但好好玩。呜溜——！』,"{p:0:『}Uryu-! Non ci capisco nulla, ma è interessante. Uryu-!{p:0:』}"
,"I've played normal shiritori before, but I've never experienced a shiritori this weird. ","I'd played normal shiritori before, but this kind of weird shiritori was a new experience for me.",[=ST],普通のしりとりをしたことはあるけれど、こんなおかしなしりとりは始めての経験だ。,普通のしりとりをしたことはあるけれど、こんなおかしなしりとりは初めての経験だ。,"Мне доводилось играть в нормальное ширитори, но в такое странное ещё нет.","Eu já brinquei de shiritori normal antes, mas esse shiritori peculiar é uma experiência nova para mim.",雖然有玩過普通的接龍，但這等怪異的接龍倒是頭一次玩。,虽然有玩过普通的接龙，但这等怪异的接龙倒是头一次玩。,"Ho giocato allo shiritori normale prima di questo, ma non ho mai provato uno shiritori così strano."
,"There's only the lively Seven Sisters, Maria onee-chan, Sakutaro, and me. ","The Seven Sisters, who would be lively enough just on their own; Maria onee‐chan; Sakutaro; and me.",[=ST],ただでさえ賑やかな七姉妹に、真里亞お姉ちゃんにさくたろに、私。,[=JP],"Есть только бойкие семь сестёр, Мария онее‐чан, Сакутаро и я.","As Sete Irmãs, que sozinhas já são muito animadas; a Maria onee‐chan; o Sakutaro; e eu.",本就夠鬧騰了的七姐妹，再加上真里亞姐姐、櫻太郎，以及我。,本就够闹腾了的七姐妹，再加上真里亚姐姐、樱太郎，以及我。,"Ci sono solo le vivaci Sette Sorelle, Maria Onee-chan, Sakutarou, e io."
,I'm now surrounded by friends that are so fun to be with. ,I was now surrounded by friends that were just so fun.,[=ST],こんな楽しい仲間たちに、私は今や囲まれている。,[=JP],Теперь я окружена друзьями и мне так весело.,Eu estava cercada por amigos tão divertidos.,此刻的我被圍在了此等愉快的伙伴們之中。,此刻的我被围在了此等愉快的伙伴们之中。,Sono circondata da amici così divertenti.
,"...The courage to accept a world of magic, a world of witches... ","......The courage to accept a world of magic, a world of witches...",[=ST],……魔法の世界、魔女の世界を受け容れる勇気。,[=JP],.....Смелость принять мир магии и мир ведьмы...,"......A coragem para aceitar o mundo da magia, o mundo das bruxas...",……去接受魔法的世界、魔女的世界的勇氣。,……去接受魔法的世界、魔女的世界的勇气。,"... Il coraggio di accettare un mondo magico, un mondo di streghe..."
,"...That alone didn't change the fact that I was still locked up in an academy, without a single friend in my class. ","...That alone wouldn't change the fact that I was locked up in an academy, without a single friend in my class.",[=ST],…それを持つだけで、私は相変わらず学園に閉じ込められていて、クラスにはたったひとりの友達もいないことに変わりはない。,[=JP],"Одно это не изменило факта, что я всё ещё была заточена в этой академии без единой подруги из своего класса.","...Apenas isso não muda o fato de que eu estava trancada dentro da academia, sem uma única amiga na minha classe.",…僅憑這勇氣，並不能改變我被關在學園裡，在班上連一個朋友都沒有的事實。,…仅凭这勇气，并不能改变我被关在学园里，在班上连一个朋友都没有的事实。,"... Questo non cambiava il fatto che fossi ancora bloccata in un'accademia, senza un solo amico nella mia classe."
,"But despite that, I'm able to have such a fun and lively time. ",But I was having such a fun and merry time regardless.,[=ST],にもかかわらず、こんなにも楽しく賑やかに過ごせている。,[=JP],"Но несмотря на это, я так весело и энергично провожу время.","Mas apesar de tudo, eu me divertia muito, sempre tão animado.",可儘管如此，現在的我卻在如此熱熱鬧鬧地開心度日。,可尽管如此，现在的我却在如此热热闹闹地开心度日。,"Ma nonostante ciò, riesco ad avere momenti così divertenti e vivaci."
,"......I'll also become a witch, like Maria onee-chan. ",.........I'll become a witch like Maria onee‐chan.,[=ST],………私も、真里亞お姉ちゃんのような、魔女になろう。,[=JP],".........Я тоже стану ведьмой, как Мария онее‐чан.",.........Eu irei me tornar uma bruxa como a Maria onee‐chan.,………我也想成為像真里亞姐姐那樣的魔女。,………我也想成为像真里亚姐姐那样的魔女。,"... Diventerò anch'io una strega, come Maria Onee-chan."
