,"I'm an idiot, so this is the only way I can live, but even so, ......I believe that one day, I'll definitely be able to teach Kanon‐kun about a new world!!","I'm an idiot, so this is the only way I can live, but even so, ...I'm sure I'll be able to teach Kanon-kun... about a new world someday!! ",[=ST],私は馬鹿だからこんな生き方しか出来ないけど、それでもきっと、嘉音くんの人生に、新しい世界を教えてあげるくらいのことはいつか出来ると、……信じてる！！,[=JP],"Я дура, поэтому могу жить только так, а не иначе, но всё равно... Я верю, что когда‐нибудь обязательно явлю Канону‐куну другой мир.","Eu sou idiota, por isso essa é a única forma que sei viver, mesmo assim, ......acredito que um dia, eu definitivamente serei capaz de ensinar ao Kanon‐kun sobre um novo mundo!!",[=UP],我因為笨，所以只會用這種活法活，但是，即便如此，給嘉音君的人生，帶去新世界的這點事，我相信……我總有一天一定能做到！！,我因为笨，所以只会用这种活法活，但是，即便如此，给嘉音君的人生，带去新世界的这点事，我相信……我总有一天一定能做到！！,[=UP],[=UP],[=UP]
,"So I'm not gonna buckle in a place like this...!!{n}I'll definitely defeat you, and save everyone!!",So I'm not gonna lose heart in a place like this...!! I'll definitely defeat you... and save everyone!! ,[=ST],だからこんなところで挫けない…！！絶対にお前を打ち倒しッ、みんなを救い出してみせる！！,だからこんなところで挫けない…！！{n}絶対にお前を打ち倒しッ、みんなを救い出してみせる！！,Поэтому я не собираюсь отчаиваться в таком месте!{n}Я обязательно одолею тебя и всех спасу!,Por isso eu não vou me deixar abater em um lugar como esse...!!{n}Eu definitivamente vou derrotar você e salvar todo mundo!!,[=UP],所以，我不會在這種地方受挫喪氣…！！{n}我絕對要打倒你，救出大家，給嘉音君看！！,所以，我不会在这种地方受挫丧气…！！{n}我绝对要打倒你，救出大家，给嘉音君看！！,[=UP],[=UP],[=UP]
Ushiromiya Krauss,"""Dammit!! If I could just...open a hole......aaaaaaaargghhh!!!""","""Damn!! Got to somehow...open a hole... Aaaaaaaaaaaaargghhh!!!"" ",[=ST],「くそッ！！何とか、隙間を……、うおおおおおぉおおおお！！」,「くそッ！！　何とか、隙間を……、うおおおおおぉおおおお！！」,"""Чё‐о‐орт! Ну хоть как‐то... раздвиньте прутья... а‐а‐а‐а‐а‐аргх!!!""","""Droga!! Se eu ao menos pudesse...abrir um buraco......aaaaaaaargghhh!!!""",[=UP],「可惡！！無論如何，都要把這空隙……，嗚哦哦哦哦哦哦哦哦哦哦！！」,「可恶！！无论如何，都要把这空隙……，呜哦哦哦哦哦哦哦哦哦哦！！」,[=UP],[=UP],[=UP]
,Krauss was repeating his useless effort in trying to somehow open a hole between the metal bars.,Krauss was repeating his useless effort to somehow open a hole between the metal bars. ,[=ST],蔵臼は、何とか鉄格子の間に隙間を開けようと、無駄な努力を繰り返している。,[=JP],Краусс продолжал напрасные попытки как‐нибудь расширить пространство между металлическими прутьями.,Krauss estava repetindo seus esforços inúteis para tentar abrir um espaço entre as grades de metal.,[=UP],藏臼在為了無論如何都要將鐵條間的空隙撐大，而反覆地付出著白費勁的努力。,藏臼在为了无论如何都要将铁条间的空隙撑大，而反复地付出着白费劲的努力。,[=UP],[=UP],[=UP]
,......Useless. .........There's nothing useless.{n}There's nothing...,...Useless. ......Nothing is useless. There's nothing... ,[=ST],……無駄。………無駄なことなどないんだ。　無駄なことなど。,……無駄。………無駄なことなどないんだ。{n}無駄なことなど。,......Бесполезно. ........Не существует ничего бесполезного.{n}Ничего...,......Inútil. .........Não existe nada inútil.{n}Não existe nada...,[=UP],……白費勁。………不存在白費勁。{n}沒有什麼是白費勁。,……白费劲。………不存在白费劲。{n}没有什么是白费劲。,[=UP],[=UP],[=UP]
,The lookout goats had been swallowed up by those black pits and disappeared.,The lookout goats had been swallowed up by those black pitfalls and disappeared. ,[=ST],見張りの山羊たちが、例の黒い落とし穴に飲み込まれて消えてしまった。,[=JP],"Козлоголовых стражей поглотили те иссиня‐чёрные дыры, и они исчезли.",As cabras que os vigiavam foram engolidas pelos alçapões negros e desapareceram.,[=UP],看守牢房的山羊們在剛才被那黑色的落穴吞噬，消失不見了。,看守牢房的山羊们在刚才被那黑色的落穴吞噬，消失不见了。,[=UP],[=UP],[=UP]
,......Now was their do‐or‐die chance.,...Now was their once-in-a-lifetime chance. ,[=ST],……今は千載一遇のチャンスなのだ。,[=JP],И теперь узникам выпал тот единственный в жизни шанс.,......Aquele era a única chance deles.,[=UP],……此刻，是千載難逢的機會。,……此刻，是千载难逢的机会。,[=UP],[=UP],[=UP]
,This was their only chance to break the bars......,This was their only chance to break the bars... ,[=ST],今だけが鉄格子を破るチャンス……。,[=JP],"Если они собирались ломать прутья, то сейчас или никогда.",Era a única oportunidade para quebrar a grade......,[=UP],斬斷鐵窗的機會，只在此刻……。,斩断铁窗的机会，只在此刻……。,[=UP],[=UP],[=UP]
Nanjo Terumasa,"""S‐stop it, it's impossible, Krauss‐san! We can't do anything about them with our bare hands! Let's look for a tool, don't waste time on the impossible...!""","""S-Stop it, it's impossible, Krauss-san! There's nothing we can do with our bare hands! Let's look for a tool, don't waste time on the impossible...!"" ",[=ST],「よ、よせ、無茶だ、蔵臼さん！　素手でどうにかなるもんじゃない！道具を探しましょう、無茶をするんじゃない…！」,「よ、よせ、無茶だ、蔵臼さん！　素手でどうにかなるもんじゃない！　道具を探しましょう、無茶をするんじゃない…！」,"""Н‐не надо, Краусс‐сан, это невозможно! Мы ничего не добьёмся голыми руками. Нам лучше поискать какой‐нибудь инструмент вместо напрасной траты сил!""","""P‐Pare, é impossível, Krauss‐san! Não podemos fazer nada quanto a isso de mãos vazias! Vamos procurar por alguma ferramenta, não perca seu tempo com o impossível...!""",[=UP],「好、好了，沒用的，藏臼！這不是空手就能解決的！去找找工具吧，別胡來…！」,「好、好了，没用的，藏臼！这不是空手就能解决的！去找找工具吧，别胡来…！」,[=UP],[=UP],[=UP]
Ushiromiya Krauss,"""If you give up saying it's useless, then it's all over...that's what my daughter said. ......Even if it's impossible for my body, as long as a small person like Shannon or Kanon could make it through......!!""","""If you give up because it's useless, then it's all over. That's what my daughter said. ...Even if my body won't fit, as long as a small person like Shannon or Kanon can make it through...!!"" ",[=ST],「無駄と諦めたらそれまでと、娘に言われてしまった。……私の体は無理でも、小柄な紗音か嘉音が抜けられれば……！！」,[=JP],"""Если опускать руки, поскольку считаешь что‐то напрасным, то тогда конец всему... Вот что сказала моя дочь. ......Даже если моему телу не под силу преодолеть эту решётку, то если удастся протиснуться кому‐нибудь с более скромным телосложением, вроде Шаннон или Канона!..""","""Se você desistir dizendo que é inútil, então está tudo acabado...foi o que a minha filha disse. ......Mesmo que seja impossível para o meu corpo passar, uma pessoa pequena como a Shannon ou o Kanon conseguira......!!""",[=UP],「我女兒說了，覺得白費勁而放棄，那就到此結束了。……雖然我的個子沒戲，但只要能讓小個子的嘉音紗音鑽出去……！！」,「我女儿说了，觉得白费劲而放弃，那就到此结束了。……虽然我的个子没戏，但只要能让小个子的嘉音纱音钻出去……！！」,[=UP],[=UP],[=UP]
Ushiromiya Kyrie,"""......At this stage, action is more important than racking our brains. Let's put our strength together, I'll join in too...! ......Kanon‐kun, you're a boy, lend a hand...! ......Kanon‐kun?!""","""...Now that we've reached this point, action is more important than racking our brains. Let's work together, I'll do it too...! ...Kanon-kun, you're a boy, aren't you? Lend a hand...! ...Kanon-kun?!"" ",[=ST],「……この段階に至っては、出ない知恵を絞るより行動あるのみね。力を合わせましょ、私もやるわ…！　……嘉音くん、男の子でしょ、手を貸して…！……嘉音くん？！」,「……この段階に至っては、出ない知恵を絞るより行動あるのみね。力を合わせましょ、私もやるわ…！　……嘉音くん、男の子でしょ、手を貸して…！　……嘉音くん？！」,"""......Как говорится, раз пошла такая пьянка, то сейчас важнее действовать, а не шевелить мозгами. Поэтому давайте действовать сообща, я тоже помогу! .....Канон‐кун, ты юноша, подсоби‐ка! .....Канон‐кун?!""","""......A essa altura, agir é mais importante do que perdermos tempo pensando. Vamos juntar nossas forças...! ......Kanon‐kun, você é homem, me ajude...! ......Kanon‐kun?!""",[=UP],「……事情發展到這個地步，比起絞盡腦汁，還是行動第一哦。大家齊心協力吧，我也來幫忙…！……嘉音君，你是男孩子吧，來幫下手…！……嘉音君？！」,「……事情发展到这个地步，比起绞尽脑汁，还是行动第一哦。大家齐心协力吧，我也来帮忙…！……嘉音君，你是男孩子吧，来帮下手…！……嘉音君？！」,[=UP],[=UP],[=UP]
Kanon,"""............Krauss‐sama. Please stand back.""","""......Krauss-sama, please stand back."" ",[=ST],「…………旦那様。下がってください。」,「…………旦那様。下がってください」,"""..........Краусс‐сама. Пожалуйста, отойдите.""","""............Patrão. Por favor, afaste‐se.""",[=UP],「…………主人。請退後。」,「…………主人。请退后。」,[=UP],[=UP],[=UP]
Ushiromiya Krauss,"""What? What are you thinking of......?""","""What? What are you planning...?"" ",[=ST],「何？　何をする気だ……？」,[=JP],"""Что? Что ты задумал?""","""O quê? O que você está pensando em fazer......?""",[=UP],「怎麼？你想幹嘛……？」,「怎么？你想干嘛……？」,[=UP],[=UP],[=UP]
Kanon,"""......It's alright, isn't it, Nee‐san? .........If we try struggling...just one more time.""","""...Okay, Nee-san? ......Just one more time, let's try struggling."" ",[=ST],「……いいよね、姉さん。………もう一度だけ、足掻いても。」,「……いいよね、姉さん。………もう一度だけ、足掻いても」,"""......Ну что, нее‐сан? ..........Повоюем‐ка ещё раз.""","""......Está tudo bem, não está, nee‐san? .........Se tentarmos lutar...só mais uma vez.""",[=UP],「……可以吧，姐姐？………再去，掙扎個一次。」,「……可以吧，姐姐？………再去，挣扎个一次。」,[=UP],[=UP],[=UP]
Shannon,"""............Yeah. ......I'll...struggle once more as well. ......No, not once. ...Over and over again.""","""......Yes. ...I too...will struggle one more time. ...No, not just one more time. ...Over and over again."" ",[=ST],「…………うん。……私も、…もう一度だけ足掻くよ。……ううん、一度だけじゃない。…何度でも。」,「…………うん。……私も、…もう一度だけ足掻くよ。……ううん、一度だけじゃない。…何度でも」,"""..........Да. .....Я тоже... поборюсь ещё раз. ......Нет, не просто ещё раз. А ещё, ещё и ещё.""","""............Sim. ......Eu irei...lutar mais uma vez também. ......Não, não só uma. ...Quantas vezes for preciso.""",[=UP],「…………嗯。……我也、…再掙扎個一次。……不，不是一次。…而是，不管幾次。」,「…………嗯。……我也、…再挣扎个一次。……不，不是一次。…而是，不管几次。」,[=UP],[=UP],[=UP]
,Jessica's voice had reached Kanon.{n}It had certainly permeated into his stone‐cold heart.,"Jessica's voice had reached Kanon. It certainly had permeated into his cold, rock-like heart. ",[=ST],朱志香の声は、嘉音に届いた。冷たい岩のような彼の心に、確かに浸透したのだ。,朱志香の声は、嘉音に届いた。{n}冷たい岩のような彼の心に、確かに浸透したのだ。,"Слова Джессики достигли Канона.{n}Они проникли в его холодное, каменистое сердце.",A voz de Jessica alcançou Kanon.{n}Ela certamente havia permeado em seu frio coração de pedra.,[=UP],朱志香的聲音，傳到了嘉音的心裡。{n}的的確確地滲透進了，冰冷得猶如岩石的他的心。,朱志香的声音，传到了嘉音的心里。{n}的的确确地渗透进了，冰冷得犹如岩石的他的心。,[=UP],[=UP],[=UP]
,"And George's voice had reached Shannon. If the love he had shown was embodied by strength, she would have to respond in the same way.","And George's voice had reached Shannon. If the love he had shown was embodied by strength, she would have to respond in the same way. ",[=ST],そして譲治の声も、紗音に届いた。彼が示す愛が強さで体現されるなら、自分も同じ形で応えなければならない。,[=JP],"А слова Джорджа достигли Шаннон. Если проявленная им любовь заключала в себе силу, то ей следовало ответить таким же образом.","E a voz de George havia alcançado Shannon. Se o amor que ele demonstrou foi encarnado pela força, ela precisaria responder da mesma forma.",[=UP],而讓治的聲音，也傳到了紗音的心裡。既然他所示的愛是以堅強來體現的，那自己也必須以同樣的形式做出回應。,而让治的声音，也传到了纱音的心里。既然他所示的爱是以坚强来体现的，那自己也必须以同样的形式做出回应。,[=UP],[=UP],[=UP]
,An incredible metallic sound rang out.,An incredible metal sound rang out. ,[=ST],ものすごい金属音が鳴り響いた。,[=JP],И тут раздался непередаваемый металлический звон.,Um incrível som metálico ecoou.,[=UP],駭人的金屬聲響徹牢房。,骇人的金属声响彻牢房。,[=UP],[=UP],[=UP]
,".........The first flash cut horizontally through several of the metal bars, and with the next flash, they were cut through horizontally again, causing them to clatter to the ground like bamboo shoots cut by a sword.","......In the first flash, several metal bars were severed horizontally, and in the next flash, they were severed horizontally again, causing many metal bars to clatter to the ground like bamboo shoots cut by a sword. ",[=ST],………最初の一閃は鉄格子数本を横一文字に切断し、次の一閃でさらに横一文字に切断され、鉄格子数本が刀で切られた竹の子のようにばたばたと倒れる。,[=JP],"........Первая вспышка — и несколько металлических прутьев разрезаны по горизонтали. Ещё одна вспышка — и ещё один горизонтальный разрез, множество металлических прутьев, словно срубленные мечом бамбуковые стебли, с лязганьем падают на пол.",".........O primeiro flash cortou horizontalmente várias barras de metal, e no flash seguinte, elas foram cortadas horizontalmente mais uma vez, fazendo‐as cair no chão como brotos de bambu sendo cortados por uma espada.",[=UP],………最初的一閃以橫著的“一”字斬斷了數根鐵條，下一閃則以橫著的“一”字斬斷了另一端，數根鐵條如被刀砍下的竹子般“啪嘡啪嘡”地倒到地上。,………最初的一闪以横着的“一”字斩断了数根铁条，下一闪则以横着的“一”字斩断了另一端，数根铁条如被刀砍下的竹子般“啪嘡啪嘡”地倒到地上。,[=UP],[=UP],[=UP]
,"Krauss, Kyrie, and Nanjo didn't even have a clue about what had just happened......","Krauss, Kyrie, and Nanjo didn't even have a clue what had just happened... ",[=ST],蔵臼も霧江も南條も、一体何が起こったのか、さっぱりわからない……。,[=JP],"Краусс, Кирие и Нанджо не понимали, что только что произошло.","Krauss, Kyrie e Nanjo sequer faziam ideia do que havia acabado de acontecer......",[=UP],藏臼、霧江、南條都完全不明白，到底發生了什麼……。,藏臼、雾江、南条都完全不明白，到底发生了什么……。,[=UP],[=UP],[=UP]
Kanon,"""......Doctor Nanjo. Which way down the corridor goes to the mansion......?""","""...Doctor Nanjo, which way down the corridor goes to the mansion...?"" ",[=ST],「……南條先生。お屋敷へは廊下をどっちに……？」,[=JP],"""....Доктор Нанджо. Как нам попасть в особняк?""","""......Doutor Nanjo. Qual dos corredores leva para a mansão......?""",[=UP],「……南條大夫。通往大屋的走廊在哪……？」,「……南条大夫。通往大屋的走廊在哪……？」,[=UP],[=UP],[=UP]
Nanjo Terumasa,"""Y‐.........yes! It's to the left at the back...to the left at the back......!""","""......O-Oh, of course! In and to the left, ...in and to the left...!"" ",[=ST],「あ、………あぁ！　左奥だ…、左奥……！」,[=JP],"""Д‐да! В коридор и налево... налево!""","""C‐.........Certo! No final do da esquerda...o final do da esquerda......!""",[=UP],「啊、………啊——！左邊最深處…、左邊最深處……！」,「啊、………啊——！左边最深处…、左边最深处……！」,[=UP],[=UP],[=UP]
Shannon,"""Let's go, everyone. ......We'll be noticed by {f:5:Virgilia}‐sama any time now.""","""Let's go, Krauss-sama. ...{f:5:Virgilia}-sama will notice us at any moment now."" ",[=ST],「参りましょう、旦那様方。……すぐにワルギリアさまに気付かれます。」,「参りましょう、旦那様方。……すぐにワルギリアさまに気付かれます」,"""Идёмте, Краусс‐сама. ......{f:5:Вергилия}‐сама вот‐вот заметит нас.""","""Vamos, pessoal. ......Nós seremos percebidos pela {f:5:Virgilia}‐sama a qualquer momento.""",[=UP],「快走吧，主人。……馬上就會被瓦爾基莉亞夫人察覺的。」,「快走吧，主人。……马上就会被瓦尔基莉亚夫人察觉的。」,[=UP],[=UP],[=UP]
Ushiromiya Kyrie,"""You two.........what in the world {i:are} you......?""","""What in the world... ...are you guys...?"" ",[=ST],「あんたたちは、………一体何なの……。」,「あんたたちは、………一体何なの……」,"""Вы... да кто же вы такие?..""","""Vocês dois.........o que {i:são} vocês......?""",[=UP],「你們，………究竟是什麼……？」,「你们，………究竟是什么……？」,[=UP],[=UP],[=UP]
Kanon,"""............We're......""","""......We are..."" ",[=ST],「…………僕たちは……。」,「…………僕たちは……」,""".........Мы...""","""............Nós somos......""",[=UP],「…………我們……」,「…………我们……」,[=UP],[=UP],[=UP]
,"When Kanon hung his head a little and faltered, Shannon slapped his shoulder, smiled, and spoke.","When Kanon hung his head a little and faltered, Shannon slapped his shoulder, smiled, and spoke. ",[=ST],嘉音が少し俯き口ごもると、紗音がその肩を叩き、にっこり笑い、そして言った。,[=JP],"Канон повесил голову и заколебался, но Шаннон хлопнула его по плечу, широко улыбнулась и ответила.","Quando Kanon inclinou sua cabeça para baixo e vacilou, Shannon bateu em seu ombro, sorrindo, e falou.",[=UP],嘉音稍稍垂下了頭，講不出話來，紗音拍了拍他的肩膀，莞爾一笑，然後說道。,嘉音稍稍垂下了头，讲不出话来，纱音拍了拍他的肩膀，莞尔一笑，然后说道。,[=UP],[=UP],[=UP]
Shannon,"""We are {y:0:Human}{n:0:human}.""","""We're Human."" ",[=ST],「私たちは、ニンゲンです。」,「私たちは、ニンゲンです」,"""Мы {y:0:Люд}{n:0:люд}и.""","""Nós somos {y:0:Humanos}{n:0:humanos}.""",[=UP],「我們，是人類。」,「我们，是人类。」,[=UP],[=UP],[=UP]
Chiester45,"""V‐{f:5:Virgilia}‐sama!! Response from warning network, jailbreak! The goat guards aren't there for some reason...!!""","""V-{f:5:Virgilia}-sama!! Response from the lookout web, it's a jailbreak! The goat guards aren't there for some reason...!!"" ",[=ST],「ワ、ワルギリアさまぁ！！　警戒網に反応ッ、脱獄です！　なぜか見張りの山羊がいません…！！」,[=JP],"""В‐{f:5:Вергилия}‐сама! Сигнал от наблюдательной паутины! Побег из заточения! Стражников‐козлоголовых почему‐то нет на месте!""","""V‐{f:5:Virgilia}‐sama!! Resposta vinda da rede de vigilância, é uma fuga! As cabras que ficaram de guarda não estão lá por algum motivo...!!""",[=UP],「瓦、瓦爾基莉亞夫人！！警戒網有反應，是越獄！不知怎麼搞的，在看守的山羊不見了…！！」,「瓦、瓦尔基莉亚夫人！！警戒网有反应，是越狱！不知怎么搞的，在看守的山羊不见了…！！」,[=UP],[=UP],[=UP]
{f:5:Virgilia},"""......Whaaat?! Why?! ...............It's Gaap, isn't it. Taking my summons without asking!! ......Gap! Gapgap!!""","""...Whaaat?! Why?! ......It's Gaap, isn't it? Taking someone else's summonings without asking!! ...Gap! Gapgap!! ",[=ST],「……えぇ？！　どうしてです？！……………ガァプですね。人の召喚物を勝手にィ！！　……ガプ！ガプガプ！！」,「……えぇ？！　どうしてです？！　……………ガァプですね。人の召喚物を勝手にィ！！　……ガプ！　ガプガプ！！」,"""....Что‐о?! Чего?! .......Это дело рук Гаап, не так ли. Без спросу забирать чужих призванных! .....Гап! Гапгап!""","""......O quêêê?! Por quê?! ...............Foi a Gaap, não foi? Tomando minhas invocações sem permissão!! ......Gap! Gapgap!!""",[=UP],「……哎——？！怎麼會？！……………是噶普呢。擅自把別人的召喚物！！……噶普！噶普噶普！！」,「……哎——？！怎么会？！……………是噶普呢。擅自把别人的召唤物！！……噶普！噶普噶普！！」,[=UP],[=UP],[=UP]
Chiester00,"""......Confirming Rules of Engagement. Request permission to fire at the escapees, ma'am.""","""...Confirming Battle Regulations. Requesting permission to fire at the escapees."" ",[=ST],「……交戦規定確認。脱走者への射殺許可を申請であります。」,「……交戦規定確認。脱走者への射殺許可を申請であります」,""".....Подтверждаю боевые указания. Запрашиваю разрешение на ведение огня по беглецам.""","""......Confirmando Regras de Engajamento. Requirindo permissão para atirar nos fugitivos, senhora.""",[=UP],「……確認交戰規定。我向您申請射殺脫逃者的許可。」,「……确认交战规定。我向您申请射杀脱逃者的许可。」,[=UP],[=UP],[=UP]
