,"Then, with a matched timing that only the men confronting each other could comprehend, ......the two leapt forward like bullets shot out of a gun.","Then, with a matched timing that only the men confronting each other could comprehend, ...the two leapt forward like bullets shot out of a gun. ",[=ST],そして、対峙した男たちにしか分かり合えぬタイミングの一致を見て、……二人は撃ち出された砲弾のように飛び出す。,[=JP],"А затем, как по команде, в миг, который могут понять мужчины, противостоящие друг другу, они прыгнули вперёд словно пули, пущенные из пистолетов.","Então, com um tempo combinado que só dois homens se confrontando poderiam compreender, ......os dois saltaram para frente como balas disparadas de uma arma.",[=UP],然後，兩人以只有對峙著的男人們能互相領會的一致時機，……如射出的砲彈般地衝了出去。,然后，两人以只有对峙着的男人们能互相领会的一致时机，……如射出的炮弹般地冲了出去。,[=UP],[=UP],[=UP]
,"The men howled, collecting the strength from all over their bodies into one arm each.","The men howled, collecting the strength from all over their bodies into one arm each. ",[=ST],男たちの咆哮、全身の肉体の力がそれぞれの腕一本に集約される。,[=JP],"Оба взвыли, сосредотачивая в руке силу со всего тела.","O homem rugiu, acumulando a força de todo seu corpo em um único braço.",[=UP],男人們的咆哮，全身肉體的力量匯聚在了各自的那一條臂膀之上。,男人们的咆哮，全身肉体的力量汇聚在了各自的那一条臂膀之上。,[=UP],[=UP],[=UP]
,The goat's fiery glowing eyes clearly locked onto Krauss's face.,The goat's fiery glowing eyes clearly locked onto Krauss's face. ,[=ST],山羊の爛々と光る瞳には、はっきりと蔵臼の顔面が捉えられている。,[=JP],Горящие глаза козлоголового чётко сосредоточились на лице Краусса.,Os impetuosos olhos brilhantes da cabra focaram‐se no rosto de Krauss.,[=UP],山羊爍爍發光的瞳孔中，清晰捕捉住了藏臼的面門。,山羊烁烁发光的瞳孔中，清晰捕捉住了藏臼的面门。,[=UP],[=UP],[=UP]
,"......He could perfectly see a vision of when he would step forwards, when he would punch through Krauss and blow him away, and when he would achieve his total victory.","...He could perfectly see a vision of when he would step forwards, when he would punch through Krauss and blow him away, and when he would win perfectly. ",[=ST],……どのタイミングまで踏み込み、どのタイミングで殴り抜き、吹き飛ばし、完全に勝利するか、そのビジョンが完全に見えていた。,[=JP],"Он ясно представлял себе, как делает шаг вперёд, ударяет Краусса, сносит того и одерживает абсолютную победу.","......Ela podia ver perfeitamente uma cena enquanto corria em frente, quando iria socar Krauss e mandá‐lo voando para longe, e quando iria alcançar sua vitória completa.",[=UP],……完整地看到了，會在哪一刻踏到對方面前，會在哪一刻揮拳將其揍飛，大獲全勝的，未來線。,……完整地看到了，会在哪一刻踏到对方面前，会在哪一刻挥拳将其揍飞，大获全胜的，未来线。,[=UP],[=UP],[=UP]
,"The long, painful days before today drifted through the goat's mind......","The long, painful days up to that point drifted through the goat's mind... ",[=ST],山羊の脳裏に、今日までの辛く長かった日々が蘇る……。,[=JP],"Длинные, тяжёлые дни, минувшие до этого момента, пронеслись в его памяти...",Os longos e dolorosos dias anteriores a hoje começaram a passar pela cabeça da cabra......,[=UP],山羊的腦中，浮現出了今日前那辛酸漫長的歲月……。,山羊的脑中，浮现出了今日前那辛酸漫长的岁月……。,[=UP],[=UP],[=UP]
,The hard days of training where his senpais had picked on him...,Those painful days of training when his senpais had picked on him... ,[=ST],先輩たちにいびられながらの鍛錬の辛い日々…。,[=JP],"Эти болезненные дни тренировок, когда сенпаи обижали его...",Os duros dias de treinamento onde seus senpais a escolheram...,[=UP],受著前輩們嚴苛虐待，吃盡苦頭的練功日子…。,受着前辈们严苛虐待，吃尽苦头的练功日子…。,[=UP],[=UP],[=UP]
,The faint glimpses of his senpais' warm concern during those days.,Those faint glimpses of the warm concern his senpais felt for him. ,[=ST],そんな日々に、わずかに垣間見えた先輩たちの温かな気遣い。,[=JP],Слабые ощущения тёплой заботы от других сенпаев в те дни.,Fracos vislumbres de seus senpais calorosamente preocupados durante aqueles dias.,[=UP],在那段日子裡，微微窺視到的前輩們的溫暖的關懷。,在那段日子里，微微窥视到的前辈们的温暖的关怀。,[=UP],[=UP],[=UP]
,"And the joy of that day his power had been acknowledged, and he had been accepted as one of the team...!","And the joy of that day his power had been acknowledged, when he had been accepted as one of the comrades...! ",[=ST],そして初めて実力を認められ、仲間として認めてもらえた日の喜び…！,[=JP],"И радость того дня, когда его силу наконец‐то признали, а его самого приняли как одного из товарищей!","E a alegria do dia em que seu poder foi reconhecido, e ela foi aceita como parte do time...!",[=UP],以及，被初次認可實力，被承認為大家之中一員的那一天的喜悅…！,以及，被初次认可实力，被承认为大家之中一员的那一天的喜悦…！,[=UP],[=UP],[=UP]
,I never properly respected my parents.,I never showed proper respect to my parents. ,[=ST],ずっと親不孝だった。,[=JP],Я так и не отдал должного уважения своим родителям.,Eu nunca respeitei direito meus pais.,[=UP],我一直都很不孝。,[=CHT],[=UP],[=UP],[=UP]
,"......That's right, I'd actually planned on washing my hands of this business when this job was over, and returning to my hometown.","...That's right, didn't I plan to wash my hands of this business when this job was over...and return to my hometown? ",[=ST],……そうさ、実は俺、今回の仕事を終えたら足を洗って、故郷に帰るつもりだったんだ。,[=JP],"......И верно, я ведь собирался бросить это дело, когда завершится эта работа, и вернуться в свой родной город.","......Isso mesmo, eu planejo lavar minhas mãos e largar tudo quando esse trabalho acabar, e então retornar para minha casa.",[=UP],……對，其實我打算在完成這次的工作後，就金盆洗手，回到故鄉。,……对，其实我打算在完成这次的工作后，就金盆洗手，回到故乡。,[=UP],[=UP],[=UP]
,"Sorry, my little goat sister...your onii‐chan caused you nothing but trouble.","I'm sorry, little goat sister... Your Onii-chan always caused you so much trouble. ",[=ST],ごめんな、妹の山羊子、お兄ちゃん、迷惑ばかりかけてたな。,[=JP],"Простите, моя козлоголовая сестрица, онии‐чан... Я был только обузой.","Desculpe, minhas pequeninas irmãs cabrinhas...seu onii‐chan não causou nada além de problemas.",[=UP],對不起，妹妹山羊子，哥哥盡是給你添麻煩。,对不起，妹妹山羊子，哥哥尽是给你添麻烦。,[=UP],[=UP],[=UP]
,"And I, ...a‐actually have a childhood friend, and I'm going to marry her when I get hoooooome!!!","And I...a-actually have a childhood friend, ...and I'm gonna marry her when I got hooooome!!! ",[=ST],それに俺、…じ、実は幼馴染がいて、帰ったら結婚することになってるっすーーー！！！,[=JP],"И у меня... У меня даже была подруга детства, и я собирался жениться на ней по возвращении домо‐ой!!!","E eu, ...n‐na verdade eu tenho uma amiga de infância, e vou me casar com ela quando voltar para casaaaaa!!!",[=UP],而且我，…其、其實還有個青梅竹馬，說好了回去後就結婚———！！！,而且我，…其、其实还有个青梅竹马，说好了回去后就结婚———！！！,[=UP],[=UP],[=UP]
{f:5:Virgilia},"""Gyaaaaaaaaahh!!! Nooooooooooo!! Don't trip so many {c:86EF9C:loser flaaaaaa{-}a{-}a{-}a{-}aags}!!""","""Gyaaaaaaaaahh!!! Nooooooooooo!! Stop tripping all those loser flaaaaaaaaaaags!! ",[=ST],「ぎゃーーーッ！！！　ダメぇえええぇえ！！　負けフラグ立て過ぎちゃらめええぇええええぇえ！！,「ぎゃーーーッ！！！　ダメぇえええぇえ！！　負けフラグ立て過ぎちゃらめええぇええええぇえ！！」,"""Гья‐а‐а‐а‐а‐а‐а!!! Не‐е‐е‐е‐ет! Не поднимай так много {c:86EF9C:флажков неудачника‐а‐а}!!!""","""Gyaaaaaaaaahh!!! Nãoooooooooo!! Não caia em tantas {c:86EF9C:loser flaaaaaa{‐}a{‐}a{‐}a{‐}aags}!!""",[=UP],「噶呀———！！！不要啊——————！！敗兆立得太多了啊—————————！！」,「噶呀———！！！不要啊——————！！败兆立得太多了啊—————————！！」,[=UP],[=UP],[=UP]
{f:5:Virgilia},"""You can't handle that punch, dodge iiiiiiiiiit!!""","You can't handle that punch, dodge iiiiiiiiiit!!"" ",[=ST],そのパンチは駄目よ、避けてえええぇええ！！」,「そのパンチは駄目よ、避けてえええぇええ！！」,"""Ты не выдержишь того удара, уклоня‐а‐айся!!!""","""Você não pode com aquele soco, desvieeeeee!!""",[=UP],「不可以受那一拳，快躲開——————！！」,「不可以受那一拳，快躲开——————！！」,[=UP],[=UP],[=UP]
,It happened the instant before the two crashed and their punches crossed.,It happened the instant before the two crashed and their punches crossed. ,[=ST],それはまさに二人が激突し、互いのパンチが交差する直前の瞬間だった。,[=JP],"Всё случилось в один миг прямо перед тем, как поединщики сшиблись, а их наносящие удар руки пересеклись.",Aconteceu instantes antes dos dois colidirem e seus socos se cruzarem.,[=UP],這正發生在那，兩人即將撞上，雙拳即將交錯的那一瞬間。,这正发生在那，两人即将撞上，双拳即将交错的那一瞬间。,[=UP],[=UP],[=UP]
Ushiromiya Kyrie,"""Foolish, {f:5:Virgilia}. It looks like you couldn't make a composed decision.""","""You fool, {f:5:Virgilia}. Looks like you failed to make a calm and rational decision."" ",[=ST],「愚かね、ワルギリア。冷静な判断を欠いたようよ。」,「愚かね、ワルギリア。冷静な判断を欠いたようよ」,"""Ты дура, {f:5:Вергилия}. Похоже, ты не смогла принять взвешенное решение.""","""Você é tola, {f:5:Virgilia}. Parece que não é capaz de tomar uma decisão serena.""",[=UP],「愚蠢，瓦爾基莉亞。看來，你欠缺了冷靜的判斷哦。」,「愚蠢，瓦尔基莉亚。看来，你欠缺了冷静的判断哦。」,[=UP],[=UP],[=UP]
{f:5:Virgilia},"""You must not take that punch!! Deflect it!!""","""You mustn't take that punch!! Knock it aside!!"" ",[=ST],「そのパンチを受けてはなりませんッ！！　弾きなさい！！」,[=JP],"""Ты не должен принимать этот удар! Отрази его!""","""Você não deve levar este soco!! Repila ele!!""",[=UP],「不可受下那一拳！！擋開它！！」,「不可受下那一拳！！挡开它！！」,[=UP],[=UP],[=UP]
The Goat Butler,"""?!?!""","""?!?!"" ",[=ST],「ッ？！？！」,[=JP],[=UP],[=UP],[=UP],「？！？！」,[=CHT],[=UP],[=UP],[=UP]
,"The very instant the goat's left straight and Krauss's right straight crossed! The goat obeyed {f:5:Virgilia}'s order with super‐fast reflexes and pulled back his straight, deflecting Krauss's punch!","The very instant the goat's left straight and Krauss's right straight crossed...! The goat obeyed {f:5:Virgilia}'s order with super-fast reflexes and pulled his straight back, repelling Krauss's punch! ",[=ST],山羊の左ストレートと蔵臼の右ストレートが交差するその瞬間！　山羊は超反射神経でワルギリアの命令に従い、ストレートを引き戻して蔵臼のパンチを弾く！,[=JP],"За миг до того, как прямой левой козлоголового и прямой правой Краусса пересеклись! Козлоголовый подчинился приказу {f:5:Вергилии} со сверх‐быстрой реакцией и отдёрнул свой прямой удар назад, отбив удар Краусса!","No exato instante em que o direto de esquerda da cabra e o direto de direita de Krauss se cruzaram! A cabra obedeceu as ordens de {f:5:Virgilia} com reflexos super‐rápidos e reteve seu braço, repelindo o soco de Krauss!",[=UP],在山羊的左直拳與藏臼的右直拳交錯的那一瞬間！山羊以超反射神經服從了瓦爾基莉亞的命令，縮回直拳，擋開了藏臼的拳頭！,在山羊的左直拳与藏臼的右直拳交错的那一瞬间！山羊以超反射神经服从了瓦尔基莉亚的命令，缩回直拳，挡开了藏臼的拳头！,[=UP],[=UP],[=UP]
Ushiromiya Krauss,""".........mmgh—""","""......Nng-"" ",[=ST],「………むッ、」,[=JP],""".........У...""",[=UP],[=UP],「………姆，」,[=CHT],[=UP],[=UP],[=UP]
,"Yes, {f:5:Virgilia}'s decision was probably wise.{n}After all, the number of loser flags act as a multiplier on the opponent's power level!","That's right, {f:5:Virgilia}'s decision probably had been wise. After all, the number of loser flags amplifies the power level of one's opponent! ",[=ST],そう、ワルギリアの判断は賢明だっただろう。何しろ負けフラグの数は、相手の戦闘力にそのまま倍率となって掛かる！,そう、ワルギリアの判断は賢明だっただろう。{n}何しろ負けフラグの数は、相手の戦闘力にそのまま倍率となって掛かる！,"Да, {f:5:Вергилия} всё‐таки приняла мудрое решение.{n}Ведь количество провальных флажков увеличивают силу противника!","Sim, a decisão de {f:5:Virgilia} provavelmente havia sido sábia.{n}Afinal, o número de {i:loser flags} atua como um multiplicador no poder de luta do oponente!",[=UP],對，瓦爾基莉亞的判斷可謂明智吧。{n}畢竟敗兆的數量，會直接化為倍率，乘算對手的戰鬥力！,对，瓦尔基莉亚的判断可谓明智吧。{n}毕竟败兆的数量，会直接化为倍率，乘算对手的战斗力！,[=UP],[=UP],[=UP]
{f:5:Virgilia},"""That was close. If you had taken that punch after tripping so many loser flags, imagine just how great a force it would have been multiplied to...!!""","""That was close, if you had taken that punch after tripping so many loser flags, imagine just how great a force it would have been amplified to...!!"" ",[=ST],「危ないところでした、こんな負けフラグ立てまくりの状態で食らっていたら、どれほどの威力に倍率が掛かっていたことか…！！,「危ないところでした、こんな負けフラグ立てまくりの状態で食らっていたら、どれほどの威力に倍率が掛かっていたことか…！！」,"""Вот пронесло. Схлопочи ты такой удар после поднятия стольких провальных флажков, страшно себе представить, насколько мощным он бы оказался!""","""Foi por pouco. Se você tivesse levado aquele soco depois de cair em tantas {i:loser flags}, imagine quanta força teria se multiplicado...!!""",[=UP],「好險，要是在立下這麼多敗兆的狀態下吃下那一拳，那就不知道會乘上多少倍的威力了…！！」,「好险，要是在立下这么多败兆的状态下吃下那一拳，那就不知道会乘上多少倍的威力了…！！」,[=UP],[=UP],[=UP]
{f:5:Virgilia},"""Come on, from there, smash the completely open right side of his face with a right straight!!""","""Come on, from there, smash the completely open right side of his face with a right straight!! ",[=ST],さぁ、そこでがら空きの右側面に右ストレートを叩き込んでやりなさい！！,「さぁ、そこでがら空きの右側面に右ストレートを叩き込んでやりなさい！！」,"""Давай, теперь размозжи совершенно открытую правую сторону его лица прямым правой!""","""Vamos, daqui, esmague completamente o lado direito do rosto dele com um direto de direita!!""",[=UP],「來，接著就對他門戶大開的右側，來一右直拳！！」,「来，接着就对他门户大开的右侧，来一右直拳！！」,[=UP],[=UP],[=UP]
{f:5:Virgilia},"""What? The promise about fighting with only your left arm?""",What? That promise about fighting with only your left arm? ,[=ST],何？　左腕一本で戦う約束？,「何？　左腕一本で戦う約束？」,"""Чего? Обещание драться лишь левой рукой?""","""O quê? E a promessa de só lutar com o braço esquerdo?""",[=UP],「什麼？說好只用一只左手戰鬥？」,「什么？说好只用一只左手战斗？」,[=UP],[=UP],[=UP]
{f:5:Virgilia},"""Hoh‐hoh‐ho!! Promises are made to be brokennnnn!!""",Hohohoh!! Aren't promises made to be broken?!! ,[=ST],ほっほっほ！！　約束は破るためにあるのでしょうがー！！,「ほっほっほ！！　約束は破るためにあるのでしょうがー！！」,"""Хо‐хо‐хо! Так разве обещания не даются, чтобы их нарушать?!!""","""Hoh‐hoh‐ho!! Promessas são feitas para serem quebradaaasssss!!""",[=UP],「嚯嚯嚯！！約定就是為了打破而存在的吧——？！！」,「嚯嚯嚯！！约定就是为了打破而存在的吧——？！！」,[=UP],[=UP],[=UP]
{f:5:Virgilia},"""Gyaah, tripped another ooooooone!!""","Gyaah, tripped another ooooooone!!"" ",[=ST],ぎゃー、また立ったあああぁ！！」,「ぎゃー、また立ったあああぁ！！」,"""Гья‐а, подняла очередной!""","""Gyaah, tropeçou em mais umaaaaa!!""",[=UP],「噶呀——，又立了————！！」,[=CHT],[=UP],[=UP],[=UP]
Ushiromiya Kyrie,"""I'm disappointed, {f:5:Virgilia}. You really were lacking composure.""","""I'm disappointed, {f:5:Virgilia}. You really have lost your composure."" ",[=ST],「失望よ、ワルギリア。あなたはやはり冷静を欠いていたわ。」,「失望よ、ワルギリア。あなたはやはり冷静を欠いていたわ」,"""Я разочарована, {f:5:Вергилия}. Ты и впрямь потеряла хладнокровие.""","""Estou desapontada, {f:5:Virgilia}. De fato, falta serenidade em você.""",[=UP],「失望啊，瓦爾基莉亞。你果然是欠缺了冷靜。」,「失望啊，瓦尔基莉亚。你果然是欠缺了冷静。」,[=UP],[=UP],[=UP]
{f:5:Virgilia},"""What's that......?! How was I not composed by noticing it beforehand and making him avoid it...?!""","""What's that...?! How was I not composed by noticing it beforehand and making him avoid it...?!"" ",[=ST],「何ですって……？！　直前に気付いて避けさせた私のどこが冷静でないと…！」,[=JP],"""Как же так?! Почему это я оказалась несобранной, заметив такой удар заранее и вынудив его уклониться от него?!""","""O que disse......?! Como eu posso não ter serenidade se notei de antemão e fui capaz de desviar...?!""",[=UP],「你說什麼……？！在此前察覺到，命令其避開的我，又是哪兒不冷靜了…？！」,「你说什么……？！在此前察觉到，命令其避开的我，又是哪儿不冷静了…？！」,[=UP],[=UP],[=UP]
Shannon,"""Wh‐...why is that, Kyrie‐sama...? If they had crashed like that, wouldn't Krauss‐sama have won......?""","""Wh-Why is that, Kyrie-sama...? If they had crashed like that, wouldn't it have been Krauss's..."" ",[=ST],「ど、…どうしてですか霧江さま…？　あのまま激突していたら、旦那様の勝ちだったのでは……。」,「ど、…どうしてですか霧江さま…？　あのまま激突していたら、旦那様の勝ちだったのでは……」,"""П‐почему так, Кирие‐сама? Сшибись они вот так, разве Краусс‐сама не...""","""O‐...O que foi isso, Kyrie‐sama...? Se eles tivessem colidido daquela forma, o patrão teria vencido......?""",[=UP],「怎、…怎麼，霧江夫人…？就那麼撞上了的話，就是主人獲勝了吧……？」,「怎、…怎么，雾江夫人…？就那么撞上了的话，就是主人获胜了吧……？」,[=UP],[=UP],[=UP]
Kanon,""".........Ah, I, I see...! Even with 20 loser flags, ......that's still not enough!""",""".........Ah, I, I see...! ...even with 20 loser flags, ...that's not enough!"" ",[=ST],「………はッ、そ、そうか…、負けフラグの数が２０でも、……まだ足りないんだ！」,[=JP],"""........Ах, я... я понимаю... Даже с 20 провальными флажками... Этого не достаточно!""",""".........Ah, e‐entendi...! Mesmo com 20 {i:loser flags}, ......ainda não é o bastante!""",[=UP],「………啊，對、對了…，即使敗兆的數量達到 20，……也還是不夠啊！」,「………啊，对、对了…，即使败兆的数量达到 20，……也还是不够啊！」,[=UP],[=UP],[=UP]
,"Krauss's and the goat's double rush make it x4.{n}With a miracle on their side, the firm promise of a critical hit would double it again for x8.","Krauss's and the goat's double rush made for times 4. With a miracle as an ally, the firm promise of a critical hit doubled it again for times 8. ",[=ST],蔵臼と山羊の２倍の踏み込みで４倍。奇跡が味方してクリティカル確約でさらに２倍で８倍。,蔵臼と山羊の２倍の踏み込みで４倍。{n}奇跡が味方してクリティカル確約でさらに２倍で８倍。,"Двойной рывок Краусса и козлоголового увеличил силу в 4 раза.{n}С чудом в качестве союзника, твёрдое обещание критического удара удвоило множитель силы уже до 8.","Krauss e a cabra obtiveram um x4.{n}Com um milagre ao seu lado, a firme promessa de um ataque crítico que iria dobrar novamente x8.",[=UP],藏臼與山羊的兩倍疾衝變 4 倍。{n}有奇跡做伴，保證會心一擊乘 2 倍變 8 倍。,藏臼与山羊的两倍疾冲变 4 倍。{n}有奇迹做伴，保证会心一击乘 2 倍变 8 倍。,[=UP],[=UP],[=UP]
,"On top of that, a multiplier of x20 equal to the number of tripped loser flags applies, making it x160.","On top of that, there was an amplification of times 20, equal to the number of loser flags, making for x160. ",[=ST],その上、立てた負けフラグの数だけ倍率が掛かって２０倍で１６０倍。,[=JP],"Вдобавок произошло увеличение в 20 раз, равное количеству провальных флажков, после чего величина множителя силы достигла 160.","Acima disso, um multiplicador x20 igual ao número de vezes da {i:loser flags} se aplica, fazendo com que aumente para x160.",[=UP],在這基礎上，根據有多少敗兆就算多少倍數，乘以 20 倍變 160 倍。,在这基础上，根据有多少败兆就算多少倍数，乘以 20 倍变 160 倍。,[=UP],[=UP],[=UP]
