Ushiromiya George,""".........There probably are quite a few people who wouldn't celebrate an engagement between me and Shannon. I was prepared to make enemies of the entire family by announcing my engagement to her.""","......There probably are quite a few people who wouldn't celebrate an engagement between me and Shannon. I was prepared to make enemies of the entire family by announcing my engagement to her."" ",[=ST],………僕と紗音の婚約を祝福しない者も、きっと多いだろう。僕は彼女との婚約を宣言することで、親族全てを敵に回すと、覚悟していた。,「………僕と紗音の婚約を祝福しない者も、きっと多いだろう。僕は彼女との婚約を宣言することで、親族全てを敵に回すと、覚悟していた」,"""........Более чем вероятно, сыщется мало людей, которых наша помолвка обрадует. Я был готов иметь во врагах всю семью после того, как объявлю о ней.""",""".........Provavelmente haveriam algumas pessoas que não celebrariam este casamento entre a Shannon e eu. Eu estava preparado para fazer inimigos em meio a toda família ao anunciar meu noivado com ela.""",[=UP],「………一定也是會有不少，不祝福我與紗音訂婚之人的吧。我有做好，宣言我與她訂婚，與所有親戚為敵的思想準備。」,「………一定也是会有不少，不祝福我与纱音订婚之人的吧。我有做好，宣言我与她订婚，与所有亲戚为敌的思想准备。」,[=UP],[=UP],[=UP]
Ushiromiya George,"""I have been prepared. Since the time I came to this island, .........no, that's not it. .........Since the time I confessed to her that I wanted us to get engaged.""","""I have been prepared. Since the time I came to this island......no, that's not it. ......Since the time I confessed that I wanted to engage her."" ",[=ST],僕にはあるんだよ。この島に訪れたその時から、………いや、違う。………彼女に婚約したいと打ち明けたその時からね。」,「僕にはあるんだよ。この島に訪れたその時から、………いや、違う。………彼女に婚約したいと打ち明けたその時からね」,"""Да, я был готов. С момента прибытия на этот остров... Нет, не так. С того самого момента, как признался, что хочу обручиться с ней.""","""Eu venho me preparando. Desde o momento em que cheguei nesta ilha, .........não, não é isso. .........Desde o momento em que eu me confessei para ela que eu queria que nos casássemos.""",[=UP],「我有這覺悟。從到這島上時就，………不、不是。………在向她挑明，我想與她訂婚時就有。」,「我有这觉悟。从到这岛上时就，………不、不是。………在向她挑明，我想与她订婚时就有。」,[=UP],[=UP],[=UP]
Gaap,"""............So, you can sacrifice everything else as long as you can get married......?""","""......So, you can sacrifice everything else as long as you can get married...?"" ",[=ST],「…………結婚さえ出来れば、他の何もかも犠牲に出来る、と……？」,[=JP],""".........То есть ты готов пожертвовать всем, если сможешь жениться на любимой девушке?""","""............Então, você pode sacrificar a todos contanto que possa se casar......?""",[=UP],「…………是說，只要能結婚，就願意放棄其他的一切，嗎……？」,「…………是说，只要能结婚，就愿意放弃其他的一切，吗……？」,[=UP],[=UP],[=UP]
Ushiromiya George,"""Marriage......means remaining an ally to your wife for your entire life. .........As of that moment, ......I was prepared to make the entire world my enemy for her sake.""","""Marriage means... ...continuing to be your wife's ally for your whole life. ......At that point, ...I was prepared to have the entire world as my enemy for her sake."" ",[=ST],「結婚とは。……自分は生涯、妻の味方であり続けるということだ。………僕にはその時点で。……彼女のために、世界の全てを敵に回す覚悟があるんだ。」,「結婚とは。……自分は生涯、妻の味方であり続けるということだ。………僕にはその時点で。……彼女のために、世界の全てを敵に回す覚悟があるんだ」,"""Брак означает... стать союзником жены на всю жизнь. .......К тому моменту, ради неё я был готов иметь во врагах весь мир.""","""Casamento......significa ser um aliado de sua esposa por toda sua vida.{n}.........Como parte desse momento, ......eu estava preparado para fazer o mundo todo meu inimigo pelo bem dela.""",[=UP],「所謂結婚。……就是意味著，究其一生地站在妻子的這一邊。………我在那時起。……就已有為了她，與整個世界為敵的覺悟。」,「所谓结婚。……就是意味着，究其一生地站在妻子的这一边。………我在那时起。……就已有为了她，与整个世界为敌的觉悟。」,[=UP],[=UP],[=UP]
,"Those words, through the three‐sided mirror, ......also reached Shannon's ears.{n}And his determination reached her eyes.","Those words, through the three-sided mirror, ...also reached Shannon's ears. And that determination reached her eyes. ",[=ST],その言葉を、三面鏡越しに、……紗音も耳にする。そしてその決意を、目にする。,その言葉を、三面鏡越しに、……紗音も耳にする。{n}そしてその決意を、目にする。,"Эти слова, передаваемые зеркалом, достигли и ушей Шаннон.{n}А несгибаемость Джорджа достигла её глаз.","Aquelas palavras passaram através do espelho de três faces, ......e chegaram até os ouvidos de Shannon. E sua determinação, ao seus olhos.",[=UP],這些話，越過三面鏡，……傳進了紗音的耳中。{n}並且，她還親眼目睹了這份決意。,这些话，越过三面镜，……传进了纱音的耳中。{n}并且，她还亲眼目睹了这份决意。,[=UP],[=UP],[=UP]
,"......Shannon certainly had arranged with George that tonight, she would be given an engagement ring.",...Shannon certainly had promised to be given an engagement ring tonight. ,[=ST],………紗音は確かに今夜、婚約指輪を渡される約束をしていた。,[=JP],Шаннон определённо пообещали сегодня подарить кольцо.,"......Shannon certamente estava prometida a se encontrar com George esta noite, onde receberia um anel de noivado.",[=UP],………紗音的確是聽讓治承諾過，要在今晚送她訂婚戒指。,………纱音的确是听让治承诺过，要在今晚送她订婚戒指。,[=UP],[=UP],[=UP]
,"Then this incident had occurred, and she hadn't been able to receive the ring.","Then, this incident had occurred, and she hadn't been able to receive the ring. ",[=ST],そしてこのような事件が起こってしまい、指輪を受け取ることが出来なかった。,[=JP],"Затем случился этот инцидент, который помешал ей получить кольцо.","Então, este incidente ocorreu, e ela não foi capaz de receber o anel.",[=UP],然後，就發生了這樣的事件，而沒能拿到戒指。,然后，就发生了这样的事件，而没能拿到戒指。,[=UP],[=UP],[=UP]
,"But now, .........even though it wasn't in the form of a ring, ......Shannon had received something even greater.","But now... ...Even though it wasn't in the form of a ring, Shannon had received something even greater. ",[=ST],しかし、今。………指輪の形を成さないだけで、……それ以上の何かを、紗音は受け取る。,[=JP],"Но теперь. Хоть это и не имело формы кольца, Шаннон получила нечто гораздо более ценное.","Mas agora, .........mesmo que não tivesse sido na forma de um anel, ......Shannon havia recebido algo ainda melhor.",[=UP],不過，此刻。………紗音收到了，……僅僅是沒有戒指外形罷了的，遠超實物的什麼。,不过，此刻。………纱音收到了，……仅仅是没有戒指外形罢了的，远超实物的什么。,[=UP],[=UP],[=UP]
,"......And as proof of that, ......a single tear with the same sparkle as a diamond...dripped down.","...And as proof of that, ...a single tear with the same sparkle as a diamond... dripped down. ",[=ST],……その証拠に、……ダイヤと同じ輝きの涙が一粒、…零れたから。,[=JP],"Доказательством стала единственная слезинка, которая, сверкнув алмазом, упала вниз.","......E como prova disso, ......uma singela lágrima, com um brilho igual ao de um diamante...escorreu por seu rosto.",[=UP],……而這證據，……就是那淌下的，有著與鑽石同等光輝的，…一滴淚。,……而这证据，……就是那淌下的，有着与钻石同等光辉的，…一滴泪。,[=UP],[=UP],[=UP]
Gaap,"""Heh, ......heheheheheheh......! What a gutsy answer. .........Yes, if I really think about it, this was an easy decision for you.""","""Heh, ...heheheheheheh...! What a courageous answer. I see, if I really think about it, this was an easy decision for you."" ",[=ST],「ふ、……うふふふふふふ……！　それは何とも奮った答えだことね。………なるほど、よく考えたら、君にこれは気楽な選択肢だわ。,「ふ、……うふふふふふふ……！　それは何とも奮った答えだことね。………なるほど、よく考えたら、君にこれは気楽な選択肢だわ」,"""Хе... хе‐хе‐хе‐хе!.. Какой отважный ответ. И правда, если задуматься, ты и впрямь не мог ответить иначе.""","""Heh, ......heheheheheheh......! Que resposta mais valente. .........Sim, se pensar sobre isto, esta é a decisão mais fácil para você.""",[=UP],「哼、……哼哼哼哼哼哼哼……！好是氣壯山河的回答呢。………原來如此，仔細一想，這對你而言是一個輕鬆的選項呢。」,「哼、……哼哼哼哼哼哼哼……！好是气壮山河的回答呢。………原来如此，仔细一想，这对你而言是一个轻松的选项呢。」,[=UP],[=UP],[=UP]
Gaap,"""After all, your parents were already killed on the first twilight, right? By now, there's no one whose death would bother you. Hahha{0}ha{0}ha{0}ha{0}ha{0}haha, I see, this was an easy choice. Ahaha{0}ha{0}ha{0}ha{0}ha{0}haha......""","""After all, your parents were already killed on the first twilight, right? By now, there's no one whose death would trouble you."" ""Hahhahahahahahaha, I see, truly an easy choice. Ahahahahahahahaha..."" ",[=ST],だって、君の両親は、第一の晩に、すでに殺されちゃってるんだもんね？　今さら君にとって、死んで困る人間は誰もいない。はっははははははは、なるほどね、これは簡単な選択だったわ。あはははははははは……。」,「だって、君の両親は、第一の晩に、すでに殺されちゃってるんだもんね？　今さら君にとって、死んで困る人間は誰もいない。はっははははははは、なるほどね、これは簡単な選択だったわ。あはははははははは……」,"""Ведь, в конце концов, твоих родителей убили в первые сумерки, верно? Теперь не осталось никого, чья смерть причинит тебе беспокойства. Ха‐ха‐ха‐ха‐ха‐ха‐ха, я вижу, и впрямь лёгкий ответ. Аха‐ха‐ха‐ха‐ха‐ха‐ха...""","""Afinal, seus pais já morreram no primeiro crepúsculo, certo? Neste momento, a morte de ninguém iria afetá‐lo. Hahha{0}ha{0}ha{0}ha{0}ha{0}haha, entendo, essa é uma escolha fácil. Ahaha{0}ha{0}ha{0}ha{0}ha{0}haha......""",[=UP],「畢竟，你的雙親，已經在第一晚被殺了呢。現如今，對你來說，死了有所謂的人一個都沒有。哈、哈哈哈哈哈哈哈，原來如此，這是道簡單的選擇呢。啊哈哈哈哈哈哈哈哈……」,「毕竟，你的双亲，已经在第一晚被杀了呢。现如今，对你来说，死了有所谓的人一个都没有。哈、哈哈哈哈哈哈哈，原来如此，这是道简单的选择呢。啊哈哈哈哈哈哈哈哈……」,[=UP],[=UP],[=UP]
Ushiromiya George,"""You can say whatever you want. This is my determination and my choice, ......personally, and as the next family head.""","""Say whatever you want. This determination and choice are mine, ...and mine as the Successor."" ",[=ST],「何とでも言うがいい。これが僕の、……そして、僕の次期当主としての覚悟と、選択だ。」,「何とでも言うがいい。これが僕の、……そして、僕の次期当主としての覚悟と、選択だ」,"""Говори что хочешь. Таковы мои решимость и выбор. Решимость и выбор как следующего главы семьи.""","""Você pode dizer o que quiser. Esta é minha determinação e minha escolha, ......pessoal, e como novo chefe da família.""",[=UP],「隨你怎麼說。這就是我的、……以及，我作為下任當主的覺悟與，選擇。」,「随你怎么说。这就是我的、……以及，我作为下任当主的觉悟与，选择。」,[=UP],[=UP],[=UP]
,The sparkle in George's eyes was brilliant and sharp.,The sparkle in George's eyes was brilliantly sharp. ,[=ST],譲治の目に光る輝きは眩しく鋭い。,[=JP],Блеск в глазах Джорджа резал своей яркостью.,O brilho nos olhos de George era reluzente e afiado.,[=UP],閃爍在讓治雙目中的光輝鋒利刺眼。,闪烁在让治双目中的光辉锋利刺眼。,[=UP],[=UP],[=UP]
,"...For just an instant, Gaap felt the same sense of intimidation that Kinzo exuded, and was slightly overpowered.","...For just an instant, Gaap felt the same sense of threat as Kinzo's...and was slightly overwhelmed. ",[=ST],…その中に、一瞬だけ金蔵と同じ凄みを感じ、ガァプはわずかに気圧される。,[=JP],"На мгновение Гаап ощутила такое же чувство угрозы, что и от Кинзо, и оказалась слегка подавлена.","...Por um curto instante, Gaap sentiu o mesmo senso de intimidação que Kinzo impõem, e ficou visivelmente dominada.",[=UP],…噶普從這之中感到了一瞬與金藏相同的霸氣，些許地被鎮住了。,…噶普从这之中感到了一瞬与金藏相同的霸气，些许地被镇住了。,[=UP],[=UP],[=UP]
Gaap,""".........I see. ......So, the same answer as {f:5:Goldsmith}...... ......Despite your innocent face, ......you're going to become a terrible demon in the future. ......What do you know, we might get along pretty well.""","""......I see. ...Yes, the same decision as {f:5:Goldsmith}... ...So even with your innocent face, ...you will also become a terrible demon in the future. ...What do you know, we might get along pretty well."" ",[=ST],「………なるほど。……ゴールドスミスと同じ答え、というわけ……。……君も、あどけなさそうな顔して、……将来はとんだ悪魔になるわけね。……何だ、私たち、とてもうまくやれそうじゃない。,「………なるほど。……ゴールドスミスと同じ答え、というわけ……。……君も、あどけなさそうな顔して、……将来はとんだ悪魔になるわけね。……何だ、私たち、とてもうまくやれそうじゃない」,"""......Понятно. ......Выходит, то же решение, что и {f:5:Голдсмита}... ......Значит, даже с таким невинным личиком ты также в будущем станешь страшным демоном. Кто бы мог подумать, оказывается, мы даже можем поладить.""",""".........Entendo. ......Então, a mesma resposta que o {f:5:Goldsmith}......? ......Apesar de seu rosto inocente, ......você vai se tornar um terrível demônio no futuro. ......Sabe, nós podemos acabar nos dando muito bem.""",[=UP],「………原來如此。……是個與黃金史密斯相同的回答呢……。……你倒也是，儘管長著張好好先生的臉，……卻又會在將來成為了不得的惡魔呢。……啥呀，咱倆看來，不是挺合得來嘛。」,「………原来如此。……是个与黄金史密斯相同的回答呢……。……你倒也是，尽管长着张好好先生的脸，……却又会在将来成为了不得的恶魔呢。……啥呀，咱俩看来，不是挺合得来嘛。」,[=UP],[=UP],[=UP]
Gaap,"""You will succeed {f:5:Goldsmith}. And maybe one day, I may even be summoned eventually and serve you. ......That might be surprisingly interesting. .........Heheh.""","""You will succeed {f:5:Goldsmith}. Eventually, I may even be summoned and serve you. ...That could be surprisingly interesting. ......Heheh."" ",[=ST],君がゴールドスミスの後を継ぐ。そしてやがては私は召喚され、君に仕えることもあるかもしれない。……それも案外、面白いかもしれないわね。………ふふ。」,「君がゴールドスミスの後を継ぐ。そしてやがては私は召喚され、君に仕えることもあるかもしれない。……それも案外、面白いかもしれないわね。………ふふ」,"""Ты наследуешь {f:5:Голдсмиту}. Тогда я могу даже оказаться призванной, чтобы служить тебе. Это может оказаться на удивление интересным. .....Хе‐хе.""","""Você sucederá {f:5:Goldsmith}. E talvez um dia, eu possa ser invocada e, eventualmente, servir a você. ......Isto seria realmente interessante. .........Heheh.""",[=UP],「你當上黃金史密斯的後繼人。而我或許會在將來被你召喚出來，仕奉於你。……搞不好，這倒也挺好玩的吧。………哼哼。」,「你当上黄金史密斯的后继人。而我或许会在将来被你召唤出来，仕奉于你。……搞不好，这倒也挺好玩的吧。………哼哼。」,[=UP],[=UP],[=UP]
,Gaap needed to change her opinion of George.,Gaap had needed to change her opinion of George. ,[=ST],ガァプは譲治に対する認識を改める必要があった。,[=JP],Гаап пришлось изменить мнение о Джордже.,Gaap precisou mudar sua opinião quanto a George.,[=UP],噶普需要改變對讓治的認識。,噶普需要改变对让治的认识。,[=UP],[=UP],[=UP]
,"......This man bore a determination and resolve unimaginable from his outward appearance, and had not adopted that just now, ......but had possessed it since the very beginning.","...This man bore a determination and resolve unimaginable from his outward appearance... and not just now, but since the very beginning. ",[=ST],……この男には、外見からは想像もつかない決意と覚悟を、今この場でなく、……すでに最初から背負っているのだ。,[=JP],"Этот мужчина обладал целеустремленностью и решимостью, которые трудно было вообразить при взгляде на него, и был наделён ими с самого начала, а не обрёл только сейчас.","......Este homem detém de uma determinação e resolução inimaginável por sua aparência externa, e não é algo adquirido agora, ......mas algo que ele possui desde o princípio.",[=UP],……這個男人的，無法從外表上想像到的決意與覺悟，並非是在此時此地，……而是從一開始，就已背負在他的身上了。,……这个男人的，无法从外表上想象到的决意与觉悟，并非是在此时此地，……而是从一开始，就已背负在他的身上了。,[=UP],[=UP],[=UP]
Ushiromiya George,"""I am prepared to inherit the headship right away. .........No, that's not it. You told me to think as the head in this test. So I answered based on the premise that I am the head.""","""I am prepared to inherit the Headship right away. ......No, that's not it. You told me to think as the Head in this test. So I answered based on the premise that I am the Head."" ",[=ST],「僕には、今すぐ当主を継承する覚悟がある。………いや、違うね。君はこのテストを、当主として考えろと言った。だから僕は自分が当主であると前提して答えたんだ。,「僕には、今すぐ当主を継承する覚悟がある。………いや、違うね。君はこのテストを、当主として考えろと言った。だから僕は自分が当主であると前提して答えたんだ」,"""Я готов немедленно наследовать главенство. .........Нет, не так. Ты сказала мне, что проходя данное испытание, я должен мыслить как глава. Поэтому я ответил, исходя из предпосылки, что являюсь главой.""","""Eu estou preparado para herdar a liderança agora mesmo. .........Não, não é isso. Você me disse para pensar como o chefe para esse teste. Por isso respondi baseado na premissa de que eu sou o chefe.""",[=UP],「我有此刻立即繼承當主的覺悟。………不、不對。你說了，把自己當成當主，去思考這個問題。所以，我以自己是當主為前提，作出了回答。」,「我有此刻立即继承当主的觉悟。………不、不对。你说了，把自己当成当主，去思考这个问题。所以，我以自己是当主为前提，作出了回答。」,[=UP],[=UP],[=UP]
Ushiromiya George,""".........No, even that's not it. I thought as the head himself. ......Right now...I {i:am} the head of the Ushiromiya family.""","""......No, even that's not it. I thought as the Head himself. ...I am now...the Head of the Ushiromiya family."" ",[=ST],………いや、それすら違う。当主そのものとして考えた。……僕は今、右代宮家の当主なんだ。」,「………いや、それすら違う。当主そのものとして考えた。……僕は今、右代宮家の当主なんだ」,"""........Нет, даже это неверно. Я мыслил как сам глава. ......Отныне я... глава семьи Уширомия.""",""".........Não, isso também está errado. Eu pensei como o próprio chefe. ......Agora...eu {i:sou} o chefe da família Ushiromiya.""",[=UP],「………不，就連這都錯了。我是作為當主在思考。……我此刻，就是右代宮家的當主。」,「………不，就连这都错了。我是作为当主在思考。……我此刻，就是右代宫家的当主。」,[=UP],[=UP],[=UP]
Gaap,"""....................................... Ehheheheheh...... I'm impressed... I didn't expect you to be able to say so much.""","""............ Hehheheheheh... Splendid, to think that you'd be able to go so far. ",[=ST],「…………………………………。うっふふふふふ……。見事だわ、そこまで言えるなんてね。,「…………………………………。うっふふふふふ……。見事だわ、そこまで言えるなんてね」,""".......................Эхе‐хе‐хе‐хе... Радостно слышать от тебя такие речи.""","""....................................... Ehheheheheh...... Estou impressionada... Eu não esperava que você fosse capaz de isso.""",[=UP],「…………………………………。嗚、哼哼哼哼哼……。了不起，竟能說到這個地步。」,「…………………………………。呜、哼哼哼哼哼……。了不起，竟能说到这个地步。」,[=UP],[=UP],[=UP]
