Speaker,Umineko Project (UP),Steam (ST),Original Witch Hunt (OG),PC Japanese (JP),PS3 Japanese - Censored (JPC),Russian (RU),Brazilian Portuguese (PT),Vietnamese (VI),Chinese Traditional (CHT),Chinese Simplified (CN),Indonesian (IDN),Italian (IT),Turkish (TR)
,"It goes without saying, but since the time she was born, ......Jessica was raised in this mansion.","Of course, since the time of her birth, ...Jessica had been raised in this mansion. ",[=ST],朱志香は生まれてからずっと、……当たり前だが、この屋敷で育ってきた。,[=JP],С самого своего рождения Джессика росла и воспитывалась в этом особняке.,"Naturalmente, desde seu nascimento, ......Jessica vem sendo criada nesta mansão.",[=UP],不言而喻，……朱志香自出生時起，一直在這幢大屋中生活、成長。,不言而喻，……朱志香自出生时起，一直在这幢大屋中生活、成长。,[=UP],[=UP],[=UP]
,"The Western‐style house that the cousins simply called ""the mansion"" was her home.","The atrophied, Western-style house that the cousins called a mansion was her home. ",[=ST],いとこたちがお屋敷と呼んで萎縮するその洋館が、自分の家だった。,[=JP],"Выполненный в западном стиле дом, который кузены называли особняком, являлся её домом.","A casa em estilo ocidental que seus primos chamavam de ""a mansão"", era sua casa.",[=UP],這幢被堂兄妹們稱為大屋，令他們感到拘謹的洋館，是她自己的家。,这幢被堂兄妹们称为大屋，令他们感到拘谨的洋馆，是她自己的家。,[=UP],[=UP],[=UP]
,"And yet, she had never understood her cousins' feelings as much as she did today.","And yet, she had never understood her cousins' feelings as much as she did today. ",[=ST],なのに、今日ほどそのいとこたちの気持ちがわかったことはない。,[=JP],"И всё же она никогда не понимала чувства своих кузенов так, как сегодня.","Ainda assim, ela nunca entendeu os sentimentos de seus primos tanto quanto ela tinha entendido hoje.",[=UP],不過，她從來沒有像今天這般深刻地體會到堂兄妹們的心情。,不过，她从来没有像今天这般深刻地体会到堂兄妹们的心情。,[=UP],[=UP],[=UP]
,"......And at the same time, her own home, which she knew well, had never felt so different a place as it did now......","...At the same time, she had never felt her own home, which she knew well, to be as alien as it seemed now... ",[=ST],……そして同時に、自分がよく見知った自宅が、これほど別の場所に感じたことはなかった……。,[=JP],"......И в то же время она никогда настолько не ощущала, что её собственный дом, который она знала так хорошо, был совершенно другим местом, как сейчас......","......E ao mesmo tempo, sua própria casa, na qual ela conhecia bem, nunca pareceu ser um lugar tão diferente como agora......",[=UP],……與此同時，她也從未如現在這般地感到過，自己所熟知的家，猶如他處…。,……与此同时，她也从未如现在这般地感到过，自己所熟知的家，犹如他处…。,[=UP],[=UP],[=UP]
,Her own.........room.,Her own......room. ,[=ST],自分の、………部屋。,[=JP],Её собственная... комната.,Seu próprio.........quarto.,[=UP],自己的………房間。,自己的………房间。,[=UP],[=UP],[=UP]
,"This had once been her personal hideaway, the only place in this vast mansion where she could feel at peace.","This had once been her hideaway, the only place in this vast mansion where she could feel at peace. ",[=ST],そこはかつて、この広大な屋敷で唯一心を許せる、自分だけの隠れ家だった。,[=JP],"Когда‐то она была её убежищем, единственным местом в этом огромном особняке, где Джессика могла чувствовать себя спокойно.","Uma vez fora seu esconderijo pessoal, o único lugar nessa imensa mansão onde ela podia se sentir em paz.",[=UP],此處曾是這廣大的大屋中唯一能令自己徹底放鬆的，只屬於自己的藏身處。,此处曾是这广大的大屋中唯一能令自己彻底放松的，只属于自己的藏身处。,[=UP],[=UP],[=UP]
,"However, ......that door had never felt as intimidating as it did now.","However, ...she had never felt as much pressure coming from that door as she did now. ",[=ST],しかし、……今ほど、その扉に威圧感を感じることはない。,[=JP],"Однако она никогда не ощущала такого давления, исходящего сейчас от двери.","Entretanto, ......aquela porta nunca pareceu ser tão intimidadora como agora.",[=UP],可是，……此刻的她卻從這扇門上感到了未曾有過的威壓感。,可是，……此刻的她却从这扇门上感到了未曾有过的威压感。,[=UP],[=UP],[=UP]
Ushiromiya Jessica,""".........A test, he says...? Tch, what the hell has he got waiting in there...... He better not have ransacked my desk and stuff......""","""......A test, you say...? Tch, what the hell could be waiting in there... I'm not gonna find my desk and stuff dragged around all over the place, right...?"" ",[=ST],「………テストだって…？　ちぇ、一体、何が待ち受けてやがるんだ……。まさか、私の机とか、引っ掻き回してねぇだろうな……。」,「………テストだって…？　ちぇ、一体、何が待ち受けてやがるんだ……。まさか、私の机とか、引っ掻き回してねぇだろうな……」,""".........Испытание, говорите? Что, чёрт возьми, меня может там ждать... Я же не обнаружу, что мой стол и вещи разбросаны по всей комнате, верно?""",""".........Ele disse que era um teste...? Tch, que merda vai estar me esperando aqui......? É melhor que ele não tenha mexido na minha mesa e espalhado minhas coisas......""",[=UP],「………考試…？切，到底是有什麼等著我呢……？總不會是亂翻過我的桌子什麼的吧……」,「………考试…？切，到底是有什么等着我呢……？总不会是乱翻过我的桌子什么的吧……」,[=UP],[=UP],[=UP]
,"She acted tough, trying to deceive herself.{n}......Trying to make herself believe that she wasn't scared of anything.","She acted tough, trying to deceive herself. ...Trying make herself believe that she wasn't scared of anything. ",[=ST],自らを騙すために、悪態をつく。……自分は何も恐れていないのだと、信じさせるために。,自らを騙すために、悪態をつく。{n}……自分は何も恐れていないのだと、信じさせるために。,"Она храбрилась, пытаясь обмануть саму себя.{n}......Стараясь заставить себя поверить, что она ничего не боялась.","Ela falou de forma dura, tentando enganar a si mesma.{n}......Tentando fazer a si mesma acreditar que não estava com medo de nada.",[=UP],為了騙自己，朱志香故意出言不遜。{n}……這是為了令自己相信，自己無所畏懼。,为了骗自己，朱志香故意出言不逊。{n}……这是为了令自己相信，自己无所畏惧。,[=UP],[=UP],[=UP]
,"She readied herself, and opened the door to her room.","Readying herself, she opened the door to her room. ",[=ST],覚悟を決め、自分の部屋の扉を開く。,[=JP],"Подготовив себя, она открыла дверь в свою комнату.","Ela preparou a si mesma, e então abriu a porta de seu quarto.",[=UP],然後，她鐵了鐵心，打開了自己房間的門。,然后，她铁了铁心，打开了自己房间的门。,[=UP],[=UP],[=UP]
Ushiromiya Jessica,"""....................................""","""............"" ",[=ST],「………………………………。」,「………………………………」,""".....................""",[=UP],[=UP],[=JPC],[=JPC],[=UP],[=UP],[=UP]
,"......When she saw that, fortunately, the room didn't appear to have been messed with, she relaxed.","...When she saw that, fortunately, the room didn't appear to be messed up, she relaxed. ",[=ST],……幸いなことに、部屋が荒らされてるようには見えず、ほっとする。,[=JP],"......Когда она увидела, что, к счастью, комната была в порядке, она успокоилась.","......Quando ela o viu, felizmente, não aparentava que o quarto tivesse sido revistado, por isso ela se acalmou.",[=UP],……幸好，房中並沒有被亂翻過的跡象，鬆了一口氣。,……幸好，房中并没有被乱翻过的迹象，松了一口气。,[=UP],[=UP],[=UP]
,No one......was there. ......Of course.{n}There was nowhere for anyone to hide here.,No one...was there. ...Of course. There was nowhere for anyone to hide here. ,[=ST],誰も、……いない。……もちろんだ。人が隠れられる場所など、あるわけもない。,誰も、……いない。……もちろんだ。{n}人が隠れられる場所など、あるわけもない。,"Она никого там не застала. ......Ну разумеется.{n}В ней не было места, где кто‐нибудь мог спрятаться.",Não havia......ninguém lá. ......É claro.{n}Não havia onde alguém se esconder.,[=UP],沒人……在。……這是當然。{n}這房間才沒有能藏人的地方。,没人……在。……这是当然。{n}这房间才没有能藏人的地方。,[=UP],[=UP],[=UP]
,"Right away, Jessica locked the door behind her.{n}......Now the room was safe.","Right away, Jessica locked the door behind her. ...This way, the room was safe. ",[=ST],朱志香は咄嗟に、後手で施錠してしまう。……これで、この部屋は安全だ。,朱志香は咄嗟に、後手で施錠してしまう。{n}……これで、この部屋は安全だ。,"Джессика сразу же закрыла за собой дверь.{n}......Таким образом, в комнате стало безопасней.","Logo depois, Jessica fechou a porta às suas costas.{n}......Agora o quarto estava seguro.",[=UP],朱志香當即就把手伸到身後，鎖好了門。{n}……這下，這個房間就安全了。,朱志香当即就把手伸到身后，锁好了门。{n}……这下，这个房间就安全了。,[=UP],[=UP],[=UP]
,"She peeked under the bed and in the closet, but of course, no one was hiding.","She peeked under the bed and in the closet, but of course, no one was hiding. ",[=ST],ベッドの下もクローゼットも覗くが、もちろん誰も隠れていない。,[=JP],"Она посмотрела под кроватью и в шкафу, но, конечно, там никто не прятался.","Ela olhou debaixo da cama e atrás no armário, e é claro, não havia ninguém escondido.",[=UP],接著，她查看了下床底與衣櫃，當然，也沒人藏著。,接着，她查看了下床底与衣柜，当然，也没人藏着。,[=UP],[=UP],[=UP]
Ushiromiya Jessica,"""......Wh‐......what the hell. ...Haha, ...haha...!""","""...Wh-What the hell. ...Haha, ...haha...!"" ",[=ST],「……な、……何だってんだ。……はは、…はは…！」,[=JP],"""......Ч‐что за чёрт. ...Ха‐ха, ха‐ха!""","""......A‐......Até parece. ...Haha, ...haha...!""",[=UP],「……搞、……搞啥呀。……哈哈、…哈哈…！」,[=CHT],[=UP],[=UP],[=UP]
,"She looked at the clock. ......Ten past eleven, or just a little past that.",She looked at the clock. ...It was just past 23:10. ,[=ST],時計を見る。……２３時１０分、ちょっと過ぎ。,[=JP],Она посмотрела на часы. ......Было лишь немногим больше одиннадцати.,Ela olhou para o relógio. ......Já passava das 23:10.,[=UP],看了下鐘。……剛過 23 點 10 分。,看了下钟。……刚过 23 点 10 分。,[=UP],[=UP],[=UP]
,"As her tension lessened and fatigue came back to her entire body, she realized how messed up this whole day had been.","As her tension lessened and fatigue came back to her entire body, she realized how messed up this whole day had been. ",[=ST],緊張が抜けて、全身に疲労感が蘇ると共に、今日一日がどれほど狂っているかを知った。,[=JP],"Когда её отпустило напряжение, и усталость вернулась ко всему телу, она поняла, насколько сумасшедшим был весь этот день.","Conforme sua tensão diminuía e a fatiga retornava ao seu corpo, ela começou a perceber o quão louco havia sido aquele dia.",[=UP],緊張感一放鬆，伴隨著全身重新涌起的疲勞感，她想起了今天一整天是有多麼的瘋狂。,紧张感一放松，伴随着全身重新涌起的疲劳感，她想起了今天一整天是有多么的疯狂。,[=UP],[=UP],[=UP]
,It was still only eleven.,It was still about 23:00. ,[=ST],まだ、２３時なのだ。,[=JP],На часах было около одиннадцати.,Ainda eram 23 h.,[=UP],才，十一點啊。,才，十一点啊。,[=UP],[=UP],[=UP]
,"......The plan had been for all the cousins to get together, have fun playing around, and talk animatedly about all kinds of things together into the night.","...The plan had been for all the cousins to gather, have fun playing around, and talk animatedly about various things together into the night. ",[=ST],……いとこのみんなが集まって、楽しく遊んで、夜はみんなで色々な話に花を咲かせるつもりだった。,[=JP],"......По задумке, все кузены и кузины должны были собраться, весело поиграть и оживлённо поболтать о разных вещах до глубокой ночи.","......O plano era que todos os primos se juntassem, se divertissem e conversassem animados sobre todas as coisas que fariam durante a noite.",[=UP],……本打算堂兄妹聚聚，一起開心玩耍，一起在晚上海聊各種各樣的話題。,……本打算堂兄妹聚聚，一起开心玩耍，一起在晚上海聊各种各样的话题。,[=UP],[=UP],[=UP]
,"Normally, we would have been doing that kind of thing at this very moment.{n}Why has that......turned into this......?","Normally, we would've been doing that kind of thing right now. Why...has that turned into this...? ",[=ST],本当だったなら、今頃まさにそうしていただろう。それが、……どうしてこんなことに……？,本当だったなら、今頃まさにそうしていただろう。{n}それが、……どうしてこんなことに……？,"При нормальных обстоятельствах, мы бы сейчас и занимались такими вещами.{n}Почему... всё так обернулось?","Normalmente, estaríamos fazendo esse tipo de coisa agora.{n}Por que......as coisas acabaram assim......?",[=UP],本來的話，這會兒正在這麼做吧。{n}為什麼，……會變成這樣……？,本来的话，这会儿正在这么做吧。{n}为什么，……会变成这样……？,[=UP],[=UP],[=UP]
Ushiromiya Jessica,""".........It's all that old bastard's fault...... ......How could he do that...to Mom......to everyone.........""","""......It's all that damn geezer's fault... ...How could he do that...to Mom... to everyone......"" ",[=ST],「………全部、あのクソジジイのせいだ……。……よくも、母さんを……。みんなを………。」,「………全部、あのクソジジイのせいだ……。……よくも、母さんを……。みんなを………」,""".......Это все тот старый хрыч виноват... Как он мог... сотворить такое с мамой... со всеми...""",""".........É tudo culpa daquele velho de merda...... ......Como ele pôde fazer aquilo...com a minha mãe......com todos.........""",[=UP],「………全部，都怪那個混帳老頭……。……竟敢，把媽媽……。把大家………」,「………全部，都怪那个混帐老头……。……竟敢，把妈妈……。把大家………」,[=UP],[=UP],[=UP]
,Her head was swimming with anger and sadness...... But there was no one here to direct those emotions at.,She shook her head back and forth with anger and sadness... But there was no one here to direct those emotions at. ,[=ST],怒りと悲しみで、頭がぐるぐる回る……。しかし、その矛先を向けるべき相手は、ここにはいないのだ。,[=JP],"Она со злостью и грустью тряхнула головой взад‐вперёд...Но здесь не было никого, на кого направить свои эмоции.",Sua cabeça estava girando junto àquela raiva e tristeza...... Mas não havia ninguém para quem ela pudesse direcionar aquelas emoções.,[=UP],憤怒與悲傷令她的腦子天旋地轉……。可是，這些感情的矛頭所指之人，並不在此處。,愤怒与悲伤令她的脑子天旋地转……。可是，这些感情的矛头所指之人，并不在此处。,[=UP],[=UP],[=UP]
,"......Because of the lock, this room's security was guaranteed.{n}Remembering that one more time, Jessica somehow regained her calm......","...Because of the lock, this room's security was guaranteed. Remembering that one more time, Jessica somehow regained her calm... ",[=ST],……施錠によって、この部屋の安全は確保された。それをもう一度思い出すことにより、朱志香は何とか冷静を取り戻す……。,……施錠によって、この部屋の安全は確保された。{n}それをもう一度思い出すことにより、朱志香は何とか冷静を取り戻す……。,"......Благодаря замку, безопасность этой комнаты была гарантирована.{n}Ещё раз вспомнив об этом, Джессика каким‐то образом вернула себе спокойствие...","......Por causa da tranca, a segurança do quarto estava garantida.{n}Lembrando‐se disso mais uma vez, Jessica se acalmou um pouco......",[=UP],……通過上鎖，這間房間的安全已得到保證。{n}通過再次想起這點，朱志香總算取回了冷靜……。,……通过上锁，这间房间的安全已得到保证。{n}通过再次想起这点，朱志香总算取回了冷静……。,[=UP],[=UP],[=UP]
,If it keeps up like this and nothing happens...{n}Jessica thought that she would like to go to the dining hall and see her mother's last face.,If it keeps up like this and nothing happens... ...I want to go to the dining hall and see Mom's dead face. ,[=ST],もし、このまま何も起こらないなら。食堂に行き、母の死に顔を見たいと思った。,もし、このまま何も起こらないなら。{n}食堂に行き、母の死に顔を見たいと思った。,Если всё так и продолжится и ничего не случится...{n}Я хочу пойти в обеденный зал и увидеть лицо мамы.,Se continuar assim e nada acontecer...{n}Jessica pensou em ir à sala de jantar e ver o rosto de sua mãe pela última vez.,[=UP],接著，她想到了，如果就這麼什麼都不發生的話。{n}那就去下餐廳，見下母親的遺容。,接着，她想到了，如果就这么什么都不发生的话。{n}那就去下餐厅，见下母亲的遗容。,[=UP],[=UP],[=UP]
,"......Even though Gohda had emphasized so strongly that it was gruesome and that she definitely shouldn't look at it, even so, she wanted to see her mother's face one final time...","...Even though Gohda emphasized so strongly that it was gruesome and that I definitely shouldn't go to look at it, even so, I wanted to see her face at the end... ",[=ST],……郷田から絶対に見るべきではない惨いものだと、あれほど念を押されていても、それでもなお、最後に母の顔が見たかった…。,[=JP],"......Пусть Года и подчеркнул, что зрелище было отвратительным, и я определённо не должна смотреть на него, даже так, я всё равно хочу увидеть его в последний раз...","......Mesmo Gohda tendo enfatizado que era algo horrível e que ela definitivamente não deveria olhar, mesmo assim, ela queria ver o rosto de sua mãe uma última vez...",[=UP],……儘管被鄉田反覆叮囑了，母親的死狀慘到了絕對不該見，但儘管如此，她還是好想去見母親最後一面…。,……尽管被乡田反复叮嘱了，母亲的死状惨到了绝对不该见，但尽管如此，她还是好想去见母亲最后一面…。,[=UP],[=UP],[=UP]
,But they had been warned repeatedly that doing anything stupid would put the hostages in danger.,But we were warned repeatedly that stepping out of line even a little would put the hostages in danger. ,[=ST],だが、余計なことをすれば人質に危害が及ぶと重ねて警告されている。,[=JP],"Но нас несколько раз предупредили, что любой глупый поступок подвергнет заложников опасности.",Mas eles foram alertados diversas vezes que fazer qualquer coisa idiota colocaria os reféns em perigo.,[=UP],但是，有被多次警告過，若有多餘的舉動，就會危害人質的安全。,但是，有被多次警告过，若有多余的举动，就会危害人质的安全。,[=UP],[=UP],[=UP]
,......Could it be that locking the door was also against the rules......?,...Could it be that locking the door was also against the rules...? ,[=ST],……ひょっとして、鍵を掛けるのもルール違反に入るだろうか……？,[=JP],"......Может ли оказаться так, что запирание двери тоже против правил?",......Poderia ser que fechar a porta fosse algo considerado contra as regras......?,[=UP],……鎖門，會不會也屬於犯規呢……？,……锁门，会不会也属于犯规呢……？,[=UP],[=UP],[=UP]
,"If I close myself up in here, I alone might be saved.","If I close myself up in here, I alone might be saved. ",[=ST],ここに閉じ篭っていれば、自分だけは助かるかもしれない。,[=JP],"Если я запрусь здесь, возможно, хотя бы я одна смогу спастись.","Se eu me fechar, devo ficar segura sozinha.",[=UP],選擇在這閉守的話，也許就能令自己一人得救。,选择在这闭守的话，也许就能令自己一人得救。,[=UP],[=UP],[=UP]
,"......But if I don't open it, it will surely be against the rules, and Dad, Kanon‐kun, Shannon, Auntie Kyrie, and Doctor Nanjo...will be killed.","...But if I don't open it, it'll surely be against the rules, and Dad, Kanon-kun, Shannon, Aunt Kyrie and Doctor Nanjo... will be killed. ",[=ST],……でも、開けなければきっとルール違反で、父さんや嘉音くん、紗音、霧江叔母さんに南條先生が、…殺される。,[=JP],"......Но, если я не открою её, это наверняка будет против правил и папу, Канон‐куна, Шаннон, Кирие и Доктора Нанджо... убьют.","......Mas se eu não abrir, certamente vai ser contra as regras e meu pai, o Kanon‐kun, a Shannon, a tia Kyrie e o doutor Nanjo...serão mortos.",[=UP],……不過，不去開門一定會犯規，從而會導致爸爸和嘉音君、紗音、霧江叔母還有南條大夫，…遭到殺害。,……不过，不去开门一定会犯规，从而会导致爸爸和嘉音君、纱音、雾江叔母还有南条大夫，…遭到杀害。,[=UP],[=UP],[=UP]
,............There's no way the scales balance between five lives and my own one life.,......There's no way the scales will balance out between five lives and my own one life. ,[=ST],…………５人の命と自分１人の命なんて、天秤が釣り合うわけもない。,[=JP],".........Весы определённо не придут в равновесие, когда с одной стороны на них будут пять жизней, а с другой одна, моя собственная.",............Não há como a escala se balancear entre cinco vidas e a minha própria vida.,[=UP],…………五人的命與自己一條命，天秤根本不可能兩端齊平。,…………五人的命与自己一条命，天秤根本不可能两端齐平。,[=UP],[=UP],[=UP]
