Speaker,Umineko Project (UP),Steam (ST),Original Witch Hunt (OG),PC Japanese (JP),PS3 Japanese - Censored (JPC),Russian (RU),Brazilian Portuguese (PT),Vietnamese (VI),Chinese Traditional (CHT),Chinese Simplified (CN),Indonesian (IDN),Italian (IT),Turkish (TR)
,The months and years slid by.,The months and years slid by. ,[=UP],そして年月はゆっくりと降り積もる。,[=JP],Шли месяцы и годы.,Meses e anos foram ficando para trás.,[=UP],然後，光陰緩緩沉澱，歲月慢慢堆積。,然后，光阴缓缓沉淀，岁月慢慢堆积。,[=UP],[=UP],[=UP]
,"In my new, more colorful life, I smiled at the spring sunshine peeking through the trees, gazed up at the column of summer clouds, enjoyed the piles of fallen leaves in autumn, and played in the winter snow the few times it did fall.","In my new, more colorful life, I smiled at the spring sunshine peeking through the trees, gazed up at the column of summer clouds, enjoyed the piles of fallen leaves in autumn, and played in the winter snow the few times it did fall. "," In my new, more colorful life, I smiled at the spring sunshine peeking through the trees, gazed up at the column of summer clouds, enjoyed the piles of fallen leaves in autumn, and played in the winter snow the few times it did fall.",彩を得た我が日々は、春の木漏れ日に笑い、夏に入道雲を見上げ、秋には落ちる木の葉を愛で、冬は稀なる雪化粧を楽しむ。,[=JP],"В своей новой, более яркой жизни, я улыбалась весеннему солнцу, выглядывающему из‐за деревьев, смотрела на шествие летних облаков, радовалась кучкам опавших осенних листьев и изредка играла с зимним снегом, когда он выпадал.","Meu cotidiano foi se matizando; eu sorria para o sol de primavera que espreitava entre as árvores, observava as cúmulo‐nimbo de verão, apreciava as folhas de outono que se empilhavam e brincava na neve durante as ocasiões em que ela caía.",[=UP],於獲得了色彩的我的生活中，春天笑對從樹梢間射下的陽光，夏天仰望天空的積雨雲，秋天喜愛翩翩落葉，冬天欣賞罕見的素裹銀裝。,于获得了色彩的我的生活中，春天笑对从树梢间射下的阳光，夏天仰望天空的积雨云，秋天喜爱翩翩落叶，冬天欣赏罕见的素裹银装。,[=UP],[=UP],[=UP]
,"As these days passed one after another, there was a considerable change to my environment.","As these days passed one after another, there was a considerable change to my environment. "," As these days passed one after another, there was a considerable change to my environment.",そんな日々が繰り返されるうちに、決して小さくない環境の変化が重なっていった。,[=JP],"Пока дни летели один за другим, окружающая меня обстановка значительно изменилась.","Conforme esses dias passavam um após o outro, uma considerável mudança ocorreu em meu ambiente.",[=UP],在日復一日地過著這樣的生活的同時，我所處的環境有了個不算小的變化。,在日复一日地过着这样的生活的同时，我所处的环境有了个不算小的变化。,[=UP],[=UP],[=UP]
,That was a complete rotation in the servants from the Gospel House.,The servants coming from the Fukuin House had switched. , The servants coming from the Fukuin House had switched.,それは、福音の家より来た使用人たちの入れ替わりである。,[=JP],"Поменялись слуги, приходящие из Дома Фукуин.",Houve uma rotação completa dentre os serviçais da Casa Fukuin.,[=UP],而這變化，即是來自福音之家的傭人們的更替。,而这变化，即是来自福音之家的佣人们的更替。,[=UP],[=UP],[=UP]
,"There weren't specific grades like in school, so there was no rule saying how long a servant could work before quitting.","There weren't specific grades like in school, so there was no rule saying how long a servant could work before quitting. "," There weren't specific grades like in school, so there was no rule saying how long a servant could work before quitting.",学校のように学年があるわけではないので、誰が何年で辞めると、厳密に決まっているわけではない。,[=JP],"Здесь не было конкретных классов, как в школе, поэтому не было и правила о том, сколько слуга может работать, прежде чем уволиться.","Não haviam séries específicas como na escola, por isso não havia regras sobre quanto tempo um serviçal poderia trabalhar antes de ir embora.",[=UP],因為不是像學校那樣有學年，所以並沒有嚴格細致地規定，誰誰誰幹多少年後就離開。,因为不是像学校那样有学年，所以并没有严格细致地规定，谁谁谁干多少年后就离开。,[=UP],[=UP],[=UP]
,"Each servant made their own decision about when they would ""graduate"" from Rokkenjima.","Each servant made their own decision about when they would ""graduate"" from Rokkenjima. ", Each servant made their own decision about when they would 'graduate' from Rokkenjima.,何年で六軒島を“卒業”するかは、使用人たち個々人と環境が判断することなのである。,[=JP],"Каждый служащий принимал собственное решение по поводу того, когда ему 'выпуститься' с Роккенджимы.","Cada serviçal tomava a sua própria decisão sobre quando iria se ""graduar"" de Rokkenjima.",[=UP],要待幾年才從六軒島“畢業”，是根據傭人們每一個個人與環境判斷的。,要待几年才从六轩岛“毕业”，是根据佣人们每一个个人与环境判断的。,[=UP],[=UP],[=UP]
,Some of those who couldn't stand the environment would quit in as little as three days.,Some of those who couldn't stand the environment would quit in as little as three days. , Some of those who couldn't stand the environment would quit in as little as three days.,よほど環境が合わない使用人なら、来て３日ともたない者もいる。,[=JP],"Некоторые из тех, кто не выдерживал окружающей обстановки, уходили дня через три.",Alguns dos serviçais que não conseguiam suportar o ambiente abandonavam após três dias.,[=UP],如果是相當不適合這個環境的傭人，也有來了 3 天不到就走了的。,如果是相当不适合这个环境的佣人，也有来了 3 天不到就走了的。,[=UP],[=UP],[=UP]
,"After all, life on Rokkenjima was strict.","After all, life on Rokkenjima was strict. "," After all, life on Rokkenjima was strict.",何しろ、六軒島での生活は厳しい。,[=JP],Всё‐таки жизнь на Роккенджиме была строгой.,"Afinal, a vida em Rokkenjima era rigorosa.",[=UP],畢竟，六軒島的生活管得很嚴。,毕竟，六轩岛的生活管得很严。,[=UP],[=UP],[=UP]
,"It was also strict in the Gospel House, of course, but there were a lot of Rokkenjima‐only rules, and Natsuhi, the one who supervised the servants, was also very authoritarian. It was probably easy to feel constrained.","It was also strict in the Fukuin House, of course, but there were a lot of Rokkenjima-only rules, and Natsuhi, the one who supervised the servants, was also very authoritarian. It was probably easy to feel trapped. "," It was also strict in the Fukuin House, of course, but there were a lot of Rokkenjima-only rules, and Natsuhi, the one who supervised the servants, was also very authoritarian. It was probably easy to feel constrained.",福音の家ももちろん厳しいが、六軒島ならではの決まりごとも多く、使用人たちを統括する夏妃の指導も厳しい。窮屈に感じることも多いだろう。,[=JP],"Разумеется, строгость присутствовала и в Доме Фукуин, но на Роккенджиме было много уникальных правил, и Нацухи, контролирующая слуг, тоже была очень авторитарной. Можно было запросто почувствовать себя ограниченными.","Também era rigorosa na Casa Fukuin, mas haviam muitas regras específicas em Rokkenjima, e a Natsuhi, aquela que supervisionava os serviçais, também era muito autoritária. Certamente era fácil se sentir desconfortável.",[=UP],雖然福音之家當然也很嚴，但此地有很多“在六軒島就得怎麼怎麼樣”的規矩，統領全體傭人的夏妃的教導也很嚴厲。他們是常常感到不自由吧。,虽然福音之家当然也很严，但此地有很多“在六轩岛就得怎么怎么样”的规矩，统领全体佣人的夏妃的教导也很严厉。他们是常常感到不自由吧。,[=UP],[=UP],[=UP]
,That constrained feeling and the money sat on opposite sides of the scale that they used to decide the time of their graduation.,That trapped feeling and the money sat on opposite sides of the scale that they used to decide the time of their graduation. , That constrained feeling and the money sat on opposite sides of the scale that they used to decide the time of their graduation.,その窮屈さと給金を秤に掛け、彼らは自ら、卒業の時期を判断するのである。,[=JP],"Чувство ограниченности и деньги лежат на противоположных сторонах весов, по которым определяют время выпуска.",Aquele sentimento desconfortável e o dinheiro sentavam em lados opostos de uma balança que eram usada para determinar o momento de suas graduações.,[=UP],通過權衡這份不自由與薪水孰輕孰重，他們自己判斷什麼時候畢業。,通过权衡这份不自由与薪水孰轻孰重，他们自己判断什么时候毕业。,[=UP],[=UP],[=UP]
,"And sometimes, someone from the Ushiromiya family would use their influence to secure someone a new job, encouraging them to spread their wings and start a new life.","And sometimes, someone from the Ushiromiya family would use their influence to secure someone a new job, encouraging them to spread their wings and start a new life. "," And sometimes, someone from the Ushiromiya family would use their influence to secure someone a new job, encouraging them to spread their wings and start a new life.",また、時には右代宮家の方から、就職先の斡旋があり、新しいステージへ羽ばたくよう勧められることもある。,[=JP],"А иногда семья Уширомия с помощью своего влияния обеспечивает кого‐нибудь новой работой, призывая расправить крылья и начать новую жизнь.","E, algumas vezes, alguém da família Ushiromiya usava sua influência para garantir um novo trabalho a um serviçal, encorajando‐o a abrir suas asas e começar uma nova vida.",[=UP],另外，有時也是會發生，由右代宮家幫忙介紹工作，被勸去在新的舞台展翅翱翔的事的。,另外，有时也是会发生，由右代宫家帮忙介绍工作，被劝去在新的舞台展翅翱翔的事的。,[=UP],[=UP],[=UP]
,The cycle usually lasted two or three years.,The cycle usually lasted two or three years. , The cycle usually lasted two or three years.,そのサイクルは、大抵は２〜３年程度。,[=JP],Цикл обычно длился два или три года.,O ciclo normalmente dura dois ou três anos.,[=UP],這一循環，大多都在 2 到 3 年左右。,这一循环，大多都在 2 到 3 年左右。,[=UP],[=UP],[=UP]
,"No one decided this, but it was one of the goals most servants shot for, an unspoken rule.","No one decided this, but it was one of the goals most servants shot for, an unspoken rule. "," No one decided this, but it was one of the goals most servants shot for, an unspoken rule.",誰が決めたわけではないが、それが彼らの勤続の、一つの目標であり、暗黙のルールとなっていた。,[=JP],"Никто так не решал, но такова была цель большинства слуг, негласное правило.","Ninguém decidia isso, mas era o objetivo pelo qual a maior parte dos serviçais visava — uma regra não mencionada.",[=UP],雖說並不是通過誰誰誰確定的，但這也成為了他們繼續工作的一個目標，一條默認的規矩。,虽说并不是通过谁谁谁确定的，但这也成为了他们继续工作的一个目标，一条默认的规矩。,[=UP],[=UP],[=UP]
,"However, I was an exception to that rule.","However, I was an exception to that rule. "," However, I was an exception to that rule.",しかし、我はそのルールからも外れていた。,[=JP],Однако я была исключением из этого правила.,"Entretanto, eu fui a exceção dessa regra.",[=UP],然而，我卻把這條規矩也給破了。,然而，我却把这条规矩也给破了。,[=UP],[=UP],[=UP]
,I continued to live as a servant while going to school in Niijima......,I continued to go to school on Niijima while still living as a servant... , I continued to go to school in Niijima while still living as a servant...,未だ、新島の学校に通い続けながら、使用人生活を続けている……。,[=JP],"Я продолжала ходить в школу на Нииджиме, по‐прежнему живя как слуга...",Continuei a viver como serviçal enquanto frequentava a escola em Niijima......,[=UP],至今仍，邊去新島的學校上學，邊繼續過著傭人的生活……。,至今仍，边去新岛的学校上学，边继续过着佣人的生活……。,[=UP],[=UP],[=UP]
,"That year, all of the Gospel House servants quit at once.","That year, all of the Fukuin House servants quit at once. "," That year, all of the Fukuin House servants quit at once.",その年、ごっそりと福音の家の使用人たちが辞めることとなった。,[=JP],В этом году все слуги Дома Фукуин уволились одновременно.,"Naquele ano, todos os serviçais da Casa Fukuin foram embora ao mesmo tempo.",[=UP],這一年，一個不剩地，福音之家的傭人們全都決定了辭職。,这一年，一个不剩地，福音之家的佣人们全都决定了辞职。,[=UP],[=UP],[=UP]
,It wasn't at all rare for friends to quit at the same time as each other.,It wasn't at all rare for friends to quit at the same time as each other. , It wasn't at all rare for friends to quit at the same time as each other.,仲の良い使用人たちが、連れ立って同時に辞めることは珍しくなかった。,[=JP],Друзья не впервые увольняются в одно и то же время.,Não era incomum que amigos decidissem ir embora ao mesmo tempo.,[=UP],關係好的傭人一起同時辭職，倒也不是少見的事。,关系好的佣人一起同时辞职，倒也不是少见的事。,[=UP],[=UP],[=UP]
,"All of my fellow servants from the Gospel House graduated from the island at once, leaving only me behind...","All of my fellow servants from the Fukuin House graduated from the island at once, leaving only me behind... "," All of my fellow servants from the Fukuin House graduated from the island at once, leaving only me behind...",我だけを残し、福音の家から来た仲間たちは一斉に、この島から卒業していった…。,[=JP],"Все мои коллеги из Дома Фукуин разом выпустились с острова, оставив только меня...","Todos os serviçais da Casa Fukuin que me faziam companhia se graduaram da ilha ao mesmo tempo, deixando‐me para trás...",[=UP],只留下了我一人，來自福音之家的伙伴們，一起從這個島畢業了…。,只留下了我一人，来自福音之家的伙伴们，一起从这个岛毕业了…。,[=UP],[=UP],[=UP]
,"Of course, I hadn't been on particularly good terms with them.","Of course, I wasn't on particularly good terms with them. "," Of course, I wasn't on particularly good terms with them.",我は、別に彼らと仲が良かったわけではない。,[=JP],"Разумеется, у меня с ними были не очень хорошие взаимоотношения.","É claro, não era como se eu tivesse uma boa relação com eles.",[=UP],我和他們的關係稱不上好。,我和他们的关系称不上好。,[=UP],[=UP],[=UP]
,"On the contrary, it was annoying to be treated like a kid and called Yasu all the time.","On the contrary, it was annoying to be treated like a kid and called Yasu all the time. "," On the contrary, it was annoying to be treated like a kid and called Yasu all the time.",むしろ、ヤスヤスと呼ばれ、いつまで経っても半人前扱いだったので、不愉快なくらいだった。,[=JP],"Напротив, раздражало то, что они обращались со мной как с ребёнком и всё время называли Ясу.","Pelo contrário, tê‐los me tratando como criança e me chamando de Yasu o tempo todo era bem incômodo.",[=UP],不如說，由於老被“小安小安”地叫，無論過多久都還被當成半桶水，所以我都覺得他們挺討厭的了。,不如说，由于老被“小安小安”地叫，无论过多久都还被当成半桶水，所以我都觉得他们挺讨厌的了。,[=UP],[=UP],[=UP]
,"Even when new servants had joined, the older ones got them believing that ""Yasu loses things all the time"", so things had still been unpleasant even then.","Though some new servants had come after me, the older ones had already gotten them believing that ""Yasu loses things all the time"", so it wasn't really any more pleasant to have new comrades. "," Even though some new servants had come after me, the older ones had already gotten them believing that 'Yasu loses things all the time', so it wasn't really any more pleasant to have new comrades.",せっかく後輩が入ってきても、先輩たちが私のことを、ヤスはよく物をなくして云々と吹き込んだため、新しい仲間が来ても不愉快なままだったのだ。,[=JP],"Хотя некоторые слуги пришли после меня, старшие уже заверили их, что 'Ясу вечно всё теряет', поэтому заводить новых товарищей было не так уж и приятно.","Sempre que novos serviçais se juntavam, os mais velhos os faziam acreditar que ""Yasu perde as coisas toda hora"", por isso as coisas continuaram desagradáveis mesmo depois de tudo.",[=UP],哪怕難得有後輩進府，因為前輩們會對新人灌輸些，“小安常把東西搞丟”什麼的，所以即便來了新伙伴，我也依舊高興不起來。,哪怕难得有后辈进府，因为前辈们会对新人灌输些，“小安常把东西搞丢”什么的，所以即便来了新伙伴，我也依旧高兴不起来。,[=UP],[=UP],[=UP]
,"Those unpleasant older servants, as well as the ones who started at the same time or after I did, all quit at once.","Those unpleasant older servants, as well as the ones who started at the same time or after I did, all quit at once. "," Those unpleasant older servants, as well as the ones who started at the same time or after I did, all quit at once.",その、不愉快な先輩も同輩も後輩も、一度に辞めることとなった。,[=JP],"Неприятные старшие слуги, а также те, кто пришёл одновременно со мной или после меня, уволились все вместе.","Aqueles desagradáveis serviçais mais velhos, bem como aqueles que começaram ao mesmo tempo ou depois de mim, foram embora juntos.",[=UP],這群令人不快的前輩、同輩、後輩，一股腦地全都決定了辭職。,这群令人不快的前辈、同辈、后辈，一股脑地全都决定了辞职。,[=UP],[=UP],[=UP]
,The Ushiromiya family had no quarrel with those who left. Adult servants were easier to handle in the first place.,The Ushiromiya family made no effort to stop them from leaving. Adult servants were easier to handle in the first place. , The Ushiromiya family had no quarrel with those who left. Adult servants were easier to handle in the first place.,右代宮家は去る者を追わない。そもそも、使用人としては、大人の方が使いやすい。,[=JP],"Семья Уширомия не ссорилась с теми, кто уходил. Во‐первых, со взрослыми слугами проще.","A família Ushiromiya não discutia com aqueles que iam embora. Primeiro de tudo, porque os serviçais mais adultos eram mais fáceis de se lidar.",[=UP],右代宮家是不會去追回要走的人的。說到底，作為傭人來說，比起他們，成年人要好使喚得多。,右代宫家是不会去追回要走的人的。说到底，作为佣人来说，比起他们，成年人要好使唤得多。,[=UP],[=UP],[=UP]
,The Gospel House servants were only accepted so that they could be trained.,The Fukuin House servants were only accepted so that they could be trained. , The Fukuin House servants were only accepted so that they could be trained.,あくまでも福音の家の使用人は、研修として受け容れているだけだ。,[=JP],Слуг Дома Фукуин принимали только ради обучения.,Os serviçais da Casa Fukuin só eram aceitos para que pudessem ser treinados.,[=UP],右代宮家至多不過是在以培訓的形式，接收福音之家的傭人而已。,右代宫家至多不过是在以培训的形式，接收福音之家的佣人而已。,[=UP],[=UP],[=UP]
,"So, all of the servants except for me left, and no one tried to stop them......","And so, all of the servants besides me left, and no one tried to stop them... "," So, all of the other servants left, and no one tried to stop them......",だから、誰も引き止めず、私以外の使用人たちは、一度に辞めた……。,[=JP],"Все другие слуги уходили, и никто их не останавливал......","Por isso, todos os serviçais além de mim foram embora, e ninguém tentou pará‐los......",[=UP],所以，沒有人挽留，除我以外的傭人們，一股腦地全都不幹了……。,所以，没有人挽留，除我以外的佣人们，一股脑地全都不干了……。,[=UP],[=UP],[=UP]
,"""Later, Yasu. Don't go losing stuff again.""","""Later, Yasu. Don't go losing stuff again."" ",[=UP],「じゃーね、ヤス。あんた、物を無くしたりするんじゃないわよ。」,「じゃーね、ヤス。あんた、物を無くしたりするんじゃないわよ」,"""Пока, Ясу. Больше ничего не теряй.""","""Tchau, Yasu. Não vá perder as coisas de novo.""",[=UP],「再見咯，小安。你啊，可別再時不時地搞丟東西了哦。」,「再见咯，小安。你啊，可别再时不时地搞丢东西了哦。」,[=UP],[=UP],[=UP]
,"""......I don't lose things anymore.""","""...I don't lose things anymore."" ",[=UP],「……もう、無くしたりなんかしてません。」,「……もう、無くしたりなんかしてません」,"""......Я и не теряю.""","""......Eu não perco mais as coisas.""",[=UP],「……我已經，再也不會搞丟東西了。」,「……我已经，再也不会搞丢东西了。」,[=UP],[=UP],[=UP]
,"""Hmph, later. Make sure you listen to what Madam says. Don't you go troubling the next group of servants.""","""Hmph, later. Make sure you listen to what Madam says. Don't you go troubling the next group of servants."" ",[=UP],「ふんっ。じゃーね。奥様の言うこと、よく聞くのよ。後から来る仲間に迷惑掛けるんじゃないわよ。」,「ふんっ。じゃーね。奥様の言うこと、よく聞くのよ。後から来る仲間に迷惑掛けるんじゃないわよ」,"""Хмф, пока. Обязательно слушай, что говорит мадам. Не причиняй беспокойства следующей группе слуг.""","""Hmph, tchau. Trate de ouvir o que a madame diz. Não cause problemas para a próxima leva de serviçais.""",[=UP],「哼，再見了。好好聽太太的話。可別給後進府的伙伴添麻煩喲。」,「哼，再见了。好好听太太的话。可别给后进府的伙伴添麻烦哟。」,[=UP],[=UP],[=UP]
,"""......You know, it's still a mystery. Why did someone recommend Yasu?""","""...You know, it's still a mystery. Why was Yasu recommended for this job?"" ",[=UP],「……未だに謎よね。どうしてヤスはここに推薦されたの？」,[=JP],"""......А ведь это по‐прежнему загадка. Почему Ясу порекомендовали?""","""......Sabe, ainda é um mistério. Por que alguém recomendou Yasu?""",[=UP],「……直到現在都是個謎呢。為什麼，小安會被推薦來這？」,「……直到现在都是个谜呢。为什么，小安会被推荐来这？」,[=UP],[=UP],[=UP]
