{f:5:Beatrice},"""Whoops, that's no good. If the whole ring disappears, my friend will be suspected again. ......All we need to disappear is......yes, just the key to this room.""","""Whoops, that won't do. If the whole ring disappears, my friend will be suspected again. ...All we need... yes, we just need the key to this room to disappear."" ","""Whoops, that's no good. If the whole ring disappears, my friend will be suspected again. ......All we need... yes, we just need the key to this room to disappear.""",「おっと、いけないいけない。鍵束ごと無くしては、また我が友が疑われてしまうな。……いなくなるのは、……そう、この部屋の鍵だけで良い。」,「おっと、いけないいけない。鍵束ごと無くしては、また我が友が疑われてしまうな。……いなくなるのは、……そう、この部屋の鍵だけで良い」,"""Упс, не пойдёт. Если исчезнет всё кольцо, мою подругу опять заподозрят. ......Нам нужно лишь... Да, нам нужно чтобы исчез ключ от этой комнаты.""","""Ops, não posso fazer assim. Se o chaveiro inteiro desaparecer, vão suspeitar de você de novo. ......Tudo que precisamos fazer desaparecer é......sim, apenas a chave este quarto.""",[=UP],「喔唷，糟糕糟糕。若將整串鑰匙都變沒了，那就又會令吾友受懷疑了。……即將無影無踪的，……對，就僅限於這房間的鑰匙好了。」,「喔唷，糟糕糟糕。若将整串钥匙都变没了，那就又会令吾友受怀疑了。……即将无影无踪的，……对，就仅限于这房间的钥匙好了。」,[=UP],[=UP],[=UP]
,"Beato controlled my fingers, controlling the magic. ......And thereby controlling the keys.","Beato controlled my fingers, controlling the magic. ...And thereby controlling the keys. ","Beato controlled my fingers, controlling the magic. ...And thereby controlling the keys.",ベアトが私の指を操り、魔力を操る。……そして鍵束を操る。,[=JP],"Беато управляла моими пальцами, контролируя магию... и тем самым управляя ключами.","A Beato controlou meus dedos, controlou a magia. ......E, consequentemente, controlou as chaves.",[=UP],貝阿朵操縱著我的手指，施展魔力。……然後再操縱鑰匙串。,贝阿朵操纵着我的手指，施展魔力。……然后再操纵钥匙串。,[=UP],[=UP],[=UP]
,"The key ring slumped down on the bed, .........and then just the mansion's master key stood on end.","The key ring slumped down on the bed, ...and then just the mansion's master key stood on end. "," The key ring slumped down on the bed, ......and then just the mansion's master key stood on end.",鍵束はくたりと、潰れて倒れ、………その中の屋敷のマスターキーだけが、再びひょっこりと起き上がった。,[=JP],Кольцо для ключей упало на кровать...... и универсальный ключ особняка встал на конец.,"O chaveiro caiu sobre a cama, .........e apenas a chave mestra da mansão foi removida.",[=UP],鑰匙串無力地癱倒，………唯獨這之中的大屋的總鑰匙，忽然重新仰起了身來。,钥匙串无力地瘫倒，………唯独这之中的大屋的总钥匙，忽然重新仰起了身来。,[=UP],[=UP],[=UP]
{f:5:Beatrice},"""Well now, what shall I do with this? ......Just erasing it would be terribly dull. So, ............*cackle*cackle*! Why don't I throw it into her locker?! That way, I'll give my friend, who's been working here with her the whole time, a perfect alibi!""","""Well now, what shall I do with this? ...Merely erasing it would be quite boring. So, ......*cackle*cackle*! Why don't I throw it into her locker?! That will give my friend, who's been working here with her the whole time, a splendid alibi!"" ","""Well now, what shall I do with this? ......Just erasing it would be so boring. So, ............*cackle*cackle*! Why don't I throw it into her locker?! That way, I'll give my friend, who's been working here with her the whole time, a perfect alibi!""",「さぁて、この鍵をどうしてやろうか。……ただ消し去るだけではつまらぬというもの。ならば………、……くっくくくく！　そやつのロッカーにでも放り込んでおくか！　これならば、ずっと一緒にここで掃除をしている我が友にはアリバイがあるというもの！」,[=JP],"""Что бы мне с ним сделать?........Просто стереть будет слишком скучно. Поэтому.........*хе‐хе*хе‐хе*! Почему бы мне не бросить его в её шкафчик?! Так я дам своей подруге, всё время работавшей с ней, идеальное алиби!""","""Certo, o que devemos fazer com isto? ......Simplesmente sumir com ela seria muito chato. Então, ............*gargalhada*gargalhada*! Por que eu não jogo no armário dela?! Dessa forma, eu darei a você, quem esteve trabalhando com ela o tempo inteiro, um álibi perfeito!""",[=UP],「來——來，要怎麼處置這把鑰匙呢？……只是把它變沒，就有點無趣了。那麼………，……呵、呵呵呵呵！就把它扔到那傢伙的儲物櫃之中吧！這樣一來，一直都跟她一起在這打掃的吾友就有不在場證明了！」,「来——来，要怎么处置这把钥匙呢？……只是把它变没，就有点无趣了。那么………，……呵、呵呵呵呵！就把它扔到那家伙的储物柜之中吧！这样一来，一直都跟她一起在这打扫的吾友就有不在场证明了！」,[=UP],[=UP],[=UP]
{f:5:Beatrice},"""Come, try to remember. Where have you been sleeping?! Yes, it was a warm, dark place...""","""Come, try and remember. Where have you been sleeping?! Yes, it was a warm, dark place..."" ","""Come, try and remember. Where have you been sleeping?! Yes, it was a warm, dark place...""",「さぁさ、思い出してご覧なさい。そなたがどこで眠っていたのやら！　そう、そこは温かくて暗い場所…。」,「さぁさ、思い出してご覧なさい。そなたがどこで眠っていたのやら！　そう、そこは温かくて暗い場所…」,"""Ну же, вспомни. Где ты был?! Да, в тёплом, тёмном месте...""","""Vamos, busque recordar. Onde esteve dormindo?! Sim, era um lugar escuro e caloroso...""",[=UP],「來——來，想起來吧。汝原本沉睡於何處！對，那是個溫暖且陰暗之所…」,「来——来，想起来吧。汝原本沉睡于何处！对，那是个温暖且阴暗之所…」,[=UP],[=UP],[=UP]
{f:5:Beatrice},"""The inside of Belne's locker!! *cackle*cackle*cackle*!!""","""The inside of Belne's locker!! *cackle*cackle*cackle*!!"" ","""The inside of Berune's locker!! *cackle*cackle*cackle*!!""",「鐘音のロッカーの中であるわ！！　くっくくくくくく！！」,[=JP],"""В шкафчике Вельне!!! *хи‐хи*хи‐хи*хи‐хи*!""","""Dentro do armário da Berune!! *gargalhada*gargalhada*gargalhada*!!""",[=UP],「是在鐘音的儲物櫃之中哦！！呵、呵呵呵呵呵呵！！」,「是在钟音的储物柜之中哦！！呵、呵呵呵呵呵呵！！」,[=UP],[=UP],[=UP]
,"When Beato snapped her fingers, the key burst and became a gold butterfly.","When Beato snapped her fingers, the key burst and became a gold butterfly. ",[=UP],ベアトが指を鳴らすと、鍵はポンと爆ぜて、黄金の蝶に姿を変える。,[=JP],"Когда Беато щёлкнула пальцами, ключ вспыхнул и стал золотой бабочкой.","Quando a Beato estalou seus dedos, a chave explodiu e se tornou uma borboleta dourada.",[=UP],貝阿朵打了一個響指，鑰匙“嘭”地爆炸，變成了黃金蝶。,贝阿朵打了一个响指，钥匙“嘭”地爆炸，变成了黄金蝶。,[=UP],[=UP],[=UP]
,......A gold butterfly...?,...A gold butterfly...? ,......A gold butterfly...? ,……黄金の蝶…？,[=JP],......Золотой бабочкой?..,......Uma borboleta dourada...?,[=UP],……黃金蝶…？,……黄金蝶…？,[=UP],[=UP],[=UP]
,"I see, it's gold because she's the Golden Witch, who gave the Master all of his gold.","I see, it's gold because she's the Golden Witch, who gave the Master all of his gold. ",[=UP],そうか、お館様に黄金を授けた黄金の魔女だから、黄金なのか。,[=JP],"Вот как, золотой потому, что она Золотая ведьма, давшая Господину всё его золото.","Entendi, é dourada porque ela é a Bruxa Dourada, aquela que concedeu ao Mestre todo o seu ouro.",[=UP],是麼，因為是授予老爺黃金的黃金的魔女，所以是黃金麼？,是么，因为是授予老爷黄金的黄金的魔女，所以是黄金么？,[=UP],[=UP],[=UP]
,"And butterflies are scared of spiderwebs. ......So, it's a gold butterfly.","And butterflies are scared of spiderwebs. ...So, it's a gold...butterfly. "," And butterflies are scared of spiderwebs. ......So, it's a gold butterfly.",そして、蜘蛛の糸を嫌がるのは蝶。……だから、黄金の、蝶。,[=JP],А бабочки боятся паутины. ......Поэтому золотая бабочка.,E borboletas têm medo de teias de aranha. ......Por isso é uma borboleta dourada.,[=UP],而怕蛛絲的是，蝴蝶。……所以是，金色的，蝴蝶。,而怕蛛丝的是，蝴蝶。……所以是，金色的，蝴蝶。,[=UP],[=UP],[=UP]
,The minions of the witch {f:5:Beatrice}...are gold butterflies......,The minions of the witch {f:5:Beatrice}...are gold butterflies... , The minions of the witch Beatrice...are gold butterflies...,黄金の蝶は、魔女ベアトリーチェの、眷属なのだ……。,[=JP],Спутники ведьмы {f:5:Беатриче} — золотые бабочки...,Os servos da bruxa {f:5:Beatrice}...são borboletas douradas......,[=UP],黃金蝶，乃是魔女貝阿朵莉切的眷屬……。,黄金蝶，乃是魔女贝阿朵莉切的眷属……。,[=UP],[=UP],[=UP]
,"After flitting into the air, it burst into a shower of gold sparks and disappeared.","After flitting into the air, it burst into a shower of gold sparks and disappeared. "," After flitting into the air, it burst into a shower of gold sparks and disappeared.",ふわりと、空中を舞った後、ポンと黄金の鱗粉を弾けさせて消える。,[=JP],"Пропорхав, она вспыхнула в золотых искрах и исчезла.","Após esvoaçar e dançar pelo ar, com um *plop*, ela explodiu em douradas escamas e desapareceu.",[=UP],它在空中輕飄飄地飛舞了片刻後，“嘭”地四濺出黃金的鱗粉，消失了。,它在空中轻飘飘地飞舞了片刻后，“嘭”地四溅出黄金的鳞粉，消失了。,[=UP],[=UP],[=UP]
,"Then, the vanished key......went to Belne‐san's locker......","And then, the vanished key...was in Belne-san's locker... "," Then, the vanished key......went to Berune-san's locker......",そして、消えた鍵は、……鐘音さんのロッカーの中に……。,[=JP],Затем пропавший ключ...... отправился в шкафчик Вельне......,"Então, a chave desaparecida......foi parar no armário da Berune‐san......",[=UP],接著，消失了的鑰匙，……出現在了鐘音的儲物櫃之中……。,接着，消失了的钥匙，……出现在了钟音的储物柜之中……。,[=UP],[=UP],[=UP]
,"Though it was far away, in the locker of a changing room, I had a vivid understanding of its new state.","Though it was far away, in a changing room locker, I could tell exactly how it had happened. "," Though it was far away, in a changing room locker, I could tell exactly how it had happened.",それはここではない、更衣室のロッカーの話なのに、その様子がありありと理解できた。,[=JP],"Хотя он далеко — в раздевалке со шкафчиками, — я знала, как всё было.","Embora estivesse muito longe, no armário do vestiário, eu tive um vívido entendimento de sua atual situação.",[=UP],儘管這是發生在並非此處的，更衣室的儲物櫃中的事，但我卻歷歷在目地清楚這副情形。,尽管这是发生在并非此处的，更衣室的储物柜中的事，但我却历历在目地清楚这副情形。,[=UP],[=UP],[=UP]
,"It wasn't by sight or by touch.{n}It was by some other sense inside my heart, which couldn't be explained by the five senses.{n}A completely new sensation that I'd never felt before.","It wasn't by sight or by touch. It was by some other sense inside my heart, which couldn't be explained by the five senses. A completely new sensation that I'd never felt before. "," It wasn't by sight or by touch. It was by some other sense inside my heart, which couldn't be explained by the five senses. A completely new sensation that I'd never felt before.",それは、視覚でも感触でもない。五感では説明の出来ない、心の中のもう一つの感触。今日までに一度も感じたことのない、まったく新しい感触。,それは、視覚でも感触でもない。{n}五感では説明の出来ない、心の中のもう一つの感触。{n}今日までに一度も感じたことのない、まったく新しい感触。,"Не по взгляду или на ощупь.{n}В моей душе было другое ощущение, не объяснимое пятью чувствами.{n}Абсолютно новое ощущение, которое я никогда раньше не испытывала.","Não foi por ter visto ou tocado.{n}Foi por causa de um outro sentido dentro do meu coração, o qual não poderia ser explicado pelos cinco sentido.{n}Uma sensação completamente nova na qual eu nunca tinha sentido antes.",[=UP],這既不屬於視覺，也不屬於觸覺。{n}它是以五感無法解釋的，存在於心中的另一種感觸。{n}直到今天為止一次都未感到過的，全新的感觸。,这既不属于视觉，也不属于触觉。{n}它是以五感无法解释的，存在于心中的另一种感触。{n}直到今天为止一次都未感到过的，全新的感触。,[=UP],[=UP],[=UP]
,It was the completely alien concept...called magic.{n}A completely unknown pleasure that left me in a trance.,It was the completely alien concept...called magic. A completely unknown pleasure that left me in a trance. , It was the completely alien concept...called magic. A completely unknown pleasure that left me in a trance.,つまり、魔法という、まったくの未知の概念。恍惚とする他ない、まったくの未知の、快楽。,つまり、魔法という、まったくの未知の概念。{n}恍惚とする他ない、まったくの未知の、快楽。,"Совершенно чужеродное понятие... под названием магия.{n}Совершенно неведомое удовольствие, погрузившее меня в транс.",Um conceito completamente alienígena...chamado magia.{n}Um prazer completamente desconhecido que me deixou em transe.,[=UP],總而言之，即是名為魔法的、完全未知的概念。{n}除去心醉神迷，什麼都做不了的，完全未知的快感。,总而言之，即是名为魔法的、完全未知的概念。{n}除去心醉神迷，什么都做不了的，完全未知的快感。,[=UP],[=UP],[=UP]
{f:5:Beatrice},"""......It is done, my friend. I shall return this body to you...""","""...That's enough, my friend. I'll give this body back to you..."" ","""......That's enough, my friend. I'll give this body back to you...""",「……もう良いぞ、我が友よ。この体、そなたに返すぞ…。」,「……もう良いぞ、我が友よ。この体、そなたに返すぞ…」,"""......Всё, друг мой. Возвращаю тебе твоё тело...""","""......Está feito, camarada. Devo agora devolver este corpo a você...""",[=UP],「……已經好了哦，吾友喲。把這軀體，還給汝…」,「……已经好了哦，吾友哟。把这躯体，还给汝…」,[=UP],[=UP],[=UP]
,"Nn, ..................ah......","Nng, ......ah... ","Nn, .........ah......",ん、………………ぁ……。,[=JP],Н‐н......... a......,[=UP],[=UP],嗯，………………啊……。,[=CHT],[=UP],[=UP],[=UP]
,"""...........................""","""............"" ","""............""",「………………………。」,「………………………」,[=OG],[=UP],[=UP],[=JPC],[=JPC],[=UP],[=UP],[=UP]
,"It felt as though I had been spinning through space, and gravity had suddenly come back and thrown me to the ground.",It felt as though I had been spinning through space... until gravity suddenly came back and threw me to the ground. ,It felt as though I had been spinning through space until gravity suddenly came back and threw me to the ground.,つい先ほどまで宙を舞っていた自分が、唐突に浮力を失い、床にストンと落とされたような気持ち。,[=JP],"Меня словно вращали в пространстве, пока тяжесть вдруг не вернулась и не сбросила меня на пол.","Eu senti como se estivesse girando através do espaço e, abruptamente, a gravidade retornou a mim e me jogou contra o chão.",[=UP],這感覺就像，直到剛才還飄舞在半空中的自己，突然失去了浮力，撲通一聲，掉到地上。,这感觉就像，直到刚才还飘舞在半空中的自己，突然失去了浮力，扑通一声，掉到地上。,[=UP],[=UP],[=UP]
,"Like when you're having a great dream, but you're suddenly woken up, ......and all you can remember about the dream was that it was fun. ......That sort of lonely feeling.","Like when you're having a great dream, but you wake up suddenly, ...and all you remember about the dream was that it was fun. ...That sort of lonely feeling. "," Like when you're having a great dream, but you wake up suddenly, ......and all you remember about the dream was that it was fun. ......That sort of lonely feeling.",素敵な夢を見ていたのに、唐突に起こされてしまい、……しかも何の夢を見ていたのか、楽しかったことだけはわかるのに、思い出せないかのような、……そんな寂しさ。,[=JP],"Как когда видишь долгий сон, но вдруг просыпаешься...... и помнишь о сне лишь то, что он был весёлым. ......Одинокое чувство.","Assim como quando você está tendo um ótimo sonho, mas acaba acordando de repente, ......e tudo o que consegue lembrar é que o sonho era divertido. ......Esse tipo de sentimento solitário foi o que senti.",[=UP],其中帶有著一份，恰似“在正做著美夢時，被人突然叫醒，……而且只記得很開心，卻就是想不起做了什麼夢”般的，……淒涼。,其中带有着一份，恰似“在正做着美梦时，被人突然叫醒，……而且只记得很开心，却就是想不起做了什么梦”般的，……凄凉。,[=UP],[=UP],[=UP]
,"Though Beato had been borrowing my body, it was my own body that used magic.","Though Beato had been borrowing my body, it was my own body that used magic. "," Though Beato had been borrowing my body, it was my own body that used magic.",ベアトに体を奪われていたとはいえ、確かに私の体は魔法を使っていたのだ。,[=JP],"Хотя в меня вселилась Беато, использовала магию именно я.","Embora a Beato tivesse pegado meu corpo emprestado, era o meu próprio corpo quem estava usando aquela magia.",[=UP],雖說是被貝阿朵搶走了身體，但那時我的身體的確是施展了魔法。,虽说是被贝阿朵抢走了身体，但那时我的身体的确是施展了魔法。,[=UP],[=UP],[=UP]
,I could still feel that sensation in my hands.,I could still feel that sensation in my hands. , I could still feel that sensation in my hands.,まだ、両手にあの感触が残ってる。,[=JP],Я до сих пор чувствовала то ощущение в руках.,Eu ainda podia sentir aquela sensação em minhas mãos.,[=UP],我的雙手上，依舊留著那種感觸。,我的双手上，依旧留着那种感触。,[=UP],[=UP],[=UP]
,The key ring over there had danced along with the movements of my fingers.,The key ring over there had danced along with the movements of my fingers. , The key ring over there had danced along with the movements of my fingers.,私の指の動きにつられて、鍵束がそこでダンスを踊ったのだ。,[=JP],Кольцо для ключей кружило под движения моих пальцев.,O chaveiro que estivera dançando aos movimentos dos meus dedos.,[=UP],隨著我手指的動作，鑰匙串在那翩翩起舞。,随着我手指的动作，钥匙串在那翩翩起舞。,[=UP],[=UP],[=UP]
,"No, that's not quite it. The key ring and my fingers had danced together.","No, that's not quite it. The key ring and my fingers had danced together. "," No, that's not quite it. The key ring and my fingers had danced together.",いや違う。鍵束と、私の指が一緒に、ダンスを踊った。,[=JP],"Нет, не совсем. Ключи и мои пальцы кружились вместе.","Não, não foi exatamente isso. O chaveiro e meus dedos estavam dançando em conjunto.",[=UP],不、錯了。那是鑰匙串與我的手指，在一起翩翩起舞。,不、错了。那是钥匙串与我的手指，在一起翩翩起舞。,[=UP],[=UP],[=UP]
,"That fun, that excitement......still tingled slightly in my hands......","That fun, that excitement... ...still tingled slightly in my hands... "," That fun, that excitement......still tingled slightly in my hands...",その、楽しさ。わくわくが、……まだ、指にほのかに、残ってる……。,[=JP],"Это веселье, волнение...... ещё покалывало в руках...","Aquela diversão, aquela empolgação......ainda permaneceu formigando suavemente em minhas mãos......",[=UP],這份愉悅、興奮，……依舊，微微地留在我的手指上……。,这份愉悦、兴奋，……依旧，微微地留在我的手指上……。,[=UP],[=UP],[=UP]
,"""Whoops, that was close.""","""Whoops, that was close."" ",[=UP],「おっとー、いけないいけない。」,「おっとー、いけないいけない」,"""Ой, ещё бы немного.""","""Ops, foi por pouco.""",[=UP],「喔——唷，糟糕糟糕。」,[=CHT],[=UP],[=UP],[=UP]
,"Saying this, Belne‐san suddenly turned around and picked up the key ring she had thrown down on the bed.","Saying this, Belne-san suddenly turned around and picked up the key ring she had thrown down on the bed. ","Saying this, Berune-san suddenly turned around and picked up the key ring she had thrown down on the bed.",鐘音さんが唐突にそう言いながら振り返り、ベッドの上に投げ出した鍵束を引っ手繰る。,[=JP],"С этими словами Вельне вдруг повернулась и взяла кольцо для ключей, которое бросила на кровать.","Dizendo isso, a Berune‐san se virou de repente e pegou o chaveiro que ela havia jogado sobre a cama.",[=UP],鐘音突然邊這麼說著邊轉過頭來，一把搶走了被扔在床上的鑰匙串。,钟音突然边这么说着边转过头来，一把抢走了被扔在床上的钥匙串。,[=UP],[=UP],[=UP]
,She must have realized that I was staring at it.,She must have realized that I was staring at it. , She must have realized that I was staring at it.,私がじっとそれを見ていたことに気付いたらしい。,[=JP],"Должно быть, заметила, что я смотрю на него.",Ela deve ter percebido que eu estava olhando para ele.,[=UP],她好像是注意到，我在目不轉睛地盯著鑰匙串了。,她好像是注意到，我在目不转睛地盯着钥匙串了。,[=UP],[=UP],[=UP]
,"""Almost had Yasu complain that I shouldn't leave keys lying about like this. I'd never put something down and forget about it.""","""Almost had Yasu complain that I shouldn't leave keys lying about like this. I'd never put something down and forget about it."" ",[=UP],「まーたヤスに、鍵をこんなところに放り出さないでーって怒られるところでしたー。私、置きっ放しにして忘れたりなんかー、しませんからー。」,「まーたヤスに、鍵をこんなところに放り出さないでーって怒られるところでしたー。私、置きっ放しにして忘れたりなんかー、しませんからー」,"""Ясу чуть было не пожаловалась, что мне не следует вот так бросать ключи. Я бы ни за что не забыла о том, что положила.""","""Quase que Yasu já vem reclamar que eu não deveria deixar as chaves jogadas assim. Eu nunca colocaria algo em algum lugar e esqueceria.""",[=UP],「差點就又——要被小安訓，別把鑰匙扔在這種地方了——。我才——不會把東西一放就忘了呢——。」,「差点就又——要被小安训，别把钥匙扔在这种地方了——。我才——不会把东西一放就忘了呢——。」,[=UP],[=UP],[=UP]
