,"""I already told you!! The key really was there in the beginning! I was the one who unlocked that room! So it must have been there! ......And then, I went into the room! I'm an idiot who hates hearing the keys clattering around, so I placed the ring on the bed...!""","""I already told you!! The key really was there in the beginning! I was the one who unlocked that room! So it must have been there! ...And then, I went into the room! I'm stupid, and since I hate having the keys clattering around, I placed the ring on the bed...!"" ","""I already told you!! The key really was there in the beginning! I was the one who unlocked that room! So it must have been there! ......And then, I went into the room! I'm stupid, and since I hate having the keys clattering around, I placed the ring on the bed...!""",「だから言ってんじゃん！！ちゃんと鍵は最初あった！　あの部屋の鍵を開けたのは私！　だから絶対、鍵はあった！　……んで、部屋に入って！　私、馬鹿だから、鍵のジャラジャラが嫌いで、ひょいっとベッドの上に置いといた…！」,「だから言ってんじゃん！！　ちゃんと鍵は最初あった！　あの部屋の鍵を開けたのは私！　だから絶対、鍵はあった！　……んで、部屋に入って！　私、馬鹿だから、鍵のジャラジャラが嫌いで、ひょいっとベッドの上に置いといた…！」,"""Я же сказала!!! Сначала ключ был! Это я отперла комнату! Он должен был там быть!......Затем я вошла в комнату! Я тупая и ненавижу, когда ключи гремят, поэтому положила кольцо на кровать!..""","""Eu já disse!! A chave estava mesmo ali no começo! Fui eu quem destrancou a porta daquele quarto! Então só podia estar ali! ......E mais, eu entrei no quarto! Eu sou do tipo de idiota que odeia ouvir as chaves fazendo barulho, por isso coloquei o chaveiro em cima da cama...!""",[=UP],「我不都說了嘛！！剛開始時，是好好有著那把鑰匙的！那房間的門鎖，是我開的喲！所以，我絕對有那把鑰匙！……然後，進了房間！我是個笨蛋，因為不愛聽鑰匙“噌啷噌啷”的聲音，所以我就把它往床上隨便一放…！」,「我不都说了嘛！！刚开始时，是好好有着那把钥匙的！那房间的门锁，是我开的哟！所以，我绝对有那把钥匙！……然后，进了房间！我是个笨蛋，因为不爱听钥匙“噌啷噌啷”的声音，所以我就把它往床上随便一放…！」,[=UP],[=UP],[=UP]
,"""Then, when we finished cleaning, I picked up the ring, tried to lock the door, and it was gone! I may have turned my back on the ring, but it was right next to me! So, if someone tried to pull a prank by removing just one key, I'd have heard the clinking! And yet, just the key for that room vanished and appeared again in my locker!!""","""Then, when we finished cleaning, I picked up the ring, tried to lock the door, and it was gone! I may have turned my back on the ring, but it was right next to me! So, if someone tried to pull a prank by removing just one key, I'd have heard the clinking! And yet, just the key for that room vanished and appeared again in my locker!!"" ",[=UP],「それで掃除終わって、鍵束取って、施錠しようとしたらもうなかった！　背中を向けてはいたけれど、鍵のすぐ傍にいた！　だから、誰かが鍵を１本だけ抜くなんて悪戯をして、悠長にガチャガチャ言わせたらすぐわかる！　なのに、その部屋の鍵１本だけがすぅっと蒸発して、私のロッカーの中に！！」,[=JP],"""Потом, когда мы закончили уборку, я взяла его — хотела запереть дверь, а ключ пропал! Да, я отвернулась от кольца, но оно было совсем рядом! Если бы надо мной захотели подшутить, сняв только один ключ, я бы услышала звон! И всё равно ключ от комнаты испарился и появился в моём шкафчике!""","""Então, quando terminei a limpeza, eu peguei o chaveiro, tentei fechar a porta e vi que tinha sumido! Eu posso ter dado às costas para o chaveiro, mas ele estava pertinho de mim! Por isso, se alguém tentasse fazer uma pegadinha, removendo apenas uma chave, eu teria ouvido o barulho! Mesmo assim, apenas uma chave daquele quarto desapareceu e reapareceu no meu armário!!""",[=UP],「然後，等打掃完，拿起鑰匙串，想鎖門時，它就已經無影無踪了！儘管是在我背後，但我與鑰匙近在咫尺！所以，要是有誰在，惡作劇地抽出一把鑰匙，慢悠悠地把鑰匙串搞得“咔恰咔恰”地響的話，我是當即就會知道的！可儘管如此，唯獨那房間的那一把鑰匙“嗖”地就無影無踪了，隨後又出現在了我的儲物櫃之中！！」,「然后，等打扫完，拿起钥匙串，想锁门时，它就已经无影无踪了！尽管是在我背后，但我与钥匙近在咫尺！所以，要是有谁在，恶作剧地抽出一把钥匙，慢悠悠地把钥匙串搞得“咔恰咔恰”地响的话，我是当即就会知道的！可尽管如此，唯独那房间的那一把钥匙“嗖”地就无影无踪了，随后又出现在了我的储物柜之中！！」,[=UP],[=UP],[=UP]
,"""......So okay, let's say that Yasu managed to sneak it away. It's less stressful to imagine. ......But still! How could Yasu have put it in my locker, then?! We were together with Yasu the whole time, right?! When I started yelling about it being gone and ran all over the place looking for it, Yasu was with me until the moment I found it in my locker, get it?!""","""...So okay, let's say that Yasu managed to sneak it away. It's easier to think of that way. ...But still! How could Yasu have put it in my locker?! Yasu and I were together the whole time, right?! When I started yelling about it being gone and ran all over the place looking for it, Yasu was with me until the moment I found it in my locker, get it?!"" ","""......So okay, let's say that Yasu managed to sneak it away. It's easier to think of that way. ......But still! How could Yasu have put it in my locker?! Yasu and I were together the whole time, right?! When I started yelling about it being gone and ran all over the place looking for it, Yasu was with me until the moment I found it in my locker, get it?!""",「……いいよ、ヤスがこっそりやったって仮定してもいい。そう考えると気楽になれるもん。……でもね？！　じゃあ、どうやってロッカーに入れたわけ？！　ヤス、私たちとずっと一緒じゃん？！　私がないないって大騒ぎして、あちこち探し回ってロッカーの中で見つけるまで、ずっと一緒だったじゃん？！」,[=JP],"""......Ладно, предположим, Ясу удалось стащить его. Так думать проще всего. ......Но всё же! Как бы она положила его в мой шкафчик?! Мы всё время были вместе, так?! Когда я начала кричать про пропажу и побежала повсюду искать его, Ясу была со мной до того самого момента, пока я не нашла ключ в своём шкафчике, понимаешь?!""","""......Tudo bem, vamos dizer que Yasu conseguiu surrupiar ela. É mesmo estressante de imaginar. ......Ainda assim! Como Yasu teria colocado no meu armário, hein?! Nós estávamos com Yasu o tempo todo, não estávamos?! Quando eu comecei a gritar e correr por todo lado enquanto procurava, Yasu estava comigo até o momento em que a encontrei no meu armário, entendeu?!""",[=UP],「……好吧，就假定是小安偷偷幹的好了。畢竟，這麼想就不用背思想包袱了。……但是啊？！要是這樣，小安又是怎麼把鑰匙放進儲物櫃的啊？！小安不是一直都跟我們在一起嗎？！在我“不見了不見了”地大吵起來，直到四處尋找，最後在儲物櫃中找到為止，小安不是一直都跟在旁邊嗎？！」,「……好吧，就假定是小安偷偷干的好了。毕竟，这么想就不用背思想包袱了。……但是啊？！要是这样，小安又是怎么把钥匙放进储物柜的啊？！小安不是一直都跟我们在一起吗？！在我“不见了不见了”地大吵起来，直到四处寻找，最后在储物柜中找到为止，小安不是一直都跟在旁边吗？！」,[=UP],[=UP],[=UP]
,"""I'm telling you it's impossible!! Even as I jumped at Yasu, I began to feel it. I mean, Yasu's eyes seemed to be saying it silently. ......According to Yasu, the reason things used to go missing all the time...wasn't because Yasu was forgetful, as everyone said, ......but actually.........because impossible things would suddenly happen, just like they had to me, ......and.........and...!""","""I'm telling you it's impossible!! Even as I jumped at Yasu, I began to feel it. I mean, Yasu's eyes seemed to be saying it silently. ...According to Yasu, the reason things used to go missing all the time wasn't because Yasu was forgetful, as everyone said, ...but actually... it was because... impossible things would suddenly happen, just like they had to me, ...and...and...!"" ","""I'm telling you it's impossible!! Even as I jumped at Yasu, I began to feel it. I mean, Yasu's eyes seemed to be saying it silently. ......According to Yasu, the reason things used to go missing all the time wasn't because Yasu was forgetful, as everyone said, ......but actually... it was because... impossible things would suddenly happen, just like they had to me, ......and......and...!""",「ありえないってッ！！私、ヤスに当り散らしながら感じ始めてた。というか、ヤスの瞳がさ、無言で言ってるわけ。……あの子の言うさ、いつの間にか物がなくなってるって、……みんなが言うようにあの子がぼんやりしてるんじゃなくて……、……本当に実は、……私と同じで、突然、ありえないことが起こって、……その、………そのッ…！」,「ありえないってッ！！　私、ヤスに当り散らしながら感じ始めてた。というか、ヤスの瞳がさ、無言で言ってるわけ。……あの子の言うさ、いつの間にか物がなくなってるって、……みんなが言うようにあの子がぼんやりしてるんじゃなくて……、……本当に実は、……私と同じで、突然、ありえないことが起こって、……その、………そのッ…！」,"""Говорю же, это невозможно!!! Даже набросившись на Ясу, я начала замечать. Её глаза словно молча говорили об этом. ......По словам Ясу, всё пропадало не из‐за её забывчивости, как все говорят...... а на самом деле... потому что... неожиданно происходит невозможное, прямо как со мной...... и...... и!..""","""Estou dizendo que é impossível!! Na mesma hora que parti pra cima de Yasu, eu já estava sentindo isso. Quero dizer, os olhos de Yasu pareciam estar dizendo isso em silêncio. ......De acordo com Yasu, o motivo pelo qual as coisas costumavam sumir o tempo todo...não era porque Yasu se esquecia de tudo, assim como todo mundo falava, ......mas porque.........coisas impossíveis aconteciam do nada, assim como aconteceu comigo, ......e.........e...!""",[=UP],「不可能！！我邊向小安亂撒氣，邊開始感到了這不可能。不如說，小安的瞳孔，就在無言地這麼說。……那孩子說的，不知不覺間東西就不見了，……並不是像大家說的那樣，是那孩子犯馬虎……，……而其實真的是，……跟我一樣，突然，發生了不可能的事，……那個，………那個…！」,「不可能！！我边向小安乱撒气，边开始感到了这不可能。不如说，小安的瞳孔，就在无言地这么说。……那孩子说的，不知不觉间东西就不见了，……并不是像大家说的那样，是那孩子犯马虎……，……而其实真的是，……跟我一样，突然，发生了不可能的事，……那个，………那个…！」,[=UP],[=UP],[=UP]
Furfur,"""......Yasu was with you the whole time, so there was no chance for Yasu to put the key in the locker?""","""...Yasu was with you the whole time, so there was no chance for Yasu to put the key in the locker?"" ",[=UP],「……ヤスはずっと一緒だったから、ロッカーに入れるのは不可能？」,[=JP],"""......Ясу всё время была с тобой и поэтому не могла положить ключ в шкафчик?""","""......Yasu estava com você o tempo todo, logo não tinha como Yasu ter tido  a chance de colocar a chave no seu armário?""",[=UP],「……因為小安一直都跟你在一起，所以小安無法把鑰匙放進儲物櫃？」,「……因为小安一直都跟你在一起，所以小安无法把钥匙放进储物柜？」,[=UP],[=UP],[=UP]
Zepar,"""Did other strange things like that happen?""","""Did other strange things like that happen?"" ",[=UP],「そんなおかしなことが、他にも？」,[=JP],"""Были другие похожие странности?""","""Aconteceram outras coisas estranhas?""",[=UP],「像這種怪事，並非僅此一件？」,「像这种怪事，并非仅此一件？」,[=UP],[=UP],[=UP]
,"""Yeah, they did. More stuff went missing, but not just that... Things kept happening, over and over... ......Of course, I started getting nervous and being careful not to just leave stuff lying around, ......but that didn't help.""","""Yeah, they did. Afterwards, other things happened...and not just things disappearing... Over and over... ...Of course, I started getting nervous and made sure not to put things down in places like that, ...but that didn't help."" ","""Yeah, they did. Afterwards, other things happened...and not just things disappearing...over and over... ...Of course, I started getting nervous and made sure not to put things down in places like that, ......but that didn't help.""",「うん、そう。物がなくなるとか、単純にそれだけじゃないことが、その後も、他にも、何度も何度も。……さすがに薄気味悪くなって、物とかその辺に置かないように気を付けたけど、……それでも駄目だった。」,「うん、そう。物がなくなるとか、単純にそれだけじゃないことが、その後も、他にも、何度も何度も。……さすがに薄気味悪くなって、物とかその辺に置かないように気を付けたけど、……それでも駄目だった」,"""Да, были. Потом происходило ещё много чего, и не только исчезновения......... Естественно, я занервничала и перестала бросать всё куда попало...... но ничего не помогло.""","""Sim, aconteceram. Mais coisas começaram a sumir, mas não foi só isso... Coisas continuaram acontecendo, e se repetindo e repetindo... ......É claro, eu comecei a ficar nervosa e ser mais cuidadosa para não deixar nada para trás, ......mas isso não ajudou.""",[=UP],「嗯，是的。“東西不見了”，並不單純只是這樣的事，在這之後，其他的事也發生了好多好多次。……實在是都叫人心裡瘮得慌了，雖然我有小心不把東西放在那些地方，……但即便如此還是不行。」,「嗯，是的。“东西不见了”，并不单纯只是这样的事，在这之后，其他的事也发生了好多好多次。……实在是都叫人心里瘆得慌了，虽然我有小心不把东西放在那些地方，……但即便如此还是不行。」,[=UP],[=UP],[=UP]
,"""......At first, I was angry at Yasu, ......but at some point, I began to realize that I was mistaken. One time, a key even disappeared from a ring that was in my pocket! Then, I realized. ......These weren't Yasu's pranks. The same thing that had happened to Yasu was now happening to me...!""","""...At first, I was angry at Yasu, ...but at some point, I began to realize that I was mistaken. One time, a key even disappeared from a ring that I'd left in my pocket! Then, I realized. ...These weren't Yasu's pranks. The same thing that happened to Yasu was now happening to me...!"" ","""......At first, I was angry at Yasu, ......but at some point, I began to realize that I was mistaken. One time, a key even disappeared from a ring that was in my pocket! Then, I realized. ......These weren't Yasu's pranks. The same thing that happened to Yasu was now happening to me...!""",「……最初こそヤス舐めんなって思ってたけど、……途中からマジで、これは違うって理解し始めた。私がポケットに入れっ放しにしてたはずの鍵束から鍵が消えたことだってある！私は気付いた。……ヤスが悪戯してんじゃない。ヤスも私も、同じ何かに、やられてるんじゃないかッ、って…！」,「……最初こそヤス舐めんなって思ってたけど、……途中からマジで、これは違うって理解し始めた。私がポケットに入れっ放しにしてたはずの鍵束から鍵が消えたことだってある！　私は気付いた。……ヤスが悪戯してんじゃない。ヤスも私も、同じ何かに、やられてるんじゃないかッ、って…！」,"""......Сначала я разозлилась на Ясу...... но потом поняла, что ошибаюсь. Один раз ключ исчез даже с кольца, которое было у меня в кармане! И тогда я поняла. ......Это не шутки Ясу. То же, что случалось с ней, теперь происходит со мной!..""","""......Logo de cara, eu fiquei furiosa com Yasu, ......mas, em determinado momento, comecei a perceber que eu estava enganada. Certa vez, até mesmo uma chave desapareceu de um chaveiro que estava dentro do meu bolso! Foi quando eu percebi. ......Não eram brincadeiras de Yasu. As mesmas coisas que aconteciam com Yasu, agora estava acontecendo comigo...!""",[=UP],「……雖然在最開始時，我是在想“小安，你可別小瞧人啊”，……但漸漸地我就開始明白，這事真的不對頭了。我甚至還撞上過，明明是放在口袋裡，可鑰匙串卻少了鑰匙！我意識到了。……這不是，小安的惡作劇。小安也好我也罷，會不會都在被同樣的什麼戲弄…？！」,「……虽然在最开始时，我是在想“小安，你可别小瞧人啊”，……但渐渐地我就开始明白，这事真的不对头了。我甚至还撞上过，明明是放在口袋里，可钥匙串却少了钥匙！我意识到了。……这不是，小安的恶作剧。小安也好我也罢，会不会都在被同样的什么戏弄…？！」,[=UP],[=UP],[=UP]
,"""C‐calm down a bit... I think some of those were Yasu's pranks, ...and the others were just you being clumsy. ......It's true that the mansion's always dark and eerie, ......and it does feel like the sort of place you'd find a curse. I'm sure that's what made you scared like that...""","""C-Calm down a bit... I think some of those were Yasu's fault, and the others were just you being clumsy. ...It's true that the mansion's always dark and eerie, ...and it does feel like the sort of place you'd find a curse. I'm sure that's what made you scared like that..."" ","""C, calm down a bit... I think some of those were Yasu's fault, and the others were just you being clumsy. ......It's true that the mansion's always dark and eerie, ......and it does feel like the sort of place you'd find a curse. I'm sure that's what made you scared like that...""",「お、落ち着きなよー……。私は、一部はヤスの悪戯。…それ以外のほとんどは、鐘音のウッカリか勘違いだと思ってるよ。……確かに屋敷はいつも薄暗くて、どこか薄気味悪かったし……、何か祟りとか呪いとか、そんなのがあってもおかしくなさそうな雰囲気はあった。そのせいできっと、鐘音はおかしな方向に怯えちゃったんじゃないかなって…。」,「お、落ち着きなよー……。私は、一部はヤスの悪戯。…それ以外のほとんどは、鐘音のウッカリか勘違いだと思ってるよ。……確かに屋敷はいつも薄暗くて、どこか薄気味悪かったし……、何か祟りとか呪いとか、そんなのがあってもおかしくなさそうな雰囲気はあった。そのせいできっと、鐘音はおかしな方向に怯えちゃったんじゃないかなって…」,"""У... успокойся... Думаю, некоторое случилось по вине Ясу, а некоторое — из‐за твоей неуклюжести. ......Особняк всегда такой тёмный и жуткий...... и кажется, что в нём на тебя могут наслать проклятие. Вот из‐за чего ты испугалась...""","""S‐Se acalme... Eu pensei que algumas eram brincadeiras de Yasu, ...e outras eram simplesmente você sendo descuidada. ......É verdade que a mansão sempre foi escura e sinistra, ......e parecia o tipo de lugar você iria se deparar com maldições. Tenho certeza que foi o que a fez ficar com medo...""",[=UP],「冷、冷靜點——……。我覺得，這當中有一部分是小安的惡作劇。…而除此之外的，幾乎全都是鐘音你犯馬虎或多心了喲。……的確，大屋每時每刻都很陰暗，哪有點陰森森的……，存在著“即便有什麼作祟詛咒等諸如此類的玩意也不足為奇”的氣氛。一定是出於這個原因，鐘音你才從反常的方向害怕了起來…」,「冷、冷静点——……。我觉得，这当中有一部分是小安的恶作剧。…而除此之外的，几乎全都是钟音你犯马虎或多心了哟。……的确，大屋每时每刻都很阴暗，哪有点阴森森的……，存在着“即便有什么作祟诅咒等诸如此类的玩意也不足为奇”的气氛。一定是出于这个原因，钟音你才从反常的方向害怕了起来…」,[=UP],[=UP],[=UP]
,"""You saw it too, didn't you?! Remember that white shadow we saw vanish into the VIP room that rainy day?!""","""You saw it too, didn't you?! Remember that vanishing white shadow we saw in the VIP room that rainy day?!"" ","""You saw it too, didn't you?! Remember that vanishing white shadow we saw in the VIP room that rainy day?!""",「あんただって見たでしょ？！　ほらあの雨の日ッ、貴賓室に消えるおかしな白い影を見たでしょ？！」,[=JP],"""Ты ведь тоже видела?! Помнишь исчезающую белую тень, которую мы видели в почётной комнате тем дождливым днём?!""","""Você também viu, não viu?! Lembra daquela sombra branca que vimos desaparecer para dentro do quarto VIP naquele dia chuvoso?!""",[=UP],「你不是也看到過嘛？！喏，你不是也在那個下雨天，看到了在貴賓室裡消失了的詭異白影嗎？！」,「你不是也看到过嘛？！喏，你不是也在那个下雨天，看到了在贵宾室里消失了的诡异白影吗？！」,[=UP],[=UP],[=UP]
,"""......Y‐yes, I saw, but couldn't that just have been Madam or Milady wearing something white...?""","""...Y-Yes, I saw, but couldn't that just have been Madam or Milady wearing something white...?"" ","""......Y, yes, I saw, but couldn't that just have been Madam or Milady wearing something white...?""",「……み、見たけど。白い何かを着た、奥様かお嬢様じゃない…？」,[=JP],"""......Д‐да, я видела, но разве это не могла быть мадам или миледи в белом?..""","""......S‐Sim, eu vi também, mas não poderia ter sido apenas a madame ou a ojou‐sama vestindo algo branco...?""",[=UP],「……雖、雖然我是有看到過。但那不就是，穿著白色的什麼的，太太或小姐嘛…？」,「……虽、虽然我是有看到过。但那不就是，穿着白色的什么的，太太或小姐嘛…？」,[=UP],[=UP],[=UP]
