Speaker,Steam (ST),Umineko Project (UP),Original Witch Hunt (OG),PC Japanese (JP),PS3 Japanese - Censored (JPC),Russian (RU),Brazilian Portuguese (PT),Chinese Traditional (CHT),Chinese Simplified (CN),Italian (Ars Magica) (Old) (ITA)
,"""And then, you see, we'll set it up so that, among the works entered in Company X's mystery novel contest, yet another one of the great Hachijo's works will ""appear"" under a false name..."" ","""And then, you see, the public will be told that, among the works entered into the first Company X mystery novel contest, a work from the amazing Hachijo was once again submitted under a false name...""","""And then, you see, we'll set it up so that, among the works entered in Company X's mystery novel contest, yet another one of the great Hachijo's works will appear under a false name...""",「そこでですね、第１回丸々社ミステリー大賞応募作品中に、八城先生が再び偽名にて原稿をお寄せになったという形に致しまして…。」,「そこでですね、第１回丸々社ミステリー大賞応募作品中に、八城先生が再び偽名にて原稿をお寄せになったという形に致しまして…」,"""А потом мы сделаем так, что среди работ, представленных на конкурс детективных романов компании Х, ещё одна великая работа Хачиджо появится под фальшивым именем...""","""Então, como pode ver, será dito ao público que, dentre as obras que entraram no primeiro concurso de mistério da Editora Siclano, um novo trabalho da incrível Hachijo foi enviado novamente sob um nome falso...""",「就是說啊，在第 1 屆丸丸社推理小說大獎徵集作品中，八城老師您再次以假名的形式將原稿寄來…」,「就是说啊，在第 1 届丸丸社推理小说大奖征集作品中，八城老师您再次以假名的形式将原稿寄来…」,"""E poi, vede... lo prepareremo in modo che, tra le opere entrate nel concorso di romanzi gialli della Compagnia X, apparirà sotto un nome falso un'altra delle opere della grande Hachijo..."""
,"""Of course, we'll then move on with a movie version and a TV drama bundled in...! We here at Company X would be honored to accept your manuscript...!!"" ","""Of course, we'll have produced a movie version and a TV drama, all of it ready for a simultaneous and coordinated launch...! I hope this makes clear how eager we are at Company X to receive your manuscript...!!""","""Of course, we'll then move on with a movie version and a TV drama bundled in...! We here at Company X would be honored to accept your manuscript...!!""",「もちろん、映画化、テレビドラマ化、全てが同時にリンクして動く形になっておりまして…！　ぜひ先生の玉稿を我が丸々社にお預けいただきたく…！！」,[=JP],"""Разумеется, мы пойдём дальше с киноверсией и теледрамой в комплекте!.. Мы, компания Х, сочтём за честь принять вашу рукопись!..""","""É claro, nós teremos produzido um filme e uma novela, tudo pronto para um lançamento coordenado e simultâneo...! Eu espero que isso deixe claro o quão dispostos nós, da Editora Siclano, estamos para receber o seu manuscrito...!!""",「當然，電影化，電視劇化，這些都將同時聯動起來…！請務必將老師的玉稿交予我丸丸社…！！」,「当然，电影化，电视剧化，这些都将同时联动起来…！请务必将老师的玉稿交予我丸丸社…！！」,"""In seguito, ovviamente, passeremo ad una versione cinematica insieme ad una fiction televisiva...! Noi della Compagnia X saremmo onorati di accettare il suo manoscritto...!!"""
Hachijo Tohya,"""And am I getting prize money out of this?"" ","""And will there be prize money?""",[=UP],「賞金は出るのですか。」,「賞金は出るのですか」,"""А призовые деньги будут?""","""E terá uma premiação em dinheiro?""",「會有獎金嗎？」,「会有奖金吗？」,"""E ci sarà un premio in denaro?"""
,"""But of course...! The 10 million yen prize for Company X's first mystery novel contest will all go to you! And much more besides!!"" ","""But of course...! The ten million yen prize for Company X's first mystery novel contest will all go to you! And much more besides!!""","""But of course...! The 10 million yen prize for Company X's first mystery novel contest will all go to you! And much more besides!!""",「もちろんでございます…！　栄えある第１回丸々社ミステリー大賞賞金１０００万円はもちろん、先生にお支払いさせていただきます！　他にもですね、他にも他にも！！」,[=JP],"""Конечно!.. Весь приз за первый конкурс детективных романов компании Х — 10 миллионов иен — перейдёт к вам! И многое другое!""","""É claro...! Os dez milhões do prêmio do primeiro concurso de livro de mistério da Editora Siclano irá todo para você! E muito mais além disso!!""",「當然有的…！這隆重的第 1 屆丸丸社推理小說大獎獎金 1000 萬日元，當然會支付給老師您的！其它還有，還有還有！！」,「当然有的…！这隆重的第 1 届丸丸社推理小说大奖奖金 1000 万日元，当然会支付给老师您的！其它还有，还有还有！！」,"""Ma certamente...! Il premio da 10 milioni di yen per il primo concorso di romanzi gialli della Compagnia X andrà tutto a lei! E poi, molto altro!!"""
Hachijo Tohya,"""Splendid. You've caught my interest. That's why I've decided not to write up a manuscript for you."" ","""Splendid. You've caught my interest. That's why I've decided not to write up a manuscript.""",[=UP],「面白い。気に入りました。だから原稿は書かないことにします。」,「面白い。気に入りました。だから原稿は書かないことにします」,"""Великолепно. Вы меня заинтересовали. Поэтому я решила не писать рукопись.""","""Magnífico. Você tem o meu interesse. É por isso que decidi não escrever um manuscrito.""",「有意思。我很中意。所以就不打算寫原稿了。」,「有意思。我很中意。所以就不打算写原稿了。」,"""Splendido. Avete catturato il mio interesse. Per cui, ho deciso di non scrivere un manoscritto."""
,"""""Whaaaaaat?!?! M-Madam Hachijo, whyyyyyy...?!!!"""" ","""""Whaaaaaaaa?!?! M‐Madam Hachijo, whyyyyyyyy...?!!!""""","""""Whaaaaaaaa?!?! M, Madam Hachijo, whyyyyyyyy...?!!!""""",「「ええぇええぇえ？！？！　せ、先生ッ、そんなぁッ…！！！」」,[=JP],"""""Э‐э‐э‐э?!?! Ма... мадам Хачиджо, почему‐у‐у‐у?!!""""","""""Quêêêêêêê?!?! S‐Sensei, por quê...?!!!""""",「「誒誒誒誒誒誒誒？！？！老、老師，怎麼這樣…！！！」」,「「诶诶诶诶诶诶诶？！？！老、老师，怎么这样…！！！」」,"""""Eeeeeeeeeeeh?!?! S-Signora Hachijo, perchéééé...?!!!"""""
,"Everything had seemed to be going so smoothly up until then, so this sudden refusal made the people from the publishing company fall over in their sofa. ","Everything had seemed to be going so smoothly up until then, so this sudden refusal made the people from the publishing company fall over in their sofa.",[=UP],ここまで話がとんとん拍子で進んでいたのに、にこやかに原稿を断られ、出版社の人間達はソファーの上で仰け反って転げる。,[=JP],"Всё, казалось бы, шло гладко, и от её неожиданного отказа люди из издательства перевалились на диване.","Tudo parecia estar transcorrendo bem até então, por isso essa recusa repentina fez o pessoal da editora caírem no sofá.",明明之前話題都在順利進展下去，被這麼痛苦地拒絕了提供原稿，出版社的人們都仰倒在沙發上。,明明之前话题都在顺利进展下去，被这么痛苦地拒绝了提供原稿，出版社的人们都仰倒在沙发上。,"Sembrava che tutto sarebbe andato bene fino ad allora, perciò questo rifiuto improvviso fece ricadere sul divano le persone della casa editrice."
Hachijo Tohya,"""This little scheme of yours is far more interesting than the manuscript I wrote. In that case, it wouldn't be fitting to hand it over to you. ...It was always a worthless story. I wanted to lure my ignorant readers into lauding it, making them feel as though they'd performed some magnificent reasoning. ","""This little scheme of yours is far more interesting than the manuscript I wrote. Which is why this manuscript is unsuitable for your company. ......It was always a worthless story. Mere junk prose to entice my ignorant readers into somehow ignoring their own ignorance and feeling as though they have exhausted the limits of reasoning.""","""This little scheme of yours is far more interesting than the manuscript I wrote. In that case, it wouldn't be fitting to hand it over to you. ......It was always a worthless story. Just something for my ignorant readers to put on their shelves and let them think that they've managed to solve a great puzzle.",「私が書いた原稿より、あなた方のシナリオの方が面白い。ですから、この原稿は御社にお預けするに相応しくありません。……元より、下らなき原稿。無知蒙昧なる読者が、如何にそれを棚に上げて、自身が推理の限りを尽くしたかのような気分になるよう誘導するだけの駄文。,「私が書いた原稿より、あなた方のシナリオの方が面白い。ですから、この原稿は御社にお預けするに相応しくありません。……元より、下らなき原稿。無知蒙昧なる読者が、如何にそれを棚に上げて、自身が推理の限りを尽くしたかのような気分になるよう誘導するだけの駄文」,"""Ваша авантюра гораздо интереснее написанной мной рукописи. Было бы неуместно отдавать её вам. ......Она всегда была никудышной историей. Всего лишь тем, что мои невежественные читатели ставят на полку, думая, что сумели разгадать великую загадку.""","""Esse seu esqueminha é muito mais interessante que o manuscrito que escrevi. Por isso, este manuscrito não é apropriado para a sua editora. ......É sempre uma história sem valor. Uma mera prosa sáfio para seduzir meus ignorantes leitores a algo que acaba por ignorar a própria ignorância deles e os fazem sentir como se tivessem exaurido os limites do raciocínio.""",「比起我寫的原稿，你們的劇本更有意思。所以，這份原稿不適合交給貴社。……原本這就是，無聊的原稿。蒙昧無知的讀者，無論怎麼將之束之高閣，也只是誘導讀者認為自身的推理已經到了盡頭的爛文。」,「比起我写的原稿，你们的剧本更有意思。所以，这份原稿不适合交给贵社。……原本这就是，无聊的原稿。蒙昧无知的读者，无论怎么将之束之高阁，也只是诱导读者认为自身的推理已经到了尽头的烂文。」,"""Questo vostro schema è di gran lunga più interessante del manoscritto che ho composto. In questo caso, non sarebbe adatto consegnarvelo. ... È sempre stata una storia senza valore. Semplicemente qualcosa che i miei lettori ignoranti metterebbero sui loro scaffali e che farebbe credere loro che sono riusciti a risolvere un grandioso enigma."
Hachijo Tohya,"I was hoping that you children of men would recognize the irony and laugh at your own mistake, but it looks like you've taken it seriously. Yes, I can say I'm ashamed at my own failure as a writer."" ","""I was hoping that they'd recognize the irony and laugh at their own foolishness, but it looks like you've taken it seriously. Yes, I can say I'm ashamed at my own failure as a writer."""," I was hoping that they'd recognize the irony and laugh at their own foolishness, but it looks like you've taken it seriously. Yes, I can say I'm ashamed at my own failure as a writer.""",それを皮肉と気付き、人の子が自らの愚かさに苦笑する、そんな作品に書いたつもりが、まさか推理小説の扱いを受けるとは。我ながら文才のなさに呆れ果てるというものです。」,「それを皮肉と気付き、人の子が自らの愚かさに苦笑する、そんな作品に書いたつもりが、まさか推理小説の扱いを受けるとは。我ながら文才のなさに呆れ果てるというものです」,"""Я надеялась, что они распознают иронию и посмеются над своей глупостью, но вы восприняли это всерьёз. Да, могу сказать, что, как писателю, мне стыдно за свой провал.""","""Eu estava esperando que eles reconhecessem a ironia e rissem da própria tolice, mas parece que você levou a sério. Sim, posso dizer que estou envergonhada da minha própria falha como escritora.""",「注意到其中的諷刺，人子苦笑於自己的愚蠢，我只是想寫這樣的作品，居然會被當作是推理小說。看來我的文采已經缺失到連我自己都覺得目瞪口呆了。」,「注意到其中的讽刺，人子苦笑于自己的愚蠢，我只是想写这样的作品，居然会被当作是推理小说。看来我的文采已经缺失到连我自己都觉得目瞪口呆了。」,"Speravo che avrebbero riconosciuto l'ironia e riso della propria stoltezza, ma sembra che voi l'abbiate preso sul serio. Sì, posso dire di provare vergogna per il mio fallimento come scrittrice."""
,"""O-O-Of course not!! Please, forgive us!! Please, let us use your-!!"" ","""O‐o‐of course not!! Please, forgive us!! Please, let us use your work!!""","""O, o, of course not!! Please, forgive us!! Please, let us use your-!!""",「ととと、とんでもない！！　どうかお許しをー！！　どうか我が社に玉稿をーー！！」,[=JP],"""Ко‐ко‐конечно нет! Простите нас! Прошу, позвольте нам взять вашу‐!""","""É‐É‐É claro que não!! Por favor, nos perdoe!! Permita usarmos seu trabalho!!""",「才才才、才沒有這回事！！請您原諒——！！請您將玉稿交予我社——！！」,「才才才、才没有这回事！！请您原谅——！！请您将玉稿交予我社——！！」,"""O-Ovviamente no!! La prego, ci perdoni!! La prego, ci lasci usare il suo-!!"""
Hachijo Tohya,"""...I have no need for money, but some pet food would be nice."" ",""".........I have no need for money, but some pet food would be nice.""","""......I have no need for money, but some pet food would be nice.""",「………カネはいらぬが、エサが欲しいです。」,「………カネはいらぬが、エサが欲しいです」,"""......Мне не нужны деньги, но кошачья еда не помешала бы.""",""".........Eu não preciso de dinheiro, mas um pouco de ração seria ótimo.""",「………我不要錢，但是想要餌食。」,「………我不要钱，但是想要饵食。」,"""... Non ho bisogno di denaro, ma mi piacerebbe del cibo per animali."""
,"""Pet food? O-Oh, for your cat...!!"" ","""Pet food? O‐oh, for your cat...!!""","""Pet food? O, oh, for your cat...!!""",「エサ？　あ、あぁッ、先生の飼い猫の…！！」,[=JP],"""Кошачья еда? О... о‐о, для вашей кошки!..""","""Ração? A‐Ah, para a sua gata...!!""",「餌食？啊，啊啊，先生養的貓的…！！」,「饵食？啊，啊啊，先生养的猫的…！！」,"""Cibo per animali? O-Oh, per il suo gatto...!!"""
,"""Th-There was a rumor that you had a cat who liked dried plums! Y-Yes, as you wish...! Quickly, let's have a high-quality assortment of dried plums brought in here!!"" ","""Th‐there was a rumor that you had a cat who liked dried plums! Y‐yes, as you wish...! Quickly, let's have a high‐quality assortment of dried plums in here!!""","""Th, there was a rumor that you had a cat who liked dried plums! Y, yes, as you wish...! Quickly, let's have a high-quality assortment of dried plums in here!!""",「う、梅干の好きな猫ちゃんとのお噂を！　か、畏まりました…！　至急、最高級の梅干詰め合わせをー！！」,[=JP],"""Ходил слух, что у вас есть кошка, любящая чернослив! Д‐да, как скажете!.. Скорее, принесём сюда первоклассный ассортимент чернослива!""","""T‐Tem um rumor que diz que sua gata gosta de umeboshi! S‐Sim, como quiser...! Logo teremos um sortimento de alta qualidade de umeboshi aqui!!""",「聽、聽說是喜歡梅乾的小貓！我、我明白了…！馬上，就去買最高級的梅乾禮盒——！！」,「听、听说是喜欢梅干的小猫！我、我明白了…！马上，就去买最高级的梅干礼盒——！！」,"""S-Si diceva che lei avesse un gatto a cui piacciono le prugne secche! {n}S-Sì, come desidera...! Veloci, portate qui un assortimento di alta qualità di prugne secche!!"""
Hachijo Tohya,"""She only eats the ones that are packaged separately, at 200 yen apiece. ...At this rate, she'll die of high blood pressure. She snacks on kimchi and spicy miso all the time too... Really, there must be something wrong with that cat's tongue."" ","""She only eats the ones that are packaged separately, at 200 yen apiece. ......At this rate, she'll die of high blood pressure. She snacks on kimchi and spicy miso soup all the time too... Really, there must be something wrong with that cat's tongue.""",[=UP],「一つずつ個別包装してあるヤツで、一粒２００円以上するものしか食べません。……あれはやがて高血圧で死ぬな。キムチや辛味噌もよく舐めるし、……舌のイカれた猫であること。」,「一つずつ個別包装してあるヤツで、一粒２００円以上するものしか食べません。……あれはやがて高血圧で死ぬな。キムチや辛味噌もよく舐めるし、……舌のイカれた猫であること」,"""Она ест только те, которые упакованы отдельно, по 200 иен за штуку. ......Такими темпами она умрёт от высокого кровяного давления. Ещё и всё время перекусывает кимчи и пряным супом мисо... С языком этой кошки явно что‐то не так.""","""Ela só come aqueles de embalagens avulsas, de 200 iene cada. ......Desse jeito, ela vai morrer de pressão alta. Ela passa o tempo todo comendo {i:kimchi} e {i:miso} apimentado... Deve ter algo muito errado com aquela língua de gato.""",「它只吃單獨包裝的，一顆 200 日元以上的那種。……那樣遲早會死於高血壓的吧？還經常舔辣白菜和辣味噌，……是只口味很怪的貓。」,「它只吃单独包装的，一颗 200 日元以上的那种。……那样迟早会死于高血压的吧？还经常舔辣白菜和辣味噌，……是只口味很怪的猫。」,"""Mangia solo quelle confezionate separatamente, a 200 yen al pezzo. {n}Di questo passo, morirà di pressione alta. Inoltre fa sempre merenda con il kimchi e la zuppa di miso piccante... seriamente, la lingua di quel gatto deve avere qualcosa di strano."""
,Meep! The cat meowed an objection from where it lay on top of the bookshelf. ,Mii! The cat meowed an objection from where it lay on top of the bookshelf.,[=UP],みー！　本棚の上で寝そべっていた黒猫が、反論するように甲高く鳴く。,[=JP],Ми‐и! Кошка мяукнула с книжной полки в знак протеста.,Mii! A gata miou uma objeção de onde estava deitada sobre uma estante de livros.,咪——！書架上躺著的黑貓，像是反駁一樣高聲叫著。,咪——！书架上躺着的黑猫，像是反驳一样高声叫着。,"Mii! Il gatto miagolò un'obiezione da dove giaceva, al di sopra dello scaffale."
Hachijo Tohya,"""I cannot give you this manuscript, but why don't I write up a new one for your company's contest? However, I won't write it under my name. It's estimated that thousands of manuscripts will be sent in for your contest. If you manage to pick mine out from the pack, and if you also find it deserving of the prize, then I would be happy to continue our discussion just now. ...How does that sound?"" ","""I cannot give you this manuscript, but why don't I write up a new one for your company's contest? However, I won't write it under my name. It's estimated that thousands of manuscripts will be sent in for your contest. If you manage to pick out mine from the pack, and if you also find it deserving of the prize, then I would be happy to continue our discussion just now. .........How does that sound?""","""I cannot give you this manuscript, but why don't I write up a new one for your company's contest? However, I won't write it under my name. It's estimated that thousands of manuscripts will be sent in for your contest. If you manage to pick out mine from the pack, and if you also find it deserving of the prize, then I would be happy to continue our discussion just now. ......How does that sound?""",「この原稿は預けませんが、御社大賞用に新しい原稿を執筆しましょう。ただし、私の名前では描きません。御社大賞の推定投稿数は千件以上。その中から私の匿名原稿を見事見付け出し、その上で尚、大賞に相応しいと思えたなら、その時、改めて先々の話をうかがいましょう。………それで如何か？」,[=JP],"""Я не могу отдать вам эту рукопись, но почему бы мне не написать для конкурса вашей компании новую? Только я не стану писать её под своим именем. Считается, что на ваш конкурс будут отправлены тысячи рукописей. Если вам удастся вытянуть из них мою и если вы посчитаете её достойной приза, я буду рада продолжить наш разговор. ......Что скажете?""","""Eu não posso dar a você este manuscrito, mas que tal eu escrever algo novo para o concurso da sua editora? Contudo, não assinarei com meu nome. É estimado que milhares de manuscritos serão enviados ao seu concurso. Se conseguir encontrar o meu dentre eles, e também achar que ele merece o prêmio, então eu ficaria feliz em continuar nossa conversa agora. .........Que tal?""",「這份原稿不會給你們，但是我會為貴社的大獎寫份新的原稿。不過，我不會寫名字。貴社的大獎預計投稿數在千份以上。在那其中能夠找到我的匿名原稿，並在此之上，認為那和大獎相符的話，那時，就重新再談之後的事吧？………這樣如何？」,「这份原稿不会给你们，但是我会为贵社的大奖写份新的原稿。不过，我不会写名字。贵社的大奖预计投稿数在千份以上。在那其中能够找到我的匿名原稿，并在此之上，认为那和大奖相符的话，那时，就重新再谈之后的事吧？………这样如何？」,"""Non vi posso donare questo manoscritto, ma perché non scriverne uno nuovo per il concorso della vostra compagnia? Tuttavia, non lo scriverò con il mio nome. Si stima che per il vostro concorso verranno inviati migliaia di manoscritti. Se riuscirete a trovare il mio nel pacco, e se troverete anche che si meriti il premio, allora sarei lieta di continuare la nostra discussione in questo momento. ... Come vi sembra?"""
,"""""H-Haha--!! Just the honor of receiving your manuscript is more than enough!!"""" ","""""Y‐yes, of course!! Just the honor of receiving your manuscript is more than enough!!""""","""""H, haha--!! Just the honor of receiving your manuscript is more than enough!!""""",「「は、ははーー！！　玉稿を賜れるだけでも、至極幸福に存じまするー！！」」,[=JP],"""""Х... ха‐ха! Одной чести принять вашу рукопись более чем достаточно!""""","""""S‐Sim, é claro!! Receber seu manuscrito já é uma grande honra!!""""",「「好、好的——！！能獲賜您的玉稿，實乃至高的幸福——！！」」,「「好、好的——！！能获赐您的玉稿，实乃至高的幸福——！！」」,"""""H-Haha-!! Il solo onore di ricevere il suo manoscritto è più che sufficiente!"""""
