{f:5:Ange Beatrice},"That's why I decided to accept my family's deaths. I decided to accept the truth, no matter what it is. That's why I became a Witch of Truth...!!"" ","""That's why I decided to accept my family's deaths. I decided to accept the truth, no matter what it is. That's why I became a Witch of Truth...!!""","That's why I decided to accept my family's deaths. I decided to accept the truth, no matter what it is. That's why I became a Witch of Truth...!!""",だから、私は家族の死を受け入れることにした。どのような真実であろうとも認めようと思った。だから、私は真実の魔女となった…！！」,「だから、私は家族の死を受け入れることにした。どのような真実であろうとも認めようと思った。だから、私は真実の魔女となった…！！」,"""Вот почему я решила принять смерти своей семьи. Я решила принять правду, какой бы она ни была. Именно поэтому я стала ведьмой правды!..""","""É por isso que eu decidi aceitar a morte da minha família. Eu decidi aceitar a verdade, independente do que ela for. É por isso que eu me tornei uma Bruxa da Verdade...!!""",「所以，我選擇接受家人的死。無論真實是怎樣的都會去接受。所以，我才成為了真實的魔女…！！」,「所以，我选择接受家人的死。无论真实是怎样的都会去接受。所以，我才成为了真实的魔女…！！」,"Ecco perché ho deciso di accettare la morte della mia famiglia. Ho deciso di accettare la verità, non importa quale sia. Ecco perché sono diventata una Strega della Verità...!!"""
{f:5:Beatrice},"""...How foolish, to be blinded by the truth of the past and unable to see one's own future...! Forgive me, Battler. ...I was not strong enough to guide your sister properly..."" ","""......How foolish, to be blinded by the truth of the past and unable to see one's own future......! Forgive me, Battler. ......I was not strong enough to guide your sister to a proper future...""",[=UP],「……過去の真実に目が眩み、自らの未来が見えなくなった者の、何と愚かなことか……！　許せ、戦人。……そなたの妹を、正しき未来に導くには、妾は力が足りなかった…。」,「……過去の真実に目が眩み、自らの未来が見えなくなった者の、何と愚かなことか……！　許せ、戦人。……そなたの妹を、正しき未来に導くには、妾は力が足りなかった…」,"""......Как глупо зацикливаться на правде прошлого и не видеть своё будущее!.. Прости, Баттлер. ......Моих сил не хватило, чтобы направить твою сестру к правильному будущему...""","""......Quanta tolice, a ponto de ser cega pela verdade do passado e incapaz de ver o próprio futuro......! Me perdoe, Battler. ......Eu não fui forte o bastante para guiar sua irmã para o futuro certo...""",「……因為過去的真實而失去判斷力，讓自己看不到未來的人，是何等的愚蠢……！原諒妾身，戰人。……妾身的力量還不足以，將汝的妹妹引導到正確的未來上去…」,「……因为过去的真实而失去判断力，让自己看不到未来的人，是何等的愚蠢……！原谅妾身，战人。……妾身的力量还不足以，将汝的妹妹引导到正确的未来上去…」,"""... Che sciocchezza, essere accecati dalla verità del passato incapaci di vedere il proprio futuro...! Perdonami, Battler. ... Non sono stata abbastanza forte da guidare tua Sorella a un futuro adatto..."""
,"A blazing blue wedge appeared in Ange's hand. It was long, thick, and shaped like a spear. ","A blazing blue wedge appeared in Ange's hand.{n}It was long, thick, and shaped like a spear.","A blazing blue wedge appeared in Ange's hand. It was long, thick, and shaped like a spear.",縁寿の手に、青く眩しく光る楔が現れる。それは太く長く、まるで槍のように見えた。,縁寿の手に、青く眩しく光る楔が現れる。{n}それは太く長く、まるで槍のように見えた。,"В руке Энджи появился пылающий синий клин.{n}Длинный, толстый и в форме копья.","Uma resplandecente cunha azul surgiu nas mãos de Ange.{n}Era longa, espessa e tinha a forma de uma lança.",緣壽的手中，出現了閃著炫目藍色光芒的楔子。{n}那又粗又長，仿彿像長槍一般。,缘寿的手中，出现了闪着炫目蓝色光芒的楔子。{n}那又粗又长，仿佛像长枪一般。,"Un ardente cuneo blu apparse nella mano di Ange. Era lungo, spesso, e dalla forma di una lancia."
{f:5:Ange Beatrice},"""This is the end, witch of 1986. ...{p:2:This closed room is perfect!! Therefore, I can't get out, and you can't lay a finger on me from the outside! However, you ""locked me into this room""! So, we can say you killed me with this simple trick...!! You shut me in this perfect closed room and made me starve to death...!! Since you intentionally did this, it's totally fair to say ""This is a closed room murder with you as the killer""!!} ","""This is the end, witch of 1986. ......{p:2:This locked room is perfect!! Therefore, I can't get out, and you can't lay a finger on me from the outside! However, you {i:locked me into} this room! And there's just one trick that makes that the same as you ""killing"" me...!! You shut me in this perfect locked room and made me starve to death...!! Since you intentionally did this, there's no problem saying that this was a locked room murder with you as the killer}!!""","""This is the end, witch of 1986. ......{p:2:This closed room is perfect!! Therefore, I can't get out, and you can't lay a finger on me from the outside! However, you 'locked me into this room'! So, we can say you killed me with this simple trick...!! You shut me in this perfect closed room and made me starve to death...!! Since you intentionally did this, there's no problem saying that 'this was a closed room murder with you as the killer'!!}",「これで終わりよ、１９８６年の魔女。……{p:2:この密室は完璧な密室！！ゆえに私は出られず、あんただって外部から私に指一本触れることは出来ない！でも、あんたは私をこの密室に“閉じ込めた”わ！それを以って、私を“殺した”と言える唯一のトリックがこれよ…！！あんたは私をこの完全な密室に閉じ込めて餓死させた…！！それを目論んで私を閉じ込めたなら、これは立派に“あんたが殺したことになる密室殺人”！！},「これで終わりよ、１９８６年の魔女。……{p:2:この密室は完璧な密室！！　ゆえに私は出られず、あんただって外部から私に指一本触れることは出来ない！　でも、あんたは私をこの密室に“閉じ込めた”わ！　それを以って、私を“殺した”と言える唯一のトリックがこれよ…！！　あんたは私をこの完全な密室に閉じ込めて餓死させた…！！　それを目論んで私を閉じ込めたなら、これは立派に“あんたが殺したことになる密室殺人”！！}」,"""Вот и всё, ведьма 1986. ......{p:2:Эта закрытая комната идеальна! Поэтому я не могу выйти, а ты снаружи не можешь добраться до меня! Но ты {i:заперла меня} в этой комнате! И можно сказать, что ты убила меня этой простой хитростью!.. Ты заперла меня в этой идеальной закрытой комнате и заставила умереть с голоду!.. Ты сделала так намеренно, поэтому это правильное «убийство в закрытой комнате, где убийцей была ты»}!""","""Esse é o fim, bruxa de 1986. ......{p:2:Este quarto fechado é perfeito!! Portanto, eu não posso sair, e você não pode encostar um dedo em mim pelo lado de fora! Mas você {i:me trancou} neste quarto! E há apenas um único truque que faz o mesmo que você me ""matar""...!! Você me trancou neste quarto fechado perfeito e me fez morrer de fome...!! Como você fez isso intencionalmente, não existe nenhum problema em dizer que esse é um assassinato de quarto fechado onde você é a assassina}!!""",「這樣就結束了，1986 年的魔女。……{p:2:這個密室是完美的密室！！所以我出不去，你從外面也碰不到我一根汗毛！但是，你把我“關在了”這個密室裡！由此，這就是唯一可以說是把我“殺死”的手法…！！你把我關入這個完美的密室裡餓死我…！！因為是你策劃把我關進來的，這就是完美的“由你殺死我的密室殺人”！！}」,「这样就结束了，1986 年的魔女。……{p:2:这个密室是完美的密室！！所以我出不去，你从外面也碰不到我一根汗毛！但是，你把我“关在了”这个密室里！由此，这就是唯一可以说是把我“杀死”的手法…！！你把我关入这个完美的密室里饿死我…！！因为是你策划把我关进来的，这就是完美的“由你杀死我的密室杀人”！！}」,"""Questa è la fine, strega del 1986. ... {p:2:Questa stanza chiusa è perfetta!!} {p:2:Perciò, io non posso uscire, e tu non puoi alzare un dito su di me dall'esterno!} {p:2:Tuttavia, mi hai ‘chiuso in questa stanza’!} {p:2:Quindi, possiamo dire che mi hai ucciso con questo semplice trucco...!!} {p:2:Mi hai rinchiuso in questa stanza chiusa perfetta e mi hai fatto morire di fame...!!} {p:2:Dato che hai fatto ciò intenzionalmente, non c'è problema nel dire che ‘questo era un omicidio con una stanza chiusa con te come assassina’!!}"
{f:5:Ange Beatrice},"It looks like being overly vague with the cause of death backfired on you. ......So long, witch of illusions. <See you in hell>."" ","""It looks like being overly vague with the cause of death backfired on you. .........So long, witch of illusions. <See you in hell>."""," It looks like being overly vague with the cause of death backfired on you. .........So long, witch of illusions. <See you in hell>.""",　死因を煙に巻きすぎたのが裏目に出たわね。………さようなら、幻想の魔女。シーユーヘル。」,「死因を煙に巻きすぎたのが裏目に出たわね。………さようなら、幻想の魔女。シーユーヘル」,"""Чрезмерная расплывчатость с причиной смерти обернулась против тебя. .........Прощай, ведьма иллюзий. See you in hell.""","""Parece que ser vaga demais com a causa da morte acabou se voltando contra você. .........Adeus, bruxa das ilusões. {i:See you in hell}.""",「給死因打了太多煙霧彈反而露出了破綻呢。………再見了，幻想的魔女。See you hell.」,「给死因打了太多烟雾弹反而露出了破绽呢。………再见了，幻想的魔女。See you hell.」,"Sembra che essere eccessivamente vaghi con le cause della morte ti si sia ritorto contro. ... Addio, strega delle illusioni. {p:0:＜}See you in hell{p:0:＞}."""
,"With the stained glass window behind her, Beato spread her arms and let the spear of the blue truth pierce her. ","With the stained glass window behind her, Beato spread her arms and let the spear of the blue truth pierce her.",[=UP],その青き真実の槍を、ステンドグラスを背負って浮かぶベアトは両腕を広げて受け入れる。,[=JP],"Стоя перед витражом, Беато развела руки и дала копью синей правды пронзить её.","Com o vitral às suas costas, Beato abriu seus braços e recebeu a lança da verdade azul em seu peito.",背對著彩繪玻璃浮在空中的貝阿朵，伸開雙臂接受那藍色真實之槍。,背对着彩绘玻璃浮在空中的贝阿朵，伸开双臂接受那蓝色真实之枪。,"Con la vetrata colorata dietro di lei, Beato spiegò le sue braccia e lasciò che la lancia della verità blu la perforasse."
,The blue spear seemed to crucify Beato against the window. ,The blue spear seemed to crucify Beato against the window., The blue spear seemed to crucify Beato against the window.,青き槍はベアトをステンドグラスに、磔刑のように縫い付けた。,[=JP],"Казалось, что синее копьё распяло её об окно.",A lança azul parecia crucificar Beato contra o vidro.,藍色的槍將貝阿朵如接受磔刑一般，釘在了彩繪玻璃上。,蓝色的枪将贝阿朵如接受磔刑一般，钉在了彩绘玻璃上。,Sembrava che la lancia blu stesse crocifiggendo Beato contro la finestra.
{f:5:Beatrice},"""......Nng...gah......"" ",""".........Nng.........gah............""",""".........Nng...gah.........""",「………ぐ、………ぬ…………、」,[=JP],""".........Н‐нг...... гх.........""",[=UP],「………咕，………唔…………，」,[=CHT],"""... Nng... gah..."""
{f:5:Ange Beatrice},"""Game set. ...So, this is Aunt Eva's diary, ...the Book of the Single Truth."" ","""Game set. ...So, this is Aunt Eva's diary, ......the Book of the Single Truth.""","""Game set. ...So, this is Eva oba-san's diary, ......the Book of the Single Truth.""",「ゲームセット。…これが絵羽伯母さんの日記、……一なる真実の書ね。」,「ゲームセット。…これが絵羽伯母さんの日記、……一なる真実の書ね」,"""Исход решён. ...Так вот он, дневник тёти Евы...... книга единственной правды.""","""{i:Game set}. ...Este é o diário da Tia Eva, ......o Livro da Única Verdade.""",「遊戲結束。…這就是繪羽姑母的日記，……唯一真實之書呢。」,「游戏结束。…这就是绘羽姑母的日记，……唯一真实之书呢。」,"""Fine dei giochi. ... Quindi, questo è il diario di Eva oba-san... il Libro dell'Unica Verità."""
,"Ange picked the book up from where it lay on the altar, sealed in crystal. ","Ange picked the book up from where it lay on the altar, sealed in crystal.",[=UP],縁寿は、祭壇の上に置かれた、水晶に封じられたそれを手に取る。,[=JP],"Энджи взяла с алтаря книгу, запечатанную в кристалле.","Ange pegou o livro de onde ele descansava sobre o altar, selado no cristal.",緣壽將放在祭壇上的，被水晶封印著的那個拿在手上。,缘寿将放在祭坛上的，被水晶封印着的那个拿在手上。,"Ange prese il libro da dove giaceva sull'altare, sigillato nel cristallo."
{f:5:Beatrice},"""...If you read that, then by your contract with {f:5:Bernkastel}, you will die... ...Learning the truth just to die? Ridiculous...!!"" ","""......If you read that, then by your contract with {f:5:Bernkastel}, you will die... .........Learning the truth just to die? Ridiculous...!!""","""......If you read that, then by your contract with Bernkastel, you will die... ......Learning the truth just to die? Ridiculous...!!""",「……それを読めば、そなたはベルンカステルとの契約により、死ぬのであろうが…。………死ぬために真実を知るのか？　馬鹿げている…！！」,[=JP],"""......Прочитав её, согласно твоему договору с {f:5:Бернкастель}, ты умрёшь... ......Узнать правду просто чтобы умереть? Чушь!..""","""......Se o lê‐lo, devido ao seu contrato com {f:5:Bernkastel}, você morrerá... .........Aprender a verdade para simplesmente morrer? Ridículo...!!""",「……讀了它的話，汝就會因與貝倫卡斯泰露定下的契約而死吧…？………為了去死而知道真實嗎？簡直是瘋了…！！」,「……读了它的话，汝就会因与贝伦卡斯泰露定下的契约而死吧…？………为了去死而知道真实吗？简直是疯了…！！」,"""... Se lo leggi, allora per il tuo contratto con Bernkastel, morirai... scoprire la verità solo per morire? Ridicolo...!!"""
{f:5:Ange Beatrice},"""That's right. I'm looking for the truth so I can die. ...At least let me choose how I go. ...I'm not an idiot. ...I know the real me is still floating in that starry sky."" ","""That's right. I'm looking for the truth so I can die. ......At least let me choose how I go. .........I'm not an idiot. ......I know the real me is still.........floating in that starry sky.""","""That's right. I'm looking for the truth so I can die. ......At least let me choose how I go. ......I'm not an idiot. ......I know the real me is still floating in that starry sky.""",「そうよ。私は死ぬために真実を求めてるの。……死に方くらい、私に選ばせて。………私も馬鹿じゃない。……本当の私はきっと、………あの、地上の星空の宙に、浮かんでいるのよ。」,「そうよ。私は死ぬために真実を求めてるの。……死に方くらい、私に選ばせて。………私も馬鹿じゃない。……本当の私はきっと、………あの、地上の星空の宙に、浮かんでいるのよ」,"""Верно. Я ищу правду для того, чтобы умереть. ......Дайте хоть самой выбрать, как. ......Я не идиотка. ......Я знаю, что настоящая я всё ещё парит в том звёздном небе.""","""Tem razão. Eu estou procurando a verdade para poder morrer. ......Ao menos me deixe escolher como será. .........Eu não sou idiota. ......Eu sei que a verdadeira eu ainda.........está flutuando naquele céu estrelado.""",「是啊。我就是為了去死而追求真實的。……死法至少讓我自己來選擇。………我也不是笨蛋。……真正的我一定，………還浮在那個，地上的星空的空中。」,「是啊。我就是为了去死而追求真实的。……死法至少让我自己来选择。………我也不是笨蛋。……真正的我一定，………还浮在那个，地上的星空的空中。」,"""È così. Sto cercando la verità così che possa morire. ... Fammi almeno scegliere come andarmene. ... Non sono un'idiota. ... So che la vera me sta ancora fluttuando in quel cielo stellato."""
,{f:5:Bernkastel} acknowledged me as the final {f:5:Beatrice} and invited me on a journey to learn the truth of 1986. ,{f:5:Bernkastel} acknowledged me as the final {f:5:Beatrice} and invited me on a journey to learn the truth of 1986.,Bernkastel acknowledged me as the final Beatrice and invited me on a journey to learn the truth of 1986.,ベルンカステルは、私を最後のベアトリーチェだと認め、１９８６年の真実を知る旅に私を招いた。,[=JP],{f:5:Бернкастель} признала меня последней {f:5:Беатриче} и пригласила в путешествие к правде 1986.,A {f:5:Bernkastel} me reconheceu como a última {f:5:Beatrice} e me convidou a uma jornada para aprender a verdade sobre 1986.,貝倫卡斯泰露，認同我為最後的貝阿朵莉切，將我招待至獲知 1986 年的真實之旅。,贝伦卡斯泰露，认同我为最后的贝阿朵莉切，将我招待至获知 1986 年的真实之旅。,Bernkastel mi ha riconosciuto come l'ultima Beatrice e mi ha invitato in un viaggio per scoprire la verità del 1986.
,I won't be able to return here again. ,There would be no coming back from that journey., I won't be able to return here again.,ここには二度と戻って来られない。,[=JP],Я больше не смогу вернуться.,Não haveria retorno dessa jornada.,無法再回到這裡了。,无法再回到这里了。,Non potrò ritornare qui di nuovo.
,"When {f:5:Bernkastel} told me that and walked off the roof into the black sky, ...I followed her into the empty air. ","When {f:5:Bernkastel} told me that and walked off the roof into the black sky, ......I followed her into the empty air."," When Bernkastel told me that and walked off the roof into the black sky, ......I followed her into the empty air.",そう告げて、ビルの屋上から漆黒の中空へ歩み出すベルンカステルの背中を追って、……私も中空へ足を踏み出した。,[=JP],Когда {f:5:Бернкастель} сказала мне это и сошла с крыши в ночное небо...... я последовала за ней в пустой воздух.,"Quando ela me disse isso e caminhou além do telhado, na direção do céu azeviche, ......eu a segui sobre o ar vazio.",追在這樣說著，向著大樓上方漆黑的夜空走去的貝倫卡斯泰露身後，……我也向空中踏出了腳步。,追在这样说着，向着大楼上方漆黑的夜空走去的贝伦卡斯泰露身后，……我也向空中踏出了脚步。,Quando Bernkastel mi ha disse ciò e camminò nel cielo nero... io la seguii nell'aria vuota.
,That was the contract. I wanted two things from {f:5:Bernkastel}. ,That was the contract. I wanted two things from {f:5:Bernkastel}., That was the contract. I wanted two things from Bernkastel.,それが、契約。私はベルンカステルに２つを望んだ。,[=JP],Таков был уговор. Я хотела от {f:5:Бернкастель} две вещи.,Esse foi o contrato. Eu queria duas coisas da {f:5:Bernkastel}.,這就是，契約。我向貝倫卡斯泰露提出了兩個願望。,这就是，契约。我向贝伦卡斯泰露提出了两个愿望。,Quello era il contratto. Volevo due cose da Bernkastel.
,One was for someone from my family to come back. The other...was revenge. ,One was for someone from my family to come back.{n}The other......was revenge., One was for someone from my family to come back. The other......was revenge.,１つは家族が誰か帰ってきて欲しい。もう１つは、……復讐。,１つは家族が誰か帰ってきて欲しい。{n}もう１つは、……復讐。,Первое — чтобы кто‐нибудь из моей семьи вернулся.{n}А второе...... месть.,Uma era que alguém da minha família retornasse.{n}A outra era......vingança.,一個是希望親人中有人能回來。{n}另一個是，……復仇。,一个是希望亲人中有人能回来。{n}另一个是，……复仇。,Una era far tornare qualcuno della mia famiglia. L'altra... era vendetta.
,I wanted to destroy the Illusion of the Witch that hid the events of that day. I wanted to reach the truth. ,"To destroy the witch illusions concealing the events of that day. In other words, to reach the truth.", I wanted to destroy the Illusion of the Witch that hid the events of that day. I wanted to reach the truth.,あの日に何があったのかを覆い隠す、魔女幻想を打ち破るということ。即ち、真実に至るということ。,[=JP],"Я хотела разрушить иллюзию ведьмы, скрывающую события того дня. Хотела узнать правду.","Destruir a ilusão da bruxa que encobria os acontecimentos daquele dia. Ou seja, alcançar a verdade.",打破隱藏著那一天發生了什麼的魔女幻想。這即是，抵達真實。,打破隐藏着那一天发生了什么的魔女幻想。这即是，抵达真实。,Volevo distruggere l'Illusione della Strega che aveva nascosto gli eventi di quel giorno. Volevo raggiungere la verità.
,"However, the first of my wishes couldn't come true. ","However, the first of my wishes couldn't come true."," However, the first of my wishes couldn't come true.",しかし、最初の願いは叶えられない。,[=JP],Однако моё первое желание не могло сбыться.,Mas o meu primeiro desejo não se concretizou.,但是，第一個願望無法實現。,但是，第一个愿望无法实现。,"Tuttavia, il primo dei miei desideri non poteva avverarsi."
,"After all, even the Witch of Miracles couldn't find a Fragment where my family came home. ","After all, even the Witch of Miracles couldn't find a fragment where my family came home."," After all, even the Witch of Miracles couldn't find a Fragment where my family came home.",だって、奇跡の魔女でさえ、私の家族が帰ってくるというカケラを見つけられなかった。,[=JP],"Ведь даже ведьма чудес не смогла найти фрагмент, где моя семья вернулась домой.","Afinal, nem mesmo a Bruxa dos Milagres conseguiu encontrar um Fragmento no qual a minha família voltava para casa.",因為，就連奇跡的魔女，也找不到我的家人能回來的碎片。,因为，就连奇迹的魔女，也找不到我的家人能回来的碎片。,"Dopotutto, persino la Strega dei Miracoli non è riuscita a trovare un Frammento dove la mia famiglia tornava a casa."
,"So, she wordlessly questioned me. ","So, she wordlessly questioned me."," So, she wordlessly questioned me.",だから、彼女は無言で私に問い掛けたのだ。,[=JP],Поэтому она без слов спросила меня.,"Então, ela me questionou sem usar de palavras.",所以，她無言地對我說。,所以，她无言地对我说。,"Quindi, mi interrogò silenziosamente."
