Hachijo Tohya,"""I won't write it. I will merely record it. ...The tale that Ushiromiya Ange weaves herself."" ","""I won't write it. I will merely record it. ......The tale that Ushiromiya Ange weaves herself.""","""I won't write it. I will merely show it. ......The tale that Ushiromiya Ange weaves herself.""",「私は書かぬ。記すだけだ。……右代宮縁寿が自ら紡ぐ物語をな。」,「私は書かぬ。記すだけだ。……右代宮縁寿が自ら紡ぐ物語をな」,"""Я не буду писать. Я просто покажу. ......Историю, которую Уширомия Энджи сплетёт сама.""","""Eu não escreverei. Meramente o gravarei. ......O conto que a própria Ushiromiya Ange tecer.""",「我不是寫。而是記述。……記述右代宮緣壽自己編織出的故事。」,「我不是写。而是记述。……记述右代宫缘寿自己编织出的故事。」,"""Non lo scriverò. Semplicemente, lo mostrerò. ... Il racconto che Ushiromiya Ange medesima tesse."""
{f:5:Bernkastel},"""So, ...you're going to do that sort of thing again?"" ","""So, ......you're going to do that sort of thing again?""",[=UP],「また、……そういうことをするのね。」,「また、……そういうことをするのね」,"""Значит...... опять собираешься сделать то же самое?""","""Então, ......vai fazer aquilo de novo?""",「你，……又要做這種事了呢。」,「你，……又要做这种事了呢。」,"""Quindi... farai di nuovo quel genere di cosa?"""
Hachijo Tohya,"""After growing tired of a thousand years of life, I've decided that choosing not to know the truth is the more noble path. ...However, I now see that it isn't fair to force my opinion on Ange, who hasn't lived even a hundred years."" ","""After growing tired of a thousand years of life, I am of the opinion that deliberately choosing not to learn the truth is the more noble path. ......However, I now see that it isn't fair to force my opinion on Ange, who hasn't lived even a hundred years.""","""After growing tired of a thousand years of life, I've decided that choosing not to know the truth is the more noble path. ......However, I now see that it isn't fair to force my opinion on Ange, who hasn't lived even a hundred years.""",「私は、真実を知らぬことを敢えて選ぶ方が高潔であると、千年を生き飽きた末に思う。……しかし、百年も生きぬ縁寿に、その価値観を押し付けるのも酷であると、今、理解した。」,「私は、真実を知らぬことを敢えて選ぶ方が高潔であると、千年を生き飽きた末に思う。……しかし、百年も生きぬ縁寿に、その価値観を押し付けるのも酷であると、今、理解した」,"""Устав от тысячелетней жизни, я решила, что предпочесть не знать правду — более благородный путь. ......Но теперь я вижу, что несправедливо навязывать моё мнение Энджи, не прожившей и сотни лет.""","""Após me cansar de milhares de anos de vida, eu sou da opinião de que escolher deliberadamente por não aprender a verdade é o caminho mais nobre. ......Contudo, agora eu vejo que não é justo forçar a minha opinião sobre ela, quem não viveu nem cem anos.""",「我活夠了千年後認為，敢選擇不去獲知真實的人是高潔的。……但是，現在理解了，將這個價值觀加在活了還不足百年的緣壽身上，是何等的過分。」,「我活够了千年后认为，敢选择不去获知真实的人是高洁的。……但是，现在理解了，将这个价值观加在活了还不足百年的缘寿身上，是何等的过分。」,"""Dopo essermi stancata di essere vissuta per mille anni, ho deciso che scegliere di non conoscere la verità sia il percorso più nobile. ... Ciononostante, ora comprendo che non sia giusto forzare la mia opinione su Ange, che non ha vissuto nemmeno per cent'anni."""
{f:5:Bernkastel},"""So, ...you're going to leave it in Ange's care?"" ","""So, ......you're going to leave it in Ange's care?""",[=UP],「だから、……縁寿に委ねようと？」,[=JP],"""То есть...... ты оставишь всё ей?""","""Por isso, ......vai deixar aos cuidados da Ange?""",「所以，……就交給緣壽了？」,「所以，……就交给缘寿了？」,"""Allora... lo lascerai in affidamento ad Ange?"""
Hachijo Tohya,"""Yes. I will silently record it as it plays out."" ","""Yes. I will write it as it plays out.""",[=UP],「そうだ。それを、私は淡々と記す。」,「そうだ。それを、私は淡々と記す」,"""Да. Я напишу то, что выйдет в итоге.""","""Sim. Eu anotarei conforme se desenrolar.""",「對。我只是輕描淡寫地記述。」,「对。我只是轻描淡写地记述。」,"""Sì. Lo scriverò mentre viene recitato."""
{f:5:Bernkastel},"""...If you're leaving it to Ange, ...then the rest of this tale is pretty much set in stone, right...?"" ","""......If you're leaving it to Ange, ......then the future course of this tale is all but set in stone, right...?""","""......If you're leaving it to Ange, ......then most of what's left of this tale is pretty much set in stone already, right...?""",「……縁寿に委ねるということは、……もうこの物語の向かう先は、半ば決まったようなものだけど…？」,[=JP],"""......Если выбор за Энджи...... большая часть оставшейся истории уже решена, верно?..""","""......Se está deixando para ela, ......então o curso futuro deste conto já está definido, não...?""",「……交給緣壽就代表著，……這個故事的走向，已經基本上定下了啊…？」,「……交给缘寿就代表着，……这个故事的走向，已经基本上定下了啊…？」,"""... Se lo stai affidando ad Ange... allora molto di quello che rimane di questa storia è praticamente già deciso, giusto...?"""
Hachijo Tohya,"""So it would seem. ...Let it be so. ...After all, in the end, a tale that a child of man weaves for herself will be more fun than any story I could create."" ","""It would seem so. .........Let it be so. ......After all, in the end, a tale that a child of man weaves for herself will be more fun than any story I could create.""","""It would seem so. ......Let it be so. ......After all, in the end, a tale that a child of man weaves for herself will be more fun than any story I could create.""",「そうなるだろうな。………それで良い。私が記すどのような物語よりも結局は、……人の子が自ら紡ぐ物語の方が、面白いのだから。」,「そうなるだろうな。………それで良い。私が記すどのような物語よりも結局は、……人の子が自ら紡ぐ物語の方が、面白いのだから」,"""Видимо, да. ......Пусть. ......Её история всё равно будет гораздо интереснее любой истории, которую я могла бы создать.""","""É o que aparenta. .........Deixe que assim seja. ......Afinal, no fim, um conto tecido por conta própria por aquele filho do homem será muito mais interessante que qualquer história que eu possa criar.""",「會是這樣啊。………這樣也好。因為比起我所記述的任何故事，……最終還是人子自己編織的故事，要更有趣。」,「会是这样啊。………这样也好。因为比起我所记述的任何故事，……最终还是人子自己编织的故事，要更有趣。」,"""Sembrerebbe di sì. ... Diciamo di sì. ... Dopotutto, alla fine, una storia scritta da un figlio dell'uomo per se stesso sarà più divertente di ogni altra storia che io possa creare."""
{f:5:Bernkastel},"""In that case, why don't you lend a hand in Ange's tale? You've already given yourself a role in it, haven't you...?"" ","""In that case, why don't you lend a hand in Ange's tale? You've already given yourself a role in it, haven't you...?""",[=UP],「なら、縁寿の物語に付き合ってあげたら？　出番はもう、作ってあげたでしょ…？」,[=JP],"""Тогда почему бы тебе не помочь Энджи в её истории? Ты ведь уже отвела себе роль в ней?..""","""Nesse caso, por que não dá uma mão no conto da Ange? Você já desistiu do seu papel, não...?""",「那麼，就奉陪一下緣壽的故事怎樣？你已經準備好了，自己的戲份吧…？」,「那么，就奉陪一下缘寿的故事怎样？你已经准备好了，自己的戏份吧…？」,"""In questo caso, perché non dai una mano nella storia di Ange? Tu stessa ti sei già data un ruolo in essa, no...?"""
Hachijo Tohya,"""...Hmm. ...So, is it my role to bring this tale to its conclusion?"" ",""".........Hmm. ......So, it is my role to bring this tale to its conclusion.""","""......Hmm. ......So, it is my role to bring this tale to its conclusion.""",「………ふむ。……私は、この物語にピリオドを打つ役目か。」,「………ふむ。……私は、この物語にピリオドを打つ役目か」,"""......Хм‐м. ......В общем, моя роль — довести эту историю до конца.""",""".........Hmm. ......Então, meu papel é trazer uma conclusão a este conto?""",「………嗯。……我是，給這個故事打上句號的角色嗎？」,「………嗯。……我是，给这个故事打上句号的角色吗？」,"""... Hmm. ... Quindi, il mio ruolo è portare a conclusione questa storia."""
{f:5:Bernkastel},"""Come on, that's no way for someone in Beato's game to talk. ...It's your job to tear the guts out of the cat box."" ","""Come on, that's no way for someone in Beato's game to talk. ......It's your job to tear the guts out of the cat box.""",[=UP],「ベアトのゲーム風に、もっとカッコよく言って欲しいわ。……猫箱のハラワタを、引き摺り出す役目よ。」,「ベアトのゲーム風に、もっとカッコよく言って欲しいわ。……猫箱のハラワタを、引き摺り出す役目よ」,"""В игре Беато так не говорят. ......Твоя работа — вырвать внутренности кошачьей коробки.""","""Vamos, não tem como alguém no jogo da Beato falar. ......É o seu dever arrancar as entranhas da caixa de gato.""",「應該說得更帥氣一點，用貝阿朵的遊戲風格說。……是將貓箱的內臟，扯出來的角色喲。」,「应该说得更帅气一点，用贝阿朵的游戏风格说。……是将猫箱的内脏，扯出来的角色哟。」,"""Avanti, non è così che dovrebbe parlare qualcuno nel gioco di Beato. {n}È tuo dovere strappare le interiora fuori dalla scatola del gatto."""
,"Hachijo chuckled, pushed aside the pile of writing paper, and picked up ""the Book of the Single Truth"". ","Hachijo chuckled, pushed aside the pile of writing paper, and picked up the Book of the Single Truth.","Hachijo chuckled, pushed aside the pile of writing paper, and picked up 'the Book of the Single Truth'.",八城は、ふっと笑いながら、原稿用紙の山を払い除け、“一なる真実の書”を取り出す。,[=JP],"Хачиджо усмехнулась, отодвинула кучу писчей бумаги и взяла «книгу единственной правды».","Hachijo riu, empurrando para o lado a pilha de papel, e pegando o Livro da Única Verdade.",八城呵呵笑著，將稿紙之山挪開，拿出“唯一真實之書”。,八城呵呵笑着，将稿纸之山挪开，拿出“唯一真实之书”。,"Hachijo ridacchiò, scostò la pila di fogli, e prese il ‘Libro dell'Unica Verità’."
,"Then, she opened a locked drawer. ","Then, she opened a locked drawer."," Then, she opened a locked drawer.",そして、施錠された引き出しを開く。,[=JP],Затем она открыла запертый ящик.,"Então, ela abriu o cadeado da gaveta.",然後，打開被上了鎖的抽屜。,然后，打开被上了锁的抽屉。,"Poi, aprì un cassetto chiuso."
Hachijo Tohya,"""...That is what Ange desires. ...Perhaps this book's seal is fated to be broken. ...Ange will reach the Single Truth, the Single Truth will break the seal on the cat box, and everything will then be exposed to the light of day. ","""......That is what Ange desires. ......Perhaps fate has decided that this book's seal is to be broken. ......Ange will reach the Single Truth, the Single Truth will break the seal on the cat box, and everything will be exposed to the light of day.""","""......That is what Ange desires. ......Perhaps fate has decided that this book's seal is to be broken. ......Ange will reach the Single Truth, the Single Truth will break the seal on the cat box, and everything will be exposed to the light of day.",「……縁寿が望むのだ。……この書の封印は解かれる運命にあるだろう。……縁寿は一なる真実に至り、一なる真実は猫箱の封印を開いて、全てを白日に晒す。,「……縁寿が望むのだ。……この書の封印は解かれる運命にあるだろう。……縁寿は一なる真実に至り、一なる真実は猫箱の封印を開いて、全てを白日に晒す」,"""......Вот то, что желает Энджи. ......Быть может, судьба решила, что печать этой книги должна быть сломана. ......Энджи узнает единственную правду, единственная правда сломает печать кошачьей коробки, и всё будет выставлено на дневной свет.""","""......Isto é o que a Ange deseja. ......Talvez o destino tenha decidido que o destino do selo deste livro é ser quebrado. ......Ela alcançará a Única Verdade, a Única Verdade quebrará o selo da caixa e tudo será exposto à luz do dia.""",「……緣壽她期待著。……這本書的封印會是被解開的命運吧？……緣壽抵達唯一真實，唯一真實將貓箱的封印解開，將一切披露于青天白日之下。」,「……缘寿她期待着。……这本书的封印会是被解开的命运吧？……缘寿抵达唯一真实，唯一真实将猫箱的封印解开，将一切披露于青天白日之下。」,"""... Questo è ciò che Ange desidera. ... Forse il destino ha deciso che il sigillo di questo libro debba essere rotto. ... Ange raggiungerà l'Unica Verità, l'Unica Verità romperà il sigillo della scatola del gatto, e tutto verrà esposto alla luce del giorno."
Hachijo Tohya,"And so, all of those countless message bottles and Fragments made up of delightful imaginings, which have been scattered across the ocean of the internet, will fade away like foam on the sea. ...After all, even that person has surely tired of such Fragments."" ","""And so, all of those countless message bottles and fragments made up of delightful imaginings, which have been scattered across the ocean of the internet, will fade away like foam on the sea. .........After all, even that one has surely tired of such fragments."""," And so, all of those countless message bottles and Fragments made up of delightful imaginings, which have been scattered across the ocean of the internet, will fade away like foam on the sea. ......After all, even that person has surely tired of such Fragments.""",それを以って、ネットの海に無数にばら蒔かれた愉快なる妄想のボトルメッセージとカケラは、全て海の泡となって消え果てる。………あやつももう、そのようなカケラには疲れ果てただろうからな。」,「それを以って、ネットの海に無数にばら蒔かれた愉快なる妄想のボトルメッセージとカケラは、全て海の泡となって消え果てる。………あやつももう、そのようなカケラには疲れ果てただろうからな」,"""И так все те бесчисленные послания в бутылках и фрагменты из сладостного воображения, разбросанные по всему океану интернета, исчезнут как пена на волнах. ......Ведь даже этому человеку наверняка надоели такие фрагменты.""","""E assim, todas aquelas incontáveis mensagens nas garrafas e Fragmentos fabricados por deleitáveis imaginações, que foram espalhados através do oceano da internet, desaparecerão como espuma do mar. .........Afinal, ela também já se cansou de tais Fragmentos.""",「由此，播撒在網絡之海的無數愉快妄想的漂流瓶和碎片，都將化作海裡的泡沫消失。………那傢伙也已經，厭倦於這樣的碎片了吧？」,「由此，播撒在网络之海的无数愉快妄想的漂流瓶和碎片，都将化作海里的泡沫消失。………那家伙也已经，厌倦于这样的碎片了吧？」,"E così, tutti quegli innumerevoli messaggi in bottiglia e Frammenti create con tanta immaginazione, che sono stati sparsi nell'oceano che è internet, svaniranno come spuma sul mare. ... Dopotutto, anche quella persona si è di certo stancata di quei Frammenti."""
{f:5:Bernkastel},"""It's about time for that kid's journey to end too."" ","""It's about time for that kid's journey to end as well.""","""It's about time for that kid to finish her journey too.""",「もう、あの子も旅を終えてもいい頃だわ。」,「もう、あの子も旅を終えてもいい頃だわ」,"""Пора и ей закончить своё путешествие.""","""Está na hora da jornada daquela criança terminar.""",「已經到了，讓那孩子和旅途都結束的時候了。」,「已经到了，让那孩子和旅途都结束的时候了。」,"""È quasi ora che anche quella ragazza finisca la sua avventura."""
Hachijo Tohya,"""...Yes, let us accept this task. As our role demands, let's give this journey an ""end of the line""."" ","""......Yes, let us accept this task. Let us bring this journey to its final destination.""",[=UP],「……引き受けようではないか。その旅に、終着駅を与える役目を。」,「……引き受けようではないか。その旅に、終着駅を与える役目を」,"""......Да, возьмём на себя эту задачу. Давай доведём это путешествие до конечного пункта назначения.""","""......Sim, vamos aceitar essa tarefa. Conduziremos esta jornada ao seu destino final.""",「……就接下吧？給予這旅程的，終點站的任務。」,「……就接下吧？给予这旅程的，终点站的任务。」,"""... Sì, accogliamo questo compito. Portiamo questo viaggio verso la sua meta finale."""
,"At that moment, there were sounds of someone in the hallway. ","At that moment, there were sounds of someone in the hallway.",[=UP],その時、廊下に人の気配がする。,[=JP],В этот момент в коридоре раздались шаги.,"Nesse momento, se ouviu o som de alguém no corredor.",這時，走廊上傳來了人的氣息。,这时，走廊上传来了人的气息。,"In quel momento, si sentì il rumore di qualcuno nel corridoio."
,"The instant someone knocked on the door, {f:5:Bernkastel} turned back into a black cat. ","The instant someone knocked on the door, {f:5:Bernkastel} turned back into a black cat."," The instant someone knocked on the door, Bernkastel turned back into a black cat.",ノックの音と同時に、ベルンカステルは黒猫の姿に戻る。,[=JP],"Как только в дверь постучали, {f:5:Бернкастель} превратилась обратно в чёрную кошку.","No instante que alguém bateu na porta, {f:5:Bernkastel} se transformou em um gato preto.",敲門聲響起的同時，貝倫卡斯泰露變回了黑貓的樣子。,敲门声响起的同时，贝伦卡斯泰露变回了黑猫的样子。,"Nel momento in cui qualcuno bussò alla porta, Bernkastel ridivenne un gatto nero."
,"""...Madam Hachijo, please forgive me for interrupting."" ","""......Miss Hachijo, please forgive me for interrupting.""",[=UP],「……先生、執筆中失礼致します。」,「……先生、執筆中失礼致します」,"""......Мисс Хачиджо, простите, что прерываю.""","""......Sensei, sinto muito interrompê‐la.""",「……老師，抱歉在執筆中打擾您。」,「……老师，抱歉在执笔中打扰您。」,"""... Miss Hachijo, la prego di scusarmi per l'interruzione."""
,It was the voice of Hachijo's servant. ,It was the voice of Hachijo's servant.,[=UP],八城の使用人の声だった。,[=JP],Это был голос слуги Хачиджо.,Era a voz de uma das serviçais de Hachijo.,是八城的傭人的聲音。,是八城的佣人的声音。,Era la voce del domestico di Hachijo.
Hachijo Tohya,"""What is it? If it's a phone call, tell them I'm busy."" ","""What is it? If it's a phone call, tell them I'm busy.""",[=UP],「何か？　電話なら断って下さい。」,「何か？　電話なら断って下さい」,"""В чём дело? Если звонят, скажи, что я занята.""","""O que seria? Se for algum telefonema, diga que estou ocupada.""",「什麼？是電話的話就掛掉。」,「什么？是电话的话就挂掉。」,"""Che c'è? Se è una telefonata, riferisci che sono occupata."""
,"""It isn't that. ...Tohya-sama has woken up."" ","""It isn't that. ......Tohya‐sama has woken up.""","""It isn't that. ......Tohya-sama has woken up.""",「いえ。……十八さまがお目覚めになりました。」,「いえ。……十八さまがお目覚めになりました」,"""Нет. ......Господин Тойя проснулся.""","""Não é. ......O Tohya‐sama acordou.""",「不。……是十八大人醒了。」,[=CHT],"""Non è questo. ... Tohya-sama non sta più dormendo."""
Hachijo Tohya,"""Thank you. Prepare a light meal. Enough for the two of us."" ","""Thank you. Prepare a light meal. Enough for the two of us.""",[=UP],「ありがとう。軽食の準備を。私の分も一緒に。」,「ありがとう。軽食の準備を。私の分も一緒に」,"""Спасибо. Приготовь закуски. Для нас обоих.""","""Obrigada. Prepare uma refeição leve. O suficiente para nós dois.""",「謝謝你。準備一些餐點。連我的份一起。」,「谢谢你。准备一些餐点。连我的份一起。」,"""Grazie. Prepara un pasto leggero. Solo per noi due."""
,"""As you wish."" ","""As you wish.""",[=UP],「畏まりました。」,「畏まりました」,"""Как скажете.""","""Como desejar.""",「知道了。」,[=CHT],"""Come desidera."""
,"Hachijo stood up. Then, she shut the open drawer and locked it again. ","Hachijo stood up. Then, she shut the open drawer and locked it again.",[=UP],八城は立ち上がる。そして、開いた引き出しを再び閉めて、施錠する。,[=JP],Хачиджо встала. Затем она закрыла открытый ящик и снова заперла его.,"Hachijo se levantou. Então, ela fechou a gaveta e a trancou novamente.",八城站起來。將抽屜再次關上，上鎖。,八城站起来。将抽屉再次关上，上锁。,"Hachijo si alzò. Poi, richiuse il cassetto a chiave."
,Inside that drawer...lay a glittering golden key... ,Inside that drawer.........lay a glittering golden key......, Inside that drawer......lay a glittering golden key......,その引き出しの中には、………黄金色に輝くあの鍵が、横たわっていた……。,[=JP],В ящике...... лежал сверкающий золотой ключ......,Dentro dela.........descansava uma reluzente chave dourada......,在那抽屜之中，………閃耀著黃金色的那把鑰匙，正躺在裡面……。,在那抽屉之中，………闪耀着黄金色的那把钥匙，正躺在里面……。,In quel cassetto... c'era una chiave dorata luccicante...
Furudo Erika,"""Repeat it!! ""The definition of a closed room prevents all varieties of entering and exiting""!"" ","""Repetition requested!! ""The definition of a locked room prevents all varieties of entering and exiting""!""","""Repeat it!! 'The definition of a closed room prevents all varieties of entering and exiting'!""",「復唱要求ッ！！“密室の定義は、内外からのあらゆる出入りを否定するものである”！」,「復唱要求ッ！！　“密室の定義は、内外からのあらゆる出入りを否定するものである”！」,"""Повторите! 'Определение закрытой комнаты предотвращает все разновидности входа и выхода!'""","""Repetição requisitada!! ""A definição de quarto fechado impede todas as variações de entrada e saída""!""",「要求複述！！“密室的定義是，否定了從內外的各種出入方法的房間”！」,「要求复述！！“密室的定义是，否定了从内外的各种出入方法的房间”！」,"""Ripetilo!! ‘La definizione di stanza chiusa impedisce ogni tipo di entrata e uscita’!"""
