Ushiromiya Krauss,"""F-Father...! Is the door open yet...?! It looks like they're about to break in through the windows...!!"" ","""F‐Father...! Is the door open yet...?! It looks like they're about to break in through the windows...!!""","""F, Father...! Is the door open yet...?! It looks like they're about to break in through the windows...!!""",「お、お父さん…！　扉はまだ開きませんか…！　ヤツら、もうじき、窓を破ってきそうです…！！」,[=JP],"""О... отец!.. Дверь ещё не открылась?! Они вот‐вот прорвутся через окна!..""","""P‐Pai...! A porta ainda não abriu...?! Eles parecem estar prestes a entrar pelas janelas...!!""",「父、父親…！門還沒打開嗎…！它們馬上，就快打破窗戶了…！！」,「父、父亲…！门还没打开吗…！它们马上，就快打破窗户了…！！」,"""P-Padre...! La porta è aperta...?! Sembra che stiano per entrare dalle finestre...!!"""
Ronove,"""Krauss-sama, there is no need for you to fear. An Eiserne Jungfrau barrier is not so easily broken."" ","""Krauss‐sama, there is no need for you to fear. An Eiserne Jungfrau barrier is not so easily broken.""","""Krauss-sama, there is no need for you to fear. An Eiserne Jungfrau barrier is not so easily broken.""",「蔵臼さま、どうかご安心を。アイゼルネ・ユングフラウの結界、そう易々と破れるものではございません。」,「蔵臼さま、どうかご安心を。アイゼルネ・ユングフラウの結界、そう易々と破れるものではございません」,"""Господин Краусс, вам нечего бояться. Барьер Айзерн Юнгфрау не так просто сломать.""","""Krauss‐sama, não há motivos para medo. A barreira da Eiserne Jungfrau não quebraria facilmente.""",「藏臼先生，請您安心。鋼鐵處女的結界，不是輕易能夠打破的。」,「藏臼先生，请您安心。钢铁处女的结界，不是轻易能够打破的。」,"""Krauss-sama, non c'è alcun bisogno che si spaventi. Una barriera delle Eiserne Jungfrau non si rompe così facilmente."""
{f:5:Virgilia},"""Very soon, it'll be big enough for adults to go through too. Don't worry. We'll make it in time."" ","""Very soon, it'll be big enough for adults to go through too. Don't worry. We'll make it in time.""",[=UP],「もうじき、大人も通れるようになります。大丈夫ですよ、間に合います。」,「もうじき、大人も通れるようになります。大丈夫ですよ、間に合います」,"""Вскоре она будет достаточно широкой для того, чтобы через неё прошли и взрослые. Не беспокойтесь. Мы успеем.""","""Muito em breve, estará aberto o bastante para os adultos passarem. Não se preocupem. Vai dar tempo.""",「很快，大人們也能通過了。沒事的，來得及。」,「很快，大人们也能通过了。没事的，来得及。」,"""Molto presto, sarà abbastanza grande da fare passare anche gli adulti. {n}Non preoccupatevi. Ce la faremo in tempo."""
Kumasawa Chiyo,"""B-But...there's knocking and banging everywhere, and-"" ","""B‐but...there's knocking and banging everywhere, and—""","""B, but...there's knocking and banging everywhere, and-""",「し、しかし、ドンドンバンバンとすごい有様でしてそのッ、」,[=JP],"""Н‐но... повсюду стучат и бьют, и‐""","""M‐Mas...tem batidas e estrondos por todo lado—""",「但、但是，這叮叮咣咣的響聲相當的大，」,「但、但是，这叮叮咣咣的响声相当的大，」,"""M-Ma... ci sono colpi e rumori ovunque, e-"""
Ushiromiya Kinzo,"""Stay calm and wait. After all, there is nothing else we can do."" ","""Stay calm and wait. After all, there is nothing for us to do but wait.""",[=UP],「慌てずに待て。どうせ、我らには待つ以外に出来ることは何もないのだからな。」,「慌てずに待て。どうせ、我らには待つ以外に出来ることは何もないのだからな」,"""Сохраняйте спокойствие и ждите. Нам всё равно остаётся только ждать.""","""Fique calma e espere. No fim, não podemos fazer nada além de aguardarmos.""",「不要慌張安心等。反正，我們除了等待之外什麼都做不到。」,「不要慌张安心等。反正，我们除了等待之外什么都做不到。」,"""Sta' calma e aspetta. Dopotutto, per noi non c'è altro da fare se non aspettare."""
,Even the outer walls of the mansion were covered with goats. ,Even the outer walls of the mansion were covered with goats.,[=UP],屋敷の外壁にも、びっしりと山羊たちがしがみついてる。,[=JP],Даже внешние стены особняка были все в козлоголовых.,As paredes externas da mansão estão repletas de cabras.,大屋的外牆，也被擠成一團的山羊們啃咬著。,大屋的外墙，也被挤成一团的山羊们啃咬着。,Anche i muri esterni della villa erano coperti dai caproni.
,"And they were plunging their fangs and fists into the walls and windows, trying to crush them. ","And they were plunging their fangs and fists into the walls and windows, trying to break through them."," And they were plunging their fangs and fists into the walls and windows, trying to crush them.",そして、壁や窓を破ろうと、牙や拳を打ち付けるのだ。,[=JP],"И они впивались клыками и кулаками в стены и окна, пытаясь разрушить их.","Elas estão tentando enfiar suas presas e punhos nas paredes e janelas, tentando passar por elas.",並且，為了打破牆壁和窗戶，在用牙和拳頭不斷擊打。,并且，为了打破墙壁和窗户，在用牙和拳头不断击打。,"E stavano affondando le loro zanne e i loro pugni nei muri e nelle finestre, cercando di romperli."
,"So, anyone watching the goats stuck to all the windows in the hallway, smashing their thick arms against the windows, ...couldn't help but be terrified, even if they knew about the barrier. ","So, there were goats stuck to all the windows in the hallway, smashing their thick arms against the windows in a way that would terrify anyone, even if they knew about the barrier."," So, there were goats stuck to all the windows in the hallway, smashing their thick arms against the windows in a way that would terrify anyone, even if they knew about the barrier.",だから、廊下中の窓にびっしりと山羊たちがしがみ付き、窓をその豪腕で叩き続ける様子は、たとえ結界で守られているとわかっていても、怯えずにはいられぬものだった。,[=JP],"Поэтому некоторые козлоголовые застряли во всех окнах коридора, разбивая толстые руки об окна так, что напугали бы кого угодно, даже если они знали о барьере.","E tem também cabras agarradas às janelas do corredor, batendo com seus imensos braços contra as janelas, assustando a todos, mesmo eles sabendo que a barreira ainda estava de pé.",所以，走廊上的玻璃被密密麻麻的山羊們啃咬，用那粗手臂不停敲擊窗戶的樣子，就算知道自己被結界保護著，也還是會害怕。,所以，走廊上的玻璃被密密麻麻的山羊们啃咬，用那粗手臂不停敲击窗户的样子，就算知道自己被结界保护着，也还是会害怕。,"Quindi, c'erano caproni attaccati a tutte le finestre del corridoio, sbattendo le loro spesse braccia contro le finestre in una maniera che terrorizzerebbe chiunque, anche se sapesse della barriera."
,"However, anyone watching the group of goats gathered at the top of the big staircase on the other side of the barrier would probably feel a different emotion. ","However, anyone watching the group of goats gathered at the top of the big staircase from the safety of the other side of the barrier would probably feel a different emotion."," However, anyone watching the group of goats gathered at the top of the big staircase on the other side of the barrier would probably feel a different emotion.",しかし、窓ではなく、大階段の上で結界越しに山羊の群れを見る者は、他の感情を抱くだろう。,[=JP],"Но все те, кто наблюдал за группой козлоголовых, столпившихся на большой лестнице по другую сторону барьера, испытывали другую эмоцию.","Contudo, qualquer um observando o grupo de cabras se amontoando no topo da grande escadaria do lado oposto à segurança da barreira, provavelmente sentiria uma emoção diferente.",但是，不是窗戶，而是大樓梯那邊透過結界俯視山羊群的人們，心裡有著別樣的感覺。,但是，不是窗户，而是大楼梯那边透过结界俯视山羊群的人们，心里有着别样的感觉。,"Tuttavia, guardando il gruppo di caproni riuniti in cima alla grande scalinata dall'altro lato della barriera, chiunque proverebbe un'emozione diversa."
,"Rather than terror, ...it was a sad, empty sort of emotion. ","Instead of terror, ......it was a sad, empty sort of emotion."," Instead of terror, ......it was a sad, empty sort of emotion.",それは恐怖ではなく、……ある種の悲しさと、虚しさだった。,[=JP],Вместо ужаса...... эта эмоция была печальной и пустой.,"Ao invés do terror, ......seria uma emoção triste e vazia.",那不是恐怖，……而是某種悲傷和，空虛。,那不是恐怖，……而是某种悲伤和，空虚。,"Invece di terrore... era un triste, vuoto tipo di emozione."
,The barrier was drawn across the landing at the top of the hall's great staircase. ,The barrier was drawn across the landing at the top of the hall's great staircase., The barrier was drawn across the landing at the top of the hall's great staircase.,ホールの大階段は、踊り場の境で結界を張られている。,[=JP],Барьер протянулся наверху главной лестницы зала.,A barreira foi traçada cruzando o patamar do topo da grande escadaria do hall.,大廳的大樓梯，在樓梯平台的位置上展開了結界。,大厅的大楼梯，在楼梯平台的位置上展开了结界。,La barriera era estesa attraverso il pianerottolo in cima alla grande scalinata dell'ingresso.
,"Beyond that barrier, ...everything had already been eaten away. ","Beyond that barrier, ......everything had already been eaten away."," Beyond that barrier, ......everything had already been eaten away.",その結界の向こうは、……すでに、何もかもが食い尽くされてしまった。,[=JP],За этим барьером...... всё уже было съедено.,"Além da barreira, ......tudo já havia sido devorado.",那結界的另一邊，……所有的一切，都已經被吞食殆盡了。,那结界的另一边，……所有的一切，都已经被吞食殆尽了。,Oltre quella barriera... tutto era stato divorato.
,Was it even possible for those who stood in the hallway of the upper floors to believe that this was the Rokkenjima mansion? ,Was it even possible for those who stood in the hallway of the upper floors to believe that this was the Rokkenjima mansion?, Was it even possible for those who stood in the hallway of the upper floors to believe that this was the Rokkenjima mansion? ,上の階の廊下にいる者には、自分たちが、六軒島の屋敷の中にいると信じることが出来るだろう。,[=JP],"Могут ли те, кто стоит в коридорах верхних этажей, полагать, что это особняк Роккенджимы?","Era mesmo possível para aqueles que permaneciam no corredor do andar superior, acreditar que essa era a mansão de Rokkenjima?",在樓上的走廊上的人們，還能相信自己是在六軒島的大屋之中吧？,在楼上的走廊上的人们，还能相信自己是在六轩岛的大屋之中吧？,Era anche possibile per coloro che stavano nel corridoio dei piani superiori credere che questa era la villa di Rokkenjima?
,"By now, ...no one looking at this scene would be able to imagine such a thing. ","By now, ......no one looking at this scene would be able to imagine such a thing.",[=UP],しかし、ここにいて、……この光景を見ている者には、もはやそう思い込むことは出来ない。,[=JP],"Теперь...... ни один человек, видящий эту сцену, не смог бы представить такое.","Agora, ......ninguém olhando essa cena seria capaz de imaginar tal coisa.",但是，站在這裡，……看著這幅光景的人們，已經無法這樣想了。,但是，站在这里，……看着这幅光景的人们，已经无法这样想了。,"Da quel momento... nessuno guardando questa scena, sarebbe in grado di immaginare una cosa simile."
,Forget the hall or even the whole first floor... Even the ground itself was almost gone. ,Forget the hall or even the whole first floor...... Even the ground itself was almost gone., Forget the hall or even the whole first floor...... Even the ground itself was almost gone.,ホールはおろか、１階も、……そもそも大地さえもなくなろうとしている。,[=JP],Да что там зал или весь первый этаж...... Даже самой земли почти не осталось.,"Esqueça o hall ou até mesmo o primeiro andar...... Tudo, até mesmo o solo já tinha sumido.",不用說大廳了，1 層也，……就連大地也完全沒有了。,不用说大厅了，1 层也，……就连大地也完全没有了。,Dimenticate il ritratto e persino l'intero piano terra... anche il terreno stesso era quasi scomparso.
,The sea of goats had eaten everything apart long before this. ,The sea of goats had eaten everything apart long before this., The sea of goats had eaten everything apart long before this.,山羊の海は、とっくの昔に全てを食い尽くしていた。,[=JP],Море козлоголовых давным‐давно разъело всё.,O mar de cabras havia comido tudo há tempos.,山羊之海，早就將這些全部吞食了。,山羊之海，早就将这些全部吞食了。,Il mare di caproni aveva già divorato tutto molto prima.
,"They had eaten apart the hall, the pillars of the mansion, the floor, the ground, the sea, the very concept of the island... Every part of the game board Battler had created. ","They had eaten apart the hall, the pillars of the mansion, the floor, the ground, the sea, the very concept of the island......every part of the game board Battler had created."," They had eaten apart the hall, the pillars of the mansion, the floor, the ground, the sea, the very concept of the island......every part of the game board Battler had created.",ホールを食い尽くし、屋敷の柱を食い尽くし、床も、大地も、海も、概念も、……戦人の生み出したゲーム盤の全てを食い尽くした。,[=JP],"Они пожрали зал, столбы особняка, пол, землю, море, само понятие острова...... всю игровую доску, созданную Баттлером.","Elas haviam devorado o hall, os pilares da mansão, o piso, o solo, o mar, o próprio conceito da ilha......toda e cada parte do tabuleiro que Battler havia criado.",將大廳吃光，將大屋的柱子吃光，地板、大地、海、甚至概念，……將戰人做出的遊戲盤的一切吃得精光。,将大厅吃光，将大屋的柱子吃光，地板、大地、海、甚至概念，……将战人做出的游戏盘的一切吃得精光。,"Avevano divorato l'ingresso, i pilastri della villa, il pavimento, il terreno, il mare, il concetto stesso dell'isola... ogni parte del piano da gioco che Battler aveva creato."
,"And now, the only leftover was the upper part of the mansion, which floated along in empty space. ","And now, the only leftover was the upper part of the mansion, which floated along in empty space."," And now, the only leftover was the upper part of the mansion, which floated along in empty space.",今や、この屋敷は、上半分の食い残しのみが、虚無の空間に漂っているのだ。,[=JP],"И осталась только верхушка особняка, парящая в пустом пространстве.","E agora, tudo o que restara foi o andar superior da mansão, que flutuava sobre um espaço vazio.",現在，這間大屋，只剩下上面的一半，漂浮在虛無的空間裡。,现在，这间大屋，只剩下上面的一半，漂浮在虚无的空间里。,"E adesso, l'unico avanzo era la parte superiore della villa, che fluttuava nello spazio vuoto."
Dlanor,"""...How {f:5:pitiful}."" ","""......How {f:5:pitiful}.""","""......How PITIFUL.""",「……哀れなことデス。」,「……哀れなことデス」,"""......Какое {f:5:убожество}.""","""......É mesmo {f:5:lamentável}.""",「……真是可悲。」,[=CHT],"""... Com'è PIETOSO."""
Gertrude,"""To what do you refer?"" ","""To what do you refer?""",[=UP],「何が也や。」,「何が也や」,"""О чём вы?""","""Ao que se refere?""",「什麼？」,「什么？」,"""A cosa si riferisce?"""
Dlanor,"""...The goats, in their eagerness to chew this island apart, have eaten up even the ground they stood on, dropping themselves into {f:5:nothingness}."" ","""......The goats, in their eagerness to chew this island apart, have eaten up even the ground they stood on, dropping themselves into {f:5:nothingness}.""","""......The goats, in their eagerness to chew this island apart, have eaten up even the ground they stood on, dropping themselves into NOTHINGNESS.""",「……この島を食い尽くすという快楽に身を任せた山羊たちが、自分たちの足場さえ食い尽くし、虚無に落ちて、消えてイク。」,「……この島を食い尽くすという快楽に身を任せた山羊たちが、自分たちの足場さえ食い尽くし、虚無に落ちて、消えてイク」,"""......В своём стремлении разжевать остров козлоголовые грызут даже землю, на которой стоят, падая в {f:5:небытие}.""","""......As cabras, em sua avidez de consumir a ilha, devoraram o solo abaixo delas, jogando a si mesmas no {f:5:nada}.""",「……沉浸於將島吃光的快樂中的山羊們，連自己的落腳之處都吃掉，落入虛無而消失。」,「……沉浸于将岛吃光的快乐中的山羊们，连自己的落脚之处都吃掉，落入虚无而消失。」,"""... I caproni, nel loro desiderio di divorare quest'isola, hanno mangiato anche il terreno su cui si trovavano, gettandosi nel NULLA."""
,This had once been a huge entrance hall. ,This had once been a huge entrance hall.,[=UP],かつてそこは、広大なホールだった。,[=JP],Когда‐то здесь была огромная прихожая.,Este fora o grande hall de entrada.,過去這裡是，寬廣的大廳。,过去这里是，宽广的大厅。,Un tempo questo era stato un enorme ingresso.
,Beyond it had been a vast rose garden. ...There had been so many places to stand upon. ,Beyond it had been a vast rose garden. ......There had been so many places to stand upon., Beyond it had been a vast rose garden. ......There had been so many places to stand upon.,ホールの外には広大な薔薇庭園。……足の踏み場はいくらでもあった。,[=JP],"За ней простирался обширный розарий. ......Было столько мест, на которых можно стоять.",Além dele havia um vasto jardim de rosas. ......Tinham muitos lugares para se destacar.,大廳之外是寬廣的玫瑰庭園。……踏腳的地方有的是。,大厅之外是宽广的玫瑰庭园。……踏脚的地方有的是。,Oltre di esso c'era stato un vasto giardino di rose. ... C'erano stati così tanti posti su cui stare.
,"However, now, ...holes had been dug everywhere, and nearly everything outside the mansion was completely gone. ","However, now, ......holes had been dug everywhere, and nearly everything outside the mansion was completely gone."," However, now, ......holes had been dug everywhere, and nearly everything outside the mansion was completely gone.",しかし今や、……そこかしこは穴だらけで、もはや屋敷の外だった部分は完全に虚空。,[=JP],"Но теперь...... повсюду вырыты дыры, и почти всё снаружи особняка полностью исчезло.","Contudo, agora, ......buracos haviam sido abertos por todo lado, e praticamente todo o exterior da mansão tinha desaparecido.",但是現在，……到處都是洞，大屋之外的部分已經幾乎完全是虛空。,但是现在，……到处都是洞，大屋之外的部分已经几乎完全是虚空。,"Tuttavia, ora... dei buchi erano stati fatti ovunque, e quasi tutto fuori dalla villa era completamente scomparso."
,"Some goats were clutching to the few remaining footholds and pillars, still eating away at them. ","Some goats were clutching to the few remaining footholds and pillars, still eating away at them."," Some goats were clutching to the few remaining footholds and pillars, still eating away at them.",わずかに残った足場や柱などにしがみ付き、山羊たちはそれでもなお、ばりばりと貪り食っているのだ。,[=JP],"Некоторые козлоголовые жались к немногим оставшимся опорам и столбам, всё равно разъедая их.","Algumas cabras estavam se agarrando nos poucos apoios e pilares restantes, enquanto ainda continuavam a devorá‐los.",扒著僅存的一點落腳處和柱子，山羊們即便身處這種情況，還在不停地貪食著。,扒着仅存的一点落脚处和柱子，山羊们即便身处这种情况，还在不停地贪食着。,"Alcuni caproni continuavano ad azzannare i pochi appigli e pilastri rimanenti, strappandone via i pezzi."
Cornelia,"""...Let it be known that exposing the truth is murder."" ","""......It should be known that to expose the truth is to kill.""",[=UP],「……真実を暴くとは、殺すことと心得るもの也。」,「……真実を暴くとは、殺すことと心得るもの也」,"""......Да будет известно, что раскрыть правду означает убить.""","""......Deveria ser de conhecimento que expor a verdade é matar.""",「……已領教揭露真實，如同殺人。」,「……已领教揭露真实，如同杀人。」,"""... Dovrebbe essere risaputo che esporre la verità equivale ad uccidere."""
