Ushiromiya Battler,"Eva oba-san, secondo il tuo ragionamento... devi spiegarci perché tu e Hideyoshi oji-san non potreste aver ucciso quei sei la scorsa notte e poi tornare alla casa degli ospiti facendo finta di niente...!"
Ushiromiya Battler,"Stavi provando ad obbligare Natsuhi oba-san a spiegare. Sono sicuro che tu possa provare la tua innocenza, giusto?! Eva oba-san, tu che ora hai improvvisamente fra le mani tutto il patrimonio del Nonno!!"""
Ushiromiya Jessica,"""Es-Esatto, anche tu sei abbastanza sospetta, vero!!? Se affermi che Mamma lo è perché è stata l'ultima persona a vederlo, allora che mi dici di te, Eva oba-san, che sei stata l'ultima persona a vedere Papà e gli altri?!! Proprio come ha detto Battler, prova che voi due non siete quelli che li hanno uccisi!!"""
Ushiromiya George,"""... Madre, anche io penso che il tuo ragionamento sia stato un po' troppo affrettato. ... Sono sicuro che lo scontrino sia un indizio importante."
Ushiromiya George,"Ma, come ha detto Battler-kun, non è sufficiente per provare che Natsuhi oba-san è la colpevole. ... Penso che tutti siano egualmente sospetti. Non è giusto che solo Natsuhi oba-san sia perseguitata."""
Ushiromiya Eva,"""I-Il nostro magnifico Padre, che striscia sotto il suo letto? Tu chiami quella storiella senza senso una spiegazione?!"""
Ushiromiya Jessica,"""In questo caso, perché non lo spieghi per prima!!? Chi ha ucciso quei sei, e come, e poi prova a mostrarci prove che dimostrano che non sei coinvolta!!"
Ushiromiya Jessica,"... *cough*, *cough* *cough* *cough*, *cough*, *cough*!!! Uu- *coffcoffcoff*!! *coughCOUGH*!! *coffcoffcoffcoff*!!!"""
Kanon,"""Milady... Milady...!!"""
,"Jessica iniziò improvvisamente a tossire. All'inizio pensai che stesse solamente tossendo per aver gridato troppo forte, ma poco dopo, capii quanto sembrasse doloroso..."
,"Jessica continuò a tossire, inginocchiata a terra..."
Ushiromiya Natsuhi,"""Jessica... riprenditi...!! Dottor Nanjo...!"""
Nanjo Terumasa,"""... Jessica-san, il tuo inalatore, presto. ... No aspetta, ne ho uno con me."""
,"Dottor Nanjo tirò fuori un broncodilatatore dalla sua borsa, che era poggiata sul divano, e lo porse a Jessica."
,"... Ora che ci penso, sei anni fa, a volte Jessica non aveva forse crisi di violenti colpi di tosse e doveva usare una cosa del genere...?"
,"Tuttavia, sei anni fa, non avevo mai visto Jessica provare così tanto dolore."
Ushiromiya Battler,"""... Aniki, l'asma di Jessica è sempre stata così grave...?"""
Ushiromiya George,"""È peggiorata molto in questi ultimi anni... non è un problema quando lei è normale, ma... quando un attacco viene all'improvviso, non riesce più a smettere di tossire."""
Ushiromiya Jessica,"""*cough* *cough*!! Uu- ga-*COUGH* *coughcough*!! *coffcoff*, *coffcoff*!!"""
Kanon,"""... Milady, la sua medicina. ... Ecco..."""
Ushiromiya Jessica,"""... Nnn... *coughcough*!!"""
,"Prendendo l'inalatore da Kanon-kun, Jessica lo usò con mano esperta."
,"... Sembrava che la sua gola sarebbe stata ancora irritata per un po', ma ora era sotto controllo..."
Ushiromiya Battler,"""Stai bene, Jessica...? Mi hai spaventato..."""
Ushiromiya Jessica,"""... Non è un gran problema. ... Non preoccuparti..."""
,"Gocce di sudore coprivano l'intero corpo di Jessica e lei non poteva nascondere il suo respiro rauco, ma sembrava che il suo attacco improvviso si fosse calmato per ora..."
,Questa interruzione aveva fatto sfumare l'atmosfera pericolosa che si era venuta a creare fino a poco fa.
,Ma andava bene. ... Questo tipo di battaglia di sospetti reciproci era completamente inutile.
,"E pensandoci, anche trovare alibi per tutti gli altri e cercare il colpevole era probabilmente inutile."
,"Dopotutto, siamo solo deboli e ordinarie persone, e quando domani la polizia verrà, impiegheranno sicuramente tecniche all'avanguardia e investigheranno a fondo il caso, risolvendo tutti i problemi e arrestando il colpevole..."
Ushiromiya Eva,"""... Mi chiedo se dopotutto Battler-kun abbia ragione. ... Proprio come Natsuhi Nee-san è sospetta, non posso ignorare il fatto che sono sospetta anche io. Discutere su questo ora non sarebbe produttivo. ... Andrà tutto bene se lasceremo tutto nelle mani della polizia domani."
Ushiromiya Eva,"... Ma non vuoi saperlo anche tu, Battler-kun? Chi è il colpevole? ... Non vuoi fargli conoscere il dolore che hai provato perdendo qualcuno a te prezioso, il prima possibile?"""
Ushiromiya Battler,"""... Non lo nego. Anche un solo giorno sarebbe troppo lungo lasciando stare quel meraviglioso bastardo che c'è dietro tutto questo."
Ushiromiya Battler,"... Ma questo non significa che voglio dubitare di uno dei 18. Nonostante abbia detto le parole di poco fa, non voglio dubitare neanche di te, Eva oba-san. ... Per me, sei una zia fantastica che è sempre divertente, anche se un po' giocherellona."
Ushiromiya Battler,"... Non voglio scambiarmi insulti con una zia così. Non vorrei farlo con nessun altro qui. ... Giusto? E voi?"""
Ushiromiya George,"""... La penso allo stesso modo di Battler-kun. ... È inutile insultarsi. ... Probabilmente è solo lo stress venutosi a causare perché così tante persone si sono ammassate qui sin da questa mattina."""
Nanjo Terumasa,"""... È vero. Non è una sorpresa... so di non avere il diritto di dirlo, ma penso che tutti dovrebbero rilassarsi..."""
Ushiromiya Hideyoshi,"""... Eva. Anche io penso che dovremmo rinfrescarci un po' le idee. {n}Lo scontrino è certamente un indizio importante nella ricerca del luogo dove si trova Papà. Dovremmo riferirlo alla polizia appena arriverà..."""
Ushiromiya Eva,"""... Va bene. ... Giusto. Mi sono semplicemente sentita un po' trionfante quando ho scoperto quella parte riguardo lo scontrino. ... Di certo non è corretto dubitare solo di Natsuhi Nee-san, giusto? Anche io sono sospetta allo stesso modo."
Ushiromiya Eva,"... Nonostante questo, Battler-kun? Almeno la parte riguardante lo scontrino è reale, giusto? ... Non dimenticarlo. E prova a pensare attentamente a cosa possa significare, ok...?"""
Ushiromiya Battler,"""..."""
Ushiromiya Natsuhi,"""..."""
,Eva oba-san e Hideyoshi oji-san si alzarono. Sembrava avessero intenzione di lasciare il salotto.
Ushiromiya Eva,"""Alla fine, è inutile per noi continuare a giocare ai detective. Dopotutto, la polizia svelerà ogni cosa comunque alla fine."""
,... Esatto.
,"Anche se non giochiamo ai detective, il tifone passerà... e quando quei vivaci gabbiani torneranno al porto, tutto si sistemerà."
,"Giusto. Se ci pensi, questo tipo di crimine è del tutto banale."
,"... Sarà sicuramente risolto, anche se non facciamo niente, quando piangono i gabbiani."
Ushiromiya Eva,"""... Natsuhi Nee-san, lo prendo come il fatto che non vuoi più vedere la mia faccia? Provo la stessa sensazione. ... Se ricordo correttamente, ieri, hai fatto preparare per noi delle camere nella villa in modo che non dovessimo tornare nella casa degli ospiti, giusto?"
Ushiromiya Eva,"Ci dovrebbe essere un bagno e una toilette lì, così come un lucchetto e una catena per serrare la porta. C'è perfino un letto su cui sdraiarsi, e mio marito potrebbe vedere la TV senza litigare con Maria-chan sul canale da guardare, ok?"""
Ushiromiya Natsuhi,"""... Fai quello che vuoi. Ma fai attenzione."""
Ushiromiya Eva,"""Grazie, Nee-san. ... E fatti gli affari tuoi. Conto su di te per tenere d'occhio tutti, va bene? Perché il colpevole è di certo qui. ... E Nee-san, assicurati di non dimenticarti di tenere d'occhio pure te stessa."""
Ushiromiya Natsuhi,"""... Non hai fatto ancora abbastanza commenti prima di andartene?"""
Ushiromiya Eva,"""... Sì, è abbastanza. ... Ci vediamo, Natsuhi Nee-san. ... Genji-san, ti chiameremo quando è ora di cena. Fino ad allora, ci chiuderemo dentro con la catena."""
Ushiromiya Hideyoshi,"""..."""
Ushiromiya Natsuhi,"""... Genji, Kanon. Scortateli alla stanza degli ospiti."""
Ushiromiya Eva,"""Siamo a posto. Odio le scorte losche. Anzi, sarebbe più comodo che nessuno lasci questa stanza fino a quando non raggiungeremo la nostra. ... Andiamo, George."""
Ushiromiya George,"""... Io starò qui con tutti."""
Ushiromiya Eva,"""George...! Il colpevole è in questa stanza. Hai intenzione di stare in un posto come questo...?!"""
Ushiromiya George,"""... Lasciare questa stanza significherebbe sospettare uno dei miei parenti. ... Io... io non posso credere che qualcuno della nostra famiglia può essere capace di qualcosa tanto orribile."""
Ushiromiya Eva,"""George...! ... Anche tu lo stai dicendo...!"""
Ushiromiya Hideyoshi,"""... George è un uomo adulto. ... Se il suo modo di fare gli dice di non lasciare questa stanza, allora la decisione spetta a lui. Facciamogli fare ciò che vuole..."""
Ushiromiya George,"""... Padre..."""
,Eva oba-san e Hideyoshi oji-san se ne andarono. La sola voce che li seguiva era il suono della pioggia.
,"Il salotto fu sepolto da una atmosfera atroce... quando guardai l'orologio, fui sorpreso dal notare che era già pomeriggio."
,"... Avevamo davvero impiegato così tanto tempo preoccupandoci di cose inutili, parlando tra noi, litigando tra noi...?"
,"Annoiandomi, iniziai a afferrare la mia testa quando..."
,... Maria e io ci guardammo.
,"Dato che ero convinto che fosse completamente presa dalla TV, fui un po' sorpreso."
Ushiromiya Battler,"""... Ora ci credo."""
Ushiromiya Maria,"""Uu-...?"""
Ushiromiya Battler,"""La lettera, gli omicidi, tutto. È stata Beatrice. ... No, in realtà stavo sperando che qualcuno sbucasse fuori e dicesse che era vero. ... Io voglio credere che sia opera di una diciannovesima persona. Altrimenti, noi diciotto avremmo dovuto continuare a sospettarci fra noi... penso che credere in una diciannovesima persona sia meglio..."""
Ushiromiya Maria,"""..."""
Ushiromiya Battler,"""... Portare il Nonno fuori senza aprire porte o finestre deve essere una sciocchezza per Beatrice, vero...?"""
,"Maria, dopo aver fatto un solo, corto respiro, chinò la sua testa... e poi alzò il volto nuovamente."
Ushiromiya Maria,"""... Esatto. Kihihihihihihihi, chiudere una porta è inutile per una strega. ... Beatrice conosce tutti i 72 Demoni. Gaap, la 33esima, dona il potere di portare istantaneamente chiunque in un posto qualsiasi."
Ushiromiya Maria,"... Per lei, portare una persona fuori da una stanza chiusa non è per niente difficile, capisci? Kihihihihihihihihihihihihihihihihihi..."""
Ushiromiya Battler,"""Le streghe sono sicuramente incredibili. ... Dille, nel caso volesse commettere un altro crimine, di farlo in un modo che nessun umano lo possa commettere... e a farmi così credere che una diciannovesima persona... no, che una strega, esista."""
Ushiromiya Maria,"""... Kihihi. ... Va bene. Se la dovessi incontrare, lo riferirò."""
,Dannazione... è da un po' che niente sta avendo più senso...
,"Proprio quando voglio credere ad una diciannovesima persona, io la nego, e proprio quando voglio credere che siamo solo in diciotto, nego pure quello."
,"Nonostante io desideri che ci sia qualcuno oltre a noi diciotto individui qui, non posso accettare l'esistenza di quella diciannovesima persona."
,"... In poche parole, anche se ci fossero più di 18 persone, ci sarebbero meno di 19 persone. ... Il numero delle persone in questa villa è 19{p:0:＞}X{p:0:＞}18. Quindi il numero delle persone non può essere rappresentato da un intero."
,"... Tuttavia, è impossibile che ci sia qualcosa dopo il punto decimale. {n}Non si dovrebbe essere capaci di mostrare un numero di persone con qualcosa di diverso da un intero."
,"... Ciononostante, 19{p:0:＞}X{p:0:＞}18. Come si può spiegare la frazione minore di 1...!"
,"Non riesco a capirlo. ... Quella diciannovesima persona era qualcosa che non poteva essere vista. Questo è il motivo per cui, dato che si può scrivere il numero di persone solamente con un numero intero, non si può vedere quella persona"
,"Quella strega non può essere vista. Perché Beatrice non ha corpo. Pertanto, lei è invisibile."
,"C'è una diciannovesima persona, oppure no? La strega esiste, oppure no?"
,19{p:0:＞}X{p:0:＞}18. ... La strega esiste da qualche parte in quella X...!
