Speaker,Italian (Ars Magica) (Old) (ITA)
,"Una volta terminato il pranzo, i domestici presero le stoviglie e si diressero in cucina. Il vento e la pioggia non si erano né indeboliti ma neanche rafforzati, e l'isola era ormai estraniata dal mondo esterno."
,"Sembrò, inizialmente, che Natsuhi non volesse permettere a nessuno di mettere piede fuori dalla stanza, ma quando fu ora di preparare il pranzo, finalmente realizzò che era impossibile."
,"Tuttavia, in modo da evitare che qualcuno restasse solo in cucina, disse ai tre domestici di restare insieme."
,"Perciò, i domestici furono i primi a lasciare immediatamente il salone recluso, che conteneva ben undici persone."
,"... Poiché la colazione si era subito succeduta a quel terribile incidente, e molti di loro non avevano mangiato molto, tutti quanti, terminarono il loro pranzo silenziosamente."
Kumasawa Chiyo,"""Ci penso io a lavare i piatti, quindi Kanon-kun e Genji-san, riposatevi pure. Volete qualcosa da bere?"""
Ronoue Genji,"""... No, grazie. Kanon?"""
Kanon,"""... Neanche io, grazie."""
Kumasawa Chiyo,"""Voi due siete stati a lavorare tutto il tempo, e sin da stamattina presto... {n}Non mi sorprende che siate stanchi..."""
,"L'unico rumore presente era quello di Kumasawa che lavava i piatti, che risuonava in tutta la cucina."
,"Genji e Kanon sedevano in alcune sedie a poca distanza da Kumasawa, con gli occhi socchiusi."
,"Proprio come aveva detto Kumasawa, quei due si erano probabilmente affaticati molto."
,Ma questo non significava che avrebbero mostrato quella fatica di fronte agli ospiti.
,... Evitare ciò era una delle loro virtù.
,Dopo che il silenzio continuò per un po' di tempo... Kanon aprì la bocca e sussurrò.
Kanon,"""... Shannon... perché... doveva morire in un modo così orribile...?"""
Ronoue Genji,"""... Dimentica com'è morta. ... Non è stata altro che... sfortuna."""
Kanon,"""... Hai ragione. ... Non è stata altro che sfortuna."""
,Entrambi si fecero nuovamente silenziosi. ... Il volto di Kanon era colmo di afflizione.
Kumasawa Chiyo,"""Shannon è morta... ancora non riesco a crederci. ... Povera, povera Shannon-chan... non riesco a credere che non potrò rivederla... volevo rivedere il volto sorridente di quella ragazza ancora una volta..."""
,Kumasawa parlò voltata di spalle.
,"... Dopotutto, Kumasawa non aveva visto il cadavere di Shannon, quindi non aveva problemi nel nominare il volto di Shannon."
,"... Quando Kanon udì quelle parole, gli tornò in mente il volto mezzo sfigurato di Shannon, e la sua rabbia crebbe ancora di più..."
Kanon,"""... Perché Beatrice ha fatto questo a Shannon...? ... Se proprio desiderava un sacrificio, c'erano un sacco di persone fra cui scegliere... perché... perché...?!"""
Ronoue Genji,"""... Non è stata altro che sfortuna. ... Se non fossimo tanto fortunati, al posto di Shannon ci saremmo potuti essere tu o io stesi lì a terra."
Ronoue Genji,"O chiunque altro. ... Tutto è in mano al fato."""
Kanon,"""Genji-sama. ... Hai detto che la porta di Madame era sporca di tracce di qualcosa tipo sangue, giusto...? O comunque della stessa sostanza dipinta sulla serranda?"""
Ronoue Genji,"""... Hmmm. ... Erano tracce di qualcosa di poco gradevole. Quasi come se qualcuno, con le mani sporche di sangue, avesse tentato di scardinare la maniglia... no, di imprimere nella porta... quei segni terribili."""
Kanon,"""Quindi questo significa che... Beatrice-sama è andata a visitare la stanza di Madame... e ha tentato di aprire la porta, ma non ci è riuscita...?"""
,Genji ripensò all'attimo in cui vide quelle tracce di sangue sulla porta della stanza di Natsuhi...
,"La sostanza impressa sulla porta e attorno alla maniglia, così come i segni di graffi e manate sulla porta... davano decisamente l'impressione che qualcuno avesse tentato di aprire la porta, ma non ci fosse riuscito..."
Kanon,"""... Perché... non è stata scelta Madame come sacrificio...? Se solo fosse stata scelta lei... Shannon non sarebbe... Shannon non sarebbe dovuta morire..."""
,"In quel momento, un forte, netto rumore provenne dal corridoio. Entrambi si voltarono, sorpresi."
Ushiromiya Battler,"""... Sembra una discussione molto interessante. Rendete partecipe anche me."""
,"Prima che uno dei domestici potesse rendersene conto, Battler era già in piedi sul ciglio della porta della cucina."
Kanon,"""... Battler-sama. Per favore, mi perdoni..."""
,"Genji-san e Kanon-kun si alzarono, sorpresi, e si inchinarono velocemente."
,... Ma non mi importava certo di queste cose. Ero più interessato a continuare la loro discussione.
Ushiromiya Battler,"""Ho detto che stavo andando in bagno, per questo mi hanno lasciato andare. Penso che sarei soffocato a restare un attimo di più in quella stanza."
Ushiromiya Battler,"... Pensavo di chiedervi un bicchiere d'acqua, e invece sono incappato in qualcosa di molto interessante. ... Non c'è bisogno che vi inchiniate o cose del genere. Per favore, fatemi sentire il resto."""
Kanon,"""... Quella di prima... non era realmente..."""
Ushiromiya Battler,"""Sono stato a origliare per un bel po'. Ora non cercare di nasconderlo."
Ushiromiya Battler,"... Quindi lo chiederò direttamente. ... Chi è questa Beatrice? Si suppone sia una strega tratta dalle fantasie di un bambino, ma a quanto pare non è così."""
Kanon,"""..."""
,Kanon-kun distolse lo sguardo.
,... Era ovvio che non volesse parlare di quell'argomento... cosa che mi portava a fare ancora più domande.
,"Sforzandomi di sorridere, afferrai il colletto della sua camicia."
Ushiromiya Battler,"""... Fino alla scorsa notte non avevo niente a che fare con tutto questo, ma dopo questa mattina, le cose sono cambiate. Dopo che Papà e gli altri sono stati uccisi, sono entrato a far parte di questa situazione. ... Ho il diritto di sentire questa storia sospetta, no...?"""
,"Continuai a fissare negli occhi Kanon mentre lui, faticosamente, tentava di evitare il mio sguardo."
,"Dato che c'era molta differenza d'altezza, Kanon doveva stare sulle punte dei piedi, e pareva che questo gli provocasse dolore."
Kumasawa Chiyo,"""... Battler-san... per favore lo lasci andare... Kanon-san non sta nascondendo niente..."""
Ushiromiya Battler,"""Quindi tu non avresti alcun problema a parlarne, giusto? Mi sento solo ad essere escluso dal giro, capisci?"""
,"Quando tentai di afferrare il suo colletto, Genji-san si interpose fra noi e parlò."
,... C'era un leggero senso di rassegnazione sul suo volto. ... Sembrava che non avesse intenzione di nascondere alcunché.
Ronoue Genji,"""... Posso parlarne io. ... Kanon ha esitato solo perché l'avrebbe presa male, Battler-sama..."""
Ushiromiya Battler,"""Esitare non è segno di coraggio, no? Mantenere un segreto è ancora più fastidioso."
Ushiromiya Battler,"... Dimmi quello che sai. Tanto non abbiamo niente di meglio da fare sino a domani. Una storia di misteri aiuterà a vincere la noia."""
,"Dopo che Genji-san e Kanon-kun si guardarono negli occhi, annuirono come per prepararsi a parlare..."
Kanon,"""... Ho capito. Prego, ci chieda qualunque cosa. ... Parleremo."""
Ushiromiya Battler,"""Ottimo. Allora lasciate che vi chieda."
Ushiromiya Battler,"... Chi diavolo è Beatrice? ... Tutto quello che so è che è una strega che vive nella foresta di Rokkenjima. ... Ho sentito che si tratta di una storia inventata dalla nonna o qualcun altro per tenere lontane le persone dalla foresta. ... Non è esatto?"""
Kanon,"""... No... è giusto. È come ha detto. Beatrice è una strega che vive nella foresta di Rokkenjima."""
Ronoue Genji,"""... Battler-sama. ... Non mi aspetto che ci creda subito, ma... Beatrice-sama esiste. ... È una persona reale, che donò al padrone un'enorme quantità di oro, e che ha lavorato al suo fianco per molto tempo."""
Ushiromiya Battler,"""Huh...? Ah, dai... il Nonno vi paga per ripetere tutto ciò che dice...?"""
,"Sorrisi come se si trattasse di uno scherzo, ma Genji-san e Kanon-kun non risero... e neanche Kumasawa baa-chan, che evitava i miei occhi, agitata, mentre lavava i piatti."
,"Quindi sfortunatamente, risi solo io. ... Dolorosamente, con amarezza."
Ushiromiya Battler,"""... Capisco, ecco perché Genji-san si era rifiutato di dirmelo. ... Se questa storia è vera, è ovvio che la prenda a male. ... Quindi state dicendo che una persona chiamata Beatrice esiste veramente?"""
Ronoue Genji,"""... Sì. Ha servito il padrone da ancora prima che la villa venisse costruita su quest'isola. ... È possibile che abbia lavorato per lui anche più di me."""
Ushiromiya Battler,"""Ma guarda un po', la teoria di Kyrie-san è stata distrutta... il Nonno possiede davvero una domestica di fiducia chiamata Beatrice. ... Questa persona è sull'isola adesso...?"""
Kanon,"""... Sì. Credo che si trovi qui."""
Ushiromiya Battler,"""... È un modo vago di dirlo. Suppongo che tu intenda dire che non l'hai incontrata oggi o ieri."""
Kanon,"""... Sì. ... È estremamente difficile da dire, ma... umm..."""
,"Kanon-kun ancora una volta distolse lo sguardo, evitando i miei occhi."
Ushiromiya Battler,"""... Cosa c'è? Non fermarti così. Non tenermi sulle spine, ok?"""
,Lo invitai a continuare scherzosamente.
,"... Tuttavia, sembrava che Kanon non riuscisse a decidere se dovesse parlare o no."
,"... A quel punto, Kumasawa baa-chan sussurrò qualcosa."
Kumasawa Chiyo,"""... Hoh-hoh-hoh... non si può vedere il suo volto... perché Beatrice-sama non ha corpo..."""
Ushiromiya Battler,"""... Lei non ha... cos'hai detto?"""
Ronoue Genji,"""Beatrice-sama non ha corpo. ... Pertanto, finché Beatrice-sama non lo desidera, le persone comuni come noi non possono vedere il suo aspetto."""
Kumasawa Chiyo,"""Ho sentito che il ritratto mostra Beatrice-sama quando era nella sua forma umana... Il padrone desiderava così tanto quella figura, che spesso restava in piedi davanti a quel ritratto... hoh-hoh-hoh..."""
Kanon,"""Talvolta, Beatrice-sama talvolta trasforma il suo corpo in farfalle luccicanti e si mostra. ... Nella rara occasione in cui si dovesse scorgerle da qualche parte nella villa, la regola è che non bisogna seguirle per nessun motivo."
Kanon,"Si mormora che se seguendole, si andrebbe incontro alla sciagura. ... In verità, c'era una domestica che ha infranto questa regola e si è licenziata a causa di una grave ferita."""
Ushiromiya Battler,"""... Aspettate un secondo, mi state prendendo in giro? Siete seri quando dite queste cose...?"""
Ronoue Genji,"""... Battler-sama, Beatrice-sama è già qui. Non credo che parlare in questo modo sia saggio."""
Kanon,"""A Beatrice-sama non piace la mancanza di rispetto. ... Se lei dubita della sua esistenza, le accadrà qualcosa di brutto."""
Kumasawa Chiyo,"""Battler-san... probabilmente lei troverà questa storia sgradevole. Ma lo sa? Beatrice ‘esiste’."""
Ronoue Genji,"""... Lei ‘esiste’. Beatrice-sama odia le persone che dubitano di questo fatto."""
Kanon,"""... Non capisce, Battler-sama? ... Beatrice-sama è già arrivata..."""
Ushiromiya Battler,"""... Dai, piantatela. Sapete che mi impressiono facilmente... mi state mettendo i brividi..."""
,"Tuttavia, negli occhi dei domestici non c'era nulla di scherzoso."
,"All'apparenza stavo ridendo, cercavo di fare il duro, ma iniziavo a impensierirmi. ... Anche i loro occhi si stavano facendo seri."
Kumasawa Chiyo,"""... Battler-san... la prego, smetta di mancare di rispetto a Beatrice-sama. {n}Per favore, mi creda..."""
,"Kumasawa baa-chan, che era sempre allegra e prendeva in giro le persone... ora stava dicendo questo con un'espressione del tutto seria."
Ushiromiya Battler,"""... B... Beh... certo, voi dite che esiste... ma io non vedo nulla... state dicendo che potrebbe essere proprio accanto a me? Piantatela di scherzare..."""
Ushiromiya Maria,"""Kihihihihihihihihihihihihihihihihi..."""
,"Proprio in quel momento, quella risata snervante riempì la cucina..."
,"... Quando mi voltai, Maria era in piedi davanti all'ingresso. ... Ma quell'espressione e quell'atmosfera, quella presenza... era del tutto identica a quella dei domestici."
Ushiromiya Maria,"""... Se la tua lunghezza d'onda è adatta o meno è deciso alla nascita. Battler è il tipo di persona la cui lunghezza d'onda non va bene per nascita. È per questo che non la puoi vedere. È per questo che non la puoi incontrare. È per questo che non le puoi parlare."
Ushiromiya Maria,"... Kihihihihihihihihihihihihihihihi. Sei il genere di persona che Beatrice odia più di tutti."""
,La risata di Maria sembrava quasi folle... ed era estremamente inquietante.
,... Era quasi come se stesse ridendo di me perché ero l'unico che non capiva.
Ushiromiya Maria,"""Vuoi sapere di più su Beatrice? ... Beatrice è... una strega che ha vissuto per mille anni. ... Con tutti i demoni al suo servizio, può sfruttare il potere dell'alchimia per creare la pietra filosofale e una grande quantità d'oro. Il Nonno ha costruito l'enorme ricchezza della famiglia Ushiromiya stipulando un contratto con lei."
Ushiromiya Maria,"... Ieri, ho letto la lettera di Beatrice, no? Era reale. ... Beh, credo che sia inutile tentare di costringerti a crederci."
Ushiromiya Maria,"... In fondo, sembra che tu sia nato senza la minima quantità di sesto senso, vero. Kihihihihihihihihihihihihihihihihi...!"""
Ushiromiya Battler,"""... Di che stai parlando? Streghe, demoni? Chi te ne ha parlato...?"""
Ushiromiya Maria,"""Kihihihihihihihihi. L'ho sentito da Beatrice stessa. Kihihihihihihihihihihi!"""
,"Maria alzò ancora la voce mentre rideva in quel modo irritante. ... Tuttavia, i domestici che assistevano alla scena non reagirono in alcun modo."
,"Lei aveva sentito tutto da... quella strega nel ritratto che decorava l'ingresso. Maria continuava a ridere con una voce strana, proprio come se quella fosse senza dubbio la verità..."
Ushiromiya Battler,"""... Maria, so che non è carino da parte mia, ma te lo chiederò ancora una volta, va bene...? Ieri, chi ti ha dato quella lettera?"""
Ushiromiya Maria,"""L'ho ricevuta da Beatrice. Quante volte devo dirtelo prima che tu capisca?"
Ushiromiya Maria,"... Non capisci, vero? Tu non riesci a vedere. Non ci credi, è così? Kihihihihihihihihihihihihihihihi."""
,"Proprio allora, la risata di Maria si interruppe all'improvviso."
Ushiromiya Maria,"""... Battler. Ancora non capisci? Beatrice-sama ‘esiste’."""
Ushiromiya Battler,"""‘Esiste’, dici... dove?"""
Ushiromiya Maria,"""Come ho detto, tu non capisci che Beatrice-sama ‘esiste’ qui."""
,"... Giusto. A pensarci, era da un po' che mi sembrava che ci fosse qualcosa di strano nello sguardo dei domestici."
,"... Pensavo che stessero semplicemente fissando il vuoto, ma... non era così."
,"I quattro presenti, Genji-san, Kanon-kun, Kumasawa-san, e Maria... tutti tranne me... stavano fissando un punto dietro di me..."
,"Trattenendo il respiro, guardai lentamente dietro le mie spalle."
,"... Naturalmente, non c'era motivo per cui qualcuno dovesse essere lì. {n}Lo sapevo dall'inizio!"
,... Però tutti nella stanza erano concentrati su quel punto come se ci fosse davvero qualcuno lì.
Ushiromiya Maria,"""Beatrice è una grande strega dorata che ha vissuto per mille anni. ... Ma siccome lei non può mostrarsi a umani con una lunghezza d'onda inadatta, non può parlare con loro."
Ushiromiya Maria,"... E sai una cosa? È davvero triste. ... Questo significa che odia profondamente quando le persone come te, nate senza un frammento della capacità necessaria ad avvertire la magia, rinnegano la sua esistenza...!"
Ushiromiya Maria,"... Sei fortunato, Battler. È davvero una cosa buona che ti abbia dato quell'amuleto ieri, vero? Non capisci che terribile maledizione Beatrice ti avrebbe lanciato a questo punto se non l'avessi portato con te? ... Sei davvero fortunato, Battler. Kihihihihihihihihihihihihihihihihihihi...!"""
Ushiromiya Battler,"""... Ah sì, quel portachiavi con lo scorpione. Pensavo fosse solo un giocattolino o qualcosa del genere, ma tu dici che ha davvero dei poteri?"""
Ushiromiya Maria,"""Kihihihihihihihi. Se non fosse stato per quello, in questo momento tu saresti steso nel capannone con la faccia distrutta come uno dei sacrifici. Kihihihihihihihihi, sei così fortunato, Battler...! Kihhihihihihihihihihihihihihihihihi!"""
Ushiromiya Battler,"""... Capisco. Quindi se non fosse stato per l'amuleto, sarei già stato ucciso..."""
Ushiromiya Maria,"""Perché Battler non crede in Beatrice...? Anche se lei ‘esiste’. Proprio ora, laggiù, guarda."
Ushiromiya Maria,"Kihihihihihihihi! Ehi, scommetto che ora vuoi crederci. Credici. E ringrazia Maria per averti dato quell'amuleto...!"
Ushiromiya Maria,"Se non fosse stato per quello, adesso saresti nel capannone. D'altra parte, forse avresti salvato qualcun altro in cambio, no? Kihhihihihihihihihihihi!"""
,*pop*.
,"... In quel momento, scoppiai a ridere. Giocare alle streghe era stato piuttosto divertente fino a quel punto, ma sfortunatamente, sembrava che quest'ultima parte fosse troppo per me."
Ushiromiya Battler,"""Hahahahahahah. ... Allora è tutto inutile, no, Maria? Se è così, mi spiace, ma aaah, è tutto inutile."""
,"Quando Maria mi vide scoppiare a ridere all'improvviso, lei smise. Anche se non capiva di cosa stessi ridendo, capiva bene che si trattava di qualcosa di spiacevole per lei."
Ushiromiya Maria,"""..."""
Ushiromiya Battler,"""Pensavo che ci saresti rimasta male, quindi prima non l'ho detto, ma..."
Ushiromiya Battler,"... l'amuleto che mi hai dato, credevo di averlo in tasca, ma ad un certo punto deve essermi caduto, capisci?"
Ushiromiya Battler,"... Allora non può essere vero che io sia vivo adesso solo grazie a quell'amuleto, e questo significa che, anche se dovrei essere stato maledetto dalla strega, in questo momento sto benissimo. ... Scusami, ma non credo in cose che non posso vedere coi miei occhi."
Ushiromiya Battler,"Sesto senso? Lunghezze d'onda? Avvertire la magia? Scusa, ma non credo in questa roba fittizia. Quando sento le ragazze in classe che iniziano a parlare della loro capacità di percepire il sovrannaturale, mi secca da morire!"
Ushiromiya Battler,"... Non so quanto ti stia pagando il Nonno, ma se stai cercando di convincermi ad unirmi a qualche culto, credimi, non ci riuscirai così facilmente."""
Kanon,"""... Battler-sama..."""
Ushiromiya Battler,"""... Kanon-kun e voialtri siete liberi di credere in quello che volete. Però, se credere in qualcosa o meno, io sono sempre quello che lo decide!"
Ushiromiya Battler,"Scusate, ma non riuscirò a credere in una storia bizzarra come quella di Beatrice finché non l'avrò vista coi miei stessi occhi...!!"""
,"Parlai energicamente e con chiarezza... quando lo feci, Maria iniziò a ridacchiare di nuovo."
Ushiromiya Maria,"""Kihhihihihihihihihihihihi...! Beh va bene così, no...? Le persone come te, la cui lunghezza d'onda è del tutto inadatta, non saranno mai in grado di vedere Beatrice ad ogni modo."
Ushiromiya Maria,"... Avrà luogo presto, la resurrezione. La resurrezione di Beatrice. ... Lei ha promesso che quando accadrà, parlerà e giocherà con me un sacco."
Ushiromiya Maria,"... Non c'è assolutamente motivo per dubitare o per costringerti a credere. {n}Lei apparirà molto presto. Kihihihihihihihihihi...!"""
,"Mentre alcune persone vanno al bagno dopo un pasto, altre preferiscono riposare per un po'."
,"Sembrava che diverse persone avessero lasciato il salotto, come me che ero andato in cucina a bere dell'acqua."
,"Alla fine, l'ordine di Natsuhi che tutti restassero assieme nel salotto, che nessuno fosse lasciato solo e che nessuno dovesse lasciare il salotto, anche se con riluttanza, era stato ritirato per forza di cose."
,"In ogni caso, se undici persone stanno chiuse nella stessa stanza dal mattino presto, l'aria inizierà a ristagnare."
,"... E dopo un po' di tempo, tutti avevano incominciato a riprendersi dallo shock di quella mattina. Forse il loro senso del pericolo si era indebolito col tempo."
,"... Era comunque un fatto certo che sei persone erano state uccise in questa villa, quindi nessuno era del tutto rilassato."
,"Perciò quando uscivano nel corridoio per prendere una boccata d'aria fresca, cercando di non dare a vedere la loro ansia... dopo poco si spaventavano a stare lì, isolati, e quindi ritornavano al salotto."
,"Bastava guardarli. ... Immagino che sia come la storia de ‘Il Vento del Nord e il Sole’. Se forzi qualcuno a stare rinchiuso, resisterà, ma se gli dici di fare ciò che vogliono, torneranno indietro obbedientemente."
,Le persone sono davvero ipocrite.
,"... Quando i domestici finirono di riordinare dopo il pasto, ritornarono obbedientemente in salotto proprio come Natsuhi oba-san aveva detto loro, e sedettero su un divano vicino all'entrata, aspettando pazientemente nuovi ordini."
,"Maria, come se avesse improvvisamente finito di giocare alle streghe, era ritornata la pura Maria che conoscevo bene, esclamando ‘uu-uu-’."
,"... Che diavolo era successo in cucina? ... Non avevo minimamente avvertito la presenza di questa persona chiamata Beatrice, che sarebbe dovuta essere dietro di me, invisibile."
,"... Tuttavia, mi era sembrato di poter scorgere un frammento di quella presenza in Maria..."
Ushiromiya George,"""Hai ragione. Quando Maria inizia a parlare di streghe, cambia. ... Battler-kun, anche tu l'hai visto giù in spiaggia ieri, vero?"""
Ushiromiya Battler,"""Ti riferisci al portachiavi con lo scorpione? ... No, non dico di quando si era sentita ferita, sto parlando di quando era sembrato che avesse una doppia personalità."""
Ushiromiya Jessica,"""Aah, è una cosa che capita a volte. ... Come quando Maria aveva iniziato a parlare del cerchio magico, succede a volte. Mette i brividi però."""
,"A quanto dice Jessica, pare che lei abbia visto la Maria che ride in modo sinistro varie volte."
,"In quest'occasione era successo in un momento delicato, e per di più, era la prima volta che la vedevo così quindi ero rimasto davvero scioccato..."
Ushiromiya Battler,"""Allora di che si tratta? Maria ha una doppia personalità o qualcosa del genere? Oppure stai dicendo che il suo sesto senso è particolarmente forte e lei ne è posseduta?"""
Ushiromiya George,"""... No, non penso sia questo. Non ti è mai successo? Quando eri piccolo, non c'era qualcuno diverso da te stesso che aspiravi ad essere?"""
,"Nel momento in cui gli esseri umani nascono, nessuno possiede un'individualità propria. Tuttavia, quando raggiungono l'età dello sviluppo, iniziano ad essere coscienti di se stessi e cominciano a sviluppare un senso di individualità."
,Vogliono essere diversi dalle altre persone.
,"... Ma questo non significa che scopriranno di essere diversi dagli altri nella loro classe, dato che impareranno le stesse cose a scuola e condurranno lo stesso stile di vita."
,"Quando se ne accorgono, iniziano innanzitutto a infrangere le regole durante quella che viene chiamata l'età della ribellione. Siccome tutti seguono le regole, loro vogliono dimostrare la loro individualità infrangendole."
,"... Anche le persone che definiscono questo comportamento infantile e ne ridono, capiranno che si tratta solo di un adorabile marmocchio che cerca se stesso, quando guarderanno questa storia sotto questa luce."
,"... Beh, sto parlando di questa roba come fossi un genio, ma in realtà l'ho sentita prima da George-aniki."
,Io stesso ero uno di quei ragazzini vergognosi che pensavano che comportarsi come dei piccoli bastardi fosse figo...
,"Ecco, ero nell'età in cui cerchi di farti notare dal sesso opposto."
Ushiromiya George,"""La caratteristica principale della crescita è che le persone cercando di dimostrare che non sono più bambini. È lo stesso impulso che spinge un pulcino a rompere il guscio dell'uovo. Sapete qual è la differenza tra un bambino e un adulto?"""
Ushiromiya Battler,"""L'età? O l'aspetto fisico?"""
Ushiromiya George,"""No, è l'esperienza. Gli adulti possono prendere alla leggera i bambini perché questi hanno pochissima esperienza. Il motivo per cui sbuffano e non prendono sul serio i bambini quando dicono qualcosa è perché i bambini non sanno nulla del mondo."""
Ushiromiya Jessica,"""Già, questo lo capisco. Quando sei piccolo, cerchi di parlare come se avessi capito tutto della vita, e cerchi di comportarti come un adulto. ... Qualsiasi cosa dica un bambino, gli adulti non lo prenderanno mai in considerazione perché è troppo ingenuo o perché pensano che sarebbe in grado di capire solo ‘quando sarà grande’."
Ushiromiya Jessica,"... Beh, sarà vero probabilmente, ma per un bambino è irritante, come se venissero snobbati."""
Ushiromiya Battler,"""... Capito. L'importante è la conoscenza e l'esperienza. ... Naturalmente, l'età non rende degna di rispetto una persona che ha sprecato tutta la sua vita."""
Ushiromiya George,"""Quindi, quando cercando di emergere rispetto agli altri bambini, si ispirano anche a personalità diverse da quelle che li circondano. Se quello che separa bambini e adulti è conoscenza ed esperienza, allora...?"""
Ushiromiya Battler,"""... Ci sono, se sanno qualcosa che nessun altro sa, questo diventa parte della loro identità."""
Ushiromiya Jessica,"""Sapete, quando ero alle elementari, imparavo cose che nessun altro sapeva, avevo cose che nessun altro aveva, e mettevo cose che nessun altro indossava, e per questo motivo ero una specie di eroe. Scommetto che tu hai fatto lo stesso, Battler."""
Ushiromiya Battler,"""Già, già. Di sicuro c'è stato un periodo in cui volevo essere il primo in qualcosa. ... Capisco, era perché volevo smettere di essere un bambino, ero nel periodo in cui stavo crescendo."""
Ushiromiya George,"""Se lo si vede sotto una luce positiva, quel periodo, forzandoti a differenziarti dagli altri, ti spinge ad acquisire abilità e conoscenze che nessun altro possiede."
