Nanjo Terumasa,"""Tutti coloro che conoscono bene Kinzo-san probabilmente capirebbero che non si piegherebbe a delle minacce ordinarie..."""
Ushiromiya Natsuhi,"""... È un uomo che porta il fardello di tutta la ricchezza della famiglia Ushiromiya. È stato esposto a molti pericoli e attacchi in passato. È per il fatto che è stato capace di superarli che oggi la famiglia prospera."""
Ushiromiya Jessica,"""È dannatamente esatto. Non riesco neanche a immaginare che nostro Nonno obbedirebbe se qualcuno lo minacciasse!"""
Ushiromiya Natsuhi,"""... Jessica, attenta a come parli."""
Ushiromiya Jessica,"""... S... Sì."""
Ushiromiya Battler,"""In questo caso... cosa ne pensate di quest'idea? ... No aspetta, forse è troppo folle...?"""
,... Non potevo esitare! Un'idea pazza è come arco e freccia.
,"... Può essere difficile colpire, ma se riesci a prendere il nemico dall'altro lato, è una grande arma."
,... Dicono che la maggior parte dei morti in battaglia sia stata uccisa da ferite di freccia.
,... In una battaglia non si può lanciare soltanto una freccia.
,"Ne lanci una miriade alla volta, e attacchi i soldati nemici con un muro di frecce. ... Quindi lanciale, ancora e ancora! ‘Attacca con un muro di verità...!’"
Ushiromiya Battler,"""Se il colpevole sta cercando l'oro nascosto, sarebbe molto inefficiente per lui obbligarci a risolvere l'enigma. Chiedere alla persona che l'ha pensato in primo luogo sarebbe molto più rapido e facile."
Ushiromiya Battler,"... In questo caso, la domanda è... tutto ciò è un messaggio rivolto al Nonno?"""
,"In altre parole, questo omicidio era una minaccia rivolta al Nonno. ... Se non avesse rivelato al colpevole dove si trovasse l'oro, i suoi familiari sarebbero stati uccisi uno ad uno."
,E se non fossimo i soli obbligati a risolvere quest'enigma... e se lo fosse anche il Nonno?!
,"Pensandoci in questa prospettiva, si spiegava la misteriosa scomparsa del Nonno."
,"Se il colpevole avesse attaccato il Nonno, allora giudicando dallo stato in cui erano stati lasciati i sei corpi, avrebbe dovuto essere stato esposto da qualche parte con l'aggiunta di quell'orribile trucco."
,"Ma nonostante ciò, non l'avevamo ancora trovato. ... Significava che il Nonno era stato rapito, e condotto da qualche parte?!"
Ushiromiya Natsuhi,"""... Come può... non starai dicendo, come può...!"""
Ushiromiya Eva,"""*giggle* *giggle*. Sembra interessante. ... Quindi il Nonno sarebbe rinchiuso in qualche luogo, sotto minaccia per cui se non rivela l'ubicazione dell'oro, noi saremo uccisi uno ad uno?"""
Ushiromiya Natsuhi,"""Mi fa star male pensare a come ritieni interessante tutto questo...!"""
,"Natsuhi oba-san la minacciò, ma Eva oba-san si limitò a sorridere con calma."
Ushiromiya George,"""... Dal momento che ancora non l'abbiamo visto dopotutto questo tempo, penso che sia quasi certo che il Nonno sia stato coinvolto nel crimine. Se ci si pensa, non si può semplicemente ignorare la teoria di Battler-kun, giusto...?"""
Ushiromiya Eva,"""Fai silenzio George. ... Quando è sparito nostro Padre, prima di tutto?"""
Ushiromiya Hideyoshi,"""... Chi è stata l'ultima persona a vederlo?"""
Ushiromiya Natsuhi,"""... Probabilmente sono stata io. Questa mattina, quando ci stavamo preoccupando sul fatto di dove fossero mio marito e gli altri, pensavamo potessero stare nello studio di nostro Padre, così sono andata a controllare la sua stanza e l'ho salutato."
Ushiromiya Natsuhi,"... Ora che ci penso, ho tenuto la chiave del suo studio per tutto il tempo. Genji, permettimi di restituirla."""
,Natsuhi oba-san tirò fuori la chiave dorata e la passò a Genji...
,"Guardando la chiave, Eva oba-san rise..."
Ushiromiya Eva,"""... Ehi, Genji-san. Sono sicura che la polizia ispezionerà a fondo la stanza di nostro Padre ad ogni modo. ... Se c'è qualcosa nascosto lì, verrà esposto comunque. ... Quindi magari sarebbe meglio se ce lo dici subito, in questo momento."""
Ronoue Genji,"""... Di cosa state parlando?"""
Ushiromiya Eva,"""Semplice. ... Lo studio di nostro Padre è una stanza chiusa, con nessuna via di entrata o di uscita eccetto per quella chiave, giusto? Voglio verificare che sia vero. C'è un'entrata per lo studio. E riguardo la finestra? Altre entrate o uscite?"""
Ronoue Genji,"""... Non ci sono. Non c'è modo di entrare se non dall'entrata."""
Ushiromiya Eva,"""Ne sei sicuro? Non c'è qualche porta segreta nascosta o cose del genere? Siccome nostro Padre non è qui, io sono il membro della famiglia Ushiromiya con il più alto grado. Te lo sto chiedendo come rappresentante della famiglia Ushiromiya. Capisci e rispondi."
Ushiromiya Eva,"Ci sono altri modi di entrare o uscire da quella stanza oltre all'entrata? Essendo il domestico più vicino a nostro Padre, sono sicura che lo sai."""
,"Natsuhi oba-san sembrava leggermente offesa per il ‘membro con il più alto grado’, ma tenne la bocca chiusa per il momento, e attese la risposta di Genji."
,... Non potevo far altro che sentirmi a disagio. Perché continuava ad insistere con quelle porte nascoste...??
Ushiromiya Eva,"""Anche voi, Kanon-kun, Kumasawa-san. Se lo sapete, vorreste dirmelo? Se ce n'è una, sarebbe meglio che lo diciate."
Ushiromiya Eva,"... Se non ci dovesse essere, allora qualcuno potrebbe essere messo con le spalle al muro in un secondo. ... Se assumiamo che esista un porta nascosta, allora il mio ragionamento fallirebbe."""
,"Eva oba-san non specificò quale persona stava per essere messa con la spalle al muro... ma seguendo lo scorrere della conversazione, ho avuto il presentimento che si stesse riferendo a Natsuhi oba-san."
Ushiromiya George,"""... Madre, di cosa stai parlando?"""
Ushiromiya Eva,"""George, stai zitto per un attimo. ... Cosa dite? Genji-san? Kanon-kun? O Kumasawa-san? C'è una porta nascosta? Non c'è? Genji-san, quando hai ristrutturato lo studio di nostro Padre, devi avere supervisionato la costruzione. Non ti permetterò di dire che non lo sai."""
Ronoue Genji,"""... Non c'è niente del genere nello studio del Padrone."""
Ushiromiya Eva,"""Ne sei sicuro? E tu che mi dici Kanon-kun, che porti l'Aquila Mono-alata?"""
Kanon,"""... Sì. Ne sono sicuro. ... Non c'è niente come una porta nascosta nello studio del Padrone."""
Ushiromiya Eva,"""Kumasawa-san?"""
Kumasawa Chiyo,"""N... No, non ho mai sentito di una cosa del genere..."""
Ushiromiya Eva,"""Cosa dice lei, Dottor Nanjo, che ha una profonda amicizia con nostro Padre?"""
Nanjo Terumasa,"""... M-Mai sentita una cosa del genere..."""
Ushiromiya Eva,"""Perfetto! Allora siete pronti? Fatemi iniziare. È davvero semplice."""
,"Ognuno inclinò la sua testa dubbiosamente, chiedendosi cosa Eva oba-san stesse cominciando a dire così orgogliosamente."
,"... Eva oba-san rise trionfalmente, come se stesse per rivelare un segreto che solo lei conosceva."
Ushiromiya Eva,"""Natsuhi Nee-san è stata l'ultima persona ad incontrare nostro Padre, giusto? Non ricordo l'ora esatta, ma mi sembra fosse un po' prima delle nove di mattina."
Ushiromiya Eva,"... Nee-san, te lo ricordi? Ti sono venuta incontro appena sei uscita dallo studio, sbaglio?"""
Ushiromiya Natsuhi,"""... Sì, ricordo. Ma questo cosa ha a che fare con tutto il resto?"""
Ushiromiya Eva,"""E la volta dopo che Nee-san è andata a visitare lo studio di nostro Padre? {n}È stato quando abbiamo trovato i corpi di Nii-san e gli altri, giusto? Insieme a me, sei andata nello studio per riportare ciò, e abbiamo scoperto non era lì."
Ushiromiya Eva,"... A proposito, Nee-san. In quel momento, quando sei entrata nello studio, non hai notato nulla?"""
Ushiromiya Natsuhi,"""... Notato nulla? ... Di cosa stai parlando?"""
Ushiromiya Eva,"""Su. Hai buttato della cartaccia, no? Uno scontrino piegato."""
Ushiromiya Natsuhi,"""... Mi sembra di ricordare di aver buttato della cartaccia. Cosa c'entra questo...?"""
Ushiromiya Eva,"""Ho ottenuto quella ricevuta quando ho comprato delle caramelle in un negozio dell'aeroporto."""
,Eva oba-san tirò fuori un sacchetto di caramelle dalla sua borsetta.
Ushiromiya George,"""... Aah, lo scontrino di quando hai comprato quella caramella? ... Ma Madre, cosa c'entra quello con tutto il resto...?"""
Ushiromiya Hideyoshi,"""George, stai calmo e ascolta per un altro po'..."""
,"L'espressione di Hideyoshi oji-san era un po' severa. ... In qualche modo, sembrava che avesse capito le intenzioni di Eva oba-san."
Ushiromiya Eva,"""Era solo per un capriccio, capisci? Forse ho avuto una piccola previsione, ma non stavo di certo pianificando di piazzare una trappola per Natsuhi Nee-san o chissà cosa."
Ushiromiya Eva,"... In realtà, questo scontrino, ricordi, Nee-san, appena hai incontrato nostro Padre e te ne sei andata, hai incontrato me giusto? In quell'istante, ho inserito questo nella porta dello studio."""
Ushiromiya Battler,"""... E allora, che significa? Intendi dire che, finché Natsuhi oba-san non ha raccolto quello scontrino, nessuno ha aperto la porta...?"""
Ushiromiya Jessica,"""A-Aspetta un attimo, Eva oba-san...! Inserire uno scontrino sarebbe ovvio! {n}È possibile che, quando il Nonno abbia aperto la porta, lo abbia notato e, trovandolo interessante, lo abbia reinserito nella porta..."""
,Jessica controbatté in fretta.
,"... Ancora non comprendeva veramente quel che intendeva, ma realizzò che, qualsiasi cosa fosse, avrebbe innalzato dubbi su sua Madre."
Ushiromiya Eva,"""Ovviamente, ho piegato lo scontrino fino a farlo diventare così piccolo che nessuno lo avrebbe potuto notare. Ma anche se ipotizzi che lo abbia visto cadere, non c'è modo che potesse sapere a che altezza fosse stato inserito di preciso, giusto?"
Ushiromiya Eva,"Lo ho controllato mentre Natsuhi Nee-san stava togliendo la chiave. {n}Lo scontrino si trovava ancora nell'identica posizione di quando l'ho inserito io...!"""
Ushiromiya Natsuhi,"""N... Non riesco a capire perché mai dovresti fare un scherzo tanto infantile! {n}S-Scommetto che sei stata tu a fare anche quello scherzo sulla mia porta!"""
Nanjo Terumasa,"""... La porta della stanza di Natsuhi-san?"""
Ushiromiya Natsuhi,"""... Era sgradevole parlarne, così non l'ho fatto, ma questa mattina, quando mi sono svegliata, c'erano i segni di qualche scherzo fuori la mia porta, con quel che era probabilmente la stessa vernice rossa usata sulla saracinesca. C'erano dei segni sgradevoli, come se qualcosa avesse lacerato la porta..."""
Ushiromiya Hideyoshi,"""Aspetta, cosa significa! Perché non ne hai parlato finora...!!?"""
Ushiromiya Natsuhi,"""Le mie scuse. Siccome tante cose orribili sono accadute da allora, me ne sono completamente dimenticata fino ad ora."""
Ushiromiya Eva,"""Non so niente al riguardo. Quello che ho fatto non era sulla tua porta, ma su quella della stanza di nostro Padre, no? Dopo che hai controllato se si trovava nella sua stanza, e finché non ci siamo assicurate che non ci fosse, quella porta non è stata aperta nemmeno una volta. Come ha fatto nostro Padre a uscire senza utilizzare la porta?"""
Ushiromiya Natsuhi,"""... N... Non lo so...! È quello che voglio sapere!!!"""
Ushiromiya Hideyoshi,"""Natsuhi Nee-san, oltre a te, chi altro ha controllato se nostro Padre fosse nella sua stanza?"""
Nanjo Terumasa,"""La notte scorsa, l'ultima volta che ho incontrato Kinzo-san è stato quando stavamo giocando a scacchi... quindi sono stato con lui fino a prima di cena..."""
Ushiromiya Hideyoshi,"""Chi l'ha visto dopo?"""
Ronoue Genji,"""... Io. Gli ho portato la sua cena la notte scorsa."""
Kanon,"""... Sì. Shannon e io eravamo con lui."""
Ushiromiya Hideyoshi,"""Quindi in quel momento, nostro Padre era sicuramente nella sua stanza. Tuttavia, Natsuhi Nee-san. Quando hai scoperto che non era lì, ho sentito che tutte le vie di entrata o uscita dello studio erano chiuse, o sbaglio? ... Ma anche così, hai detto che lei lo ha incontrato questa mattina."""
Nanjo Terumasa,"""... N... Non capisco perché siate diventati tutti così cupi. Qualcuno potrebbe spiegarmelo...?"""
Ushiromiya George,"""P... Padre, Madre, state forse ... dicendo che quel che Natsuhi dice sull'aver incontrato il Nonno questa mattina ... è una bugia?"""
Ushiromiya Jessica,"""Come potrebbe dire una bugia? Mamma è innocente!! Perché mai dovrebbe mentire!!"""
Ushiromiya Natsuhi,"""Jessica! Continuo a dirti di badare al tuo linguaggio!"""
,"In un attimo, ogni cosa divenne confusa..."
,"Eva oba-san e Natsuhi oba-san l'una di fronte all'altra nel tavolo del salotto, con George di fronte a Jessica... ma che diamine...!!"
Ushiromiya Eva,"""Molte persone l'hanno visto la scorsa notte, giusto? Ma da questa mattina, l'unica che afferma di aver visto Papà è Natsuhi Nee-san."
Ushiromiya Eva,"... E poi c'è quello strano fatto che abbiamo appreso dallo scontrino. {n}Insomma, come possiamo collegare insieme questi punti...?"""
,Eva oba-san invitò tutti ad immaginarlo...
,"... Di certo, quello scontrino poteva essere un punto importante. ... Ma non capivo che tipo di collegamento potesse esserci...!"
,La risposta che Eva oba-san stava sperando... era che Natsuhi oba-san aveva mentito sul fatto di aver visto il Nonno nella sua stanza questa mattina.
,Il capriccio di Eva oba-san aveva rivelato una cosa del genere...??
Ushiromiya Jessica,"""Non riesco proprio a capirlo!! Perché mamma avrebbe dovuto mentire!!? {n}Non ne aveva motivo, giusto!!?"""
Ushiromiya Eva,"""... È quello che voglio capire."
Ushiromiya Eva,"Ma Jessica-chan. Tu non puoi dire che non c'era motivo per lei di mentire e dire che Nonno era nella stanza, giusto? Si vede anche ogni tanto nei romanzi gialli, no? Quel trucchetto di falsare il momento della morte per creare un alibi."""
Ushiromiya Jessica,"""C-Che stai dicendo?! Non ho mai sentito una cosa del genere!!"""
Ushiromiya Eva,"""... Noi ancora non l'abbiamo trovato, ma ragionando normalmente, sarebbe logico dedurre che sia già stato ucciso. In quel caso, dovremmo aspettarci di trovarne presto il cadavere."
Ushiromiya Eva,"... Se, in quel momento, il tempo del decesso potesse essere falsificato, Natsuhi Nee-san sarebbe in grado di crearsi un alibi. ... Avete capito? Tutti quanti?"""
,"... Questa mattina, quando Natsuhi oba-san è andata a controllare che il Nonno fosse lì, ha mentito... e in quel momento era già morto?"
,"... Poi, ha spostato il corpo da qualche parte, e l'ha reso in modo da sembrare che fosse stato ucciso lì."
,... Poi poteva stare con tutti gli altri per crearsi un alibi.
,"... E avrebbe potuto dire ‘Ho sentito qualcuno gridare!’ o qualcosa del genere e correre lì, diventando la prima a trovare il corpo prima di chiunque altro... è questo quello che Eva oba-san sta cercando di dire...?"
Ushiromiya Natsuhi,"""Ridicolo. Dopotutto, i gialli son solo romanzi da intrattenimento! Puoi solo pensare una idea così assurda solo perché li leggi sempre!"""
Ushiromiya Jessica,"""Giusto!! Anche se avesse provato a falsare il tempo del decesso, sarebbe stato tutto inutile al momento dell'autopsia condotta dalla polizia!! Poteva essere efficace in passato, ma pensi davvero che un trucco del genere possa funzionare nel Giappone moderno?! Sei impazzita?!"""
Ushiromiya Eva,"""... Lo pensi davvero? Questa mattina, quando il dottor Nanjo ha guardato i cadaveri, fu capace di stimare solo vagamente il tempo del decesso, giusto? Sarebbe molto facile influenzare i risultati dell'autopsia confondendo ciò che circonda i cadaveri. È una stima molto relativa con una incertezza di alcune ore."
Ushiromiya Eva,"E, sfortunatamente, la scientifica dovrà aspettare fino a domani. Misurare il corretto tempo di decesso dopo una cosa del genere, anche nel Giappone moderno come hai fatto notare, non sarebbe così facile, no? Giusto, Dottor Nanjo...?"""
Nanjo Terumasa,"""... Un'autopsia richiede sia istinto che esperienza, è un compito estremamente difficile... ho sentito che c'è un'alta percentuale di diagnosi sbagliata... è altamente possibile che, in molti casi, può avvenire un errore di alcune ore..."""
Ushiromiya Hideyoshi,"""... Tuttavia, per un alibi, è più che sufficiente! È un vecchio trucco! Un trucco che funziona abbastanza bene! ... Natsuhi Nee-san. Non è che ti stiamo sospettando, va bene? Vogliamo solo che tu provi la tua innocenza così che non dobbiamo sospettarti."""
Ushiromiya Natsuhi,"""Che innocenza vuoi che provi!!? Questa mattina, mi sono sicuramente incontrata con Papà!! E mi ha detto di mantenere l'aquila mono-alata incisa nel mio cuore... e tu stai negando che abbia perfino detto così!!?"
Ushiromiya Natsuhi,"Di sicuro non permetterò una cosa del genere!! Non ti permetterò di negare che nostro Padre abbia detto quelle parole!!"""
Ushiromiya Eva,"""... Forse il corpo di Papà non comparirà da qualche parte? Normalmente, qualcuno deve essere scomparso per sette anni prima che venga dichiarato ufficialmente morto. Sarebbe un modo molto intelligente di prolungare di altri sette anni la vita quasi conclusa di nostro Padre e tenere tutto il suo patrimonio per te!"""
Ushiromiya Natsuhi,"""Io, Io non ti lascerò dire una cosa del genere!! Io non ti permetterò di dire altro!!"
Ushiromiya Natsuhi,"Io sono Ushiromiya Natsuhi!! Nonostante non abbia il diritto di indossare l'aquila mono-alata sul mio corpo, è certamente incisa nel mio cuore!! Che cosa pensi di star dicendo alla moglie di Krauss, il successore del capofamiglia, e la persona che agirà come tale in questo posto!!!"""
Ushiromiya Eva,"""Che cosa vuoi fare? Mi sparerai con quel fucile? Vai avanti. E anche se spari?! Sei solo disperata perché non riesci a trovare una soluzione, giusto?! Fallo, prova ad oscurare la verità con la violenza...!!"""
Ushiromiya Natsuhi,"""T... Tu!!!!"""
,"In realtà Natsuhi oba-san non stava tenendo quel fucile a portata di mano e spaventando nessuno. Ma dopo che Eva oba-san gli disse così, lei lo prese in mano!"
,"... Senza sorpresa alcuna, una volta che le cose si misero in quella maniera, Jessica e Genji-san provarono a fermarla."
Ronoue Genji,"""... Madame, per favore, si calmi...!"""
Ushiromiya Jessica,"""Mamma, non stai mentendo! Quindi non c'è alcuna ragione per ascoltarla!!"""
Ushiromiya Hideyoshi,"""... Calmati, Natsuhi-san. Non andrebbe meglio se tu solamente giurassi che Papà era sicuramente in quella stanza? Perché ti stai facendo problemi per questo...?"""
Nanjo Terumasa,"""... E... Esatto. Natsuhi-san non sta mentendo. La finiamo qua...?"""
Ushiromiya Eva,"""Allora voglio che lo spiegate. Come ha fatto Papà a scomparire dalla stanza? {n}La finestra era chiusa dall'interno. Lo stesso vale per la porta, giusto?"
Ushiromiya Eva,"... Questa mattina, se tu davvero hai incontrato Papà... allora devi spiegare come ha fatto a sparire da questa stanza chiusa con una ‘porta non aperta’. Se non ci riesci, significa che dopotutto stai mentendo, giusto?"""
Ushiromiya Natsuhi,"""Per quanto ancora pensi di deridermi...!!!?"""
Ushiromiya Eva,"""Se vuoi controbattere, prosegui pure!! Esatto, prova a spiegarlo qui, ora. {n}E dopo, potrò chiederti scusa per aver dubitato di te. Come ha fatto Papà a riuscire a fuggire da quella stanza chiusa!!?"""
Ushiromiya Natsuhi,"""Non posso spiegarlo per cui non è necessario!!"""
Ushiromiya Eva,"""Davvero? Allora lascia che lo spieghi io. Prenderemo le parti migliori dalla mia e dalla tua prospettiva, e ne usciremo con una spiegazione più amichevole! ... Crederò che, come hai detto, Papà fosse ancora nella sua stanza questa mattina."
Ushiromiya Eva,"Tuttavia, la volta seguente quando fu aperta la porta, lui non era lì. Per ora non hai alcuna obiezione, giusto?"""
Ushiromiya Natsuhi,"""Non ho voglia di ascoltare niente di ciò che hai da dire!! Chiudi quella tua frivola boccaccia!!"""
Ushiromiya Eva,"""Il mio ragionamento continua così, ok? Entrambe le volte, ho controllato e mi sono assicurata che tu fossi l'unica ad andare attraverso la porta. E questo scontrino ne è la prova! E perciò, qual è la risposta all'enigma di come Papà sia stato mandato fuori dalla stanza?"
Ushiromiya Eva,"La finestra! È stato mandato fuori dalla finestra. ... Natsuhi Nee-san, tu hai gettato Papà fuori dalla finestra dello studio del secondo piano giù nel cortile!!!"""
Ushiromiya Natsuhi,"""T-T-TUUUUUUUUUUUUU!!!"""
Kanon,"""Madame, per favore, sopporti...!!"""
Kumasawa Chiyo,"""Eva-sama... per favore, la smetta...!!"""
Ushiromiya Eva,"""Dopo di che, quando te ne sei andata e hai detto che stavi andando a controllare porte e finestre, hai preso il cadavere di Papà, che era caduto nel cortile, e l'hai nascosto! Probabilmente è stato in quel momento che hai adottato alcune misure per falsare il tempo del decesso, giusto?!"""
Ushiromiya Hideyoshi,"""... Questo si collega al caso che riguarda Krauss nii-san e gli altri, e anche il caso della scorsa notte riguardante Beatrice! C'è una possibilità estremamente alta che Natsuhi-san sia sospetta in quei casi... normalmente, non vorrei dirlo."
Ushiromiya Hideyoshi,"... Ma ora che è venuto allo scoperto, non c'è nient'altro che possa fare...! {n}Per favore, Natsuhi Nee-san! Per favore spiegaci come puoi essere innocente!! Altrimenti, non posso far altro che dubitare di te...!!"""
Ushiromiya Natsuhi,"""Perché io!!? Perché io, Ushiromiya Natsuhi, devo essere insultata cosììììììì!!!"""
,... Hmmmm. ... Sembra che sia il mio momento.
Ushiromiya Battler,"""Ihihihi. ... È inutile. È tutto inutile, Eva oba-san."""
Ushiromiya Jessica,"""... C... Cosa intendi con ‘inutile’, Battler..."""
,"Jessica mi guardò, pendendo dalle mie labbra. L'espressione di Eva oba-san era composta come sempre."
Ushiromiya Eva,"""... Inutile, dici? Cosa? Battler-kun. Dimmelo."""
Ushiromiya Battler,"""Se guardassi solo da una prospettiva, allora rimarresti ferma a pensare che dev'essere stata Natsuhi oba-san. ... Non è che la stia difendendo, ma ciò che hai detto non è sufficiente per un perfetto scacco matto."
Ushiromiya Battler,"Penso che basare l'intera teoria su quello scontrino è passabile. Non è una cattiva logica. Ma al massimo posso dargli un voto di 65. Se questo fosse un esame, sarebbe abbastanza per assegnarti lezioni di recupero, no? Ihihi!"""
Ushiromiya Eva,"""... Oh cielo. Bene, come attraverseresti una porta sigillata da uno scontrino, e come faresti scomparire Papà? Oltre che con la mia teoria?!"""
Ushiromiya Battler,"""La teoria di Eva oba-san è davvero interessante. E se tu potessi mostrare che non c'è maniera di far scomparire il Nonno oltre a quella che hai detto, allora proveresti che l'ultima persona ad averlo visto, Natsuhi oba-san, sarebbe la responsabile."
Ushiromiya Battler,"Tuttavia, dato che c'è ancora una possibilità che sia innocente, e che queste accuse siano false, non puoi fare quella affermazione!!"""
Ushiromiya Eva,"""... Hmm. Allora, Battler-kun, stai dicendo che qualcuno oltre a Natsuhi Nee-san ha fatto sparire il Nonno? Sarebbe impossibile farlo per qualcun altro. Il mio scontrino lo prova, giusto?"
Ushiromiya Eva,"Dopo la prima volta che si è visitato quello studio, e fino alla seconda volta in cui l'abbiamo visitato insieme, lo studio era una perfetta stanza chiusa, e quando nella stanza chiusa il sigillo è stato rotto, lui era già sparito! Se questo non prova che lei è stata la colpevole, che tipo di trucco possono aver usato?!"""
Ushiromiya Battler,"""Come ho detto, Eva oba-san, solo 65 punti. Quindi, proviamo a ‘girare la scacchiera’, ok? Non è come loro abbiano fatto a far sparire il Nonno dall'esterno. Pensa a come il Nonno è sparito dall'interno."
Ushiromiya Battler,"La porta aveva lo scontrino inserito, quindi non può essere stata usata. Non può neanche essere andato via attraverso la finestra, perché non puoi chiuderla dall'esterno, e quando Eva oba-san ha visitato lo studio, lei ha controllato per essere sicura che fosse chiusa. Quindi anche la finestra non è stata usata. A quel punto, lo studio era davvero una stanza chiusa. Dobbiamo accettarlo!"
Ushiromiya Battler,"Tuttavia, lo studio non è rimasto una stanza chiusa per sempre. Una volta che il sigillo creato dallo scontrino è stato rimosso, sarebbe stato possibile per qualcuno scappare dalla porta."
Ushiromiya Battler,"... In altre parole, la questione non è come Natsuhi oba-san ha fatto sparire il Nonno. ... Dobbiamo pensare a come lui sia stato capace di scappare!!"
Ushiromiya Battler,"Lo studio del Nonno non è uno studio normale, giusto? Stando a quanto dice Genji-san, c'è un bagno e una cucina e anche una stanza da letto, quasi come una piccola casa. ... Per esempio, e se si fosse nascosto sotto il letto e voi due avete solo pensato che fosse sparito?"
Ushiromiya Battler,"Eva oba-san, anche tu non hai controllato così a fondo, vero? E allora voi due siete tornate giù per le scale, pensando non fosse lì."
Ushiromiya Battler,"In quel momento, lo scontrino già non c'era più! In altre parole, se il Nonno si fosse nascosto nella sua stanza per l'intera durata di quando era una stanza chiusa, e fosse scappato dopo aver lasciato che voi due lo precedeste, possiamo sfondare subito questa stanza chiusa!!"""
Ushiromiya Eva,"""C-Cosa vuoi dire!? Perché Papà vorrebbe fare una cosa così strana e poi scappare dalla stanza?! Non essere così assurdo!"""
Ushiromiya Battler,"""Già, può anche essere assurdo. Tuttavia, dimostra comunque che c'è una possibilità che Natsuhi oba-san stia venendo accusata ingiustamente. {n}La tua ricevuta non è stata perfetta. Nel gioco degli scacchi, potremmo chiamarlo scacco, ma non è uno scacco matto!!"
Ushiromiya Battler,"E la cosa che mi è piaciuta di meno del tuo ragionamento, pressare Natsuhi oba-san per spiegarlo, e poi affermare che, se non ci fosse riuscita, allora deve essere per forza la colpevole! Se mi stai chiedendo di lasciar correre una cosa del genere, allora perché non lasci che io,"
Ushiromiya Battler,"Ushiromiya Battler, giri la scacchiera ancora una volta!!"
