,"Da quel mozzicone, Kyrie capì che Hideyoshi stava fornendo un alibi ad Eva."
,"A Hideyoshi era stato dato il compito di sorvegliare la stanza per creare un alibi... e, durante quel periodo di tempo, non era stato capace di resistere alla tensione e aveva fumato."
,"Allora Kyrie l'aveva detto a Rudolf. Gli confessò che c'era una buona probabilità che Eva fosse la colpevole, e Hideyoshi un complice."
Ushiromiya Battler,"""... In seguito, Kyrie-san ha proposto di andare a prendere del cibo. E ha chiesto a Hideyoshi oji-san di dare una mano!! Questo può voler dire soltanto una cosa."
Ushiromiya Battler,"Kyrie-san aveva intenzione di isolare Hideyoshi oji-san e domandargli quale fosse la verità!!"""
Ronove,"""Il ‘Corvo di Hempel’ è efficace. A meno che la parte della strega attacchi questa mossa, l'esistenza della magia che afferma di aver controllato Kyrie viene negata."""
{f:5:Eva Beatrice},"""C-Cos'hai dettooooooooooooooooo?!?! L-Lo nego, in ogni caso, lo nego...!! Non sono stata io, noooo! Non è stata Eva Ushiromiya, Eva stava dormendo nella camera!!!"""
Ushiromiya Battler,"""Allora prova a dirlo. Già, non puoi dirlo! Questa volta non ci riesci!!"
Ushiromiya Battler,"Ripetilo!! ‘In quel momento, Eva Ushiromiya non ha fatto un passo fuori dalla stanza’!!"""
{f:5:Eva Beatrice},"""Cos'è questooooooo?! Ero io quella che stava attaccando, no?! Perché sono passata dalla parte di chi viene attaccato?! Quand'è che si sono scambiate offesa e difesa?!"
{f:5:Eva Beatrice},"Sono io che ti sto facendo le domande, giusto?! La strega, io, perchéééééééééé!!!"""
Ushiromiya Battler,"""Di nuovo!!!! Ripetilo!! ‘Eva Ushiromiya non ha lasciato la stanza’!! {n}È impossibile che tu possa dirlo, è scacco mattoooooooooooooooo!!"""
Ronove,"""La fazione della strega ha qualche mossa in risposta?"""
{f:5:Virgilia},"""... Non può essercene una. Non esiste verità che possa essere accettata da una falsa strega rivestita di verità e bugie."""
Ushiromiya Battler,"""Non sei degna di chiamarti una vera strega!! Tu non sei la Strega Dorata! {n}Sei un'umana!"
Ushiromiya Battler,"Ushiromiya Evaaaaaaaaaaaaaaa!!"""
{f:5:Eva Beatrice},"""Oooooooooooooooooooooooooooooohhhhhhhh!!"""
,"La strega urlò. Il suo intero corpo fu bruciato dal tremendo calore che negava la sua magia e la sua esistenza, e lei lanciò un urlo come un drago..."
,"Il suo corpo tremò ripetutamente, lampeggiando come se la sagoma di Eva e quella della strega si stessero sovrapponendo."
,"Tuttavia, quell'urlo fu risucchiato nel bagliore... facendolo ritornare all'originaria forma della crudele strega."
{f:5:Eva Beatrice},"""... *cackle*cackle*cackle*... kuhhihhahhahahahaha... d'accordo. ... Se vuoi chiamarmi Ushiromiya Eva, allora puoi farlo..."
{f:5:Eva Beatrice},"... Esatto, io non posso davvero respingere tutte le mosse legate a Ushiromiya Eva come colpevole. ... Io posso essere stata trascinata via dalla posizione di Strega Dorata... e forse ora posso essere chiamata Ushiromiya Eva..."
{f:5:Eva Beatrice},... Ma sai cosa? Questo da solo non basta perché la magia e le streghe siano negate!! ... Te lo insegnerò a partire da ora...
{f:5:Eva Beatrice},"Ti insegnerò che io non sono Ushiromiya Eva, e nemmeno un'umana... ma una vera strega...!!! Guarda e ammira questa verità rossa!!"""
,"Quando la strega batté la mani, il tempo avanzò nel mondo della Gameboard."
,"Mentre chiamavano il nome di Jessica, Battler ed Eva corsero di fronte al salotto."
,"... La stavano cercando perché erano andati nella stanza dei domestici, avevano trovato il cadavere di Nanjo, e non sapevano dove fosse Jessica."
Ushiromiya Battler,"""... Quindi, qual è il punto? ... Cosa stai cercando di dire?"""
{f:5:Beatrice},"""T... Tu non puoi essere... oh no..."""
,Beato impallidì. ... Ciò rese chiaro che la mossa che la strega malvagia stava provando a fare era talmente grave da far impallidire Beato...
{f:5:Eva Beatrice},"""Questa volta... ti infliggerò una mossa fatale da cui non sarai in grado di uscire. ... No, farò questa mossa contro tutti gli umani che ti supportano. Ascoltala attentamente."""
{f:5:Beatrice},"""S... Smettila... quella mossa è...!"""
Ushiromiya Battler,"""Beato, stai indietro...!! Ci penserò io! Vieni, falsa strega!!"""
{f:5:Eva Beatrice},""" {p:1:Dopo che Jessica è stata ferita,} {p:1:Eva è stata sempre sotto la supervisione di Battler.} {p:1:Battler non è né il colpevole né un complice.} {p:1:Con questo, possiamo stabilire un alibi perfetto per Eva}."""
Ushiromiya Battler,"""C... Che cooosa...?"""
{f:5:Eva Beatrice},"""Sigillerò te, e anche gli umani... in una barriera rossa da cui sicuramente non si può scappare. Addio, miseri umani. Dormite per tutta l'eternità in un'assoluta stanza chiusa di magia con nessuna uscita. ... Su, ascolta attentamente. Ascolta la verità rossa."""
{f:5:Eva Beatrice},{p:1:Non ci sono più di 18 umani su quest'isola}.
{f:5:Eva Beatrice},Getta via i tuoi sciocchi pensieri di persone misteriose che si nascondono e commettono i crimini.
{f:5:Eva Beatrice},"... Ma se lo dico in questo modo, potresti sospettare di colpevoli animali. Sarebbe insopportabile sentire una teoria illogica su come un orango-tango addestrato per commettere omicidi non conterebbe come umano."
{f:5:Eva Beatrice},"Quindi, la cambierò in questo modo."
{f:5:Eva Beatrice},{p:1:Nessuna forma di vita a parte gli umani ha alcuna relazione con questo gioco}.
{f:5:Eva Beatrice},"È così. Come prossima cosa, spiegherò la situazione per tutte le 18 persone che esistono su quest'isola."
{f:5:Eva Beatrice},{p:1:Kinzo è morto}. {p:1:Krauss è morto}. {n}{p:1:Natsuhi è morta}. {p:1:Hideyoshi è morto}. {n}{p:1:George è morto}. {p:1:Rudolf è morto}. {n}{p:1:Kyrie è morta}. {p:1:Rosa è morta}. {n}{p:1:Maria è morta}. {p:1:Genji è morto}. {n}{p:1:Shannon è morta}. {p:1:Kanon è morto}. {n}{p:1:Gohda è morto}. {p:1:Kumasawa è morta}. {n}{p:1:Nanjo è morto}.
{f:5:Eva Beatrice},{p:1:Le 15 persone menzionate sono morte}.
{f:5:Eva Beatrice},Inoltre.
{f:5:Eva Beatrice},{p:1:Battler è vivo}. {n}{p:1:Eva è viva}. {n}{p:1:Jessica è viva}.
{f:5:Eva Beatrice},Queste sono tutte le 18 persone!
{f:5:Eva Beatrice},"""Quindi tu capisci che di conseguenza, quando l'ultima vittima, Nanjo, è morta, solo tre persone, Battler, Eva, e Jessica, sono vive, giusto?"""
Ushiromiya Battler,"""... C... Che cosa hai detto...? ... P... Puttana... non vorrai dire..."""
{f:5:Eva Beatrice},""" {p:1:Eva è stata con te per tutto il tempo.} {p:1:Quindi commettere il crimine era impossibile per lei.} {p:1:Ovviamente, Battler-kun non è il colpevole.} {p:1:Lui non le stava creando un falso alibi, e ha preso in considerazione la possibilità che lei fosse la colpevole, sorvegliando le sue azioni attentamente.""}"
{f:5:Eva Beatrice},"{p:1:""} {p:1:Non c'era possibilità per lei di fare qualcosa di sospetto!} {p:1:In breve, al momento del crimine, solo Nanjo e Jessica erano nella stanza dei domestici}."""
{f:5:Eva Beatrice},"""... E so quello che stai pensando. La tua prossima mossa sarà questa, giusto? C'è anche la possibilità che Jessica sia la colpevole! Ma che peccato, la farò a pezzi prima che tu possa provarci!!"""
{f:5:Eva Beatrice},""" {p:1:Ushiromiya Jessica non ha commesso omicidio}! {p:1:Non è coinvolta nell'omicidio di Nanjo}!! {p:1:I suoi occhi non erano assolutamente in grado di vedere.} {p:1:È impossibile per lei compiere un omicidio come quello}!"
{f:5:Eva Beatrice},"E c'è un extra. {p:1:Neanche Eva e Battler hanno ucciso Nanjo, e non sono neanche coinvolti}!!"""
Ushiromiya Battler,"""A-Aspetta un secondo!! Non è strano?!! Ci sono solo tre umani, poi avviene un omicidio... e nessuno di quei tre è coinvolto? Non ha senso!!"""
{f:5:Eva Beatrice},"""Lo affermerò chiaramente. {p:1:Il colpevole che ha ucciso Nanjo non è Eva né Jessica}!! In altre parole, non è nessuno dei sopravvissuti. Capiiiito?"""
Ushiromiya Battler,"""No, umm... g-giusto! Che mi dici di personalità multiple...?! Proprio come tu eri originariamente un'altra personalità di Eva oba-san... diciamo che Jessica ha un'altra personalità simile a una strega, che prende il nome di ‘qualcuno diverso da Jessica’ e ha ucciso il Dottor Nanjo...!!"""
{f:5:Eva Beatrice},"""Idiota. L'ho già detto in rosso. {p:1:Gli occhi di Jessica non erano assolutamente in grado di vedere, e l'omicidio era impossibile per lei}!"
{f:5:Eva Beatrice},"Non importa da che tipo di personalità fosse impossessata, con il suo corpo non avrebbe potuto compiere un omicidio! Mi chiedo se sei soddisfatto se lo dico in questa maniera?"
{f:5:Eva Beatrice},"{p:1:Nessuna azione causata dal corpo di Jessica ha alcuna relazione o influenza sull'omicidio di Nanjo}! {p:1:Questo si applica anche a Battler ed Eva}. In altre parole, non importa quanto cerchi di lottare e interpretarlo, {p:1:Il colpevole che ha ucciso Nanjo non è né Jessica né Battler né Eva}!"""
Ushiromiya Battler,"""M... Mi stai prendendo in giro!!! Voglio dire, tutti gli altri sono sicuramente morti, giusto?!!"
Ushiromiya Battler,"Allora... tutto ciò che rimane... è la ‘teoria del suicidio del Dottor Nanjo’, giusto?! E l'ipotesi della trappola! Il colpevole era già morto, ma una trappola che aveva già preparato è scattata..."""
{f:5:Eva Beatrice},"""{p:1:Nanjo è stato ucciso da qualcun altro}. ... {p:1:Ovviamente, è stato un metodo diretto di omicidio, non una trappola}. {p:1:Un'arma è stata caricata, e con essa lui è stato ucciso frontalmente a bruciapelo!} {p:1:Il colpevole è apparso apertamente davanti agli occhi di Nanjo, e quando loro due si sono guardati in faccia, il colpevole lo ha ucciso}...!!"""
Ushiromiya Battler,"""Ma aspetta!! Ci sono solo tre sopravvissuti! Tu hai detto in rosso che tutti gli altri sono morti! Hai fondamentalmente confermato lo stato di vita o di morte di tutte le 18 persone. Inoltre, l'esistenza di una diciannovesima persona è stata già negata in rosso...!!"""
Ushiromiya Battler,"""In altre parole, non può esistere nessuno a parte i tre sopravvissuti!! Eppure, una quarta persona oltre quei tre è apparsa davanti al Dottor Nanjo!! Perché una persona oltre a noi può comparire e uccidere il Dottor Nanjo se non esiste una diciannovesima persona?!?!"
Ushiromiya Battler,"Non ha senso!! Stai mentendo!! Stai mentendo col rosso!!!"""
{f:5:Eva Beatrice},"""{p:1:Il rosso dice solo la verità}!!! Dubitare di ciò non è forse la stessa cosa di tradire l'onore di quella strega che è dietro di te, che si fa piccola per via della sua paura verso di me e che si nasconde dietro la tua schiena?!"""
Ushiromiya Battler,"""D... Dannazione...!!!"""
{f:5:Eva Beatrice},"""Ora, lo affermerò chiaramente. ... Quella apparsa di fronte a Nanjo ero io. {n}Una strega. ... La Strega Dorata, che non può essere spiegata dai 18 umani!!"""
Ushiromiya Battler,"""V-Virgilia! Ronove...!! Non c'è nessuna contraddizione in questa situazione?! Sta davvero dicendo la verità con il rosso?!"""
Ronove,"""... Sì. La ‘verità rossa’ è valida."""
{f:5:Virgilia},"""... Che accerchiamento... elaborato e preciso..."""
Ushiromiya Battler,"""C... Come dovrei fare la mia mossa contro di lei...? Virgilia...! Non c'è qualche mossa...?!"""
{f:5:Virgilia},"""... Io... non riesco a pensare a niente..."""
Ushiromiya Battler,"""... E tu, Ronove?!"""
Ronove,"""... Le mie scuse. ... Tuttavia, in questi ultimi mille anni... non avevo mai visto... una così elaboratamente splendida disposizione sulla scacchiera."""
{f:5:Virgilia},"""... È opprimente... ma è anche bellissimo... che... splendido... scacco matto fatto in rosso..."""
,La maestra della strega e il maggiordomo demoniaco erano entrambi sbalorditi... e un'espressione di estasi si formò sul loro volto...
,... Dimentica di arrenderti... loro sono impressionati da questo perfetto scacco matto... che deve semplicemente essere ammirato...
,Quando le persone accettano la sconfitta dal profondo del proprio animo... {n}Non dà vita né a rimpianti né a umiliazione. ... Non nasce niente se non sentimenti di rispetto...
,Io... non sapevo più... che cosa fosse.
,Non c'erano assolutamente punti deboli nel suo rosso.
,Ha detto in rosso che tutte quelle 15 persone sono morte. Ha detto in rosso che non esistono altre persone oltre ai 18.
,"In altre parole, non più di tre persone: io, Jessica ed Eva oba-san, esistevano."
,"E nonostante nessuna di quelle tre persone fosse il colpevole, il Dottor Nanjo è stato ucciso."
,"E senza dubbio, lui era stato ucciso da qualcun altro, assassinato da ‘quella persona’ apertamente di fronte a lui...!"
,E lei sta dicendo che ‘quella persona’... è una strega...?!!
{f:5:Eva Beatrice},"""Il colpevole che ha ucciso Nanjo non era né un animale né niente del genere. Quello è già stato trattato col rosso, giusto? Tutto ciò che non è umano è stato completamente rimosso dall'essere considerato. Anche cose come robot non funzionano."
{f:5:Eva Beatrice},"{p:1:Assolutamente nessun fattore a parte gli umani hanno partecipato in questa gameboard}! Pertanto, io posso anche dire questo."
{f:5:Eva Beatrice},{p:1:La persona che ha ucciso Nanjo era di certo un umano}!
{f:5:Eva Beatrice},"{p:1:Un essere umano, con i piedi a terra, teneva un'arma e ha ucciso con essa!} {p:1:Proprio di fronte ai suoi occhi!} {p:1:}Tuttavia, quell'essere umano potrebbe essere stato in grado di usare la magia. ... Il che significa, che era una strega."
{f:5:Eva Beatrice},"... Era, in altre parole, me. La Strega Dorata, Beatrice!!"""
,... Anche se Battler... stringeva i suoi denti... le sue ginocchia colpirono il pavimento con un thunk.
,La sua anima rifiutava ancora di arrendersi...
,... Tuttavia... le sue ginocchia avevano già... iniziato ad accettare la resa...
{f:5:Eva Beatrice},"""Kuhhihhihihihihihihihihi! Oh, ti sei inginocchiato...?"
{f:5:Eva Beatrice},"Esatto, hai già iniziato a capire. ... La Strega Dorata esiste. ... E quella Strega Dorata, Beatrice, sono io...!!"
{f:5:Eva Beatrice},"""Avanti, lodami. Ora, loda la resurrezione di una vera strega. Ora, loda la resurrezione della Strega Dorata, Beatrice!! Al nono crepuscolo, la Strega risorgerà e nessuno sarà lasciato vivo...!!!"""
Ushiromiya Battler,"""Daaannazioooooneeee... io non... capisco...! Dopo... essere stato così immobilizzato dal rosso... io non ne ho più... la più pallida idea...!"""
{f:5:Beatrice},"""B... Battler... n-non perderti d'animo... tu e io... abbiamo promesso che avremmo combattuto di nuovo l'uno contro l'altra, giusto...? Ti arrenderai qui...?! Scomparirai in un posto come questo prima di combattere di nuovo con me...?!"""
Ushiromiya Battler,"""Io non voglio rompere quella promessa... tuttavia... non riesco a pensare ad alcuna mossa per negarla...!!"
Ushiromiya Battler,"In primo luogo... questo non è neanche un problema! Non esiste niente a parte i sospettati, e tutti questi sono innocenti! Mi è stato detto che sono innocenti in rosso, giusto?! E anche che è stato un vero omicidio, e che il colpevole era umano, e che è comparso di fronte agli occhi del Dottor Nanjo e lo ha ucciso! Mi arrendo... non c'è niente che possa fare...!!!"""
{f:5:Beatrice},"""Ti prego, Battler, non arrenderti, non perderti d'animo...! Se smetti di pensare, hai automaticamente perso. ... Ti scongiuro, non perderti d'animo... Anche io ti sto incoraggiando... quindi non perdere...!"""
Ushiromiya Battler,"""Non riesco a pensare più a niente...!! Credo che lei sia comunque una strega, e deve averlo fatto con la magia, quindi pensare è inutile...!"
Ushiromiya Battler,"È inutile, mi fa male la testa, ho la mente stanca... sto pensando che è inutile pensare, quindi dovrei solo smetterla...!!"""
{f:5:Beatrice},"""Battler, ascolta... nel gioco degli scacchi, entrambe le parti fanno tutto ciò che possono per far perdere l'altro, quindi una singola partita richiede un lungo periodo di tempo. ... Tuttavia, se una parte rinuncia alla vittoria dall'inizio, e avanza con mosse dannose a se stessa, la partita finirà in un batter d'occhio. Questo è chiamato ‘matto dell'imbecille’."""
,"Il matto dell'imbecille è, semplicemente parlando, uno strano modo di giocare a scacchi, dove si cerca di perdere il prima possibile."
,... Aprire lo spazio di fronte al proprio re e invitare dentro la regina dell'avversario.
,"Gli scacchi, il cui tempo medio di giocata potrebbe tendere a diverse ore, possono essere risolti in quattro mosse scarse."
,"... In altre parole, se entrambe le parti cercano di vincere in una lotta, sono costrette ad impiegare un tremendo periodo di tempo... ma se una parte decide di perdere, il gioco può terminare anche troppo facilmente, in ogni momento..."
{f:5:Beatrice},"""... Quando la parte umana smette di pensare, passa qualsiasi problema di fronte a sé nella mani della strega, e anche una mela che cade da un albero può essere immediatamente risolta come opera di magia."
{f:5:Beatrice},"... E lo stesso vale per la parte della strega. ... Le streghe usano la verità rossa. Usandola, possono spiegare con esseri umani la vera forma della magia, e perdere immediatamente."""
Ushiromiya Battler,"""... Non c'è bisogno che tu me lo dica... mi stai dicendo di non smettere di pensare, giusto...? Tuttavia... come dovrei contrattaccare alla perfetta mossa rosso-acceso di quella persona...? Per me... per gli umani... non è più possibile..."""
{f:5:Beatrice},"""... È... impossibile...? È... impossibile per te, Battler...? ... Per favore... non perderti d'animo..."""
Ushiromiya Battler,"""... Scusa... non è più... possibile per me..."""
,"Battler sfregava con le unghie il pavimento, piangendo a dirotto."
,... Beato lo guardò con una faccia afflitta...
,"Poi si alzò, e parlò alla strega."
{f:5:Beatrice},"""... Farò io una mossa per contrastare la tua."""
{f:5:Eva Beatrice},"""Huh? Mi chiedo come puoi eliminare questo perfetto scacco matto?"
{f:5:Eva Beatrice},"Come può questo scacco matto, che è completamente impossibile per gli umani rompere, venire infranto da una come te?!"""
{f:5:Virgilia},"""... B-Beatrice, non può essere, tu..."""
{f:5:Beatrice},"""Hmm. ... Se un umano non può fare una mossa... io ti assalirò con una che posso usare perché sono una strega..."""
Ushiromiya Battler,"""Una mossa che puoi utilizzare perché sei una strega...? C... Cosa stai pensando di fare...?"""
{f:5:Beatrice},"""Userò il rosso, per negare le streghe."""
{f:5:Virgilia},"""Beatrice...!!"""
Ronove,"""M-Milady...!!"""
,Sia la maestra che il maggiordomo si allarmarono.
,... Anch'io capii immediatamente cosa volesse dire. Usare il rosso che soltanto le streghe possono usare. ... Usare il rosso per negare le streghe.
,Era come usare la sua stessa spada per tagliarsi la gola.
{f:5:Eva Beatrice},"""C... Cooosa...?! E... Ehi, cosa stai dicendo? Negare le streghe col rosso...? {n}P... Piantala di parlare come un'idiota. Se lo fai... neanche tu ne uscirai illesa...!!"""
{f:5:Beatrice},"""... Tu non sei una strega. E neanche io lo sono. ... La strada per diventare una vera strega è difficile, e io ho ancora molta, molta strada da fare..."
{f:5:Beatrice},"... Allora questo è vantaggioso. In questo posto ora, le streghe non sono esistite fin da principio. Strapperò via questo inganno io stessa."""
{f:5:Eva Beatrice},"""Non siamo entrambe streghe vere, ovviamente?!! Essere in grado di usare il rosso è di per sé prova per le streghe!"
{f:5:Eva Beatrice},"Non so quale sia per te la definizione di strega, ma se pensi erroneamente che tu sola sarai in grado di uscirne incolume, allora adesso-"""
{f:5:Beatrice},"""Come potrei sbagliarmi. È abbastanza."""
{f:5:Eva Beatrice},"""C... Cos'hai detto...?"""
{f:5:Beatrice},"""Dall'inizio, non sono stata capace di diventare una strega. ... Non ho fatto altro che cominciare finalmente a incamminarmi sulla strada per divenirne una vera."
{f:5:Beatrice},"... Se dicessi che sono una strega ora... non sarei altro che una falsa strega dedita al potere, come te."
{f:5:Beatrice},"... Anziché esistere in questa forma deplorevole, la cancellerò assieme a te, senza alcun rimpianto...!"""
{f:5:Eva Beatrice},"""S... Sei pazza?!?! F-Fermati...! Voglio ancora essere una strega! Odio gli umani...!!"""
Ronove,"""... Strega-sama, per favore tornate al vostro posto. Vi prego di ricevere la risposta della fazione umana da lì."""
{f:5:Eva Beatrice},"""C-Cosa stai facendo?! L-Lasciami andare!! Non lasciare che quella donna usi il rosso!! Fermala!! Lasciamiiiiiiiiiiiiiiiiiiiiiii!!"""
,"Quando la strega si alzò dalla sua sedia e provò a gettarsi su Beato, Ronove la spinse sulle spalle verso il basso, forzandola a stare seduta."
,"E, anche in seguito, non tolse la sue mani da quelle spalle."
,Negare le streghe era la stessa cosa di negare la magia.
,... Questo includeva i demoni come Ronove.
,"Tuttavia, invece di fuggire, Ronove scelse di agire come moderatore del gioco... e di portare a termine il suo compito per il bene della sua padrona."
{f:5:Virgilia},"""... Beatrice. ... Non hai... rimpianti, vero..."""
{f:5:Beatrice},"""Dovrei dirlo io."
{f:5:Beatrice},"... Perdonami. ... Anche se mi hai insegnato un sacco di magie divertenti e di felicità... non ho potuto mai usarle al meglio. ... Quindi studierò da zero... e ripartirò da capo. ... Sono davvero dispiaciuta... che tu abbia dovuto venire coinvolta nella cattiva condotta della tua stupida allieva."""
{f:5:Virgilia},"""... Alla fine ho avuto una buona allieva. ... Vai, mentre ancora credi."""
Ushiromiya Battler,"""... N-Non ho idea di cosa stiate parlando..."
Ushiromiya Battler,"... Ma ho capito una cosa. E posso dire questo... Beato, non so cosa tu stia cercando di fare... ma smetti di cercare di farlo...!"""
{f:5:Beatrice},"""Tu non hai mosse. Ma io ne ho una."
{f:5:Beatrice},"... Se ce la lasciamo sfuggire, lei sarà resuscitata come una strega nel vero senso della parola, e, questa volta, controllerà tutta l'isola. ... Ogni incubo sarà suo per farne ciò che desidera, e quest'isola cadrà nell'inferno più profondo delle illusioni della strega che si ripeteranno, per tutta l'eternità."
{f:5:Beatrice},"... Puoi permettere ciò? ... Ti sta bene che i tuoi cari parenti diventino giocattoli per tutta l'eternità nell'incubo di quella strega?"""
Ushiromiya Battler,"""P-Però... non dovresti sacrificarti tu stessa... Q-Questo è un gioco fra me e lei. Non dovresti dover fare la tua mossa e sacrificarti! I-Io penserò a qualcosa! Troverò sicuramente una mossa miracolosa...!!"
Ushiromiya Battler,"Quindi non essere affrettata!! Ooooooooooooooohhhh, dannazioneeeeeeeeeeeeeee, Ne penserò di sicuro una... non avere frettaaaaaaaaaaaaaaaaa!!"""
{f:5:Beatrice},"""... Questo gioco è crudele. Il limite di tempo per le tue considerazioni è già terminato. ... Ora io sono la sola che può farlo."
{f:5:Beatrice},"... Calmati, Battler. ... io la sconfiggerò. ... Sconfiggerò quella strega crudele con le mie stesse mani..."""
Ushiromiya Battler,"""A-Aspetta, Beato!! Fermati, piantala!! Non c'è alcun bisogno che tu ti sacrifichi!!"""
{f:5:Beatrice},"""Non stavi combattendo per negarmi? ... Che strana persona. Hahahahahahahaha."""
{f:5:Virgilia},"""... Lascia che la bambina faccia come crede. E per favore, assistila fino alla fine."""
Ushiromiya Battler,"""M... Ma..."""
{f:5:Beatrice},"""Battler. ... C'è solo una cosa che ti chiedo. ... Potresti, tapparti le orecchie?"""
Ushiromiya Battler,"""Le orecchie...? Perché...?"""
{f:5:Beatrice},"""... partendo da ora, negherò le streghe col rosso. Taglierò il campo da gioco che lei ha preparato con il suo rosso."
{f:5:Beatrice},"... Facendo ciò... probabilmente perderò anch'io la mia forma di strega. {n}Se anche tu ascolti le verità rosse che pronuncerò, capirai la mia vera forma."
{f:5:Beatrice},"... Se soltanto tu ti copri le orecchie, la verità non avrà il minimo cambiamento. ... Tuttavia... nonostante questo, voglio che tu solo lo faccia. ... Voglio essere una strega... almeno ai tuoi occhi. ... Per favore."""
Ronove,"""... Beatrice-sama. ... Non c'è problema per la parte delle streghe. Prego, la vostra mossa."""
{f:5:Eva Beatrice},"""Lasciamiiiiiiiiiiiiiiiiii!! Non lascerò che anche tu la passi liscia, intesi?!"
{f:5:Eva Beatrice},"È pazza!! Intendi morire e portarci via con te?! Fermati, non negarlo!!"
{f:5:Eva Beatrice},"Fermatiiiiiiiiiiiiiiiiiiiiiiiii!!!"""
{f:5:Beatrice},"""... Che vista disdicevole per una Strega Dorata. ... Molto bene, sei pronta?"
{f:5:Beatrice},"... Rimuoverò il tuo scacco al posto di Battler. Cos'è accaduto sulla scacchiera dove 15 persone sono morte, e solo tre sono rimaste? ... Da adesso, lo spiegherò col rosso. Con quella verità rossa... Trafiggerò e ucciderò entrambe le false streghe!"""
,Beato si voltò e sorrise a Battler.
,"... Molto probabilmente, nessuno crederebbe che la strega che ha raggiunto i limiti della crudeltà, proverebbe a lasciare il suo sorriso come ultima espressione mostrata a Battler."
,"E quel sorriso significava il suo ultimo desiderio, ovvero che voleva che si coprisse le orecchie..."
,Negare le streghe in rosso... era come mostrarle la sua misera forma.
,Battler premette entrambe le mani sulle sue orecchie...
,"... Per proteggere il suo... onore finale come strega, mi mise le mani sulle orecchie... rifiutando la verità."
,E gridò. Così che neanche un frammento di cosa stava dicendo trapelasse nelle sue orecchie.
,"In seguito, venne un mondo in cui Battler non riusciva a sentire nulla. {n}Beato stava dicendo qualcosa in rosso."
,Perfino la strega malvagia si tappò le orecchie a quelle parole amare.
,... Quella era... la verità rossa. Parole di potere. ... Parole che negavano la sua stessa esistenza.
,"Parole uniche che solo le streghe potevano usare, che negavano le streghe."
,"Beato parlò. Con la verità rossa, sbriciolò il campo da gioco di un rosso brillante che la strega aveva sprigionato."
