Speaker,Italian (Ars Magica) (Old) (ITA)
,La strage del primo crepuscolo fu scoperta alle ore 6:00 del mattino il giorno seguente.
,"Gohda, che si era svegliato per preparare la colazione, andò a controllare i parenti che erano rimasti nella sala da pranzo dalla notte precedente a causa della conferenza di famiglia."
Ushiromiya Battler,"""Parlaci di quando hai scoperto il delitto."""
Gohda Toshiro,"""{p:42:La sala da pranzo era chiusa a chiave.} Ovviamente c'è una serratura sulle porte della sala da pranzo, ma in genere restano aperte. Ho bussato, ma non c'è stata risposta..."""
Kumasawa Chiyo,"""{p:42:Sono arrivata in quel momento.} Gli ho suggerito di aprire la porta, per ogni evenienza."""
Gohda Toshiro,"""Quando {p:42:ho aperto la porta col passepartout}, una vista terrificante mi attendeva all'interno..."""
Kumasawa Chiyo,"""{p:42:Eva-sama, Hideyoshi-sama, Rudolf-sama, Kyrie-sama, Rosa-sama e Genji-san,} {p:42:sei persone in tutto, giacevano a terra, ricoperti di sangue...}"""
Ushiromiya Krauss,"""In seguito c'è stata una gran confusione. {p:42:Tutti si sono radunati nella sala da pranzo.}"""
Ushiromiya Natsuhi,"""Non voglio ricordarlo... la vista di tutti i ragazzi che piangevano rannicchiati sui corpi dei loro genitori..."""
Ushiromiya Jessica,"""C'era la possibilità che potessero essere ancora vivi. ... Tutti quanti li scuotevano disperatamente."""
Shannon,"""Ma è stato inutile... {p:42:la morte di ogni genitore era stata confermata dal proprio figlio...}"""
Kanon,"""{p:42:Io e il dottor Nanjo abbiamo confermato che Genji-san era morto.}"""
Nanjo Terumasa,"""È stato un modo orribile di morire... {p:42:nessuno confermerebbe per sbaglio una morte, anche gli altri oltre me.}"""
Ushiromiya Maria,"""Sembra che {p:42:tutte le vittime siano morte sul colpo.} ... Kihihihihi."""
Ushiromiya Krauss,"""{p:42:Dopo aver ispezionato l'interno della sala da pranzo, abbiamo scoperto che tutte le porte e le finestre erano chiuse, rendendola una stanza chiusa.}"""
Ushiromiya Battler,"""E {p:42:niente di sospetto è stato ritrovato all'interno della sala da pranzo.}"""
Ushiromiya George,"""Ovviamente, {p:42:non c'era nessuno nascosto all'interno della sala da pranzo.}"""
Ushiromiya Krauss,"""Naturalmente. Siamo tutti qui ora. {p:42:È chiaro che nessuno si sta nascondendo.}"""
Ushiromiya Jessica,"""Ma Papà, se fosse vero, non avrebbe senso... sei persone sono state uccise, e la sala da pranzo è una stanza chiusa! Come avrebbe potuto qualcuno ucciderli e poi scappare?!"""
Ushiromiya Natsuhi,"""... Preferirei non pensarci, ma i domestici con i loro passepartout sono i più sospetti."""
Ushiromiya Krauss,"""Hanno ucciso i sei, poi sono usciti e hanno chiuso la porta con i loro passepartout. ... È una teoria sensata."""
Gohda Toshiro,"""E-Eeek! È... è assurdo!"""
,"Poiché non era possibile che il colpevole si stesse nascondendo nella sala da pranzo, aveva senso ritenere che il colpevole avesse chiuso la porta dopo aver commesso l'omicidio ed essere uscito dalla stanza."
,"Era naturale che i domestici, con i loro passepartout, venissero sospettati."
,"E, purtroppo, nessuno dei domestici aveva un alibi."
,"Tuttavia, ciò non voleva solo per i domestici. Anche tutti gli altri non avevano un alibi."
Ushiromiya Battler,"""C'è modo di chiudere dall'esterno senza un passepartout?"""
{f:5:Bernkastel},"""No, non c'è. ... Hmm, non è sufficiente. Lo dirò con la verità rossa."""
{f:5:Bernkastel},"{p:1:Tutte le porte possono essere chiuse o aperte soltanto con un passepartout.} {p:1:Ovviamente, è possibile chiudere o aprire le porte dall'interno della stanza anche senza un passepartout.}"
{f:5:Lambdadelta},"""Ecco a voi. Altre domande?"""
{f:5:Beatrice},"""Non dovrebbero esserci chiavi per ogni singola stanza oltre ai passepartout?"""
{f:5:Bernkastel},"""... Normalmente esisterebbero. Tuttavia, avrebbero reso il gioco più complesso, quindi le ho eliminate. Verità rossa. {p:1:In questo gioco, considereremo i passepartout come le uniche chiavi esistenti.}"""
Ushiromiya Battler,"""In altre parole, tutte le serrature che appaiono in questo gioco possono essere chiuse o aperte soltanto dai passepartout."""
{f:5:Lambdadelta},"""Esattamente. È un gioco davvero semplice."""
{f:5:Beatrice},"""In questo caso, dovremmo verificare il numero di passepartout e chi li ha."""
{f:5:Bernkastel},"{p:1:Ci sono cinque passepartout in totale.} {p:1: Ognuno tenuto da ciascun domestico.} {n}Le chiavi sono gestite in modo particolare. {p:1:I domestici tengono le chiavi con loro per tutto il tempo, per cui è impossibile che vengano rubate, prestate, o usati da altri esseri umani oltre loro.}"""
Ushiromiya Battler,"""Che diavolo. Ora sembrano meno delle chiavi e più un sistema ad impronte digitali."""
{f:5:Beatrice},"""Metafora interessante. ... In altre parole, nel mondo di questo gioco, non sono i passepartout, ma i cinque domestici stessi a poter aprire o chiudere le porte."""
Ushiromiya Krauss,"""Abbiamo provato a recuperare il passepartout di Genji-san, ma senza successo."""
Ushiromiya Natsuhi,"""Per prevenire problemi in seguito, {p:42:abbiamo distrutto il passepartout di Genji.}"""
,Questo era il delitto del primo crepuscolo. La scena del crimine era la stanza chiusa della sala da pranzo.
,"Nessuno dei domestici possedenti passepartout ha un alibi. Inoltre, nessuno degli altri ha un alibi..."
,Tutti tornarono in salotto per discutere sul da farsi.
,"I telefoni erano fuori uso, per cui non potevano contattare la polizia."
,"Il colpevole si stava forse nascondendo da qualche parte, pianificando di attaccare la prossima vittima proprio in quel momento?"
,"O era con loro, leccandosi le labbra e gustandosi la prossima preda?"
,"Nessuno di loro aveva alibi, ed era possibile che ognuno di loro fosse colpevole..."
,"Tuttavia, quell'aria pesante non durò a lungo."
,"Verso mezzogiorno tutti si erano stancati di litigare, e avevano deciso di prendersi una pausa."
,Krauss e Natsuhi annunciarono di voler parlare tra di loro da soli e si diressero verso il primo piano.
,"Quello era solo l'inizio, dopodiché tutti iniziarono ad andare in giro da soli ogni tanto, ad esempio per andare in bagno o per andare a guardare la pioggia che cadeva senza fine."
,"Tuttavia, non importa quanto tempo fosse passato, Krauss e Natsuhi erano gli unici a non essere ritornati."
,"Furono inviate telefonate sia alla stanza di Krauss che a quella di Natsuhi usando la linea interna, ma non ci fu risposta."
,Poteva essere successo qualcosa.
,"Si diressero tutti insieme verso le stanze di Krauss e Natsuhi... e nella stanza di Natsuhi, trovarono Krauss e Natsuhi che giacevano sul pavimento."
Gohda Toshiro,"""{p:42:La stanza di Madame era chiusa!} È proprio come la sala da pranzo!"""
Shannon,"""Dopo aver ottenuto il permesso di tutti, {p:42:io ho sbloccato la porta...}"""
Kanon,"""{p:42:Krauss-sama e Natsuhi-sama giacciono distesi sul pavimento della stanza.}"""
Ushiromiya Battler,"""{p:42:Il dottor Nanjo ha controllato il battito.} {p:42:Dopodiché, ha annunciato che entrambi erano morti sul colpo.}"""
Nanjo Terumasa,"""Corretto. {p:42:Ho confermato entrambe le loro morti.} {p:42:Non c'è dubbio che siano morti sul colpo.}"""
Ushiromiya Jessica,"""Ho esaminato tutta la stanza, alla ricerca di un indizio...! Alla fine, {p:42:ho scoperto che le finestre e le porte erano tutte chiuse, rendendola una stanza chiusa.}"""
Kumasawa Chiyo,"""Un'altra stanza chiusa! E ancora una volta, noi domestici con i passepartout verremo sospettati...!"""
Gohda Toshiro,"""M-Ma non c'è da aver paura...! Dopo che Madame ha iniziato a sospettare di noi, abbiamo iniziato a tenerci d'occhio a vicenda!"""
Shannon,"""{p:42:Tutti noi domestici siamo stati insieme per tutto il tempo.}"""
Kanon,"""{p:42:Tutti noi domestici possiamo confermare un alibi per tutti gli altri domestici.}"""
Ushiromiya Battler,"""Questo sì che è interessante. Stai dicendo che questa stanza chiusa è ancora più perfetta."""
{f:5:Bernkastel},"""... Nel caso della prima stanza chiusa, nessuno aveva un alibi. Quindi, per questa stanza chiusa, ognuno di loro ha un alibi."""
{f:5:Beatrice},"""In questo mondo, i domestici stessi diventano passepartout viventi. Dato che tutti loro hanno un alibi perfetto, era impossibile chiudere la stanza di Natsuhi..."""
Ushiromiya George,"""Abbiamo deciso di conservare la scena del crimine così com'era."""
Ushiromiya Maria,"""{p:42:Abbiamo posto del nastro adesivo all'esterno di ogni porta e finestra, sigillandole!}"""
Ushiromiya Jessica,"""Sono sicura che il colpevole abbia lasciato qualche indizio in quella stanza! {p:42:Ci siamo accertati che nessuno fosse in grado di entrare o uscire fino all'arrivo della polizia!}"""
Ushiromiya Battler,"""Poi, abbiamo fatto lo stesso con la sala da pranzo. {p:42:Abbiamo sigillato allo stesso modo anche la sala da pranzo.}"""
Nanjo Terumasa,"""Siamo giunti alla conclusione che l'intera villa dovesse essere lasciata così com'è. {p:42:Abbiamo sigillato anche la villa stessa, e tutti noi abbiamo preso rifugio nella casa degli ospiti.}"""
Ushiromiya Battler,"""Hanno sigillato l'intera villa? Nastro adesivo su tutte le finestre? Hanno anche usato una scala per le finestre al secondo piano?"""
{f:5:Bernkastel},"""... Il gioco sarebbe diventato complicato così, per cui ho semplificato la cosa. {p:1:Tutte le finestre hanno sbarre di ferro, quindi è impossibile entrare o uscire attraverso di esse.} {p:1: }Pertanto, {p:1:diremo che possono sigillare l'intera villa sigillando le due porte, la principale e quella sul retro.}"""
Ushiromiya Battler,"""Capisco. Così è facile."""
{f:5:Beatrice},"""Cosa ne pensi?"""
Ushiromiya Battler,"""In realtà uccidere le due persone nella stanza di Natsuhi oba-san sarebbe semplice. Basterebbe che qualcuno bussasse alla porta per farsela aprire. Tuttavia, non potrebbe chiuderla dopo."""
{f:5:Beatrice},"""Solo i domestici possono chiudere le porte, ma tutti i domestici hanno alibi."""
Ushiromiya Battler,"""A meno che i domestici siano tutti in combutta. Ma soprattutto, il primo crepuscolo mi ha insospettito."""
{f:5:Beatrice},"""Pensi che uno dei sei che è morto nella sala da pranzo fosse in realtà vivo e abbia commesso il crimine?"""
Ushiromiya Battler,"""È a causa di Erika. Non posso fare a meno di essere sospettoso quando delle persone esaminano dei cadaveri."""
{f:5:Beatrice},"""Quindi pensi che qualcuno tra le prime sei vittime fosse vivo?"""
Ushiromiya Battler,"""Già. E in seguito, ha ucciso Krauss e Natsuhi. Poi ha chiuso la porta, si è nascosto all'interno della stanza, e ha trovato una buona opportunità per scappare."""
{f:5:Beatrice},"""Mh, questa teoria ha senso."""
{f:5:Bernkastel},"""... Lo dirò in rosso. {p:1:Il colpevole del primo crepuscolo ha davvero ucciso sei persone.}"""
{f:5:Beatrice},"""Proverò a ribattere con la verità blu. Ecco la vera natura di questa stanza chiusa. {p:2:Il colpevole ha chiuso la porta dall'interno, poi si è nascosto nella stanza di Natsuhi.} {p:2:Poi, dopo che tutti se ne sono andati, ne ha approfittato per scappare.}"""
{f:5:Bernkastel},"""... Va bene, lo negherò in rosso. {p:1:Il gruppo ha sigillato la stanza nello stesso momento in cui se ne sono andati.} {p:1: Nessun colpevole si è unito al gruppo quando se ne sono andati.} {p:1: Inoltre, tutti i sigilli sulla stanza di Natsuhi, sulla sala da pranzo, e sulla villa stessa non verranno infranti.}"""
{f:5:Lambdadelta},"""Heheheheheh. In altre parole, non puoi usare il trucco in cui si nasconde sotto al letto per poi scappare in seguito."""
Ushiromiya Battler,"""... Interessante. Bella mossa, Bernkastel."""
{f:5:Bernkastel},"""Grazie."""
,"Questo era il delitto del secondo crepuscolo. La scena del crimine era la stanza di Natsuhi, una stanza chiusa."
,"Stavolta, tutti i domestici con passepartout avevano un alibi."
,"L'intero gruppo, realizzando quanto fosse pericoloso rimanere nella villa, prese rifugio nella casa degli ospiti..."
,Tutti quelli che si erano rifugiati nella casa degli ospiti decisero di rimanere chiusi lì finché non fosse passato il tifone.
,"Lì, se tutti si fossero tenuti d'occhio, avrebbero potuto evitare ulteriori crimini dall'interno o dall'esterno."
,"Tuttavia, non avrebbero potuto farlo senza interruzioni fino alla fine della tempesta."
,"Ancora una volta, le loro azioni avevano lasciato un punto debole scoperto, e dovettero affrontare un'altra tragedia."
Ushiromiya Battler,"""Shannon-chan e Kanon-kun, che erano usciti per svolgere una faccenda, non sono ancora tornati...!"""
Ushiromiya Jessica,"""George Nii-san si è fatto cogliere dall'agitazione, così {p:42:siamo andati tutti fuori a cercarli.}"""
Kumasawa Chiyo,"""Abbiamo trovato Shannon-chan che giaceva nel roseto. Oh povera, povera Shannon-chan..."""
Ushiromiya George,"""Pregai che fosse ancora viva. Tuttavia, {p:42:dovetti riconoscere che era morta...}"""
Nanjo Terumasa,"""Ovviamente, {p:42:anche io l'ho esaminata e ho confermato la sua morte.}"""
Gohda Toshiro,"""Quando quei due sono usciti, noi eravamo occupati a controllare che ogni serratura della casa degli ospiti fosse chiusa. Quindi, {p:42:nessuno di noi ha un alibi...!}"""
Ushiromiya George,"""Io, ucciderla?! Come avrei potuto?!!"""
Ushiromiya Maria,"""Esatto. George Onii-chan non avrebbe potuto ucciderla, uu-."""
Ushiromiya Jessica,"""In seguito, abbiamo scoperto che solo George Onii-chan aveva un alibi. {p:42:Almeno per quanto riguarda la morte di Shannon, era impossibile per George Onii-chan essere l'assassino.}"""
Ushiromiya Battler,"""Per dirla in un altro modo... {p:42:chiunque avrebbe potuto ucciderla eccetto George-aniki.}"""
Gohda Toshiro,"""Per evitare che il colpevole lo usasse per i suoi loschi fini, {p:42:abbiamo distrutto il passepartout che Shannon aveva con sé.}"""
{f:5:Bernkastel},"""... Nel momento in cui Shannon viene uccisa, Kanon scompare per sempre. {p:1:D'ora in avanti, Kanon viene considerato ucciso.} {p:1:Inoltre, il passepartout di Kanon viene considerato distrutto.}"""
{f:5:Lambdadelta},"""Beh, ho pensato che sarebbe stato rude, quindi ho taciuto su questo, ma questo è ciò che succede quando Shannon muore."""
{f:5:Beatrice},"""In altre parole, possiamo dire che Shannon e Kanon vengono uccisi nello stesso momento, anche se manca un cadavere?"""
{f:5:Bernkastel},"""Esatto."""
Ushiromiya Battler,"""... Hmm. Sembra che i crimini stiano proseguendo."""
,Questo era il delitto del quarto crepuscolo.
,La scena del delitto era il roseto.
,"Non ci sono serrature o porte. Non è una stanza chiusa. Quindi, i passepartout non hanno più nulla a che vedere con ciò."
,"Poi, il ritmo dei delitti prese ad aumentare..."
,Tutti presero rifugio nella casa degli ospiti.
,"Chiusero con cura tutte le porte e le finestre, barricandosi in una stanza chiusa."
,"Tuttavia, si erano già verificati diversi delitti in stanze chiuse."
,Chiudersi in una stanza chiusa avrebbe forse potuto fare altro che portare ad un'altra tragedia?
,"Dopo aver litigato ferocemente nella stanza dei cugini sul trovare il colpevole, essi decisero che avrebbero dovuto ricontrollare le testimonianze di Nanjo, Kumasawa e Gohda."
,E qui... scoprirono che la tragedia si era ripetuta ancora una volta.
Nanjo Terumasa,"""{p:42:A giudicare dalle ferite, Gohda-san e Kumasawa-san sono morti all'istante}, credo. Che modo orrendo di morire..."""
Ushiromiya Jessica,"""Come se potessero sopravvivere dopo una cosa del genere...! {p:42:Gohda-san e Kumasawa-san sono entrambi morti!}"""
Ushiromiya Battler,"""Beh, siamo stati occupati a guardarci intorno e a controllare le serrature. {n}Ancora una volta, {p:42:nessuno di noi ha un alibi.}"""
Ushiromiya George,"""Questo non è vero. Guarda. ... Considerando il modo in cui sono stati uccisi, il colpevole si sarebbe di certo sporcato di sangue."""
Ushiromiya Maria,"""Ma il dottor Nanjo e tutti i cugini non hanno sangue su di loro."""
Ushiromiya Jessica,"""Tutti noi... per dirla in altre parole, {p:42:i quattro cugini e il dottor Nanjo non avrebbero potuto uccidere Gohda-san e Kumasawa-san.}"""
Ushiromiya Battler,"""In questo caso, è chiaro che il colpevole è qualcuno al di fuori di noi."""
Ushiromiya George,"""Ho immaginato che qualcuno avesse potuto introdursi, per cui ho controllato attorno, {p:42:ma la casa degli ospiti era ancora completamente sigillata.}"""
Nanjo Terumasa,"""Forse dopotutto il colpevole ha un passepartout..."""
Ushiromiya Battler,"""Impossibile. {p:42:Non esistono altri passepartout al di fuori delle due chiavi che hanno le due persone che giacciono morte qui a terra.}"""
Ushiromiya Jessica,"Dato che i due passepartout esistenti sono all'interno della casa degli ospiti... questo la rende una perfetta stanza chiusa...!"""
Ushiromiya Maria,"""Beh, dato che qualcuno è morto, ovviamente non è poi così perfetta. Kihihihihihihihihi..."""
,Questo era il delitto del quinto e del sesto crepuscolo. La scena del crimine era la stanza chiusa conosciuta come casa degli ospiti.
,"Anche i passepartout di Gohda e Kumasawa sono stati distrutti, ciò significa che tutti i passepartout sono andati perduti."
,"Ora, nessuno può entrare in questa stanza chiusa che è la casa degli ospiti."
,"O almeno, così doveva essere..."
,"Questa volta, fu il Dottor Nanjo ad essere ucciso."
,È stato ucciso nell'atrio d'ingresso della casa degli ospiti.
,Era stato troppo stupido voler andare lì da solo per controllare che tutto fosse chiuso.
Ushiromiya Jessica,"""{p:42:È... è morto...} {p:42:è stato ucciso...!}"""
Ushiromiya George,"""Persino io... posso dire con sicurezza che {p:42:questa è stata una morte istantanea}..."""
Ushiromiya Maria,"""{p:42:Tutto è perfettamente sigillato.} Com'è potuto succedere, se questa è una stanza chiusa?"""
Ushiromiya Battler,"""Allora significa che il colpevole è uno di noi...!"""
Ushiromiya Jessica,"""Impossibile! A giudicare dalle circostanze, {p:42:Maria, Battler, George Nii-san e io non potevamo uccidere il Dottor Nanjo!}"""
Ushiromiya George,"""In primo luogo, {p:42:nessuno poteva uccidere il Dottor Nanjo all'interno della casa degli ospiti!}"""
Ushiromiya Battler,"""E guardate questo. Per dirlo semplicemente, {p:42:questa è la prova che il Dottor Nanjo non ha lasciato la casa degli ospiti...!}"""
Ushiromiya Maria,"""Allora questo significa che nessuno poteva uccidere il Dottor Nanjo, giusto? {n}E allora perché è stato ucciso?"""
,Nessuno riusciva a rispondere a quell'innocente domanda.
,Questo era il settimo crepuscolo.
,"Ancora una volta, la scena del crimine era la stanza chiusa conosciuta come casa degli ospiti."
,Alcuni frammenti di prove facevano sembrare questo delitto ancora più impossibile.
,"Infine, la tragedia raggiunse l'ottavo, crepuscolo, l'ultimo."
,"Ormai, era chiaro che rintanarsi non li avrebbe tenuti al sicuro."
,Forse Jessica aveva scelto la rabbia per sopprimere la paura.
,"Uscì correndo fuori dalla casa degli ospiti in preda alla rabbia, cercando il colpevole che era sicura si stesse nascondendo da qualche parte lì fuori."
,"George, Battler e Maria si affettarono ad inseguirla."
,"Quindi, fuori dall'edificio, trovarono Jessica che giaceva al suolo."
,"Era, come tutti potevano giudicare guardandolo, un cadavere massacrato..."
Ushiromiya George,"""Povera... Jessica-chan. {p:42:Probabilmente è morta sul colpo.}"""
Ushiromiya Maria,"""{p:42:È impossibile che sia sopravvissuta ad una cosa del genere.} Kihihihihi."""
Ushiromiya Battler,"""Noi tre siamo rimasti insieme per tutto il tempo! {p:42:George-aniki, Maria e io non avremmo potuto uccidere Jessica!}"""
Ushiromiya Maria,"""Già. {p:42:Noi tre non potevamo uccidere Jessica.}"""
Ushiromiya George,"""Come se Maria-chan potesse uccidere qualcuno. {p:42:Maria-chan non può uccidere nessuno.}"""
Ushiromiya Maria,"""Kihihi, grazie. {p:42:George Onii-chan non poteva uccidere un adulto.} {p:42:Avrebbe potuto uccidere un ragazzo però.} Kihihihihihi."""
Ushiromiya Battler,"""Ah, non ci capisco niente...!! Che diavolo sta succedendo...?!!"""
,Questo era l'ottavo crepuscolo. La scena del crimine era... l'esterno.
,"Tuttavia, i tre che avevano inseguito Jessica avevano degli alibi. George, Battler e Maria non avrebbero potuto uccidere Jessica."
,"Quindi, c'è davvero qualcuno che si sta nascondendo su quest'isola, a parte la famiglia Ushiromiya...?"
,"Il sipario viene calato su questa storia, per ora..."
{f:5:Bernkastel},"""... Questo è tutto, per quanto riguarda la mia storia."""
{f:5:Lambdadelta},"""Piuttosto ben fatta. Se tu avessi un Lettore completo, terrebbe bene testa ai giochi di Beato."""
Ushiromiya Battler,"""Sono d'accordo. Hai fatto un buon lavoro."""
{f:5:Beatrice},"""Beh, il vero lavoro si ha prendendo ciò, Leggendolo e facendogli valere un giusto spettacolo."""
Ushiromiya Battler,"""Tuttavia, sono perplesso. A giudicare dalle apparenze, il colpevole deve essere qualche persona misteriosa al di fuori della famiglia Ushiromiya."""
{f:5:Beatrice},"""E ciò sarebbe come riconoscere l'esistenza di una strega. ... Possiamo anche sospettare l'esistenza di qualche complice che abbia aiutato il colpevole."""
Ushiromiya Battler,"""A proposito, che cos'era quel testo viola? Una nuova regola?"""
{f:5:Bernkastel},"""... Le chiamo ‘dichiarazioni viola’. È una regola che ho introdotto per rendere la storia un po' più facile da seguire. ... Pensate alle dichiarazioni viola come a delle importanti affermazioni verbali. ... In altre parole, potreste ignorare le affermazioni verbali che non sono in viola."""
Ushiromiya Battler,"""Oho... beh, carino da parte tua."""
{f:5:Beatrice},"""Quindi, le dichiarazioni viola sono affidabili come la verità rossa?"""
{f:5:Bernkastel},"""Sì. Potete pensare che le dichiarazioni viola abbiano lo stesso potere della verità rossa. ... Tuttavia, c'è una sola eccezione. Il colpevole può dire menzogne con le dichiarazioni viola."""
Ushiromiya Battler,"""... Capisco. Capovolgendolo, chiunque non sia il colpevole non può mentire."""
{f:5:Beatrice},"""Dichiarazioni viola. ... Sembrano essere la chiave del gioco di Lady Bernkastel."""
{f:5:Bernkastel},"""Già, esatto. ... Spiegherò le regole del mio gioco."""
,"{e:100: • La definizione di ‘colpevole’ è ‘la persona che compie l'omicidio’. {n}• È possibile per un colpevole mentire. {n}• È possibile per un colpevole mentire anche prima di commettere omicidio. {n}• Personaggi che non sono colpevoli possono solo dire la verità. {n}• Personaggi che non sono colpevoli non possono cooperare con un colpevole. {n}• Un colpevole deve compiere tutti gli omicidi direttamente, con le sue mani. {n}• Un colpevole non deve morire. {n}• Un colpevole deve essere tra i personaggi apparsi nella storia {n}• Le dichiarazioni viola sono assolute come le verità rosse. Tuttavia, il colpevole e lui solamente può mentire con le dichiarazioni viola. }"
{f:5:Bernkastel},"""Questo è tutto."""
Ushiromiya Battler,"""La definizione di ‘colpevole’ è ‘la persona che compie l'omicidio’... ha senso."""
{f:5:Beatrice},"""È possibile per un colpevole mentire. Anche questo sembra ragionevole."""
Ushiromiya Battler,"""È possibile per un colpevole mentire anche prima di commettere omicidio. {n}Beh, nessuna sorpresa."""
{f:5:Beatrice},"""Personaggi che non sono colpevoli possono solo dire la verità. {n}Sarebbe stupendo!"""
{f:5:Lambdadelta},"""Personaggi che non sono colpevoli non possono cooperare con un colpevole, giusto?"""
{f:5:Beatrice},"""Quindi, il colpevole non può usare alcun complice per creare un alibi."""
Ushiromiya Battler,"""Dannazione. La mia ipotesi era che qualcuno avesse creato un alibi per coprire il colpevole, ma..."""
{f:5:Bernkastel},"""... Aw, che peccato."""
{f:5:Beatrice},"""Un colpevole deve compiere tutti gli omicidi direttamente, con le sue mani. {n}In altre parole, non ci sono metodi di omicidio remoti o indiretti, come trappole."""
Ushiromiya Battler,"""Un colpevole non deve morire. In altre parole, non può commettere omicidio, formare una stanza chiusa e poi suicidarsi al suo interno."""
{f:5:Lambdadelta},"""E non significa anche che le persone morte non possono essere colpevoli?"""
{f:5:Beatrice},"""... Hmm. Questa è un'informazione decisamente vitale."""
Ushiromiya Battler,"""Un colpevole deve essere tra i personaggi apparsi nella storia. ... Quindi, nessun estraneo misterioso che si intrufola sull'isola."""
{f:5:Bernkastel},"""I personaggi che appaiono sono le stesse vecchie 17 persone dopo che Kinzo è stato rimosso. Nessun altro appare nella storia, quindi nessun altro importa."""
{f:5:Beatrice},"""Le dichiarazioni viola sono assolute come le verità rosse. Tuttavia, il colpevole e lui solamente può mentire con le dichiarazioni viola. ... Questa è quella difficile."""
Ushiromiya Battler,"""Potrebbe essere il cuore di questo gioco. Le premesse del gioco son tutte qui?"""
{f:5:Bernkastel},"""... Oltre a ciò, credo ci sia solamente che ‘il Lettore non mente’. In altre parole, {p:1:oltre alle affermazioni parlate, non ci sono menzogne nella narrazione.} {n}Volendo l'avrei potuto fare, ma sarebbe stato un fastidio e avrebbe reso le cose complicate."""
{f:5:Beatrice},"""Quindi, abbandoni volontariamente i privilegi di una strega. Sembri piuttosto fiduciosa."""
Ushiromiya Battler,"""Probabilmente ha intenzione di vincere nonostante ciò."""
{f:5:Bernkastel},"""Questo è tutto da parte mia. ... Non intendo darvi altri indizi o rispondere ad ulteriori domande."""
{f:5:Lambdadelta},"""Come osservatrice, lo proclamo ancora una volta. {p:1:Garantisco che è possibile individuare il colpevole con queste informazioni.}"""
Ushiromiya Battler,"""Ok. ... Capito."""
{f:5:Beatrice},"""Non vedo l'ora di iniziare. Non riesco a credere che noi due discuteremo dello stesso giallo insieme ancora una volta...!"""
Ushiromiya Battler,"""Già. Non vedo l'ora...!"""
,... Questo è veramente un gioco tra te e me. Raccomando di prendere della carta e qualcosa con cui scrivere. Questo se intendi davvero sfidarmi.
