{f:5:Beatrice},"""In altre parole... questo ci fa notare che esiste ancora un altro colpevole."""
Ushiromiya Battler,"""Interessante. È anche una teoria che ha senso. Inoltre, vorrebbe dire che anche il terzo colpevole è uno di quelli che si sono finti morti. ... In questo modo sarebbe persino possibile avere quattro o cinque colpevoli."""
{f:5:Beatrice},"""*cackle*, non ne sono sicura. Ad ogni modo, Gohda, Kumasawa e Nanjo non potevano venire uccisi se c'erano solo due colpevoli. Su questo non c'è dubbio...!"""
Ushiromiya Battler,"""Si sta facendo complicato. Era un gruppo di tre colpevoli? O una coppia che collaborava insieme a qualcun altro per conto suo? ... Ah, giusto, non possiamo tralasciare la possibilità che ci siano più di tre colpevoli."""
{f:5:Beatrice},"""Delle 17 persone che appaiono nella storia, nove sono state confermate innocenti. Mettiamo da una parte Battler, George e Maria dato che sono sopravvissuti. Per le persone che dovrebbero essere morte, ma non sono provate essere innocenti, abbiamo Eva, Hideyoshi, Rudolf, Kyrie e Rosa, tutte vittime nel primo crepuscolo."""
Ushiromiya Battler,"""Ora, la questione è quale di queste cinque vittime nella sala da pranzo stesse fingendo la propria morte. ... Ci stiamo avvicinando. Sta iniziando a piacermi...!"""
Ushiromiya Battler,"""Per l'ottavo crepuscolo alla fine, la struttura è identica."""
{f:5:Beatrice},"""Esatto. La narrazione dice che George, Battler e Maria non avrebbero potuto uccidere Jessica. I tre sopravvissuti non avrebbero potuto farlo."""
Ushiromiya Battler,"""Le dichiarazioni viola qui sembrano avere molti indizi per noi."""
{f:5:Beatrice},"""Le dichiarazioni viola di George e di Maria sono particolarmente interessanti. Se solo potessimo fidarci di loro, sarebbero un indizio fondamentale..."""
Ushiromiya Battler,"""Se George-aniki è innocente, allora la sua dichiarazione viola su Maria incapace di uccidere chiunque sarebbe vera e Maria sarebbe confermata innocente. Allo stesso modo, se Maria fosse innocente, allora la sua affermazione su George incapace di uccidere un adulto sarebbe vera, e alla fine proverebbe George-aniki innocente."""
{f:5:Beatrice},"""Sarebbe così, ma non possiamo confermare nessuno di loro come innocente..."""
Ushiromiya Battler,"""Se una persona tra George-aniki e Maria può dimostrare che l'altra è innocente, sarebbe anch'essa innocente. È come il dilemma dell'uovo e della gallina. Sembra essere un indizio importante, ma non sufficiente. Piuttosto fastidioso."""
{f:5:Beatrice},"""Provare l'innocenza di uno di loro probabilmente non sarà facile. Almeno abbiamo ridotto i sospetti ad un numero esiguo. Da qui in poi, probabilmente non è rimasto niente da fare se non controllare ognuno per vedere se può essere lui il colpevole."""
Ushiromiya Battler,"""Hai ragione. Pare che siamo entrati nella fase finale!"""
{f:5:Lambdadelta},"""Insomma, sembra che ce l'abbiano quasi fatta, no...?"""
{f:5:Bernkastel},"""... Mi sento come un pesce spolpato."""
Ushiromiya Battler,"""Per prima cosa, proviamo a controllare le teoria con Maria come colpevole. Se lo fosse, allora Rosa potrebbe fingersi morta. Potrebbe aver compiuto i crimini del primo e del secondo crepuscolo. Poi, essersi chiusa nella stanza di Natsuhi oba-san e Maria compie il resto degli omicidi."""
{f:5:Beatrice},"""Era impossibile per Maria compiere uno qualsiasi dei delitti della casa degli ospiti. Quindi il massimo che poteva fare Maria era uccidere Shannon."""
Ushiromiya Battler,"""Il che significa che sarebbe necessario un terzo colpevole per gli omicidi della casa degli ospiti."""
{f:5:Beatrice},"""Il terzo potrebbe essere Eva, Hideyoshi, Rudolf o Kyrie. E questo significherebbe che avremmo bisogno anche di un quarto colpevole, giusto?"""
Ushiromiya Battler,"""... Esatto. Per fare in modo che uno di quei quattro adulti si finga morto, anche il figlio che l'ha controllato sarebbe automaticamente un colpevole. In altre parole, se Maria è una colpevole, dobbiamo avere in totale almeno quattro colpevoli."""
{f:5:Beatrice},"""Se ci sono quattro colpevoli, allora ognuno di loro deve uccidere almeno una persona."""
,Il ‘colpevole’ è un omicida.
Ushiromiya Battler,"""... In questo caso... i conti sembrano non tornare."""
{f:5:Beatrice},"""I quattro colpevoli allora sarebbero due adulti e due ragazzi. Un adulto è incaricato degli omicidi del primo e del secondo crepuscolo. L'altro adulto si occupa di quelli della casa degli ospiti in poi. Sì, si crea una contraddizione."""
Ushiromiya Battler,"""La definizione di ‘colpevole’ è ‘la persona che compie l'omicidio’. ... Questo significa che chiunque è un colpevole deve compiere un omicidio almeno una volta."""
{f:5:Beatrice},"""Per dirla semplicemente, ci sono davvero poche persone che un ragazzo colpevole può uccidere. I ragazzi non possono aver ucciso nel primo e nel secondo crepuscolo. Inoltre, non possono compiere omicidi dopo le prime morti nella casa degli ospiti. L'unico omicidio che possono commettere è quello di Shannon nel quarto crepuscolo."""
Ushiromiya Battler,"""... Un ragazzo colpevole può solo uccidere Shannon. Un secondo ragazzo colpevole non può uccidere nessuno, quindi non può essere affatto colpevole. ... Significa che ci può essere un solo ragazzo colpevole."""
{f:5:Beatrice},"""Se prendiamo Maria come colpevole, abbiamo bisogno di un altro colpevole adulto a parte Rosa. Tuttavia, è impossibile che ci sia un secondo ragazzo colpevole che menta sulla morte del suo genitore. ... In altre parole, è impossibile per Maria essere una colpevole...!"""
Ushiromiya Battler,"""Come prossima cosa, proviamo le teorie con George come colpevole. Solo un ragazzo colpevole può esistere. Quindi, se George-aniki è un colpevole, significa che Eva oba-san e Hideyoshi oji-san sono gli unici adulti che potevano fingere di essere morti."""
{f:5:Lambdadelta},"""Quindi, un gruppo di tre persone, con due adulti e un ragazzo? Capisco, sembra che ciò spieghi tutti i crimini finora, no?"""
Ushiromiya Battler,"""Ma aspetta! Anche questo in realtà è impossibile."""
{f:5:Beatrice},"""Certo. È mostrato chiaramente che George non può essere un colpevole."""
{f:5:Lambdadelta},"""*giggle*. ... Piuttosto acuto. I ragazzi possono uccidere solo Shannon nel quarto crepuscolo."""
{f:5:Beatrice},"""Una dichiarazione viola fidata ha già provato che George non avrebbe potuto essere il colpevole nell'omicidio di Shannon...!"""
Ushiromiya Battler,"""Esatto. Solo un piccolo alibi che funziona solo con l'omicidio di Shannon-chan. Questo prova che George-aniki è innocente per tutti i crimini...!"""
{f:5:Beatrice},"""Quindi, possiamo non sospettare di George...! Il che significa che tutte le sue dichiarazioni viola sono affidabili...!"""
{f:5:Beatrice},"""Una volta che siamo sicuri che George è innocente, rende automaticamente innocente anche Maria."""
Ushiromiya Battler,"""Già. Conferma la dichiarazione viola di George-aniki che dice ‘Maria non può uccidere nessuno’. Dato che non può uccidere nessuno, non può essere una colpevole. Quindi, anche Maria è confermata innocente."""
{f:5:Beatrice},"""Dato che George e Maria sono innocenti, ciò prova anche che i loro controlli della morte dei loro genitori sono affidabili."""
Ushiromiya Battler,"""Esatto. Nessuno sbaglierebbe nel confermare una morte, e le persone che non sono colpevoli non mentono. Quindi, le morti dei loro genitori sono state confermate e quei genitori sono anche loro innocenti."""
{f:5:Beatrice},"""Ci siamo occupati praticamente di tutti... ... La risposta è già chiara, non è vero...?"""
Ushiromiya Battler,"""Prima di tutto, ci sono colpevoli multipli. Questo è confermato. Questi delitti sarebbero impossibili per una sola persona."""
{f:5:Beatrice},"""Per iniziare, uno dei colpevoli adulti ha compiuto il primo crepuscolo, poi si è finto morto."""
Ushiromiya Battler,"""Dato che sappiamo che tutti i domestici con i passepartout sono innocenti, non c'è modo per il colpevole di chiudere le porte della sala da pranzo dall'esterno. Quindi, sappiamo che quello che l'ha chiusa l'ha fatto dall'interno della stanza."""
{f:5:Beatrice},"""E, per fingersi morto, aveva bisogno di un altro colpevole che mentiva quando controllava la sua morte."""
Ushiromiya Battler,"""Dato che Genji-san è innocente, il controllo di tutte e cinque le vittime sospette è stato fatto dai propri figli. Quindi, il figlio del primo colpevole è il secondo colpevole."""
{f:5:Beatrice},"""Inoltre, il ragazzo colpevole non poteva compiere i delitti una volta che iniziavano a succedere nella casa degli ospiti. Tuttavia, il colpevole adulto era chiuso nella stanza di Natsuhi. Quindi, c'è bisogno di un secondo colpevole adulto."""
Ushiromiya Battler,"""Due adulti, un ragazzo. È così che dev'essere il nostro gruppo dei colpevoli."""
{f:5:Beatrice},"""Ora dovrebbe essere ovvio. Il nome del ragazzo colpevole in questo gruppo di colpevoli è chiaro."""
Ushiromiya Battler,"""Già. Tutti i ragazzi sono stati provati innocenti, con un'eccezione."""
{f:5:Beatrice},"""E la sola ispezione del cadavere su cui un ragazzo colpevole può mentire è quella dei genitori di quel ragazzo. Quindi, il gruppo dei colpevoli era una famiglia di due adulti e un ragazzo."""
Ushiromiya Battler,"""Omicidio con la famiglia. Che cosa dolce."""
{f:5:Beatrice},"""Quindi, chi sono i tre colpevoli? Non c'è davvero bisogno di prolungare questa faccenda ulteriormente, non è vero?"""
Ushiromiya Battler,"""Aw, ma dai. Che risposta incasinata. Sembra che sia io il ragazzo colpevole."""
{f:5:Beatrice},"""Hmph. Persino nei miei giochi, le teorie di Battler colpevole erano tra le più popolari, non è vero?"""
Ushiromiya Battler,"""Così sembra. Cielo, perché tutti pensano che l'abbia fatto io...?!"""
{f:5:Beatrice},"""Se tu sei un colpevole, allora ciò automaticamente colpevoli anche i tuoi genitori. Non c'è più bisogno di preoccuparsi. Abbiamo già vinto."""
Ushiromiya Battler,"""Non c'è bisogno di ulteriori discussioni o indizi. Proseguiamo con la risposta...!"""
{f:5:Lambdadelta},"""È finita?"""
{f:5:Bernkastel},"""... Ben fatto. ... Sembra che un giallo di questo livello non fosse sufficiente a battere questi due, dopotutto."""
